created,id_str,text,user_id,screen_name,location,followers_count,user_favourites_count,time_zone,geo_enabled,verified,status_count,geo,coords,retweet_count,tweet_favourite_count,Subjectivity,Polarity,Sentiment
2021-03-12 01:28:58,1370185011886911491,"POTUS: One in four adults in the U.S. has received their first COVID-19 vaccine — and we’re now leading the world in vaccinations.

Tha…",435136773,Vorrviss,,30,8698,,True,False,9077,,,15422,0,0.3333333333333333,0.25,positive
2021-03-12 01:28:58,1370185011694080001,OklahomaCovid Good grief. I'm in state for two weeks to care for an elderly relative. My second Moderna shot comes on 3-29. What timing. ☹️,71044863,LarryGolfnut512,US,1401,16859,,False,False,8229,,,0,1,0.2,-0.025000000000000022,negative
2021-03-12 01:28:57,1370185010423152647,"kayleighmcenany: FINALLY the Biden admin recognizes the Trump admin’s unprecedented vaccine work:

➡️ “We’re grateful for the work that…",1368277096074797056,windchase6,,1,210,,False,False,428,,,4225,0,0.95,0.3,positive
2021-03-12 01:28:57,1370185008225341440,"kayleighmcenany: FINALLY the Biden admin recognizes the Trump admin’s unprecedented vaccine work:

➡️ “We’re grateful for the work that…",716762814,lm_vance,,137,27694,,True,False,4896,,,4225,0,0.95,0.3,positive
2021-03-12 01:28:57,1370185008040669184,"CNN: “All adult Americans will be eligible to get a vaccine no later than May 1,"" President Biden announces. ""...That doesn't mean ever…",27818124,yayayarndiva,"Sonoma County, California",13054,602284,,True,False,556667,,,256,0,0.32916666666666666,-0.07083333333333333,negative
2021-03-12 01:28:57,1370185007705296896,"Speak4Tomorrow: ColinDMello First Nations peoples are in phase 1. solmamakwa  was eligible to get the vaccine, regardless of where he…",3246390180,hs88_hs88,A safe distance from you,1060,204006,,False,False,168302,,,1,0,0.3333333333333333,0.25,positive
2021-03-12 01:28:57,1370185007277412354,"WHCOVIDResponse: By May 1st, every adult in this country will be eligible for a COVID-19 vaccine but we all have to do our part: Get yo…",73118798,padrealex,,941,21284,,False,False,69919,,,903,0,0.3,0.1,positive
2021-03-12 01:28:56,1370185006090391553,"zerohedge: 7 European Nations Halt AstraZeneca Jabs On Reports Of ""Serious"" Blood Clots ",1325121565193768962,EngfDZMJi0UW6f6,,224,18733,,False,False,16401,,,245,0,0.3333333333333333,-0.16666666666666666,negative
2021-03-12 01:28:56,1370185005239042052,"Biden spent little time of this speech touting his Covid bill, which he signed today. Most of the speech was focused on what's next, and outlined top goals: Everyone eligible for vaccine by May 1, website to help with access, re-open k-8, guidance on what vaccinated people can do",153181367,CHueyBurns,,37113,2297,,True,True,19497,,,2,21,0.32,0.14250000000000002,positive
2021-03-12 01:28:56,1370185003670384643,"Mr. President talks about the truth. Presidential address.   He is lying to you. He’s claiming success for the vaccine, that Donald Trump got to market faster than any other vaccine in history. Dr. Anthony Fauci talks about Covid-19  via YouTube",2781851163,212345734a37435,"Atlanta Georgia, USA",21,1134,,False,False,3717,,,0,0,0.1875,0.0875,positive
2021-03-12 01:28:56,1370185003427102723,"WUSTLmed: As Tyrone Simpkins and Hilary Babcock, MD, deal with the long-term effects of COVID on their health, they are also grieving…",763866958722805761,MFamilyMom,,172,5541,,True,False,1114,,,30,0,0.0,0.0,neutral
2021-03-12 01:28:56,1370185002965626885,BNN_Breaking: BreakingNews : 🔔🚨Denmark suspends use of AstraZeneca COVID vaccine ,1193626844483862528,Red4ProLife,United States,4784,31726,,False,False,41472,,,6,0,0.0,0.0,neutral
2021-03-12 01:28:55,1370185001602547714,Chellaney: More negative publicity for AstraZeneca: Several European nations suspend AstraZeneca vaccinations over blood clot fears. Bu…,4109998360,RawnaRafaz,"Karachi, Pakistan",12,144,,False,False,827,,,165,0,0.225,0.05,positive
2021-03-12 01:28:55,1370185001313177602,"CNN: “All adult Americans will be eligible to get a vaccine no later than May 1,"" President Biden announces. ""...That doesn't mean ever…",809890740,Bramsho,Washington DC,384,1366,,False,False,598,,,256,0,0.32916666666666666,-0.07083333333333333,negative
2021-03-12 01:28:55,1370185000142974978,"ABC: Pfizer's vaccine is successful in preventing not only symptomatic COVID-19, but also asymptomatic disease according to new real-wo…",1686978289,Earthangelfl,"Hamtramck, MI",2083,81024,,False,False,83087,,,386,0,0.8015151515151514,0.29545454545454547,positive
2021-03-12 01:28:55,1370184998649655309,"m_scribe: Breaking: Novavax announces efficacy results in its vaccine trials.

* 100% protection against severe disease
* 96% effective…",1447469275,MADdelaRosa,"San Francisco, CA",835,283056,,True,False,87109,,,446,0,0.0,0.0,neutral
2021-03-12 01:28:54,1370184995810250758,"CNN: “All adult Americans will be eligible to get a vaccine no later than May 1,"" President Biden announces. ""...That doesn't mean ever…",1173113467,_chris_ryan,"Cape May County, NJ",101,1376,,True,False,274,,,256,0,0.32916666666666666,-0.07083333333333333,negative
2021-03-12 01:28:54,1370184995604627457,"PNHPNYMetro: We join with healthcare workers, patients &amp; advocates today to demand that pfizer FreeTheVaccine. 

Board member Dr. Roo…",25393191,dgendvil,"Las Vegas, NV",3677,90569,,True,False,856688,,,18,0,0.0,0.0,neutral
2021-03-12 01:28:54,1370184995420000258,"roccogalatilaw: Denmark. another country, like Austria, to suspend  Astra-Zeneca vaccine due to ""blood-clotting"" which  led to deaths a…",1345187503536439297,LeftCivil,Vancouver,17,414,,False,False,123,,,1332,0,0.375,-0.125,negative
2021-03-12 01:28:54,1370184995311120384,"mcdowellformo: What I heard - All adult Americans are ordered to get the COVID vaccine starting May 1. 

Nope! 

bidenspeech
Bidenisn…",1346303053373308930,Presson3Don,I Don't Follow Locked Accounts,4955,6113,,False,False,12619,,,2,0,0.2,0.05,positive
2021-03-12 01:28:54,1370184994317025281,jsolomonReports: Trump: U.S. ‘probably’ would’ve never had COVID-19 vaccine without him | Just The News ,861307069898665988,katscan27_kim,Texas,6756,109190,,False,False,122096,,,262,0,0.0,0.0,neutral
2021-03-12 01:28:54,1370184993977200643,PhilippineStar: READ: The Department of Health and Food and Drug Administration said there is no reason to stop the AstraZeneca COVID-1…,78956685,danabatnag,Manila,2419,23759,,False,False,48055,,,3,0,0.0,0.0,neutral
2021-03-12 01:28:53,1370184993805365251,danieteebee: It’s completely predictably American that the brand of COVID vaccine you have access to has now become a class signifier,1000893372599500805,jooorddannn,"Greensboro, NC",448,114358,,True,False,10615,,,10178,0,0.0,0.0,neutral
2021-03-12 01:28:53,1370184992811257858,"MichelleObama: When you can get the COVID-19 vaccine, I hope you do—Barack and I are certainly glad we did. It’s our best shot at beati…",810449076,Calpe19,,367,117769,,False,False,99469,,,7525,0,0.65,0.75,positive
2021-03-12 01:28:53,1370184992458903553,Moderna And Pfizer On Track To Hit Vaccine Production Goals ,14150186,Chelleld16,,647,236585,,False,False,188891,,,0,0,0.0,0.0,neutral
2021-03-12 01:28:53,1370184992068866049,"HamillHimself: Statement by the Twice Impeached Former Guy

I hope everyone remembers when they're getting the COVID-19 (often referred…",822621565942632449,JohannaBizub,,115,142096,,False,False,104369,,,872,0,0.0,0.0,neutral
2021-03-12 01:28:53,1370184991829811200,"AmyKremer If it weren't for Trump 500,000 Americans might be alive today. I so wish you could understand his failures with this pandemic. Pfizer took no $ from Trump, because they didn't want him to force them to make short-cuts. They got it done without him. J &amp; J got it done without him.",2777425891,kotstot1,,250,55458,,False,False,6242,,,0,1,0.4,0.1,positive
2021-03-12 01:28:53,1370184991179673603,sunlorrie: Denmark suspends use of AstraZeneca Covid vaccine ,1109135729224048641,MakelaGerry,Ontario Canada,317,12396,,False,False,7949,,,117,0,0.0,0.0,neutral
2021-03-12 01:28:53,1370184991024513026,"kayleighmcenany: FINALLY the Biden admin recognizes the Trump admin’s unprecedented vaccine work:

➡️ “We’re grateful for the work that…",1356690781935927296,JB13399986,,0,40,,False,False,96,,,4225,0,0.95,0.3,positive
2021-03-12 01:28:53,1370184991020183555,"ClarkCountyNV: Workers who fall under the expanded eligibility can schedule appointments online here: 

Proof o…",33359627,_ChefTia_,"Seattle, WA",322,24408,,True,False,31479,,,11,0,0.0,0.0,neutral
2021-03-12 01:28:53,1370184990718238723,"michaelmalice: FREE OF CHARGE

""I dont feel comfortable taking the COVID vaccine until all the people in need get theirs first.""",754145743640727552,Waylon1995,,10,1791,,False,False,1479,,,110,0,0.6444444444444445,0.35000000000000003,positive
2021-03-12 01:28:53,1370184989950742529,"CNN: “All adult Americans will be eligible to get a vaccine no later than May 1,"" President Biden announces. ""...That doesn't mean ever…",1246483235883843587,monicaflavieli1,,8,1182,,True,False,118,,,256,0,0.32916666666666666,-0.07083333333333333,negative
2021-03-12 01:28:52,1370184988944175105,NRMorrow: just heard “yes gurl I got miss moderna!!” yelled from the Number Nine patio; nature is truly healing,1732818648,msbston,,116,128514,,False,False,93531,,,72,0,0.0,0.0,neutral
2021-03-12 01:28:52,1370184988705091590,"MichelleObama: When you can get the COVID-19 vaccine, I hope you do—Barack and I are certainly glad we did. It’s our best shot at beati…",1499516426,PattieWalters1,,148,16433,,False,False,8906,,,7525,0,0.65,0.75,positive
2021-03-12 01:28:52,1370184987467771904,"DOHgovph: Dr. Hao emphasized that given the limited vaccine supply and the risk of mutations due to continued transmission, the public’…",1365229531552866304,Wali_Usman13,,4,318,,False,False,189,,,26,0,0.19484126984126982,-0.06547619047619048,negative
2021-03-12 01:28:52,1370184987090227205,"BNODesk: All adults in the U.S. should be eligible for a COVID-19 vaccine no later than May 1, Biden says",1019961303866269696,thezacc18,,268,98394,,False,False,90731,,,71,0,0.0,0.0,neutral
2021-03-12 01:28:51,1370184984078675974,"maxwell18191708: But here, full speed ahead suckers

Denmark, Estonia, Lithuania, Luxembourg, Latvia suspend AstraZeneca Covid vaccine…",795650829285896192,Jassy_Mom,,1015,100134,,False,False,95035,,,3,0,0.675,0.024999999999999994,positive
2021-03-12 01:28:51,1370184983697055745,GabbyDarko: Covid: France approves AstraZeneca vaccine for over-65s - BBC News ,1172386045339394049,OpokuNanaYaw2,"New York, USA",855,182697,,False,False,20722,,,9,0,0.0,0.0,neutral
2021-03-12 01:28:50,1370184981193064452,pareene I’m going to need to perform a root canal to put the vaccine directly into your jaw &amp; then you’re going to need a crown. Can’t schedule the appointment til your insurance turns us down &amp; you have to decide whether to pay or just have me extract the tooth &amp; then you die of covid.,427076939,jaime_x2,,14,1572,,False,False,963,,,0,1,0.34444444444444444,-0.02777777777777779,negative
2021-03-12 01:28:50,1370184981125894145,davematt88: I talked to somebody in law enforcement today. They told me that they didn't believe that covid-19 was deadly. That it was…,20695280,marvswife,,20149,144100,,True,False,264518,,,113,0,0.4,-0.2,negative
2021-03-12 01:28:50,1370184979922132994,"CNN: “All adult Americans will be eligible to get a vaccine no later than May 1,"" President Biden announces. ""...That doesn't mean ever…",1343312620074328065,PNWGOLFER1,,8,3223,,False,False,1285,,,256,0,0.32916666666666666,-0.07083333333333333,negative
2021-03-12 01:28:50,1370184979666325505,timdragga I got Moderna and now get daily affirmations from Dolly.,995710657545887744,ebrtennisfan,"Greensboro, NC",92,42515,,False,False,6866,,,0,3,0.0,0.0,neutral
2021-03-12 01:28:50,1370184979473371139,"POTUS: One in four adults in the U.S. has received their first COVID-19 vaccine — and we’re now leading the world in vaccinations.

Tha…",1534463088,G1EAS,"Virgin Islands, USA",480,4558,,True,False,4840,,,15422,0,0.3333333333333333,0.25,positive
2021-03-12 01:28:50,1370184979133652996,"CBSNews: BREAKING: President Biden announces he is directing all states, tribes and territories to make all U.S. adults 18 and older el…",1836316272,DontMakeMeGoOff,,94,571,,False,False,1649,,,242,0,0.3333333333333333,0.16666666666666666,positive
2021-03-12 01:28:50,1370184978940657664,"LionInWinter44: Numerous reports of blood clots in Denmark, including a fatal case. Multiple European countries have suspended the Oxfo…",785532642485690369,Jblackg2017,USA,1108,2706,,False,False,3087,,,38,0,0.16666666666666666,0.0,neutral
2021-03-12 01:28:50,1370184978542309384,"PISDI94_96: Like and if you agree they can shove their COVID vaccine up their stinking ass!

NOT GETTING IT AND JOE BIDEN IS A PIECE…",2219968331,DonnaDeLong3,,19,1216,,False,False,434,,,90,0,0.0,0.0,neutral
2021-03-12 01:28:50,1370184977967685632,"chicagotribune: Thousands of seniors in Chicago public housing get their first dose of COVID-19 vaccine: ""I can’t wait to see my family…",22182294,MatrikaBT,The District,992,66992,,True,False,52022,,,6,0,0.19999999999999998,0.125,positive
2021-03-12 01:28:50,1370184977376157698,"CNN: “All adult Americans will be eligible to get a vaccine no later than May 1,"" President Biden announces. ""...That doesn't mean ever…",939041384,HumblePips,,256,567,,False,False,52876,,,256,0,0.32916666666666666,-0.07083333333333333,negative
2021-03-12 01:28:50,1370184977141411840,verge: Biden: ‘all American adults will be eligible to get a vaccine no later than May 1st’  ,17637630,AquariusRZN,"Meridian, MS",130,15882,,False,False,10710,,,31,0,0.0,0.0,neutral
2021-03-12 01:28:50,1370184977141358592,"joe_warmington: Denmark, Norway and Iceland suspend AstraZeneca COVID shots after blood clot reports | Article [AMP] | Reuters ",912583795,sustain05,,3407,418905,,False,False,580412,,,225,0,0.0,0.0,neutral
2021-03-12 01:28:49,1370184975971201024,"EricBoehlert: i found the dumbest sentence of the week: 

&lt;Despite calls for national unity and bipartisanship, President Joe Biden and…",908256402539511808,payattention747,,19,5099,,False,False,10776,,,520,0,0.0,0.0,neutral
2021-03-12 01:28:49,1370184975216091136,"CBSNews: WATCH LIVE: President Biden delivers a primetime address marking the one-year anniversary of the COVID-19 pandemic, in which h…",833466906388549632,BlackWomanDr,"California, USA",180,2167,,True,False,1884,,,86,0,0.5,0.13636363636363635,positive
2021-03-12 01:28:49,1370184973089710081,"globalnews | Over 325 pharmacies will begin giving the   AstraZeneca vaccine. This should help speed up vaccine distribution. With the three available vaccines in Canada, Canada can expect to receive up to 8 million vaccines by the end of March.
",1352024228787331078,meghandmjnews,,4,2,,False,False,13,,,0,0,0.4,0.4,positive
2021-03-12 01:28:48,1370184971994943489,NBCNews: BREAKING: President Biden is expected to call for all U.S. adults to be eligible to receive the vaccine no later than May 1; w…,877981814,CindyAlaKing,,4,1698,,True,False,1386,,,258,0,0.2,-0.05,negative
2021-03-12 01:28:48,1370184971923685378,BreakingNews: President Biden is expected to call for all U.S. adults to be eligible to receive the vaccine no later than May 1; will a…,979436126,APGovJacobsen,NYC,932,3446,,True,False,31857,,,85,0,0.2,-0.05,negative
2021-03-12 01:28:48,1370184971797860359,10TV: Biden sets May 1 target to have all adults vaccine-eligible ,3068725767,MikeMikegriff47,Northside Atlanta ,246,37106,,True,False,30857,,,8,0,0.0,0.0,neutral
2021-03-12 01:28:48,1370184969289674756,"CNN: “All adult Americans will be eligible to get a vaccine no later than May 1,"" President Biden announces. ""...That doesn't mean ever…",66989645,uncensoredIII,,12445,6794,,True,False,391689,,,256,0,0.32916666666666666,-0.07083333333333333,negative
2021-03-12 01:28:48,1370184968840871939,"CBSNews: BREAKING: President Biden announces he is directing all states, tribes and territories to make all U.S. adults 18 and older el…",719125172,mrsk23_mm,,151,53163,,True,False,46089,,,242,0,0.3333333333333333,0.16666666666666666,positive
2021-03-12 01:28:47,1370184968173936641,"President Joe Biden touted the partnership of J&amp;J and Merck
  — which has a deep presence in Bucks and Montgomery counties — in manufacturing COVID vaccine. Here is our interview with J&amp;J CEO Alex Gorsky before the effort was announced ",65243567,TheIntellNews,"Doylestown, Bucks County, PA",20576,40,,True,True,90907,,,1,0,0.4,0.0,neutral
2021-03-12 01:28:47,1370184966223626240,"CBSEveningNews: BREAKING: Pres. Biden is directing all states, tribes and territories to make all U.S. adults aged 18 and older eligibl…",471293932,joelynbeach,"Lawrenceburg, In",108,7974,,False,False,9970,,,21,0,0.3666666666666667,0.033333333333333326,positive
2021-03-12 01:28:47,1370184965833494530,MarshaBlackburn Thanks for what? Germany funded Pfizer that discovered the first vaccine.. and then lied about how much we had. Thanks POTUS for getting vaccines for all Americans!!,716469240698568704,Jx3MAMA85,"Munford, TN",86,3225,,False,False,1842,,,0,7,0.23333333333333334,0.240625,positive
2021-03-12 01:28:47,1370184965682384904,"joe_warmington: Denmark, Norway and Iceland suspend AstraZeneca COVID shots after blood clot reports | Article [AMP] | Reuters ",48376603,think_labs,"Abbotsford, BC, Canada",102,590,,True,False,926,,,225,0,0.0,0.0,neutral
2021-03-12 01:28:46,1370184964432556032,"Dharma2X: Dr. Swamy39 jee :

The rollout of the Astra-Zeneca Covid-19 vaccine in Denmark, Estonia, Lithuania, Luxemburg and Latvia has…",1315217759731544064,lalitha553322,,518,22761,,False,False,44083,,,28,0,0.0,0.0,neutral
2021-03-12 01:28:46,1370184962587123718,EMaxfieldMoen Finally have an appointment for the Pfizer vax tomorrow!+,1215007365893885952,Dianeofanxiety,,133,2526,,False,False,2155,,,0,1,1.0,0.0,neutral
2021-03-12 01:28:46,1370184962331324417,"DearAuntCrabby: Trump is a sad and pathetic little man who is desperately trying to claim some sort of credit for the Covid vaccine.

W…",2796475822,downey1950_w,"New York, USA",3098,238289,,False,False,224257,,,118,0,0.875,-0.571875,negative
2021-03-12 01:28:46,1370184962050297862,"WHCOVIDResponse: By May 1st, every adult in this country will be eligible for a COVID-19 vaccine but we all have to do our part: Get yo…",34426544,AstridBidanec,"Tampa, FL",1527,34379,,True,False,57227,,,903,0,0.3,0.1,positive
2021-03-12 01:28:45,1370184958761914375,"BNODesk: All adults in the U.S. should be eligible for a COVID-19 vaccine no later than May 1, Biden says",414872798,HuricaneHorvitz,,522,114771,,False,False,32689,,,71,0,0.0,0.0,neutral
2021-03-12 01:28:45,1370184958413799427,"aUSAPatriot1: President Trump is the person who created Warp Speed and made the COVID-19 vaccine available...!!!

Joe Biden had absolut…",1388145188,SFLAMo,"Boynton Beach, FL",696,38132,,True,False,26154,,,1,0,0.4,0.78125,positive
2021-03-12 01:28:45,1370184957562339329,"CNNPolitics: “All adult Americans will be eligible to get a vaccine no later than May 1,"" President Biden announces. ""That doesn't mean…",1230186836863180800,GSSohal2020,,383,30370,,False,False,30540,,,146,0,0.15,0.05,positive
2021-03-12 01:28:45,1370184957478510592,jsolomonReports: Breaking: Biden to instruct states to make all adults to be eligible for COVID vaccine no later than May 1 | Just The…,134989855,SRGnationwide,USA,12338,131462,,True,False,148978,,,39,0,0.0,0.0,neutral
2021-03-12 01:28:44,1370184954580135937,samjawed65: India Today confuses vaccine procurement price with the price which is being charged to citizens and falsely claims that In…,845247311706030080,NisarMohammed09,"Hyderabad, India",419,5502,,False,False,2126,,,197,0,0.6,-0.4000000000000001,negative
2021-03-12 01:28:44,1370184954148122626,"carlquintanilla: “The U.S. has 4% of the world's population, 20% of all recorded COVID-19 deaths, and 29% of all vaccine doses administ…",208868413,CHANCELL0R,"San Diego, CA",155,5963,,True,False,16249,,,20,0,0.0,0.0,neutral
2021-03-12 01:28:44,1370184952382390276,Wow!! The Pfizer Vaxx Has The Same Ingredient Used In Executions! Manulife Insurance Co. Not Paying Out For Anyone Taking The Experimental Covid Vaxx Shot! Toronto’s Top Doctor Provides No Data To Justify Lockdown. Follow The Money $$!! ,1245753372080308226,370651856Z,,1799,16247,,False,False,23120,,,0,0,0.50625,0.265625,positive
2021-03-12 01:28:43,1370184951518363651,"CNNPolitics: “All adult Americans will be eligible to get a vaccine no later than May 1,"" President Biden announces. ""That doesn't mean…",1362219081047412738,PedroMendezK,,18,2069,,False,False,2073,,,146,0,0.15,0.05,positive
2021-03-12 01:28:43,1370184951455358984,"chicagotribune: Thousands of seniors in Chicago public housing get their first dose of COVID-19 vaccine: ""I can’t wait to see my family…",2614703132,charheb11,,143,5671,,False,False,65028,,,6,0,0.19999999999999998,0.125,positive
2021-03-12 01:28:43,1370184951442804738,Watch live: Biden directs states to make all adults eligible for COVID vaccine by May 1 - CBS News 🙌 ,1292516446946226176,Carbella2929,,30,1124,,True,False,617,,,0,1,0.5,0.13636363636363635,positive
2021-03-12 01:28:43,1370184951132479491,"Pretty surreal that an entire year has come and gone since COVID changed the world. Grateful that we have a President who makes sense, takes action, and sets realistic expectations. If you're eligible for the vaccine, don't wait. If you aren't, try this:  ",55922926,KultureKameleon,"New York, NY",229,280,,False,False,873,,,0,0,0.6116666666666667,0.15333333333333332,positive
2021-03-12 01:28:43,1370184950998130688,KhushnumaKashm1: LG manojsinha_  takes the first dose of COVID-19 and we all are moving ahead to fight this pandemic. Kashmir is grow…,1368552219465814020,abhishe32597637,,1,187,,False,False,184,,,507,0,0.3333333333333333,0.25,positive
2021-03-12 01:28:43,1370184950037684225,"MackayIM: Denmark, Norway and Iceland suspend AstraZeneca COVID shots after blood clot reports
",3368690836,GrassrootsJill,"Arizona, USA",12154,150714,,False,False,204758,,,54,0,0.0,0.0,neutral
2021-03-12 01:28:43,1370184949794537473,"Lie, lie,, lie Trump said it was a Hoax, Fake News, it will go away...

Trump says US ‘probably’ would never have COVID-19 vaccine if he wasn’t president ",276266427,PoliticalSense1,United States,5183,8990,,True,False,73337,,,0,1,1.0,-0.5,negative
2021-03-12 01:28:43,1370184949295415298,"cnni: “All adult Americans will be eligible to get a vaccine no later than May 1,"" US President Biden announces. ""...That doesn't mean…",65745822,orahs,Jamaica,732,119043,,True,False,17590,,,78,0,0.15,0.05,positive
2021-03-12 01:28:43,1370184948951437318,"colonelcrystal1: Twitter On December 23, 2020 President Trump purchased additional 100 MILLION doses of vaccine from Pfizer, before le…",1129561938067906560,WilliamBTravi12,"Arlington, Virginia",2,562,,False,False,1603,,,2,0,0.0,0.0,neutral
2021-03-12 01:28:43,1370184948364230663,"NPR: Pfizer and Moderna agreed to supply 100 million doses a piece to the U.S. by the end of March. With just under three weeks left, b…",3690900377,GotiL_Hankerson,Wonderland,264,10542,,False,False,12034,,,170,0,0.0,0.0,neutral
2021-03-12 01:28:42,1370184945684119552,"EricBoehlert: i found the dumbest sentence of the week: 

&lt;Despite calls for national unity and bipartisanship, President Joe Biden and…",164694014,RealFriscoKid,,941,191844,,False,False,186350,,,520,0,0.0,0.0,neutral
2021-03-12 01:28:42,1370184944593596420,ZemanLynnZ: Biden to ask states to make all adults eligible for COVID vaccine by May 1  ,2418046156,ReadingJudith,"Bristol, RI",1099,60828,,True,False,71149,,,1,0,0.0,0.0,neutral
2021-03-12 01:28:42,1370184943855411201,"JosephEllis408: Summer 2021:

“YO SO DID YOU GET PFIZER OR MODERNA?” ",470288830,LeonardoDiaz59,Guatemala,65,193,,False,False,5903,,,46298,0,0.0,0.0,neutral
2021-03-12 01:28:42,1370184943544930304,"AmyKremer That is a ridiculous statement. She’s saying that companies like Johnson &amp; Johnson, Pfizer, etc. would have just stood by &amp; let a huge revenue opportunity just pass them by. 

Companies would have produced vaccines even if I were President. 

Idiotic. Never listen to this person.",1238193642960900097,AllenMcLeod77,"San Diego, CA",328,57695,,False,False,12222,,,0,1,0.9111111111111111,-0.19999999999999996,negative
2021-03-12 01:28:41,1370184943146524675,"CBSEveningNews: BREAKING: Pres. Biden is directing all states, tribes and territories to make all U.S. adults aged 18 and older eligibl…",122396513,petermaer,"Washington, DC",14165,2022,,True,True,32143,,,21,0,0.3666666666666667,0.033333333333333326,positive
2021-03-12 01:28:41,1370184942936846336,newsmax: Trump hopes everyone remembers him when they get their vaccine  ,832565973785800704,PattiLy79084071,,180,80590,,False,False,68230,,,402,0,0.0,0.0,neutral
2021-03-12 01:28:41,1370184942899097603,"CBSNews: BREAKING: President Biden announces he is directing all states, tribes and territories to make all U.S. adults 18 and older el…",230832125,ebscbwi,"eileenlovercheck,webster, tx",717,2814,,True,False,330585,,,242,0,0.3333333333333333,0.16666666666666666,positive
2021-03-12 01:28:41,1370184942408318979,danieteebee: It’s completely predictably American that the brand of COVID vaccine you have access to has now become a class signifier,1050558546109190144,kurry_07,she/her,24,123149,,False,False,21595,,,10178,0,0.0,0.0,neutral
