created,id_str,text,user_id,screen_name,location,followers_count,user_favourites_count,time_zone,geo_enabled,verified,status_count,geo,coords,retweet_count,tweet_favourite_count,Subjectivity,Polarity,Sentiment
2021-03-12 01:27:33,1370184654515548165,"KatyTurNBC: One year of COVID. 
Seven months pregnant. 
First shot of Pfizer.",763992516,MayaTPrabhu,"Atlanta, GA",6522,2923,,True,True,52021,,,330,0,0.41666666666666663,0.29166666666666663,positive
2021-03-12 01:27:31,1370184649037733889,"cnni: “All adult Americans will be eligible to get a vaccine no later than May 1,"" US President Biden announces. ""...That doesn't mean…",282680151,JanaLana_,Jamaica,243,7042,,True,False,34088,,,78,0,0.15,0.05,positive
2021-03-12 01:27:31,1370184648303677442,"EthelMercaptan: AmyKremer If it weren't for President Donald J Trump, we'd have more people vaccinated by now. ",50775018,LyoPaHazMat,,451,86372,,False,False,73322,,,2,0,0.5,0.5,positive
2021-03-12 01:27:31,1370184647318061057,"joe_warmington: Denmark, Norway and Iceland suspend AstraZeneca COVID shots after blood clot reports | Article [AMP] | Reuters ",20878297,ezralevant,Canada and the world,244163,17,,True,True,165883,,,225,0,0.0,0.0,neutral
2021-03-12 01:27:31,1370184646231752711,"CBSNews: BREAKING: President Biden announces he is directing all states, tribes and territories to make all U.S. adults 18 and older el…",18821004,SEL21,"River Edge, NJ",11,64,,False,False,188,,,242,0,0.3333333333333333,0.16666666666666666,positive
2021-03-12 01:27:30,1370184645401251844,"naomirwolf: Ok: Switzerland, Italy, Austria, Latvia, Lithuania, Estonia, Luxembourg, Iceland, South Africa, Norway, Denmark have all su…",994363040203202565,Ak83578774,,473,33197,,False,False,10291,,,779,0,0.5,0.5,positive
2021-03-12 01:27:30,1370184645279588352,"noahweiland: Scoop: The U.S. is sitting on tens of millions of doses of the AstraZeneca vaccine in Maryland and Ohio facilities, and of…",861229163729965056,robert_kroupa,,372,39407,,True,False,69686,,,367,0,0.0,0.0,neutral
2021-03-12 01:27:30,1370184645082423299,"kaylatausche: 14/ In one year:
- 10 million net jobs have been lost.
- 29 million Americans have contracted COVID-19
- 530,000 have die…",1243217399467233283,dbluewave20,,804,189296,,False,False,164800,,,91,0,0.0,0.0,neutral
2021-03-12 01:27:30,1370184644143022083,"renegadecut: the right has pivoted from ""covid is a hoax"" to ""covid is real but no big deal"" to ""covid vaccine isn't safe"" to ""covid va…",47159045,Dante_The_K9,"Lakeland, FL",1199,186110,,True,False,57564,,,41,0,0.35892857142857143,0.24642857142857144,positive
2021-03-12 01:27:30,1370184644092628992,"OD_ant: If you die from Covid, but had a comorbidity...you MOST definitely died from Covid.

BUT- if you die from a VACCINE and have a…",1290672853709447170,WarsJamie,,82,12576,,False,False,2220,,,149,0,0.5,0.25,positive
2021-03-12 01:27:30,1370184643971063808,CBSNews: President Biden is expected to announce Wednesday afternoon that the federal government is purchasing 100 million more doses o…,466690752,Mediatingmimi,"Johnson City, TN",1039,4064,,True,False,17091,,,776,0,0.45,0.2,positive
2021-03-12 01:27:29,1370184638786719744,"koreatimescokr: Denmark, Norway and Iceland suspend AstraZeneca COVID shots after blood clot reports ",3099044221,CYNTHIA43376979,"Coquitlam, British Columbia",695,26896,,False,False,3478,,,3,0,0.0,0.0,neutral
2021-03-12 01:27:29,1370184637465518082,21WIRE: SHARE: 'A group of scientists and doctors have issued an open letter calling on the European Medicines Agency (EMA) to answer u…,25089397,rickricardobr,,288,3716,,False,False,10226,,,139,0,0.25,0.0,neutral
2021-03-12 01:27:28,1370184636257595393,"DOHgovph: Can you get the COVID-19 vaccine if you are breastfeeding, pregnant, or planning to get pregnant? Do you need a pregnancy tes…",1365229531552866304,Wali_Usman13,,4,318,,False,False,189,,,27,0,0.5,0.3333333333333333,positive
2021-03-12 01:27:28,1370184634689064961,"gregkellyusa Yeah. No. Pfizer started working on a vaccine December, 2020.

Pfizer REFUSED any assistance from the Administration because they didn't want the other guy to politicize the vaccine.

What did the other guy do? Politicized the vaccine.",488924333,Liberal_Lady5,New York,1180,13725,,False,False,50857,,,0,0,0.375,-0.125,negative
2021-03-12 01:27:28,1370184634676387841,"NEWS1130: If someone calls you, claiming you’re next in line for the COVID-19 vaccine — do not give them any personal information.

Wes…",313074541,jeffanthony70,"Richmond, BC",206,16958,,True,False,2614,,,23,0,0.15,0.0,neutral
2021-03-12 01:27:28,1370184634303188996,"21WIRE: New VaccinePassport is not based on science or any clinical evidence. It is 100% about social control, tracking and medical co…",137388186,apegglivecouk,,57,1354,,False,False,1610,,,2063,0,0.17373737373737375,0.05656565656565656,positive
2021-03-12 01:27:28,1370184634085081094,UrugwiroVillage: VIDEO: President Kagame and First Lady Jeannette Kagame receive their Covid-19 Vaccine. VaccinesSaveLives  InkingoNi…,966307753441546240,MichaelMugisha6,,41,1281,,True,False,214,,,246,0,0.3333333333333333,0.25,positive
2021-03-12 01:27:27,1370184632411504643,"CNN: “All adult Americans will be eligible to get a vaccine no later than May 1,"" President Biden announces. ""...That doesn't mean ever…",82605645,ikateufel,"Goiânia, Brazil",389,6,,False,False,476882,,,256,0,0.32916666666666666,-0.07083333333333333,negative
2021-03-12 01:27:27,1370184631857905667,"POTUS: One in four adults in the U.S. has received their first COVID-19 vaccine — and we’re now leading the world in vaccinations.

Tha…",43746756,shallowfl,"Tampa, FL ",105,2062,,True,False,1541,,,15422,0,0.3333333333333333,0.25,positive
2021-03-12 01:27:27,1370184630956126212,"Thousands of seniors in Chicago public housing get their first dose of COVID-19 vaccine: ""I can’t wait to see my family"" 
",7313362,chicagotribune,"Chicago, IL",1127132,509,,False,True,231681,,,6,55,0.19999999999999998,0.125,positive
2021-03-12 01:27:27,1370184629232230400,DrNinaRadcliff I got my 1st COVID vaccine shot today!💪💪💪💪🙏🙏🙏 ,61769158,loco53,,624,14314,,False,False,53051,,,0,1,0.0,0.0,neutral
2021-03-12 01:27:27,1370184628980563971,Hey everyone go get your vaccine while thousands coming through the southern boarder with covid. SMH !,25380270,phillynutman,"iPhone: 40.292160,-75.357925",58,42,,False,False,207,,,0,0,0.0,0.0,neutral
2021-03-12 01:27:26,1370184628091244545,"POTUS: One in four adults in the U.S. has received their first COVID-19 vaccine — and we’re now leading the world in vaccinations.

Tha…",46729989,yharper23,,192,75375,,True,False,42402,,,15422,0,0.3333333333333333,0.25,positive
2021-03-12 01:27:26,1370184627458088966,dianne_bromley: Boycott .Pfizer!! Just because they R biggest drug company in the world doesn’t mean they dictate hormone therapy! Ba…,1060496463795511297,thofafor,,2359,2666,,True,False,584109,,,244,0,0.6875,-0.390625,negative
2021-03-12 01:27:25,1370184622617751554,TheDemocrats BidenCrimeFamilly Never seen so many lies. The truth is in what he does.  How many vaccines are you giving to other countries before Americans.  How could you sign a bill that only 9% to the virus. AstraZeneca BorderCrisis 75% of Americans vaccine Biden ,534589051,krawstormy,,4,172,,False,False,669,,,0,0,0.59375,0.21875,positive
2021-03-12 01:27:25,1370184621753827331,WGRZ: WATCH LIVE: President Biden's first prime-time address to call for all adults to be vaccine-eligible May 1. ,860207990,Brett_Conrad_,"Buffalo, NY",215,18156,,False,False,13107,,,2,0,0.41666666666666663,0.19318181818181818,positive
2021-03-12 01:27:25,1370184621615374336,"BarackObama: Michelle and I got vaccinated against COVID-19 because we know it’s the best way to beat this pandemic, protect one anothe…",1195023559401312256,Adem12380776,,25,3,,False,False,2667,,,9009,0,0.3,1.0,positive
2021-03-12 01:27:25,1370184621414100994,"KizzyPhD: Honored to be the winner the “NextGen Award”, bestowed by The Franklin Institute, an organization that has “predicted” &amp; awar…",157014095,NoireTropicalB,"Puerto Espana, NYC",761,162273,,True,False,36978,,,472,0,0.0,0.0,neutral
2021-03-12 01:27:24,1370184620482961409,21WIRE: SHARE: 'A group of scientists and doctors have issued an open letter calling on the European Medicines Agency (EMA) to answer u…,582824264,angelalambert14,Marlborough,742,23601,,False,False,17303,,,139,0,0.25,0.0,neutral
2021-03-12 01:27:24,1370184620231127043,TrilliamClinton NotAFuckinBaker That moderna had me unable to lift my arm for a few days 😭,53244906,_tatianaacosta,San Francisco,1483,17763,,True,False,134542,,,0,1,0.3,-0.35,negative
2021-03-12 01:27:24,1370184619660820486,"Inbox statement from CVS Health CEO Karen Lynch:

""Pre-K through 12 educators and staff and child care workers have accounted for more than 30 percent of COVID-19 vaccine appointments at CVS Pharmacy locations in the past week, and will continue to be a priority going forward.”",53809979,davidalim,Washington D.C.,11154,9762,,True,True,12227,,,7,27,0.375,0.125,positive
2021-03-12 01:27:24,1370184619245637634,Covid vaccine: tens of thousands of UK nurses yet to receive first dose ,2653909938,bonillal1,Canada,909,19120,,False,False,97724,,,0,0,0.3333333333333333,0.25,positive
2021-03-12 01:27:24,1370184619073667074,AmyKremer: I don’t want to hear Joe Biden talk about Covid and the vaccine as long as he is letting illegal aliens into this country th…,1253827138857381889,fan_tolkien,"Wild Thing, United States",3197,34390,,False,False,48651,,,153,0,0.45,-0.275,negative
2021-03-12 01:27:24,1370184617626529795,"Because they fit into one of the available criteria to get vaccinated and there was one available for them.

I got mine because I work in an environment where the transmission of Covid to the monkey population would devastate medical research, INCLUDING Covid Vaccine Trials. ",275480794,indiealexh,"Davis, CA",1777,43906,,True,False,25965,,,0,0,0.24000000000000005,0.23000000000000004,positive
2021-03-12 01:27:24,1370184616389263362,danieteebee: It’s completely predictably American that the brand of COVID vaccine you have access to has now become a class signifier,489953913,deefinewhine,"Maryland, USA",4426,16512,,True,False,34062,,,10179,0,0.0,0.0,neutral
2021-03-12 01:27:23,1370184615655182339,newsmax: Trump hopes everyone remembers him when they get their vaccine  ,2807071398,89doubts,,7904,32407,,False,False,76761,,,402,0,0.0,0.0,neutral
2021-03-12 01:27:23,1370184614526980101,dianne_bromley: Of course .pfizer moved PMU farms to China - NO animal welfare laws in China! None! BanPMUFarms ,1060496463795511297,thofafor,,2359,2666,,True,False,584109,,,249,0,0.0,0.0,neutral
2021-03-12 01:27:23,1370184614375919616,"Moving to Phase 3 Mar 22, meanwhile, Spokane had over 100 cases for the first time since Feb 18.
We're a day away from to 38,000 cases &amp; 600 deaths.
As of 3/8 150,000 vaccine shots in arms, but data is non-existent. King Co. has data, SpokaneHealth nope:  ",397868343,JackDaniyel,"Spokane, WA",331,1202,,True,False,8379,,,0,0,0.3333333333333333,0.25,positive
2021-03-12 01:27:23,1370184612954128384,BreakingNews: President Biden is expected to call for all U.S. adults to be eligible to receive the vaccine no later than May 1; will a…,4881407763,UrsulaRooth,USA,3524,264848,,False,False,182779,,,85,0,0.2,-0.05,negative
2021-03-12 01:27:23,1370184612496953358,HighWireTalk: The Italian Medicines Agency (AIFA) Thursday banned nationwide the use of a batch of the AstraZeneca COVID-19 vaccine due…,148776416,Valafl,Ind,310,70895,,True,False,61066,,,250,0,0.0,0.0,neutral
2021-03-12 01:27:22,1370184611830054912,"WCInvestor: 231 million doses of vaccine and no deaths from it. 118 million COVID cases and 2,620,000 deaths. It's really your call whi…",1928471444,Shasan3Ali,"St. Charles, IL",159,1833,,True,False,6640,,,62,0,0.2,0.2,positive
2021-03-12 01:27:22,1370184610508865537,"CNN: “All adult Americans will be eligible to get a vaccine no later than May 1,"" President Biden announces. ""...That doesn't mean ever…",1200452332485562368,News2Chase,Cha,556,2222,,False,True,7203,,,256,0,0.32916666666666666,-0.07083333333333333,negative
2021-03-12 01:27:22,1370184609783193601,mariamainmo: Girls don't want boys. They want the covid vaccine and a nice apartment,1017033979872989186,Nrhdx,,6965,97935,,True,False,255623,,,24529,0,1.0,0.6,positive
2021-03-12 01:27:22,1370184609497894913,MichelleRempel: I just asked NACI if they would have recommended the off label usage of the Pfizer vaccine (four month dosing interval…,1119962730579013632,rockinangelx,Currently... Hell ,203,21219,,False,False,11876,,,370,0,0.0,0.0,neutral
2021-03-12 01:27:22,1370184608201990145,"ABCPolitics: Despite calls for national unity and bipartisanship, President Joe Biden and his top aides have declined to give the Trump…",240834332,DaniaPeriodista,United States,10196,28119,,False,True,39965,,,868,0,0.5,0.5,positive
2021-03-12 01:27:21,1370184606624985088,"BarackObama: Michelle and I got vaccinated against COVID-19 because we know it’s the best way to beat this pandemic, protect one anothe…",1039641333030432770,RebeccaPhDRN,🎶TN born☀️CA livin’,4049,11628,,False,False,8195,,,9009,0,0.3,1.0,positive
2021-03-12 01:27:21,1370184606364876801,newsmax: Trump hopes everyone remembers him when they get their vaccine  ,569153323,austelme01,"Fulshear, TX",160,58561,,False,False,24965,,,402,0,0.0,0.0,neutral
2021-03-12 01:27:21,1370184605756764165,"ThrombosisCan: Our statement on the AZ vaccine and blood clots: ""based on the available evidence, there is no link between receiving th…",718433029614604288,kimpy79,"Hamilton, Ontario",344,2062,,False,False,772,,,20,0,0.4,0.4,positive
2021-03-12 01:27:21,1370184604712374272,dianne_bromley: .pfizer it's time to let the skeletons out of the closet for the world to see BanPMUFarm ,1060496463795511297,thofafor,,2359,2666,,True,False,584109,,,246,0,0.0,0.0,neutral
2021-03-12 01:27:21,1370184604116717569,"Kroger clinic patients expecting COVID-19 vaccine receive empty shot, called back later for real deal via /r/nottheonion  ",71274488,TheLostAtHome,Vermont's #1 Podcast,5764,9901,,False,False,49073,,,0,0,0.2,0.025,positive
2021-03-12 01:27:20,1370184603680575493,newsmax: Trump hopes everyone remembers him when they get their vaccine  ,292023564,dmeiske,"South Dakota, USA",251,34115,,True,False,3346,,,402,0,0.0,0.0,neutral
2021-03-12 01:27:20,1370184603420426245,"Heritage: As of March 10, the states have so far received 126.2 million COVID vaccine doses and administered 94.4 million of them. 

To…",532503947,GinaConti5,,324,26179,,True,False,15300,,,7,0,1.0,0.1,positive
2021-03-12 01:27:20,1370184600069275648,"GottaLaff: 💪🏼President Biden announces he is directing all states, tribes and territories to make all U.S. adults 18 and older eligible…",31480713,Yombe,USA,4129,42049,,False,False,285750,,,5,0,0.3333333333333333,0.16666666666666666,positive
2021-03-12 01:27:20,1370184599628828678,"bcohenn: My story with robferguson1, Mariasarrouh and angelynsayshi on Ontario's confusing AstraZeneca vaccine pilot launch today
ht…",109337812,angelynsayshi,"Toronto, Ontario",5134,24829,,True,True,21277,,,7,0,0.4,-0.3,negative
2021-03-12 01:27:19,1370184598815145987,dianne_bromley: Horse advocates declare a boycott on .Pfizer! BanPMUFarms,1060496463795511297,thofafor,,2359,2666,,True,False,584109,,,245,0,0.0,0.0,neutral
2021-03-12 01:27:19,1370184597460373506,"CNN: “All adult Americans will be eligible to get a vaccine no later than May 1,"" President Biden announces. ""...That doesn't mean ever…",162954784,YourNewsGirl,Korea ✈ FL ✈ NYC,3794,28,,False,True,12781,,,256,0,0.32916666666666666,-0.07083333333333333,negative
2021-03-12 01:27:19,1370184597242220550,"JerasIkehorn: RE: TRUMP CLAIMING CREDIT FOR THE VACCINES 
Pfizer, the first vaccine approved, was not a part of Operation Warp Speed.…",32293552,Mscharizmaa,"Pasadena, CA",1078,107293,,False,False,150881,,,427,0,0.3333333333333333,0.25,positive
2021-03-12 01:27:19,1370184596239831042,dianne_bromley: .Pfizer is world leader in PMU product line BanPMUFarms,1060496463795511297,thofafor,,2359,2666,,True,False,584109,,,245,0,0.0,0.0,neutral
2021-03-12 01:27:18,1370184595392536577,"ABC: Pfizer's vaccine is successful in preventing not only symptomatic COVID-19, but also asymptomatic disease according to new real-wo…",479953622,nerdy_guy18,"Florida, USA",530,6840,,False,False,108686,,,387,0,0.8015151515151514,0.29545454545454547,positive
2021-03-12 01:27:18,1370184593635213312,"WHCOVIDResponse: By May 1st, every adult in this country will be eligible for a COVID-19 vaccine but we all have to do our part: Get yo…",1368327828803117061,ChungusDoge,,8,135,,False,False,77,,,903,0,0.3,0.1,positive
2021-03-12 01:27:18,1370184593270267910,"MichelleObama: When you can get the COVID-19 vaccine, I hope you do—Barack and I are certainly glad we did. It’s our best shot at beati…",2671425678,hoganjennifera,,28,36168,,True,False,31197,,,7525,0,0.65,0.75,positive
2021-03-12 01:27:18,1370184593257549833,"WHCOVIDResponse: By May 1st, every adult in this country will be eligible for a COVID-19 vaccine but we all have to do our part: Get yo…",22650582,ORDems,Oregon,9889,6970,,True,True,13229,,,903,0,0.3,0.1,positive
2021-03-12 01:27:18,1370184592250916866,"GottaLaff: 💪🏼President Biden announces he is directing all states, tribes and territories to make all U.S. adults 18 and older eligible…",218320239,Gluna21,tejas,574,60,,True,False,74667,,,5,0,0.3333333333333333,0.16666666666666666,positive
2021-03-12 01:27:17,1370184589906382848,"aubrey_huff JoeBiden Not watching, I’d fall asleep and if I sleep now, I’ll be up all night. Is he only taking about COVID and the vaccine??",1347377613036113928,Dodgers_Titans,,1,2,,False,False,338,,,0,0,1.0,0.0,neutral
2021-03-12 01:27:17,1370184587481997313,"POTUS: One in four adults in the U.S. has received their first COVID-19 vaccine — and we’re now leading the world in vaccinations.

Tha…",250471597,BTS_X_Jaebummi3,,251,88051,,True,False,75745,,,15422,0,0.3333333333333333,0.25,positive
2021-03-12 01:27:17,1370184587108876288,"CBSEveningNews: BREAKING: Pres. Biden is directing all states, tribes and territories to make all U.S. adults aged 18 and older eligibl…",21763352,kidjim25,"Westmont, IL",571,104288,,True,False,103468,,,21,0,0.3666666666666667,0.033333333333333326,positive
2021-03-12 01:27:16,1370184586198720512,"President Biden says he will direct all states, tribes and territories to make all adults eligible for vaccination no later than May 1. He adds that we’re on track to reach 100 million shots in arms on his 60th day in office, earlier than expected.  ",366629301,thenewsoncnbc,"Englewood Cliffs, NJ",69665,158,,True,True,7350,,,24,117,0.325,0.0,neutral
2021-03-12 01:27:16,1370184585796067329,newsmax: Trump hopes everyone remembers him when they get their vaccine  ,20170208,SteveMarkham1,"London, New York and LA",2289,2259,,False,False,32291,,,402,0,0.0,0.0,neutral
2021-03-12 01:27:16,1370184585217257473,"WHCOVIDResponse: By May 1st, every adult in this country will be eligible for a COVID-19 vaccine but we all have to do our part: Get yo…",2359800589,VivianW066,"Philadelphia, PA",5387,40778,,False,False,38309,,,903,0,0.3,0.1,positive
2021-03-12 01:27:15,1370184582683844610,"RandyLudlow: Ohio 'on track' for May 1 vaccinations for all, GovMikeDeWine's office says, as Biden calls for states to make all adults…",344863305,GrantPepper,"Mount Vernon, OH",1219,19072,,True,False,19998,,,11,0,0.0,0.0,neutral
2021-03-12 01:27:15,1370184582323126272,"cnni: “All adult Americans will be eligible to get a vaccine no later than May 1,"" US President Biden announces. ""...That doesn't mean…",37284897,Gfigs75,Bronx New york,19,426,,True,False,399,,,78,0,0.15,0.05,positive
2021-03-12 01:27:15,1370184581824057345,"Kenya receives 100,000 doses of Oxford-AstraZeneca vaccine from India ",2305181856,newsafricanow,Africa,1114,9,,False,False,419438,,,1,2,0.0,0.0,neutral
2021-03-12 01:27:15,1370184580775489536,verge: Biden: ‘all American adults will be eligible to get a vaccine no later than May 1st’  ,305769799,AlvaroDBatista,"São Paulo, SP - Brasil",60,1341,,True,False,8948,,,31,0,0.0,0.0,neutral
2021-03-12 01:27:15,1370184580154675200,"KatyTurNBC: One year of COVID. 
Seven months pregnant. 
First shot of Pfizer.",263810192,Mikie_Chavez,"Arlington Heights, IL",444,202847,,False,False,176225,,,330,0,0.41666666666666663,0.29166666666666663,positive
2021-03-12 01:27:14,1370184575238963200,abeladdin: Pfizer gays vs. Moderna gays once the clubs reopen  ,26879129,Whatjakesaid,"ÜT: 41.158863,-73.386177",345,12228,,True,False,28492,,,11,0,0.0,0.0,neutral
2021-03-12 01:27:14,1370184575129817089,HeyTammyBruce: On this year anniversary of COVID-19 being declared a pandemic I am happy to say I received the 1st Pfizer vaccine jab y…,817816465617190912,rwreed48,"Tooele, Utah",594,37348,,False,False,50533,,,67,0,1.0,0.8,positive
2021-03-12 01:27:14,1370184574937014277,"CBSEveningNews: BREAKING: Pres. Biden is directing all states, tribes and territories to make all U.S. adults aged 18 and older eligibl…",8726072,Melissa_Brunner,"Topeka, KS",8847,4480,,True,True,40299,,,21,0,0.3666666666666667,0.033333333333333326,positive
2021-03-12 01:27:13,1370184573800308737,"EricBoehlert: i found the dumbest sentence of the week: 

&lt;Despite calls for national unity and bipartisanship, President Joe Biden and…",4560391760,djake1107,"Cedar Rapids, IA",418,41754,,True,False,55932,,,520,0,0.0,0.0,neutral
2021-03-12 01:27:13,1370184573276057606,"ajplus: Pres. Biden has directed states to make all adults eligible for the COVID19 vaccine by May 1.

He announced the directive duri…",552053765,cheyrupert13,somewhere,1011,217183,,True,False,27626,,,21,0,0.0,0.0,neutral
2021-03-12 01:27:13,1370184571980017664,delawaredub: delaware_gov Delaware_DHSS POTUS VP Thankful to have received 1st dose of Covid vaccine for phase 1b in Delaware :),1254839822411276298,DelawareCOVID,Delaware,251,1,,False,False,17596,,,1,0,1.0,0.5,positive
2021-03-12 01:27:13,1370184570289655808,"WHCOVIDResponse: By May 1st, every adult in this country will be eligible for a COVID-19 vaccine but we all have to do our part: Get yo…",1263130170,burnsmchumprson,,578,56243,,False,False,20505,,,903,0,0.3,0.1,positive
2021-03-12 01:27:12,1370184569920557062,Moderna's top scientist: 'We are actually hacking the software of life' ,1363007738,Howe4Jesus,,286,3159,,False,False,5855,,,0,0,0.3,0.25,positive
2021-03-12 01:27:12,1370184569224302594,Anyone else sing this in their head every time I hear about the Covid vaccine? Just me? ,428178182,TheJonDougherty,"Albany, NY",1578,8752,,True,False,23472,,,0,1,0.0,0.0,neutral
2021-03-12 01:27:12,1370184567156568067,"RN00711: Still wondering why he won? POTUS GoJoe GoPOTUS
👏🏾👏🏾👏🏾👏🏾👏🏾👏🏾👏🏾👏🏾👏🏾👏🏾👏🏾👏🏾
""Biden to direct states to make all adults eligibl…",2502967792,SadieMaeTN,"Tennessee, USA",68192,138475,,False,False,82053,,,21,0,0.4,0.1,positive
2021-03-12 01:27:12,1370184566745497602,"PISDI94_96: Like and if you agree they can shove their COVID vaccine up their stinking ass!

NOT GETTING IT AND JOE BIDEN IS A PIECE…",396725868,JoseTejeda7,"Hialeah, FL",718,146549,,True,False,79916,,,90,0,0.0,0.0,neutral
2021-03-12 01:27:12,1370184566388965381,"CNN: “All adult Americans will be eligible to get a vaccine no later than May 1,"" President Biden announces. ""...That doesn't mean ever…",1025797428023382017,AustinW64329607,"Oxford, AL",251,19007,,False,False,46591,,,256,0,0.32916666666666666,-0.07083333333333333,negative
2021-03-12 01:27:11,1370184564258308096,MichelleRempel: I just asked NACI if they would have recommended the off label usage of the Pfizer vaccine (four month dosing interval…,251667312,Doalie,the bar stool at the end #YXE,527,19575,,True,False,23214,,,370,0,0.0,0.0,neutral
2021-03-12 01:27:10,1370184561641029634,"BarackObama: Michelle and I got vaccinated against COVID-19 because we know it’s the best way to beat this pandemic, protect one anothe…",766438499432165377,Margare80107673,"Pitman, NJ",16,779,,False,False,66,,,9009,0,0.3,1.0,positive
2021-03-12 01:27:10,1370184561632632835,sunlorrie: Denmark suspends use of AstraZeneca Covid vaccine ,727211640,JudyJudyb67,"Ontario, Canada",1424,70564,,True,False,5101,,,117,0,0.0,0.0,neutral
2021-03-12 01:27:10,1370184561376821255,"cnni: “All adult Americans will be eligible to get a vaccine no later than May 1,"" US President Biden announces. ""...That doesn't mean…",119877926,ameyapendse,"New York, NY",1297,11831,,True,False,22353,,,78,0,0.15,0.05,positive
2021-03-12 01:27:10,1370184561263587333,"WCInvestor: 231 million doses of vaccine and no deaths from it. 118 million COVID cases and 2,620,000 deaths. It's really your call whi…",1413216619,BenZabar,,1838,26033,,False,False,27704,,,62,0,0.2,0.2,positive
2021-03-12 01:27:10,1370184558688280584,CNBCnow: BREAKING: President Biden will direct states to make all adults eligible for the Covid-19 vaccine by May 1. The President is a…,434513610,vrsxc,HTX,798,45196,,True,False,46674,,,329,0,0.4,0.1,positive
2021-03-12 01:27:10,1370184558294007815,NPRHealth: Moderna And Pfizer On Track To Hit Vaccine Production Goals ,239587213,hernandezfranci,"New York, New York",586,3304,,True,False,45987,,,102,0,0.0,0.0,neutral
2021-03-12 01:27:09,1370184557518000133,"cnni: “All adult Americans will be eligible to get a vaccine no later than May 1,"" US President Biden announces. ""...That doesn't mean…",1031738844230680576,XoZXo2,,74,39695,,False,False,27828,,,78,0,0.15,0.05,positive
