created,id_str,text,user_id,screen_name,location,followers_count,user_favourites_count,time_zone,geo_enabled,verified,status_count,geo,coords,retweet_count,tweet_favourite_count,Subjectivity,Polarity,Sentiment
2021-03-12 01:26:15,1370184330111193088,"POTUS: One in four adults in the U.S. has received their first COVID-19 vaccine — and we’re now leading the world in vaccinations.

Tha…",825739345265094656,TammyinMT406,"Great Northwest, USA",3099,631872,,False,False,283227,,,15422,0,0.3333333333333333,0.25,positive
2021-03-12 01:26:15,1370184327187816451,MPaiMD: Unfortunately... clots happen. Rate of thrombosis after AZ COVID19 vaccine seems no higher than expected in general population…,925909657906024450,Ortho_PA,"Ontario, Canada",1004,6656,,True,False,4884,,,20,0,0.6,-0.16874999999999998,negative
2021-03-12 01:26:14,1370184326730551300,danieteebee: It’s completely predictably American that the brand of COVID vaccine you have access to has now become a class signifier,763512480215601153,YeojaInSeoul,,41,36262,,False,False,4380,,,10179,0,0.0,0.0,neutral
2021-03-12 01:26:14,1370184324490919936,BTU66: “We’re encouraged by the momentum by which BPS and the City of Boston have made vaccinating our educators a priority now that we…,3065818421,JessJTang,"Boston, MA",4269,5888,,False,False,3847,,,5,0,0.0,0.0,neutral
2021-03-12 01:26:14,1370184323446497284,danieteebee: It’s completely predictably American that the brand of COVID vaccine you have access to has now become a class signifier,105714889,alec_nelson096,New York,158,9545,,False,False,13701,,,10179,0,0.0,0.0,neutral
2021-03-12 01:26:13,1370184322163036160,"Imagecaptured: Remember when Biden fast tracked the covid vaccine? 

No, because it wasn't him who did that, it was President Trump.…",993728773483827201,spoiled_the,,4012,88939,,False,False,58000,,,37,0,0.6,0.2,positive
2021-03-12 01:26:13,1370184318975422474,"Thank you POTUS Biden for your outstanding leadership in the battle against COVID by getting vaccine into the arms of all Americans. For the first time in a year, the end of the pandemic is really in sight and there’s tangible hope for the start of a new normal. 🇺🇸 HelpIsHere",100876567,robininny,New York • East Coast USA,1519,45918,,True,False,102133,,,0,1,0.5025757575757576,0.24727272727272726,positive
2021-03-12 01:26:12,1370184316295258116,TheView: WHOOPI RECEIVES COVID-19 VACCINE: Our WhoopiGoldberg tells us she received her first shot of the coronavirus vaccine and enco…,747866820,AnneKepplinger,Followed by AWESOME people!!!,10667,116716,,False,False,126679,,,157,0,0.3333333333333333,0.25,positive
2021-03-12 01:26:11,1370184314210684935,TheSocrateej: I'd rather get COVID than the vaccine tbh,1324004313740566532,bhiles92,New Jersey,127,7182,,True,False,1674,,,31,0,0.0,0.0,neutral
2021-03-12 01:26:11,1370184313678016516,The expansion comes as President Biden calls for all adults to get a COVID19 vaccine by May 1.  lorineleni Report4America HInews,104389564,CivilBeat,"Honolulu, HI",55014,1996,,True,True,43791,,,0,6,0.0,0.0,neutral
2021-03-12 01:26:11,1370184313203871745,"WHCOVIDResponse: By May 1st, every adult in this country will be eligible for a COVID-19 vaccine but we all have to do our part: Get yo…",262528291,deer_one1,Northern California🌊🌊,586,65160,,False,False,34971,,,904,0,0.3,0.1,positive
2021-03-12 01:26:11,1370184313107476480,"WSJ: Danish health officials said they have temporarily halted the use of AstraZeneca's Covid-19 vaccine, as they and other European re…",30683902,Blackmstrchef,"Washington, USA",826,14322,,True,False,30957,,,87,0,0.1875,-0.0625,negative
2021-03-12 01:26:11,1370184312763596802,HeyTammyBruce: On this year anniversary of COVID-19 being declared a pandemic I am happy to say I received the 1st Pfizer vaccine jab y…,757589883581968384,inacarolcross50,"Colorado, USA",468,16093,,False,False,14121,,,67,0,1.0,0.8,positive
2021-03-12 01:26:11,1370184312700731401,"NewsHour: NEW: President Biden will direct states and territories to make all U.S. adults eligible for a COVID-19 vaccine by May 1. 

…",14118112,DocDre,"Atlanta, GA",12628,209339,,False,True,135896,,,179,0,0.42727272727272725,0.11818181818181818,positive
2021-03-12 01:26:11,1370184312453263368,newsmax: Trump hopes everyone remembers him when they get their vaccine  ,929793010191294470,MyrtleB29088191,"Bensalem, PA",165,27517,,False,False,37282,,,402,0,0.0,0.0,neutral
2021-03-12 01:26:11,1370184312289513473,"naomirwolf: Ok: Switzerland, Italy, Austria, Latvia, Lithuania, Estonia, Luxembourg, Iceland, South Africa, Norway, Denmark have all su…",43105435,onlyoatmeal,,159,34806,,False,False,17906,,,779,0,0.5,0.5,positive
2021-03-12 01:26:11,1370184311220146176,"factcheckdotorg: RFK Jr.'s anti-vaccination film repeats misrepresentations about vaccines, generally, and exploits historical cases of…",342353183,therealrhickey,"Wilmington, OH",51,11042,,True,False,5678,,,25,0,0.25,0.02500000000000001,positive
2021-03-12 01:26:10,1370184310158938113,"ZaidZamanHamid: Mette Frederiksen confirms that the vaccine from AstraZeneca has been temporarily paused in Denmark.
This is because th…",775973546866638848,mbr_fsd,Faisalabad,37,20472,,False,False,15812,,,143,0,0.0,0.0,neutral
2021-03-12 01:26:10,1370184309835894785,mariamainmo: Girls don't want boys. They want the covid vaccine and a nice apartment,1315363621,arianaboo00,California ,1006,30132,,True,False,20015,,,24529,0,1.0,0.6,positive
2021-03-12 01:26:10,1370184309584314369,keithedwards: Can Pfizer make a vaccine for Trumpism while they’re at it,1301694623027531776,debthedem,"Canyon, TX",4,599,,False,False,791,,,83,0,0.0,0.0,neutral
2021-03-12 01:26:10,1370184308913283080,"Starting Friday, people can preregister on the state's website to book an appointment at the nearest mass vaccination site. ",4746090250,NBC10Boston,"Boston, MA",29029,1156,,True,True,85765,,,2,2,0.1,0.0,neutral
2021-03-12 01:26:10,1370184307113877510,"POTUS: One in four adults in the U.S. has received their first COVID-19 vaccine — and we’re now leading the world in vaccinations.

Tha…",1360585134022524930,LarewCaitlin,,3,114,,False,False,43,,,15422,0,0.3333333333333333,0.25,positive
2021-03-12 01:26:10,1370184306098905090,NBCNews: BREAKING: President Biden is expected to call for all U.S. adults to be eligible to receive the vaccine no later than May 1; w…,70780023,sisharma84,"Atlanta, GA",762,1877,,False,False,28363,,,258,0,0.2,-0.05,negative
2021-03-12 01:26:09,1370184304526028803,"themohwgovjm: Its a Family Affair!
CMO, Dr. Jacquiline Bisasor-Mckenzie and daughter, Dr. Kristen McKenzie were among 180 persons who r…",1129440823,hakeemburt,,777,8437,,True,False,60669,,,13,0,0.0,0.0,neutral
2021-03-12 01:26:09,1370184303913672709,"BNODesk: All adults in the U.S. should be eligible for a COVID-19 vaccine no later than May 1, Biden says",1276180376780713986,hmgnzlz,In The Money,140,5555,,False,False,7271,,,71,0,0.0,0.0,neutral
2021-03-12 01:26:09,1370184303657816067,globeandmail: Canada criticized for refusing to support COVID-19 vaccine patent waiver at WTO meeting ,182560935,pyramidfire,"Washington, DC",65,16193,,False,False,62413,,,3,0,0.0,0.0,neutral
2021-03-12 01:26:09,1370184302894276609,"slpng_giants: Fox News downplayed COVID while their employees quarantined.

It sowed doubt about the vaccine while Rupert Murdoch got h…",736639769900425216,Wanderlust1124,"Denver, CO",145,29442,,True,False,13613,,,109,0,0.0,0.0,neutral
2021-03-12 01:26:09,1370184302445662209,"President Biden announces a direction to all states to make all adults eligible for a COVID-19 vaccine by May 1. 

Meanwhile in Canada… ",15969507,WinstonSih,"Toronto, Ontario",29485,9017,,True,True,33380,,,0,22,0.0,0.0,neutral
2021-03-12 01:26:08,1370184299274661897,"BNODesk: All adults in the U.S. should be eligible for a COVID-19 vaccine no later than May 1, Biden says",2598357146,GailWaldby,MT,3616,437827,,False,False,217639,,,71,0,0.0,0.0,neutral
2021-03-12 01:26:08,1370184297869549568,"President Biden blah blah, they say. Trump was in power when it was worse, covid was unpredictable and there was no vaccine, economy kept shut down to save lives. 

Who is great? One who smiles and talks nice things at good times or who was there in tough times?",1357152301207592962,SIrrigator,India,2,48,,False,False,33,,,0,0,0.7246031746031746,0.14126984126984127,positive
2021-03-12 01:26:07,1370184296997253129,"Twitter On December 23, 2020 President Trump purchased additional 100 MILLION doses of vaccine from Pfizer, before leaving office. The vision of a REAL LEADER! 
TRANK YOU, PRESIDENT TRUMP FOR THE THREE VACCINES YOU DEVELOPED!",774763083180847104,colonelcrystal1,"Puerto Rico, USA",946,15644,,False,False,46767,,,2,2,0.30000000000000004,0.1875,positive
2021-03-12 01:26:07,1370184293427732485,NBCNews: BREAKING: President Biden is expected to call for all U.S. adults to be eligible to receive the vaccine no later than May 1; w…,36946477,shiplady1877,Houston,170,24198,,False,False,23403,,,258,0,0.2,-0.05,negative
2021-03-12 01:26:06,1370184292450582528,"ChildrensHD: NEW RobertKennedyJr: In Oct 2019, shortly before the COVID outbreak, Gates + other powerful individuals began planning ho…",139892962,jordancapp_,"Bonita Springs, FL",330,3130,,True,False,18796,,,308,0,0.5323863636363636,0.07784090909090909,positive
2021-03-12 01:26:04,1370184284573683722,"CNNPolitics: “All adult Americans will be eligible to get a vaccine no later than May 1,"" President Biden announces. ""That doesn't mean…",756235664304332801,gerstkitty,,251,52854,,False,False,18293,,,146,0,0.15,0.05,positive
2021-03-12 01:26:04,1370184284489719808,"Pfizer yes, I got my first vaccine in my arm today! And I cried with joy and thanks to my President and staff! ",1212900245312434178,boyd_penton,,47,2028,,True,False,1753,,,0,0,0.24444444444444446,0.45416666666666666,positive
2021-03-12 01:26:04,1370184283592126467,"Globalbiosec: ""Why frontline workers should only get the Pfizer vaccine"" - Medical Observer - AusDoc: ",4800931904,patientsafe3,,9385,51988,,True,False,97203,,,1,0,0.5,0.0,neutral
2021-03-12 01:26:04,1370184283063676933,patnutana: ⁦PremierScottMoe⁩ your public health officials need to look at this data coming out of the Uk. Clinically compromised folks…,47022386,GregFingas,,2215,44456,,False,False,94039,,,5,0,0.06666666666666667,0.0,neutral
2021-03-12 01:26:04,1370184280836476932,"BarackObama: Michelle and I got vaccinated against COVID-19 because we know it’s the best way to beat this pandemic, protect one anothe…",1293256549,JBaca59,Santa Fe NM / Venice CA,975,26847,,True,False,31471,,,9009,0,0.3,1.0,positive
2021-03-12 01:26:02,1370184276080214016,ColinDMello: NEW: Chief Gordon Beardy of Muskrat Dam confirms to CTVNews that they asked MPP Sol Mamakwa to fly-in and get the Moderna…,3246390180,hs88_hs88,A safe distance from you,1060,204006,,False,False,168302,,,494,0,0.45454545454545453,0.13636363636363635,positive
2021-03-12 01:26:02,1370184273840504833,danieteebee: It’s completely predictably American that the brand of COVID vaccine you have access to has now become a class signifier,1332106462454276098,SandraBlackLive,"Texas, USA",227,148,,False,False,115,,,10179,0,0.0,0.0,neutral
2021-03-12 01:26:02,1370184273827799041,HighWireTalk: VACCINE DISASTER AHEAD  CDC Spin on New Mask Data; Celebrity Catches Fauci Lying!; Expert Warns of Coming Covid Vaccine D…,27172412,Pepperpear,The Second Epistle of John:,1650,202978,,False,False,285893,,,427,0,0.45454545454545453,0.17045454545454544,positive
2021-03-12 01:26:01,1370184271919390722,"Covid-19 Vaccine Tracker Updates: 2021-03-12

▓▓░░░░░░░░ 26.35% +0.62 Serbia
▓▓▓▓▓▓▓▓░░ 85.89% +2.80 Seychelles
▓░░░░░░░░░ 10.45% +0.26 Singapore
▓░░░░░░░░░ 10.60% +0.18 Slovakia
▓░░░░░░░░░ 10.30% +0.20 Slovenia",1357684898807517184,vaccinneprogres,,94,11,,False,False,582,,,0,0,0.0,0.0,neutral
2021-03-12 01:26:01,1370184270610857984,"Today, our ThankfulThursday goes to HPW Transportation and HHD for joining forces to tackle COVID-19 vaccination clinic.
COHEmployeeNews

 ",2384168508,COHEmployeeNews,Houston,865,1065,,True,False,4548,,,0,0,0.0,0.0,neutral
2021-03-12 01:26:01,1370184268597583872,"AmstatNews: In the 90s, Christy Chuang-Stein represented Pfizer in presenting their HIV trial data at an FDA Antiviral Drugs Advisory C…",2661769334,siminaboca,"@gumedcenter,@LombardiCancer",1355,6967,,False,False,5135,,,5,0,0.0,0.0,neutral
2021-03-12 01:26:00,1370184266991144960,"OklahomaCovid: ""My body is now learning how to kill spike proteins.""

(Got a COVID vaccine) ",813725182175092736,moonstonemother,"Oklahoma, USA",1404,263308,,True,False,161003,,,4,0,0.0,0.0,neutral
2021-03-12 01:26:00,1370184266827460609,"This news is so big. Biden also announced a vaccine-finding website from the federal government, which will launch by May 1st.

",14985128,jaypeters,"Portland, OR",1699,470,,False,True,362,,,0,1,0.1,0.0,neutral
2021-03-12 01:26:00,1370184266739552256,"CBSNews: BREAKING: President Biden announces he is directing all states, tribes and territories to make all U.S. adults 18 and older el…",101532348,nayasala,Algonquin,1787,90061,,False,False,385463,,,242,0,0.3333333333333333,0.16666666666666666,positive
2021-03-12 01:26:00,1370184266735181826,"TheAtulMishra: Sweden,a largely inconsequential country wished to bounce back to significance with its AstraZeneca vaccines that it pro…",70443912,aeroomkar,Mysore,35,15711,,False,False,38012,,,363,0,0.21428571428571427,0.10714285714285714,positive
2021-03-12 01:26:00,1370184266043170818,"patientsafe3: Given we have no community transmission of COVID19 in Australia, no hospitalisations &amp; no deaths, the efficacy of AZ bei…",1183141642347245568,lawlor_smith,"South Australia, Australia",82,141,,False,False,317,,,1,0,0.0,0.0,neutral
2021-03-12 01:26:00,1370184265753886722,"renegadecut: the right has pivoted from ""covid is a hoax"" to ""covid is real but no big deal"" to ""covid vaccine isn't safe"" to ""covid va…",822548451535781889,irarugii,he/him |🌈|🇵🇭🇬🇧| London,7640,66702,,False,False,42273,,,41,0,0.35892857142857143,0.24642857142857144,positive
2021-03-12 01:25:59,1370184261488279553,cantpretendtoo: Wife’s Uncle got the Covid vaccine on Friday. Died this morning.  Sad.,4602887955,DebraBuenik,,1961,264440,,True,False,307447,,,358,0,1.0,-0.5,negative
2021-03-12 01:25:59,1370184261299490819,"AliVelshi: BREAKING: Biden to directing states to make all adults vaccine eligible by May 1, &amp; the expansion of those qualified to admi…",2643825305,Literacy_Lights,"Chicago, IL",438,47249,,False,False,41064,,,154,0,0.0,0.0,neutral
2021-03-12 01:25:58,1370184258799726600,"GeoffWSYX6: POTUS just announced a goal of making every American adult eligible for a COVID vaccine by May 1st...

GovMikeDeWine admin…",1066883824099999745,STAHPS_,"Columbus, OH",110,5947,,True,False,1519,,,15,0,0.15,0.05,positive
2021-03-12 01:25:58,1370184256098426880,COVID Positive After Two Vaccine Doses? What It Means ,254960042,vigneshtp,"Madurai,India",62,122,,True,False,3291,,,0,0,0.5454545454545454,0.22727272727272727,positive
2021-03-12 01:25:58,1370184255695822849,FirstSquawk: ASTRAZENECA: DENMARK SUSPENDS USE OF COVID VACCINE DUE TO SERIOUS CASES OF BLOOD CLOTS,971141827,trevorpawluk,,53,4364,,True,False,1402,,,194,0,0.5208333333333333,-0.22916666666666666,negative
2021-03-12 01:25:57,1370184254970269697,Lol if a simple covid-19 swab cost 22-27k. Imagine what they would sell a covid vaccine for.,1091110621,Demarinuh,Bermuda,170,24015,,True,False,26598,,,0,0,0.5285714285714286,0.4,positive
2021-03-12 01:25:57,1370184254865297410,"ajplus: Pres. Biden has directed states to make all adults eligible for the COVID19 vaccine by May 1.

He announced the directive duri…",1096649768288174080,Jungkook_Shooky,,174,8684,,False,False,7417,,,21,0,0.0,0.0,neutral
2021-03-12 01:25:57,1370184254009794565,politico: Biden gives first primetime address one year after Covid-19 shutdown  ,746778695130558464,Amb0306,,432,31064,,False,False,476063,,,34,0,0.3333333333333333,0.25,positive
2021-03-12 01:25:57,1370184253938528256,bhrenton: President Biden has implemented the next phase of a comprehensive strategy to make all adults eligible for the vaccine by May…,747835774897360896,PanthersFan_Afr,West Africa,1176,101105,,False,False,41176,,,10,0,0.0,0.0,neutral
2021-03-12 01:25:57,1370184253380644868,TXNancy Oh that never happens. I’m the black sheep. The narcissistic brother has them wrapped around his finger. My sister is also refusing to get the vaccine. It’s so insane. They have no empathy or even sympathy for my son and I being sick for so long with covid.,14167618,txflygirl,"Houston, TX",4470,1034,,False,False,86467,,,0,0,0.6726190476190476,-0.48273809523809524,negative
2021-03-12 01:25:57,1370184252881526785,"PresidentialAddress Biden taking credit for Trumps work, putting us on a “war footing” last March. Trump’s program, Warp Speed is what produced the vaccine and the therapeutics to make COVID a mostly treatable disease. 
Biden is embarrassing.",752078192,lisakelly_sun,,260,12942,,False,False,40809,,,0,0,0.2833333333333333,0.25,positive
2021-03-12 01:25:57,1370184252759871493,clayaiken Watching now also.  I'm still trying to get vaccinated.  Was scheduled to receive it tonight but was informed that I may have been exposed to COVID so I needed to get tested and will have to reschedule my vaccine appointment.,23450672,claylily,"Baltimore, MD",329,70,,True,False,1380,,,0,0,0.0,0.0,neutral
2021-03-12 01:25:56,1370184251283476480,"BarackObama: Michelle and I got vaccinated against COVID-19 because we know it’s the best way to beat this pandemic, protect one anothe…",595642137,MelissaRabb1,,1809,474571,,False,False,98124,,,9009,0,0.3,1.0,positive
2021-03-12 01:25:56,1370184251090608128,"POTUS: One in four adults in the U.S. has received their first COVID-19 vaccine — and we’re now leading the world in vaccinations.

Tha…",886441019767697409,coolchris210,"Texas, San Antonio",66,9247,,False,False,2028,,,15422,0,0.3333333333333333,0.25,positive
2021-03-12 01:25:56,1370184250213986304,wichmann_cody There are people who are scared of covid and the vaccine. Those people can be persuaded,447071005,xytmusic,"Dallas, TX",198,3671,,False,False,3313,,,0,1,0.0,0.0,neutral
2021-03-12 01:25:55,1370184246418145281,"PNHPNYMetro: We join with healthcare workers, patients &amp; advocates today to demand that pfizer FreeTheVaccine. 

Board member Dr. Roo…",395394840,HilarieAshton,"Brooklyn, NY",1702,465565,,False,False,257323,,,18,0,0.0,0.0,neutral
2021-03-12 01:25:55,1370184244245454850,New Yorkers 60+ Are Eligible for Covid-19 Vaccine Starting Wednesday ,382318059,ReneeArnett,Antifa soup factory,4396,81112,,False,False,150941,,,1,2,0.2772727272727273,0.06818181818181818,positive
2021-03-12 01:25:54,1370184242848747525,"BNODesk: All adults in the U.S. should be eligible for a COVID-19 vaccine no later than May 1, Biden says",894074812120825856,HallyuHomegirl,,1007,111362,,True,False,105207,,,71,0,0.0,0.0,neutral
2021-03-12 01:25:54,1370184242265788416,"JoyceWo30232478 MonaGeezie AmyKremer Was the Pfizer vaccine part of Operation Warpspeed?

No.",1315351732629762054,Joe_Montoya_312,Edison County,157,13010,,False,False,4452,,,0,5,0.0,0.0,neutral
2021-03-12 01:25:54,1370184241875722244,"EthelMercaptan: AmyKremer If it weren't for President Donald J Trump, we'd have more people vaccinated by now. ",15565901,Alindasong,,214,64872,,False,False,58916,,,2,0,0.5,0.5,positive
2021-03-12 01:25:54,1370184241477251076,"POTUS: One in four adults in the U.S. has received their first COVID-19 vaccine — and we’re now leading the world in vaccinations.

Tha…",977405538,Seriosity1,"Florida, USA",416,22392,,True,False,53025,,,15422,0,0.3333333333333333,0.25,positive
2021-03-12 01:25:54,1370184241087152128,ABC7: LIVE Biden: “All adult Americans will be eligible to get a vaccine no later than May 1. That’s much earlier than expected.” http…,745732018013614080,Denton3Abby,"Chardon, OH",192,11163,,True,False,30897,,,15,0,0.34,0.02727272727272727,positive
2021-03-12 01:25:54,1370184240462241793,"“President Joe Biden used his first evening address to the nation Thursday to announce he is directing US states to open coronavirus vaccine eligibility to all adults no later than May 1,a step he will say could allow for small Independence Day gatherings” ",2272219753,sista_theology,Where You Wanna Be ,30583,19356,,False,False,31959,,,2,24,0.30833333333333335,0.0,neutral
2021-03-12 01:25:54,1370184239640162305,"ScienceUpFirst: “Which COVID-19 vaccine is best?”

ANSWER: The first approved vaccine that’s available to you! ",1357259774,AlexMunter,"Ottawa, Canada",26609,17316,,True,True,15202,,,182,0,0.3444444444444444,0.5833333333333334,positive
2021-03-12 01:25:53,1370184238415413250,"CBSNews: BREAKING: President Biden announces he is directing all states, tribes and territories to make all U.S. adults 18 and older el…",20284696,Imzadi44,"Spartanburg, SC",1249,6074,,False,False,85605,,,242,0,0.3333333333333333,0.16666666666666666,positive
2021-03-12 01:25:52,1370184232434335744,"NashvilleHealth: More COVID-19 vaccine appointments will open on Friday, starting at 10am.

Those who are eligible can sign up for thei…",3176745760,MaryjaneMjmalin,"Tennessee, USA",3854,353395,,True,False,157094,,,9,0,0.3666666666666667,0.16666666666666666,positive
2021-03-12 01:25:52,1370184231427715075,"nytgraphics: The CDC said on Thursday that about 64.1 million people have received at least one dose of a Covid-19 vaccine, including a…",1253758194981064709,COVIDInfoBot,,16,1,,False,False,6664,,,23,0,0.4,-0.3,negative
2021-03-12 01:25:52,1370184231171805188,NBCNews: BREAKING: President Biden is expected to call for all U.S. adults to be eligible to receive the vaccine no later than May 1; w…,1075793383753478150,Robin56362858,“Unable to answer my phone”...,324,57264,,False,False,21628,,,258,0,0.2,-0.05,negative
2021-03-12 01:25:51,1370184229624164357,Biden: All American adults will become eligible to receive a Covid-19 vaccine by May 1. ,132254964,alana_austin,"Washington, DC",2948,3354,,True,True,23938,,,0,0,0.0,0.0,neutral
2021-03-12 01:25:51,1370184227807985666,verge: Biden: ‘all American adults will be eligible to get a vaccine no later than May 1st’  ,421645674,BaronVonBeard_,🌴💀🌴,121,11067,,True,False,11854,,,31,0,0.0,0.0,neutral
2021-03-12 01:25:50,1370184224003612672,AmyKremer: I don’t want to hear Joe Biden talk about Covid and the vaccine as long as he is letting illegal aliens into this country th…,915809174,jaclyw,,508,67988,,False,False,31066,,,153,0,0.45,-0.275,negative
2021-03-12 01:25:50,1370184223286571016,newsmax: Trump hopes everyone remembers him when they get their vaccine  ,2336973035,piocqua,United States,418,17472,,True,False,24890,,,402,0,0.0,0.0,neutral
2021-03-12 01:25:49,1370184221977894913,news6wkmg: HUGS NEVER FELT SO GOOD | This grandma recently got to hug her granddaughter for the first time in a year after getting full…,338794637,gonzo_30531,FL,1929,126547,,True,False,347162,,,2,0,0.39444444444444443,0.31666666666666665,positive
2021-03-12 01:25:49,1370184221441060869,The Pfizer/BioNTech vaccine explained [Weekly Dose Of Wisdom] -  ,1293870975948189701,eastMEDPharmacy,"Auckland, New Zealand",1,0,,False,False,29,,,0,0,0.0,0.0,neutral
2021-03-12 01:25:49,1370184220820307969,verge: Biden: ‘all American adults will be eligible to get a vaccine no later than May 1st’  ,1961708935,TheTylerJP,"Akron, OH",1290,34465,,True,False,9426,,,31,0,0.0,0.0,neutral
2021-03-12 01:25:49,1370184218991419395,"POTUS: One in four adults in the U.S. has received their first COVID-19 vaccine — and we’re now leading the world in vaccinations.

Tha…",27819475,jenningsghv2,Manila,1337,206804,,False,False,228814,,,15422,0,0.3333333333333333,0.25,positive
2021-03-12 01:25:48,1370184217384996867,"MackayIM: Denmark, Norway and Iceland suspend AstraZeneca COVID shots after blood clot reports
",930174438,OmanReagan,Cascadia - US/Canada,25969,158564,,False,True,9091,,,54,0,0.0,0.0,neutral
2021-03-12 01:25:48,1370184214533005312,"No Healthcare Professional knows how „safe“ the  Covid vaccine truly is....It is called LATENCY!!! It takes years and years to know the true effects of ALL medicines and Tx. And yes, I‘ve been „shot“  biden facts healthcareworker",25003746,Longstocking_29,Villa Villekulla,360,10205,,True,False,15893,,,0,1,0.375,0.27265625,positive
2021-03-12 01:25:47,1370184212557479938,"jsolomonReports: Former presidents urge Americans to get COVID-19 vaccine, Trump not among group | Just The News ",121718272,soapbox62,,291,30975,,True,False,44804,,,131,0,0.0,0.0,neutral
2021-03-12 01:25:47,1370184211173408771,MPaiMD: Unfortunately... clots happen. Rate of thrombosis after AZ COVID19 vaccine seems no higher than expected in general population…,753488731,sudeeppappur,"Halifax, Nova Scotia",126,99,,False,False,88,,,20,0,0.6,-0.16874999999999998,negative
2021-03-12 01:25:46,1370184207813722114,cantpretendtoo: Wife’s Uncle got the Covid vaccine on Friday. Died this morning.  Sad.,1364601979914256384,TexasFoxHound,,10,1211,,False,False,616,,,358,0,1.0,-0.5,negative
2021-03-12 01:25:46,1370184207679426561,"shartstorm8d8: Before COVID, Gates Planned Social Media Censorship of Vaccine Safety Advocates With Pharma, CDC, Media, China and CIA
h…",1218740650599837697,RodStiffingto13,,16,2676,,False,False,2050,,,5,0,0.06666666666666667,0.03333333333333333,positive
2021-03-12 01:25:46,1370184206605684737,"joe_warmington: Denmark, Norway and Iceland suspend AstraZeneca COVID shots after blood clot reports | Article [AMP] | Reuters ",259960795,mmacewen,,234,0,,False,False,12692,,,225,0,0.0,0.0,neutral
