created,id_str,text,user_id,screen_name,location,followers_count,user_favourites_count,time_zone,geo_enabled,verified,status_count,geo,coords,retweet_count,tweet_favourite_count,Subjectivity,Polarity,Sentiment
2021-03-12 01:28:18,1370184844051767296,"WHCOVIDResponse: By May 1st, every adult in this country will be eligible for a COVID-19 vaccine but we all have to do our part: Get yo…",333652878,jxrrygerard,univ of Oregon - France,696,16638,,True,False,43046,,,903,0,0.3,0.1,positive
2021-03-12 01:28:18,1370184842911096835,"21WIRE: COVID19 Vaccine Lockdown 
This recent admission by WHO should be of grave concern to every public health official, politicia…",137388186,apegglivecouk,,57,1354,,False,False,1610,,,2554,0,0.15833333333333333,0.0,neutral
2021-03-12 01:28:17,1370184841409482758,"CNN: “All adult Americans will be eligible to get a vaccine no later than May 1,"" President Biden announces. ""...That doesn't mean ever…",2914099961,arthurphelipe4,"Braga, Portugal",2133,430311,,True,False,117642,,,256,0,0.32916666666666666,-0.07083333333333333,negative
2021-03-12 01:28:17,1370184840516149253,Trump Demands Americans Picture His Face While COVID Vaccine Enters Their Bodies SmartNews  ,1045389666210451457,hultmark_mark,"Ahoskie, NC",19163,50266,,False,False,153123,,,0,1,0.0,0.0,neutral
2021-03-12 01:28:17,1370184838779604994,naomirwolf: Whoa! Add Italy: ,1355009488177168384,TheLitt81281992,,54,4387,,False,False,640,,,509,0,0.0,0.0,neutral
2021-03-12 01:28:16,1370184838272086017,YesItsNicolaC WOO HOO!!! Pfizer twins!,212304955,dragonfly_in_ca,deaf in California,266,12110,,False,False,45220,,,0,2,0.0,0.0,neutral
2021-03-12 01:28:16,1370184837366169601,JustinMinor81: Holy shit Zigmanfreud  ,1311043841257074691,LeafsLeafly,"Louisville, KY",98,8148,,False,False,5589,,,5,0,0.8,-0.2,negative
2021-03-12 01:28:16,1370184837064179714,"cnni: “All adult Americans will be eligible to get a vaccine no later than May 1,"" US President Biden announces. ""...That doesn't mean…",260824224,SenJanetCruz,"Tampa, FL",6274,1771,,True,True,3121,,,78,0,0.15,0.05,positive
2021-03-12 01:28:16,1370184836569174022,Avardus I don't have enough info on the AstraZeneca vaccine to give an opinion at this time,20334002,BrujoFaolan,Canada,13188,43973,,False,False,23474,,,0,0,0.5,0.0,neutral
2021-03-12 01:28:15,1370184832064614402,"BNODesk: All adults in the U.S. should be eligible for a COVID-19 vaccine no later than May 1, Biden says",547358807,MarkitaChatman,chicago,894,114901,,True,False,221367,,,71,0,0.0,0.0,neutral
2021-03-12 01:28:15,1370184831821352966,"CNN: “All adult Americans will be eligible to get a vaccine no later than May 1,"" President Biden announces. ""...That doesn't mean ever…",1363354722472783874,not_remainings,New York,142,746,,False,False,1199,,,256,0,0.32916666666666666,-0.07083333333333333,negative
2021-03-12 01:28:15,1370184830487498753,"CNN: “All adult Americans will be eligible to get a vaccine no later than May 1,"" President Biden announces. ""...That doesn't mean ever…",920041542265524224,AFT4999,,78,522,,False,False,4833,,,256,0,0.32916666666666666,-0.07083333333333333,negative
2021-03-12 01:28:14,1370184829153775619,"POTUS: One in four adults in the U.S. has received their first COVID-19 vaccine — and we’re now leading the world in vaccinations.

Tha…",42439862,madokakanames,,234,34883,,True,False,76238,,,15422,0,0.3333333333333333,0.25,positive
2021-03-12 01:28:14,1370184827308216325,"AnnPage10 MCusolito Me, too! Number 2 Moderna. ",39359104,EnglandLF,Winston Salem NC,227,1715,,False,False,1224,,,0,2,0.0,0.0,neutral
2021-03-12 01:28:13,1370184825198546955,"WISN_Caroline: If you are a Wisconsin resident with any of the medical conditions on this list, you are eligible for the COVID-19 vacci…",558910291,Gyrrakavian,Across the aether,24,19114,,False,False,12240,,,35,0,0.0,0.0,neutral
2021-03-12 01:28:12,1370184821734014984,"EricBoehlert: i found the dumbest sentence of the week: 

&lt;Despite calls for national unity and bipartisanship, President Joe Biden and…",16088452,mimshow,"Marysville, MI",676,71490,,True,False,57748,,,520,0,0.0,0.0,neutral
2021-03-12 01:28:12,1370184820853194756,"naomirwolf: Ok: Switzerland, Italy, Austria, Latvia, Lithuania, Estonia, Luxembourg, Iceland, South Africa, Norway, Denmark have all su…",294938362,Lafflace,,35,1571,,True,False,1389,,,778,0,0.5,0.5,positive
2021-03-12 01:28:11,1370184815388078081,"BarackObama: Michelle and I got vaccinated against COVID-19 because we know it’s the best way to beat this pandemic, protect one anothe…",957349834981339137,rileymlopez,"Washington, DC",172,24485,,False,False,1114,,,9009,0,0.3,1.0,positive
2021-03-12 01:28:11,1370184814414938114,"m_scribe: Breaking: Novavax announces efficacy results in its vaccine trials.

* 100% protection against severe disease
* 96% effective…",109538525,ioanauoft,"New York, USA",428,5901,,False,False,6169,,,446,0,0.0,0.0,neutral
2021-03-12 01:28:11,1370184813659918336,"NewsBFM: 1. Kelantan police have identified several of their personnel who refused to take a Covid-19 vaccine, via the letter of consen…",741189270283522048,Flintwind,Baker Street,94,8624,,True,False,14060,,,16,0,0.0,0.0,neutral
2021-03-12 01:28:10,1370184812904992777,"HighWireTalk: ""Denmark has suspended the use of the Oxford-AstraZeneca COVID vaccine in a precautionary move, citing concerns that it c…",761593153,DDDaved99,"Florida, USA",50,18582,,False,False,13579,,,316,0,0.0,0.0,neutral
2021-03-12 01:28:10,1370184812699340809,"CNNPolitics: “All adult Americans will be eligible to get a vaccine no later than May 1,"" President Biden announces. ""That doesn't mean…",24792733,Ashadahya,"Los Angeles, CA",16645,78363,,True,True,65662,,,146,0,0.15,0.05,positive
2021-03-12 01:28:10,1370184812669980673,"joe_warmington: Denmark, Norway and Iceland suspend AstraZeneca COVID shots after blood clot reports | Article [AMP] | Reuters ",1277422816539729920,Blanche54309561,United States,26,2741,,False,False,2902,,,225,0,0.0,0.0,neutral
2021-03-12 01:28:10,1370184812460441603,President Joe Biden announced that he will direct states to make all adult Americans eligible to receive coronavirus vaccine shots by no later than May 1. ,21782956,wsoctv,"Charlotte, NC",273977,3761,,True,True,276287,,,1,10,0.2333333333333333,0.06666666666666667,positive
2021-03-12 01:28:10,1370184811885789195,"CBSNews: BREAKING: President Biden announces he is directing all states, tribes and territories to make all U.S. adults 18 and older el…",160337290,Louie_Rock,"Richmond, VA",98,23506,,False,False,14787,,,242,0,0.3333333333333333,0.16666666666666666,positive
2021-03-12 01:28:10,1370184810761752580,narendramodi: Happy to share that my mother has taken the first dose of the COVID-19 vaccine today. I urge everyone to help and motivat…,354993695,hindustanse,,78484,448858,,False,False,663635,,,16106,0,0.6666666666666666,0.525,positive
2021-03-12 01:28:10,1370184810472292359,"s01181969: kylegriffin1 all the good stuff while being sleepy, imagine, . Watch out Mr. Trump. He keeps breaking promises -- early vac…",1021379087749844997,cahillskiddos,"Connecticut, USA",37,961,,False,False,4861,,,13,0,0.45000000000000007,0.39999999999999997,positive
2021-03-12 01:28:10,1370184809872453633,PoliticusSarah Thank GOD for Biden! Before Trump left office he refused to sign up on the contract with Pfizer for the new 100 Million doses that we needed in order to continue 2nd shot vaccinations in 2021. Without Joe Biden we would still be waiting. - Per CEO of Pfizer TV mainstream news. ,1158562636113440768,JanieResists,"USA~""True Blue"" In AZ! ",4051,40566,,False,False,48841,,,0,1,0.15151515151515152,0.04545454545454545,positive
2021-03-12 01:28:09,1370184809272725516,"ABCPolitics: Despite calls for national unity and bipartisanship, President Joe Biden and his top aides have declined to give the Trump…",56103806,rickbrunner,,490,1599,,True,False,5270,,,867,0,0.5,0.5,positive
2021-03-12 01:28:09,1370184808882610179,"I won’t be surprised if these DDS found out that AstraZeneca might cause blood clots for those who are inoculated with it, then they will ridicule LGUs and those who were against Sinovac.",1244625367530213376,mrkjshcld,UST 🐅,115,1422,,False,False,701,,,0,0,0.9,0.1,positive
2021-03-12 01:28:09,1370184808589004802,"HamillHimself: Statement by the Twice Impeached Former Guy

I hope everyone remembers when they're getting the COVID-19 (often referred…",271695509,DonHarrel,"New Mexico, USA",508,19701,,True,False,4017,,,872,0,0.0,0.0,neutral
2021-03-12 01:28:09,1370184807066394625,"cnni: “All adult Americans will be eligible to get a vaccine no later than May 1,"" US President Biden announces. ""...That doesn't mean…",26336962,AdamBlaker,"Los Angeles, CA",334,2403,,True,False,2225,,,78,0,0.15,0.05,positive
2021-03-12 01:28:09,1370184806701621258,Goebiwonkinobie pbump Pfizer says sure...whatevs,500359169,GOPsickandtired,"Maryland, USA",90,649,,True,False,2564,,,0,0,0.0,0.0,neutral
2021-03-12 01:28:09,1370184805615304706,ABC7NY: LIVE: President Biden hopes to “mark our independence from this virus” by July 4th: ,31313314,gabbypearl,Morris County,178,54127,,False,False,4444,,,5,0,0.5,0.13636363636363635,positive
2021-03-12 01:28:09,1370184805271343107,Canada criticized for refusing to support COVID-19 vaccine patent waiver at WTO meeting /via globeandmail  cdnpoli,452447266,SoniaMRobaey,Canada,1167,4592,,False,False,7553,,,0,0,0.0,0.0,neutral
2021-03-12 01:28:08,1370184803207634949,"CNNPolitics: “All adult Americans will be eligible to get a vaccine no later than May 1,"" President Biden announces. ""That doesn't mean…",950357642848841728,VKinswa,"Town and Country, WA",148,11,,False,False,36440,,,146,0,0.15,0.05,positive
2021-03-12 01:28:07,1370184799562956803,tsyiblkhealth: Is Johnson &amp; Johnson as effective of a vaccine? How well does it prevent severe COVID-19 illness? We’ve got answers! Her…,74478716,TulaneSPHTM,"New Orleans, LA",3886,4105,,True,False,6815,,,9,0,0.8,0.75,positive
2021-03-12 01:28:07,1370184798753423362,"cnni: “All adult Americans will be eligible to get a vaccine no later than May 1,"" US President Biden announces. ""...That doesn't mean…",1225099062661218306,TheBigRafa1998,"Boston, MA",311,1273,,True,False,86126,,,78,0,0.15,0.05,positive
2021-03-12 01:28:07,1370184798401093637,"POTUS: One in four adults in the U.S. has received their first COVID-19 vaccine — and we’re now leading the world in vaccinations.

Tha…",75702965,fozisland,,461,9697,,False,False,15742,,,15422,0,0.3333333333333333,0.25,positive
2021-03-12 01:28:07,1370184798229180416,"KatyTurNBC: One year of COVID. 
Seven months pregnant. 
First shot of Pfizer.",830167254813786113,litfolk,"Lead, SD, USA",137,30402,,False,False,8854,,,330,0,0.41666666666666663,0.29166666666666663,positive
2021-03-12 01:28:07,1370184797864165378,"CNNPolitics: “All adult Americans will be eligible to get a vaccine no later than May 1,"" President Biden announces. ""That doesn't mean…",771168021842792449,suzanneh58,United States,18,3200,,False,False,4524,,,146,0,0.15,0.05,positive
2021-03-12 01:28:07,1370184797662769154,"RonniSalt: Actually, it is news.

This is how Scott Morrison manipulates people's minds. 

It's up to Australians to decide what they c…",115304914,MissKayeSera,Drag Nation,2567,44244,,True,False,87601,,,171,0,0.1,0.0,neutral
2021-03-12 01:28:07,1370184797205762048,"kayleighmcenany: FINALLY the Biden admin recognizes the Trump admin’s unprecedented vaccine work:

➡️ “We’re grateful for the work that…",341865867,powerinplanks,,118,19884,,False,False,1755,,,4225,0,0.95,0.3,positive
2021-03-12 01:28:06,1370184796144611331,"Why tf is the Biden administration backing the one shot J+J vax when it’s only 60% effective, while the Pfizer vax is 80% effective after having JUST the first shot. I really hope people don’t get a false sense of hope and safety because of that.",111234790,kelly11marie,,122,2379,,True,False,1863,,,0,0,0.6222222222222223,0.2083333333333333,positive
2021-03-12 01:28:06,1370184794861137924,Beaufort County teachers and staff receive the COVID-19 vaccine ,17781837,WJCLNews,"Savannah, GA",29983,96,,True,True,192654,,,0,0,0.0,0.0,neutral
2021-03-12 01:28:06,1370184794517204993,"bpmena: CONFIRMED: POTUS is directing all states to make all American adults eligible for the COVID-19 vaccine no later than May 1.

H…",4105572915,GNEErynDion,"Newport, RI",852,3092,,True,False,23529,,,3,0,0.3333333333333333,0.13333333333333333,positive
2021-03-12 01:28:06,1370184794131243010,"KayRecede: Golden Valley health centers has sharpened its focus to vaccinate more high-risk communities. 

They invite anyone 18 and ol…",5780702,danmacht,NYC,997,3071,,True,True,8066,,,2,0,0.5,0.4,positive
2021-03-12 01:28:06,1370184793925812226,sunlorrie: Denmark suspends use of AstraZeneca Covid vaccine ,833169584,raphaelmetatron,"Ontario, Canada",128,17328,,False,False,4524,,,117,0,0.0,0.0,neutral
2021-03-12 01:28:06,1370184793351188481,"CNN: “All adult Americans will be eligible to get a vaccine no later than May 1,"" President Biden announces. ""...That doesn't mean ever…",338794637,gonzo_30531,FL,1929,126547,,True,False,347162,,,256,0,0.32916666666666666,-0.07083333333333333,negative
2021-03-12 01:28:06,1370184793007267844,"naomirwolf: Ok: Switzerland, Italy, Austria, Latvia, Lithuania, Estonia, Luxembourg, Iceland, South Africa, Norway, Denmark have all su…",1320794871205158913,_crystal_stark,,14,3652,,False,False,225,,,778,0,0.5,0.5,positive
2021-03-12 01:28:06,1370184792784785411,Our shared reality on this planet is if you refuse to take the vaccine for Covid you will suffer it’s effects eventually without any buffer. Politics,2772114020,brain_blog_,"Los Angeles, CA",7288,67196,,True,False,26774,,,0,2,0.0,0.0,neutral
2021-03-12 01:28:05,1370184789215563777,"WOOT WOOOOOOOT

It is SO GOOD to hear that all adults 18+ in all 50 states will now be eligible for a COVID vaccine starting May 1st

Maine's bullshit ruling of age-based eligibility was a literal death sentence for so many younger disabled/chronically ill people, so *whew* ",398998879,memilluu,"Bar Harbor, ME",261,20452,,True,False,2974,,,2,6,0.44000000000000006,0.13999999999999999,positive
2021-03-12 01:28:05,1370184788502515714,Donald Trump Demands Americans Picture His Face While COVID Vaccine Enters Their Bodies - Vanity Fair ,22716237,keenanls,"Cuba, New York",4129,106028,,True,False,126761,,,0,0,0.9,0.7,positive
2021-03-12 01:28:04,1370184787898429445,Biden orders all adults to be eligible for Covid vaccine shots by MAY 1ST.,541068308,grantcopywriter,US,6346,495,,False,False,11656,,,0,0,0.0,0.0,neutral
2021-03-12 01:28:04,1370184787122475010,narendramodi: Happy to share that my mother has taken the first dose of the COVID-19 vaccine today. I urge everyone to help and motivat…,163055734,Dhaval000,Surat,216,1590,,True,False,1859,,,16106,0,0.6666666666666666,0.525,positive
2021-03-12 01:28:04,1370184786740793345,"CNN: “All adult Americans will be eligible to get a vaccine no later than May 1,"" President Biden announces. ""...That doesn't mean ever…",34078050,itsjustme_k,,49,3152,,True,False,3789,,,256,0,0.32916666666666666,-0.07083333333333333,negative
2021-03-12 01:28:04,1370184786053042180,SarahBeckman3: Iowans still have a hard time finding open vaccine appointments. And the state website isn't much help. So who comes to…,1640642557,amyzoeknapp,"Dubuque, IA",257,90340,,False,False,35932,,,9,0,0.4138888888888888,-0.030555555555555558,negative
2021-03-12 01:28:04,1370184785625288705,POTUS says new tools &amp; new website will be released soon so that it’ll be easier to find a Covid-19 vaccine. “No more searching day and night for an appointment for you and your loved ones.”,132254964,alana_austin,"Washington, DC",2948,3354,,True,True,23938,,,0,0,0.5522727272727272,0.18068181818181817,positive
2021-03-12 01:28:03,1370184782403891202,"CNN: “All adult Americans will be eligible to get a vaccine no later than May 1,"" President Biden announces. ""...That doesn't mean ever…",771168021842792449,suzanneh58,United States,18,3200,,False,False,4524,,,256,0,0.32916666666666666,-0.07083333333333333,negative
2021-03-12 01:28:03,1370184780998918147,AstraZeneca jab faces suspensions as world marks pandemic anniversary ,17612485,Td0GG066,"32.459022,-85.022086",341,855,,False,False,11588,,,0,0,0.0,0.0,neutral
2021-03-12 01:28:02,1370184779656617986,"HamillHimself: Statement by the Twice Impeached Former Guy

I hope everyone remembers when they're getting the COVID-19 (often referred…",922303497068072960,Cadydid1960,,57,12209,,False,False,10705,,,872,0,0.0,0.0,neutral
2021-03-12 01:28:02,1370184779358953472,"CBSNews: BREAKING: President Biden announces he is directing all states, tribes and territories to make all U.S. adults 18 and older el…",241240457,cpjrecords,Earth'77,497,38588,,False,False,64282,,,242,0,0.3333333333333333,0.16666666666666666,positive
2021-03-12 01:28:02,1370184778830462978,"theserhajm: COVID-19 Vaccine AstraZeneca is one of the vaccines used in reducing hospitalization, illness and death associated with COV…",68373649,thelaymansdr,Jamaica,1780,39771,,True,False,44748,,,9,0,0.0,0.0,neutral
2021-03-12 01:28:02,1370184777723117572,"KatyTurNBC: One year of COVID. 
Seven months pregnant. 
First shot of Pfizer.",1491629612,hkfinan,,576,249352,,True,False,58641,,,330,0,0.41666666666666663,0.29166666666666663,positive
2021-03-12 01:28:01,1370184772874428416,danieteebee: It’s completely predictably American that the brand of COVID vaccine you have access to has now become a class signifier,1354046290473021440,senbonhoshi,she/her | brain dump acc,1,957,,False,False,1219,,,10178,0,0.0,0.0,neutral
2021-03-12 01:28:01,1370184772480167938,"CNN: “All adult Americans will be eligible to get a vaccine no later than May 1,"" President Biden announces. ""...That doesn't mean ever…",976350332375646209,Suntiwongp,,36,3,,True,False,250,,,256,0,0.32916666666666666,-0.07083333333333333,negative
2021-03-12 01:28:01,1370184772182417410,sunlorrie: Denmark suspends use of AstraZeneca Covid vaccine ,14101483,Donadeedooda,Rocky Mountains,11964,342023,,True,False,434408,,,117,0,0.0,0.0,neutral
2021-03-12 01:28:00,1370184770785849349,🇨🇦 Sobeys says request to use personal information of COVID-19 vaccine recipients was a mistake ,118200525,NeilRetail,"Scottsdale, AZ",22423,26981,,True,True,127534,,,0,0,0.3,0.0,neutral
2021-03-12 01:28:00,1370184770127339525,HighWireTalk: The Italian Medicines Agency (AIFA) Thursday banned nationwide the use of a batch of the AstraZeneca COVID-19 vaccine due…,50969799,shane_lim,Florida ,417,54366,,False,False,13612,,,250,0,0.0,0.0,neutral
2021-03-12 01:27:59,1370184767346458624,"cnni: “All adult Americans will be eligible to get a vaccine no later than May 1,"" US President Biden announces. ""...That doesn't mean…",826419511972732928,JudithC44397974,,121,97567,,False,False,23163,,,78,0,0.15,0.05,positive
2021-03-12 01:27:59,1370184765656154113,"noahweiland: Scoop: The U.S. is sitting on tens of millions of doses of the AstraZeneca vaccine in Maryland and Ohio facilities, and of…",1155497643826712576,SethKadish,"Toronto, Ontario",109,13472,,False,False,2111,,,367,0,0.0,0.0,neutral
2021-03-12 01:27:59,1370184765396062208,"thenewsoncnbc: “My fellow Americans, you’re owed nothing less than the truth,” President Biden says in his address to the nation, one y…",1238467680773894146,CoronaUpdateBot,,1171,65,,False,False,587925,,,17,0,0.06666666666666667,-0.16666666666666666,negative
2021-03-12 01:27:59,1370184764238487553,"BarackObama: Michelle and I got vaccinated against COVID-19 because we know it’s the best way to beat this pandemic, protect one anothe…",1891042316,chrisolivier73,"Miami, FL",74,3412,,False,False,14887,,,9009,0,0.3,1.0,positive
2021-03-12 01:27:57,1370184757892423680,"WHCOVIDResponse: By May 1st, every adult in this country will be eligible for a COVID-19 vaccine but we all have to do our part: Get yo…",1250925794668371969,ToreadorSkarrin,"Near Seattle, WA",420,112651,,False,False,21476,,,903,0,0.3,0.1,positive
2021-03-12 01:27:57,1370184756730621953,"Good news for public transit workers: Updated CAPublicHealth rules make bus drivers, BAoperators and others eligible for COVID vaccines starting Monday ",15815876,NSavidge,"Oakland, CA",2307,2161,,True,True,13416,,,0,0,0.2555555555555556,0.2333333333333333,positive
2021-03-12 01:27:56,1370184754771951620,ChinasaNworu: Denmark Suspends AstraZeneca Vaccine Use Over Blood Clot Fears WIONews NOIweala MaziNnamdiKanu WHOAFRO WHONigeria ht…,3610349368,maziogadimma83,Port Harcourt,413,4978,,True,False,22881,,,46,0,0.0,0.0,neutral
2021-03-12 01:27:56,1370184754369228800,DavidSacks: President Biden is correctly calling on states to drop vaccine eligibility requirements and provide a date certain for Covi…,26104299,jayeskenazi,,27865,7216,,True,False,19659,,,53,0,0.5714285714285714,0.21428571428571427,positive
2021-03-12 01:27:56,1370184754088189954,"mschlapp YouTube ACUConservative CPAC HARRISFAULKNER FaulknerFocus His speech was so good
He converted American citizens into rioting terrorists ready to hang GOP TheDemocrats Mike_Pence 
His speech readily to offered disinfectant as COVID vaccine
His speech was so TOXIN over 520000 Americans drop dead
A liar A loser A womanizer &amp;circus joker",1356494984619327488,AnthSald,,133,13,,False,False,3300,,,0,0,0.4,0.18,positive
2021-03-12 01:27:56,1370184753740189698,"aubrey_huff JoeBiden If we needed a vaccine a few things would be happening.

1. Ambulances would be non-stop blaring down every fucking street in America
2. We would all know numerous people who have died from covid first-hand
3. Vaccine would not need to be constantly promoted and marketed",952277613258690561,commoncentsduud,,148,3237,,False,False,568,,,1,23,0.4044444444444445,-0.19111111111111112,negative
2021-03-12 01:27:56,1370184751936638976,danieteebee: It’s completely predictably American that the brand of COVID vaccine you have access to has now become a class signifier,555435475,keeli_d,Everywhere 💜,552,111008,,False,False,31477,,,10178,0,0.0,0.0,neutral
2021-03-12 01:27:55,1370184750023970817,"It's widely known that the second dose of the COVID-19 vaccines tend to come with more side effects than the first, including tiredness, headaches, chills, fever, nausea and muscle pain. Why is that?
",15844989,WDVMTV,"MD, WV, VA, DC",20286,5142,,True,True,76557,,,0,0,0.30833333333333335,0.1625,positive
2021-03-12 01:27:55,1370184749982093314,verge: Biden: ‘all American adults will be eligible to get a vaccine no later than May 1st’  ,290503090,ValiiCuca,Montenegro,195,40603,,True,False,12963,,,31,0,0.0,0.0,neutral
2021-03-12 01:27:55,1370184749969457157,"“I hope everyone remembers when they're getting the COVID-19 [often referred to as the China Virus] Vaccine, that if I wasn’t President, you wouldn’t be getting that beautiful 'shot' for 5 years, at best, &amp; probably wouldn't be getting it at all. I hope everyone remembers!"" ",289031581,WandaHaynes,"Ragland, AL",3055,327180,,True,False,229208,,,0,0,0.65,0.925,positive
2021-03-12 01:27:55,1370184749709414400,"As the nation focuses on the COVID-19 vaccine, there is another vaccine doctors want you to get, especially if you’re over 55.
",344171667,KAMCNews,"Lubbock, Texas",8720,131,,False,True,66485,,,0,0,1.0,0.0,neutral
2021-03-12 01:27:55,1370184746576314378,21WIRE: SHARE: 'A group of scientists and doctors have issued an open letter calling on the European Medicines Agency (EMA) to answer u…,994363040203202565,Ak83578774,,473,33197,,False,False,10291,,,139,0,0.25,0.0,neutral
2021-03-12 01:27:54,1370184746081296387,"Denmark has temporarily suspended the use of the AstraZeneca coronavirus vaccine after reports of blood clots in some people, but its health authority said Thursday it has no evidence the vaccine was responsible.

",1288653700349571072,AuEpochTimes,Australia,1328,703,,False,False,2181,,,0,0,0.55,0.2,positive
2021-03-12 01:27:54,1370184745116655621,"CBSEveningNews: BREAKING: Pres. Biden is directing all states, tribes and territories to make all U.S. adults aged 18 and older eligibl…",108726910,bkovoDC,"Washington, DC",2196,83017,,True,False,31877,,,21,0,0.3666666666666667,0.033333333333333326,positive
2021-03-12 01:27:54,1370184744378363904,700 COVID-19 vaccine doses are expected to be given out at drive-thru clinic in Douglas County this weekend.  ,156814503,KLCCOregon,"Eugene OR, USA",4829,941,,True,False,9870,,,1,0,0.4,-0.1,negative
2021-03-12 01:27:54,1370184744319791104,"annaalmendrala: This stat is powerful, and shows the dire need for person-to-person outreach for the covid vaccine. Here's a story abou…",177442661,WritePaintDraw,,519,64637,,False,False,43638,,,6,0,1.0,0.3,positive
2021-03-12 01:27:54,1370184744252674049,"cnni: “All adult Americans will be eligible to get a vaccine no later than May 1,"" US President Biden announces. ""...That doesn't mean…",1061607068942114818,waqarm2019,"New York, USA",241,11623,,False,False,30441,,,78,0,0.15,0.05,positive
2021-03-12 01:27:54,1370184744051253252,"Breaking911 So you can’t say it changes your DNA without being labeled misinformation, but that’s not what the chief medical officer of Moderna said in 2017 on TED talk ",458029429,pettyTrader,Commie california,190,6594,,False,False,5019,,,19,42,0.0,0.0,neutral
2021-03-12 01:27:54,1370184742604263426,"thenewsoncnbc: “My fellow Americans, you’re owed nothing less than the truth,” President Biden says in his address to the nation, one y…",20402945,CNBC,"Englewood Cliffs, NJ",4031738,619,,True,True,412021,,,17,0,0.06666666666666667,-0.16666666666666666,negative
