created,id_str,text,user_id,screen_name,location,followers_count,user_favourites_count,time_zone,geo_enabled,verified,status_count,geo,coords,retweet_count,tweet_favourite_count,Subjectivity,Polarity,Sentiment
2021-03-11 17:10:42,1370059620769759245,nyakie_: Eric Omondi na Ezekiel Mutua Recommends the Use of VochaLtd when Recharging Airtime to Any Network via Mpesa.Go to MpesaPB…,1279109385852268545,sacyrono3,🇰🇪,26345,18982,,False,False,44887,,,7,0,0.0,0.0,neutral
2021-03-11 17:10:42,1370059620257964035,aslavitt46: COVID Vaccination Update: 1 in 4 adults in the U.S. have now received their first vaccine.,107772974,rr9281,"West Kelowna, British Columbia",295,331788,,False,False,61178,,,6485,0,0.3333333333333333,0.25,positive
2021-03-11 17:10:42,1370059619154989064,"UPDATE | Russia's SputnikV is the world's safest COVID vaccine, ABC news saysSputnikUpdates ",34262462,SputnikInt,,322239,24,,False,True,155754,,,10,6,0.0,0.0,neutral
2021-03-11 17:10:41,1370059617573560321,Farmworkers have borne the brunt of the pandemic in California: up to 40% of workers tested for the virus had positive results. A landmark effort is now underway across the Coachella Valley to bring the vaccine directly into the fields. nytimes,4100845935,center4goodfood,"Berkeley, CA",1593,428,,True,False,1132,,,0,2,0.4727272727272727,0.16363636363636364,positive
2021-03-11 17:10:41,1370059616445464577,"JoeBrunoWSOC9: CDC, Dollar General exploring partnership to speed up COVID-19 vaccine rollout  ",1207782626666393600,SamGrundman,"Charlotte, NC",169,105207,,True,False,12919,,,5,0,0.5,0.05000000000000002,positive
2021-03-11 17:10:41,1370059616420294656,TheInsiderPaper: NEW 🚨 Paris rejects Covid-19 vaccine passport proposed by Netanyahu that would allow obstacle-free travel between Fran…,202552776,hb9uqx,"Valais, Suisse",190,16870,,False,False,4305,,,53,0,0.45454545454545453,0.13636363636363635,positive
2021-03-11 17:10:41,1370059616197902341,"CNNPolitics: In a new ad campaign, former Presidents Jimmy Carter, Bill Clinton, George W. Bush, Barack Obama and respective former fir…",18204638,MiniPainter65,United States,42,34511,,False,False,22449,,,596,0,0.13863636363636364,0.03409090909090909,positive
2021-03-11 17:10:41,1370059615501758469,"JKNjenga: In the last 24 hours, seven European nations have suspended the Astra Zeneca vaccine that Kenya using because of serious adve…",343379317,itsberyl,"Nairobi, Kenya",1184,18075,,False,False,109826,,,329,0,0.24444444444444444,-0.1111111111111111,negative
2021-03-11 17:10:41,1370059614457372674,"JAWalker: Doug Ford's attack on Sol Mamakwa was a reckless, dangerous undermining of life-saving efforts to roll out the COVID-19 vacci…",3253989290,ChristyCeeCK,Canada,1327,45990,,False,False,19813,,,35,0,0.9,-0.6,negative
2021-03-11 17:10:41,1370059613975023617,MarkMeadows Under Trump daily COVID cases rose to 300K+.  Under Biden  is under 60K.  Biden is fixing gapping holes in vaccine distribution (no Trump plan).Real COVID relief was just passed despite nobody from GOP voting for it.Market reached record highs.  Any more questions?,854706360524701698,Themed_Teams,"New York, USA",722,1560,,False,False,5581,,,0,0,0.48333333333333334,0.3666666666666667,positive
2021-03-11 17:10:40,1370059613131968514,"roccogalatilaw: Denmark. another country, like Austria, to suspend  Astra-Zeneca vaccine due to ""blood-clotting"" which  led to deaths a…",173961916,okibizzle,"Abuja, Nigeria",340,8665,,False,False,1915,,,1501,0,0.375,-0.125,negative
2021-03-11 17:10:40,1370059612960006152,"“We know the light is at the end of the tunnel, but we don’t know how long the tunnel is.” Dr. Steven Sbardella spoke with reporters about the importance of remaining vigilant with COVID-19 safety protocols, even after receiving vaccinations. ",46424522,MWHealthcare_,Boston's Northern Suburbs,1501,367,,False,False,5025,,,0,0,0.55,0.17500000000000002,positive
2021-03-11 17:10:40,1370059611995275267,"rupasubramanya: Denmark,Norway,Austria suspend the use of AstraZeneca vaccine over blood clot fears. In Italy, two young Sicilian polic…",285053357,albert_eci,"Lagos, Nigeria",1131,7747,,True,False,19441,,,103,0,0.4,0.1,positive
2021-03-11 17:10:40,1370059611533889540,kayleighmcenany: FINALLY the Biden admin recognizes the Trump admin’s unprecedented vaccine work:➡️ “We’re grateful for the work that…,365802405,davis924,,104,883,,False,False,2074,,,4662,0,0.95,0.3,positive
2021-03-11 17:10:40,1370059609931718658,spectatorindex: JUST IN: Norway has suspended use of the AstraZeneca coronavirus vaccine,1358665773514899456,NdumisoNgema13,,343,11684,,False,False,3163,,,2566,0,0.0,0.0,neutral
2021-03-11 17:10:39,1370059608782471174,"alastanford: PHILADELPHIA: We are excited to announce in addition to Moderna, we will start administering the one-dose, Johnson &amp; Johns…",25938737,JeniceArmstrong,Philadelphia,8948,20309,,True,True,18380,,,130,0,0.75,0.375,positive
2021-03-11 17:10:39,1370059608434311168,"While none of my friends who got the COVID vaccine have superpowers yet, some have reported improved 5G reception! Looking forward to getting my shot. ",7481882,tonythescribe,Atlanta,3402,4033,,True,False,2900,,,0,0,0.0,0.0,neutral
2021-03-11 17:10:39,1370059607641628684,Roshan_Rinaldi The vaccine was already being worked on before the virus started to spread. Pfizer was working on it yrs before trump. So how is he saying he did that? 🤔,1342735654971703297,Amanda13791686,,79,2216,,False,False,2645,,,0,0,0.0,0.0,neutral
2021-03-11 17:10:39,1370059607016673281,"queenchristina_: ""We decided to accept the kind offer from the Abu Dhabi ruling family."" Yup, the rich are different as Scott Fitzgeral…",1358064322325454849,Philiprichard19,,37,6547,,False,False,4430,,,15,0,0.75,0.325,positive
2021-03-11 17:10:39,1370059606983020545,"NateSilver538: A month ago, the EU and UK had similar rates of COVID cases per capita, and the US was about 30% higher than either one.…",43167604,morganwick,Seattlite in exile in LA,270,6,,True,False,88524,,,145,0,0.45,0.125,positive
2021-03-11 17:10:39,1370059606827864064,quefregados Lazylaredoan have only seen J and J at hospitals so far in Htown. Moderna is available at most pharmacies near me though,1135602362964434944,ElliottScribe,Htown,507,100391,,False,False,41774,,,0,1,0.6599999999999999,0.22000000000000003,positive
2021-03-11 17:10:39,1370059606488141827,"canadá Maj.-Gen. Dany Fortin said today that vaccine supplies have stabilized and the ""ramp up"" phase of the inoculation campaign is in full swing, with some 36.4 million shots now expected to arrive before the end of June canada covid-19vaccin...",897571671657394176,MilenioStadium,"Toronto, Ontario",393,333,,True,False,8041,,,0,0,0.47500000000000003,0.12499999999999999,positive
2021-03-11 17:10:39,1370059606421028866,simondolan: Nothing to see here. Move along. Perfectly safe....Italy and Norway join Denmark in suspending use of AstraZeneca vaccine…,1324720055855308801,simon06641235,,18,20390,,False,False,1095,,,899,0,1.0,1.0,positive
2021-03-11 17:10:39,1370059606341386246,I’m glad that we are starting to look deeper into the Covid-19 vaccinations. Do what’s best for YOU &amp; YOUR FAMILY! Famous people using their platform to push the vaccine just dose not sit well with me. MyOpinion,449520306,mcneal_dd,,495,3304,,False,False,9630,,,0,1,0.6000000000000001,0.5,positive
2021-03-11 17:10:39,1370059605389156359,"CireAmai: All living former Presidents Carter, Clinton, Bush, Obama and their respective former first ladies -- with the exception of t…",1153768783409864704,GOPwillPAY,"Arizona, USA",1914,24202,,False,False,26231,,,8,0,0.10833333333333334,0.0625,positive
2021-03-11 17:10:38,1370059604852281344,"zoo_bear: India Today and the BJP falsely claimed that India is providing COVID vaccines for the lowest cost to its citizens. However,…",109173912,vinayaravind,Chennai,10321,103222,,True,False,99679,,,412,0,0.6,-0.4000000000000001,negative
2021-03-11 17:10:38,1370059604562952193,POTUS: One in four adults in the U.S. has received their first COVID-19 vaccine — and we’re now leading the world in vaccinations.Tha…,15420017,OTTerry,North of the Equator,52,30706,,True,False,24357,,,16530,0,0.3333333333333333,0.25,positive
2021-03-11 17:10:38,1370059603422146562,MichelleObama True that is Michelle- let the world have a positive attitude to COVID-19 vaccine.😇,330975480,mukujc,,46,96,,False,False,20,,,0,0,0.5977272727272727,0.28863636363636364,positive
2021-03-11 17:10:38,1370059602398699522,"roccogalatilaw: Denmark. another country, like Austria, to suspend  Astra-Zeneca vaccine due to ""blood-clotting"" which  led to deaths a…",1338195286188027909,ericjonboerner,,32,1833,,False,False,2000,,,1501,0,0.375,-0.125,negative
2021-03-11 17:10:38,1370059601266286596,PplsAction: Big pharma is creating a scarcity of vaccines to protect their profits threatening millions of lives and trillions of dolla…,191203581,HealthGAP,"New York, NY",4342,4298,,True,False,4851,,,12,0,0.1,0.0,neutral
2021-03-11 17:10:37,1370059599848480770,narendramodi: Happy to share that my mother has taken the first dose of the COVID-19 vaccine today. I urge everyone to help and motivat…,1364124744069439494,mayurpa04719121,,0,57,,False,False,52,,,17142,0,0.6666666666666666,0.525,positive
2021-03-11 17:10:37,1370059599731159045,In The Name Of Father GodAnd My Savior Lord JesusChrist May All WhoContinue Pushing ThisFake Corona Virus HoaxAnd Vaccine Be Bound InThe Void To Burn For AllEternity,1334609087024271364,Lifepathnine,Beyond time and space,135,1283,,False,False,5141,,,0,0,0.0,0.0,neutral
2021-03-11 17:10:37,1370059598653059073,POTUS: One in four adults in the U.S. has received their first COVID-19 vaccine — and we’re now leading the world in vaccinations.Tha…,96444967,billybennight,Los Angeles,544,5773,,True,False,20638,,,16530,0,0.3333333333333333,0.25,positive
2021-03-11 17:10:37,1370059598464421894,Just managed to make a Covid vaccine appointment for Saturday! ,14244018,annemay73,"Pennsylvania, USA",187,9236,,False,False,5453,,,0,11,0.0,0.0,neutral
2021-03-11 17:10:37,1370059598162489348,"morifemme The same thing happened to me with the Moderna vaccine. I just had the guy put it in my dominant arm because that's the one that was nearest to him and I wasn't really concerned about it. He was like ""..... are you sure. most people do the non-dominant."" I should've listened 😅",1228460867404038144,bts_vinyl,United States,138,3744,,False,False,3646,,,0,1,0.4284722222222222,0.3,positive
2021-03-11 17:10:37,1370059597847928832,"GreatGameIndia: THIS IS BIG8 European nations including Italy, Latvia, Luxembourg, Lithuania, Estonia, Denmark, Norway and Iceland ha…",1244547221980405760,RantRighteous,,218,26863,,False,False,8039,,,809,0,0.0,0.0,neutral
2021-03-11 17:10:37,1370059597424246802,"NAACP_LDF: Today, the same disparities we see in COVID19 cases are reflected in the vaccination numbers. In D.C., Black people compris…",186949186,Llama_Strudel,,1912,849948,,False,False,567984,,,11,0,0.2791666666666667,-0.08333333333333333,negative
2021-03-11 17:10:37,1370059597118062598,Is it a good idea to post a picture or video of you getting your coronavirus vaccine on your social media channels? Our experts weigh in: ,21332950,KNPRnews,"Las Vegas, NV",10294,590,,True,False,28767,,,0,1,0.33333333333333337,0.36666666666666664,positive
2021-03-11 17:10:37,1370059597109600256,Coronavirus: Pfizer vaccine 97% effective against severe cases – The Jerusalem Post ,1288584604551647232,HamsonNed,,43,4532,,False,False,11279,,,0,0,0.8,0.6,positive
2021-03-11 17:10:37,1370059597004877830,"MichelleObama: When you can get the COVID-19 vaccine, I hope you do—Barack and I are certainly glad we did. It’s our best shot at beati…",1030581959305703426,fuckcancer56,Red Sox Nation,3958,298739,,False,False,239324,,,8538,0,0.65,0.75,positive
2021-03-11 17:10:36,1370059596434378756,"justinmadders: Todays data-6,753 new cases, highest for 10 days6,975 patients in hospital in England, lowest since 23rd Oct23,053,716…",3125969777,carolejames19,,169,59582,,False,False,24765,,,4,0,0.45454545454545453,0.13636363636363635,positive
2021-03-11 17:10:36,1370059596077891585,danieteebee: It’s completely predictably American that the brand of COVID vaccine you have access to has now become a class signifier,1056369000,lezzie_eddie,"The river Styx, USA",69,29475,,True,False,3436,,,10923,0,0.0,0.0,neutral
2021-03-11 17:10:36,1370059595956162563,"MichelleObama: When you can get the COVID-19 vaccine, I hope you do—Barack and I are certainly glad we did. It’s our best shot at beati…",1004045330780860416,ResidentOregon,"Eugene, OR",81,32215,,False,False,29507,,,8538,0,0.65,0.75,positive
2021-03-11 17:10:36,1370059595880615937,NateSilver538: Several EU countries are temporarily suspending use of the AstraZeneca vaccine (see story below). So it's worth pointing…,43167604,morganwick,Seattlite in exile in LA,270,6,,True,False,88524,,,71,0,0.05,0.15,positive
2021-03-11 17:10:36,1370059594962198536,NYGovCuomo: Vaccination Update: 20.4% of New Yorkers have received at least one vaccine dose and 10.4% have completed their vaccine s…,560821229,BorgheseAmira,NY/CO,1700,30295,,True,False,58573,,,174,0,0.42727272727272725,-0.08181818181818182,negative
2021-03-11 17:10:36,1370059593695559680,mikemchargue Just got the second Pfizer shot Tuesday,337973337,joecro1984,,129,11798,,False,False,12069,,,0,3,0.0,0.0,neutral
2021-03-11 17:10:36,1370059593318072321,Jb1Steve: EU Countries Suspend AstraZeneca Vaccine Over Blood Clot Fears |  ,1109276203771445248,WarriorLadyZ,"Waco, TX",209,12202,,True,False,7981,,,2,0,0.0,0.0,neutral
2021-03-11 17:10:36,1370059593225793540,"OliverMathenge: Kenya has this evening received another 100,000 doses of AstraZeneca Covid-19 Vaccine as a donation by the Indian Gover…",1303137127052578816,Basajjabalaba1,,49,2920,,False,False,2405,,,26,0,0.0,0.0,neutral
2021-03-11 17:10:36,1370059592684732418,suzibitch1: I really want my Covid vaccine but don’t make the age requirement- who else feels the same?  Their saying JULY😥,327022004,GeminijlwWilson,"Harrisburg, Pa",3209,134242,,False,False,284991,,,2,0,0.1625,0.1,positive
2021-03-11 17:10:36,1370059592642740228,2still_learning: RealJoelSmalley Here's one..,371376316,deeugbug,,178,40848,,True,False,19466,,,14,0,0.0,0.0,neutral
2021-03-11 17:10:35,1370059591967461380,michael_galant: 130 countries have yet to receive a single dose of Covid vaccine — that’s global health apartheid. And it’s a political…,3092520167,calebloschiavo,occupied Lenape land,1385,141974,,True,False,13817,,,158,0,0.10714285714285714,-0.03571428571428571,negative
2021-03-11 17:10:35,1370059591669714946,"JajaPhD: This is the Covid-19 vaccine that should be going to front line health workers and those who are the most vulnerable, ba?",232668399,Kemaaayyyy,The Feminist Coven ,11965,6201,,True,False,544329,,,1210,0,0.5,0.0,neutral
2021-03-11 17:10:35,1370059590595907585,ansa_english: Italian serviceman dies after taking AstraZeneca COVID19  vaccine.Italian medicines agency AIFA has stopped jabs from…,1459430522,ChristianGerde2,Milano,468,36,,True,False,76404,,,2,0,0.0,0.0,neutral
2021-03-11 17:10:35,1370059589626982407,MikeDelMoro: New: Pfizer says that real world data out of Israel shows its vaccine effectiveness is 97% in preventing symptomatic disea…,401015098,MondeeRedman,"Burnaby, BC Canada",3086,73114,,False,False,147516,,,595,0,0.3772727272727273,0.16818181818181818,positive
2021-03-11 17:10:35,1370059589543137285,kayleighmcenany: FINALLY the Biden admin recognizes the Trump admin’s unprecedented vaccine work:➡️ “We’re grateful for the work that…,1047986390624026624,Mcbain5422,,27,30666,,False,False,4529,,,4662,0,0.95,0.3,positive
2021-03-11 17:10:35,1370059588612018176,"B52Malmet And then got his vaccine 🤬 all the while encouraging his supporters that Covid-19 was a hoax or the ""flu"" in which ""strength"" could get you through.",7976502,ClaudiaC,Denver,8987,97205,,False,False,90182,,,3,7,0.0,0.0,neutral
2021-03-11 17:10:34,1370059588293308419,The latest Covid-19 vaccine and world news ,891382950436229120,ExBulletinUk,UK,225,216,,False,False,371273,,,0,0,0.9,0.5,positive
2021-03-11 17:10:34,1370059588112945152,danieteebee: It’s completely predictably American that the brand of COVID vaccine you have access to has now become a class signifier,706989400627027969,Anaaa_27,In luv,258,6021,,True,False,3077,,,10923,0,0.0,0.0,neutral
2021-03-11 17:10:34,1370059586615533570,"NET Health postponing Moderna second-dose clinic 'due to no vaccine':   -- NET Health schedules immunization appointments based on COVID vaccine supplies. On Wednesday, the entity announced anyone expecting to receive round two of the Moderna vaccine thi...",91120560,KTBBRadio,"Tyler, Texas",1768,4,,True,False,194306,,,0,0,0.19375,-0.08125,negative
2021-03-11 17:10:34,1370059586431021062,P4AD_: J&amp;J execs want us to think they’re working for the good of the people –– but the company’s CEO just took home $29.6M in 2020 tha…,121951847,JacquieNicole1,Iowa,74,2439,,False,False,530,,,5,0,0.6000000000000001,0.7,positive
2021-03-11 17:10:34,1370059586376499214,NYGovCuomo: Vaccination Update: 20.4% of New Yorkers have received at least one vaccine dose and 10.4% have completed their vaccine s…,9343172,acidflask,New York 🇺🇸🗽·Singapore 🇸🇬,2594,16385,,True,False,14744,,,174,0,0.42727272727272725,-0.08181818181818182,negative
2021-03-11 17:10:34,1370059586275786761,mariamainmo: Girls don't want boys. They want the covid vaccine and a nice apartment,1138693363,shira_porter,"Bridgewater, MA",339,9372,,True,False,2099,,,25405,0,1.0,0.6,positive
2021-03-11 17:10:34,1370059586225463305,Had my 1st Covid shot this morning.  Moderna.,3071040496,authorMsBev,,21716,65599,,False,True,31405,,,8,1555,0.0,0.0,neutral
2021-03-11 17:10:34,1370059584560332804,"BarackObama: Michelle and I got vaccinated against COVID-19 because we know it’s the best way to beat this pandemic, protect one anothe…",3292771226,djadler12,"New York, NY",71,35625,,False,False,4716,,,10666,0,0.3,1.0,positive
2021-03-11 17:10:34,1370059584539344898,trtworld: World Trade Organization considers a proposal by India and South Africa to temporarily waive patents for Covid-19 vaccines as…,42395978,wainepat,,147,1015,,False,False,4044,,,5,0,0.0,0.0,neutral
2021-03-11 17:10:33,1370059583893344256,rebelawyer: Do the British thank their queen for the Oxford vaccine?Do the Americans or Germans thank their President or Chancellor fo…,1313387337720635392,pranav_whatever,,18,194,,False,False,207,,,523,0,0.0,0.0,neutral
2021-03-11 17:10:33,1370059583532716035,"BusinessInsider: There’s no evidence that AstraZeneca’s vaccine causes blood clots, and experts say any risks are outweighed by the sho…",391706347,AmadouBah7,Conakry,1564,237782,,False,False,45536,,,26,0,0.0,0.0,neutral
2021-03-11 17:10:33,1370059582131859462,"What to expect before and after getting a COVID-19 vaccine, an illustrated guide  ",100806469,HAL9000r,"Cape Horn, Chile",282,8086,,False,False,51548,,,0,0,0.0,0.0,neutral
2021-03-11 17:10:33,1370059581167112195,"mentallyfinish My gma got Pfizer and a close friend got another one (in EC) and the symptoms were pretty similar. Fever, lethargy, minor joint pains and aches at varying degrees after each shot (gma got both shots).... It passed after a few days. Friend was knocked out same day, improved after",363235865,ThisisKadz,Jamaica,1669,117833,,True,False,173036,,,0,1,0.365,0.0,neutral
2021-03-11 17:10:33,1370059581062266880,"MichelleObama: When you can get the COVID-19 vaccine, I hope you do—Barack and I are certainly glad we did. It’s our best shot at beati…",3086876396,addie_1122,New York State,6764,181474,,False,False,65836,,,8538,0,0.65,0.75,positive
2021-03-11 17:10:33,1370059580449951744,"Jaykiluu: Europa league kibao, purchase airtime from VochaLtd and stay updated.✅Go to M-pesa✅Paybill no 505082✅A/c no your phone nu…",1279109385852268545,sacyrono3,🇰🇪,26345,18982,,False,False,44887,,,68,0,0.0,0.0,neutral
2021-03-11 17:10:32,1370059579392983042,"MichelleObama: When you can get the COVID-19 vaccine, I hope you do—Barack and I are certainly glad we did. It’s our best shot at beati…",846415250891026433,KarenGuffey3,,328,280497,,False,False,86579,,,8538,0,0.65,0.75,positive
2021-03-11 17:10:32,1370059577618616320,MaritsaNBCMT: MISSOULA CO: Appointments still available for COVID-19 clinics tomorrow and Sunday! And look at this! An option of which…,340973441,LawrenceNelson1,Montana,139,6639,,False,False,1063,,,15,0,0.4,0.625,positive
2021-03-11 17:10:31,1370059575278325770,"MBWarner8 Also, I had the Moderna shot.",172857211,likefrostwild,Kansas,586,5353,,True,False,15716,,,0,1,0.0,0.0,neutral
2021-03-11 17:10:31,1370059575274008576,"alfonslopeztena: With Trump gone, QAnon groups seethe with covid denialism and vaccine misinformation The ideology’s followers have rec…",197816199,cruthfd,"Orange County, CA",423,64830,,False,False,21220,,,28,0,0.0,0.0,neutral
2021-03-11 17:10:31,1370059575018291208,POTUS: One in four adults in the U.S. has received their first COVID-19 vaccine — and we’re now leading the world in vaccinations.Tha…,23239760,OfficialQSF,"Miami, FL",238,5520,,True,False,10241,,,16530,0,0.3333333333333333,0.25,positive
2021-03-11 17:10:31,1370059574577819654,"CTwatville tshitla SylviaDeeDee Covid-19: Pfizer BioNTech vaccine reduced cases by 94% in Israel, shows peer reviewed study | The BMJ ",1193723230512545794,ByronHsu2,"California, USA",192,18930,,False,False,8371,,,0,0,0.0,0.0,neutral
2021-03-11 17:10:31,1370059572677808129,POTUS: One in four adults in the U.S. has received their first COVID-19 vaccine — and we’re now leading the world in vaccinations.Tha…,2925202255,s_mcleanORST,,43,4843,,True,False,735,,,16530,0,0.3333333333333333,0.25,positive
2021-03-11 17:10:30,1370059571520274439,POTUS I got my first Pfizer vaccine...Thank You POTUS!!!,1360946951454404615,JoleneJoleneee1,hot springs ar,105,12538,,False,False,5294,,,0,0,0.3333333333333333,0.48828125,positive
2021-03-11 17:10:30,1370059571398471680,narendramodi: Happy to share that my mother has taken the first dose of the COVID-19 vaccine today. I urge everyone to help and motivat…,1124406849527341057,Tothepoint_Ns,India,27,4511,,False,False,1743,,,17142,0,0.6666666666666666,0.525,positive
2021-03-11 17:10:30,1370059570547208194,kayleighmcenany: FINALLY the Biden admin recognizes the Trump admin’s unprecedented vaccine work:➡️ “We’re grateful for the work that…,983952144,pmd2500,United States,1307,102925,,False,False,38832,,,4662,0,0.95,0.3,positive
2021-03-11 17:10:30,1370059570224189445,"Covid Vaccine 1 Done!So grateful to have this today!Thank you! POTUS and VP coronavirus COVID COVID19 vaccinated It is so ez!  Efficient!  Getting 8,000 people a day done!",843606578,healthcareicare,,6859,138893,,True,False,176486,,,0,0,0.0,0.0,neutral
2021-03-11 17:10:30,1370059567644676103,"dlh2409: BillKristol “The truth is that Pfizer didn’t receive any development funding from Operation Warp Speed. Rather, its partner,…",1271507028662521856,JimBrya68704905,,1500,152308,,False,False,118189,,,60,0,0.0,0.0,neutral
2021-03-11 17:10:29,1370059567023980544,grammadeb196: The human experimental jab 💉💉💉is a concern inanother country..⤵️✅⤵️✅⤵️,930446426085081089,2017rockwood,"Toronto, Ontario",275,18448,,False,False,8525,,,1,0,0.25,0.05,positive
2021-03-11 17:10:29,1370059566629548040,"AmyMek: AstraZeneca was proved to be dangerous yet countries throughout Europe pushed it on citizensMeanwhile, a famous German doctor…",4358014033,VijayPandita8,"Indore, India",284,35731,,True,False,15503,,,111,0,0.6333333333333333,-0.033333333333333326,negative
2021-03-11 17:10:29,1370059565794959363,rebelawyer: Do the British thank their queen for the Oxford vaccine?Do the Americans or Germans thank their President or Chancellor fo…,1000067625727094784,DrajayBrar,,65,59814,,False,False,38983,,,523,0,0.0,0.0,neutral
2021-03-11 17:10:29,1370059565295939588,"MichelleObama: When you can get the COVID-19 vaccine, I hope you do—Barack and I are certainly glad we did. It’s our best shot at beati…",857640878432800768,Amos82885532,Western Cape,129,414,,False,False,444,,,8538,0,0.65,0.75,positive
2021-03-11 17:10:29,1370059565040070658,"FinancialTimes: Denmark, Norway and Iceland have suspended use of the Oxford/AstraZeneca vaccine in a 'precautionary' move after a Dani…",456679532,IamMungi,Rubaga,3704,70443,,True,False,102962,,,329,0,0.0,0.0,neutral
2021-03-11 17:10:28,1370059562804477955,"BarackObama: Michelle and I got vaccinated against COVID-19 because we know it’s the best way to beat this pandemic, protect one anothe…",231180803,viragoh,"Durban, South Africa",229,3568,,True,False,4428,,,10666,0,0.3,1.0,positive
2021-03-11 17:10:28,1370059562523430916,lucaswconrad debbie2328 JustinTrudeau Don’t want Astra Zeneca rejected but other countries for blood clots,1301668151374028800,justbeachy200,,2887,34601,,False,False,4757,,,0,0,0.375,-0.125,negative
2021-03-11 17:10:28,1370059561642655752,"WhoopiGoldberg JoyVBehar sunny sarahaines MeghanMcCain TheView This information is disturbing. In an effort to resume normalcy in America, are there high-profile, influential ""Republicans"" willing to assist w/this issue via precept and example?",468998639,jaydeebgs,In the Moment ,33,4485,,False,False,2541,,,3,1,0.775,-0.125,negative
2021-03-11 17:10:28,1370059561533603845,"ladailynews: Kiss frontman Paul Stanley talks COVID-19 vaccine, R&amp;B classics on new Soul Station album  ",1303329814196170755,EveLyn97415,,1,4884,,False,False,197,,,1,0,0.45454545454545453,0.13636363636363635,positive
