created,id_str,text,user_id,screen_name,location,followers_count,user_favourites_count,time_zone,geo_enabled,verified,status_count,geo,coords,retweet_count,tweet_favourite_count,Subjectivity,Polarity,Sentiment
2021-03-11 17:11:31,1370059826743668736,COVID-19: European Union approves Johnson &amp; Johnson's single-shot coronavirus vaccine ,340825754,millerman14,Where I need to be!,25279,14541,,True,False,164818,,,0,0,0.0,0.0,neutral
2021-03-11 17:11:31,1370059826261327872,kayleighmcenany: FINALLY the Biden admin recognizes the Trump admin’s unprecedented vaccine work:➡️ “We’re grateful for the work that…,1195436131623591937,BenDIsrael1,Yerushalayim,286,37685,,False,False,32377,,,4662,0,0.95,0.3,positive
2021-03-11 17:11:31,1370059824818499586,ClareCraigPath: And 8 countries have today suspended use of AstraZeneca vaccine pending investigation that it is causing clots which ca…,1338842369215623172,MB12Germany,,104,5526,,False,False,3505,,,223,0,0.0,0.0,neutral
2021-03-11 17:11:31,1370059824071897089,POTUS: One in four adults in the U.S. has received their first COVID-19 vaccine — and we’re now leading the world in vaccinations.Tha…,22968743,treestarbugbug,Maryland....USA,40,11595,,False,False,10739,,,16530,0,0.3333333333333333,0.25,positive
2021-03-11 17:11:31,1370059823723769862,"chosensomto: Please how many doctors serving at the frontlines, have received the covid-19 vaccine?The dangers of a nepotistic regime;…",251033565,ehigiejatto,Nigeria,1353,107340,,False,False,105648,,,58,0,0.5,0.5,positive
2021-03-11 17:11:30,1370059823178514440,Scots staying in other parts of UK will not miss out on covid vaccine.,19858587,janekbradley,Edinburgh,2000,1481,,True,True,2896,,,0,0,0.375,-0.125,negative
2021-03-11 17:11:30,1370059822838730754,"GovernorObaseki: Edo receives 81,080 doses of AstraZeneca COVID-19 vaccine ",178039684,Williamhaving,One tweet away,1276,54095,,True,False,11270,,,29,0,0.0,0.0,neutral
2021-03-11 17:11:30,1370059821165256712,POTUS: One in four adults in the U.S. has received their first COVID-19 vaccine — and we’re now leading the world in vaccinations.Tha…,412822556,sionedkay,,624,8510,,True,False,6981,,,16530,0,0.3333333333333333,0.25,positive
2021-03-11 17:11:30,1370059821114867716,VACCINE TEAM: Governor Sisolak will receive a COVID-19 vaccine alongside grocery store workers in Las Vegas later today.  ,16568530,KTVN,"Reno, Nevada",50663,1399,,True,False,96932,,,2,6,0.0,0.0,neutral
2021-03-11 17:11:30,1370059820750012420,NYGovCuomo: Vaccination Update: 20.4% of New Yorkers have received at least one vaccine dose and 10.4% have completed their vaccine s…,3183839182,OJSHEP,,102,1109,,True,False,1658,,,174,0,0.42727272727272725,-0.08181818181818182,negative
2021-03-11 17:11:30,1370059820565360640,carletonjtysick: Six European countries have now halted use of Astrazeneca vaccine. We just started using it.,803371842266431488,stad_jo,,1225,61797,,True,False,78316,,,255,0,0.0,0.0,neutral
2021-03-11 17:11:30,1370059820460515330,danieteebee: It’s completely predictably American that the brand of COVID vaccine you have access to has now become a class signifier,103906710,lvparkman,"San Francisco, CA",1304,6183,,True,False,27508,,,10923,0,0.0,0.0,neutral
2021-03-11 17:11:30,1370059820187848709,NYDailyNews: JUST IN | Sen. Schumer announced a new “super-charged” $32 billion push to get more COVID vaccines to New Yorkers quicker.…,2825211861,lapham923,,401,62613,,True,False,49961,,,61,0,0.4696969696969697,0.25757575757575757,positive
2021-03-11 17:11:30,1370059820116684802,richu_jay: Make your skin glow using DISAAR CREAM AND SERUM ENRICHED WITH SUNFLOWER OILS♨️Removes dark spots♨️Balances skin tones♨️M…,755207172,Mkaguu,"Nairobi, Kenya",4161,18697,,True,False,75687,,,129,0,0.4,-0.15,negative
2021-03-11 17:11:30,1370059819214897157,"Tea__light: It's almost end term, do you that you can send parents a message to alert them about school reopening dates, fees balance &amp;…",945919421599703041,its__risah,"Nyeri, Kenya",6740,28858,,False,False,14280,,,23,0,0.0,0.0,neutral
2021-03-11 17:11:29,1370059818510209027,spectatorindex: CORONAVIRUS: Denmark has temporarily suspended the AstraZeneca coronavirus vaccine as a precautionary measure due to ca…,1140468637,sala_asante,"SA, Free State",240,3220,,False,False,8790,,,3014,0,0.375,-0.125,negative
2021-03-11 17:11:29,1370059817713287168,"chosensomto: Please how many doctors serving at the frontlines, have received the covid-19 vaccine?The dangers of a nepotistic regime;…",99524769,feyiwonder,"Lagos,Nigeria",2616,10977,,True,False,105785,,,58,0,0.5,0.5,positive
2021-03-11 17:11:29,1370059817629458433,GreatGameIndia: A 65-year-old man in India collapsed and passed away just five minutes after getting first dose of vaccine against covi…,1305959081618931713,ryk_sr,Ver weg van de hel Amsterdam,116,118,,False,False,1541,,,196,0,0.3333333333333333,0.25,positive
2021-03-11 17:11:29,1370059817369358338,danieteebee: It’s completely predictably American that the brand of COVID vaccine you have access to has now become a class signifier,1278382632427048962,bethanycqlh,"Edmond, OK",21,21960,,False,False,1233,,,10923,0,0.0,0.0,neutral
2021-03-11 17:11:29,1370059815649734658,"SputnikInt: UPDATE | Russia's SputnikV is the world's safest COVID vaccine, ABC news saysSputnikUpdates ",829028277935288320,Jnrputin,ANONYMOUS,225,3964,,False,False,12468,,,10,0,0.0,0.0,neutral
2021-03-11 17:11:28,1370059814689243137,kayleighmcenany: FINALLY the Biden admin recognizes the Trump admin’s unprecedented vaccine work:➡️ “We’re grateful for the work that…,738918278836461568,AnthonyMcConn20,,178,20263,,True,False,8693,,,4662,0,0.95,0.3,positive
2021-03-11 17:11:28,1370059814546587654,"BusinessInsider: The CDC is reportedly eyeing a 'promising' partnership with Dollar General to bring vaccines to rural communities, and…",7934772,soulgranger,omaha🌽,652,5850,,True,False,26527,,,10,0,0.3333333333333333,0.08333333333333333,positive
2021-03-11 17:11:28,1370059814253047816,"PseudoTaxPro: ProjectLincoln Who's gonna tell him that:1) Pfizer, the first vaccine to be approved by FDA, had nothing to do with War…",1271507028662521856,JimBrya68704905,,1500,152308,,False,False,118189,,,5,0,0.3333333333333333,0.25,positive
2021-03-11 17:11:28,1370059814064287755,"Tea__light: It's almost end term, do you that you can send parents a message to alert them about school reopening dates, fees balance &amp;…",1126396117288214528,brax_beth,Kejani🏘️,11596,75745,,False,False,57818,,,23,0,0.0,0.0,neutral
2021-03-11 17:11:28,1370059813640617990,"MichelleObama: When you can get the COVID-19 vaccine, I hope you do—Barack and I are certainly glad we did. It’s our best shot at beati…",241240457,cpjrecords,Earth'77,498,38637,,False,False,64327,,,8538,0,0.65,0.75,positive
2021-03-11 17:11:28,1370059813401587714,Long line outside of a Shoppers at Danforth/Coxwell offering the AstraZeneca vaccine today to people aged 60 to 64. A spokesperson for Loblaws says the pharmacy will likely run out of vaccines this afternoon. ,2395888880,Mariasarrouh,,481,1880,,True,False,987,,,15,42,0.4625,-0.037500000000000006,negative
2021-03-11 17:11:28,1370059813212758017,narendramodi: Happy to share that my mother has taken the first dose of the COVID-19 vaccine today. I urge everyone to help and motivat…,2409423895,D11p11k11,,1826,38503,,False,False,39829,,,17142,0,0.6666666666666666,0.525,positive
2021-03-11 17:11:28,1370059812227153922,POTUS: One in four adults in the U.S. has received their first COVID-19 vaccine — and we’re now leading the world in vaccinations.Tha…,1171094605682675713,Nadin_without_e,Schweiz,373,45053,,False,False,6818,,,16530,0,0.3333333333333333,0.25,positive
2021-03-11 17:11:28,1370059812113907712,"DHSCgovuk: ""There is no shred of evidence to suggest that the vaccine affects your fertility, either male or female.""Watch Dr Charles…",1288674931,NHSLewishamCCG,London Borough of Lewisham,5762,1586,,True,True,5657,,,129,0,0.13333333333333333,0.0,neutral
2021-03-11 17:11:28,1370059811455442945,Mariasarrouh: A scene from one of the GTA’s very first vaccine clinics in Scarborough. While yesterday some seniors waited for over 2 h…,870811519,maywarren11,"Toronto, Ontario",4094,5538,,True,True,6104,,,22,0,0.43333333333333335,0.325,positive
2021-03-11 17:11:28,1370059811002404864,"ajc: Georgia will expand the eligibility for COVID-19 vaccines on Monday, March 15 to include people 55 and older, in addition to those…",33119023,TPFNewsNow,"Atlanta, GA❤️💚🖤",1522,2193,,True,False,162408,,,3,0,0.3333333333333333,0.16666666666666666,positive
2021-03-11 17:11:27,1370059810587226113,"JAbramsMcLean: ""You said state leaders are telling you they are not distributing the vaccine to majority-Black neighborhoods because th…",16504186,jilspn,New York,1295,294870,,False,False,60297,,,162,0,0.0,0.0,neutral
2021-03-11 17:11:27,1370059810343772168,rochelleriley: DETROIT _ People don't always give Detroit its due. But after having so many people tell me directly how proud they are…,15992944,valkayec,"Sacramento Valley, CA",767,227546,,True,False,149714,,,74,0,0.56875,0.31875,positive
2021-03-11 17:11:27,1370059809668661251,BBCWorld: China offers Covid vaccine doses for Olympic and Paralympic athletes ,39534983,simplybotansoap,"Metro Washington, DC USA",3450,50814,,False,False,96329,,,38,0,0.0,0.1,positive
2021-03-11 17:11:27,1370059809429594120,"'He was my everything': Man died from COVID-19 after trying to get vaccine twice, wife says - WISN Milwaukee  via GoogleNews",1323961399,DromVladicZinn,Brookings South Dakota,8580,104249,,False,False,28886,,,0,1,0.0,0.0,neutral
2021-03-11 17:11:27,1370059809077166080,NYGovCuomo: Vaccination Update: 20.4% of New Yorkers have received at least one vaccine dose and 10.4% have completed their vaccine s…,322986132,OnlyWhiteTiger,New York,22236,434816,,False,False,306411,,,174,0,0.42727272727272725,-0.08181818181818182,negative
2021-03-11 17:11:27,1370059808456339456,davidkurten: Seven European countries suspend use of Astra Zeneca Covid vaccine after blood clot deaths.I will not be taking a 'Covid…,1245527198267633664,Terramo63148721,Tucson,193,20233,,False,False,14035,,,854,0,0.0,0.0,neutral
2021-03-11 17:11:27,1370059808322293762,tylerwatt90: Canada to receive 36.5 million vaccines by July including 25 million vaccines from Pfizer and Moderna between April and Ju…,373460084,christmasali,North America,2100,198740,,False,False,70679,,,54,0,0.0,0.0,neutral
2021-03-11 17:11:27,1370059807357566982,"JuddLegum: JohnKavanagh_AZ 3. Kavanaugh, who apparently believes its his job to ensure that ""uninformed"" people do not vote is support…",792164346688176129,92lovesyou,WINTER,284,90099,,False,False,100085,,,596,0,0.35,0.05,positive
2021-03-11 17:11:26,1370059806048915459,"SandraWeeden: Oxford/AstraZeneca suspended.Denmark joins five other countries - Austria, Estonia, Lithuania, Luxembourg and Latvia -…",1351779406369456130,MediaSeph,,68,94,,False,False,49,,,798,0,0.375,-0.125,negative
2021-03-11 17:11:26,1370059804769665031,Latest COVID-19 vaccine JanssenEMEA JNJNews  based on technology tested for safety &amp; immunogenicity in IMI_JU Ebola projects:  EFPIA,3066034721,kuiper_em,"Brussels, Belgium",1907,4428,,True,False,7544,,,0,0,0.9,0.5,positive
2021-03-11 17:11:26,1370059804631314440,ABC7NY: Denmark pauses AstraZeneca COVID-19 vaccine to probe reports of blood clots  ,1250155992,mma718,,1036,67376,,False,False,37994,,,7,0,0.0,0.0,neutral
2021-03-11 17:11:26,1370059804597755904,ildandy_: HOW IT STARTED vs HOW IT'S GOING VaccinoAiGiornalisti AstraZeneca 👻 ,2377494538,queequeg1901,Labirinto di Ts'ui Pên,1729,112861,,True,False,37867,,,46,0,0.0,0.0,neutral
2021-03-11 17:11:25,1370059801875509251,"Engr_Smith5 I think the side effects are different for some people. A good friend of mine had the single-dose Janssen vaccine and had absolutely no side effects. I’ve heard other people who get the Pfizer vaccine they have very few side effects. Bottom line, get vaccinated when you can.",2254884070,hobbs_jan13,Third Planet Out,4239,15677,,False,False,36414,,,0,1,0.521,0.043,positive
2021-03-11 17:11:25,1370059801854676993,"frontlineaids: The COVID-19 pandemic and its effects pose major threats to the goal of ending AIDS. Learning from our own history, we…",19177501,UNAIDS,"Geneva, Switzerland",280279,4411,,False,True,17717,,,10,0,0.75,0.33125,positive
2021-03-11 17:11:25,1370059801045139462,POTUS: One in four adults in the U.S. has received their first COVID-19 vaccine — and we’re now leading the world in vaccinations.Tha…,35386492,Ligtstar,"TN, USA",11084,33190,,False,False,135052,,,16530,0,0.3333333333333333,0.25,positive
2021-03-11 17:11:25,1370059799635841028,GaIatasarayli: spectatorindex My neighbour is literally in the hospital now a few days after he took Astrazeneca vaccine. He was healt…,456679532,IamMungi,Rubaga,3704,70443,,True,False,102962,,,45,0,0.1,-0.2,negative
2021-03-11 17:11:25,1370059798939635713,"paulmor21190726: Fine Gael EU negotiations succeeded in Ireland getting 1% of pFizer vaccines, 1% of COVID19 recovery fund but 42% of…",33185029,LuccketiMandy,"Derry City, Ireland",1475,149663,,True,False,206001,,,40,0,0.5,0.4166666666666667,positive
2021-03-11 17:11:24,1370059797937152008,Bloomberg: Johnson &amp; Johnson’s Covid Vaccine Cleared by EU Regulator.via GoogleNews,183676674,JHillport,,1066,325203,,False,False,80799,,,0,0,0.0,0.0,neutral
2021-03-11 17:11:24,1370059797698056196,"iainnicol is a no brainer, the huge scientific celebration is because pfizer and moderna took a new tech and elevated it. mRNA vaccines have been stagnant in development for over a decade because no one wanted to pay to develop them because ebola/SARS1 became unprofitable to develop for.",17234202,curexcomplex,"Utica, NY",8172,51314,,False,False,158146,,,0,2,0.6772727272727272,0.2681818181818182,positive
2021-03-11 17:11:24,1370059797576491019,SputnikInt: MORE | Iceland suspends use of AstraZeneca COVID vaccineSputnikUpdates ,829028277935288320,Jnrputin,ANONYMOUS,225,3964,,False,False,12468,,,4,0,0.5,0.5,positive
2021-03-11 17:11:24,1370059796649549825,POTUS: One in four adults in the U.S. has received their first COVID-19 vaccine — and we’re now leading the world in vaccinations.Tha…,30111756,Goddess8008,"Kansas City, MO",1242,179401,,False,False,57823,,,16530,0,0.3333333333333333,0.25,positive
2021-03-11 17:11:24,1370059795709972480,"GovPhilScott: If you're eligible, sign up today at  OurShotVT",1112747337796014080,NewsTalkWVMT,,184,434,,True,False,1516,,,18,0,0.0,0.0,neutral
2021-03-11 17:11:24,1370059795126874112,"MichelleObama: When you can get the COVID-19 vaccine, I hope you do—Barack and I are certainly glad we did. It’s our best shot at beati…",1127744748532273152,YR22132120,,32,29080,,False,False,8384,,,8538,0,0.65,0.75,positive
2021-03-11 17:11:24,1370059794845990916,"washingtonpost: Alaska makes vaccines available to those 16 and older, becoming first state to remove eligibility requirements ",18951898,blondevalgal,"Lexington, Kentucky",68,11638,,False,False,3763,,,157,0,0.4791666666666667,0.31666666666666665,positive
2021-03-11 17:11:24,1370059794011336715,NYGovCuomo: Vaccination Update: 20.4% of New Yorkers have received at least one vaccine dose and 10.4% have completed their vaccine s…,2882500278,Effiuziel,"New York, USA",401,81315,,True,False,12223,,,174,0,0.42727272727272725,-0.08181818181818182,negative
2021-03-11 17:11:23,1370059793461866503,Several European countries suspend AstraZeneca vaccinations over blood clot fears ,1109532876310302721,donkamion78,,16784,158905,,False,False,112571,,,173,233,0.0,0.0,neutral
2021-03-11 17:11:23,1370059793138917376,"wwwbighag: A year of the pandemic: Sorrow, stamina, defiance, despair  / A yr in which Trump quickly addressed t…",702495288364118017,FritzLoren,the heart of it all! Ohio ,2143,14979,,False,False,55292,,,2,0,0.5,0.3333333333333333,positive
2021-03-11 17:11:23,1370059792639791107,"ruthmkb: So apparently if you are currently 64, but will be turning 65 in 2021, you are NOT eligible for the AstraZeneca vaccine. Can…",734791975,deb2_debra,"Québec, Canada",989,64778,,False,False,79843,,,14,0,0.375,0.025,positive
2021-03-11 17:11:23,1370059792186802187,spectatorindex: JUST IN: Norway has suspended use of the AstraZeneca coronavirus vaccine,606130960,Candi_AppleRed1,,516,2655,,False,False,60841,,,2566,0,0.0,0.0,neutral
2021-03-11 17:11:23,1370059791398227970,richu_jay: Make your skin glow using DISAAR CREAM AND SERUM ENRICHED WITH SUNFLOWER OILS♨️Removes dark spots♨️Balances skin tones♨️M…,1332976030705967105,martohbilly,"Nairobi, Kenya",2157,6935,,False,False,5033,,,129,0,0.4,-0.15,negative
2021-03-11 17:11:23,1370059791230451715,POTUS: One in four adults in the U.S. has received their first COVID-19 vaccine — and we’re now leading the world in vaccinations.Tha…,242307379,dxywer,,196,42439,,True,False,15966,,,16530,0,0.3333333333333333,0.25,positive
2021-03-11 17:11:23,1370059790190280706,NYGovCuomo: Vaccination Update: 20.4% of New Yorkers have received at least one vaccine dose and 10.4% have completed their vaccine s…,1097969983143985159,PaweSzulc14,Polska,15,3237,,True,False,3409,,,174,0,0.42727272727272725,-0.08181818181818182,negative
2021-03-11 17:11:23,1370059789796007945,stellabystarlit me 2GF gets 2nd pfizer in about a week,1309262172728553474,DocBass4,,3802,60589,,False,False,16900,,,0,0,0.0,0.0,neutral
2021-03-11 17:11:22,1370059789032652807,kayleighmcenany: FINALLY the Biden admin recognizes the Trump admin’s unprecedented vaccine work:➡️ “We’re grateful for the work that…,873799677560459264,JohnWT263,,1044,49706,,False,False,50622,,,4662,0,0.95,0.3,positive
2021-03-11 17:11:22,1370059788139249675,NYGovCuomo: Vaccination Update: 20.4% of New Yorkers have received at least one vaccine dose and 10.4% have completed their vaccine s…,2815794381,NYGov,New York State,32131,3356,,True,True,7671,,,174,0,0.42727272727272725,-0.08181818181818182,negative
2021-03-11 17:11:22,1370059787820396544,MaDKiIlZz areyoureal2019 jjhorgan The Prime Minister doesn't order the vaccines.  And there were very well documented reasons for why Pfizer felt short on delivery for a few weeks but is now up to speed.  Assuming the delays are because someone didn't order enough is just ignorant.  That's not how things work.,634969204,Enigmius1,,47,132,,False,False,1640,,,0,1,0.3,0.0,neutral
2021-03-11 17:11:22,1370059787753373701,J&amp;J’s Single-Dose Covid-19 Vaccine Approved by EU Drug Regulator – The Wall Street Journal ,1228505856657981441,AdFreeTalkRadio,,1652,706,,False,False,280632,,,0,0,0.0,0.0,neutral
2021-03-11 17:11:22,1370059787547897859,"MichelleObama: When you can get the COVID-19 vaccine, I hope you do—Barack and I are certainly glad we did. It’s our best shot at beati…",615192377,mommamoy,,26,22204,,False,False,8646,,,8538,0,0.65,0.75,positive
2021-03-11 17:11:22,1370059787514298371,"SharonPascoe123: A unique, incredible opportunity to hear first hand from an inspirational scientific researcher at the forefront of th…",986537883212374017,FPSSwanseaCity,,90,290,,False,False,322,,,6,0,0.8083333333333333,0.50625,positive
2021-03-11 17:11:22,1370059787413684230,Bridget_Otoo: ItalyNorwayDenmarkhave all suspended the use of AstraZeneca COVID19 vaccine,1316981596063436800,Collinscottbery,your area,200,5031,,False,False,1534,,,18,0,0.0,0.0,neutral
2021-03-11 17:11:22,1370059787262697488,"alfonslopeztena: With Trump gone, QAnon groups seethe with covid denialism and vaccine misinformation The ideology’s followers have rec…",179215762,MolinariZuzek,"Ohio, USA",894,41419,,False,False,47075,,,28,0,0.0,0.0,neutral
2021-03-11 17:11:21,1370059784725073922,POTUS: One in four adults in the U.S. has received their first COVID-19 vaccine — and we’re now leading the world in vaccinations.Tha…,1140679033,RICARDOCASESG,,1547,49927,,False,False,67487,,,16530,0,0.3333333333333333,0.25,positive
2021-03-11 17:11:21,1370059784108584970,We stand united with ThisIsOurShot in building vaccine trust and combating misinformation about COVID-19 vaccines. ✊ThisIsOurShot to end this pandemic.Learn more at   VacunateYa ,89290775,LMSA_National,United States,5954,4769,,True,False,6929,,,1,3,0.5,0.5,positive
2021-03-11 17:11:21,1370059783735287834,Michelle Obama Shares She Got the COVID-19 Vaccine With an Inspiring Video ,3319757930,amarich7,Germany,77,1,,False,False,44283,,,0,0,1.0,0.5,positive
2021-03-11 17:11:21,1370059783412330497,"Pfizer Covid vaccine cuts transmission of coronavirus, new real-world study shows – NBC News ",1228505856657981441,AdFreeTalkRadio,,1652,706,,False,False,280632,,,0,0,0.45454545454545453,0.13636363636363635,positive
2021-03-11 17:11:21,1370059782510448640,rishibagree: India has provided over 481 lakh doses of Covid vaccines to various countries till March 4.Out of 481.06 lakh vaccine do…,986902747671707648,praveen_kgl,Annanagar Chennai,184,23513,,False,False,12623,,,241,0,0.5,0.0,neutral
2021-03-11 17:11:21,1370059781935919112,FTC: On Medicare? You don't have to pay to get the COVID19 vaccine. MedicareGov has you covered. Learn more at ,1096878210,SJLSTweets,"Camden, NJ",804,2793,,True,False,6527,,,17,0,0.5,0.5,positive
2021-03-11 17:11:21,1370059781772173314,"jhanjhat: This billboard is in Canada by Hindu Forum Canada.""Thank You India and PM Modi for providing Covid vaccine to Canada""2 mi…",133329755,Nawabs_Of_Amity,"Kanpur, India",15284,18809,,True,False,365071,,,35,0,0.0,0.0,neutral
2021-03-11 17:11:21,1370059781579419648,POTUS: One in four adults in the U.S. has received their first COVID-19 vaccine — and we’re now leading the world in vaccinations.Tha…,2788128034,Lsant727My,,12,11557,,False,False,4305,,,16530,0,0.3333333333333333,0.25,positive
2021-03-11 17:11:20,1370059780807659535,POTUS: One in four adults in the U.S. has received their first COVID-19 vaccine — and we’re now leading the world in vaccinations.Tha…,1218076646546333696,IslandGirlPRV,,34750,213468,,False,False,137273,,,16530,0,0.3333333333333333,0.25,positive
2021-03-11 17:11:20,1370059780157435904,"MalawiUNICEF: Here is what frontline health worker, Monalisa Tembo had to say about receiving the COVID19 vaccine.""I have just been…",24932980,JenniferEMabry,,88,3363,,False,False,3125,,,32,0,0.0,0.0,neutral
2021-03-11 17:11:20,1370059779700367361,POTUS: One in four adults in the U.S. has received their first COVID-19 vaccine — and we’re now leading the world in vaccinations.Tha…,870077752178814977,Kitten27406,"North Carolina, USA",376,114471,,False,False,45597,,,16530,0,0.3333333333333333,0.25,positive
2021-03-11 17:11:20,1370059779230593029,ScrubKingGeoff blowyburrito POTUS Not true. I hate Trump but operation warp speed did fund moderna. It is important to mention though that phiszer developed their vaccine first and warp speed didn’t help them at all. It’s unclear on the amount of research Phizer shared after they confirmed their success,1213126760490913793,whybotherL1,🇨🇦Canada🇨🇦,16,1571,,False,False,1406,,,0,1,0.5976190476190476,0.06785714285714285,positive
2021-03-11 17:11:20,1370059778496598028,"IndianEmbassyTR: Pakistan🇵🇰, the only SAARC country to not seek COVID-19 Vaccine from India, is getting 45 million 🇮🇳 made vaccine Covi…",2522259223,VasanthFocus,Dubai,344,120983,,False,False,6859,,,3062,0,1.0,0.0,neutral
2021-03-11 17:11:20,1370059778156765190,POTUS: One in four adults in the U.S. has received their first COVID-19 vaccine — and we’re now leading the world in vaccinations.Tha…,64619482,ArtTalkHawaii,"Honolulu, HI",2347,110,,False,False,147938,,,16530,0,0.3333333333333333,0.25,positive
2021-03-11 17:11:19,1370059775501856776,danieteebee: It’s completely predictably American that the brand of COVID vaccine you have access to has now become a class signifier,3429242020,lucyrydell,"New Jersey, USA",269,11671,,False,False,33067,,,10923,0,0.0,0.0,neutral
2021-03-11 17:11:19,1370059774713270286,"KizzyPhD: Honored to be the winner the “NextGen Award”, bestowed by The Franklin Institute, an organization that has “predicted” &amp; awar…",14076724,john_lam,"Redmond, WA",4334,6433,,True,False,5550,,,504,0,0.0,0.0,neutral
2021-03-11 17:11:19,1370059773769568261,Denmark suspends use of AstraZeneca Covid vaccine over reports of blood clots – CNBC ,1228505856657981441,AdFreeTalkRadio,,1652,706,,False,False,280632,,,0,0,0.0,0.0,neutral
2021-03-11 17:11:18,1370059772725243914,"meenaharris: Today phenomenalwoman, with ddlovato and HigherHeights, is launching our PRO-VAXXER campaign to help fight misinformati…",1229508599057129472,psycolovatic,"Ceará, Brasil",323,21273,,False,False,1182,,,656,0,0.0,0.0,neutral
2021-03-11 17:11:18,1370059772486164483,"BarackObama: Michelle and I got vaccinated against COVID-19 because we know it’s the best way to beat this pandemic, protect one anothe…",190913752,dannyboi36,"Corpus Christi, TX",242,135,,True,False,26125,,,10666,0,0.3,1.0,positive
2021-03-11 17:11:18,1370059770154131457,"Who cares, right? leannelily18 ",1057538984,drumcodeuk,Covid Hotspot,581,507,,True,False,34773,,,0,0,0.5357142857142857,0.2857142857142857,positive
2021-03-11 17:11:18,1370059769206222848,narendramodi: Happy to share that my mother has taken the first dose of the COVID-19 vaccine today. I urge everyone to help and motivat…,4820693013,ajithrs07,"Dubai, United Arab Emirates",55,27284,,False,False,5574,,,17142,0,0.6666666666666666,0.525,positive
2021-03-11 17:11:18,1370059768937725959,Denmark has suspended AstraZenecas coronavirus vaccine over concerns about blood clots – Business Insider ,1228505856657981441,AdFreeTalkRadio,,1652,706,,False,False,280632,,,0,0,0.0,0.0,neutral
