created,id_str,text,user_id,screen_name,location,followers_count,user_favourites_count,time_zone,geo_enabled,verified,status_count,geo,coords,retweet_count,tweet_favourite_count,Subjectivity,Polarity,Sentiment
2021-03-11 17:12:17,1370060016523304964,JuddLegum: JohnKavanagh_AZ ATT Allstate BCBSAssociation CoxComm WeAreFarmers pfizer UnitedHealthGrp USAA Prudential WellsFar…,62880951,cynthiakiker,North Carolina,4077,223446,,False,False,156066,,,360,0,0.0,0.0,neutral
2021-03-11 17:12:17,1370060016493813761,narendramodi: Happy to share that my mother has taken the first dose of the COVID-19 vaccine today. I urge everyone to help and motivat…,1086922713229336576,Vermasandeep007,ch.dadri Haryana,268,50122,,True,False,28494,,,17142,0,0.6666666666666666,0.525,positive
2021-03-11 17:12:17,1370060016384884737,spectatorindex: CORONAVIRUS: Denmark has temporarily suspended the AstraZeneca coronavirus vaccine as a precautionary measure due to ca…,376490842,its_Winnieee,Bahamas 🇧🇸,793,3317,,True,False,86585,,,3014,0,0.375,-0.125,negative
2021-03-11 17:12:16,1370060014606372869,CTVNews: Denmark suspends use of AstraZeneca vaccine as 'precautionary measure' ,1025103260795920385,WP_McCann,"Calgary, Alberta",176,50345,,False,False,13272,,,183,0,0.0,0.0,neutral
2021-03-11 17:12:16,1370060014539444229,POTUS: One in four adults in the U.S. has received their first COVID-19 vaccine — and we’re now leading the world in vaccinations.Tha…,752274791063703552,drizzy_dre2225,"Haddonfield,  Illinois",134,17519,,False,False,9738,,,16530,0,0.3333333333333333,0.25,positive
2021-03-11 17:12:16,1370060014170308612,kayleighmcenany: FINALLY the Biden admin recognizes the Trump admin’s unprecedented vaccine work:➡️ “We’re grateful for the work that…,2472641792,stacyrossetti,"Connecticut, USA",1026,56729,,False,False,11271,,,4662,0,0.95,0.3,positive
2021-03-11 17:12:16,1370060013402779649,POTUS: One in four adults in the U.S. has received their first COVID-19 vaccine — and we’re now leading the world in vaccinations.Tha…,1350179725,1970LizzieM,,777,58040,,False,False,156878,,,16530,0,0.3333333333333333,0.25,positive
2021-03-11 17:12:16,1370060012941365250,richu_jay: Make your skin glow using DISAAR CREAM AND SERUM ENRICHED WITH SUNFLOWER OILS♨️Removes dark spots♨️Balances skin tones♨️M…,1284865734712205312,TneyMashaah,"Thika, Kenya",18562,56240,,True,False,61343,,,129,0,0.4,-0.15,negative
2021-03-11 17:12:15,1370060011573932033,"Kathy's mom got one jab of Pfizer and her dad got two of Moderna. Almost home free! Kathy is eligible for AstraZeneca, I'm not sure we won't wait. I would for sure but I'm extremely at risk living with her. The blood clot issues reported today seem precautionary, unrelated.",2390097782,DeanJC420,Calgary,7316,119272,,False,False,83128,,,1,8,0.8944444444444444,0.15625,positive
2021-03-11 17:12:15,1370060011364302850,mariamainmo: Girls don't want boys. They want the covid vaccine and a nice apartment,2982749020,NozomiUeki666,,172,14245,,True,False,11072,,,25405,0,1.0,0.6,positive
2021-03-11 17:12:15,1370060011339182080,POTUS: One in four adults in the U.S. has received their first COVID-19 vaccine — and we’re now leading the world in vaccinations.Tha…,16152086,RewardScup,"Virginia, USA",350,63030,,False,False,45535,,,16530,0,0.3333333333333333,0.25,positive
2021-03-11 17:12:15,1370060011167227904,disclosetv: JUST IN - Norway and Denmark suspend Oxford-AstraZeneca COVID19 vaccine rollout.,947959099660161030,Muzza103Crypto,United Kingdom,1242,10462,,False,False,1165,,,2607,0,0.0,0.0,neutral
2021-03-11 17:12:15,1370060010319974404,"BarackObama: Michelle and I got vaccinated against COVID-19 because we know it’s the best way to beat this pandemic, protect one anothe…",1249334929391058953,kathy_sandridge,,1,1075,,False,False,249,,,10666,0,0.3,1.0,positive
2021-03-11 17:12:15,1370060010135429124,USATODAY: The nation has endured agonizing moments during the coronavirus pandemic but also witnessed instances to restore our faith in…,39534983,simplybotansoap,"Metro Washington, DC USA",3450,50814,,False,False,96329,,,8,0,0.0,0.0,neutral
2021-03-11 17:12:15,1370060009954975745,narendramodi: Happy to share that my mother has taken the first dose of the COVID-19 vaccine today. I urge everyone to help and motivat…,2175506927,DesiEducatedBoy,Gujarat,229,12189,,False,False,7653,,,17142,0,0.6666666666666666,0.525,positive
2021-03-11 17:12:15,1370060009535545345,POTUS: One in four adults in the U.S. has received their first COVID-19 vaccine — and we’re now leading the world in vaccinations.Tha…,416560148,1AwakeWorld,,3821,36872,,False,False,77084,,,16530,0,0.3333333333333333,0.25,positive
2021-03-11 17:12:15,1370060009418162180,Reuters: Pfizer/BioNTech say COVID-19 vaccine likely to prevent asymptomatic infection  ,1352274622855712772,LukeHen31225397,,42,2104,,False,False,1670,,,78,0,1.0,0.0,neutral
2021-03-11 17:12:15,1370060008617041926,oh i cant stop my imagine 😅😅koronawirus 방탄소년단 WhoTheHellAreUSonuSood BTSARMY  turkeystopscovid ipinucukiminelinde AstraZeneca got7radio LiderBeşiktaş ,1315211717689868290,Vascodagama1487,"İstanbul, Türkiye",462,197,,False,False,956,,,0,1,0.0,0.0,neutral
2021-03-11 17:12:14,1370060007153278976,"This odd reports of AstraZeneca causing blood clots would further aggravate COVID19 vaccine hesitancy, especially among black folks. ",333483308,adamsabonu,Heart of Africa ,1438,4188,,True,False,13317,,,0,0,0.5458333333333334,-0.08333333333333333,negative
2021-03-11 17:12:14,1370060007123738627,spectatorindex: CORONAVIRUS: Denmark has temporarily suspended the AstraZeneca coronavirus vaccine as a precautionary measure due to ca…,1346345605287747584,KelvinS09449962,,18,1136,,False,False,486,,,3014,0,0.375,-0.125,negative
2021-03-11 17:12:14,1370060006675124230,ZombaeKillz: It's been one year and alot of people have died. Alot of people have permanently been impacted by covid. If you're still h…,48166974,DevinJPR,Denver,586,55220,,True,False,19515,,,27,0,0.0,0.0,neutral
2021-03-11 17:12:14,1370060005857058818,carletonjtysick: Six European countries have now halted use of Astrazeneca vaccine. We just started using it.,179750548,gkey63,,145,27410,,True,False,2713,,,255,0,0.0,0.0,neutral
2021-03-11 17:12:14,1370060005462970371,"MichelleObama: When you can get the COVID-19 vaccine, I hope you do—Barack and I are certainly glad we did. It’s our best shot at beati…",1317950842671190018,build_nyc1979,"New York, NY",704,55406,,False,False,2320,,,8538,0,0.65,0.75,positive
2021-03-11 17:12:14,1370060005219704834,"LindaL16: Denmark, Norway, Austria, Estonia, Latvia, Lithuania and Luxembourg – have suspended the use of AstraZeneca vaccines... htt…",1246712686118866944,fionakavanagh19,Ireland,302,33413,,False,False,13637,,,20,0,0.0,0.0,neutral
2021-03-11 17:12:14,1370060004959653888,It’s not like after you get the moderna you only need to protect your chin,17053565,MARTYN3024,NOVA,25298,26646,,False,True,1693,,,0,6,1.0,0.0,neutral
2021-03-11 17:12:14,1370060003806121987,tracyachabala: Well Happy Anniversary. This is the second study showing vaccine prevents asymptomatic infection and thereby transmiss…,1355005902944759808,FrancineGraff,,8,322,,False,False,44,,,1,0,0.5,0.4,positive
2021-03-11 17:12:13,1370060003080466433,JosephEllis408: Summer 2021:“YO SO DID YOU GET PFIZER OR MODERNA?” ,98841296,_evetteee," Fresno,CA 📍",1730,49262,,True,False,166781,,,46788,0,0.0,0.0,neutral
2021-03-11 17:12:13,1370060003047051265,donkamion78: Several European countries suspend AstraZeneca vaccinations over blood clot fears ,1260951959693135872,LindaO888,,1374,35983,,False,False,27661,,,173,0,0.0,0.0,neutral
2021-03-11 17:12:13,1370060002518515716,ABC7NY: Denmark pauses AstraZeneca COVID-19 vaccine to probe reports of blood clots  ,1080297980,peterjr377,"New York, NY",28,2270,,True,False,1198,,,7,0,0.0,0.0,neutral
2021-03-11 17:12:13,1370060002325622789,mgscarsbrook: Astrazeneca 💉 has just been halted in Denmark: “Danish health authorities announced they had temporarily stopped administ…,1351779406369456130,MediaSeph,,68,94,,False,False,49,,,388,0,0.0,0.0,neutral
2021-03-11 17:12:13,1370060002132692998,kayleighmcenany: FINALLY the Biden admin recognizes the Trump admin’s unprecedented vaccine work:➡️ “We’re grateful for the work that…,624468099,SunkissdSLP,"Sassy , sweet, southerner ",155,2727,,False,False,1626,,,4662,0,0.95,0.3,positive
2021-03-11 17:12:13,1370060000811311105,narendramodi: Happy to share that my mother has taken the first dose of the COVID-19 vaccine today. I urge everyone to help and motivat…,1205359008963387392,UmeshKu65199347,"Rajasthan, India",6,99,,False,False,31,,,17142,0,0.6666666666666666,0.525,positive
2021-03-11 17:12:13,1370060000706625542,simondolan: Nothing to see here. Move along. Perfectly safe....Italy and Norway join Denmark in suspending use of AstraZeneca vaccine…,627813,Raoul,Romania,1855,2816,,True,False,24362,,,899,0,1.0,1.0,positive
2021-03-11 17:12:13,1370060000438190084,"""Dr. Anthony Fauci joins Rachel Maddow to discuss the vaccine rollout and the latest on the coronavirus pandemic. Watch The Rachel Maddow Show, tonight at 9 p.m. ET.""",14260758,mingomonk,"Atlanta, GA",523,21948,,True,False,85008,,,0,0,0.9,0.5,positive
2021-03-11 17:12:13,1370060000090001409,"Tea__light: It's almost end term, do you that you can send parents a message to alert them about school reopening dates, fees balance &amp;…",1298183918886232064,kirinyaga_duke,"Nairobi, Kenya",12582,41169,,False,False,42394,,,23,0,0.0,0.0,neutral
2021-03-11 17:12:12,1370059999209213953,WarksNorthCCG: The GOVUK website now includes a British Sign Language video about the COVID vaccine and current advice for women of ch…,1359098408,PHE_WestMids,"West Midlands, UK",4298,10634,,False,True,14789,,,2,0,0.2,0.0,neutral
2021-03-11 17:12:12,1370059998487789571,"Jaykiluu: Europa league kibao, purchase airtime from VochaLtd and stay updated.✅Go to M-pesa✅Paybill no 505082✅A/c no your phone nu…",3301853737,kiarie_kioni,,1674,15440,,True,False,11945,,,68,0,0.0,0.0,neutral
2021-03-11 17:12:12,1370059998412206081,"GreatGameIndia: THIS IS BIG8 European nations including Italy, Latvia, Luxembourg, Lithuania, Estonia, Denmark, Norway and Iceland ha…",1226745681827655681,rohanvid,,116,3347,,False,False,1663,,,809,0,0.0,0.0,neutral
2021-03-11 17:12:12,1370059997736931329,"alfonslopeztena: With Trump gone, QAnon groups seethe with covid denialism and vaccine misinformation The ideology’s followers have rec…",1276277727448821760,boodiebooboo,,2630,77195,,False,False,100590,,,28,0,0.0,0.0,neutral
2021-03-11 17:12:12,1370059997686665220,"Tea__light: It's almost end term, do you that you can send parents a message to alert them about school reopening dates, fees balance &amp;…",764783184903036928,Is_she67,ni kubad,2477,20592,,True,False,3649,,,23,0,0.0,0.0,neutral
2021-03-11 17:12:12,1370059997397331979,"IndianEmbassyTR: Pakistan🇵🇰, the only SAARC country to not seek COVID-19 Vaccine from India, is getting 45 million 🇮🇳 made vaccine Covi…",3254506823,chamakunnu,,95,4741,,False,False,1528,,,3062,0,1.0,0.0,neutral
2021-03-11 17:12:12,1370059997124628487,SalehGh28: Me watching oxford astrazeneca  vaccine banned after already receiving my first dose..⁦AstraZeneca⁩ ,20754491,unojen_wood,London(ish),12141,23461,,False,False,389838,,,198,0,0.3333333333333333,0.25,positive
2021-03-11 17:12:12,1370059996793163776,Oxford-AstraZeneca: EU regulator says 'no indication' vaccine linked to blood clots ,850923103462899712,Trialanderror_v,日本,387,149,,False,False,632512,,,0,0,0.0,0.0,neutral
2021-03-11 17:12:12,1370059996533248015,"obviousreally: Questioning the COVID 'vaccine' jab at all, may get you such a response...'The suggestions are based on psychologic…",1334263254827274240,Avenger1100,England,164,19147,,False,False,12951,,,7,0,0.5,0.0,neutral
2021-03-11 17:12:12,1370059996126404608,"JuddLegum: JohnKavanagh_AZ 3. Kavanaugh, who apparently believes its his job to ensure that ""uninformed"" people do not vote is support…",62880951,cynthiakiker,North Carolina,4077,223446,,False,False,156066,,,596,0,0.35,0.05,positive
2021-03-11 17:12:12,1370059995727982595,"actupny: We’re here outside Pfizer HQ to demand POTUS to protect people not profits, support TRIPSWaiver, and hold pharmaceuticals ac…",831797306,globalgyno,,904,23170,,True,False,18896,,,170,0,0.05,0.0,neutral
2021-03-11 17:12:11,1370059994993995779,nytimes: A New York-based start-up is matching vaccine providers who have extra shots to people who are willing to get one at a moment’…,147446901,FrancoCNac,"Toronto, ON",5070,283792,,False,False,286296,,,833,0,0.4348484848484849,0.12878787878787878,positive
2021-03-11 17:12:11,1370059992770879488,AmeshAA: “there is little a vaccinated person should be discouraged from doing”— agree with Dr ⁦MartyMakary⁩  ,47212311,11ared_rj146,,302,140066,,False,False,59891,,,68,0,0.5,-0.1875,negative
2021-03-11 17:12:11,1370059992380887040,NYGovCuomo: Vaccination Update: 20.4% of New Yorkers have received at least one vaccine dose and 10.4% have completed their vaccine s…,1293605529244311552,livelivefever,"New York, NY",18,17448,,False,False,16736,,,174,0,0.42727272727272725,-0.08181818181818182,negative
2021-03-11 17:12:10,1370059990078255104,disclosetv: JUST IN - Norway and Denmark suspend Oxford-AstraZeneca COVID19 vaccine rollout.,786367359296561152,factishtruthish,United States,27,3039,,False,False,15293,,,2607,0,0.0,0.0,neutral
2021-03-11 17:12:10,1370059989981790210,TheTorontoSun: Significant number of PSWs refuse their COVID vaccine ,1244086056737214464,HopeStill17,,483,23484,,False,False,10900,,,179,0,0.875,0.375,positive
2021-03-11 17:12:10,1370059989969174530,"DinaPomeranz: Daily Covid vaccinations:Chile has now overtaken Israel, US has overtaken UK &amp; Germany is now faster than Switzerland.…",1160705189315170304,Thinktwice_gell,Switzerland,111,17552,,False,False,17629,,,19,0,0.0,0.0,neutral
2021-03-11 17:12:10,1370059988907999233,"According to Fox News, Pfizer and BioNTech will generate $15 billion in revenues this year. Moderna expects to supply 1 billion doses in 2021 and 1.4 billion in 2022 for a total haul of $18.4 billion. Johnson &amp; Johnson1 billion doses $10 billion in revenue.",19889143,Dlloydlevine,New York City,1994,3622,,True,False,14188,,,0,1,0.75,0.0,neutral
2021-03-11 17:12:09,1370059986504650763,disclosetv: JUST IN - Norway and Denmark suspend Oxford-AstraZeneca COVID19 vaccine rollout.,1104859516846383114,faustoamazon,"Puerto Providencia, Orellana",220,12293,,False,False,17011,,,2607,0,0.0,0.0,neutral
2021-03-11 17:12:09,1370059986496225284,I’m booked for a Covid-19 Vaccine. The challenges I read about the booking system seem to have been worked out.,459855232,davidwhitepeng,Calgary,194,2321,,False,False,3522,,,0,4,0.0,0.0,neutral
2021-03-11 17:12:09,1370059986139680772,"laurmasi: gtconway3d “However, Pfizer’s head of vaccine research and development told the New York Times that they “were never part of…",55137160,jorgeaorozco,,30,857,,False,False,1195,,,18,0,0.45454545454545453,0.13636363636363635,positive
2021-03-11 17:12:09,1370059984663240706,"GovSisolak SteveSisolak For real this time??? I was on the list 3 weeks ago and suddenly I’m not. I work full-time for a large grocery chain and have a child with severe asthma and 2 autoimmune diseases. If he were to get Covid, chances are it would complicate his condition. I need the vaccine now.",793938914926956544,rebecca_pines,,148,8897,,False,False,1085,,,0,3,0.40952380952380957,0.13809523809523808,positive
2021-03-11 17:12:09,1370059984369770500,"makaumutua: The AstraZeneca Covid vaccine temporarily SUSPENDED in Denmark, Norway, Austria, and several EU countries after a few inst…",923611753216466944,OwenAbong,Nairobi_Kenya,1880,71187,,False,False,158584,,,35,0,0.05,-0.1,negative
2021-03-11 17:12:09,1370059983732244487,danieteebee: It’s completely predictably American that the brand of COVID vaccine you have access to has now become a class signifier,384266035,hope_bennett,hurricane tortilla,378,17671,,True,False,1134,,,10923,0,0.0,0.0,neutral
2021-03-11 17:12:09,1370059983207817219,"rspchary: India started external supplies of Made-in-India vaccines on January 20, the minister said. Supplies are being undertaken in…",1070572972145106945,Nainabjpamethi,"Amethi, India",218,2048,,False,False,31183,,,74,0,0.1,0.0,neutral
2021-03-11 17:12:09,1370059983090507781,"The Obamas, Clintons, Bushes and Carters are promoting the COVID-19 vaccine  in two new  Ad Council PSAs debuting on…",251634768,stojkovic_alex,"Toronto, Canada",94130,321395,,True,False,146938,,,0,0,0.45454545454545453,0.13636363636363635,positive
2021-03-11 17:12:09,1370059982788554758,"BarackObama: Michelle and I got vaccinated against COVID-19 because we know it’s the best way to beat this pandemic, protect one anothe…",876823140189515777,YDCabarrus,"Concord, NC",305,1226,,False,False,6071,,,10666,0,0.3,1.0,positive
2021-03-11 17:12:08,1370059982293585925,regionofpeel: Do you know a licensed health care professional looking for work? We’re urgently hiring Immunizers for our COVID-19 vacci…,990933895347499011,shazafadel4,,262,4251,,False,False,721,,,15,0,0.1,0.1,positive
2021-03-11 17:12:08,1370059981874151428,NYGovCuomo: Vaccination Update: 20.4% of New Yorkers have received at least one vaccine dose and 10.4% have completed their vaccine s…,551280788,KirstanConley,NYS,1104,1768,,False,False,4642,,,174,0,0.42727272727272725,-0.08181818181818182,negative
2021-03-11 17:12:08,1370059981828022275,spectatorindex: JUST IN: Norway has suspended use of the AstraZeneca coronavirus vaccine,4922680409,therealanif_,🇳🇬,2078,45858,,True,False,86292,,,2566,0,0.0,0.0,neutral
2021-03-11 17:12:08,1370059981085536257,"BarackObama: Michelle and I got vaccinated against COVID-19 because we know it’s the best way to beat this pandemic, protect one anothe…",1095950777464455169,Pns06522934,,10,34,,True,False,2001,,,10666,0,0.3,1.0,positive
2021-03-11 17:12:08,1370059979768598534,"Covid Prescription: Get the Vaccine, Wait a Month, Return to Normal - WSJ ",294707763,ellenbraaten,"Boston, MA",4835,39412,,True,False,13973,,,0,1,0.6499999999999999,0.15,positive
2021-03-11 17:12:08,1370059979034656774,"Pfizer Covid vaccine cuts transmission of coronavirus, new study shows  via nbcnews",114853318,FosterBDAV66,Bedlam and Madness,331,49603,,False,False,26839,,,0,0,0.45454545454545453,0.13636363636363635,positive
2021-03-11 17:12:08,1370059978451648512,NYGovCuomo: Vaccination Update: 20.4% of New Yorkers have received at least one vaccine dose and 10.4% have completed their vaccine s…,919362324431015937,GroupToStopHate,Planet Earth,191,15541,,False,False,11127,,,174,0,0.42727272727272725,-0.08181818181818182,negative
2021-03-11 17:12:07,1370059978145472514,"FinancialTimes: Denmark, Norway and Iceland have suspended use of the Oxford/AstraZeneca vaccine in a 'precautionary' move after a Dani…",25978996,Geo45,World,286,8579,,False,False,94079,,,329,0,0.0,0.0,neutral
2021-03-11 17:12:07,1370059977419714567,POTUS: One in four adults in the U.S. has received their first COVID-19 vaccine — and we’re now leading the world in vaccinations.Tha…,117657942,eileen_donovan,Southern California,2306,25764,,False,False,56970,,,16530,0,0.3333333333333333,0.25,positive
2021-03-11 17:12:07,1370059977134469124,narendramodi: Happy to share that my mother has taken the first dose of the COVID-19 vaccine today. I urge everyone to help and motivat…,96710943,Drskrath,Lucknow,993,104991,,False,False,78372,,,17142,0,0.6666666666666666,0.525,positive
2021-03-11 17:12:07,1370059976761339906,kayleighmcenany: FINALLY the Biden admin recognizes the Trump admin’s unprecedented vaccine work:➡️ “We’re grateful for the work that…,770864937828835328,DiArgerie_qca,,539,116578,,False,False,218813,,,4662,0,0.95,0.3,positive
2021-03-11 17:12:07,1370059976648110080,"BarackObama: Michelle and I got vaccinated against COVID-19 because we know it’s the best way to beat this pandemic, protect one anothe…",524474062,Obama2014Europe,"Berlin, Chicago",690,26561,,False,False,73528,,,10666,0,0.3,1.0,positive
2021-03-11 17:12:07,1370059976018964488,"MDAndersonNews: With three COVID-19 vaccines now available, you might be wondering which is best for current and former cancer patients…",92603118,DynamoCooligan,"Houston, Texas",3829,1251376,,False,False,1666242,,,3,0,0.275,0.35,positive
2021-03-11 17:12:06,1370059972994859016,NYGovCuomo: Vaccination Update: 20.4% of New Yorkers have received at least one vaccine dose and 10.4% have completed their vaccine s…,1345076849039331329,JohnMuir2006,"Frostburg, MD",7587,36385,,False,False,35785,,,174,0,0.42727272727272725,-0.08181818181818182,negative
2021-03-11 17:12:06,1370059972751548416,Reuters: Pfizer/BioNTech say COVID-19 vaccine likely to prevent asymptomatic infection  ,399126583,ClarissaLValdez,,187,95455,,True,False,38236,,,78,0,1.0,0.0,neutral
2021-03-11 17:12:06,1370059971753254912,thebias_news: NEW: Denmark suspends use of AstraZeneca vaccine over blood clot fears (AFP).,1221893235657674752,Crystal92075604,"Washington, USA",397,87259,,True,False,53720,,,218,0,0.45454545454545453,0.13636363636363635,positive
2021-03-11 17:12:06,1370059971543584768,"heklami JakeGronie ninjaplusman conspiraboomers Covid-19 is a real actual pandemic. 520k are dead in america alone from it. Wear a mask, let us take the vaccine.",1289737120257638400,0ld_ironsides,The last place youd look,6,1972,,False,False,346,,,0,1,0.275,-0.1,negative
2021-03-11 17:12:06,1370059971426140162,"_Zeets: ""Even when vaccine distribution centers are more evenly distributed, researchers find...Residents from wealthier, predominantly…",17403645,joaniemaloney,,609,27548,,False,False,228852,,,11,0,0.5,0.5,positive
2021-03-11 17:12:06,1370059970243354627,"BarackObama: Michelle and I got vaccinated against COVID-19 because we know it’s the best way to beat this pandemic, protect one anothe…",633311413,NoRoJo44,,120,10066,,False,False,476,,,10666,0,0.3,1.0,positive
2021-03-11 17:12:05,1370059967928107010,"Read1000Lives good to hear, daniel. I'm also looking out for the pfizer jab but so far I'm not on the list (in berlin). probably too young still 😅",1035896752845545472,christo71213435,"Berlin, Germany",556,6444,,False,False,6675,,,0,0,0.6666666666666666,0.3,positive
2021-03-11 17:12:05,1370059966846013447,"RellonEarth People are speaking bullshit about J&amp;J getting forced on poor and black people as an inferior vaccine. Not understanding Pfizer &amp; Moderna get kept and transported at -70° and weren’t tested on the variants. With no deaths and no hospitalizations in trials, I want J&amp;J.",24344973,raymahl,"Durham, NC",4006,12078,,True,False,84625,,,0,0,0.41111111111111115,-0.2888888888888889,negative
2021-03-11 17:12:05,1370059966598545422,Trumpeteer14: How does a healthy young mother with no health conditions up and die from a Covid-19 vaccine? Maybe it's not safe. Helloo…,344435196,MarieVolland1,"Merritt Island, FL",3649,109198,,False,False,47539,,,94,0,0.4666666666666666,0.11666666666666665,positive
2021-03-11 17:12:05,1370059966581641218,AmmU_MaanU nellaiseemai poopoonga My uncle aunt got covid shied vaccine. No complications. All well.,1896738432,VG100000,India,3202,32056,,False,False,68396,,,1,2,0.0,0.0,neutral
2021-03-11 17:12:04,1370059964610453508,"roccogalatilaw: Denmark. another country, like Austria, to suspend  Astra-Zeneca vaccine due to ""blood-clotting"" which  led to deaths a…",3138766467,ShellOilJr,O Canada 🇨🇦!,174,5498,,False,False,3961,,,1501,0,0.375,-0.125,negative
2021-03-11 17:12:04,1370059964199276546,why am I experiencing more side effects from the vaccine than when I actually had COVID 😞😞😞,1739772991,kdt25_,,472,23355,,True,False,13004,,,0,1,0.3,0.25,positive
2021-03-11 17:12:04,1370059963515736067,richu_jay: Make your skin glow using DISAAR CREAM AND SERUM ENRICHED WITH SUNFLOWER OILS♨️Removes dark spots♨️Balances skin tones♨️M…,859657209059430400,fecci_ke,Subscribe to My Channel 🏡✨,18079,57398,,True,False,48536,,,129,0,0.4,-0.15,negative
2021-03-11 17:12:04,1370059963188572161,"NateSilver538: A month ago, the EU and UK had similar rates of COVID cases per capita, and the US was about 30% higher than either one.…",1204556916699078661,bash_h_,"Bristol, United Kingdom",148,85472,,False,False,1875,,,145,0,0.45,0.125,positive
2021-03-11 17:12:04,1370059963092058116,IWUALAVALENTIN1: please kindly retweet 🙏🏼AVAILABLE HONDA ACCORD EX-L 2016 WITH FULL DUTY 🏷5.6MOXLADE/AKAH/DROGBA/ASTRAZENECA/…,105695428,osayich,Nigeria,21017,135575,,True,False,68178,,,31,0,0.7250000000000001,0.475,positive
2021-03-11 17:12:04,1370059962940989443,POTUS: One in four adults in the U.S. has received their first COVID-19 vaccine — and we’re now leading the world in vaccinations.Tha…,1302660842,Meredizzzle,"Bay Area, CA",281,67120,,True,False,23624,,,16530,0,0.3333333333333333,0.25,positive
2021-03-11 17:12:04,1370059962873962499,BBGRichie: I'm amazed that the media is covering it. Share with everyone who has yet to have a jab. Nothing is more urgent. Do NOT have…,413487324,Jnm2Julia,,27,2337,,False,False,1498,,,0,0,0.5,0.5,positive
2021-03-11 17:12:04,1370059962496454660,Shawn_SoPeachy: Pfizer not innocent out here either.,971022553761361921,jeffreyboadi_,"London, England",13188,25360,,True,False,14728,,,5,0,0.7,-0.25,negative
2021-03-11 17:12:03,1370059961636622344,"JakeThompsonOE: Starting Friday, the University of Mississippi will administer the Pfizer version of the COVID-19 vaccine to all campus…",23258634,OxfordEagle,"Oxford, MS",13941,109,,True,False,9103,,,9,0,0.1,0.0,neutral
