created,id_str,text,user_id,screen_name,location,followers_count,user_favourites_count,time_zone,geo_enabled,verified,status_count,geo,coords,retweet_count,tweet_favourite_count,Subjectivity,Polarity,Sentiment
2021-03-11 17:01:35,1370057323587145730,POTUS: One in four adults in the U.S. has received their first COVID-19 vaccine — and we’re now leading the world in vaccinations.Tha…,922538293845094401,janet3621,,768,87423,,False,False,90400,,,16530,0,0.3333333333333333,0.25,positive
2021-03-11 17:01:34,1370057323134119937,narendramodi: Happy to share that my mother has taken the first dose of the COVID-19 vaccine today. I urge everyone to help and motivat…,31158507,sdoshi004,,166,26631,,False,False,30189,,,17140,0,0.6666666666666666,0.525,positive
2021-03-11 17:01:34,1370057323041947654,Safety of COVID19 vaccines is a top priority. Safety is considered before any vaccine is recommended for use. Learn more about how CDC and its partners are ensuring the safety of COVID-19 vaccines: TheBurlingtonMA Burlington_MRC burlingtonema ,1187030609203515392,Burlington_BOH,,291,28,,False,False,1309,,,0,1,0.5,0.5,positive
2021-03-11 17:01:34,1370057322899369987,BlackburnCK: BREAKING: Chatham-Kent's Medical Officer of Health Dr. David Colby says CK is number 1 in the country when it comes to the…,269962159,ablair2,,135,18,,True,False,24915,,,31,0,0.0,0.0,neutral
2021-03-11 17:01:34,1370057322265935872,"BarackObama: Michelle and I got vaccinated against COVID-19 because we know it’s the best way to beat this pandemic, protect one anothe…",329904264,asktatia,🌍wide ,3308,5485,,True,False,133460,,,10680,0,0.3,1.0,positive
2021-03-11 17:01:34,1370057321611730945,Reuters: Denmark suspends AstraZeneca COVID vaccine after blood clot reports  ,3342446957,mshoni_tyler,"Ogembo, Kenya",535,36118,,False,False,23258,,,1011,0,0.0,0.0,neutral
2021-03-11 17:01:34,1370057321297162240,"MichelleObama: When you can get the COVID-19 vaccine, I hope you do—Barack and I are certainly glad we did. It’s our best shot at beati…",48837744,Cougaruser,Illinois,135,4239,,False,False,14752,,,8546,0,0.65,0.75,positive
2021-03-11 17:01:34,1370057319757807616,bravenew_orwell: France about to ease travel restrictions. Just a test negative required 72 hours prior &amp; no vaccine passports.  The UK…,606598227,HodaAKamel,"Ontario, Canada",4007,17285,,False,False,46108,,,945,0,0.2,-0.15,negative
2021-03-11 17:01:34,1370057319627825153,POTUS: One in four adults in the U.S. has received their first COVID-19 vaccine — and we’re now leading the world in vaccinations.Tha…,122223643,LINCOLN_loggs,she/her,1105,3348,,True,False,19051,,,16530,0,0.3333333333333333,0.25,positive
2021-03-11 17:01:34,1370057319619387397,spectatorindex: JUST IN: Norway has suspended use of the AstraZeneca coronavirus vaccine,78055602,georgeoketch12,Nairobi Kenya,1966,93782,,True,False,119467,,,2565,0,0.0,0.0,neutral
2021-03-11 17:01:33,1370057318734434306,"dyllyp: Veterans in the LA area, the COVID-19 vaccine is now available to anyone enrolled at the VA. Call 310-268-4900 to set up an app…",2979880791,WLimestall,"Chicago, IL",1143,108108,,True,False,31102,,,85,0,0.4,0.4,positive
2021-03-11 17:01:33,1370057317652295689,aslavitt46: COVID Vaccination Update: 1 in 4 adults in the U.S. have now received their first vaccine.,19604455,AFTCT,Connecticut,4978,24693,,True,False,64161,,,6486,0,0.3333333333333333,0.25,positive
2021-03-11 17:01:33,1370057317648105476,"ClimateRealists: Italy, Norway and Denmark stop giving out AstraZeneca jabs over blood clot fears despite EU and UK regulators saying t…",720644990,SimonMaxfield8,,388,9195,,False,False,27075,,,18,0,0.0,0.0,neutral
2021-03-11 17:01:33,1370057316993802247,Reuters: Denmark suspends AstraZeneca COVID vaccine after blood clot reports  ,1078689191196803072,thenameis_KAM,Where the money resides ,155,36361,,True,False,11964,,,1011,0,0.0,0.0,neutral
2021-03-11 17:01:33,1370057316268179459,"edokeefe: NEW: Former Presidents Carter, Clinton, Bush and Obama and first ladies unite to urge Americans to get vaccinated ",633727321,ColeGrecco1,,309,38043,,False,False,5029,,,85,0,0.2626262626262626,0.12878787878787878,positive
2021-03-11 17:01:32,1370057314804367375,"MECOPP1: Registration now live for Carers Q&amp;A session on the COVID vaccine and vaccination programme with Julie Hoey, COVID Vaccine Pol…",2831587300,CarersTrustScot,Scotland,3574,4668,,True,False,8741,,,8,0,0.5,0.13636363636363635,positive
2021-03-11 17:01:32,1370057313168527371,POTUS: One in four adults in the U.S. has received their first COVID-19 vaccine — and we’re now leading the world in vaccinations.Tha…,576560067,dlarsh15,"Pennsylvania, USA",145,21259,,True,False,4595,,,16530,0,0.3333333333333333,0.25,positive
2021-03-11 17:01:32,1370057313122459648,piusperezi: Justme935286 ModricProm ample_calm GraceNamazzi1 Gonzachristine3 Iam_Shafiq_01 conradMC6 BakerSojah Kimntege Bray…,1364341603738021890,ModricProm,,445,6206,,False,False,4625,,,1,0,0.0,0.0,neutral
2021-03-11 17:01:32,1370057312740737033,"roccogalatilaw: Denmark. another country, like Austria, to suspend  Astra-Zeneca vaccine due to ""blood-clotting"" which  led to deaths a…",17679974,lhattan,"Braeside, On",17,3864,,False,False,225,,,1501,0,0.375,-0.125,negative
2021-03-11 17:01:32,1370057312719810561,"HimymCraig MrJonCryer “I hope everyone remembers when they’re getting the Covid-19 (often referred to as the Trump Virus) vaccine, that if I’d been a competent President, you wouldn’t be getting that beautiful shot at all because there’d be no need to do so, like when Pres. Obama took care of Ebola.”",242546134,NorthernSnowdog,,173,27479,,False,False,21039,,,0,0,0.8333333333333333,0.675,positive
2021-03-11 17:01:32,1370057311813726212,JuddLegum: JohnKavanagh_AZ ATT Allstate BCBSAssociation CoxComm WeAreFarmers pfizer UnitedHealthGrp USAA Prudential WellsFar…,1939118838,cardon_brian,"North Carolina, USA",312,79416,,True,False,72507,,,360,0,0.0,0.0,neutral
2021-03-11 17:01:31,1370057309372649472,JuddLegum: JohnKavanagh_AZ ATT Allstate BCBSAssociation CoxComm WeAreFarmers pfizer UnitedHealthGrp USAA Prudential WellsFar…,2680334190,coreytrina,,158,97499,,False,False,5423,,,360,0,0.0,0.0,neutral
2021-03-11 17:01:31,1370057308726788099,It’s not entirely clear how well they (Pfizer and Moderna) will work against these mutated viruses.  The J&amp;J vax was still being tested when the variants were making the rounds.,198888429,RellonEarth,In or around DC,353,896,,False,False,35563,,,1,2,0.3833333333333333,-0.05000000000000001,negative
2021-03-11 17:01:31,1370057308290613257,"WATCH: Skeptical of the COVID-19 vaccine? Experts break down misconceptions and the science behind the shot in this live town hall -- Fear, Facts, Future: The COVID-19 Vaccine explained  ",10946932,WMCActionNews5,"Memphis, TN",199000,4670,,True,True,169808,,,0,1,0.4227777777777778,-0.18383838383838386,negative
2021-03-11 17:01:31,1370057307011317771,"MichelleObama: When you can get the COVID-19 vaccine, I hope you do—Barack and I are certainly glad we did. It’s our best shot at beati…",406546118,LissaBryan,United States,2094,1143,,False,False,87510,,,8546,0,0.65,0.75,positive
2021-03-11 17:01:31,1370057307007029248,"KKMPutrajaya: On this day last year, WHO announced COVID19 as a pandemic. Let's pray for the pandemic to end.  Register for the C…",1734410480,szeweina88,Kuala Lumpur City,57,1512,,True,False,5605,,,278,0,0.06666666666666667,0.0,neutral
2021-03-11 17:01:30,1370057306256379911,"V-safe—a smartphone-based tool that monitors vaccine safety—is now available in Spanish, Vietnamese, Korean, and simplified Chinese. Tell CDCgov how you feel after COVID19 vaccination by completing short surveys. Learn more &amp; register:  ",577380112,WarrenCoHealth,Lebanon Ohio,860,17,,False,False,6113,,,0,0,0.24,0.18,positive
2021-03-11 17:01:30,1370057306029883393,BBCWorld: Denmark suspends use of Oxford-AstraZeneca vaccine 'as a precaution' ,334654986,Nwiuelucky,Port Harcourt,83,12774,,True,False,8883,,,243,0,0.0,0.0,neutral
2021-03-11 17:01:30,1370057305719508993,"zerothdream: AmmU_MaanU nellaiseemai poopoonga Even pfizer faced issue of death of elders in Norway later got cleared, regarding eff…",79175176,Shazza1uk,Scotland - N Ayrshire,5306,92889,,True,False,190006,,,3,0,0.0,0.0,neutral
2021-03-11 17:01:30,1370057304742240256,POTUS: One in four adults in the U.S. has received their first COVID-19 vaccine — and we’re now leading the world in vaccinations.Tha…,2546760696,Rashid_Coleman, The land of Black Unicorns,169,88766,,True,False,42761,,,16530,0,0.3333333333333333,0.25,positive
2021-03-11 17:01:30,1370057304318562307,"jonst0kes: If you gave free hats to a large enough population of people, the odds that some people would mysteriously drop dead shortly…",23284066,drseid,"Mayflower, AR",1685,45133,,True,False,468749,,,25,0,0.6257142857142857,0.08285714285714287,positive
2021-03-11 17:01:30,1370057304066916352,Well absolutely fuck that then!Stay paranoid my friends. ,198692763,KyloBiz,Zion,252,19748,,False,False,3866,,,0,2,0.6,-0.4,negative
2021-03-11 17:01:30,1370057304008187907,"Tcpwood duty2warn morgfair It is all known if you read it &amp; was related to Covid. Help for cities &amp; states, unemployment aid (helping states AND non-wealthy individuals), child tax care credit helping non-wealthy families, vaccine distribution funds (ya know for covid) . . . read it.",803610506556829698,ProudLibPat,,473,200858,,False,False,40794,,,0,0,0.4,0.0,neutral
2021-03-11 17:01:30,1370057303702040579,"monicah_2: Easter is around the corner, did you know that you can get your restaurant a point of sale system that will make your work e…",859657209059430400,fecci_ke,Subscribe to My Channel 🏡✨,18079,57397,,True,False,48535,,,53,0,0.0,0.0,neutral
2021-03-11 17:01:30,1370057303504822277,"Israel just passed a huge benchmark (per business  more vaccine doses given than people in country. With this, nearly 100% of people over 70 have been fully vaccinated. inthebubblepod, I interviewed top Israel epidemiologist:  ",239210681,Bob_Wachter,San Francisco,169663,7927,,True,True,19248,,,14,100,0.575,0.37500000000000006,positive
2021-03-11 17:01:29,1370057302330404867,"breeadail: EUROPE—Denmark, Austria, Estonia, Latvia, Lithuania and Luxembourg have banned Oxford’s AstraZeneca COVID vaccine.Sources…",1071668027609899008,LBee1979,SoCal,3112,48515,,False,False,14207,,,343,0,0.0,0.0,neutral
2021-03-11 17:01:29,1370057302099816450,mariamainmo: Girls don't want boys. They want the covid vaccine and a nice apartment,1122563008377569280,acastagliolaa,"Staten Island, NY",36,3032,,False,False,3252,,,25410,0,1.0,0.6,positive
2021-03-11 17:01:29,1370057301999165440,"MECOPP1: MECOPP, on behalf of the National Carer Organisations are hosting a Q&amp;A session on the COVID-19 vaccine and vaccination progra…",2831587300,CarersTrustScot,Scotland,3574,4668,,True,False,8741,,,3,0,0.0,0.0,neutral
2021-03-11 17:01:29,1370057301789409287,"SylviaDeeDee: The whole covid scam may have backfired.A whole lot of people, including myself, in researching covid, have learned a l…",1326595076353630216,Ness83228462,,139,17861,,False,False,788,,,86,0,0.4,0.2,positive
2021-03-11 17:01:29,1370057299583205384,"BarackObama: Michelle and I got vaccinated against COVID-19 because we know it’s the best way to beat this pandemic, protect one anothe…",834572923,scottf6f,United States,5341,170267,,True,False,178836,,,10680,0,0.3,1.0,positive
2021-03-11 17:01:29,1370057298836619273,DrEricDing: Cancer patients need 2nd dose—much less protected against COVID19 after only one dose of Pfizer vaccine. An early 2nd dose…,800928712497590272,EunLinda,"Hollywood, Los Angeles",8581,65509,,False,False,35388,,,304,0,0.2733333333333333,-0.01333333333333333,negative
2021-03-11 17:01:29,1370057298597580800,Reuters: Pfizer/BioNTech say data suggests vaccine 94% effective in preventing asymptomatic infection  ,740780679571595264,ColMushtaque,"پنجاب, پاکستان",137,1434,,False,False,403,,,117,0,0.8,0.6,positive
2021-03-11 17:01:28,1370057297775493121,"As states roll out the COVID19 vaccines, you may have a lot of questions. All this information can be overwhelming and anxiety-inducing, and we understand that! Check out this article for resources + suggestions for ensuring your mentalhealth. ",2784067158,IrisTelehealth,"Austin, TX",725,21,,True,False,777,,,0,1,1.0,0.625,positive
2021-03-11 17:01:27,1370057291559366656,POTUS: One in four adults in the U.S. has received their first COVID-19 vaccine — and we’re now leading the world in vaccinations.Tha…,22815176,liambutch,Philippines,347,3049,,True,False,10096,,,16530,0,0.3333333333333333,0.25,positive
2021-03-11 17:01:27,1370057291383377921,ProFootballTalk: Heading out to get the COVID vaccine. Please get it when you're able to do so. ,278877240,PaulCCasares,The Mine Shaft,1698,123097,,True,False,99381,,,20,0,0.625,0.5,positive
2021-03-11 17:01:27,1370057291169370118,While things are getting better because there's no limit on toilet paper purchases at Costco. Please remember to continue to follow COVID safety protocols and get a vaccine when you become eligible. ,540134079,GlenBeebyNews,"Salt Lake City, UT",1713,32377,,False,False,27176,,,1,11,0.25,0.23333333333333334,positive
2021-03-11 17:01:27,1370057289974042625,"FinancialTimes: Denmark, Norway and Iceland have suspended use of the Oxford/AstraZeneca vaccine in a 'precautionary' move after a Dani…",1364999868,KOMBO_STEVE,"Nairobi, Kenya",3663,1915,,False,False,6234,,,329,0,0.0,0.0,neutral
2021-03-11 17:01:26,1370057289751789569,thierrybaudet: Austria suspends AstraZeneca COVID-19 vaccine batch after death | Article [AMP] | Reuters ,1287711959408947200,JoeBidden__,United States,1884,6056,,True,False,4322,,,386,0,0.0,0.0,neutral
2021-03-11 17:01:26,1370057288921284611,"AP_Europe: Denmark has temporarily suspended use of the AstraZeneca coronavirus vaccine after reports of blood clots in some people, bu…",39534983,simplybotansoap,"Metro Washington, DC USA",3450,50839,,False,False,96353,,,83,0,0.0,0.0,neutral
2021-03-11 17:01:26,1370057288657088517,"SiriusOryon: But y'all keep on getting those ""safe"" ass shots though 💉🚫☢☣⚠️⛔Fox News: Utah mother dies four days after taking second…",1318675444284203008,MilkMann17,,128,29753,,False,False,5452,,,1,0,0.5,0.5,positive
2021-03-11 17:01:26,1370057288577212420,a2studoffl: Tomorrow going to inject covid vaccine 🙌🏻,1049684260657881094,AjithAzar2,"Chennai, India",332,6551,,False,False,6611,,,9,0,0.0,0.0,neutral
2021-03-11 17:01:26,1370057288032075776,Took415 RolandBakerIII Yes. But it's hard to imagine a scenario in which you could have more confidence in cross-immunity than in the safety of the vaccine. There will always be some level of risk and it's about balancing probabilities. If I'd had confirmed actual Covid I wouldn't bother with the vax.,1269356548641435648,gadboit,,80,3504,,False,False,1407,,,0,1,0.5354166666666667,0.15208333333333335,positive
2021-03-11 17:01:26,1370057287453261832,Biden’s COVID-19 advisers tell agripulse they’re optimistic that rural residents will get vaccinated in sufficient numbers to stop the virus from circulating. But they also know that many have questions or might be hesitant. Read here: ,74164455,ASA_Soybeans,"St. Louis, Missouri USA",34425,2762,,False,False,13120,,,0,0,0.25,0.25,positive
2021-03-11 17:01:26,1370057287067373574,Reuters: Denmark suspends AstraZeneca COVID vaccine after blood clot reports  ,376590546,AmJoseh,Ubiquitous               ,4637,14412,,True,False,61852,,,1011,0,0.0,0.0,neutral
2021-03-11 17:01:26,1370057286555734026,"JAbramsMcLean: ""You said state leaders are telling you they are not distributing the vaccine to majority-Black neighborhoods because th…",2609710289,pm_mcdaniel,"Whately, MA",6021,109058,,False,False,44837,,,162,0,0.0,0.0,neutral
2021-03-11 17:01:26,1370057286488633345,UPDATE: A chief medical examiner says it would be hard to prove vaccine injury as a cause of death in the autopsy. ,15606755,CBS12,"West Palm Beach, FL",113370,12376,,True,True,201731,,,2,0,0.2708333333333333,-0.14583333333333334,negative
2021-03-11 17:01:26,1370057286090170368,"Effective today, the Baker-Polito Administration opened eligibility for the COVID-19 vaccine to K-12 educators, childcare workers, and school staff. Click here to see if you’re eligible:  ",1243811726,MassStateRet,"Boston, MA",758,257,,False,False,3342,,,0,0,0.8,0.6,positive
2021-03-11 17:01:25,1370057285536473092,"For Stella Mack, receiving the COVID-19 vaccine gives her a shot at more protection and a healthier community. To learn more about the vaccine and to make an appointment, visit:  ThisIsMyShot ",217125123,AtriumHealth,"Based in Charlotte, NC",18127,3586,,True,True,11564,,,2,9,0.5,0.5,positive
2021-03-11 17:01:25,1370057285423267842,"CNNPolitics: In a new ad campaign, former Presidents Jimmy Carter, Bill Clinton, George W. Bush, Barack Obama and respective former fir…",361525110,CoogForever,,213,84148,,True,False,66376,,,595,0,0.13863636363636364,0.03409090909090909,positive
2021-03-11 17:01:25,1370057285016420360,ceewilldotcom: Pfizer 💉 Review: I’m 10 days out from dose 2. The symptoms I experienced both times were soreness at the site of inje…,201428484,MBre_,ATL.,449,15801,,True,False,58633,,,48,0,0.9,0.8,positive
2021-03-11 17:01:25,1370057284664102914,DCHHS: ‼️‼️Dallas County has hired a professional call center to assist the community with registering for the COVID-19 vaccine over th…,941470577256214529,24hourdallas,"Dallas, TX, USA",718,3675,,False,False,5486,,,70,0,0.1,0.0,neutral
2021-03-11 17:01:25,1370057284009725953,Sarahluvshkey77 Already got it. Moderna. Fully vaccinated. Also had Covid twice. After being sick for 4 months the second time is much rather get the vaccine.,3288551410,nvhen1,,450,7475,,False,False,8060,,,0,0,0.3523809523809524,-0.1714285714285714,negative
2021-03-11 17:01:25,1370057283523125248,imustho: Denmark suspends use of AstraZeneca Covid vaccine over reports of blood clots ,491930602,esmile27,Maldives,128,1195,,True,False,887,,,26,0,0.0,0.0,neutral
2021-03-11 17:01:25,1370057281627361307,"After receiving a COVID-19 vaccine, you may not have to wait to donate blood or platelets as long as you're symptom free and feel well. Learn more about vaccines and blood donor eligibility here:  ",21274629,RedCrossTN,"Tennessee, USA",9062,3016,,True,True,8089,,,0,1,0.5666666666666668,0.2833333333333334,positive
2021-03-11 17:01:24,1370057281304457217,"jonst0kes: If you gave free hats to a large enough population of people, the odds that some people would mysteriously drop dead shortly…",15664855,drethelin,"Madison, WI",2872,354638,,True,False,202128,,,25,0,0.6257142857142857,0.08285714285714287,positive
2021-03-11 17:01:24,1370057280000045056,WRES_team: With thanks to NHSEnglandLDN for developing videos in some of the most commonly spoken non-English languages in London and…,1173511684142579713,PrimaryCareNHS,England,5831,3808,,False,False,2332,,,15,0,0.39999999999999997,0.13333333333333333,positive
2021-03-11 17:01:24,1370057278204702722,thebias_news: NEW: Denmark suspends use of AstraZeneca vaccine over blood clot fears (AFP).,900111877333594114,Keiko04010014,,14,8063,,False,False,9454,,,218,0,0.45454545454545453,0.13636363636363635,positive
2021-03-11 17:01:24,1370057277936390146,"MichelleObama: When you can get the COVID-19 vaccine, I hope you do—Barack and I are certainly glad we did. It’s our best shot at beati…",210949307,MariaFBarragan,Perú ,237,688,,False,False,16337,,,8546,0,0.65,0.75,positive
2021-03-11 17:01:24,1370057277684641793,NYC for an Equitable Vaccination Distribution action Pfizer HQ freethevaccine peoplesvaccine M ,468716532,owsspawg,"New York, NY",1632,8600,,False,False,20036,,,1,5,0.1,0.1,positive
2021-03-11 17:01:23,1370057275839160320,spectatorindex: CORONAVIRUS: Denmark has temporarily suspended the AstraZeneca coronavirus vaccine as a precautionary measure due to ca…,1182992277100208128,Mawandacarole,,429,2513,,True,False,2305,,,3012,0,0.375,-0.125,negative
2021-03-11 17:01:23,1370057275084308482,mariamainmo: Girls don't want boys. They want the covid vaccine and a nice apartment,732307213272895488,hafsa_sll,,8,1389,,False,False,177,,,25410,0,1.0,0.6,positive
2021-03-11 17:01:23,1370057273314222080,disclosetv: JUST IN - Norway and Denmark suspend Oxford-AstraZeneca COVID19 vaccine rollout.,1257862783628013571,SouthernCross_Q,Australia,2679,18278,,False,False,9301,,,2607,0,0.0,0.0,neutral
2021-03-11 17:01:23,1370057273293295624,"scad_official: We received our delivery of AstraZeneca. Covid-19 vaccines barely two weeks ago, now this...! 😭😭😭 ",4341949835,agnesmel_yovo,"Ho, Ghana",2455,131311,,True,False,77571,,,49,0,0.1,0.0625,positive
2021-03-11 17:01:22,1370057273029099533,Just got Moderna 2. Here’s hoping it goes smoothly tonight!! 😷,1266384336145846273,DaveYGrampy,,80,500,,False,False,787,,,0,2,0.5,0.625,positive
2021-03-11 17:01:22,1370057272739688448,"Me to health care provider: I got sick after the first one.Health care provider: You'll get sick after this one, too.moderna_tx CovidVaccine",19599327,JimBessman,New York,2069,969,,True,False,94484,,,0,0,0.6825396825396824,-0.39285714285714285,negative
2021-03-11 17:01:22,1370057270571233285,"Where can i get a COVID vaccine for someone over the age of 65, Moderna or Phiezer preferably !!",996494209,ash_koshOMYGOSH,Ya daughters room😝,217,3096,,False,False,20939,,,0,0,0.0,0.0,neutral
2021-03-11 17:01:22,1370057269795115009,spectatorindex: JUST IN: Norway has suspended use of the AstraZeneca coronavirus vaccine,19171014,haqsmusings,"Silicon Valley, CA",3285,15595,,False,False,34642,,,2565,0,0.0,0.0,neutral
2021-03-11 17:01:21,1370057267698147330,CrweWorld: Oxford-AstraZeneca: EU regulator says 'no indication' vaccine linked to blood clots ,79175176,Shazza1uk,Scotland - N Ayrshire,5306,92889,,True,False,190006,,,3,0,0.0,0.0,neutral
2021-03-11 17:01:21,1370057267643523075,"zoo_bear: Moreover, India Today wrongly compared the cost of vaccine procurement for other countries with the price at which citizens c…",869760145,umarlesss,India,145,7069,,True,False,6961,,,301,0,0.6375,-0.3125,negative
2021-03-11 17:01:21,1370057267333173248,CFHousing: Today's COVID 19 Vaccine Clinic at Forand Manor still has appointments available.  It is now open to any resident over the…,402739834,PCF_Development,"Pawtucket, RI",587,1713,,True,False,1638,,,1,0,0.45,0.2,positive
2021-03-11 17:01:21,1370057266968342533,"TundeEddnut: Denmark, Norway, Austria suspend the use of AstraZeneca vaccine over blood clot fears. This is the same vaccine brought…",1364999868,KOMBO_STEVE,"Nairobi, Kenya",3663,1915,,False,False,6234,,,55,0,0.125,0.0,neutral
2021-03-11 17:01:21,1370057266544664579,"NYGovCuomo GovMurphy Interesting that we are the busiest city you want 50% capacity. Is covid-19 eliminated from our human lives or we still have to wear masks? Because leaders like NYGovCuomo do not know simple leadership. Hint: people want a cure, not a vaccine. Like this quote. ",851391315040505857,ZAYASPOTUS2024,"New York, NY",31,74,,False,False,3348,,,0,0,0.319047619047619,0.16666666666666666,positive
2021-03-11 17:01:21,1370057266364317699,CapitalFMMw: President Chakwera receiving his first dose of the Covid-19 Vaccine.CFMNewsMalawi ,2736953663,Mr_KFB_MW,MALAWI (MW) Lilongwe (L~city),2494,104383,,False,False,98409,,,9,0,0.3333333333333333,0.25,positive
2021-03-11 17:01:21,1370057265777152014,chrisfearne: Good news on the Covid vaccine rollout front: Johnson &amp; Johnson vaccine just authorized for use in the EU by the Europea…,67332005,Tamal01,Malta,452,4020,,False,False,12234,,,31,0,0.6000000000000001,0.7,positive
2021-03-11 17:01:21,1370057264984363009,POTUS: One in four adults in the U.S. has received their first COVID-19 vaccine — and we’re now leading the world in vaccinations.Tha…,3363005841,Mat1740,"Lexington Park, MD",98,42527,,True,False,17579,,,16530,0,0.3333333333333333,0.25,positive
2021-03-11 17:01:21,1370057264833368071,BlackersNot DerekCoates And what if someone young has a health condition which makes them more likely not to survive covid 19? Never go out? So you can avoid having a vaccine?,458594183,chrissieA2,,1744,61243,,True,False,89383,,,0,0,0.6333333333333333,0.19999999999999998,positive
2021-03-11 17:01:20,1370057264438996995,"hankymgc: NewJeffCT georgehahn The MRNA technology that enabled the Pfizer vaccine was developed by a German, Muslim couple over the…",3152272854,karenaboylan,"Santa Fe, NM",21985,58862,,False,False,60527,,,16,0,0.15,0.05,positive
2021-03-11 17:01:20,1370057264263004164,"TheRustler83: Latest Adverse Drug Reaction (ADR) report issued by UKGov506 deaths 87,662 reports Rule of thumb is only 1-10% of A…",2801589414,millertime8899,,90,17654,,False,False,5824,,,25,0,0.95,0.25,positive
2021-03-11 17:01:20,1370057264200048650,"roccogalatilaw: Denmark. another country, like Austria, to suspend  Astra-Zeneca vaccine due to ""blood-clotting"" which  led to deaths a…",2313281475,Guylys333,,204,3853,,False,False,37720,,,1501,0,0.375,-0.125,negative
2021-03-11 17:01:20,1370057263721889795,kayleighmcenany: FINALLY the Biden admin recognizes the Trump admin’s unprecedented vaccine work:➡️ “We’re grateful for the work that…,1238560726899404801,rIcKyT_1963,,83,527,,False,False,2070,,,4662,0,0.95,0.3,positive
2021-03-11 17:01:20,1370057262937468928,"MichelleObama: When you can get the COVID-19 vaccine, I hope you do—Barack and I are certainly glad we did. It’s our best shot at beati…",705922692688453632,AmberCarlance,"Reading, PA ",2799,215744,,True,False,153977,,,8546,0,0.65,0.75,positive
