created,id_str,text,user_id,screen_name,location,followers_count,user_favourites_count,time_zone,geo_enabled,verified,status_count,geo,coords,retweet_count,tweet_favourite_count,Subjectivity,Polarity,Sentiment
2021-03-11 16:59:03,1370056688477351936,"""J&amp;J, by contrast, sought to determine whether one dose of its vaccine protected against moderate to severe Covid illness — defined as a combination of a positive test and at least one symptom such as shortness of breath, beginning from 14 or 28 days after the single shot.""",198888429,RellonEarth,In or around DC,353,896,,False,False,35563,,,1,1,0.471948051948052,-0.02883116883116883,negative
2021-03-11 16:59:03,1370056686292058112,"TundeEddnut: Denmark, Norway, Austria suspend the use of AstraZeneca vaccine over blood clot fears. This is the same vaccine brought…",1321225273002569728,ibraheem_530,"Yobe, Nigeria",2077,34804,,True,False,24781,,,55,0,0.125,0.0,neutral
2021-03-11 16:59:02,1370056685255938048,narendramodi: Happy to share that my mother has taken the first dose of the COVID-19 vaccine today. I urge everyone to help and motivat…,895676975137697794,karthick_sk65,"Bengaluru, India",280,59546,,False,False,166162,,,17140,0,0.6666666666666666,0.525,positive
2021-03-11 16:59:02,1370056684215865348,mariamainmo: Girls don't want boys. They want the covid vaccine and a nice apartment,487040084,DeeeLeex,"Miami, FL",1160,250206,,False,False,115422,,,25410,0,1.0,0.6,positive
2021-03-11 16:59:02,1370056683230277640,kayleighmcenany: FINALLY the Biden admin recognizes the Trump admin’s unprecedented vaccine work:➡️ “We’re grateful for the work that…,44447962,Char4Trump,🇺🇸 Florida🌞 ,533,18814,,False,False,17903,,,4662,0,0.95,0.3,positive
2021-03-11 16:59:02,1370056682861043716,narendramodi: Happy to share that my mother has taken the first dose of the COVID-19 vaccine today. I urge everyone to help and motivat…,1334914066746232834,DineshG49042750,,16,834,,False,False,886,,,17140,0,0.6666666666666666,0.525,positive
2021-03-11 16:59:01,1370056681690861570,"Norway, Denmark, Iceland Suspend Use Of AstraZeneca COVID-19 Vaccine Over Blood Clot Fears ",4741864504,iam_tmaq,,273,73,,False,False,25431,,,0,0,0.0,0.0,neutral
2021-03-11 16:59:01,1370056681342701572,danieteebee: It’s completely predictably American that the brand of COVID vaccine you have access to has now become a class signifier,1648536384,huneydippp,she/her,982,123156,,True,False,62645,,,10923,0,0.0,0.0,neutral
2021-03-11 16:59:01,1370056679795003396,POTUS: One in four adults in the U.S. has received their first COVID-19 vaccine — and we’re now leading the world in vaccinations.Tha…,259808855,Benji_Gun,Northern Los Angeles,12,6730,,False,False,982,,,16530,0,0.3333333333333333,0.25,positive
2021-03-11 16:59:01,1370056679140831237,"A Coast Guard search was underway Wednesday night following a multi-car crash on the Bay Bridge and a driver who reportedly jumped into the water, more CVS stores get the COVID vaccine, and a poll finds that 1 in 5 Americans lost someone in the pandemic. ",14093707,SFist,San Francisco,281769,965,,True,True,38768,,,3,4,0.3,0.25,positive
2021-03-11 16:59:01,1370056678092140544,"MichelleObama: When you can get the COVID-19 vaccine, I hope you do—Barack and I are certainly glad we did. It’s our best shot at beati…",3435480864,adazzlinglover,melbourne,13094,650190,,True,False,546306,,,8546,0,0.65,0.75,positive
2021-03-11 16:59:01,1370056677991530496,VDHgov: DYK The Johnson&amp;Johnson vaccine requires only a single dose to protect you from COVID-19. You’ll be protected about 2 weeks a…,20737589,mharvey816,NW MO ➡️ NoVA,6022,1489635,,True,False,966162,,,10,0,0.6071428571428571,-0.03571428571428571,negative
2021-03-11 16:59:00,1370056677320499200,Remake of West Side Story but instead of a race war it’s a dance off between the kids who got the Pfizer Vaccine at Medgar Evers vs the Johnson &amp; Johnson Crew,502358573,DaltonRayce,"Brooklyn, NY",464,59566,,True,False,7524,,,0,7,0.0,0.0,neutral
2021-03-11 16:59:00,1370056676888473609,"BarackObama: Michelle and I got vaccinated against COVID-19 because we know it’s the best way to beat this pandemic, protect one anothe…",19198911,Toningtheom,New York/Worldwide,869,9663,,True,False,5872,,,10680,0,0.3,1.0,positive
2021-03-11 16:59:00,1370056676062064642,"MichelleObama: When you can get the COVID-19 vaccine, I hope you do—Barack and I are certainly glad we did. It’s our best shot at beati…",1266197324386021377,lizwipfliart,"Sacramento, CA",80,3688,,False,False,1773,,,8546,0,0.65,0.75,positive
2021-03-11 16:59:00,1370056675974017025,"JuddLegum: JohnKavanagh_AZ 3. Kavanaugh, who apparently believes its his job to ensure that ""uninformed"" people do not vote is support…",216786228,Alllwftopic,Everywhere,1865,190287,,True,False,613018,,,596,0,0.35,0.05,positive
2021-03-11 16:59:00,1370056674564800516,davidkurten: Seven European countries suspend use of Astra Zeneca Covid vaccine after blood clot deaths.I will not be taking a 'Covid…,123666193,GosuFitness,Republic of Europe,843,48928,,False,False,45608,,,854,0,0.0,0.0,neutral
2021-03-11 16:59:00,1370056674375921664,"In early February, Gov. Roy Cooper issued an executive order that opened the door for more types of health care providers to help get people vaccinated in North Carolina, including licensed dentists. Here's how that might work.nchealth coronavirusnc",307176947,NCHealthNews,North Carolina,9170,1481,,False,False,13487,,,1,4,0.4,0.3,positive
2021-03-11 16:59:00,1370056673914724352,SalehGh28: Me watching oxford astrazeneca  vaccine banned after already receiving my first dose..⁦AstraZeneca⁩ ,101551177,realheartache,Jamaica,631,38681,,True,False,9917,,,199,0,0.3333333333333333,0.25,positive
2021-03-11 16:58:59,1370056672656420864,disclosetv: JUST IN - Norway and Denmark suspend Oxford-AstraZeneca COVID19 vaccine rollout.,2361636319,franklion2014,,606,2013,,True,False,70447,,,2607,0,0.0,0.0,neutral
2021-03-11 16:58:59,1370056671855325184,AbdiwahabSheik7: The substandard AstraZeneca vaccine donated to Kenya and Somalia ‘s efficiency is only 63.09%. Compare it to Russia ‘s…,2893660395,mohamudbanjar,,179,11481,,False,False,4980,,,7,0,1.0,0.0,neutral
2021-03-11 16:58:59,1370056671725256711,POTUS: One in four adults in the U.S. has received their first COVID-19 vaccine — and we’re now leading the world in vaccinations.Tha…,1063273457650151424,dallicatt,United States,1560,180213,,False,False,51434,,,16530,0,0.3333333333333333,0.25,positive
2021-03-11 16:58:59,1370056671100293123,FullFact: Side effects are similar with the two Covid vaccines currently used in the UK.An article in the Express misleadingly sugges…,276442577,StarterPat,,394,27325,,False,False,196304,,,57,0,0.4,0.0,neutral
2021-03-11 16:58:59,1370056670429188096,ZeeOntario: Pfizer Demands Governments Gamble With State Assets To Secure Vaccine Deal - The Wire Science ,762757419663552513,Travelvar16,,2037,40694,,False,False,42843,,,5,0,0.6,0.4,positive
2021-03-11 16:58:59,1370056669879791618,jovanthony: The Jamaican Government will accept responsibility in the unlikely event that a citizen requires additional support as a re…,3239648838,JackReb65,Jamaica,350,52773,,False,False,12067,,,2,0,0.5,-0.5,negative
2021-03-11 16:58:59,1370056669418377217,JasonRaven_: MORE: Here’s how COVID-19 vaccines will be allocated regionally. State law requires DHEC to consider factors like minority…,16138559,WSPA7,"Spartanburg, SC",66410,854,,False,True,136338,,,2,0,0.5,0.5,positive
2021-03-11 16:58:59,1370056669414182915,AlbertBourla: Excited to receive my 2nd dose of the Pfizer/BioNTech COVID19 vaccine. There's nothing I want more than for my loved one…,366253632,marinaescobar3,Venezuela,3526,72721,,True,False,84312,,,217,0,0.5125,0.39375,positive
2021-03-11 16:58:59,1370056669162565633,narendramodi: Happy to share that my mother has taken the first dose of the COVID-19 vaccine today. I urge everyone to help and motivat…,2224934510,jigarshastri9,,492,7964,,False,False,10923,,,17140,0,0.6666666666666666,0.525,positive
2021-03-11 16:58:58,1370056669091278850,"iainnicol Depends what the effectiveness is measured again each companies clinical trial used different definitions. Pfizer and Moderna went for prevention of all sympatoms, AZ and J&amp;J went for prevention of hospitalisation and death. Different views and methods same outcome - protection.",17234202,curexcomplex,"Utica, NY",8171,51318,,False,False,158149,,,0,2,0.44166666666666665,0.0,neutral
2021-03-11 16:58:58,1370056668831223808,Joined the Covid Vaccine Club. Kind of birthday present I like. Thank you NHSuk ✨🎉💕 COVID19 CovidVaccine AstraZeneca ,426829534,_chloe___louise,"Leicester, England",355,18754,,True,False,5753,,,0,8,0.45,0.3,positive
2021-03-11 16:58:58,1370056668323667971,POTUS: One in four adults in the U.S. has received their first COVID-19 vaccine — and we’re now leading the world in vaccinations.Tha…,1155943108011593728,BudDe55,"Hollywood, Fl.",1769,28104,,False,False,11409,,,16530,0,0.3333333333333333,0.25,positive
2021-03-11 16:58:58,1370056668076150784,"KSLcom: BREAKING: Utah plans on opening COVID-19 vaccine eligibility to every adult by April 1, governor's office says ",201481484,CHCity,Utah,3083,1043,,True,False,9245,,,110,0,0.3,0.1,positive
2021-03-11 16:58:58,1370056667891646467,"scad_official: We received our delivery of AstraZeneca. Covid-19 vaccines barely two weeks ago, now this...! 😭😭😭 ",3368952419,MichaelWatch_,,8357,57452,,True,False,25991,,,49,0,0.1,0.0625,positive
2021-03-11 16:58:58,1370056665307836417,CNN: The European Union's medicines regulator has recommended authorizing Johnson &amp; Johnson's single-dose Covid-19 vaccine. ,1329137491681583105,MedPPEGlobal,,13,199,,False,False,174,,,67,0,0.0,0.0,neutral
2021-03-11 16:58:57,1370056663114395650,Buhari.....AstraZeneca.........Blood clot,89695270,SegunMossy,Everywhere,1218,1650,,True,False,30808,,,0,0,0.0,0.0,neutral
2021-03-11 16:58:57,1370056662648770569,Reuters: Denmark suspends AstraZeneca COVID vaccine after blood clot reports  ,1032900751,ErfanAdnan,,346,2802,,True,False,6763,,,1011,0,0.0,0.0,neutral
2021-03-11 16:58:57,1370056662002892805,danieteebee: It’s completely predictably American that the brand of COVID vaccine you have access to has now become a class signifier,1164953670,SpicePetty,,105,57617,,True,False,40313,,,10923,0,0.0,0.0,neutral
2021-03-11 16:58:57,1370056661877002249,"I, an essential worker, am now on the list for a covid vaccine 🤠",1942588712,JusticeBurrell,"Aledo, IL",428,34174,,True,False,29573,,,0,14,0.3,0.0,neutral
2021-03-11 16:58:57,1370056661369507846,"JKNjenga: Kenya is a comedy show, but it is not funny.Weeks after splashing 4.2 billion for MCAs to vote BBI, we are begging 5 billio…",2348408199,winnienkatha31,"Nairobi, Kenya",464,5408,,False,False,1093,,,898,0,0.0,0.0,neutral
2021-03-11 16:58:57,1370056660941729795,"scdhec: Even though vaccines have arrived to boost our efforts to end COVID-19, some people are skeptical of the vaccine. Dr. Linda Bel…",1273033981462798339,3_cp3o,Somewhere in South Carolina,20,1646,,False,False,2169,,,10,0,0.5,-0.5,negative
2021-03-11 16:58:57,1370056660807475205,Reuters: Pfizer/BioNTech say data suggests vaccine 94% effective in preventing asymptomatic infection  ,2851385591,nikki_ayesha,"Karachi, Pakistan",305,8647,,False,False,14502,,,117,0,0.8,0.6,positive
2021-03-11 16:58:56,1370056660073508869,"TundeEddnut: Denmark, Norway, Austria suspend the use of AstraZeneca vaccine over blood clot fears. This is the same vaccine brought…",296150213,YO_itsjide,Lagos,1087,7381,,True,False,42970,,,55,0,0.125,0.0,neutral
2021-03-11 16:58:56,1370056657456234500,"Denmark, Norway, Austria, Italy and Iceland - have suspended use of the Oxford-AstraZeneca jab after reports of blood clots in vaccinated people.",569413316,djandjava,"London, England",2828,5634,,False,False,10074,,,0,0,0.0,0.0,neutral
2021-03-11 16:58:56,1370056657368145920,"ridgeisback: To all those that have had the vaccine, just  ask yourselves 'what if the conspiracy theorists are right?'.We've been rig…",1326595076353630216,Ness83228462,,139,17861,,False,False,788,,,212,0,0.5357142857142857,0.2857142857142857,positive
2021-03-11 16:58:56,1370056657212952588,redapes: Endangered Great Apes Receive COVID-19 Vaccine at San Diego Zoo ,904018738579693570,tee_em_are,"Kentucky, USA",1134,225008,,False,False,70605,,,6,0,0.75,0.8,positive
2021-03-11 16:58:55,1370056655396696064,I did a survey to get my son on a registry for Covid vaccine trials and they had this for gender! Love it! Thank you KPWaResearch ,2182645955,nerdmomglitter,"Redmond, WA",780,67187,,True,False,15026,,,3,17,0.6,0.625,positive
2021-03-11 16:58:55,1370056655224770561,Just In from ICMR: The Covid vaccine works even without posting a picture of getting the jab.,3107094259,RamShewalkar18,Rasayani,122,4029,,True,False,6624,,,0,0,0.0,0.0,neutral
2021-03-11 16:58:55,1370056654725677057,POTUS: One in four adults in the U.S. has received their first COVID-19 vaccine — and we’re now leading the world in vaccinations.Tha…,1031988974829465600,RitaTrachuk,,24,17427,,True,False,15374,,,16530,0,0.3333333333333333,0.25,positive
2021-03-11 16:58:55,1370056652955717636,Single dose of the BioNTech/Pfizer vaccine is less effective in immunocompromised patients with cancer and that delaying their second shot is risking cancer patients’ lives.CovidVaccineCancer,792782917638455296,BremainInSpain,Spain,22920,74399,,False,False,125767,,,3,5,0.2702380952380953,0.09047619047619047,positive
2021-03-11 16:58:54,1370056651613433857,alfngete Asmali77 Norway has also suspended the use of Astra-Zeneca due to blood clots reports.,327656744,Kibonge254,Nairobi.,187,4752,,False,False,2507,,,0,0,0.375,-0.125,negative
2021-03-11 16:58:54,1370056651001184260,POTUS: One in four adults in the U.S. has received their first COVID-19 vaccine — and we’re now leading the world in vaccinations.Tha…,361525110,CoogForever,,213,84148,,True,False,66376,,,16530,0,0.3333333333333333,0.25,positive
2021-03-11 16:58:54,1370056649990410243,AshuBose3 LeonLidigu But Denmark &amp; Netherlands have stopped the use of AstraZeneca Covid 19 vaccine due to incidences of blood clots among those vaccinated! Is it not an issue of concern to us?,555777964,MburuMose,Republic of Kenya,745,6418,,True,False,6923,,,0,0,0.375,-0.15625,negative
2021-03-11 16:58:54,1370056649474457600,"FinancialTimes: Denmark, Norway and Iceland have suspended use of the Oxford/AstraZeneca vaccine in a 'precautionary' move after a Dani…",924271441,Scarlet099,"Preston, England",1769,26113,,False,False,90623,,,329,0,0.0,0.0,neutral
2021-03-11 16:58:54,1370056649067614209,danieteebee: It’s completely predictably American that the brand of COVID vaccine you have access to has now become a class signifier,611868495,rogeliocano4,"Arkansas, USA",375,50019,,False,False,26976,,,10923,0,0.0,0.0,neutral
2021-03-11 16:58:53,1370056648019095557,kiss: .PaulStanleyLive with ladailynews ,1191425445746663424,inahexe1,,224,31893,,False,False,3896,,,46,0,0.0,0.0,neutral
2021-03-11 16:58:53,1370056646051905538,punditclass: At least six European countries have halted the AstraZeneca vaccine after some people died from blood clots ,1191472857836138498,4futureHope,,399,98794,,False,False,93746,,,5,0,0.2,-0.15,negative
2021-03-11 16:58:53,1370056644567130117,Sam_Lulli: Denmark suspends use of AstraZeneca Covid vaccine (currently being used in Kenya) over reports of blood clots.,1104345660244017152,iam_renson,"Bomet, Kenya🇰🇪",13164,62800,,True,False,16054,,,66,0,0.4,0.0,neutral
2021-03-11 16:58:53,1370056644550406146,"MichelleObama: When you can get the COVID-19 vaccine, I hope you do—Barack and I are certainly glad we did. It’s our best shot at beati…",1205816432,LibbyBibby4,"South Carolina, USA",146,17036,,True,False,8959,,,8546,0,0.65,0.75,positive
2021-03-11 16:58:52,1370056643023605760,RealJoelSmalley: It has started... ,374397850,dazhillbilly,,234,1052,,True,False,19406,,,535,0,0.0,0.0,neutral
2021-03-11 16:58:52,1370056642855890953,ClareCraigPath: And 8 countries have today suspended use of AstraZeneca vaccine pending investigation that it is causing clots which ca…,1289608653226553349,PaulGoo81186940,,30,3423,,False,False,925,,,223,0,0.0,0.0,neutral
2021-03-11 16:58:52,1370056640729395214,"roccogalatilaw: Denmark. another country, like Austria, to suspend  Astra-Zeneca vaccine due to ""blood-clotting"" which  led to deaths a…",1273428987704942599,Ladybug24087592,,81,32796,,False,False,12674,,,1501,0,0.375,-0.125,negative
2021-03-11 16:58:52,1370056640674856965,"MichelleObama: When you can get the COVID-19 vaccine, I hope you do—Barack and I are certainly glad we did. It’s our best shot at beati…",26061966,phuffdaddy,"Washington, DC, USA",1793,34631,,True,True,40822,,,8546,0,0.65,0.75,positive
2021-03-11 16:58:52,1370056640272203776,laulauhula: KevCoke6 I don't understand how this will not prolong the pandemic when the vaccine neither : A. prevents someone from con…,118206026,TinksitLikeitIs,MYOB,750,247914,,True,False,85449,,,8,0,0.0,0.0,neutral
2021-03-11 16:58:52,1370056640205103108,missme5__: Buy airtime across all networks using INSTANT_966966 💎Lipa na Mpesa 💎Paybill no 966966💎A/cc no is your phone number💎Ent…,1310946363589492737,malequeen7,unknown ,14027,46871,,True,False,30085,,,53,0,0.0,0.0,neutral
2021-03-11 16:58:52,1370056639953346561,"JuddLegum: JohnKavanagh_AZ 3. Kavanaugh, who apparently believes its his job to ensure that ""uninformed"" people do not vote is support…",20558712,Karen_Russell,Cascadia,3188,17877,,False,False,65514,,,596,0,0.35,0.05,positive
2021-03-11 16:58:51,1370056638976065536,POTUS: One in four adults in the U.S. has received their first COVID-19 vaccine — and we’re now leading the world in vaccinations.Tha…,116042984,Msbmoran,,2760,109925,,False,False,86577,,,16530,0,0.3333333333333333,0.25,positive
2021-03-11 16:58:51,1370056638388899842,wsteaks This was December.,900385948697022464,FionaYancy,"Norfolk, VA",192,40570,,False,False,4908,,,4,22,0.0,0.0,neutral
2021-03-11 16:58:51,1370056638095265794,"MailOnline: Mother, 39, with NO known health issues dies four days after receiving second dose of Moderna's COVID vaccine ",1362186732146364418,AmKertesz,,9,887,,False,False,248,,,307,0,0.0,0.0,neutral
2021-03-11 16:58:51,1370056637839507461,Canada on track to receive 36.4 million COVID-19 vaccine doses by July | CBC News ,970860635369205761,potomkine,,1996,27041,,False,False,44213,,,0,0,0.0,0.0,neutral
2021-03-11 16:58:51,1370056637365555208,"BarackObama: Michelle and I got vaccinated against COVID-19 because we know it’s the best way to beat this pandemic, protect one anothe…",1334284065038610432,MarielaH0489,,701,9191,,False,False,6038,,,10680,0,0.3,1.0,positive
2021-03-11 16:58:51,1370056635884900353,SunSpearTom Joe_LoGuidice  better safe than sorry.,167398613,YaegerSC2,"Trondheim, Norway",48,478,,False,False,862,,,0,1,0.6666666666666666,0.16666666666666666,positive
2021-03-11 16:58:51,1370056635687727104,"Utah will roll back its mask mandate 4/10Vaccination of the general public will begin on 4/1About 10% of the population in Utah is fully vaccinated currently,J&amp;J vaccine takes 28 days to be effective, Pfizer &amp; Moderna up to 14-20 days after the 2nd shot. utpol",1353168960183705601,will_r_higgins,"Utah, USA",16,248,,False,False,46,,,1,3,0.2733333333333333,0.13,positive
2021-03-11 16:58:50,1370056635062890501,nypost: Utah mom Kassidi Kurill dies four days after second dose of Moderna vaccine  ,371397548,bryant_184,NYC is where I be,725,85657,,True,False,98665,,,523,0,0.0,0.0,neutral
2021-03-11 16:58:50,1370056634697928705,"MichelleObama: When you can get the COVID-19 vaccine, I hope you do—Barack and I are certainly glad we did. It’s our best shot at beati…",951966514005069825,WhitnerTrinia,"Newark, DE",269,154518,,False,False,83207,,,8546,0,0.65,0.75,positive
2021-03-11 16:58:50,1370056633825562630,snopes: The underlying claim is a misrepresentation of the facts. ,119028672,Holy_Shadows,"St Louis, MO",469,46369,,False,False,15055,,,11,0,0.0,0.0,neutral
2021-03-11 16:58:50,1370056633045377031,POTUS: One in four adults in the U.S. has received their first COVID-19 vaccine — and we’re now leading the world in vaccinations.Tha…,2227529169,AngrokVa,Everywhere and nowhere. :P,195,113884,,False,False,15867,,,16530,0,0.3333333333333333,0.25,positive
2021-03-11 16:58:50,1370056632139448323,Forbes: Denmark and Norway have temporarily suspended the rollout of the AstraZeneca-Oxford Covid-19 vaccine over blood clotting concer…,3132123721,ArtCashy,,272,26586,,False,False,10515,,,44,0,0.0,0.0,neutral
2021-03-11 16:58:50,1370056632068083722,LaymansScience jay99824300 38tori MccairnDr FatEmperor Considerations for continuation of blinded Phase 3 clinical trials if an EUA has been issued for an investigational COVID-19 vaccine,90772490,MarieASexton,"Vernon, CT",342,11007,,False,False,34390,,,0,0,0.0,0.0,neutral
2021-03-11 16:58:49,1370056631132766211,"LynnBrittney2: Now Denmark is halting vaccination with Astra Zeneca due to side effects. That's the 6th country. Austria, Estonia, Lith…",1245822180773986305,jlcpnewmarket,,153,16535,,False,False,13725,,,313,0,0.375,-0.125,negative
2021-03-11 16:58:49,1370056630168121347,AishaYesufu: The rulers in Nigeria are showing us pictures of themselves taking the COVID-19 vaccine as if they are making sacrifice fo…,1307363406,AmbioA,,173,30174,,False,False,17236,,,1017,0,0.0,0.0,neutral
2021-03-11 16:58:49,1370056629417246720,donkamion78: Florida nurse exposes dangers of Moderna COVID-19 vaccine ,1205284542048813056,CreatveCmmndo,"Leeds, England",92,7505,,False,False,1541,,,130,0,0.0,0.0,neutral
2021-03-11 16:58:49,1370056629236940801,POTUS: One in four adults in the U.S. has received their first COVID-19 vaccine — and we’re now leading the world in vaccinations.Tha…,1385413094,HanbyAndrew,UK,1562,74118,,True,False,57716,,,16530,0,0.3333333333333333,0.25,positive
2021-03-11 16:58:49,1370056628435709952,a2studoffl: Tomorrow going to inject covid vaccine 🙌🏻,1009286039909773313,Devahar2,"avadi, Chennai",690,56052,,True,False,28986,,,9,0,0.0,0.0,neutral
2021-03-11 16:58:49,1370056627789950979,POTUS: One in four adults in the U.S. has received their first COVID-19 vaccine — and we’re now leading the world in vaccinations.Tha…,2641297690,itsnotrhea,,105,12667,,False,False,5118,,,16530,0,0.3333333333333333,0.25,positive
2021-03-11 16:58:49,1370056627735425026,jafeti11026 MOH_Kenya Pfizer and moderna are for eliteThe rest is for common mwananchi,377572081,fulaniyule,"West Meath, Ireland",448,5382,,True,False,3374,,,0,2,0.5,-0.3,negative
2021-03-11 16:58:49,1370056627534106629,"MichelleObama: When you can get the COVID-19 vaccine, I hope you do—Barack and I are certainly glad we did. It’s our best shot at beati…",1331769929394245632,JoshuaX1993,"New York, NY",101,15594,,True,False,5321,,,8546,0,0.65,0.75,positive
2021-03-11 16:58:48,1370056625755549696,danieteebee: It’s completely predictably American that the brand of COVID vaccine you have access to has now become a class signifier,1335875163049533440,Cocokushhh,𝐬𝐡𝐞♡︎𝐡𝐞𝐫 ,245,7611,,True,False,4185,,,10923,0,0.0,0.0,neutral
2021-03-11 16:58:48,1370056625667649537,ntvkenya: Denmark suspends use of AstraZeneca vaccine over blood clot  ,1650585512,_skulz,"Nairobi, Kenya",532,969,,False,False,117612,,,12,0,0.0,0.0,neutral
2021-03-11 16:58:48,1370056625260654593,POTUS: One in four adults in the U.S. has received their first COVID-19 vaccine — and we’re now leading the world in vaccinations.Tha…,3284541966,Anhdeely,,149,58712,,True,False,3585,,,16530,0,0.3333333333333333,0.25,positive
2021-03-11 16:58:48,1370056625034199045,.⁦pfizer⁩ Covid vaccine blocks most asymptomatic and symptomatic cases in Israel CNBC ,2961500847,surgeonretina,Ann Arbor,3081,6139,,True,False,20254,,,2,1,0.5,0.5,positive
2021-03-11 16:58:48,1370056624887324675,"A relative, a nurse, reports that 13,000 covid-19 vaccine doses are  available in my area. 300 have been giving out. Of those, a doctor for USANA, died of covid-19 after getting the Pfizer vaccine. That's okay, Pfizer has immunity from prosecution, so everything's okay. All's gud",177640185,markjc2002,,14,41,,False,False,1130,,,1,0,0.35,0.35,positive
2021-03-11 16:58:48,1370056624455380992,ruthmkb: I get it AstraZeneca has an expiry date &amp; they shld b used up. BUT indiscriminately jabbing ppl? What has RickHillier been d…,16629664,marn_1966,central ontario,268,10996,,False,False,53571,,,47,0,0.0,0.0,neutral
2021-03-11 16:58:47,1370056621364232204,mariamainmo: Girls don't want boys. They want the covid vaccine and a nice apartment,3786741313,dani_gzza,,267,18962,,True,False,16461,,,25410,0,1.0,0.6,positive
2021-03-11 16:58:47,1370056620760252421,"MichelleObama: When you can get the COVID-19 vaccine, I hope you do—Barack and I are certainly glad we did. It’s our best shot at beati…",1179124505324769286,itsDCastrillon,"Washington, DC",264,605,,False,False,1100,,,8546,0,0.65,0.75,positive
2021-03-11 16:58:47,1370056620475056134,"MichelleObama: When you can get the COVID-19 vaccine, I hope you do—Barack and I are certainly glad we did. It’s our best shot at beati…",173544620,Zomzilove,"Palm Beach, FL/Philadelphia ",1332,76599,,True,False,42932,,,8546,0,0.65,0.75,positive
2021-03-11 16:58:47,1370056620110196737,CTVNews: Denmark suspends use of AstraZeneca vaccine as 'precautionary measure' ,1608587778,TraciVoice,,370,49755,,False,False,78822,,,183,0,0.0,0.0,neutral
2021-03-11 16:58:46,1370056618369499139,CBSNews: Over a third of Republicans don't want the COVID vaccine — and many of them aren't budging ,2686561322,Jimbobbarley,USA,3558,30222,,False,False,129914,,,82,0,0.25,0.25,positive
