created,id_str,text,user_id,screen_name,location,followers_count,user_favourites_count,time_zone,geo_enabled,verified,status_count,geo,coords,retweet_count,tweet_favourite_count,Subjectivity,Polarity,Sentiment
2021-03-11 17:00:39,1370057092606918659,kayleighmcenany: FINALLY the Biden admin recognizes the Trump admin’s unprecedented vaccine work:➡️ “We’re grateful for the work that…,3419318626,rhoda_bennett,Colorado...Alabama USA,3583,152354,,True,False,100932,,,4662,0,0.95,0.3,positive
2021-03-11 17:00:39,1370057092195885057,"People who have completed their COVID-19 vaccine regimen are no longer subject to the state's test-or-quarantine travel requirements as long as it has been more than 14 days since their final dose, under a new update to the order. ",2996801,WBUR,Boston,89699,2154,,True,True,183805,,,0,4,0.5375757575757576,0.08393939393939394,positive
2021-03-11 17:00:39,1370057091260370944,POTUS: One in four adults in the U.S. has received their first COVID-19 vaccine — and we’re now leading the world in vaccinations.Tha…,181483914,HarenNt,Canada,144,1941,,True,False,5907,,,16530,0,0.3333333333333333,0.25,positive
2021-03-11 17:00:39,1370057091038244875,AllenLEllison: . marcorubio didn’t give a damn about you during this entire pandemic. He even skipped your grandparents in line to get…,825030296844185600,Elizabe29599604,,536,117636,,False,False,118453,,,586,0,0.625,0.0,neutral
2021-03-11 17:00:39,1370057090849329157,"MichelleObama: When you can get the COVID-19 vaccine, I hope you do—Barack and I are certainly glad we did. It’s our best shot at beati…",818920427716104192,isthis4real17,,300,59915,,True,False,65543,,,8546,0,0.65,0.75,positive
2021-03-11 17:00:39,1370057090643890178,narendramodi: Happy to share that my mother has taken the first dose of the COVID-19 vaccine today. I urge everyone to help and motivat…,1152585665588027393,SumitPa83363084,"Mumbai, India",22,18257,,True,False,748,,,17140,0,0.6666666666666666,0.525,positive
2021-03-11 17:00:39,1370057089507332099,"TheInsiderPaper: BIG: Denmark, Italy, Norway and 6 other countries suspend use of AstraZeneca vaccine after reports of blood clots. 1 d…",1034706252759289856,ThalliumMK,Macedonia,958,76805,,False,False,20293,,,108,0,0.2375,-0.0625,negative
2021-03-11 17:00:39,1370057089092096003,"carolinefan Stllegend Many STL black folks fear COVID vaccine. To reduce fear, I post pics &amp; links of vaccinated locals on Facebook Black St Louis Vaccinated &amp; BlkStlVaccinatd. Pls message or send me pics of vaccine procedure/sticker/bandaid.",1362420572253286401,BlkStlVaccinatd,,4,95,,False,False,35,,,0,2,0.45555555555555555,0.05555555555555557,positive
2021-03-11 17:00:38,1370057088286793732,This is a brilliant development! We need to make sure that everyone experiencing homelessness has access to the Covid-19 vaccine to prevent healthcare inequalities. ⬇️ ,730734472438632448,HarbourHousing,"South West, England",994,11734,,True,False,2345,,,0,3,0.9444444444444444,0.75,positive
2021-03-11 17:00:38,1370057088169283593,"HarmReduction: Two upcoming Office Hours exploring COVID Vaccine + Harm Reduction!Part 1: COVID Vaccine + PWUD, LGB TGNC+, Folks with…",414164102,DrKimSue,"New Haven, CT",11417,16031,,True,True,3893,,,12,0,0.0,0.0,neutral
2021-03-11 17:00:38,1370057087993188357,disclosetv: JUST IN - Norway and Denmark suspend Oxford-AstraZeneca COVID19 vaccine rollout.,334654986,Nwiuelucky,Port Harcourt,83,12774,,True,False,8883,,,2607,0,0.0,0.0,neutral
2021-03-11 17:00:38,1370057087045267456,tony80554056 JeSuisTinkerbel They've happened in the UK too. AZ: 13 pulmonary embolisms. 14 cases deep vein thrombosis. Pfizer 15 P. embolism. 8 DVT.,16561745,Welshwoman,"Wales, UK",1256,22330,,False,False,23406,,,4,4,0.4,0.0,neutral
2021-03-11 17:00:38,1370057085770031104,kayleighmcenany: FINALLY the Biden admin recognizes the Trump admin’s unprecedented vaccine work:➡️ “We’re grateful for the work that…,717867921,rickitick43,,193,77648,,False,False,20354,,,4662,0,0.95,0.3,positive
2021-03-11 17:00:38,1370057085040390156,"MichelleObama: When you can get the COVID-19 vaccine, I hope you do—Barack and I are certainly glad we did. It’s our best shot at beati…",3037562837,PlumleyGirl,"New Jersey, USA",755,147251,,True,False,56273,,,8546,0,0.65,0.75,positive
2021-03-11 17:00:38,1370057084931309574,danieteebee: It’s completely predictably American that the brand of COVID vaccine you have access to has now become a class signifier,1281244992,TityKonnoisseur,"Detroit, MI",1086,36470,,True,False,72371,,,10923,0,0.0,0.0,neutral
2021-03-11 17:00:37,1370057083790446596,"Ocugen: $OCGN co-development partner, BharatBiotech shared Phase 3 interim results of Covaxin with data from 25,800 patients, which w…",845876496,craigpollock79,Darlington,11,120,,False,False,98,,,173,0,0.0,0.0,neutral
2021-03-11 17:00:37,1370057083069026311,"scad_official: We received our delivery of AstraZeneca. Covid-19 vaccines barely two weeks ago, now this...! 😭😭😭 ",1255206998968328193,queency_luv,,8185,16179,,False,False,14555,,,49,0,0.1,0.0625,positive
2021-03-11 17:00:37,1370057083039535106,narendramodi: Happy to share that my mother has taken the first dose of the COVID-19 vaccine today. I urge everyone to help and motivat…,1364037022315257860,SonuKum54474770,,0,1,,True,False,8,,,17140,0,0.6666666666666666,0.525,positive
2021-03-11 17:00:37,1370057082611851268,"nytimes: For some members of the LGBTQ community, and especially people of color, there is a hesitancy to get a Covid-19 vaccine that s…",47770352,ca_jackson,"Louisville, KY",111,9473,,True,False,7474,,,97,0,1.0,0.0,neutral
2021-03-11 17:00:37,1370057082590932995,kayleighmcenany: FINALLY the Biden admin recognizes the Trump admin’s unprecedented vaccine work:➡️ “We’re grateful for the work that…,1170012171436097537,lsaylor52,,22,2775,,False,False,1549,,,4662,0,0.95,0.3,positive
2021-03-11 17:00:37,1370057081659686912,POTUS: One in four adults in the U.S. has received their first COVID-19 vaccine — and we’re now leading the world in vaccinations.Tha…,4880030225,deardocmomi,,13418,26697,,False,False,15168,,,16530,0,0.3333333333333333,0.25,positive
2021-03-11 17:00:37,1370057081634574337,I pass on these pieces of news without comment..Norway earlier today joined the countries placing a temporary ban on use of the AstraZeneca Covid19 vaccine.Four hours later Norway is complaining about AZ delivering about 1 million fewer vaccines than they expected.,268385416,TWMCLtd,The North of England,2358,16731,,False,False,37983,,,0,5,0.3,-0.03333333333333333,negative
2021-03-11 17:00:37,1370057081022205952,politico: All living former presidents and first ladies — except the Trumps — appear in a new PSA urging Americans to get vaccinated ag…,236955375,christophcrews,"Richmond, VA",784,193981,,False,False,105994,,,382,0,0.2626262626262626,0.12878787878787878,positive
2021-03-11 17:00:36,1370057079436709888,"fionamflanagan1: While Denmark, Austria, Estonia, Lithuania, Luxembourg &amp; Latvia suspend their use of the Astra Zeneca injection on saf…",920796357945733120,DarrenMcHugh08,"Calgary, Alberta",567,42129,,False,False,41777,,,83,0,0.0,0.0,neutral
2021-03-11 17:00:36,1370057078547570690,kayleighmcenany: FINALLY the Biden admin recognizes the Trump admin’s unprecedented vaccine work:➡️ “We’re grateful for the work that…,4920745430,lisalabarge169,"Topeka, KS",388,56386,,False,False,55085,,,4662,0,0.95,0.3,positive
2021-03-11 17:00:36,1370057078321074182,"BarackObama: Michelle and I got vaccinated against COVID-19 because we know it’s the best way to beat this pandemic, protect one anothe…",368154480,rosesaustx,,191,116198,,False,False,22403,,,10680,0,0.3,1.0,positive
2021-03-11 17:00:36,1370057076735627265,"JuddLegum: JohnKavanagh_AZ 3. Kavanaugh, who apparently believes its his job to ensure that ""uninformed"" people do not vote is support…",717041265355964418,BixJacks,United States,1638,335599,,False,False,86835,,,596,0,0.35,0.05,positive
2021-03-11 17:00:36,1370057076525953030,POTUS: One in four adults in the U.S. has received their first COVID-19 vaccine — and we’re now leading the world in vaccinations.Tha…,1352965088827813888,Muhamma17838323,,5,2370,,False,False,45,,,16530,0,0.3333333333333333,0.25,positive
2021-03-11 17:00:36,1370057076299419648,POTUS: One in four adults in the U.S. has received their first COVID-19 vaccine — and we’re now leading the world in vaccinations.Tha…,1284951240024166401,dietrichellen,"Los Angeles, CA",26,4848,,False,False,810,,,16530,0,0.3333333333333333,0.25,positive
2021-03-11 17:00:35,1370057075527663616,"Denmark, Norway and Iceland have suspended use of the Oxford/AstraZeneca vaccine in a 'precautionary' move after a Danish woman died with blood clots following inoculation ",30701862,shehzadyounis,Thinkstan,443,0,,False,False,319535,,,0,0,0.1,0.0,neutral
2021-03-11 17:00:35,1370057074378412034,POTUS: One in four adults in the U.S. has received their first COVID-19 vaccine — and we’re now leading the world in vaccinations.Tha…,15220825,ChrisBumcrot,New York,101,19565,,True,False,7001,,,16530,0,0.3333333333333333,0.25,positive
2021-03-11 17:00:35,1370057073971503107,Go read this story about how bad software helped slow coronavirus vaccine distributionThe site is apparently a nightmare to navigaterxa 👁⚙🌩,67803525,BryanWilhite,California,462,6,,True,False,22531,,,0,0,0.47222222222222215,-0.3166666666666666,negative
2021-03-11 17:00:35,1370057073828843525,Denmark pauses AstraZeneca COVID-19 vaccine to probe reports of blood clots ,1643123766,akbarth3great,🌎 Everywhere,12881,109,,False,False,42918,,,3,0,0.0,0.0,neutral
2021-03-11 17:00:35,1370057072910422017,IR0NSPIDEY that and a lot of money and resources were made available to start studying covid-19 to get a vaccine as soon as possible!,867443437209104385,captlavenders,"goodbye, tower girl",1060,73436,,True,False,42272,,,0,1,0.7,0.2,positive
2021-03-11 17:00:35,1370057072499384322,"BarackObama: Michelle and I got vaccinated against COVID-19 because we know it’s the best way to beat this pandemic, protect one anothe…",460607223,TheSuperNupe,"The Burning Sands - My media is just gifs...save yourself the trouble, and just follow back.",3756,71934,,False,False,121520,,,10680,0,0.3,1.0,positive
2021-03-11 17:00:35,1370057072201502724,nypost: Utah mom Kassidi Kurill dies four days after second dose of Moderna vaccine  ,1270271212845805568,Cookie28499011,,15,2328,,False,False,1476,,,523,0,0.0,0.0,neutral
2021-03-11 17:00:35,1370057072100962304,thierrybaudet: Austria suspends AstraZeneca COVID-19 vaccine batch after death | Article [AMP] | Reuters ,590896963,Monnhick,"Noord-Holland, Nederland",193,6802,,False,False,2143,,,386,0,0.0,0.0,neutral
2021-03-11 17:00:35,1370057072084013059,CVS adds 74 COVID-19 vaccine sites in Texas ,1643123766,akbarth3great,🌎 Everywhere,12881,109,,False,False,42918,,,3,0,0.0,0.0,neutral
2021-03-11 17:00:34,1370057070041571331,fearlesssoski: HIV/AIDS came No Vaccine was given.Ebola came No Vaccine was given.Lassa Fever came No Vaccine was given.Hepatitis ca…,3763139007,Chris75620966,"Nürnberg, Bayern Germany ",51,24,,False,False,1707,,,9,0,0.0,0.0,neutral
2021-03-11 17:00:34,1370057069349457921,CleanAirMoms: Pfizer Covid vaccine blocks 94% of asymptomatic infections and 97% of symptomatic cases in Israeli study ,1277419895664398337,exponentialGPs,,15,42367,,False,False,10039,,,4,0,0.0,0.0,neutral
2021-03-11 17:00:34,1370057068720295940,SteveClarkPC: Our government has reached an incredible milestone: one million doses of the COVID-19 vaccines administered.   Ontario…,825060844845281281,ONPCWIP,,490,6075,,False,False,3641,,,3,0,0.9,0.9,positive
2021-03-11 17:00:34,1370057067873058817,"MichelleObama: When you can get the COVID-19 vaccine, I hope you do—Barack and I are certainly glad we did. It’s our best shot at beati…",19915883,deeshaw,Massachusetts,4442,126826,,True,False,78681,,,8546,0,0.65,0.75,positive
2021-03-11 17:00:34,1370057067835187202,"JuddLegum: JohnKavanagh_AZ 3. Kavanaugh, who apparently believes its his job to ensure that ""uninformed"" people do not vote is support…",18761165,namesraine,"San Francisco, CA",424,139057,,True,False,9633,,,596,0,0.35,0.05,positive
2021-03-11 17:00:33,1370057067147431937,DHSCgovuk: COVID19 VACCINE UPDATE: Daily figures on the number of people who have received a COVID-19 vaccine in the UK.As of 11 Mar…,323989824,SahilOberoi1,"London, England",750,5858,,True,False,20937,,,60,0,0.0,0.0,neutral
2021-03-11 17:00:33,1370057067004895235,JuddLegum: JohnKavanagh_AZ ATT Allstate BCBSAssociation CoxComm WeAreFarmers pfizer UnitedHealthGrp USAA Prudential WellsFar…,16549998,graphaks,,787,99991,,False,False,36892,,,360,0,0.0,0.0,neutral
2021-03-11 17:00:33,1370057066790989830,Babubhai Patel has had his Covid-19 vaccine and would like to reassure our Gujarati speaking communities that the vaccine is safe and you should have it when it’s your turn CovidVaccine LetsBeatCovidLLR Iskcon Leicester ,48331473,NHSELRCCG,"Leicester, England",8096,1113,,True,True,14514,,,3,5,0.5,0.5,positive
2021-03-11 17:00:33,1370057066476417026,"AP_Europe: Denmark has temporarily suspended use of the AstraZeneca coronavirus vaccine after reports of blood clots in some people, bu…",334654986,Nwiuelucky,Port Harcourt,83,12774,,True,False,8883,,,83,0,0.0,0.0,neutral
2021-03-11 17:00:33,1370057066010845190,"MichelleObama: When you can get the COVID-19 vaccine, I hope you do—Barack and I are certainly glad we did. It’s our best shot at beati…",429106712,athlynbryant,"State College, PA",972,104,,False,False,62746,,,8546,0,0.65,0.75,positive
2021-03-11 17:00:33,1370057065993924610,Updated rules mean second dose of vaccine will be given later  ,939185064428138497,orilliamatters,,2062,0,,False,False,20291,,,0,0,0.22916666666666666,-0.10416666666666667,negative
2021-03-11 17:00:33,1370057065775906822,channelstv: Norway Suspends Use Of AstraZeneca Vaccine ,848828309622448128,taiwoomotoyosi2,,1,2,,False,False,1,,,67,0,0.0,0.0,neutral
2021-03-11 17:00:33,1370057064538644487,His Excellency President Paul Kagame and H.E the First Lady Jeannette Kagame have received their COVID-19 vaccine today in Kigali  VaccinesSavesLivesLeadingbyExamples ,324374790,JohnPeter_RWA,Rwanda /Germany -Leipzig / ,2268,33415,,True,False,52483,,,0,1,0.3333333333333333,0.25,positive
2021-03-11 17:00:33,1370057064068829196,POTUS: One in four adults in the U.S. has received their first COVID-19 vaccine — and we’re now leading the world in vaccinations.Tha…,732384216437145600,Wooind,,18,9073,,False,False,7827,,,16530,0,0.3333333333333333,0.25,positive
2021-03-11 17:00:33,1370057063875932164,"DCHHS: Today we are registering residents for the COVID-19 vaccine at TR Hoover Community Center - 5106 Bexar St, Dallas, TX 75215 from…",27699465,hollyleeharris,"Dallas, TX",31,6448,,False,False,14192,,,24,0,0.1,-0.1,negative
2021-03-11 17:00:32,1370057063078924290,"Denmark, Norway, Iceland Suspend Use Of AstraZeneca Covid-19 Vaccine ",97257353,reddykesava,bangalore,549,9927,,False,False,58698,,,0,0,0.0,0.0,neutral
2021-03-11 17:00:32,1370057063007727616,CBSNews Please explain why I as a very healthy 36 year old would get the vaccine? I don’t want to hear to “protect others”. 78% of Covid hospitalizations and deaths were of obese ppl. How about some accountability for your own health?,4196807835,jasonshinn10,,18,3941,,False,False,1223,,,0,0,0.6166666666666667,0.45,positive
2021-03-11 17:00:32,1370057062579855360,GinaWatss: Why do antivaxxers always forward the 1 or 2 horror stories related to covid vaccine but ignore the MILLIONS of people who a…,203193300,5Solae,The Place to Be,4485,33655,,True,False,148717,,,67,0,0.4,0.0,neutral
2021-03-11 17:00:32,1370057062407868419,"MichelleObama: When you can get the COVID-19 vaccine, I hope you do—Barack and I are certainly glad we did. It’s our best shot at beati…",719863299,LeeslilCosplays, In Tha Cut Rollin 🍁 Up,368,34977,,False,False,51246,,,8546,0,0.65,0.75,positive
2021-03-11 17:00:32,1370057060973305856,POTUS: One in four adults in the U.S. has received their first COVID-19 vaccine — and we’re now leading the world in vaccinations.Tha…,2319149784,1981RAHULDEY,"Kolkata, India",24,11744,,True,False,10947,,,16530,0,0.3333333333333333,0.25,positive
2021-03-11 17:00:32,1370057060923097091,EU approved Johnson &amp; Johnson Covid-19 vaccine amidst the vaccine distribution chaos. Yay? Or nay?,20998753,putraps,Berlijn,236,1183,,True,False,26530,,,0,0,0.0,0.0,neutral
2021-03-11 17:00:32,1370057060306542596,"dlh2409: gtconway3d The truth is that Pfizer didn’t receive any funding from Operation Warp Speed. Rather, its partner, BioNTech recei…",3357155174,lscain3834,"New Jersey, USA",2570,277749,,True,False,255950,,,37,0,0.0,0.0,neutral
2021-03-11 17:00:32,1370057060100964362,TheView: WHOOPI RECEIVES COVID-19 VACCINE: Our WhoopiGoldberg tells us she received her first shot of the coronavirus vaccine and enco…,932035917455400960,ArayAromaz,Area 51,2299,261815,,True,False,205234,,,221,0,0.3333333333333333,0.25,positive
2021-03-11 17:00:32,1370057059442380813,POTUS: One in four adults in the U.S. has received their first COVID-19 vaccine — and we’re now leading the world in vaccinations.Tha…,26560341,KelbeeSince2020,Loving life in beautiful PNW,2172,241221,,False,False,106944,,,16530,0,0.3333333333333333,0.25,positive
2021-03-11 17:00:31,1370057058381406209,POTUS: One in four adults in the U.S. has received their first COVID-19 vaccine — and we’re now leading the world in vaccinations.Tha…,3241165467,ViolinLady1234,"New Milford, NJ",51,14047,,False,False,6090,,,16530,0,0.3333333333333333,0.25,positive
2021-03-11 17:00:31,1370057058184220673,"BarackObama: Michelle and I got vaccinated against COVID-19 because we know it’s the best way to beat this pandemic, protect one anothe…",19915883,deeshaw,Massachusetts,4442,126826,,True,False,78681,,,10680,0,0.3,1.0,positive
2021-03-11 17:00:31,1370057056787394561,JuddLegum JohnKavanagh_AZ ATT Allstate BCBSAssociation CoxComm WeAreFarmers pfizer UnitedHealthGrp USAA Prudential WellsFargo Corporate donors to Rep. Kavanagh...supporting this guy is bad for your business.,18761165,namesraine,"San Francisco, CA",424,139057,,True,False,9633,,,6,16,0.3333333333333333,-0.3499999999999999,negative
2021-03-11 17:00:31,1370057056653217794,donnyonyea: IronyPump AlexBerenson moche8 Believethe families of the victims. There's big money in protecting pharmaceutical compani…,1011846806,BullyzBako,,624,29180,,False,False,9949,,,2,0,0.1,0.0,neutral
2021-03-11 17:00:31,1370057055671742464,"BarackObama: Michelle and I got vaccinated against COVID-19 because we know it’s the best way to beat this pandemic, protect one anothe…",21176045,cheriedelcarlo,Northern California,2964,305358,,True,False,224573,,,10680,0,0.3,1.0,positive
2021-03-11 17:00:30,1370057054791081987,"GOPJake Just received an email from you stating ""Andy Beshear has totally botched Kentucky’s COVID-19 vaccine sign-up website and it’s putting lives on the line."" I'm curious by what measure you are being this statement. It seems like a bad-faith and misleading statement.",15655854,cordy74,"Berea, KY",195,64,,False,False,5987,,,0,0,0.875,-0.05,negative
2021-03-11 17:00:30,1370057054707093507,"hankymgc: NewJeffCT georgehahn The MRNA technology that enabled the Pfizer vaccine was developed by a German, Muslim couple over the…",393855734,wandainparis,,33925,72190,,True,False,366674,,,16,0,0.15,0.05,positive
2021-03-11 17:00:30,1370057054551937026,mariamainmo: Girls don't want boys. They want the covid vaccine and a nice apartment,289003660,MorganSkiles1,"Bloomington, IN",313,64364,,False,False,4836,,,25410,0,1.0,0.6,positive
2021-03-11 17:00:30,1370057054447005697,narendramodi: Happy to share that my mother has taken the first dose of the COVID-19 vaccine today. I urge everyone to help and motivat…,1325711293278351366,THERAJPUT24,,14,4919,,False,False,4071,,,17140,0,0.6666666666666666,0.525,positive
2021-03-11 17:00:30,1370057054161829889,"JuddLegum: JohnKavanagh_AZ 3. Kavanaugh, who apparently believes its his job to ensure that ""uninformed"" people do not vote is support…",1044241,brooklynmarie,,62395,473648,,False,True,197451,,,596,0,0.35,0.05,positive
2021-03-11 17:00:30,1370057052467388416,APTA_Transit: Thank you RepJohnYarmuth for ensuring that transit agencies can continue to be a lifeline for essential workers while a…,441032036,APTA_info,"Washington, DC",8341,11097,,True,False,8840,,,2,0,0.3,0.0,neutral
2021-03-11 17:00:29,1370057048956669955,spectatorindex: JUST IN: Norway has suspended use of the AstraZeneca coronavirus vaccine,114946688,Marlinaayu,"Kuala Lumpur, Malaysia",2271,579822,,True,False,664791,,,2565,0,0.0,0.0,neutral
2021-03-11 17:00:29,1370057048734511107,RealPolySci AlexBerenson pfizer I personally don’t know anyone that has tested positive after being fully vaccinated.,27306559,kmccaslin,,105,6093,,False,False,634,,,0,0,0.42272727272727273,0.11363636363636363,positive
2021-03-11 17:00:29,1370057047883022338,KylaKeaunza: maybe i shouldn’t have posted that i got my first dose of the covid vaccine 😂,4882262848,lala_lalauren,somewhere being great,1328,43605,,True,False,23877,,,1,0,0.3333333333333333,0.25,positive
2021-03-11 17:00:29,1370057047539023872,JuddLegum: JohnKavanagh_AZ ATT Allstate BCBSAssociation CoxComm WeAreFarmers pfizer UnitedHealthGrp USAA Prudential WellsFar…,3311890578,PPedrotty,,547,102749,,True,False,66379,,,360,0,0.0,0.0,neutral
2021-03-11 17:00:29,1370057047295811588,"anyone living in NJ and trying to get a COVID vaccine appointment, this account is how I was able to get one in less than 24 hours of trying! NJGov ",925963705,AFredston,"Ithaca, NY",1656,10660,,False,False,5835,,,0,2,0.3458333333333333,0.14583333333333334,positive
2021-03-11 17:00:29,1370057047211978760,"FinancialTimes: Denmark, Norway and Iceland have suspended use of the Oxford/AstraZeneca vaccine in a 'precautionary' move after a Dani…",1005109987,Dweller15,Dark side of the Moon,35,10193,,False,False,11439,,,329,0,0.0,0.0,neutral
2021-03-11 17:00:28,1370057046113013761,"When Kurt Bringsjord heard his Texas community needed a solution to crowdsource vaccination sites, he rallied colleagues and APEX resources to help:  ",809273,Oracle,"Austin, TX",779260,12353,,True,True,21993,,,11,36,0.0,0.0,neutral
2021-03-11 17:00:28,1370057045521666050,"JuddLegum: JohnKavanagh_AZ 3. Kavanaugh, who apparently believes its his job to ensure that ""uninformed"" people do not vote is support…",16549998,graphaks,,787,99991,,False,False,36892,,,596,0,0.35,0.05,positive
2021-03-11 17:00:28,1370057043747409923,DAILY POST reporter receives COVID-19 vaccine in Cross River   Nigeria NigeriaNews ,520720055,NigNewspapers,London - UK,3876,0,,False,False,76492,,,0,0,0.0,0.0,neutral
2021-03-11 17:00:28,1370057043726467073,Babubhai Patel has had his Covid-19 vaccine and would like to reassure our Gujarati speaking communities that the vaccine is safe and you should have it when it’s your turn CovidVaccine LetsBeatCovidLLR Iskcon Leicester ,26548941,NHSLeicester,"Leicester, England",12511,1039,,True,True,9109,,,0,0,0.5,0.5,positive
2021-03-11 17:00:28,1370057043189501956,"PrisonPlanet: In a rare moment of truth of CNN Wednesday, Anthony Fauci admitted that there is no scientific reason why people who have…",1244893492209283073,Ginny12718372,Idaho,311,55502,,False,False,39765,,,395,0,0.9,0.3,positive
2021-03-11 17:00:27,1370057041813901313,danieteebee: It’s completely predictably American that the brand of COVID vaccine you have access to has now become a class signifier,742346888192634881,mhg_xo,,129,7552,,False,False,2984,,,10923,0,0.0,0.0,neutral
2021-03-11 17:00:27,1370057041398599683,danieteebee: It’s completely predictably American that the brand of COVID vaccine you have access to has now become a class signifier,1267691475770408960,luvkayanna,,45,28796,,True,False,25683,,,10923,0,0.0,0.0,neutral
2021-03-11 17:00:27,1370057041285414916,LordBlessedJu: More people gone die from that vaccine than covid itself,2749156745,Ray2live1223,Somewhere rolling up,426,15265,,True,False,21979,,,2,0,0.5,0.5,positive
2021-03-11 17:00:27,1370057041243439106,Individuals aged 16 years and older with certain medical conditions that increase their risk of severe illness from COVID-19. Note: Pfizer is the only COVID vaccine currently approved for children aged 16 and older. Conditions include:,3312011435,DMalebranche,"Atlanta, GA",7502,11154,,True,False,5814,,,1,1,0.42976190476190473,0.04345238095238095,positive
2021-03-11 17:00:27,1370057040597553165,JuddLegum: JohnKavanagh_AZ ATT Allstate BCBSAssociation CoxComm WeAreFarmers pfizer UnitedHealthGrp USAA Prudential WellsFar…,21956112,chadcrichton,"Toronto, Canada",237,181270,,False,False,103053,,,360,0,0.0,0.0,neutral
2021-03-11 17:00:27,1370057040186474503,"Beginning March 15, 2021, the following populations will be eligible for COVID vaccination in Georgia:Adults aged 55 and overIndividuals with disabilities",3312011435,DMalebranche,"Atlanta, GA",7502,11154,,True,False,5814,,,1,2,0.25,-0.05,negative
2021-03-11 17:00:27,1370057039569903623,"MichelleObama: When you can get the COVID-19 vaccine, I hope you do—Barack and I are certainly glad we did. It’s our best shot at beati…",799057985356054530,ESpence00496851,,215,178420,,True,False,183808,,,8546,0,0.65,0.75,positive
2021-03-11 17:00:27,1370057039448186883,The Corona Virus vaccine is a scam!,921206510,motorboatersb,,12,3,,False,False,20,,,0,1,0.0,0.0,neutral
2021-03-11 17:00:27,1370057039393738757,TheDamageReport: Coming up on TDRlive: Biden says he’ll share surplus US vaccines with rest of the world as he announces 100m more sin…,46648624,clutch64,"West Hickory, PA USA",1578,73635,,True,False,13654,,,5,0,0.5,0.5,positive
