created,id_str,text,user_id,screen_name,location,followers_count,user_favourites_count,time_zone,geo_enabled,verified,status_count,geo,coords,retweet_count,tweet_favourite_count,Subjectivity,Polarity,Sentiment
2021-03-11 16:59:53,1370056898851057666,Coronavirus vaccine deaths aren’t covered by life insurance because jabs are “experimental medical intervention”  GregMannarino ,86796377,JeffLee2020,United States,4695,223257,,False,False,476475,,,11,18,0.2,0.05,positive
2021-03-11 16:59:53,1370056897710018564,narendramodi: Happy to share that my mother has taken the first dose of the COVID-19 vaccine today. I urge everyone to help and motivat…,48770528,rinseandrepeat2,India,498,219463,,True,False,172924,,,17140,0,0.6666666666666666,0.525,positive
2021-03-11 16:59:53,1370056896485462021,bravenew_orwell: France about to ease travel restrictions. Just a test negative required 72 hours prior &amp; no vaccine passports.  The UK…,336498597,charliegee2020,UK,10930,627,,False,False,497,,,945,0,0.2,-0.15,negative
2021-03-11 16:59:53,1370056895956914176,"""I hope everyone remembers when they’re getting the COVID-19 (often referred to as the China Virus) Vaccine, that if I wasn’t President, you wouldn’t be getting that beautiful 'shot' for 5 years, at best, and probably wouldn’t be getting it at all.""  ",16513416,fox35orlando,"Orlando, Florida",241033,342,,False,True,233236,,,3,45,0.65,0.925,positive
2021-03-11 16:59:52,1370056895495557122,"nationalpost: Denmark, Norway and Iceland suspend AstraZeneca COVID shots after blood clot reports ",936080886260555776,jenmiomotoyosi_,"Lagos, Nigeria",406,14184,,True,False,5515,,,77,0,0.0,0.0,neutral
2021-03-11 16:59:52,1370056892790140930,danieteebee: It’s completely predictably American that the brand of COVID vaccine you have access to has now become a class signifier,87867142,loudrandomchick,,360,351220,,False,False,83607,,,10923,0,0.0,0.0,neutral
2021-03-11 16:59:52,1370056892400037890,"Arzookazmi30: Pakistan will receive a free dose of the Indian-made Oxford-AstraZeneca coronavirus vaccine, which will cover 20 per cent…",75039503,Lohana1983,Gujarat,27550,18698,,False,False,391412,,,122,0,0.8,0.4,positive
2021-03-11 16:59:52,1370056891469074441,Trump: 'Hope Everyone Remembers' Me When Getting COVID Shot |   via Newsmax,1359908049293611008,karney_giselle,,2,8,,False,False,280,,,0,0,0.0,0.0,neutral
2021-03-11 16:59:51,1370056891229962241,"TIMEHealth: COVID-19 Cases Are Rising in Europe, and the Vaccine Rollout Is Lagging. How Did It All Go So Badly Wrong? ",242575939,onlywaytomoMD,"Fort Lauderdale, FL",265,44684,,False,False,134876,,,12,0,0.9,-0.5,negative
2021-03-11 16:59:51,1370056891003469832,"NYS is committed to breaking down barriers to vaccination &amp; ensuring equitable vaccine distribution. Tune in today at 6:30pm for ‘COVID-19 &amp; Tribal Nations: Building Community Trust,' a fireside chat with the NYS COVID-19 Vaccine Equity Taskforce➡️  ",65734517,NYSLabor,"Albany,  NY",85768,1999,,True,True,16735,,,4,25,0.2888888888888889,-0.15555555555555559,negative
2021-03-11 16:59:51,1370056889992626177,danieteebee: It’s completely predictably American that the brand of COVID vaccine you have access to has now become a class signifier,2730072466,caiden__cook,,806,65771,,True,False,35824,,,10923,0,0.0,0.0,neutral
2021-03-11 16:59:51,1370056889598414850,nypost: Denmark is latest country to halt AstraZeneca COVID vaccine over blood clots  ,37906386,Ediwey,"Stuttgart, Germany",314,9446,,False,False,29891,,,97,0,0.9,0.5,positive
2021-03-11 16:59:51,1370056888705024001,Mike Adams: We Enter 'A DANGEROUS' Wave of the COVID Vaccine  ,532321171,HEKTORLVL,CANADA,36,3780,,False,False,25827,,,0,0,0.9,-0.6,negative
2021-03-11 16:59:51,1370056888654688257,DrEricDing: Cancer patients need 2nd dose—much less protected against COVID19 after only one dose of Pfizer vaccine. An early 2nd dose…,952247125185720320,viralvideovlogs,കേരളം,6031,2304,,False,False,610117,,,304,0,0.2733333333333333,-0.01333333333333333,negative
2021-03-11 16:59:51,1370056887991857155,JuddLegum: JohnKavanagh_AZ ATT Allstate BCBSAssociation CoxComm WeAreFarmers pfizer UnitedHealthGrp USAA Prudential WellsFar…,1044711566354960384,MsLensRAMZ,,561,286259,,False,False,81391,,,360,0,0.0,0.0,neutral
2021-03-11 16:59:51,1370056887975211008,Just got my first moderna shot and all I wanna do is floss and dab is this a known side effect?,30773748,cassielyons95,Philadelphia,444,53718,,True,False,24408,,,0,5,0.3333333333333333,0.25,positive
2021-03-11 16:59:50,1370056886599421953,kinsellawarren: One year after all of this began - one year! - Canada is in 61st place in the world for COVID-19  vaccine doses adminis…,836370137666174977,PilukPeter,,267,23187,,False,False,15738,,,260,0,0.0,0.0,neutral
2021-03-11 16:59:50,1370056885345398784,kayleighmcenany: FINALLY the Biden admin recognizes the Trump admin’s unprecedented vaccine work:➡️ “We’re grateful for the work that…,1221104967634882562,NathanL62878661,,53,10325,,False,False,5476,,,4662,0,0.95,0.3,positive
2021-03-11 16:59:50,1370056884514869249,HoustonChron: Texas Democrats ask Abbott to open up vaccine eligibility to farmworkers ,1320331161281961984,Kristin08957126,,45,2073,,True,False,1048,,,70,0,0.5,0.0,neutral
2021-03-11 16:59:50,1370056883713814529,DrEricDing: Cancer patients need 2nd dose—much less protected against COVID19 after only one dose of Pfizer vaccine. An early 2nd dose…,106457836,Avonan,"Ohio, USA",2581,401880,,False,False,477480,,,304,0,0.2733333333333333,-0.01333333333333333,negative
2021-03-11 16:59:49,1370056882971377666,ClareCraigPath: Any finding on yellow card data gets dismissed because no-one knows what the true denominator is or if everything gets…,94449835,FlamingKaty1,,1189,96226,,False,False,17782,,,255,0,0.325,0.175,positive
2021-03-11 16:59:49,1370056882799394818,"FinancialTimes: Denmark, Norway and Iceland have suspended use of the Oxford/AstraZeneca vaccine in a 'precautionary' move after a Dani…",1719022614,canutescanoe,clown world,1527,40904,,False,False,23938,,,329,0,0.0,0.0,neutral
2021-03-11 16:59:49,1370056882778411011,"BraveBosom: ""The comic absurdity continues: She could get a vaccine if, in addition to having cancer, she also needed a solid organ tra…",372572406,DiepFlapBreast,"San Antonio, Texas",23577,41691,,True,False,46661,,,8,0,0.3,0.125,positive
2021-03-11 16:59:49,1370056882048667648,TheTerribleTout: Media loves sensation so a temporary suspension of AZ Vaccine rollout in some European nations getting pl hype. Bloodc…,150029426,melrose_86,"Kingston, Jamaica",311,83988,,True,False,56275,,,102,0,0.0,0.0,neutral
2021-03-11 16:59:49,1370056881272717312,ikaveri: Denmark becomes sixth country to halt use of AstraZeneca's Covid-19 vaccine over fears of blood clot  v…,79175176,Shazza1uk,Scotland - N Ayrshire,5306,92889,,True,False,190006,,,7,0,0.0,0.0,neutral
2021-03-11 16:59:49,1370056881109135363,Zonknews20: Australia’s Health Minister Greg Hunt has been admitted to hospital and is said to be in a serious condition just one day a…,507010668,rebeccaluyali,"Nairobi, Kenya",92,445,,False,False,947,,,37,0,0.6666666666666666,-0.3333333333333333,negative
2021-03-11 16:59:49,1370056881100689408,BreesAnna: Denmark suspends Oxford Covid vaccine after patient dies with blood clot – Metro ,1119277255593791489,LeeHami75918304,,683,165223,,False,False,26171,,,810,0,0.0,0.0,neutral
2021-03-11 16:59:49,1370056880006004752,DreaHumphrey: “after reports of severe cases of blood clots in people who have been vaccinated with the COVID-19 vaccine from AstraZene…,1183115084345815040,FredFredderson1,,1492,61162,,False,False,34726,,,10,0,0.0,0.0,neutral
2021-03-11 16:59:49,1370056879880040451,narendramodi: Happy to share that my mother has taken the first dose of the COVID-19 vaccine today. I urge everyone to help and motivat…,807302243196301312,chopda_arpan,"Mungeli, India",13,1502,,False,False,1162,,,17140,0,0.6666666666666666,0.525,positive
2021-03-11 16:59:49,1370056879515168773,MollyJongFast: This is great news  ,1070826416168521729,Amdinvestorblog,United States,92,14561,,False,False,2796,,,206,0,0.75,0.8,positive
2021-03-11 16:59:49,1370056879263596549,POTUS: One in four adults in the U.S. has received their first COVID-19 vaccine — and we’re now leading the world in vaccinations.Tha…,796924524860153856,DelfinaValdez8,Texas USA,2073,149388,,True,False,129207,,,16530,0,0.3333333333333333,0.25,positive
2021-03-11 16:59:48,1370056877820760064,"roccogalatilaw: Denmark. another country, like Austria, to suspend  Astra-Zeneca vaccine due to ""blood-clotting"" which  led to deaths a…",1293023581345968129,Dcarreau12,"Québec, Canada",88,13929,,False,False,17918,,,1501,0,0.375,-0.125,negative
2021-03-11 16:59:48,1370056877673971720,Today I get to just finally lay around and relax I've been busy for the last 2-3 weeks I guess and it's been very hectic so today and tomorrow I'm just going to relax however tomorrow at 3:00 p.m. I get my first shot of covid-19 vaccine.,1335741249173774337,PiSnoopy8,USA🌊🌊🌊 USA 🌊🌊🌊 USA🌊🌊🌊,3977,10298,,False,False,7393,,,0,8,0.4,0.11000000000000001,positive
2021-03-11 16:59:48,1370056876889636866,The Independent: Mother dies four days after receiving second dose of Moderna’s Covid vaccine...   ,470929874,rankstr,,111,0,,False,False,29965,,,0,0,0.0625,0.0,neutral
2021-03-11 16:59:48,1370056875841060870,POTUS: One in four adults in the U.S. has received their first COVID-19 vaccine — and we’re now leading the world in vaccinations.Tha…,1952413104,NCastaldoAuthor,,2666,60052,,True,False,23039,,,16530,0,0.3333333333333333,0.25,positive
2021-03-11 16:59:48,1370056875270676481,"FinancialTimes: Denmark, Norway and Iceland have suspended use of the Oxford/AstraZeneca vaccine in a 'precautionary' move after a Dani…",1253996816414146560,AbogadaGalan,,282,1349,,False,False,13014,,,329,0,0.0,0.0,neutral
2021-03-11 16:59:47,1370056874398220296,"TomiLahren: If you need an ID to get a Covid vaccine, why the hell shouldn’t you need an ID to vote?!! LiberalismIsAMentalDisorder",2316267790,Kathyw1953Kathy,,174,53626,,True,False,18917,,,2379,0,0.0,0.0,neutral
2021-03-11 16:59:47,1370056874108805121,nkquakyi: Deep breath.0.0007% - that's the proportion of people in the EU who have experienced the sort of clotting described here af…,1053361216960245760,big_phish_,"Accra, Ghana",333,30176,,True,False,12522,,,71,0,0.65,0.4,positive
2021-03-11 16:59:47,1370056873748086792,$GOVX I agree. 👇Just wait. 👊 It will be a monster. $GOVX 💎 👇,1294001310803656706,SelectionNYork,"Wall Street, New York",150,176,,False,False,2589,,,0,0,0.0,0.0,neutral
2021-03-11 16:59:47,1370056872598851584,"roccogalatilaw: Denmark. another country, like Austria, to suspend  Astra-Zeneca vaccine due to ""blood-clotting"" which  led to deaths a…",337421682,LukeWeedall,"Toronto, Ontario",736,4995,,True,False,2834,,,1501,0,0.375,-0.125,negative
2021-03-11 16:59:47,1370056871034294276,"FinancialTimes: Denmark, Norway and Iceland have suspended use of the Oxford/AstraZeneca vaccine in a 'precautionary' move after a Dani…",870875230704517120,mytheorem,,925,9756,,True,False,24797,,,329,0,0.0,0.0,neutral
2021-03-11 16:59:47,1370056870573047808,"Naija_PR: Zamfara govt receives 55,920 doses of COVID-19 vaccine",1321225273002569728,ibraheem_530,"Yobe, Nigeria",2077,34804,,True,False,24781,,,2,0,0.0,0.0,neutral
2021-03-11 16:59:46,1370056869897723905,BuhoOscuro Thanks for clarification! I should have made it more clear that these are Pfizer lures. And yeah there are not much information available publicly.,913976720,h2jazi,Canada,989,2517,,True,False,1878,,,0,2,0.29166666666666663,0.19166666666666665,positive
2021-03-11 16:59:46,1370056869797113856,duntalk: news outlets are really irresponsible with click bait headlines - there has been zero proof that the Astra Zeneca vaccine dire…,313042820,reinKarneit,✨,1231,27614,,True,False,118922,,,68,0,0.2,0.2,positive
2021-03-11 16:59:46,1370056867964157955,Dr Cheryl Watkins-Moore revels in revealing her 1st COVID 19 vaccine dose.blackhealthmatters blackCovidVaccineChallenge blkvcc fightCovid19 blkstlCovidfight ,1362420572253286401,BlkStlVaccinatd,,4,95,,False,False,35,,,0,0,0.0,0.0,neutral
2021-03-11 16:59:46,1370056866768814084,realTuckFrumper: Report Claims New Coronavirus Vaccine Ads To Feature Every Living President Except For Donald Trump ,1309061953856385027,PaulHaider6,"Weybridge, England 🇬🇧",1284,120221,,False,False,72780,,,66,0,0.45454545454545453,0.13636363636363635,positive
2021-03-11 16:59:46,1370056866684825602,"TheInsiderPaper: BIG: Denmark, Italy, Norway and 6 other countries suspend use of AstraZeneca vaccine after reports of blood clots. 1 d…",939214381732151296,S246278910,Here.,1906,93575,,False,False,173369,,,108,0,0.2375,-0.0625,negative
2021-03-11 16:59:45,1370056865338564622,MHRAgovuk: People should still go and get their vaccine when asked to do so.Read our response to Danish authorities’ action to tempor…,179673366,vivjones10,,1979,100401,,True,False,144735,,,36,0,0.1,0.1,positive
2021-03-11 16:59:45,1370056864738709514,POTUS: One in four adults in the U.S. has received their first COVID-19 vaccine — and we’re now leading the world in vaccinations.Tha…,304771434,RobWolter1,,25,9831,,False,False,8521,,,16530,0,0.3333333333333333,0.25,positive
2021-03-11 16:59:44,1370056861244870665,More on NBK Vax here ,293214378,EJ_Goldberg,,1211,3724,,True,True,2398,,,1,1,0.5,0.5,positive
2021-03-11 16:59:44,1370056860871577610,I GOT MY COVID-19 VACCINE MAKE SURE YOU GET IN YOUR DOCTOR OFFICE NOT A SIGHT LIKE STADIUM EXC..IN CASE YOU HAVE BAD REACTIONS IF WANT TO GET IT DONE 😊 ,1012475880248143873,Karrasamelia5,"Brooklyn , NY",7940,443060,,True,False,477996,,,1,3,0.7777777777777777,-0.09999999999999992,negative
2021-03-11 16:59:44,1370056860657668100,nadine dorries outstupiding herselftakes some doingNadineDorries BorisJohnsonOut AstraZeneca princewilliam Bercow JohnsonAndJohnson,1337170694069751808,tommybox3,,103,12451,,False,False,20281,,,0,1,0.0,0.0,neutral
2021-03-11 16:59:44,1370056859835535361,rishibagree: No opposition leader took Covid vaccination until PM Modi  took. After him... Everyone is taking it.Looks like they have…,1013021441078333440,KantiBhanu,,119,66126,,True,False,24196,,,1589,0,0.0,0.0,neutral
2021-03-11 16:59:44,1370056859500097537,POTUS: One in four adults in the U.S. has received their first COVID-19 vaccine — and we’re now leading the world in vaccinations.Tha…,457030696,Alicia_A77,"Suffolk, VA 23434",327,158381,,True,False,84138,,,16530,0,0.3333333333333333,0.25,positive
2021-03-11 16:59:44,1370056859479052292,"FaithEFletcher: Thank you RollingStone  for asking ""Why Are Black Communities Being Singled Out as Vaccine Hesitant?"" elizabethics. H…",362227925,FordhamEthics,"Bronx, New York",1425,749,,True,False,4817,,,10,0,0.43333333333333335,-0.16666666666666666,negative
2021-03-11 16:59:44,1370056859403628546,TheInsiderPaper: BREAKING 🚨 Denmark suspends use of AstraZeneca vaccine due to serious cases of blood clots,202552776,hb9uqx,"Valais, Suisse",189,16896,,False,False,4316,,,213,0,0.5208333333333333,-0.22916666666666666,negative
2021-03-11 16:59:44,1370056859235676160,"MichelleObama: When you can get the COVID-19 vaccine, I hope you do—Barack and I are certainly glad we did. It’s our best shot at beati…",860061866797613056,SagorAhemmed,"Dhaka, Bangladesh",59,806,,False,False,570,,,8546,0,0.65,0.75,positive
2021-03-11 16:59:43,1370056857771986946,"scad_official: We received our delivery of AstraZeneca. Covid-19 vaccines barely two weeks ago, now this...! 😭😭😭 ",1134124580862386176,beliketeniola,"Lagos, Nigeria",1275,107432,,True,False,15935,,,49,0,0.1,0.0625,positive
2021-03-11 16:59:43,1370056857369387009,charlieeasmon: Oxford-AstraZeneca: Denmark suspends vaccine 'as a precaution' ,79175176,Shazza1uk,Scotland - N Ayrshire,5306,92889,,True,False,190006,,,1,0,0.0,0.0,neutral
2021-03-11 16:59:43,1370056856702488579,tdemio: Reports of COVID19 vaccine side effects are streaming in to the CDC. What are they? What are they telling experts? We asked: h…,1024865280424640513,ellenmhine,emhine@iu.edu,400,19780,,False,False,3516,,,1,0,0.0,0.0,neutral
2021-03-11 16:59:43,1370056856383655944,"AndrewJ43942191 Triciabee13 marella0411 AlexBerenson AstraZeneca Yes, you are!",391663431,trafficconehelp,"Rhode Island, USA",473,68730,,True,False,44373,,,0,0,0.0,0.0,neutral
2021-03-11 16:59:43,1370056856320811015,"REPOit this Way;""African Heads of State have been  publicy seen taking what they say is COVID-19 Vaccine Jab"".What Evidence do you have that what they're taking is actually a COVID19 Vaccine?? ",3028039900,HezMureithi,Kenya🇰🇪AFRICA,16093,18371,,True,False,35395,,,1,1,0.05,0.0,neutral
2021-03-11 16:59:43,1370056856274604032,kayleighmcenany: FINALLY the Biden admin recognizes the Trump admin’s unprecedented vaccine work:➡️ “We’re grateful for the work that…,27570086,nursebruce,"Metairie, La.",40,41585,,False,False,9783,,,4662,0,0.95,0.3,positive
2021-03-11 16:59:43,1370056856064958467,POTUS: One in four adults in the U.S. has received their first COVID-19 vaccine — and we’re now leading the world in vaccinations.Tha…,21612042,walkerdl,"Decatur, GA",2762,73307,,True,False,415483,,,16530,0,0.3333333333333333,0.25,positive
2021-03-11 16:59:43,1370056855817445376,mariamainmo: Girls don't want boys. They want the covid vaccine and a nice apartment,181004370,Rosalindagvm,"Victoria, Tamaulipas",412,17465,,False,False,23853,,,25410,0,1.0,0.6,positive
2021-03-11 16:59:43,1370056855091826691,CommabSteven cauley_anne CTVNews US has a larger population and a significant amount seem to be against vaccines. ,113450739,CalyDreams,"Ontario, Canada",70,1088,,False,False,2387,,,0,1,0.6875,0.1875,positive
2021-03-11 16:59:43,1370056855054073864,BreesAnna: Denmark suspends Oxford Covid vaccine after patient dies with blood clot – Metro ,728949405563424768,prettytastygdns,Canada,89,1086,,False,False,1921,,,810,0,0.0,0.0,neutral
2021-03-11 16:59:43,1370056855020527618,✔️NETFLIX  📛PROMO📛 ❇️💯PROMOTION 💯✳️Lien⤵️.BTSHistoryMakersBTSBestSellingAlbumsCDUKorruptionBohlenBBB21CarlaBetclicKhalassBTSHistoryMakersNintendalertsXNinNinGameAstraZenecaXiaomiMi11free_yenaбиатлонقلب_البنات_فندق ,514335169,ibrahimredson,,113,1480,,False,False,597,,,0,1,0.0,0.0,neutral
2021-03-11 16:59:43,1370056854991175683,"CNN: While the rest of the world debates how a Covid vaccination passport will work, Israel has introduced one that is already opening…",145698754,cybsb,"Créteil, France",105,499,,True,False,6247,,,155,0,0.0,0.0,neutral
2021-03-11 16:59:43,1370056854101843970,"MichelleObama: When you can get the COVID-19 vaccine, I hope you do—Barack and I are certainly glad we did. It’s our best shot at beati…",867515165113057281,AewsomeguyI,,9793,13289,,False,False,38857,,,8546,0,0.65,0.75,positive
2021-03-11 16:59:42,1370056853598699528,"MichelleObama: When you can get the COVID-19 vaccine, I hope you do—Barack and I are certainly glad we did. It’s our best shot at beati…",161784689,theyloveashley,paradise with drake,1067,102,,True,False,97437,,,8546,0,0.65,0.75,positive
2021-03-11 16:59:42,1370056853598654464,POTUS: One in four adults in the U.S. has received their first COVID-19 vaccine — and we’re now leading the world in vaccinations.Tha…,63138568,NYCgrl55,"Charlotte, NC",80,11952,,False,False,6012,,,16530,0,0.3333333333333333,0.25,positive
2021-03-11 16:59:42,1370056853598650372,"BarackObama: Michelle and I got vaccinated against COVID-19 because we know it’s the best way to beat this pandemic, protect one anothe…",208467044,Choxy1,Everywhere inscribed Enjoy. ,1525,34039,,True,False,57205,,,10680,0,0.3,1.0,positive
2021-03-11 16:59:42,1370056852772298755,"MartyMakary: Dr. Fauci supported double masking arguing it was ""common sense""-- OK.Here's my ""common sense"" conclusion after reviewin…",773306592938819584,JSlate__,🇺🇸,731,168444,,False,False,180539,,,453,0,0.3333333333333333,-0.19999999999999998,negative
2021-03-11 16:59:42,1370056850805305344,DaveKeating: In AstraZeneca's contract with the EU it list 4 facilities that will be used to fulfil delivery - 2 in the UK and 2 in the…,695753,ezekiel,EU 🇪🇺 - BRU 🇧🇪 - RM 🇮🇹,16327,36883,,True,False,135534,,,79,0,0.0,0.0,neutral
2021-03-11 16:59:42,1370056849937072128,"20) Europe’s Medicines Regulator has said there appeared to be no higher risk of blood clots in those 💉, after Denmark, Norway and Iceland suspended use of the AstraZeneca jab &amp; another five European countries withdrew a batch;",2567292679,fredwalton216,Pennsylvania,1849,38653,,True,False,265323,,,0,0,0.25,-0.0625,negative
2021-03-11 16:59:41,1370056848821399554,spectatorindex: JUST IN: Norway has suspended use of the AstraZeneca coronavirus vaccine,953400986608943105,FernandoChvezR4,,55,12854,,False,False,5350,,,2565,0,0.0,0.0,neutral
2021-03-11 16:59:41,1370056848691376138,"scad_official: We received our delivery of AstraZeneca. Covid-19 vaccines barely two weeks ago, now this...! 😭😭😭 ",819422857243529216,tweetbyLAS,,3066,12446,,True,False,12243,,,49,0,0.1,0.0625,positive
2021-03-11 16:59:41,1370056848510836744,CarterYoungman JuddLegum JohnKavanagh_AZ ATT Allstate BCBSAssociation CoxComm WeAreFarmers pfizer UnitedHealthGrp USAA Prudential WellsFargo SenatorSinema Open secrets .com,23910844,WithoutaTRACE,"Arizona, USA",4284,93699,,True,False,144653,,,0,6,0.5,0.0,neutral
2021-03-11 16:59:41,1370056848208973828,3FM News: Island to continue using AstraZeneca jab despite European concernsnews iom coronavirus ,24879232,3FMradio,Isle of Man,9854,239,,True,False,111011,,,1,0,0.0,0.0,neutral
2021-03-11 16:59:41,1370056845319139328,"News24: Denmark has suspended the use of AstraZeneca's vaccine, citing the risk of blood clots | BISouthAfrica ",1662819858,hlaly_m, Kingdom In The Sky,456,6350,,True,False,18413,,,65,0,0.0,0.0,neutral
2021-03-11 16:59:40,1370056843872108546,JosephEllis408: Summer 2021:“YO SO DID YOU GET PFIZER OR MODERNA?” ,1961637272,HannahRobinsonL,"Rock Hill, SC",435,15107,,True,False,11123,,,46798,0,0.0,0.0,neutral
2021-03-11 16:59:40,1370056842978627584,"zerohedge: 7 European Nations Halt AstraZeneca Jabs On Reports Of ""Serious"" Blood Clots ",1172835318,Sanatjuggs,,261,40575,,False,False,5459,,,247,0,0.3333333333333333,-0.16666666666666666,negative
2021-03-11 16:59:40,1370056841670103042,AJSATHISHA IndianEmbassyTR gavi IndiainPakistan WHO MEAIndia MFATurkey SozcuDunya Milliyet_Blog dhainternet DailySabah HDNER yenisafak GASAMTR Paid by Bill and Melinda gates Foundation and Gavi Alliance for Poor countries India and others.,1249874773477396482,InterAffairs1,,226,156,,False,False,3299,,,0,2,0.6,-0.4,negative
2021-03-11 16:59:40,1370056841301000203,danieteebee: It’s completely predictably American that the brand of COVID vaccine you have access to has now become a class signifier,1069665837597016064,Mudkipsmud1,"Florida, USA",322,66806,,True,False,19944,,,10923,0,0.0,0.0,neutral
2021-03-11 16:59:39,1370056840806027272,Taraba govt receives COVID-19 vaccine doses ,808267999497060356,Great9ija,United Kingdom,1850,473,,False,False,76080,,,0,0,0.0,0.0,neutral
2021-03-11 16:59:39,1370056840537595904,"laurmasi: gtconway3d “However, Pfizer’s head of vaccine research and development told the New York Times that they “were never part of…",556188501,LynnBHarrington,USA,1069,91652,,False,False,62114,,,18,0,0.45454545454545453,0.13636363636363635,positive
2021-03-11 16:59:39,1370056839061143554,"IndianEmbassyTR: Pakistan🇵🇰, the only SAARC country to not seek COVID-19 Vaccine from India, is getting 45 million 🇮🇳 made vaccine Covi…",757863351724584961,bharambe90399,"Indore, India",648,4125,,False,False,2015,,,3062,0,1.0,0.0,neutral
2021-03-11 16:59:39,1370056837488345091,Why would anyone who relies on this source for valid advice be interested in receiving information regarding a vaccine for a hoax purported by his political foes &amp; why did he take the vax in secret after bringing the circus to town doing backflips asserting covid disinformation? ,1219744193196830721,zonedfortruth,,84,13955,,False,False,13943,,,0,0,0.4333333333333333,-0.05000000000000001,negative
2021-03-11 16:59:39,1370056837400236035,kayleighmcenany: FINALLY the Biden admin recognizes the Trump admin’s unprecedented vaccine work:➡️ “We’re grateful for the work that…,352454955,Terminator_Robb,"Ohio, USA",284,24063,,True,False,23352,,,4662,0,0.95,0.3,positive
2021-03-11 16:59:38,1370056836800479239,"SouthPark: khaosqq The ""South ParQ Vaccination Special"" premieres TONIGHT at 8/7c on Comedy Central.The citizens of SouthParQ are cl…",1272440579545235457,khaosqq,2Φ2Q,14,2383,,False,False,1237,,,1,0,0.5714285714285714,0.35714285714285715,positive
2021-03-11 16:59:38,1370056836460732419,"roccogalatilaw: Denmark. another country, like Austria, to suspend  Astra-Zeneca vaccine due to ""blood-clotting"" which  led to deaths a…",1276419452,DANIMALGBC,,182,11090,,True,False,8413,,,1501,0,0.375,-0.125,negative
2021-03-11 16:59:38,1370056835764527106,spectatorindex: JUST IN: Norway has suspended use of the AstraZeneca coronavirus vaccine,950242659486044160,KendriQBulelanI,Estcourt,3190,36563,,True,False,62710,,,2565,0,0.0,0.0,neutral
2021-03-11 16:59:38,1370056835726598148,"MichelleObama: When you can get the COVID-19 vaccine, I hope you do—Barack and I are certainly glad we did. It’s our best shot at beati…",163007436,FugitiveVette,Belmont California,257,61756,,True,False,71600,,,8546,0,0.65,0.75,positive
