created,id_str,text,user_id,screen_name,location,followers_count,user_favourites_count,time_zone,geo_enabled,verified,status_count,geo,coords,retweet_count,tweet_favourite_count,Subjectivity,Polarity,Sentiment
2021-03-12 00:05:44,1370164068363993089,"gidi_9ja: BREAKING: Six European countries have suspended the use of the AstraZeneca vaccine after reports of serious blood clots 

Pl…",127562269,_imranwasim,Earth,31499,99202,,True,False,412756,,,10,0,0.3333333333333333,-0.16666666666666666,negative
2021-03-12 00:05:44,1370164068238163971,sahilkapur: Big news: White House says it will direct states and localities to make every American eligible for a Covid-19 vaccine **no…,972147365577666560,AtteberryConni,,4,9526,,False,False,7602,,,347,0,0.125,0.025,positive
2021-03-12 00:05:44,1370164067898363904,billritter7: BreakingNews  in his speech to the nation tonight - President Joe Biden will say all Americans can be eligible for a COVI…,1332819221508726787,RobertH78443973,"New York, USA",342,6793,,True,False,9051,,,5,0,0.0,0.0,neutral
2021-03-12 00:05:44,1370164067571228677,"Listen to great vibes 🔥🔥🔥. 

Damian Marley
Akah
Are You A Hard Guy
thursdayvibes
FireOnWithSupakomando
Akah
Congratulations Stargirl
AstraZeneca
Tacha1M
Lautech
Bigbrothernaija
Alafinofoyo
Biafra
Oxlade ",1412550355,elvisowen70,,528,2601,,True,False,764,,,0,2,0.6458333333333333,0.25416666666666665,positive
2021-03-12 00:05:44,1370164067332149248,jsolomonReports: Utah woman dies after taking second dose of COVID vaccine | Just The News ,354865786,Congressgohome,"Winchester, VA",328,3954,,False,False,9612,,,321,0,0.0,0.0,neutral
2021-03-12 00:05:44,1370164067009060865,"TheNVIndy: Standing alongside frontline grocery store workers, Gov. Steve Sisolak received the Janssen COVID-19 vaccine at a Las Vegas…",201766091,RileySnyder,"Reno, NV",12963,15492,,True,False,31116,,,8,0,0.0,0.0,neutral
2021-03-12 00:05:44,1370164066124242948,"ABC: Pfizer's vaccine is successful in preventing not only symptomatic COVID-19, but also asymptomatic disease according to new real-wo…",183252634,anadlacruz,,153,9190,,True,False,10306,,,1769,0,0.8015151515151514,0.29545454545454547,positive
2021-03-12 00:05:43,1370164061665685508,ColinDMello: NEW: Chief Gordon Beardy of Muskrat Dam confirms to CTVNews that they asked MPP Sol Mamakwa to fly-in and get the Moderna…,151118136,PlannerSean,Toronto,5810,125508,,True,False,53850,,,558,0,0.45454545454545453,0.13636363636363635,positive
2021-03-12 00:05:43,1370164060927356928,"michaeljames947: I would rather hear the TGA’s view from  the TGA, than relayed by politicians and their self-interested spin.
Live: Go…",185614627,phbarratt,"Armidale NSW, Anaiwan Land",26988,97898,,True,False,220842,,,12,0,0.5,0.13636363636363635,positive
2021-03-12 00:05:43,1370164060818313218,"ABC: Pfizer's vaccine is successful in preventing not only symptomatic COVID-19, but also asymptomatic disease according to new real-wo…",1265997177811169282,cl2397,Republic of the Philippines,14,114,,True,False,127,,,1769,0,0.8015151515151514,0.29545454545454547,positive
2021-03-12 00:05:43,1370164060260462592,"NewsBFM: 1. Kelantan police have identified several of their personnel who refused to take a Covid-19 vaccine, via the letter of consen…",238829754,shaq_131,Malaysia,786,95189,,True,False,223896,,,16,0,0.0,0.0,neutral
2021-03-12 00:05:42,1370164057907499010,"ABC: Pfizer's vaccine is successful in preventing not only symptomatic COVID-19, but also asymptomatic disease according to new real-wo…",209964269,gmkayumi2,,102,52227,,True,False,23288,,,1769,0,0.8015151515151514,0.29545454545454547,positive
2021-03-12 00:05:41,1370164055420329987,wrightwb Not sure the next one gets moved up as we didn't get any J&amp;J this week and the big boost of Pfizer is still a week away. I'm guessing the subsequent phases do though.,21619806,ryanhanrahan,"Hartford, CT",35890,16804,,True,True,87076,,,0,1,0.2597222222222222,-0.0625,negative
2021-03-12 00:05:41,1370164053700665344,janekin24: AZ issues across Europe. I know for a fact some batches of vax can be more problematic than others. Gtr Manc had a warning a…,934526733612613633,simonort3,,1395,141495,,False,False,106679,,,21,0,0.5,0.5,positive
2021-03-12 00:05:41,1370164051813142529,"InclusionCA: “If I were to get COVID-19, it is probably fairly unlikely that I would survive.” Vaccine prioritization can be a matter o…",2217184142,65PinkRoses,"Winnipeg, Manitoba",10014,18536,,True,False,9222,,,7,0,0.5,-0.5,negative
2021-03-12 00:05:40,1370164051305664512,Mikepeeljourno: 🚨 🚨 🚨 EU anger with AstraZeneca over vaccine delivery shortfalls is growing again. The company has said it’s doing its…,39515109,noname_8,Somewhere over WTF land 5 55,9965,873,,False,False,265006,,,6,0,0.2,-0.7,negative
2021-03-12 00:05:40,1370164051033067522,"kaylatausche: 14/ In one year:
- 10 million net jobs have been lost.
- 29 million Americans have contracted COVID-19
- 530,000 have die…",249908141,seanchristophe,Miami,83,59836,,True,False,5607,,,96,0,0.0,0.0,neutral
2021-03-12 00:05:40,1370164050731016192,"ABC: Pfizer's vaccine is successful in preventing not only symptomatic COVID-19, but also asymptomatic disease according to new real-wo…",1350789083144937472,YMXEGqxcMPnfbj0,대한민국 전라북도,9,176,,False,False,57,,,1769,0,0.8015151515151514,0.29545454545454547,positive
2021-03-12 00:05:40,1370164050643070985,"PodSaveAmerica: NEW: Republicans respond to vaccine funding and $1400 check with Dr. Seuss and Mr. Potato Head, and Democrats worry abo…",2233606956,serene19741,"Michigan, USA",5816,145372,,False,False,104264,,,17,0,0.45454545454545453,0.13636363636363635,positive
2021-03-12 00:05:40,1370164049825079296,"LOOK: NFNL starts inoculation of Troops against COVID-19 Vaccine
 
Read more about this here: 

ModernandMultiCapablePHNavy
AFPyoucanTRUST  ",108925801,burn011,Quezon City,93,182,,False,False,122,,,0,2,0.5,0.5,positive
2021-03-12 00:05:40,1370164047988064257,MSNBC: JUST IN: Pres. Biden is expected to announce that all adult Americans will be eligible for Covid-19 vaccination no later than Ma…,1333565214613262338,pollyannathibo1,,137,25883,,False,False,9009,,,103,0,0.2333333333333333,0.0,neutral
2021-03-12 00:05:39,1370164047082094594,"ABC: Pfizer's vaccine is successful in preventing not only symptomatic COVID-19, but also asymptomatic disease according to new real-wo…",188954161,cecilegatmaitan,Hundred Acre Wood,388,225670,,True,False,47950,,,1769,0,0.8015151515151514,0.29545454545454547,positive
2021-03-12 00:05:39,1370164043722457088,"ABCPolitics: “When you can get the COVID-19 vaccine, I hope you do.”

Former first lady Michelle Obama is pictured receiving the COVID-…",3115443364,Local24Brad,"Memphis, TN",2502,9402,,True,True,47023,,,18,0,0.16666666666666666,0.125,positive
2021-03-12 00:05:38,1370164041449111553,BFujer I think it was 33 deaths amongst 5 million. I don’t think one is given an option. Both have pros and cons. I decided that Covid itself carried a higher risk.  Not an easy decision as I like homeopathy better &amp; never had a flue jab either. Leap of faith for me. I had Pfizer,69558002,csibike1,"London as yet UK, Europe",9064,178877,,False,False,353169,,,0,7,0.6111111111111112,0.39444444444444443,positive
2021-03-12 00:05:38,1370164041188962306,I work in a vaccination clinic and I ask people if they 'really believe this virus stuff?' And if they say no then I switch the vaccine with a dose of actual covid-19.,896330838719188992,mywheelhouseftw,all around,1787,77707,,False,False,16621,,,1,8,0.15000000000000002,0.1,positive
2021-03-12 00:05:38,1370164040027226112,joe_warmington there is also anecdotal feedback that the vaccine helps long term covid survivors with continuing symptoms/health issues. i am on waitlists for these 2 vaccines but will actively try to avoid the astrazeneca one. 2/2,114658938,kelzipan,"Houston, TX",154,28435,,False,False,7948,,,0,0,0.5,-0.09166666666666667,negative
2021-03-12 00:05:38,1370164039939067904,"BCGovNews: CovidBC update: 569 new cases since we last reported, for a total of 86,219 cases in BC. There have been three new deaths,…",139231675,saanich,"Saanich, British Columbia",4955,6490,,True,True,14702,,,7,0,0.43143939393939396,0.06818181818181818,positive
2021-03-12 00:05:38,1370164039725281283,"POTUS: One in four adults in the U.S. has received their first COVID-19 vaccine — and we’re now leading the world in vaccinations.

Tha…",635599683,SifuMimiChan,Florida,1170,1480,,False,False,3891,,,16328,0,0.3333333333333333,0.25,positive
2021-03-12 00:05:37,1370164037573607426,BreakingNews: Novavax reports that its experimental Covid-19 vaccine is more than 96% effective in preventing mild and severe illness.…,23227333,jordan_arick,"Indianapolis, IN",384,35157,,True,False,31446,,,175,0,0.55,0.3833333333333333,positive
2021-03-12 00:05:37,1370164036822831104,"POTUS: One in four adults in the U.S. has received their first COVID-19 vaccine — and we’re now leading the world in vaccinations.

Tha…",825897642144198656,KarenOldaker,,1528,73102,,False,False,116079,,,16328,0,0.3333333333333333,0.25,positive
2021-03-12 00:05:37,1370164036080402434,toadmeister: Denmark has temporarily halted the administration of the AstraZeneca Covid vaccine following reports of cases of blood clo…,3119927967,buckland_jan,"Norwich, England",921,197979,,False,False,75664,,,437,0,0.1,0.0,neutral
2021-03-12 00:05:36,1370164034184577029,cantpretendtoo: Wife’s Uncle got the Covid vaccine on Friday. Died this morning.  Sad.,901259130576523265,StromeStephen,"Centerville, OH",749,31970,,False,False,26243,,,618,0,1.0,-0.5,negative
2021-03-12 00:05:36,1370164033656094725,"POTUS: One in four adults in the U.S. has received their first COVID-19 vaccine — and we’re now leading the world in vaccinations.

Tha…",507617289,Prairie_Agent,Canada ,358,165,,True,False,1973,,,16328,0,0.3333333333333333,0.25,positive
2021-03-12 00:05:36,1370164033375068162,"NewsHour: NEW: President Biden will direct states and territories to make all U.S. adults eligible for a COVID-19 vaccine by May 1. 

…",824354633116172288,JaxDeeDee,Boston,1137,194783,,False,False,138383,,,200,0,0.42727272727272725,0.11818181818181818,positive
2021-03-12 00:05:36,1370164032926224385,"superscriber: Denmark, Norway and Iceland suspend AstraZeneca COVID shots after blood clot reports.
No wonder ScottyFromCrapJabs got s…",1355003477240541187,JustChillieh,"Florida, USA",309,14114,,False,False,13501,,,8,0,0.0,0.0,neutral
2021-03-12 00:05:36,1370164031336689665,Thrilled to get the Moderna COVID vaccine today in WV.  We need everyone who can take a vaccine to get a shot as soon as it’s available so we can all get back to normal.  Moderna vaccinated CovidVaccine CommunityImmunityWV ,929499930619727874,WVSafetyatty,"Charleston, WV",106,31,,True,False,273,,,0,1,0.4375,0.2875,positive
2021-03-12 00:05:36,1370164031160524800,"politico: President Biden will order states to make coronavirus vaccines available to all American adults by May 1, in an effort to acc…",25178941,brkgnews,Progressland,1192,5524,,False,False,35462,,,68,0,0.2,0.2,positive
2021-03-12 00:05:36,1370164030917074945,"During declared public health emergency, healthcare providers &amp; drug companies are shielded from lawsuits. Can't sue, legal protection for COVID19 vaccines from Pfizer, Moderna, J&amp;J.
But claims for serious injuries or deaths can be filed with the CICP.
",959943347216384000,xalwho,"Asia, North America, Downunder",571,4865,,False,False,7873,,,2,0,0.3111111111111111,-0.04444444444444443,negative
2021-03-12 00:05:35,1370164030506082306,"OD_ant: If you die from Covid, but had a comorbidity...you MOST definitely died from Covid.

BUT- if you die from a VACCINE and have a…",173244861,dirt_adventure,,1032,95805,,True,False,31535,,,213,0,0.5,0.25,positive
2021-03-12 00:05:35,1370164029214298112,AllenLEllison: . marcorubio didn’t give a damn about you during this entire pandemic. He even skipped your grandparents in line to get…,889600209654882307,ReynoldPratt,"Florida, USA",7267,71854,,False,False,79128,,,584,0,0.625,0.0,neutral
2021-03-12 00:05:35,1370164028459216896,"StephBMore: My mom, dad, and sister have all gotten their first covid vaccine shot and I’m so happy. Can’t wait to see my family when w…",2423621471,henzharris,702 born and bred ,202,24733,,False,False,34663,,,10,0,0.6666666666666666,0.525,positive
2021-03-12 00:05:35,1370164028123791364,"AliVelshi: BREAKING: Biden to directing states to make all adults vaccine eligible by May 1, &amp; the expansion of those qualified to admi…",14196275,ibumichele,"Yokohama-shi Naka, Kanagawa",605,128128,,True,False,58400,,,161,0,0.0,0.0,neutral
2021-03-12 00:05:35,1370164026848739330,DavidSacks: President Biden is correctly calling on states to drop vaccine eligibility requirements and provide a date certain for Covi…,920328488,therealdhruv,,283,6864,,True,False,7567,,,70,0,0.5714285714285714,0.21428571428571427,positive
2021-03-12 00:05:34,1370164026324492290,"Noahpinion: America has created yet another super-effective COVID vaccine!!! 

🇺🇸🇺🇸🇺🇸",181087602,GrantLincoln,"New York, NY",562,320598,,True,False,13251,,,71,0,0.0,0.0,neutral
2021-03-12 00:05:34,1370164026299277312,LasVegasLocally: Casino and hospitality workers are eligible to get the covid-19 vaccine in Nevada. Finally.,2159922709,ReinaLove143,"San Antonio, TX",590,98649,,True,False,75697,,,228,0,1.0,0.0,neutral
2021-03-12 00:05:34,1370164025540157440,NewtonClarkeUK: I’ve not really posted about the vaccines being unsafe - my point has been that we just don’t know yet and so it’s wise…,2950171925,DomanLiz,,409,35407,,True,False,26805,,,135,0,0.2,-0.1,negative
2021-03-12 00:05:34,1370164024747364354,"karidoll14 pfizer I knew it . Well, no. I didn’t!",36918675,sujilu,,1317,395760,,False,False,155923,,,0,3,0.0,0.0,neutral
2021-03-12 00:05:34,1370164024395116545,NBCNews: BREAKING: President Biden is expected to call for all U.S. adults to be eligible to receive the vaccine no later than May 1; w…,1357204758042468352,Adrian27L,"New York, USA",49,1102,,False,False,485,,,288,0,0.2,-0.05,negative
2021-03-12 00:05:34,1370164023719821313,"Pfizer: COVID vaccine 97% effective, Israeli data shows

",525813230,epstein_dan,Washington/ Geneva,1892,1403,,False,False,26447,,,0,2,0.8,0.6,positive
2021-03-12 00:05:34,1370164023006793732,BlackKnight10k: 51 days until every American adult is eligible for the covid vaccine. Light at the end of the tunnel.,1294967152185942016,Dimensionspect1,,11342,35141,,False,False,11860,,,52,0,0.3333333333333333,0.16666666666666666,positive
2021-03-12 00:05:34,1370164022658662400,CNBCnow: BREAKING: President Biden will direct states to make all adults eligible for the Covid-19 vaccine by May 1. The President is a…,70198466,BryceStawski,"Covington, LA",698,312261,,False,False,71495,,,337,0,0.4,0.1,positive
2021-03-12 00:05:33,1370164020989267969,"AliVelshi: BREAKING: Biden to directing states to make all adults vaccine eligible by May 1, &amp; the expansion of those qualified to admi…",19252972,melkrawitz,,41,14258,,False,False,11505,,,161,0,0.0,0.0,neutral
2021-03-12 00:05:33,1370164020112723972,"ABC: BREAKING: Pres. Biden is expected to direct states, tribes and territories to make all American adults eligible for a COVID-19 vac…",1332819221508726787,RobertH78443973,"New York, USA",342,6793,,True,False,9051,,,96,0,0.26666666666666666,0.0,neutral
2021-03-12 00:05:33,1370164018804097034,COVID-19 first-dose vaccine appts are now available at Baptist Health Corbin. Quantities are limited and go quickly - please check back often. Click below to schedule yours now: ,145266131,BaptistHealth,"Kentucky, USA",2238,1287,,True,False,4184,,,0,0,0.26071428571428573,0.1654761904761905,positive
2021-03-12 00:05:33,1370164018355245063,COVID-19 first-dose vaccine appts are now available at Baptist Health Corbin. Quantities are limited and go quickly - please check back often. Click here to schedule yours now: ,145266131,BaptistHealth,"Kentucky, USA",2238,1287,,True,False,4184,,,0,0,0.26071428571428573,0.1654761904761905,positive
2021-03-12 00:05:33,1370164018242068481,"𝗧𝗶𝘁𝗹𝗲: A tandem-repeat dimeric RBD protein-based COVID-19 vaccine ZF2001 protects mice and nonhuman primates.
𝗔𝘂𝘁𝗵𝗼𝗿𝘀: 
 ",1244711417657376768,COVID19arXiv,,3822,7,,False,False,7831,,,0,1,0.0,0.0,neutral
2021-03-12 00:05:32,1370164017285713922,"ABC: Pfizer's vaccine is successful in preventing not only symptomatic COVID-19, but also asymptomatic disease according to new real-wo…",130503653,erick_d_23,Puerto Rico,31,2078,,True,False,10711,,,1769,0,0.8015151515151514,0.29545454545454547,positive
2021-03-12 00:05:32,1370164016753078274,BreesAnna: Austria suspends AstraZeneca COVID-19 vaccine batch after death | Article [AMP] | Reuters ,2955704391,apexviper__rko,"London, England",208,12354,,False,False,9884,,,434,0,0.0,0.0,neutral
2021-03-12 00:05:32,1370164015792599052,sahilkapur: Big news: White House says it will direct states and localities to make every American eligible for a Covid-19 vaccine **no…,55186405,fraugala,"50.11634° N, 8.70544° E 😎",905,87847,,True,False,40052,,,347,0,0.125,0.025,positive
2021-03-12 00:05:32,1370164015725436928,"Before COVID, Gates Planned Social Media Censorship of Vaccine Safety Advocates With Pharma, CDC, Media, China and CIA ",163305275,stuartbramhall,New Plymouth,1412,15,,True,False,16150,,,5,5,0.06666666666666667,0.03333333333333333,positive
2021-03-12 00:05:32,1370164015574310912,BurinskasJoe RDH07919864 They made me wait 3 weeks for my 2nd Pfizer shot too. I would have liked it much sooner.,848440530472058880,17frosted,"Anchorage, AK",10561,214682,,True,False,74208,,,0,2,0.3333333333333333,0.26666666666666666,positive
2021-03-12 00:05:32,1370164014949498882,"nytimesworld: Denmark suspended the use of the AstraZeneca vaccine because of concerns about links to an increased risk of blood clots,…",937011937979830273,Determinades,Behind the Veil of Ignorance,153,3104,,False,False,52099,,,140,0,0.0,0.0,neutral
2021-03-12 00:05:32,1370164014492217345,joshtpm: Biden Set To Announce All Adults Eligible For COVID-19 Vaccine By May 1  via TPM,2336938992,cincity631,,2572,213255,,False,False,131216,,,53,0,0.0,0.0,neutral
2021-03-12 00:05:31,1370164013691064322,spectatorindex: JUST IN: Norway has suspended use of the AstraZeneca coronavirus vaccine,2369986358,ayajet128,,792,2636,,True,False,143818,,,2582,0,0.0,0.0,neutral
2021-03-12 00:05:31,1370164012596400129,mariamainmo: Girls don't want boys. They want the covid vaccine and a nice apartment,710621199026368512,diniekirana,unnamed road,260,12901,,True,False,99813,,,25125,0,1.0,0.6,positive
2021-03-12 00:05:31,1370164011132682240,"fox5dc: 103-year-old man who survived Holocaust, 1918 pandemic receives 2nd dose of COVID-19 vaccine ",2216174972,playboi_foolio,,145,47379,,True,False,112783,,,8,0,0.0,0.0,neutral
2021-03-12 00:05:31,1370164010432278534,NBCNews: BREAKING: President Biden is expected to call for all U.S. adults to be eligible to receive the vaccine no later than May 1; w…,3009245070,JcgtPueblo,Outside ,502,20275,,True,False,25227,,,288,0,0.2,-0.05,negative
2021-03-12 00:05:30,1370164009610194944,"PHLPublicHealth: If you are interested in getting the COVID-19 vaccine, complete our Vaccine Interest Form. You will be contacted once…",1537204741,LookUpSpeakUp,,2643,2111,,False,False,3553,,,6,0,0.45,0.175,positive
2021-03-12 00:05:30,1370164007621914627,im getting the covid vaccine tomorrow,1016314872,gekijirou,HE/THEM,99,19649,,True,False,10974,,,0,4,0.0,0.0,neutral
2021-03-12 00:05:30,1370164007408074752,"ABC: Pfizer's vaccine is successful in preventing not only symptomatic COVID-19, but also asymptomatic disease according to new real-wo…",1045157397445013504,DavidResendez13,"Selma, CA",60,2030,,False,False,1072,,,1769,0,0.8015151515151514,0.29545454545454547,positive
2021-03-12 00:05:30,1370164007391408128,"JenJoeGibson poshfruit Geez_a_diamond3 thetruebluechef idiseaseecology Jen is right. It is mRNA in the Pfizer vaccine. And there is no RNA/DNA in the AZ vaccine.

Also neither vaccine is gene therapy nor can they modify your genome in anyway. There is just no mechanism that exists where that could occur",1332088018824540163,LaymansScience,,507,6003,,False,False,9891,,,0,2,0.5357142857142857,0.2857142857142857,positive
2021-03-12 00:05:30,1370164006128914438,"AudacityofGoats Target is something to look forward to! Two weeks after my 2nd Moderna injection, I shopped in a supermarket for the 1st time in a year. I was in awe of the prepared deli foods, aisles of fresh produce, endless bakery choices, &amp; organic meat &amp; cage-free eggs. It was luxurious!",893176350160416768,sachigracen,"New Orleans, LA",5642,52241,,False,False,25434,,,0,2,0.4166666666666667,0.04791666666666666,positive
2021-03-12 00:05:29,1370164005260644352,"ABC: BREAKING: Pres. Biden is expected to direct states, tribes and territories to make all American adults eligible for a COVID-19 vac…",188954161,cecilegatmaitan,Hundred Acre Wood,388,225670,,True,False,47950,,,96,0,0.26666666666666666,0.0,neutral
2021-03-12 00:05:29,1370164004740468736,Check out some amazing ThursdayMotivation! NativeAmerican vaccination rates skyrocket as tribes help others despite Internet challenges ,801503234879881220,mankillerdoc,,1318,1610,,False,False,1640,,,7,16,0.9,0.7500000000000001,positive
2021-03-12 00:05:29,1370164003276660740,mssocietyMB: Manitoba has updated its eligibility criteria for the AstraZeneca/COVISHIELD vaccine to include people with MS. MSSociety…,899823242411520000,mackozun,,55,468,,False,False,98,,,2,0,0.0,0.0,neutral
2021-03-12 00:05:29,1370164001858932736,NBCNews: BREAKING: President Biden is expected to call for all U.S. adults to be eligible to receive the vaccine no later than May 1; w…,31218760,AmandaJGomeztv,"Tucson, AZ",1194,880,,True,False,4243,,,288,0,0.2,-0.05,negative
2021-03-12 00:05:29,1370164001687015426,listenupnerds: getting euthanised at the vet by accident bc some 22yr old vet tech from purdue switched the needles and now some 18yr o…,123562002,bizmarkiedesade,Gaza,2488,40830,,False,False,117208,,,2,0,0.2,0.1,positive
2021-03-12 00:05:28,1370164001355796481,SeanCollins66: Covid-19: Several European countries suspend AstraZeneca vaccinations over blood clot fears And we all got labelled anti…,1308019801428766732,doremouse291,"Sheffield, England",45,7334,,False,False,4343,,,68,0,0.0,0.0,neutral
2021-03-12 00:05:28,1370164001347358722,"andykupf: A freedom we didn’t fully appreciate until the year of Covid happened

To gather with colleagues, friends &amp; family

A human t…",1349922686898724864,MeidasGraphics2,,5242,13411,,False,False,8496,,,76,0,0.1,0.0,neutral
2021-03-12 00:05:28,1370163999548055555,"wjz: 12-year-old helps more than 1,600 people get vaccines after building a website to help seniors
 ",20484064,MetalRabbit13,"Maryland, USA",1466,60004,,False,False,176797,,,5,0,0.5,0.5,positive
2021-03-12 00:05:28,1370163998826577922,"POTUS: One in four adults in the U.S. has received their first COVID-19 vaccine — and we’re now leading the world in vaccinations.

Tha…",918545536613081089,akinrelereanth1,"Lagos, Nigeria",1579,194890,,True,False,163977,,,16328,0,0.3333333333333333,0.25,positive
2021-03-12 00:05:28,1370163998314889216,NBCBLK: Opinion | TheRevAl: Black Americans are being called out for Covid-19 vaccine skepticism. But the greater problem is access to…,435843285,walkerbianca,Alabama,30,8444,,False,False,10187,,,7,0,0.4666666666666667,0.16666666666666669,positive
2021-03-12 00:05:27,1370163994078674954,HighWireTalk: The Italian Medicines Agency (AIFA) Thursday banned nationwide the use of a batch of the AstraZeneca COVID-19 vaccine due…,1241374383853142017,HeidiUne,,100,2779,,False,False,31491,,,434,0,0.0,0.0,neutral
2021-03-12 00:05:27,1370163994024058881,"POTUS: One in four adults in the U.S. has received their first COVID-19 vaccine — and we’re now leading the world in vaccinations.

Tha…",22924964,2021HasArrived,The UpSideDown,10167,121466,,False,False,111958,,,16328,0,0.3333333333333333,0.25,positive
2021-03-12 00:05:27,1370163993621495813,"Pfizer Vaccine mRNA Source Code:

🧬Humans have powerful antivirus system, it doesn’t care for foreign RNA

🧬Replace U (RNA) with Ψ (1-methyl-3’-pseudouridylyl or N1-methylpseudouridine) and antivirus system loses interest

🧬It now bypasses immune response induced cytotoxicity ",732611818951151616,LaurelCoons,Duke University,72003,1910,,True,False,2959,,,36,82,0.4083333333333334,-0.041666666666666664,negative
2021-03-12 00:05:27,1370163993399095300,MSNBC: BREAKING: President Biden is expected to call for all U.S. adults to be eligible to receive the vaccine no later than May 1; wil…,1343782835186851840,TalkToFrank212,,65,5593,,False,False,6764,,,54,0,0.2,-0.05,negative
2021-03-12 00:05:26,1370163991557849088,Tonight President Biden is announcing that every adult will be eligible for the Covid vaccine by May 1st!!!!,124187202,Dardenblake,,55,605,,True,False,427,,,0,2,0.3,0.244140625,positive
2021-03-12 00:05:26,1370163990626775043,"KizzyPhD: Honored to be the winner the “NextGen Award”, bestowed by The Franklin Institute, an organization that has “predicted” &amp; awar…",1861410715,TheAceblade,"Durham, NC",3524,45836,,True,False,20661,,,493,0,0.0,0.0,neutral
2021-03-12 00:05:26,1370163989481725954,BREAKING: President Biden is expected to call for all U.S. adults to be eligible to receive the vaccine no later than May 1; will announce that the U.S. could be on track to reach a sense of normalcy by Independence Day. ,2910022539,NBCBLK,"New York, NY",60095,2624,,True,True,28476,,,43,211,0.2,-0.05,negative
