created,id_str,text,user_id,screen_name,location,followers_count,user_favourites_count,time_zone,geo_enabled,verified,status_count,geo,coords,retweet_count,tweet_favourite_count,Subjectivity,Polarity,Sentiment
2021-03-12 00:03:52,1370163594701107200,"PM Scott Morrison said it was made ""very clear"" by Greg Hunt on Feb 16 that 12-week gap meant getting the second AstraZeneca dose by the end of October wouldn't be possible. I looked at those comments for earlier story and Mr Hunt actually said they would ""look at what it means"" ",1220569542,CharisChang2,Sydney,3216,1751,,True,True,4694,,,0,0,0.41966666666666663,0.026000000000000006,positive
2021-03-12 00:03:51,1370163594395025411,This just in: COVID-19 Vaccine’s do not work unless you post about them on social media. The effects of the vax will activate as soon as the Instagram story is posted.,356524189,lilchuck543,Fayetteville,543,25162,,True,False,4949,,,0,11,0.06666666666666667,0.03333333333333333,positive
2021-03-12 00:03:51,1370163594059386882,"LizSzabo: Biden Administration to Expand COVID-19 Vaccine Program to 950 Community Health Centers
",29897850,kimvie,,2692,20373,,False,False,671555,,,6,0,0.0,0.0,neutral
2021-03-12 00:03:51,1370163592675332102,"homemadeguitars: citynightcap That was my preference all along: Vaccine.
With the objective being: don't die of Covid-19.
Details opti…",146160591,Lee_in_Iowa,Des Moines,86077,685058,,True,False,332410,,,2,0,0.1,0.0,neutral
2021-03-12 00:03:51,1370163591614185473,"Hey y’all! If you’re in Chicago and cook county and in phase 1b, there are going to be 20,000 appointments available tomorrow to get vaccinated! Sign up with this link through the county! Let’s all do our part to stop covid! ",47432745,PaymonOfficial,"Chicago, IL",3786,4103,,False,False,3409,,,0,0,0.4,0.78125,positive
2021-03-12 00:03:51,1370163591001804801,"Stanley Plotkin, Godfather of vccines. He is also a consultant to Moderna, one of the creators of the Covid vax. He's under oath admitting to using fetal tissue from aborted babies/animals in vccines. He says he'll gladly go to hell for what he's done
",1360129102116753408,SFlags17,Following My Skateboard...,59,123,,False,False,847,,,1,3,1.0,0.5,positive
2021-03-12 00:03:50,1370163589546352642,Use of AstraZeneca COVID-19 vaccine suspended in parts of Europe  via YouTube,1352201767828611072,janchivv,Mongolia,19,66,,False,False,45,,,0,0,0.0,0.0,neutral
2021-03-12 00:03:50,1370163587482849281,"GreatGameIndia: THIS IS BIG

8 European nations including Italy, Latvia, Luxembourg, Lithuania, Estonia, Denmark, Norway and Iceland ha…",22060003,JessieBrewer,"Port Charles, NY",1469,73421,,True,False,121603,,,789,0,0.05,0.0,neutral
2021-03-12 00:03:50,1370163587222765569,sahilkapur: Big news: White House says it will direct states and localities to make every American eligible for a Covid-19 vaccine **no…,3130395754,beardedguy802,"Greenwood, IN",154,88438,,False,False,4742,,,347,0,0.125,0.025,positive
2021-03-12 00:03:50,1370163587210153987,AllenLEllison: . marcorubio didn’t give a damn about you during this entire pandemic. He even skipped your grandparents in line to get…,1108120812668809218,melinda10890345,"Palm Harbor, FL",472,29598,,False,False,27976,,,584,0,0.625,0.0,neutral
2021-03-12 00:03:49,1370163583963783169,"DrManaouda: After the suspension of the AstraZeneca vaccine by some countries on precautionary basis, I have just urgently consulted th…",1218433029317824512,HerveBass2,"Littoral, Cameroon",16,385,,False,False,192,,,23,0,0.0,0.0,neutral
2021-03-12 00:03:49,1370163583913504772,"realTuckFrumper: Novavax Reports Its COVID-19 Vaccine is 96% Efficacious, Based on Phase 3 Trial Results ",820344569527226370,upchuck66,,1743,213081,,False,False,423053,,,19,0,0.0,0.0,neutral
2021-03-12 00:03:49,1370163583112286211,"LizSzabo: Biden Administration to Expand COVID-19 Vaccine Program to 950 Community Health Centers
",31177547,kathygori,California: LA and Sonoma,3846,174778,,False,True,86982,,,6,0,0.0,0.0,neutral
2021-03-12 00:03:49,1370163582760017920,THEAWESOMEFAMIL: A beautiful day to take Moderna on the road to homebound seniors. Thank you ⁦MGHToronto⁩ ⁦SETorontoFHT⁩ covax Hous…,2379210613,PhamTia,"Toronto, Ontario",827,1331,,False,False,649,,,9,0,1.0,0.85,positive
2021-03-12 00:03:48,1370163581224947713,Biden will call for all adult Americans to be eligible for the COVID vaccine by May 1 ,14304170,PennLive,"Pennsylvania, USA",125223,5031,,True,True,258410,,,1,12,0.3,0.1,positive
2021-03-12 00:03:48,1370163580100825088,HighWireTalk: The Italian Medicines Agency (AIFA) Thursday banned nationwide the use of a batch of the AstraZeneca COVID-19 vaccine due…,1297529788492664835,DemonsDestroyer,UK,172,5538,,False,False,6666,,,434,0,0.0,0.0,neutral
2021-03-12 00:03:48,1370163580071505922,fox5dc: BREAKING: Biden to direct states to make all adults eligible for COVID-19 vaccine by May 1 ,2446583341,Darealfatboii_,,1445,51541,,True,False,58018,,,19,0,0.4,0.1,positive
2021-03-12 00:03:48,1370163580050534402,cantpretendtoo: Wife’s Uncle got the Covid vaccine on Friday. Died this morning.  Sad.,3180751919,DJBrooks7777,"Goose Creek, SC",471,12692,,False,False,19532,,,618,0,1.0,-0.5,negative
2021-03-12 00:03:48,1370163579857559554,"MichelleObama: When you can get the COVID-19 vaccine, I hope you do—Barack and I are certainly glad we did. It’s our best shot at beati…",3602628263,Hogan_Writes,"Washington, D.C., area",2106,106172,,False,False,62566,,,8090,0,0.65,0.75,positive
2021-03-12 00:03:46,1370163573536743425,SteiniBrown: Teachers pls consider sharing: UofT_dlsph researchers are studying COVID in Ontario teachers &amp; other education workers. P…,119748833,miltonholmes,"Oshawa, Ontario",104,2512,,False,False,632,,,300,0,0.375,-0.125,negative
2021-03-12 00:03:46,1370163572941197313,"So happy for hubby (who is a ""tad"" older than I 🤣). He's been tested for antibodies AND he just got his first shot Pfizer 1stshotdone 

It's not my turn yet...but I'm happy for HIM. He had COVID &amp; I don't ever want him to deal with that again. ",20103144,KeepinUpWithCDJ,Oakland County,3617,62108,,False,False,55118,,,0,1,0.6666666666666666,0.5041666666666667,positive
2021-03-12 00:03:46,1370163569623453701,"BarackObama: Michelle and I got vaccinated against COVID-19 because we know it’s the best way to beat this pandemic, protect one anothe…",1259009388263718913,atamegue,,10,461,,False,False,340,,,9849,0,0.3,1.0,positive
2021-03-12 00:03:45,1370163569308790785,"latimes: L.A. County is on track to reopen indoor restaurants, gyms and movie theaters as early as Monday.

The re-openings will be tri…",185960851,edmgonzalez,"Westside, USA",785,18374,,True,True,22411,,,27,0,0.3,0.1,positive
2021-03-12 00:03:45,1370163567954030593,"Bishops say shun AZ vaccine ""because they were developed using cell lines that MAY have been derived from an abortion nearly 50 years ago""
Should also avoid Catholic church cuz it was involved in killing millions in the crusades!
Fair is Fair!


cdnpoli ",284850162,shawnigan1,Shawnigan Lake BC,1827,2799,,True,False,22003,,,0,5,0.52,0.355,positive
2021-03-12 00:03:45,1370163567492751366,"TIME: COVID-19 cases are rising in Europe, and the vaccine rollout is lagging. How did it all go so badly wrong? ",931502874311393280,totobalgarcia,aquí,230,4752,,True,False,2725,,,39,0,0.9,-0.5,negative
2021-03-12 00:03:45,1370163566716858370,donkamion78: Several European countries suspend AstraZeneca vaccinations over blood clot fears ,1214446739333296129,NeanderthalWin,,1973,3106,,False,False,8822,,,174,0,0.0,0.0,neutral
2021-03-12 00:03:45,1370163566536445953,"LincolnsBible: My god... I cannot imagine how wretched the vaccine and Covid infection situation in America would be right now, if Jare…",1275467112136478720,ActonBell12,Chicago,1285,67634,,False,False,23020,,,609,0,0.5357142857142857,0.2857142857142857,positive
2021-03-12 00:03:45,1370163566091796482,"noahweiland: Scoop: The U.S. is sitting on tens of millions of doses of the AstraZeneca vaccine in Maryland and Ohio facilities, and of…",274743250,OverPatriarchy,The Mother Ship,3993,91110,,False,False,62594,,,488,0,0.0,0.0,neutral
2021-03-12 00:03:45,1370163565982740483,MSNBC: JUST IN: Pres. Biden is expected to announce that all adult Americans will be eligible for Covid-19 vaccination no later than Ma…,828718135582691328,MaryAnn27608053,,173,48233,,False,False,16540,,,103,0,0.2333333333333333,0.0,neutral
2021-03-12 00:03:45,1370163565802315781,"cnnphilippines: As the government addresses the rising number of COVID-19 infections, it's also moving to secure more vaccines for the…",1123005958945304577,fortunefrien,"San Jose Del Monte, Central Lu",329,14,,True,False,13119,,,3,0,0.55,0.45,positive
2021-03-12 00:03:44,1370163564741283843,"POTUS: One in four adults in the U.S. has received their first COVID-19 vaccine — and we’re now leading the world in vaccinations.

Tha…",725434966952267776,eleanorsaal,"Worcester, MA",100,6604,,True,False,2343,,,16329,0,0.3333333333333333,0.25,positive
2021-03-12 00:03:44,1370163562337992707,"Reuters: Data suggests the Pfizer-BioNTech vaccine is 94% effective in preventing asymptomatic infection, meaning it could significantl…",1052626822645596161,BlockTrendyCom,,262,674,,False,False,4286,,,115,0,0.8,0.6,positive
2021-03-12 00:03:43,1370163560584773639,"azcentral: BREAKING: Biden to direct states to make all adults eligible for COVID vaccine by May 1, official says
 ",80571256,Scootrbum, Illinois/Wisconsin,1930,105674,,False,False,87509,,,8,0,0.4,0.1,positive
2021-03-12 00:03:43,1370163557980069889,"kayleighmcenany: FINALLY the Biden admin recognizes the Trump admin’s unprecedented vaccine work:

➡️ “We’re grateful for the work that…",156549358,Akazo,Zion,1114,51713,,True,False,171936,,,4566,0,0.95,0.3,positive
2021-03-12 00:03:42,1370163555887165443,HighWireTalk: The Italian Medicines Agency (AIFA) Thursday banned nationwide the use of a batch of the AstraZeneca COVID-19 vaccine due…,389149189,PFerreira71,Lisboa,109,5017,,False,False,10219,,,434,0,0.0,0.0,neutral
2021-03-12 00:03:42,1370163555496947714,getting euthanised at the vet by accident bc some 22yr old vet tech from purdue switched the needles and now some 18yr old cat got the moderna vax,41590828,listenupnerds,⛰Denver ⛰,1383,75622,,False,False,23581,,,2,24,0.2,0.1,positive
2021-03-12 00:03:41,1370163552506368000,"finnygo: BREAKING: POTUS will announce during his first prime time address tonight at 8PM that he is directing all states, tribes &amp; te…",49471321,mosully,"California, USA",1054,115279,,False,False,107181,,,77,0,0.3333333333333333,0.25,positive
2021-03-12 00:03:41,1370163550363209729,"Reuters_Health: French health authorities see no reason to suspend the use of AstraZeneca COVID-19 vaccinations, despite suspensions in…",609099268,Moniorti,Undisclosed Location,1969,112522,,False,False,128344,,,3,0,0.0,0.0,neutral
2021-03-12 00:03:41,1370163550312787968,LasVegasLocally: Casino and hospitality workers are eligible to get the covid-19 vaccine in Nevada. Finally.,839098274,GoodVibeMe,Somewhere in America,167,2460,,False,False,9249,,,228,0,1.0,0.0,neutral
2021-03-12 00:03:41,1370163549314617344,"weaponizedword1: “Denmark and Norway Suspend AstraZeneca Covid-19 Vaccine Over Blood Clot Worries”

",159132441,sallie__anne,United States,16429,146994,,True,False,58685,,,23,0,0.0,0.0,neutral
2021-03-12 00:03:40,1370163546810691597,"BREAKING

Biden: Every Adult Eligible For COVID-19 Vaccine By May

Ryan Brooks reports: 

60 Twitter shares &amp; 2124 total shares so far.",1302338561316970496,WantNewsApp,🌍,239,3,,False,False,4460,,,0,0,0.6833333333333332,0.06666666666666667,positive
2021-03-12 00:03:40,1370163546558894081,WaitemataDHB: We have been alerted to possible COVID-19 vaccine scams.⚠️ At no point will you be asked to pay for the vaccine or pay fo…,4691518782,Anushiz77,New Zealand,44,7454,,True,False,1340,,,8,0,1.0,0.0,neutral
2021-03-12 00:03:40,1370163545653006338,"richones1 scottycknight POTUS That was my only side effect when I got my first dose of Pfizer vaccine (except for a slight sore arm the next day), well that and my overwhelming desire to tell everyone!",3110579093,Okie_Resister,,4908,332545,,False,False,69991,,,0,2,0.5,0.14166666666666666,positive
2021-03-12 00:03:40,1370163545027997697,Just heard from a business colleague in Alberta that he’s eligible for his AstraZeneca vaccine. He’s in the 50+ age group. C’mon B.C! ,97029749,MartinvandenH,"Richmond, B.C.",1612,15314,,True,False,11832,,,0,0,0.0,0.0,neutral
2021-03-12 00:03:39,1370163541123104768,"roccogalatilaw: Australian Health Minister hospitalized, ""in serious condition"", day after receiving Covid, Astra-Zeneca, Vaccine.

htt…",1319798118469124097,DarthSmeagle,,197,4970,,False,False,3934,,,2251,0,0.3333333333333333,-0.16666666666666666,negative
2021-03-12 00:03:39,1370163540544299013,danieteebee: It’s completely predictably American that the brand of COVID vaccine you have access to has now become a class signifier,608399336,thebreezyflash,stanford,568,76933,,False,False,16027,,,10836,0,0.0,0.0,neutral
2021-03-12 00:03:38,1370163538644328449,"YAY! I’m ready! Such good news 💉💙
 ",377152007,jill_millander,NYC ,4047,103372,,True,False,80398,,,0,11,0.5333333333333333,0.31666666666666665,positive
2021-03-12 00:03:37,1370163534164676610,HuffPostPol: BREAKING: President Joe Biden will direct all states to make every adult in the nation eligible for a COVID-19 vaccine no…,385216864,roxanarianna,SoCal,449,31753,,True,False,27808,,,150,0,0.35,0.1,positive
2021-03-12 00:03:37,1370163532835155970,"tech2020ceo Pfizer wasnt part of that, but okay.",48922691,Sektor30,West Coast,6,447,,False,False,437,,,0,0,0.5,0.5,positive
2021-03-12 00:03:37,1370163531857997824,New: North Carolina covid vaccine appointments at CVS ⬇️ ,29292353,dizzycatdesign,"Charlotte, NC",5198,147655,,False,False,38574,,,1,15,0.45454545454545453,0.13636363636363635,positive
2021-03-12 00:03:36,1370163529785966593,AllenLEllison: . marcorubio didn’t give a damn about you during this entire pandemic. He even skipped your grandparents in line to get…,1179603343989202944,Eric49101393,Inside the Beltway,39,1531,,False,False,3238,,,584,0,0.625,0.0,neutral
2021-03-12 00:03:36,1370163529433628672,"PEW: Black Americans Most Concerned Compared To Whites, Hispanics... ",224811364,PS641600,Dark Side Of The Moon,2863,3790,,False,False,216732,,,0,0,0.4666666666666667,0.16666666666666669,positive
2021-03-12 00:03:36,1370163528146030598,WSBConsensus: Moderna ( $MRNA ) executive says the co. may have phase 1 data on a multivalent COVID vaccine against Wuhan strain and So…,842612424,ianbein95,,438,21824,,True,False,60133,,,2,0,0.0,0.0,neutral
2021-03-12 00:03:35,1370163526770302987,BreakingNews: Novavax reports that its experimental Covid-19 vaccine is more than 96% effective in preventing mild and severe illness.…,2407903117,BunyBro,"Florence, KY",751,27097,,False,False,15234,,,175,0,0.55,0.3833333333333333,positive
2021-03-12 00:03:35,1370163524249513984,danieteebee: It’s completely predictably American that the brand of COVID vaccine you have access to has now become a class signifier,1143586891,Stayawake07,,120,3518,,False,False,4768,,,10836,0,0.0,0.0,neutral
2021-03-12 00:03:35,1370163523683119104,"OceanCityDental: The U.K., The EU And The WHO Have All Authorized AstraZeneca’s Covid-19 Vaccine—Why Hasn’t The U.S.? ",1044630630682816513,OceanCityDental,"Ocean City, Maryland",674,0,,True,False,1774,,,5,0,0.0,0.0,neutral
2021-03-12 00:03:35,1370163523532247043,"sarahcareyIRL Well, there's this... ",234927158,technopolitics,"Cork, Ireland.  Usually.",897,5401,,True,False,6263,,,0,0,0.0,0.0,neutral
2021-03-12 00:03:35,1370163523381125126,CNBCnow: BREAKING: President Biden will direct states to make all adults eligible for the Covid-19 vaccine by May 1. The President is a…,106836993,RazorCrusade,Vegas,272,44417,,False,False,4492,,,337,0,0.4,0.1,positive
2021-03-12 00:03:34,1370163522647298049,narendramodi: Happy to share that my mother has taken the first dose of the COVID-19 vaccine today. I urge everyone to help and motivat…,1254176264623136769,Rudra26542876,,13,1839,,False,False,1921,,,16818,0,0.6666666666666666,0.525,positive
2021-03-12 00:03:34,1370163522475282433,"TIMEHealth: Novavax Reports Its COVID-19 Vaccine is 96% Efficacious, Based on Phase 3 Trial Results ",1270831827377414145,OrbPeace,,184,52740,,False,False,22375,,,9,0,0.0,0.0,neutral
2021-03-12 00:03:34,1370163522366230540,"ChildrensHD: NEW RobertKennedyJr: In Oct 2019, shortly before the COVID outbreak, Gates + other powerful individuals began planning ho…",276979022,Foxheimer,BrussHell Belgium,62,6340,,False,False,20839,,,644,0,0.5323863636363636,0.07784090909090909,positive
2021-03-12 00:03:34,1370163522030743560,"DNV_StreetDogs: goldenlily2017 Had mine on Monday - Oxford Astra Zeneca one - was over in a couple of seconds, barely felt it, no ill…",1033160297559687168,Dimmer90921966,,47,3350,,False,False,3504,,,1,0,0.1,0.05,positive
2021-03-12 00:03:34,1370163521238003714,"Tophersux PeytonMcLeod_ EricBaudour Watch your back, Pfizies! 👊🏼
—Me, rival Moderna Gang member",15819118,KaiserGeiser,"Austin, TX",4312,105179,,False,False,23451,,,0,2,0.0,0.0,neutral
2021-03-12 00:03:34,1370163519929344003,sahilkapur: Big news: White House says it will direct states and localities to make every American eligible for a Covid-19 vaccine **no…,954126001780518914,Mikebespeckled,,198,23801,,False,False,88499,,,347,0,0.125,0.025,positive
2021-03-12 00:03:34,1370163519430160386,"Pfizer BioNTech_Group Covid_19 vaccine data shows high degree of effectiveness says the CEO of Pfizer AlbertBourla in an interview with CNBC TV.
CNBC ",1953304932,rajiv_biswas,,1715,4343,,False,False,3101,,,0,0,0.5399999999999999,0.16,positive
2021-03-12 00:03:33,1370163518134054913,KrisGoldsmith85: Yesterday (Wednesday) I went to DeptVetAffairs website and signed up for “more info” about when I could receive the C…,876724856,dprnesq,San Francisco Bay Area,1202,146765,,True,False,273137,,,191,0,0.5,0.5,positive
2021-03-12 00:03:33,1370163517777530881,East Gwillimbury to assist seniors in booking vaccine appointments  ,971844565882810368,BradfordTodayCa,,776,166,,False,False,16789,,,0,0,0.0,0.0,neutral
2021-03-12 00:03:33,1370163516078923778,Pfizer And Moderna Make Progress On COVID-19 Vaccine Goals : Shots - Health News - NPR ,4725957312,TheRadioTFI,"Queens, NY - Worldwide",122,26,,False,False,18611,,,0,0,0.0,0.0,neutral
2021-03-12 00:03:33,1370163515516882945,"IndianEmbassyTR: Pakistan🇵🇰, the only SAARC country to not seek COVID-19 Vaccine from India, is getting 45 million 🇮🇳 made vaccine Covi…",824664792409534464,Dkp_0fficial,Other World,201,25420,,True,False,42379,,,3055,0,1.0,0.0,neutral
2021-03-12 00:03:32,1370163514464038915,"Noahpinion: America has created yet another super-effective COVID vaccine!!! 

🇺🇸🇺🇸🇺🇸 ",42521789,jsalsman,Speak Clearly LLC,2295,56911,,False,False,65990,,,71,0,0.0,0.0,neutral
2021-03-12 00:03:32,1370163514069848064,"SheriffClarke: If Trump was President today, LYING LIB MEDIA would be leading this as ""Breaking News"" and saying he has blood on his ha…",65506607,jodierocco,"Las Vegas, NV",2035,8666,,False,False,10698,,,151,0,0.0,0.0,neutral
2021-03-12 00:03:32,1370163513793024000,akbarth3great: The U.S. Is Sitting on Tens of Millions of Vaccine Doses the World Needs ,1343362946852937728,CSTLUnited,🇺🇸 🇪🇺 | Fighting for Truth,4,22,,False,False,39314,,,3,0,0.0,0.0,neutral
2021-03-12 00:03:32,1370163513620979718,akbarth3great: The U.S. Is Sitting on Tens of Millions of Vaccine Doses the World Needs ,1345652009618255872,ZTSecure,Your Network,4,14,,False,False,37960,,,3,0,0.0,0.0,neutral
2021-03-12 00:03:32,1370163513390297090,A Kroger clinic in Virginia accidentally gave customers empty shots instead of Covid-19 vaccines - CNN ,4725957312,TheRadioTFI,"Queens, NY - Worldwide",122,26,,False,False,18611,,,0,0,0.5,-0.1,negative
2021-03-12 00:03:32,1370163513025462279,"ipo_mantra: When every country was focusing to encash Covid Crises and was selling Medical Equipments, Masks, PPE Kits etc, India gave…",813262001728163840,SilverL25420529,Singapore,23,2466,,False,False,1977,,,238,0,0.0,0.0,neutral
2021-03-12 00:03:32,1370163512719273984,akbarth3great: The U.S. Is Sitting on Tens of Millions of Vaccine Doses the World Needs ,1347177640243900417,agent_guzman,RTs and Likes ≠ Endorsement,3,13,,False,False,35470,,,3,0,0.0,0.0,neutral
2021-03-12 00:03:31,1370163508155969544,goldenlily2017: If you had the chance of getting a covid vaccine tomorrow would you take it and which one would you have? Mam is feelin…,1033160297559687168,Dimmer90921966,,47,3350,,False,False,3504,,,25,0,0.0,0.0,neutral
2021-03-12 00:03:31,1370163507946254350,"ABC: BREAKING: Pres. Biden is expected to direct states, tribes and territories to make all American adults eligible for a COVID-19 vac…",981637063,Mattstrangelo,"Westchester, NY // Ithaca, NY",350,55487,,True,False,11512,,,96,0,0.26666666666666666,0.0,neutral
2021-03-12 00:03:31,1370163506926981120,Nationwideradio: The EU’s medicines regulator says there’s no indication the Oxford-AstraZeneca COVID-19 vaccine is linked to an increa…,23280098,brookeharrisonx,Jamaica,1466,24094,,True,False,42511,,,12,0,0.0,0.0,neutral
2021-03-12 00:03:31,1370163506729816064,sujilu pfizer This gif is my life right now. My little will ONLY watch Lego Batman these days. 😂,176522516,karidoll14,"South Dakota, USA",1343,222054,,True,False,52673,,,0,3,0.6785714285714285,0.03273809523809523,positive
2021-03-12 00:03:31,1370163506700558337,"Nobody:

Me when I get my COVID vaccine: ",1246610359773016064,whoisoriginel,Quarantined,101,2152,,True,False,4831,,,0,1,0.0,0.0,neutral
2021-03-12 00:03:30,1370163506121736197,BreakingNews: Novavax reports that its experimental Covid-19 vaccine is more than 96% effective in preventing mild and severe illness.…,2747632378,mlusibiya1,"Johannesburg, South Africa",639,26176,,True,False,56697,,,175,0,0.55,0.3833333333333333,positive
2021-03-12 00:03:30,1370163505685524481,EricMMatheny: Are we going to talk about the healthy 39 year old woman from Utah who got her second dose of the Moderna vaccine and the…,49109153,ESH_GrannySue,"Palatine, IL",1317,49690,,False,False,60664,,,2890,0,0.2333333333333333,0.19999999999999998,positive
2021-03-12 00:03:30,1370163505400254465,sahilkapur: Big news: White House says it will direct states and localities to make every American eligible for a Covid-19 vaccine **no…,1214206642851463168,EileenMullahy,,114,41849,,False,False,4124,,,347,0,0.125,0.025,positive
2021-03-12 00:03:30,1370163503835746304,bruce_haigh: auspol Brendan Murphy is a disgrace. No shame. No ability. He is a political lackey. Saw my excellent local GP today in O…,1196750676140806145,1Barwil,,249,23,,False,False,25691,,,173,0,0.3666666666666667,0.3333333333333333,positive
2021-03-12 00:03:29,1370163501524676608,First dose in! This is for you mom! PfizerCovidVaccine Pfizer ,17420635,ritchtran,"Los Angeles, CA",1027,1298,,True,False,4988,,,0,0,0.3333333333333333,0.390625,positive
2021-03-12 00:03:28,1370163497796042752,"MichelleObama: When you can get the COVID-19 vaccine, I hope you do—Barack and I are certainly glad we did. It’s our best shot at beati…",2548028216,SloaneTodd,,57,110379,,False,False,38624,,,8090,0,0.65,0.75,positive
2021-03-12 00:03:28,1370163497762443265,"CarlaSpade: The covid vaccine roll out has killed thousands, mainly elderly.

When this is fully understood, the faith in vaccines is g…",1247250738297831425,digsbury,,134,33328,,False,False,24365,,,22,0,0.16666666666666666,-0.016666666666666677,negative
2021-03-12 00:03:28,1370163496529313799,"BarackObama: Michelle and I got vaccinated against COVID-19 because we know it’s the best way to beat this pandemic, protect one anothe…",7007182,laurengail,,76,59938,,False,False,93282,,,9849,0,0.3,1.0,positive
2021-03-12 00:03:28,1370163495342252034,"kayleighmcenany: FINALLY the Biden admin recognizes the Trump admin’s unprecedented vaccine work:

➡️ “We’re grateful for the work that…",1147232667370426368,Angela22424540,,64,11808,,False,False,5357,,,4566,0,0.95,0.3,positive
2021-03-12 00:03:28,1370163495199600640,"NewsHour: NEW: President Biden will direct states and territories to make all U.S. adults eligible for a COVID-19 vaccine by May 1. 

…",12748182,shadownlite,Washington State,1527,1430,,True,False,207511,,,200,0,0.42727272727272725,0.11818181818181818,positive
2021-03-12 00:03:27,1370163492888571909,mariamainmo: Girls don't want boys. They want the covid vaccine and a nice apartment,2576094886,sydmoore_,,337,5081,,False,False,2104,,,25125,0,1.0,0.6,positive
2021-03-12 00:03:27,1370163492456701957,"GreatGameIndia: THIS IS BIG

8 European nations including Italy, Latvia, Luxembourg, Lithuania, Estonia, Denmark, Norway and Iceland ha…",973224032836481024,SandraWors3,,1895,106143,,False,False,75324,,,789,0,0.05,0.0,neutral
2021-03-12 00:03:27,1370163492234395650,mariamainmo: Girls don't want boys. They want the covid vaccine and a nice apartment,738774764894851072,sadiearmelle,LA,335,29307,,True,False,6111,,,25125,0,1.0,0.6,positive
2021-03-12 00:03:27,1370163489847775234,"ABC: “When you can get the COVID-19 vaccine, I hope you do.”

Former first lady Michelle Obama is pictured receiving the COVID-19 vacci…",450991824,colt745flockin1,D Boy / Support LIV/Red Bottom,535,19628,,True,False,45819,,,115,0,0.16666666666666666,0.125,positive
2021-03-12 00:03:26,1370163488547610625,danieteebee: It’s completely predictably American that the brand of COVID vaccine you have access to has now become a class signifier,2643167566,Kayyy_beeeee,ATX,1156,18024,,True,False,6257,,,10836,0,0.0,0.0,neutral
