created,id_str,text,user_id,screen_name,location,followers_count,user_favourites_count,time_zone,geo_enabled,verified,status_count,geo,coords,retweet_count,tweet_favourite_count,Subjectivity,Polarity,Sentiment
2021-03-12 00:06:29,1370164253223686144,ASlavitt I didn't expect to feel this emotional about being able to get a vaccine.  I'm going to Idaho to spread my brother's ashes in May with his kids &amp; I have been so nervous about getting on a plane without being vaccinated. Hubby gets his second Pfizer shot on Sunday.,2968626209,Fly_Sistah,NYC & Virginia,12581,150812,,True,False,82287,,,13,255,0.425,0.16666666666666666,positive
2021-03-12 00:06:28,1370164252368117760,toadmeister: Denmark has temporarily halted the administration of the AstraZeneca Covid vaccine following reports of cases of blood clo…,1366134850776936448,ArdiSilverstein,"Tottenham, London",96,869,,False,False,501,,,437,0,0.1,0.0,neutral
2021-03-12 00:06:28,1370164251587928074,calmudge0n: 85 or older? Book your vaccination appointment. ,703722876,ThomasHall17,"Ottawa, Canada",2467,13228,,False,False,175804,,,2,0,0.3333333333333333,0.16666666666666666,positive
2021-03-12 00:06:28,1370164250262573059,"realTuckFrumper: Novavax Reports Its COVID-19 Vaccine is 96% Efficacious, Based on Phase 3 Trial Results ",916118760842518530,hurricane_hails,"Michigan, USA",359,90269,,True,False,38855,,,19,0,0.0,0.0,neutral
2021-03-12 00:06:27,1370164247251066882,NBCNews: BREAKING: President Biden is expected to call for all U.S. adults to be eligible to receive the vaccine no later than May 1; w…,26292411,regcoral,Puerto Rico,8470,28418,,True,False,212728,,,288,0,0.2,-0.05,negative
2021-03-12 00:06:27,1370164246961590272,"NPR: In Birmingham, Alabama, a health clinic that primarily serves a lower-income, Black neighborhood has not administered a single dos…",21809951,superholiday,,198,181913,,False,False,42791,,,180,0,0.3825396825396825,0.05396825396825398,positive
2021-03-12 00:06:26,1370164244604362756,"POTUS: One in four adults in the U.S. has received their first COVID-19 vaccine — and we’re now leading the world in vaccinations.

Tha…",299626127,desicool21,South africa /Canada ,2639,254758,,True,False,262661,,,16328,0,0.3333333333333333,0.25,positive
2021-03-12 00:06:26,1370164243153231876,Biden will direct states to make all adults eligible for COVID-19 vaccine by May 1 ,35646496,jejeanclaude,"Swissvale, PA",5153,2083,,True,False,460501,,,2,2,0.4,0.1,positive
2021-03-12 00:06:26,1370164243123695616,"TheAtulMishra: Sweden,a largely inconsequential country wished to bounce back to significance with its AstraZeneca vaccines that it pro…",1154195267140255745,trivedi_snehal,સિંહ ના ઠેકાણા ના હોય!,211,61181,,False,False,16810,,,448,0,0.21428571428571427,0.10714285714285714,positive
2021-03-12 00:06:26,1370164240934387714,citizentvkenya I hope you have read on Germany claims of 8% effectiveness on 65 years and above by AstraZeneca  vaccines thus Germany is prioritizing Pfizer vaccines for old age because of efficacy.,4793508411,YasinKuso,"Wajir, Kenya",74,582,,False,False,764,,,0,0,0.15000000000000002,0.05,positive
2021-03-12 00:06:26,1370164240758284289,"I can’t bring myself to get that vaccine, it’s not even cause it’s a Covid vaccine.. I don’t even take the flu shot",230496191,theeMINDOFARIEL,htx. // wherever i wanna be. ,29506,9742,,True,False,122608,,,0,2,0.0,0.0,neutral
2021-03-12 00:06:26,1370164240720465920,"ABC: Pfizer's vaccine is successful in preventing not only symptomatic COVID-19, but also asymptomatic disease according to new real-wo…",919084397009219584,RealBarabbas,"Ohio, USA",1474,185663,,False,False,136695,,,1769,0,0.8015151515151514,0.29545454545454547,positive
2021-03-12 00:06:25,1370164238942015488,"noahweiland: Scoop: The U.S. is sitting on tens of millions of doses of the AstraZeneca vaccine in Maryland and Ohio facilities, and of…",2450621492,AlanJMitchell_,,2305,75830,,False,False,337720,,,488,0,0.0,0.0,neutral
2021-03-12 00:06:25,1370164238770040833,NBCNews: BREAKING: President Biden is expected to call for all U.S. adults to be eligible to receive the vaccine no later than May 1; w…,65939142,AlexFisherKGET,"Bakersfield, CA",1316,4455,,True,True,7682,,,288,0,0.2,-0.05,negative
2021-03-12 00:06:25,1370164238694690827,39-Year-Old Mother Dies After 2nd Dose of Moderna Vaccine: Family  via epochtimes,38022781,graca5683,"Odessa,Tx. ",21601,133880,,True,False,157381,,,2,5,0.0,0.0,neutral
2021-03-12 00:06:25,1370164236517842944,jsolomonReports: Utah woman dies after taking second dose of COVID vaccine | Just The News ,195190500,ebrito0612,"MP, Santo Domingo ",216,2728,,True,False,4297,,,321,0,0.0,0.0,neutral
2021-03-12 00:06:25,1370164236454879239,"MsKellyMHayes I had a very mild reaction to the Moderna! Both times my arm was pretty sore, I was sleepy, and I had a mild headache that responded to ibuprofen. The first one I had some very mild body aches the next morning that were relieved by moving around. Would def recommend it to others.",22460778,awomxninscience,"Chicago, IL",246,608,,False,False,1360,,,0,0,0.5222222222222223,0.3013888888888889,positive
2021-03-12 00:06:24,1370164233560723457,"m_scribe: Breaking: Novavax announces efficacy results in its vaccine trials.

* 100% protection against severe disease
* 96% effective…",548441402,adi_gajigan,Manila x Honolulu ,1067,90077,,True,False,16950,,,682,0,0.0,0.0,neutral
2021-03-12 00:06:24,1370164233334366208,DaxGigandet I didn't have any from the Pfizer-BioNtech.,281196145,timrchurch,Personal Time Cone,2561,136355,,True,False,37456,,,0,1,0.0,0.0,neutral
2021-03-12 00:06:24,1370164232680058883,"President JoeBiden VP
getting it done - experience, and competent leadership, so refreshing.
Great job, we are so grateful for your leadership...👍🙏😷🤩😍👏👏😅

Biden will direct states to make all adults eligible for vaccine by May 1 ",842495095572238338,AnWin15,,11260,60248,,False,False,98376,,,1,1,0.7041666666666666,0.47500000000000003,positive
2021-03-12 00:06:23,1370164230461227008,davidchapman141: BREAKING: Six European countries have suspended the use of the AstraZeneca vaccine after reports of serious blood clots,354865786,Congressgohome,"Winchester, VA",328,3954,,False,False,9612,,,8,0,0.3333333333333333,-0.16666666666666666,negative
2021-03-12 00:06:23,1370164229278466050,QasimRashid: Black people have more reason than anyone to distrust vaccines—yet are the most active in getting the COVID vaccine to end…,1233107892602957825,deOrygun,Orygun,2545,69528,,False,False,39280,,,82,0,0.5083333333333333,0.17500000000000002,positive
2021-03-12 00:06:23,1370164229265883143,Mcknife1952: Biden will direct states to make all adults eligible for Covid vaccine by May 1 ,956257160,notrealdemocrat,"Azatlanta, New Mexico",2240,26188,,False,False,254638,,,1,0,0.4,0.1,positive
2021-03-12 00:06:23,1370164229257433094,Scientist behind COVID-19 vaccine discusses drug development  via utswnews,81491003,kshewitt,Michigan,599,146,,False,False,3567,,,0,0,0.7,-0.4,negative
2021-03-12 00:06:23,1370164228439609344,"theSNP: 💉 Over 1,825,800 people in Scotland have now received a first dose of the COVID vaccine.

🏴󠁧󠁢󠁳󠁣󠁴󠁿  That's over a third of Scotl…",1318605429476380674,SteveTait16,,967,5267,,False,False,6483,,,76,0,0.16666666666666666,0.125,positive
2021-03-12 00:06:23,1370164228301148163,"flumffle: 3_resurection AndRealisation LynnBrittney2 ""Covid vaccines"" are going to wipe out your immune system for ever.

This ""vacc…",1323561282214178816,jimmy31922581,,84,809,,False,False,9217,,,1,0,0.0,0.0,neutral
2021-03-12 00:06:22,1370164227235713024,"BigBadDenis: BREAKING Australia won't halt AstraZeneca rollout despite concern in Europe.

PeterDutton_MP auspol astrazenecavaccine…",833633011526545409,Kazzarina40,,29,3039,,False,False,1762,,,5,0,0.0,0.0,neutral
2021-03-12 00:06:22,1370164225885233153,NBCNews: NEW: Novavax reports that its experimental Covid-19 vaccine is more than 96% effective in preventing mild and severe illness.…,154433522,sexygirl798,,3693,742333,,False,False,607658,,,83,0,0.5309090909090909,0.3339393939393939,positive
2021-03-12 00:06:22,1370164225264345089,BlackKnight10k: 51 days until every American adult is eligible for the covid vaccine. Light at the end of the tunnel.,27279394,mvf427,"Boulder, CO",2517,313977,,True,False,31570,,,52,0,0.3333333333333333,0.16666666666666666,positive
2021-03-12 00:06:22,1370164224756834308,"Public_Citizen: 9 out of 10 people in poor countries won't have access to a COVID vaccine next year. 

Meanwhile, rich countries have h…",2569669685,bigdchval,,92,29656,,True,False,7669,,,266,0,0.45,-0.00833333333333334,negative
2021-03-12 00:06:22,1370164224077479941,"ABC: Pfizer's vaccine is successful in preventing not only symptomatic COVID-19, but also asymptomatic disease according to new real-wo…",25896925,LindaJSajan,New York,3902,3461,,False,False,12656,,,1769,0,0.8015151515151514,0.29545454545454547,positive
2021-03-12 00:06:22,1370164223905513475,UKevan27 KySportsRadio People over 16 can take Pfizer. There’s a decent subset of high schoolers we can vaccinate.,36056136,LauraMichelle39,,66,4059,,False,False,632,,,0,1,0.6033333333333333,0.16333333333333333,positive
2021-03-12 00:06:22,1370164223771295746,"POTUS: One in four adults in the U.S. has received their first COVID-19 vaccine — and we’re now leading the world in vaccinations.

Tha…",707341058393415682,MstrKnowItAll,Earth,26415,159844,,False,False,76502,,,16328,0,0.3333333333333333,0.25,positive
2021-03-12 00:06:21,1370164223586807808,"CDCgov: If you get a COVID19 vaccine, wait at least 14 days before getting any other vaccine, including those for flu or shingles. If…",22662094,PeriwinkleinOK,Oklahoma,1634,85869,,False,False,53508,,,363,0,0.3875,-0.2125,negative
2021-03-12 00:06:21,1370164221523025921,"nationalpost: Denmark, Norway and Iceland suspend AstraZeneca COVID shots after blood clot reports ",506672228,TheCJWest,Canada,466,13432,,False,False,14792,,,80,0,0.0,0.0,neutral
2021-03-12 00:06:21,1370164221221208069,"USATODAY: Biden will direct states to make all adults eligible for COVID-19 vaccine by May 1 during prime-time speech, administration o…",17539413,Niketa,"Atlanta, GA",16416,20401,,True,False,27183,,,46,0,0.4,0.1,positive
2021-03-12 00:06:21,1370164221053440000,"NewsHour: NEW: President Biden will direct states and territories to make all U.S. adults eligible for a COVID-19 vaccine by May 1. 

…",1241465019595984897,Because_really,"Earth, ",300,1001,,False,False,2145,,,200,0,0.42727272727272725,0.11818181818181818,positive
2021-03-12 00:06:21,1370164220617129988,"""Exclusive: YouTube removed 30,000 videos with COVID misinformation"" here:  
To read it on the web, tap here: ",819204740919611392,Terig1014,The PNW,12709,28084,,False,False,20949,,,0,2,0.0,0.0,neutral
2021-03-12 00:06:20,1370164219124064262,papegotsmoked: Maybe if I called myself covid-19 vaccine these bitches would line up to get me ,2885573874,alfredo_tarski,"Baltimore, MD",580,53990,,True,False,33824,,,7,0,0.0,0.0,neutral
2021-03-12 00:06:20,1370164219023360013,danieteebee: It’s completely predictably American that the brand of COVID vaccine you have access to has now become a class signifier,39881337,Powellrebecca3,"Universal City, TX",1837,91726,,True,False,60985,,,10836,0,0.0,0.0,neutral
2021-03-12 00:06:20,1370164218675273728,MSNBC: BREAKING: President Biden is expected to call for all U.S. adults to be eligible to receive the vaccine no later than May 1; wil…,72731772,suzotchka67,"Memphis, TN",225,25030,,False,False,69908,,,54,0,0.2,-0.05,negative
2021-03-12 00:06:20,1370164218100596737,"CDCgov: If you get a COVID19 vaccine, wait at least 14 days before getting any other vaccine, including those for flu or shingles. If…",2796491960,HealthHoco,"120 E. Mulberry St, Kokomo, IN",505,2549,,True,False,5484,,,363,0,0.3875,-0.2125,negative
2021-03-12 00:06:20,1370164217995784194,danieteebee: It’s completely predictably American that the brand of COVID vaccine you have access to has now become a class signifier,865413059526901760,_Rishhhhh,"Cincinnati, OH",559,122655,,True,False,63596,,,10836,0,0.0,0.0,neutral
2021-03-12 00:06:20,1370164216636833792,KrisGoldsmith85: Yesterday (Wednesday) I went to DeptVetAffairs website and signed up for “more info” about when I could receive the C…,927954272,loocygoose,Land of the Kickapoo & Myaamia,199,81114,,True,False,4055,,,191,0,0.5,0.5,positive
2021-03-12 00:06:20,1370164216053764103,"So AstraZeneca is being banned by European countries due to death and fatal blood clots.. yet our government said we didn't get the same batch
L M F A Fxxxxx O! ",522645644,KekeThaCutiee,"Nassau, Bahamas",294,4758,,True,False,23942,,,0,3,0.16666666666666666,-0.041666666666666664,negative
2021-03-12 00:06:20,1370164215831527425,danieteebee: It’s completely predictably American that the brand of COVID vaccine you have access to has now become a class signifier,3462792623,sanaahours,,1853,408766,,True,False,224391,,,10836,0,0.0,0.0,neutral
2021-03-12 00:06:20,1370164215332360195,"Zamfara Receives 55,920 Doses Of AstraZeneca Vaccines – Newspot ",630437817,NewsDeyNigeria,Nigeria,1503,148,,True,False,87334,,,0,0,0.0,0.0,neutral
2021-03-12 00:06:19,1370164215017844738,"NaomiOhReally BrigidLaffan August 2020...
The European Commission put up a €336 million down payment to secure its first 300 million doses of AstraZeneca and the University of Oxford.
The newly unveiled down payment will help fund development and liability costs on AstraZeneca.
",1095364055353704449,paulo_laranjo,European Union,93,760,,False,False,1225,,,0,2,0.32760942760942763,0.07920875420875421,positive
2021-03-12 00:06:19,1370164213591707648,"AbhishBanerj: OECD projects India's economy to grow at 12.6% in FY22.

IMF's Gita Gopinath talks of how India leads in Covid response.…",121386628,shalabhrocks,"Michigan, USA",280,68588,,True,False,28966,,,43,0,0.0,0.0,neutral
2021-03-12 00:06:19,1370164213398708227,joshtpm: Biden Set To Announce All Adults Eligible For COVID-19 Vaccine By May 1  via TPM,8108292,jackbrewster,"Olympia, WA",529,41020,,True,False,79530,,,53,0,0.0,0.0,neutral
2021-03-12 00:06:19,1370164213054799873,STForeignDesk: Romania pauses use of AstraZeneca Covid-19 vaccine batch as Italy probes deaths ,91043579,Miss_kaew,134340,6117,4215,,True,False,85093,,,6,0,0.0,0.0,neutral
2021-03-12 00:06:19,1370164212773892098,"livelovenofear: How many vaccine deaths until they stop saying there is no link?

",1305954009023479808,SteveZodiac6,"Sector 25, Gab and Telegram. ",1779,43007,,False,False,21868,,,142,0,0.5,0.5,positive
2021-03-12 00:06:19,1370164212526428164,HighWireTalk: The Italian Medicines Agency (AIFA) Thursday banned nationwide the use of a batch of the AstraZeneca COVID-19 vaccine due…,79789868,monis1013,Denver,573,33557,,False,False,24129,,,434,0,0.0,0.0,neutral
2021-03-12 00:06:19,1370164212484485121,"Wilnerness charlesnorthwe1 Not entirely correct, Mike. Yellow fever vaccine and seniors being at higher risk for some rare but debilitating/life threatening adverse effects.
That said, Charles, the COVID vaccine was 15 years in the making. It's literally the SARS vaccine that was never needed.",132194606,tyronemund,"Toronto, Ontario",1038,43420,,False,False,82240,,,0,3,0.50625,0.1375,positive
2021-03-12 00:06:19,1370164212031500288,"andykupf: A freedom we didn’t fully appreciate until the year of Covid happened

To gather with colleagues, friends &amp; family

A human t…",1066812489147604993,JamesrossrJames,,29313,102139,,False,False,87320,,,76,0,0.1,0.0,neutral
2021-03-12 00:06:18,1370164210836078593,"CNN: In his address tonight, President Biden will announce he is directing states to open coronavirus vaccine eligibility to all adults…",22186723,JoeBeOne,"ΔxΔp ≥ ħ/2 (~DC, USA)",7766,76243,,True,False,40439,,,99,0,0.5,0.0,neutral
2021-03-12 00:06:18,1370164209384894465,"I just posted ""Use of cbd cream to reduce covid-19 vaccine injection site reaction"" on Reddit

",1166006019429847041,FremontCBD,510-797-2774,48,66,,False,False,499,,,1,1,0.0,0.0,neutral
2021-03-12 00:06:18,1370164207560310791,mark_toshner: I have tweeted about likely over-reporting of side effects of vaccines extensively in the past but will have another go a…,65638864,andrewsbowie,"Cambridge, UK",1327,187597,,True,False,61669,,,243,0,0.5277777777777778,-0.08333333333333333,negative
2021-03-12 00:06:17,1370164206402727942,HuffPostPol: BREAKING: President Joe Biden will direct all states to make every adult in the nation eligible for a COVID-19 vaccine no…,986661411739897856,vampfan30,The HellSouth,16,4284,,False,False,4317,,,150,0,0.35,0.1,positive
2021-03-12 00:06:17,1370164205769347072,"LincolnsBible: My god... I cannot imagine how wretched the vaccine and Covid infection situation in America would be right now, if Jare…",761598347341737984,Leslie17Debbie,USA,12328,543237,,True,False,295957,,,609,0,0.5357142857142857,0.2857142857142857,positive
2021-03-12 00:06:17,1370164203122794496,"DrTeckKhong: Be alert to strokes, transient ischaemic attacks, coronary events and other vascular incidents in the short and intermedia…",488467524,LindaMCameron,UK and The Netherlands ,422,17575,,False,False,20204,,,506,0,0.3375,-0.0625,negative
2021-03-12 00:06:16,1370164201570861058,christufton: Oxford-AstraZeneca: EU regulator says 'no indication' vaccine linked to blood clots ,68373649,thelaymansdr,Jamaica,1785,39833,,True,False,44821,,,168,0,0.0,0.0,neutral
2021-03-12 00:06:16,1370164200694190081,Y’all sorry now huh guineapig trial  AstraZeneca,1229907320894783491,Gold193556488,,0,134,,False,False,28,,,0,0,1.0,-0.5,negative
2021-03-12 00:06:16,1370164200266375168,msvespa: All adults eligible for covid vaccine May 1st!,767231179934150656,tweeterfeet111,,3850,23541,,False,False,129509,,,10,0,0.0,0.0,neutral
2021-03-12 00:06:16,1370164200144707585,DeanParise: Italy bans batch of  AstraZeneca vaccine as navy officer dies after taking jab ,425580734,jurylady5,Southern hemisphere,15938,22193,,False,False,1759476,,,70,0,0.0,0.0,neutral
2021-03-12 00:06:16,1370164199893180423,DailyMailUK: Ex-health secretary Jeremy Hunt reveals he has tested positive for Covid just a WEEK after getting vaccine ,3087448180,janet_cutts, Dorset UK ,4768,223542,,False,False,206242,,,23,0,0.5454545454545454,0.22727272727272727,positive
2021-03-12 00:06:16,1370164199834419201,"""Black Americans and women in Travis County are significantly less likely to say they will definitely get vaccinated against COVID-19."" via KUT 

",18739107,TPRNews,"San Antonio, TX",16356,1934,,True,False,32390,,,0,1,0.5,-0.08333333333333333,negative
2021-03-12 00:06:15,1370164198127202305,NBCNews: BREAKING: President Biden is expected to call for all U.S. adults to be eligible to receive the vaccine no later than May 1; w…,781303614560100352,ceciliaannh,,570,85928,,True,False,318824,,,288,0,0.2,-0.05,negative
2021-03-12 00:06:15,1370164197766672385,EricMMatheny: Are we going to talk about the healthy 39 year old woman from Utah who got her second dose of the Moderna vaccine and the…,1100099870579453955,MamaBearCarries,Southern US. ,542,98255,,False,False,41748,,,2890,0,0.2333333333333333,0.19999999999999998,positive
2021-03-12 00:06:15,1370164196529250305,"ABC: Pfizer's vaccine is successful in preventing not only symptomatic COVID-19, but also asymptomatic disease according to new real-wo…",764655882,saxtoncharles10,"Brisbane, Queensland",141,32569,,False,False,6998,,,1769,0,0.8015151515151514,0.29545454545454547,positive
2021-03-12 00:06:15,1370164195849818113,JoeInSno Ted83521655 Pfredp FoxNews So how did Biden have anything to do with Pfizer vaccine since he wasn’t even in office when the vaccine came out? Please educate me again,1313230072896278530,DebJ10179938,,2,130,,False,False,166,,,0,0,0.0,0.0,neutral
2021-03-12 00:06:15,1370164195598143489,"TIME: COVID-19 cases are rising in Europe, and the vaccine rollout is lagging. How did it all go so badly wrong? ",321691813,skatuu,,7910,3064,,False,False,29946,,,39,0,0.9,-0.5,negative
2021-03-12 00:06:15,1370164194729988099,danieteebee: It’s completely predictably American that the brand of COVID vaccine you have access to has now become a class signifier,808902260306624512,bombissue,"Brooklyn, NY",720,94086,,True,False,18066,,,10836,0,0.0,0.0,neutral
2021-03-12 00:06:14,1370164193400348672,"SpacTiger: Biden to direct states to make all adults eligible for COVID vaccines by May 1, official says

",23551747,CanIBeRell,My-T-Sharp Barbershop / HTX,701,34607,,True,False,190822,,,4,0,0.4,0.1,positive
2021-03-12 00:06:14,1370164192355885059,MSNBC: NEW: Novavax reports that its experimental Covid-19 vaccine is more than 96% effective in preventing mild and severe illness. ht…,1313883675235237893,mkwtb1,PNW,9,3959,,False,False,763,,,53,0,0.5309090909090909,0.3339393939393939,positive
2021-03-12 00:06:14,1370164191835926530,Reuters_Health: Pfizer vaccine production on the rise as pandemic hits one-year mark​ ,73118798,padrealex,,941,21296,,False,False,69950,,,2,0,0.0,0.0,neutral
2021-03-12 00:06:14,1370164191420628992,"POTUS: One in four adults in the U.S. has received their first COVID-19 vaccine — and we’re now leading the world in vaccinations.

Tha…",547184768,RedHotDawn76,"Austin, TX",270,71332,,True,False,47481,,,16328,0,0.3333333333333333,0.25,positive
2021-03-12 00:06:14,1370164190791499779,"POTUS: One in four adults in the U.S. has received their first COVID-19 vaccine — and we’re now leading the world in vaccinations.

Tha…",18734405,janwcarlisle,"Cambridge, MA",230,4495,,False,False,1207,,,16328,0,0.3333333333333333,0.25,positive
2021-03-12 00:06:13,1370164189889708032,"Biden will use his first prime-time address to announce that he is directing states to make all American adults eligible for a coronavirus vaccine no later than May 1.
 ",19032473,9NEWS,"Denver, Colorado",452243,12119,,True,True,491357,,,1,25,0.1111111111111111,0.08333333333333333,positive
2021-03-12 00:06:13,1370164188740526084,"ForexLive: Let me get this straight, Denmark has sent AstraZeneca into  14-day isolation, right?  ",4785728440,pitsolu,"Kajiado, Kenya",382,14189,,True,False,23194,,,4,0,0.46785714285714286,0.24285714285714285,positive
2021-03-12 00:06:13,1370164186689368064,"eugenegu COVID-19 vaccine doses purchased with U.S. taxpayer dollars will be given to everyone at no cost. If you have insurance, vaccine providers may bill your insurance an administrative fee for administering, the vaccine. No one will be denied a vaccine if you can’t afford to pay.",2468610884,shemichele1,Utah,1209,55959,,False,False,11648,,,0,2,0.0,0.0,neutral
2021-03-12 00:06:12,1370164182331625476,"ABC: Pfizer's vaccine is successful in preventing not only symptomatic COVID-19, but also asymptomatic disease according to new real-wo…",544647124,Arielekaditis,Tel Aviv ,2330,8798,,True,False,10313,,,1769,0,0.8015151515151514,0.29545454545454547,positive
2021-03-12 00:06:11,1370164181115269124,Cousin is an EMT/firefighter. Goes to a rock concert. It’s *fine* tho bc HE has a vaccine &amp; wearing masks. Not distanced. Not everyone vaccinated. (NOT all masked!) Virus lives in the nose and he could potentially spread it to pts. Our grandmother just died from Covid. 🤬🤬🤬,248508965,Careyless,Kansas City,556,68216,,True,False,23154,,,0,0,0.75,0.2604166666666667,positive
2021-03-12 00:06:11,1370164180624441344,sahilkapur: Big news: White House says it will direct states and localities to make every American eligible for a Covid-19 vaccine **no…,148961421,keepupwithkeith,,646,4325,,False,False,8391,,,347,0,0.125,0.025,positive
2021-03-12 00:06:11,1370164179622002688,HugsHealth RepMattGaetz Neither the Pfizer vaccine nor the Moderna vaccine were in any way associated with Trump's Operation Warp Speed program. It took President Biden's implementation of the Defense Production Act to get Johnson &amp; Johnson and Merck to work together to manufacture the J&amp;J vaccine.,2381603959,Ever_Persisting,Everywhere else.,4157,29650,,False,False,45135,,,0,2,0.0,0.0,neutral
2021-03-12 00:06:10,1370164177453600768,NBCNews: BREAKING: President Biden is expected to call for all U.S. adults to be eligible to receive the vaccine no later than May 1; w…,873032861841883137,kr_schneider,DC,192,647,,True,False,3595,,,288,0,0.2,-0.05,negative
2021-03-12 00:06:10,1370164177105383424,tegangeorge: VACCINE: Questions are hard to hear but PM quizzed over Government's aim to have entire Australian population vaccinated a…,588732151,Qldaah,Tanah Merah. Yuggera country. ,18075,20786,,True,False,422457,,,53,0,0.38888888888888884,-0.09722222222222222,negative
2021-03-12 00:06:10,1370164174177845256,Netanyahu projects win in Israeli election despite cancellation of UAE trip and Pfizer CEO photo-op ,1257741728465006594,pathofex,,359,46,,False,False,172873,,,0,0,0.4,0.8,positive
2021-03-12 00:06:10,1370164173498384389,"ABC: Pfizer's vaccine is successful in preventing not only symptomatic COVID-19, but also asymptomatic disease according to new real-wo…",39140545,BmoreLikeNita,Ennui Blvd.,5548,5897,,True,False,335746,,,1769,0,0.8015151515151514,0.29545454545454547,positive
2021-03-12 00:06:09,1370164171854188550,LasVegasLocally: Casino and hospitality workers are eligible to get the covid-19 vaccine in Nevada. Finally.,1515235069,ReneeB_75,DMV,1846,246180,,True,False,264254,,,228,0,1.0,0.0,neutral
2021-03-12 00:06:08,1370164166934335488,"KThomasDC: News: In his speech tonight, President Biden will say he’s directing states to make all American adults eligible to sign up…",788018329,misscherryjones,"Newport, RI",3186,90812,,False,False,160683,,,19,0,0.0,0.0,neutral
