created,id_str,text,user_id,screen_name,location,followers_count,user_favourites_count,time_zone,geo_enabled,verified,status_count,geo,coords,retweet_count,tweet_favourite_count,Subjectivity,Polarity,Sentiment
2021-03-12 00:05:02,1370163891750137856,"Rahamatu Yar'adua, Niger State Commissioner looks scared as she receives COVID-19 Vaccine (Photos) - ",439838598,DEagleOnline,Nigeria,22953,247,,True,False,263278,,,0,0,0.0,0.0,neutral
2021-03-12 00:05:02,1370163891498549250,"Join our friends at naamnw for a special virtual event this Saturday. The program will focus on COVID-19 vaccines, concerns of the Black community, and so much more. 
⁠
The event is free and open to the public. RSVP and submit your questions here: ",14815685,PacSci,Seattle,23464,5806,,True,True,14729,,,0,1,0.4785714285714286,0.18174603174603177,positive
2021-03-12 00:05:02,1370163891402108930,"sunandavashisht: The World Needs Syringes. This Indian businessman jumped in to Make 5,900 Per Minute. Along with vaccine capital of th…",109487635,vjprakashhh,Kanpur,51,7255,,True,False,2073,,,216,0,0.0,0.0,neutral
2021-03-12 00:05:02,1370163889724358659,CNNPolitics: NEW: President Biden will use his first evening address to the nation to direct all states to open coronavirus vaccine eli…,2460315265,linzeyhoehan,"Simi Valley, CA",1344,110002,,True,False,373829,,,60,0,0.421969696969697,0.12159090909090908,positive
2021-03-12 00:05:02,1370163888528887810,"Rahamatu Yar'adua, Niger State Commissioner looks scared as she receives COVID-19 Vaccine (Photos) - ",348371112,oladotun1969,"Lagos, Nigeria",594,3,,True,False,183102,,,0,0,0.0,0.0,neutral
2021-03-12 00:05:01,1370163887589457921,"SheriffClarke: If Trump was President today, LYING LIB MEDIA would be leading this as ""Breaking News"" and saying he has blood on his ha…",830796515715272704,Axmister,"Lake Worth, FL",118,33133,,False,False,7679,,,151,0,0.0,0.0,neutral
2021-03-12 00:05:01,1370163885366374400,MSNBC: BREAKING: President Biden is expected to call for all U.S. adults to be eligible to receive the vaccine no later than May 1; wil…,1354587999510532099,colleenprouty1,"Oregon, USA",122,1129,,False,False,7629,,,54,0,0.2,-0.05,negative
2021-03-12 00:05:01,1370163885211271169,NBCNews: NEW: Novavax reports that its experimental Covid-19 vaccine is more than 96% effective in preventing mild and severe illness.…,547155318,AuntSophie1,,2152,552654,,False,False,518978,,,83,0,0.5309090909090909,0.3339393939393939,positive
2021-03-12 00:05:01,1370163884955406336,"I had my first Moderna shot 8 days ago, had some general symptoms but nothing out of the ordinary until today, the injection site is red and itchy, any one else experience this?",922830003393396737,ShariOwl,"Orlando, Florida",6104,47330,,False,False,36794,,,0,0,0.3333333333333333,0.012500000000000011,positive
2021-03-12 00:05:01,1370163884758233088,"thedaysarelong: Denmark, Norway and Iceland suspend AstraZeneca COVID shots after blood clot reports 

Lucky scottythequeuejumper was…",1881185678,sofistic8ed,South Australia,298,13965,,True,False,13712,,,5,0,0.8333333333333334,0.3333333333333333,positive
2021-03-12 00:05:00,1370163883608924162,"Blog_Mickey: Biden Administration to Direct States to Make COVID-19 Vaccine Available to All Adults by May 1st 
",49471321,mosully,"California, USA",1054,115279,,False,False,107181,,,24,0,0.4,0.25,positive
2021-03-12 00:05:00,1370163883160215554,brianrayguitar And Pfizer funded the vaccine on their own!  They purposely CHOSE to not get sucked into any politically driven vortex.,60359310,CLPetrolati,"Carlsbad, California",51,9600,,False,False,3457,,,5,107,0.55,0.375,positive
2021-03-12 00:05:00,1370163881415348225,FACT: When Trump was tasked with accelerating the vaccine process he purchased an old Kodak factory in New York and had it fully outfitted and gave it to Pfizer to produce the millions of doses of the Covod-19 Vaccines delivered to America in RECORD TIME! THANK YOU DONALD TRUMP!,3280835720,johnsinthehouse,,55,1053,,False,False,955,,,0,1,0.32727272727272727,0.1565340909090909,positive
2021-03-12 00:05:00,1370163880782147586,RiverToSea48: calling all Palestinians and Palestine supporters 🗣🗣🗣 this letter to the editor was sent in response to a story WaPo ran…,865094388770320384,n3ckbrace,they/them minor 🇪🇬,2450,123061,,True,False,60348,,,37,0,0.0,0.0,neutral
2021-03-12 00:04:59,1370163878965960705,wbz: CVS To Offer COVID Vaccine At 34 Additional Massachusetts Locations ,1201146794,Ryan_Carter_98,Lemontown,261,10134,,True,False,4278,,,21,0,0.0,0.0,neutral
2021-03-12 00:04:59,1370163878844243968,MSNBC: BREAKING: President Biden is expected to call for all U.S. adults to be eligible to receive the vaccine no later than May 1; wil…,260915258,arieljadler,"San Diego, CA",186,51026,,False,False,1984,,,54,0,0.2,-0.05,negative
2021-03-12 00:04:59,1370163878206832646,sahilkapur: Big news: White House says it will direct states and localities to make every American eligible for a Covid-19 vaccine **no…,14445487,EvansDonnell,"Nashville, TN, USA",2342,164507,,True,False,166100,,,347,0,0.125,0.025,positive
2021-03-12 00:04:59,1370163877774778369,"richardsyrett: Denmark, Norway and Iceland suspend AstraZeneca COVID shots after blood clot reports | Article [AMP] | Reuters ",16213179,DennisCMcMahon,"burlington,vermont",635,364,,True,False,71402,,,6,0,0.0,0.0,neutral
2021-03-12 00:04:59,1370163877460201472,"COVID-19: Novavax vaccine highly effective in latest trial 

 ",734267109140660226,GulfHeadlines,"Dubai, United Arab Emirates",107,59,,False,False,9367,,,0,0,0.8500000000000001,0.55,positive
2021-03-12 00:04:59,1370163877137244163,BREAKING: President Biden is expected to call for all U.S. adults to be eligible to receive the vaccine no later than May 1; will announce that the U.S. could be on track to reach a sense of normalcy by Independence Day. ,14173315,NBCNews,"New York, NY",8391740,789,,True,True,295288,,,288,1578,0.2,-0.05,negative
2021-03-12 00:04:59,1370163877028237316,Maybe if I called myself covid-19 vaccine these bitches would line up to get me ,1317295050997571584,papegotsmoked,Baltimore,398,13541,,False,False,13169,,,7,13,0.0,0.0,neutral
2021-03-12 00:04:59,1370163876067614724,PSIglobalunion: A few govts still haven't approved the WTO waiver proposal on vaccine patents: they are slowing down production &amp; prol…,110375644,samcossar,France,1289,92,,False,False,4313,,,53,0,0.19444444444444448,-0.1777777777777778,negative
2021-03-12 00:04:58,1370163874628993025,"Reuters: Denmark has temporarily suspended AstraZeneca COVID-19 vaccine shots after reports of cases of blood clots forming, Danish aut…",6531182,Sunitha,the seventh heaven,825,17158,,True,False,176657,,,370,0,0.0,0.0,neutral
2021-03-12 00:04:58,1370163871818919937,MSNBC: BREAKING: President Biden is expected to call for all U.S. adults to be eligible to receive the vaccine no later than May 1; wil…,931112503,alexisy95,"Salem, MA",1889,114551,,True,False,173189,,,54,0,0.2,-0.05,negative
2021-03-12 00:04:57,1370163869251895300,disclosetv: JUST IN - Norway and Denmark suspend Oxford-AstraZeneca COVID19 vaccine rollout.,1000529617948676097,SilverK190469,"West Midlands, England",217,28103,,False,False,10921,,,2579,0,0.0,0.0,neutral
2021-03-12 00:04:56,1370163866789761026,"NBPSDHealthUnit: News Release: COVID-19 Vaccine Bookings for Individuals Born in 1941 or Before Launches Monday, March 15, 2021. Read m…",1290716258711646209,HospiceWPS,Parry Sound,55,29,,True,False,151,,,4,0,0.0,0.0,neutral
2021-03-12 00:04:56,1370163864789159936,carletonjtysick Thats why JT got it as it was available in the dumpster behind Astrazeneca,994943975306936320,KenLloy85997776,"Edmonton,  Alberta",780,45337,,False,False,48732,,,0,4,0.55,0.0,neutral
2021-03-12 00:04:56,1370163863992238081,mariamainmo: Girls don't want boys. They want the covid vaccine and a nice apartment,2528549738,SABRlNAVERSACE,,1409,51918,,True,False,19966,,,25125,0,1.0,0.6,positive
2021-03-12 00:04:55,1370163862876602368,guardian: Denmark pauses AstraZeneca vaccines to investigate blood clot reports ,1165353092491173894,kathypriestley5,IRELAND,524,22256,,False,False,14633,,,81,0,0.0,0.0,neutral
2021-03-12 00:04:55,1370163861647659010,"dyannleroy: This just broke on Ari Melber's show: As of May 1, every adult in the country is eligible for the Covid vaccine. The inform…",3937263083,FrackHazReveal,"New England, USA",3834,155461,,False,False,442965,,,21,0,0.3,0.1,positive
2021-03-12 00:04:54,1370163858200014849,BradBeauregardJ: President Jimmy Carter looks so happy to get his covid vaccine...I love this ❤️💉 ,794731486259908609,MarchettaCindy,United States,491,126445,,True,False,115900,,,66,0,0.8,0.65,positive
2021-03-12 00:04:54,1370163858078371843,"kayleighmcenany seanhannity ALL NARCISSISTIC Trump does is  take credit &amp; avoid
accountability 
Pfizer told him to Fu*k off &amp; his Warp Speed Distrib  plan must be lost with his new heath plan that you also said several times it was coming in 2 weeks! All Trump cared about was lying about a fair election",1325118699578200067,ann_savickas,,58,7151,,False,False,4275,,,0,1,0.4515151515151515,0.27878787878787875,positive
2021-03-12 00:04:54,1370163857252040705,"emmapaling: I'm proud of the work I did, especially at Queen's Park and on COVID-19 in long-term care. BuzzFeed has taken our homepage…",75087004,margo94,Canada,3163,21580,,True,False,386251,,,53,0,1.0,0.4,positive
2021-03-12 00:04:53,1370163853510676481,"LupusNE: When the vaccine will be available for people with lupus, guidance on delaying medications before vaccination, and more.  htt…",797924312560914433,hand_to_eye,Nowhere,571,55118,,False,False,17550,,,2,0,0.45,0.45,positive
2021-03-12 00:04:53,1370163851593797634,ZekeEmanuel: New paper finds: just one dose of Pfizer and Moderna vaccines reduce asymptomatic infection and lowers number of viruses p…,1029198368789024768,Gaia_Rising,Oz,494,94931,,False,False,129500,,,75,0,0.45454545454545453,0.13636363636363635,positive
2021-03-12 00:04:52,1370163848955752454,"I hope everyone remembers when they’re getting the COVID-19 (often referred to as the China Virus) Vaccine, that if I wasn’t President, you wouldn’t be getting that beautiful “shot” for 5 years, at best, and probably wouldn’t be getting it at all. I hope everyone remembers!",1049363165585260544,gang_cum_on_ig,he/him,102,33234,,True,False,11594,,,2,8,0.65,0.925,positive
2021-03-12 00:04:52,1370163847194050561,"aroseblush: Today, the wonderful nurse who attended me, told me that they will give 200 shots today. Doesn't sound like that much. I wi…",860610470939697153,Washerein17,"Colorado, US",2245,293823,,False,False,178341,,,9,0,0.5333333333333333,0.5333333333333333,positive
2021-03-12 00:04:52,1370163846363508739,mariamainmo: Girls don't want boys. They want the covid vaccine and a nice apartment,876998083925557248,meaganfaye_,"Vancouver, WA",88,12469,,False,False,4201,,,25125,0,1.0,0.6,positive
2021-03-12 00:04:51,1370163844975259649,Forbes: More states are moving toward opening the Covid-19 vaccine up to the general public  ,924427140468109312,OmkarKumawat2,India,787,25834,,False,False,51595,,,5,0,0.35555555555555557,0.18333333333333335,positive
2021-03-12 00:04:50,1370163841930170368,MichelleObama I got mine! Moderna! 2 of them!,37980553,Seathls,in the OC,52,17745,,True,False,446,,,0,0,0.0,0.0,neutral
2021-03-12 00:04:50,1370163841435308039,"brithume: .⁦MartyMakary⁩ making sense on Covid again. We should be listening to him these days. The sainted Dr. Fauci, not so much.  h…",1242339018832056321,SandraKathleen4,,401,43654,,False,False,51092,,,216,0,0.2,0.2,positive
2021-03-12 00:04:49,1370163835856900096,"RhondaBarket: Biden to direct states to make all adults eligible for COVID vaccine by May 1, official says  via…",1005850936680636417,SusanDa40941714,,944,153855,,False,False,64538,,,5,0,0.4,0.1,positive
2021-03-12 00:04:49,1370163833830993922,"Yes, please! And thank you.

Biden to direct states to make all adults eligible for COVID vaccines by May 1, official says ",1419248815,VladaKnowlton,Seattle,1081,13291,,False,False,9369,,,0,1,0.4,0.1,positive
2021-03-12 00:04:48,1370163833461936129,Love to read it ,55339871,LovelyAssLupe,Hood to the Red Carpet,2742,1748,,True,False,302255,,,0,3,0.6,0.5,positive
2021-03-12 00:04:48,1370163832253865985,Is posting on social media that you got the covid vaccine mandatory...I’m confused,1107392403336503296,KurtCodeine8,,7,321,,False,False,983,,,0,1,0.3833333333333333,-0.18333333333333335,negative
2021-03-12 00:04:48,1370163832212103170,"ABC: Pfizer's vaccine is successful in preventing not only symptomatic COVID-19, but also asymptomatic disease according to new real-wo…",1260534053264150533,CoronaWave2,Ljubljana,531,15740,,False,False,951,,,1769,0,0.8015151515151514,0.29545454545454547,positive
2021-03-12 00:04:48,1370163832186937357,"KizzyPhD: Honored to be the winner the “NextGen Award”, bestowed by The Franklin Institute, an organization that has “predicted” &amp; awar…",252621417,neuenegro,"Eagleton, Indiana",421,37269,,True,False,39818,,,493,0,0.0,0.0,neutral
2021-03-12 00:04:48,1370163831633231879,ChrisEhrick ASlavitt Pfizer only one authorized for 16+ i think,466828424,wryancraig,SAT-AUS-HOU-DEN-SEA-LAX-ᏣᎳᎩ,793,20398,,True,False,391,,,0,2,1.0,0.0,neutral
2021-03-12 00:04:48,1370163829997334528,indiatvnews: PM Modi's mother receives first dose of COVID-19 vaccine | via IndiaTVNews ,1249656584185229319,MPYS_UPC,,657,1879,,True,False,2184,,,11,0,0.3333333333333333,0.25,positive
2021-03-12 00:04:48,1370163829590663169,"sophie_seid RepAshleyHinson Different vaccine distro then whats in Covid relief bill she voted against?

Death tax only apllies to Ind w assets over 11.5 mil, 22 mil for couples.   How much does avg IA farmer make?  70-90k?

Lobby ban has been kicked around for yrs what diff about this?

IAGOP IowaGOP",1254589817205243904,darklabaudio,"Chicago, IL",71,24969,,False,False,4122,,,0,0,0.6,0.06666666666666667,positive
2021-03-12 00:04:48,1370163829523513353,"BostonGlobe: Vaccine passports are familiar to world travelers who carry yellow fever immunization cards.

In the US, people who’ve got…",125632328,Sylvaners,"Joliet, IL",10602,170480,,True,False,316050,,,51,0,0.25,0.1875,positive
2021-03-12 00:04:47,1370163828885835780,DavidBe53174057: The Federal Government should hand the Covid Vaccine roll-out to the states. The Feds are simply not competent enough.,1185402087137398784,IthearSei,"Humpty Doo, Northern Territory",446,26451,,False,False,34568,,,79,0,0.5833333333333333,-0.125,negative
2021-03-12 00:04:47,1370163827954778112,"GMA: For one grandmother who recently received her second dose of the COVID-19 vaccine, it allowed her finally to reunite with her gran…",50799343,ckleintv,"Las Vegas, NV",13893,950,,True,False,1747,,,14,0,0.4166666666666667,0.0,neutral
2021-03-12 00:04:47,1370163826688208897,"politico: President Biden will order states to make coronavirus vaccines available to all American adults by May 1, in an effort to acc…",1218605146462216193,KatTompkins,,1226,162022,,False,False,205118,,,68,0,0.2,0.2,positive
2021-03-12 00:04:47,1370163826633625600,"ABC: Pfizer's vaccine is successful in preventing not only symptomatic COVID-19, but also asymptomatic disease according to new real-wo…",1268182650,BillPeters30,Berdansk  Ukraine/Richland WA,346,44022,,False,False,8150,,,1769,0,0.8015151515151514,0.29545454545454547,positive
2021-03-12 00:04:47,1370163825924657154,"ColeMillerTV: In addition to GovInslee announcing the state's move to Phase 3 beginning 3/22, President JoeBiden tonight will direct…",16086928,komonews,"Seattle, WA",439616,4364,,False,True,286904,,,6,0,0.0,0.0,neutral
2021-03-12 00:04:46,1370163822216933377,BREAKING: President Biden is expected to call for all U.S. adults to be eligible to receive the vaccine no later than May 1; will announce that the U.S. could be on track to reach a sense of normalcy by Independence Day. ,2836421,MSNBC,,4152793,824,,True,True,241164,,,54,280,0.2,-0.05,negative
2021-03-12 00:04:46,1370163822133149697,"BarackObama: Michelle and I got vaccinated against COVID-19 because we know it’s the best way to beat this pandemic, protect one anothe…",3317659546,Shawnee_Leath,"Richmond, Virginia",27793,166415,,False,False,40066,,,9849,0,0.3,1.0,positive
2021-03-12 00:04:45,1370163819738132482,"Justin knew. 

vaccine biden covid itsgonnabemay ",44389868,We_Are_SSD,Greendale Community College,409,5058,,False,False,7610,,,1,1,0.0,0.0,neutral
2021-03-12 00:04:45,1370163818924449793,"ObamaFoundation: “This vaccine means hope.” —BarackObama coming together with TheBushCenter, BillClinton, and CarterCenter.

The be…",49236051,sassiesuz,,124,35554,,False,False,24412,,,181,0,0.0,0.0,neutral
2021-03-12 00:04:44,1370163816256962560,"chipsandgist He did send the national guard. For example 
",306263929,Damocleansword,,2459,1617,,True,False,158635,,,0,0,0.0,0.0,neutral
2021-03-12 00:04:44,1370163816236003332,"MichelleObama: When you can get the COVID-19 vaccine, I hope you do—Barack and I are certainly glad we did. It’s our best shot at beati…",1099485578289135616,AlbertFlorian4,,80,50961,,False,False,35815,,,8090,0,0.65,0.75,positive
2021-03-12 00:04:44,1370163816173072388,"Got a letter that my Nana is now eligible for the Covid 19 vaccine, what a kick in the balls",788224505390989312,PrimordiaISoup,,126,64308,,True,False,56114,,,0,0,0.0,0.0,neutral
2021-03-12 00:04:44,1370163814696648713,"MichelleObama: When you can get the COVID-19 vaccine, I hope you do—Barack and I are certainly glad we did. It’s our best shot at beati…",878112861977018368,DarlaCincyGirl,"Virginia, USA",31,3169,,False,False,1170,,,8090,0,0.65,0.75,positive
2021-03-12 00:04:44,1370163814260473859,"POTUS: One in four adults in the U.S. has received their first COVID-19 vaccine — and we’re now leading the world in vaccinations.

Tha…",1352239273202868225,NatividadAmezq1,,0,37,,False,False,15,,,16328,0,0.3333333333333333,0.25,positive
2021-03-12 00:04:43,1370163812234625031,"LionInWinter44: Numerous reports of blood clots in Denmark, including a fatal case. Multiple European countries have suspended the Oxfo…",1127369304209420288,Sewist5,,6176,12278,,False,False,18086,,,47,0,0.16666666666666666,0.0,neutral
2021-03-12 00:04:43,1370163808531062785,sahilkapur: Big news: White House says it will direct states and localities to make every American eligible for a Covid-19 vaccine **no…,3193147750,ElizabethDynan,"Pennsylvania, USA",461,41070,,True,False,36751,,,347,0,0.125,0.025,positive
2021-03-12 00:04:42,1370163808271011843,danieteebee: It’s completely predictably American that the brand of COVID vaccine you have access to has now become a class signifier,1436143472,ithinkurcuuute,✊🏿,484,105269,,True,False,17730,,,10836,0,0.0,0.0,neutral
2021-03-12 00:04:42,1370163807020969986,ramornie: bruce_haigh And also doubts about the Astra Zeneca now with blood clotting problems.,3288075858,bruce_haigh,"Orange, New South Wales",9218,130510,,True,False,148972,,,4,0,0.0,0.0,neutral
2021-03-12 00:04:42,1370163806576504835,atrupar Good lord... what manufactured bullshit.  No one cares about whether or not Biden hold's press conferences.  We care that we get some  Covid relief and a vaccine.  I don't care if Biden goes 500 days without a press conferences.  He answers reporters' questions all the time,1259245328882110465,JMS52570594,,2908,47377,,False,False,15964,,,0,0,0.6000000000000001,0.7,positive
2021-03-12 00:04:42,1370163806073188354,"RichardStaff: Before Biden announced all adults are eligible for the COVID vaccine on May 1st, I hadn't seen so many people excited abo…",16101822,101singer,"Lower Manhattan, the (212).",974,90758,,False,False,130775,,,31,0,0.625,0.4375,positive
2021-03-12 00:04:42,1370163805704089607,sahilkapur: Big news: White House says it will direct states and localities to make every American eligible for a Covid-19 vaccine **no…,30595199,samy45,,1015,58065,,True,False,394662,,,347,0,0.125,0.025,positive
2021-03-12 00:04:41,1370163802981941251,Lmaooooo I love how we compliment men. John 3:16?? Pfizer??😂😂,40530509,PrettieJJ,RobynRihannaFenty'sHeart,1440,4151,,True,False,156019,,,0,0,0.6,0.5,positive
2021-03-12 00:04:41,1370163802981855234,"erichards24 RepCharlieCrist RepHastingsFL RepDWStweets USRepKCastor RepTedDeutch RepWilson RepLoisFrankel RepValDemings RepAlLawsonJr RepStephMurphy RepDarrenSoto COVID vaccine near me: Dr. B standby list texts about unused vaccines
",126945319,senraba,"Las Cruces, NM",3362,264700,,True,False,144765,,,3,12,0.4,0.1,positive
2021-03-12 00:04:41,1370163802906402817,"ChildrensHD: NEW RobertKennedyJr: In Oct 2019, shortly before the COVID outbreak, Gates + other powerful individuals began planning ho…",286973799,BoggyLuuuu,,805,9571,,True,False,31296,,,644,0,0.5323863636363636,0.07784090909090909,positive
2021-03-12 00:04:41,1370163802260578304,sahilkapur: Big news: White House says it will direct states and localities to make every American eligible for a Covid-19 vaccine **no…,27728409,BruceWoods,"Oshawa, Ontario, 🇨🇦",444,11810,,False,False,8543,,,347,0,0.125,0.025,positive
2021-03-12 00:04:41,1370163801337827332,duntalk: news outlets are really irresponsible with click bait headlines - there has been zero proof that the Astra Zeneca vaccine dire…,627097808,gunnerbeeks,Jamaica,1199,9393,,False,False,143545,,,68,0,0.2,0.2,positive
2021-03-12 00:04:40,1370163799525892096,"ABC: BREAKING: Pres. Biden is expected to direct states, tribes and territories to make all American adults eligible for a COVID-19 vac…",47699646,LyndenBlake,"Florida, USA",3874,45,,True,True,32051,,,96,0,0.26666666666666666,0.0,neutral
2021-03-12 00:04:40,1370163799211134977,spectatorindex: JUST IN: Norway has suspended use of the AstraZeneca coronavirus vaccine,756397765324865537,RuSoet118,"Melbourne, Victoria",162,24325,,True,False,19431,,,2582,0,0.0,0.0,neutral
2021-03-12 00:04:40,1370163798720577536,"MichelleObama: When you can get the COVID-19 vaccine, I hope you do—Barack and I are certainly glad we did. It’s our best shot at beati…",1291406957803380736,JessSwaggie,,10,4726,,False,False,1626,,,8090,0,0.65,0.75,positive
2021-03-12 00:04:40,1370163797797789697,NiacinPhD: Did you hear that Israel canceled the trip of the president of Pfizer to Israel because he refused to be vaccinated by his o…,2424588344,DIN7100,,92,3375,,False,False,6781,,,3,0,0.0,0.0,neutral
2021-03-12 00:04:40,1370163797432885248,"ABC: Pfizer's vaccine is successful in preventing not only symptomatic COVID-19, but also asymptomatic disease according to new real-wo…",90316283,sophiedurocher,"Montréal, Québec",50680,328,,True,False,30403,,,1769,0,0.8015151515151514,0.29545454545454547,positive
2021-03-12 00:04:40,1370163796594032640,"Pamacious: ""Kroger location in Virginia administered shots with empty syringes to multiple patients scheduled for a COVID-19 vaccine.""…",1350064255,magitek_x,Nashville TN,192,110180,,True,False,32302,,,3,0,0.25,-0.05,negative
2021-03-12 00:04:39,1370163793121177601,"THIS IS FUCKING AWESOME NEWS!! ⬇️
New evidence shows Pfizer vaccine's effectiveness against UK variant, 'silent' spread - From ABC News:

New evidence shows Pfizer vaccine's effectiveness against UK variant, 'silent' spread

",48036179,loreletti,,457,5888,,False,False,160505,,,0,0,0.42181818181818187,0.2545454545454545,positive
2021-03-12 00:04:39,1370163792441712644,mariamainmo: Girls don't want boys. They want the covid vaccine and a nice apartment,937941259649392641,khrnsa__,,83,41319,,True,False,49064,,,25125,0,1.0,0.6,positive
2021-03-12 00:04:38,1370163789547585538,DrEricDing: Cancer patients need 2nd dose—much less protected against COVID19 after only one dose of Pfizer vaccine. An early 2nd dose…,700400316555124736,CamiloGuezRodri,,530,13831,,False,False,54930,,,262,0,0.2733333333333333,-0.01333333333333333,negative
2021-03-12 00:04:37,1370163787081396225,"ABC: BREAKING: Pres. Biden is expected to direct states, tribes and territories to make all American adults eligible for a COVID-19 vac…",1313950724,PaulFromWMAR,,660,2991,,True,True,4705,,,96,0,0.26666666666666666,0.0,neutral
2021-03-12 00:04:37,1370163787072868352,MikeDelMoro: New: Pfizer says that real world data out of Israel shows its vaccine effectiveness is 97% in preventing symptomatic disea…,25584105,nihonmama,Citizen of the World,2827,50986,,False,False,141838,,,593,0,0.3772727272727273,0.16818181818181818,positive
2021-03-12 00:04:37,1370163786254929923,"GovInslee: In more good news, I am pleased that we will move to the next tier of eligibility earlier than we thought. On March 17, ever…",147806551,Aced00d,Seattle,1446,19166,,False,False,8134,,,147,0,0.52,0.33999999999999997,positive
2021-03-12 00:04:37,1370163784388542467,"AnnaVannaBoo: dcherring Yesterday, 8:28AM Pfizer 1 - I feel totally fine.
March 31  will be shot 2
Life looked a bit brighter this A…",1328983301378306049,ArtTist42941090,,46,4700,,False,False,10288,,,3,0,0.5,0.4166666666666667,positive
2021-03-12 00:04:36,1370163780731174919,"ChildrensHD: NEW RobertKennedyJr: In Oct 2019, shortly before the COVID outbreak, Gates + other powerful individuals began planning ho…",1159450910654906369,Kintsugi4u,Ireland,125,16074,,False,False,2121,,,644,0,0.5323863636363636,0.07784090909090909,positive
2021-03-12 00:04:36,1370163780341104640,"JogaBonito888 CarlaSpade Reactions published here. 

",1363926034534572034,PWaaaay,London,401,10000,,False,False,2733,,,0,2,0.0,0.0,neutral
2021-03-12 00:04:35,1370163778722074626,"RevJacquiLewis: And if you have *any* questions about the COVID vaccine, join us at 6:00 p.m. ET so you can ask doctors! Information is…",17816127,AustenLionheart,"St. Paul, MN",7903,9867,,True,True,12478,,,6,0,0.0,0.0,neutral
