created,id_str,text,user_id,screen_name,location,followers_count,user_favourites_count,time_zone,geo_enabled,verified,status_count,geo,coords,retweet_count,tweet_favourite_count,Subjectivity,Polarity,Sentiment
2021-03-11 23:25:36,1370153967494164484,"MichelleObama: When you can get the COVID-19 vaccine, I hope you do—Barack and I are certainly glad we did. It’s our best shot at beati…",791488275449950208,mwbluejem67,"Wyoming, USA",594,6281,,False,False,6895,,,8132,0,0.65,0.75,positive
2021-03-11 23:25:35,1370153962612080641,donkamion78: 12 Prominent scientists and doctors: Medical regulators should release bold figures of the numbers of people who have died…,1244384921847816206,sinclair3132,,161,1722,,False,False,504,,,191,0,0.5555555555555555,0.27777777777777773,positive
2021-03-11 23:25:35,1370153961244782596,"JerasIkehorn: RE: TRUMP CLAIMING CREDIT FOR THE VACCINES 
Pfizer, the first vaccine approved, was not a part of Operation Warp Speed.…",1293489950760075264,flushtrumpturds,"Iowa, USA",479,34298,,False,False,1913,,,1436,0,0.3333333333333333,0.25,positive
2021-03-11 23:25:35,1370153960477196290,jsolomonReports: Utah woman dies after taking second dose of COVID vaccine | Just The News ,1365926326633459713,Stixie73,,132,2812,,False,False,924,,,322,0,0.0,0.0,neutral
2021-03-11 23:25:33,1370153955372773380,"MichelleObama: When you can get the COVID-19 vaccine, I hope you do—Barack and I are certainly glad we did. It’s our best shot at beati…",1621754874,MarcMazeRemy414,,142,5348,,False,False,3152,,,8132,0,0.65,0.75,positive
2021-03-11 23:25:33,1370153954940620800,shlongvoyage: pfizer is an indica and moderna is more of a sativa,1310982191082549252,cutelikeapeach,,93,5343,,False,False,1925,,,2,0,0.5,0.5,positive
2021-03-11 23:25:33,1370153954714206208,MSNBC: Opinion | TheRevAl: Black Americans are being called out for Covid-19 vaccine skepticism. But the greater problem is access to…,1372986108,LDoug118,"New York, NY",20,952,,True,False,1238,,,37,0,0.4666666666666667,0.16666666666666669,positive
2021-03-11 23:25:33,1370153953690853377,Zakkenrollen NOS AstraZeneca Nee dat is testfase 4.,23929278,MrsKrass,Netherlands,439,44151,,False,False,46524,,,0,0,0.0,0.0,neutral
2021-03-11 23:25:33,1370153953288192003,Yesterday's COVID-19 vaccination clinic was a beautiful demonstration of how our community is stronger together.  We were proud to partner with the JCCMilwaukee and Hayat Pharmacy to bring a vaccine clinic to those eligible in our community. Over 400 people were vaccinated. ,113715504,JewishMilwaukee,"Milwaukee, WI",2377,6263,,False,False,10282,,,0,1,1.0,0.825,positive
2021-03-11 23:25:33,1370153952629583876,"LincolnsBible: My god... I cannot imagine how wretched the vaccine and Covid infection situation in America would be right now, if Jare…",943269805083189248,2018Avalanche,USA,13412,89699,,False,False,92313,,,613,0,0.5357142857142857,0.2857142857142857,positive
2021-03-11 23:25:32,1370153951710957568,"We're hiring! Read about our latest job opening here: COVID 19 Vaccine Support - Pharmacy Technician -  GreatBarrington, MA cvspharmtech",25928373,tmj_ctf_pharm,"Farmington Valley, CT",288,0,,True,False,44,"{'type': 'Point', 'coordinates': [42.1926467, -73.3645139]}","{'type': 'Point', 'coordinates': [-73.3645139, 42.1926467]}",0,0,0.9,0.5,positive
2021-03-11 23:25:32,1370153951660707840,"NBCNews: BREAKING: President Biden signs $1.9T Covid relief bill into law; ​includes $1,400 checks, $300/wk jobless benefits, child all…",25635175,wildbrad,"Salt Lake City, UT",673,176540,,True,False,66476,,,2366,0,0.0,0.0,neutral
2021-03-11 23:25:32,1370153950717034498,"MassGov: Today's COVID19MA vaccine update: 

- 2,781,490 doses shipped to MA 
- 2,353,408 total doses administered, 64,475 more than y…",1060736312,deloreshandy,"Boston, MA",2994,573,,True,False,56900,,,6,0,0.625,0.25,positive
2021-03-11 23:25:32,1370153950687719426,No sign Oxford-AstraZeneca vaccine causes blood clots: Canadian health authorities  via Yahoo   MY ASS!!,1362065645450493955,AlphaWars_,,15,292,,False,False,755,,,0,0,0.0,0.0,neutral
2021-03-11 23:25:32,1370153950582870026,Calling GEN Z &amp; Millennials for: COVIDVaccine Access: Make Your Plan. Our teens partner with jaxdotcom to share accurate information. WATCH: ,2821373243,imastarjax,"Jacksonville, FL",143,341,,True,False,573,,,0,1,0.6333333333333334,0.4000000000000001,positive
2021-03-11 23:25:32,1370153949987225606,ClintonCoHealth: Today we vaccinated both our Clinton County Prosecutor and Auditor at 2 different Clinics in 2 different locations wit…,736710115,AustinLouis5,"Cambridge,Oh",811,9609,,True,False,445274,,,2,0,0.6,0.0,neutral
2021-03-11 23:25:32,1370153949534199809,Utah mom Kassidi Kurill dies four days after second dose of Moderna vaccine - New York Post ,4725957312,TheRadioTFI,"Queens, NY - Worldwide",122,26,,False,False,18688,,,0,0,0.22727272727272727,0.06818181818181818,positive
2021-03-11 23:25:32,1370153949215461384,"NPR: In Birmingham, Alabama, a health clinic that primarily serves a lower-income, Black neighborhood has not administered a single dos…",751273177959899140,KM06643147,"Illinois, USA",60,27913,,False,False,6528,,,190,0,0.3825396825396825,0.05396825396825398,positive
2021-03-11 23:25:31,1370153947432894472,i took the covid vaccine today :)) im in so much pain but astros cb made it better! covid All_Yours 아스트로 ASTRO,1117537542612627458,lemonymj,Sweden,319,9980,,False,False,11782,,,0,1,0.5666666666666667,0.44166666666666665,positive
2021-03-11 23:25:31,1370153946229178368,"One year after Covid_19 swept across the world, my 91 year-old Dad got his first dose of the vaccine. Many thanks to the scientists, researchers &amp; health professionals who made it possible. pandemicanniversary ",48784644,tobylanzer,London,34546,2692,,False,True,11097,,,0,23,0.5083333333333333,0.2375,positive
2021-03-11 23:25:31,1370153943481786369,stubasceve: It’s finally here! A website that alerts you of any leftover COVID vaccine doses or missed appointments ,1293215793128169473,moebeh,SLC,264,11122,,False,False,1529,,,12,0,1.0,0.0,neutral
2021-03-11 23:25:30,1370153943326715908,TheBigPharaoh: Confirmed. Egypt gives AstraZeneca and Chinese vaccines (most probably Sinopharm). I would take whatever. Even if the Ch…,248732701,singeroftales,USA,1205,25011,,False,False,71396,,,5,0,0.5,0.3,positive
2021-03-11 23:25:30,1370153942215053315,"POTUS: One in four adults in the U.S. has received their first COVID-19 vaccine — and we’re now leading the world in vaccinations.

Tha…",356884625,judeberto,"Oviedo, FL",11,5135,,False,False,2280,,,16388,0,0.3333333333333333,0.25,positive
2021-03-11 23:25:30,1370153942047358977,"JosephEllis408: Summer 2021:

“YO SO DID YOU GET PFIZER OR MODERNA?” ",757227284335988736,_malloryg_,"University of Nevada, Reno",152,5404,,True,False,483,,,46551,0,0.0,0.0,neutral
2021-03-11 23:25:29,1370153937475624960,"NaomiOhReally: The EU exported more than 8 million Covid-19 vaccines to the UK in February alone, new figures reveal.
The UK is not exp…",3797437527,elemene123,South West,696,7211,,False,False,1283,,,241,0,0.4772727272727273,0.3181818181818182,positive
2021-03-11 23:25:29,1370153937203040258,"HamdanMohammed Rulers stealing from the people. Where they should buy the vaccine. I haven't been working since last year. I wish I could go back to work. Sleep better, without worrying about the bills. If I get covid because of my comfort I have no chance, I have Asthma and I know what is .",1357011458270392325,Michell21219205,"Palhoca, Santa Catarina",3,0,,False,False,11,,,0,0,0.18888888888888888,0.16666666666666666,positive
2021-03-11 23:25:29,1370153935583862784,"JoeHenryMusic: Thank you to my new home state of Maine: I received part one of the vaccine today; and being a songwriter, was mandated…",632007923,BugsGroove,Wackyland,2408,85685,,True,False,362481,,,8,0,0.45454545454545453,0.13636363636363635,positive
2021-03-11 23:25:28,1370153931083444226,"m_scribe: Breaking: Novavax announces efficacy results in its vaccine trials.

* 100% protection against severe disease
* 96% effective…",3128904602,Gabriel__Lewis,"San Francisco, CA",6629,119636,,True,False,13492,,,687,0,0.0,0.0,neutral
2021-03-11 23:25:27,1370153929766535171,danieteebee: It’s completely predictably American that the brand of COVID vaccine you have access to has now become a class signifier,613083415,changelingchild,another plane of existence,33,21120,,False,False,11269,,,10889,0,0.0,0.0,neutral
2021-03-11 23:25:27,1370153928386609157,"romromtin: astrazeneca VaccineDeath 
RIP Stefano Paterno, 43 yrs 
My sincere condolences to his wife and family, this should not have…",123370415,adDIEM24,,657,33360,,False,False,18001,,,7,0,0.5,0.5,positive
2021-03-11 23:25:27,1370153927736442881,"EUAmbUS: The facts on EU vaccine exports: 34M doses; 31 countries:

UK: 9.1M
Canada: 3.9M
Mexico: 3.1M 
Japan: 2.7M
Saudi Arabia: 1.4M…",1169961913465393152,Luxo172,,149,10776,,False,False,398,,,31,0,0.0,0.0,neutral
2021-03-11 23:25:27,1370153927308673033,AllenLEllison: . marcorubio didn’t give a damn about you during this entire pandemic. He even skipped your grandparents in line to get…,1934967511,juliannem58,"Fort Smith, AR",93,11508,,False,False,861,,,585,0,0.625,0.0,neutral
2021-03-11 23:25:27,1370153926834724866,"It's widely known that the second dose of the COVID-19 vaccines tend to come with more side effects than the first, including tiredness, headaches, chills, fever, nausea and muscle pain. Why is that?
",23659017,WTEN,"Albany, NY",83697,2201,,True,True,217061,,,1,0,0.30833333333333335,0.1625,positive
2021-03-11 23:25:26,1370153925589012481,"kayleighmcenany: FINALLY the Biden admin recognizes the Trump admin’s unprecedented vaccine work:

➡️ “We’re grateful for the work that…",2230809961,izoldelo,SATX,153,56009,,True,False,6133,,,4592,0,0.95,0.3,positive
2021-03-11 23:25:26,1370153925240791042,"Seriously, Port of Montreal may head to labor strike in 10-14 days again.... Canada’s economy will head to dark age and everyone of us paying for it. Buckle up ! COVID-19 vaccine is on the way to save us, but this will bring Canadian economy farther down.",359741677,HomerSakai,North of Frozen Tundra,1507,172542,,True,False,77513,,,0,2,0.4518518518518519,-0.22546296296296295,negative
2021-03-11 23:25:26,1370153924443922433,"Investigation: Pfizer bullied Latin American nations, including requesting the nations put sovereign assets as collateral for payments for COVID vaccines.  ",1306608747041693699,goldenbergmaya1,,898,953,,False,False,632,,,14,14,0.0,0.0,neutral
2021-03-11 23:25:26,1370153922929819660,"HamillHimself: Statement by the Twice Impeached Former Guy

I hope everyone remembers when they're getting the COVID-19 (often referred…",1024780888276721665,m10_l10,"Pittsburgh, PA",177,97868,,True,False,9979,,,1010,0,0.0,0.0,neutral
2021-03-11 23:25:25,1370153920547364865,"America has created yet another super-effective COVID vaccine!!! 

🇺🇸🇺🇸🇺🇸 ",281877818,Noahpinion,"San Francisco, CA",197966,410623,,False,True,289808,,,72,547,0.0,0.0,neutral
2021-03-11 23:25:25,1370153920513908738,"medit8now KatyTurNBC Here's a recent story on it from a doctor who got her covid shots while pregnant. She lays out her rational as to why she doesn't believe they would hurt her baby.

",932315271372726272,RealNoraC,Kentucky,17686,412100,,False,False,228212,,,0,1,0.375,0.16666666666666666,positive
2021-03-11 23:25:25,1370153919800877060,"SouthPark: C00KiEB0YZ The ""South ParQ Vaccination Special"" premieres TONIGHT at 8/7c on Comedy Central.
The citizens of SouthParQ are…",1361905683722084354,hextoshi1,,79,351,,False,False,138,,,2,0,0.4107142857142857,0.17857142857142858,positive
2021-03-11 23:25:25,1370153919356268551,No sign Oxford-AstraZeneca vaccine causes blood clots: Canadian health authorities  via CTVNews,1034835219386380288,CuricFran,,711,26039,,False,False,9051,,,0,0,0.0,0.0,neutral
2021-03-11 23:25:24,1370153918110515201,"Semyaza666 liuk_87 ThierryBreton AstraZeneca Good send them back to the UK and we can give them to other countries, who won't play politics over a vaccine.",1200131733083045890,Crumpet22635354,"Scotland, United Kingdom",366,48814,,False,False,3462,,,0,1,0.325,0.19166666666666665,positive
2021-03-11 23:25:24,1370153918077014016,naornvr_nad omg did u get the moderna vax,788611800,yenbaodoan,,502,49150,,True,False,24300,,,0,0,0.0,0.0,neutral
2021-03-11 23:25:24,1370153917196029955,danieteebee: It’s completely predictably American that the brand of COVID vaccine you have access to has now become a class signifier,339319394,Weeaboo_J0NES,rice fields,622,141071,,False,False,8605,,,10889,0,0.0,0.0,neutral
2021-03-11 23:25:24,1370153916168540160,DaxGigandet I had absolutely zero reaction to either of my Pfizer shots. Not even any swelling or arm soreness!,1281076807241019392,DILLIGAFever,,2040,10781,,False,False,3689,,,0,0,0.9,0.25,positive
2021-03-11 23:25:24,1370153915044532226,Got the first dose of the Pfizer vaccine today. Thanks Germany!,15195224,Tr0phyWaifu,Azeroth,278,8552,,True,False,10936,,,0,3,0.26666666666666666,0.25,positive
2021-03-11 23:25:23,1370153910317453316,"It's widely known that the second dose of the COVID-19 vaccines tend to come with more side effects than the first, including tiredness, headaches, chills, fever, nausea and muscle pain. Why is that?
",18970117,FOX23News,Albany NY,50268,14,,False,True,51795,,,1,2,0.30833333333333335,0.1625,positive
2021-03-11 23:25:23,1370153910086799361,"ObamaFoundation: “This vaccine means hope.” —BarackObama coming together with TheBushCenter, BillClinton, and CarterCenter.

The be…",808374524790112256,WrldCit95,"North Carolina, USA",717,99506,,True,False,20860,,,184,0,0.0,0.0,neutral
2021-03-11 23:25:22,1370153908505567232,"naomirwolf: Nine countries have now suspended the AstraZeneca vaccine due to blood clots. Now it's Iceland, Norway, Denmark, South Afri…",55588504,skyblue_England,"Hampshire, England",1548,52422,,True,False,5386,,,477,0,0.375,-0.125,negative
2021-03-11 23:25:22,1370153908362940423,"NBCNews: BREAKING: President Biden signs $1.9T Covid relief bill into law; ​includes $1,400 checks, $300/wk jobless benefits, child all…",3191858651,Botanicalsrock,,1241,276244,,False,False,92992,,,2366,0,0.0,0.0,neutral
2021-03-11 23:25:22,1370153907834474504,danieteebee: It’s completely predictably American that the brand of COVID vaccine you have access to has now become a class signifier,1494943261,1trivialove,19 she/her desi,681,16200,,False,False,89286,,,10889,0,0.0,0.0,neutral
2021-03-11 23:25:22,1370153905791905792,danieteebee: It’s completely predictably American that the brand of COVID vaccine you have access to has now become a class signifier,520080582,a_milli_shores,901 - 864,355,36274,,False,False,19473,,,10889,0,0.0,0.0,neutral
2021-03-11 23:25:21,1370153903879303174,"MichelleObama: When you can get the COVID-19 vaccine, I hope you do—Barack and I are certainly glad we did. It’s our best shot at beati…",542776690,elizabeth_racke,Washington DC,186,1702,,True,False,2222,,,8132,0,0.65,0.75,positive
2021-03-11 23:25:21,1370153903543570434,danieteebee: It’s completely predictably American that the brand of COVID vaccine you have access to has now become a class signifier,187314211,RickyKentt,"Smallville, Kansas",454,10150,,False,False,50388,,,10889,0,0.0,0.0,neutral
2021-03-11 23:25:21,1370153903111688195,Uber: The WhiteHouse has asked companies to step up in the fight against COVID-19. On top of our donation of 10 million rides to help…,2291856931,jhlittlejohn,USA,53,995,,False,False,758,,,613,0,0.5,0.5,positive
2021-03-11 23:25:21,1370153902084096003,Got my Pfizer shot today. Thankful I work at a university so I was eligible.,2168813149,darling_d68,Where she at?,78,2030,,True,False,1394,,,0,0,0.0,0.0,neutral
2021-03-11 23:25:20,1370153901190680577,"I think folks are using bots to snag HEB vaccine appointments. If you keep hitting refresh continuously, you will see Pfizer, no matter how fast you try to pick and enter your details, it’ll be gone.",24861904,ElegantSavant,"Houston, TX",20240,10781,,True,False,470358,,,0,0,0.6,0.2,positive
2021-03-11 23:25:20,1370153897952641025,CBCNews: Church leaders tell followers to opt for vaccines 'with the least connection to abortion-derived' cell lines. ,587778544,Vershaii,"Victoria, B.C.",49,6688,,True,False,4876,,,17,0,0.4,-0.3,negative
2021-03-11 23:25:19,1370153897113837573,"actupny: We’re here outside Pfizer HQ to demand POTUS to protect people not profits, support TRIPSWaiver, and hold pharmaceuticals ac…",27465911,eioconnor,"yonkers, ny",64,15228,,True,False,4250,,,168,0,0.05,0.0,neutral
2021-03-11 23:25:19,1370153895901720581,Canada on track to receive 36.5 million CoVID-19 vaccine doses by July. ,1243888276123025423,MJosling53,Canada,1913,77793,,True,False,89729,,,2,1,0.0,0.0,neutral
2021-03-11 23:25:19,1370153895201284100,"MollyJongFast still am. still quarantining packages &amp; mail for 48 hours. still wearing gloves &amp; mask to bring in my groceries. we got covid last year, and it was awful. i also never want to be responsible for giving it to anyone so i'll be wearing a mask for a long time after i get the vaccine",2544325843,notmeanspirited,,1606,382775,,False,False,33146,,,1,56,0.5041666666666667,-0.21250000000000002,negative
2021-03-11 23:25:19,1370153894903476229,"LynnBrittney2: Now Denmark is halting vaccination with Astra Zeneca due to side effects. That's the 6th country. Austria, Estonia, Lith…",1339908820047376385,john84003543,,32,14235,,False,False,1668,,,310,0,0.375,-0.125,negative
2021-03-11 23:25:18,1370153892986650629,"JKNjenga: In the last 24 hours, seven European nations have suspended the Astra Zeneca vaccine that Kenya using because of serious adve…",2511877655,__ngise,,1955,25446,,False,False,5462,,,321,0,0.24444444444444444,-0.1111111111111111,negative
2021-03-11 23:25:18,1370153890709135370,timesuppeeps: AstraZeneca Vax rollout halted due to Safety concerns. Previously healthy people developed life threatening blood clots s…,1265300020653371394,Shadowstitcher1,The best country on earth. ,73,13526,,False,False,3741,,,191,0,0.39166666666666666,0.15833333333333333,positive
2021-03-11 23:25:18,1370153890310590470,"POTUS: One in four adults in the U.S. has received their first COVID-19 vaccine — and we’re now leading the world in vaccinations.

Tha…",821187232971132930,tko805,,25,11027,,False,False,3304,,,16388,0,0.3333333333333333,0.25,positive
2021-03-11 23:25:18,1370153889937428481,Independent: Third of people in England have Covid antibodies as case rates continue to fall ,1134907050,Damo_McGregor,United Kingdom,1828,502000,,True,False,513001,,,12,0,0.0625,0.0,neutral
2021-03-11 23:25:17,1370153887487950851,MCPHSBoston: Our PharmD students are continuing to do their part by helping administer the COVID-19 vaccine in the Lowell area. The off…,905117192,JennaPookins,,49,1020,,False,False,151,,,1,0,0.0,0.0,neutral
2021-03-11 23:25:16,1370153884430127107,danieteebee: It’s completely predictably American that the brand of COVID vaccine you have access to has now become a class signifier,962190732659273729,suhhlestea,"California, USA",246,8170,,True,False,4068,,,10889,0,0.0,0.0,neutral
2021-03-11 23:25:16,1370153883960541186,"I guess not every country is under the thumb of Pharma, its  henchmen in Washington and the legions of useful idiots who are promoting this scientific and medical fraud
",17135413,KenMcCarthy,At Large,4074,135,,False,False,46712,,,5,6,0.26666666666666666,-0.16666666666666666,negative
2021-03-11 23:25:16,1370153883843067916,"solmamakwa: On March 1, 2021, I was invited by Sandy Lake First Nation to receive my 2nd dose of Moderna vaccine.  I was there to promo…",26573339,FrameToFrameBJ,"Toronto, Ontario",1648,17995,,True,False,15931,,,232,0,0.16666666666666666,0.125,positive
2021-03-11 23:25:16,1370153882840674306,Bakit kaya may pa-skip Johnson and Johnson vaccine ang iba? Been waiting for it.. skipped Pfizer already. Why suffer twice when one dose can do just the same? 85% no severe cases and 100% no hospitalization/death from covid is good enough for me.,1084486014637428736,MerryMe342143,,350,6637,,False,False,4975,,,0,9,0.4083333333333334,0.2333333333333333,positive
2021-03-11 23:25:15,1370153878361157641,heinz field holds my happiest moments: Taylor Swift concerts and a Covid vaccine 🥰🥰🥰,1015431040465297408,SielJenna,"Pittsburgh, PA",133,507,,False,False,178,,,0,4,0.0,0.0,neutral
2021-03-11 23:25:13,1370153870912020480,"DrNeilStone: When you vaccinate basically the entire population, anything that happens to anyone will be called ""vaccine related"" - and…",731992552308637696,Leighpowers16,"London, England",203,36431,,False,False,7915,,,146,0,0.5125,0.0,neutral
2021-03-11 23:25:12,1370153867619500041,"ABCPolitics: Despite calls for national unity and bipartisanship, President Joe Biden and his top aides have declined to give the Trump…",1352075772647927808,Trump2044552580,,354,4684,,False,False,6812,,,1083,0,0.5,0.5,positive
2021-03-11 23:25:12,1370153867179069440,I’m getting my second COVID vaccine in 2 weeks and I’m going to vlog about my experience.,3308589224,Cotytolly,"Texas, USA",2063,14810,,True,False,11605,,,0,5,0.0,0.0,neutral
2021-03-11 23:25:12,1370153866382086145,"TheInsiderPaper: BIG: Denmark, Italy, Norway and 6 other countries suspend use of AstraZeneca vaccine after reports of blood clots. 1 d…",45565350,suiheisen,いばらき,7989,9513,,False,False,69938,,,95,0,0.2375,-0.0625,negative
2021-03-11 23:25:11,1370153863538434053,"🚨🚨🚨Fellow Veterans🚨🚨🚨

Every veteran in Northeast Ohio that’s eligible* to receive healthcare through the V.A. can now get the COVID-19 vaccine regardless of age!

Call this number to schedule: 216-707-7660

Or fill out this survey to be contacted: 

 ",271960463,Cravanicus,"Rocky River, OH",848,108381,,True,False,66663,,,2,4,0.0,0.0,neutral
2021-03-11 23:25:11,1370153860971384832,"MichelleObama: When you can get the COVID-19 vaccine, I hope you do—Barack and I are certainly glad we did. It’s our best shot at beati…",1033466178381918208,sandymccandles4,,238,91189,,False,False,46096,,,8132,0,0.65,0.75,positive
2021-03-11 23:25:10,1370153857314029568,"Rod_Hagen: noplaceforsheep Not according to the intelligent Govs of Denmark, Norway, Iceland, Austria, Estonia, Lithuania, Latvia and…",530980768,echidna_paw,,2038,43612,,False,False,130039,,,1,0,0.9,0.8,positive
2021-03-11 23:25:10,1370153856135528453,BWhippleKS: BREAKING: SedgwickCounty has announced that ALL of Covid19 vaccine Phase 2 is now open for folks to sign up! I'm told the…,15172600,mlov,"Wichita, KS",1393,1919,,False,False,7154,,,18,0,0.5,0.0,neutral
2021-03-11 23:25:09,1370153855124701185,"GreatGameIndia: THIS IS BIG

8 European nations including Italy, Latvia, Luxembourg, Lithuania, Estonia, Denmark, Norway and Iceland ha…",1240768855389212677,Dom175289678,"Philadelphia, Pennsylvania,USA",285,23563,,False,False,27282,,,792,0,0.05,0.0,neutral
2021-03-11 23:25:09,1370153854109581314,"nprpolitics: The U.S. is currently administering over 2.1 million coronavirus vaccine shots a day.

Use our tracker to see how your sta…",817488870686101504,SandyKAlano,"Apache Junction, AZ",1187,137594,,False,False,418926,,,12,0,0.4,0.0,neutral
2021-03-11 23:25:09,1370153852410937345,"MichelleObama: When you can get the COVID-19 vaccine, I hope you do—Barack and I are certainly glad we did. It’s our best shot at beati…",612057704,ManMet80,,33122,957316,,False,False,1009820,,,8132,0,0.65,0.75,positive
2021-03-11 23:25:09,1370153852280901633,Lisadelivers I have had two pfizer vaccines. Only had a sore arm,1116159028995010564,wrathofKath55,,10,741,,False,False,443,,,0,1,1.0,0.0,neutral
2021-03-11 23:25:08,1370153851005726720,"Marine0141: Utah mother dies four days after taking second COVID vaccine dose

",22420053,conniewidman,,2333,82092,,False,False,111470,,,42,0,0.0,0.0,neutral
2021-03-11 23:25:08,1370153850544418816,"healthgovau Dear nick_coatsworth ,

Do you think Australia should also suspend usage of the experimental AstraZeneca 💉?

Breaking news below! 👇😮

",967331527561392134,JumboJones56,,100,1068,,False,False,263,,,0,0,0.4,0.125,positive
2021-03-11 23:25:08,1370153850200596481,"Florida’s governor announced a significant increase on Thursday in the number of Walgreens that will be offering vaccinations against COVID-19. Until now, only 12 were providing the shots, now 97 will be.​  ",15750898,FOX13News,"Tampa, FL",326082,3036,,True,True,209661,,,1,5,0.9375,0.1875,positive
2021-03-11 23:25:08,1370153849718140928,"JonathanWosen: Back in Nov., a documentary group chronicling Pfizer's push to develop a COVID vaccine asked me to offer some perspecti…",861629219704414209,UCSC_SciCom,"Santa Cruz, CA",1571,5625,,True,False,4130,,,2,0,0.0,0.0,neutral
2021-03-11 23:25:08,1370153848812240896,Thank you okchealth for a great COVID vaccine experience! ,19557634,ounwcm,"Norman, OK",24059,32238,,True,True,24296,,,2,153,0.75,1.0,positive
2021-03-11 23:25:08,1370153848636051462,EricMMatheny: Are we going to talk about the healthy 39 year old woman from Utah who got her second dose of the Moderna vaccine and the…,36991022,emmyandvero,,101,6981,,False,False,3807,,,2899,0,0.2333333333333333,0.19999999999999998,positive
2021-03-11 23:25:08,1370153847650390023,ClareCraigPath: And 8 countries have today suspended use of AstraZeneca vaccine pending investigation that it is causing clots which ca…,1326493201365086210,Truth7898Lee,,92,15022,,False,False,6872,,,220,0,0.0,0.0,neutral
