created,id_str,text,user_id,screen_name,location,followers_count,user_favourites_count,time_zone,geo_enabled,verified,status_count,geo,coords,retweet_count,tweet_favourite_count,Subjectivity,Polarity,Sentiment
2021-03-11 23:23:26,1370153419772719107,fionamflanagan1: A leaked letter from the HSE regarding the Covid 19 vaccine. Clearly some staff are becoming increasingly uncomfortabl…,29269648,jfk2005,ireland,357,16882,,True,False,15902,,,25,0,0.6166666666666667,0.275,positive
2021-03-11 23:23:25,1370153418996744194,AstraZeneca. My daughter... ⏳,795085364088176640,OvercomerMarson,"Kingston , Jamaica",486,13992,,True,False,4061,,,0,0,0.0,0.0,neutral
2021-03-11 23:23:25,1370153418120105986,"NPR: In Birmingham, Alabama, a health clinic that primarily serves a lower-income, Black neighborhood has not administered a single dos…",190882621,MsMyraD,Lost in thought...,401,12242,,True,False,18670,,,190,0,0.3825396825396825,0.05396825396825398,positive
2021-03-11 23:23:25,1370153418115801088,"AlanBixter: Therese_Rein Not all first COVID vaccine shots will be delivered by October. They are miles behind, and getting further be…",1174639256863510530,ToneSaysGoLeft,Worimi Land,1063,17910,,False,False,36553,,,21,0,0.5111111111111111,-0.05000000000000001,negative
2021-03-11 23:23:25,1370153416673128453,"NPR: In Birmingham, Alabama, a health clinic that primarily serves a lower-income, Black neighborhood has not administered a single dos…",58981717,SparrowOnTheEye,St. Louis,2833,319459,,False,False,373048,,,190,0,0.3825396825396825,0.05396825396825398,positive
2021-03-11 23:23:25,1370153415670644737,"a2binny KirkMMaxey I wish I could go. I can't -- vaccine is contraindicated if you have covid, and I'm still waiting to find out. Was exposed Sunday so I have to wait until next week to make sure I don't develop symptoms. But I am all for this weather and for chocolate and coffee!",961231092,AliceDreger,the nearest open water,30873,71082,,False,True,47410,,,0,1,0.4444444444444444,0.3125,positive
2021-03-11 23:23:24,1370153411082125318,"TexasDSHS: School and child care workers are eligible for a COVID-19 vaccine. 

Find a COVID19TX vaccine provider: ",842472365628047360,dizzle5000,"GeeksResist HQ, Texas 🖖",12537,189146,,True,False,61271,,,85,0,0.0,0.0,neutral
2021-03-11 23:23:23,1370153410700394497,"bagel_witch By what I've read (and I could be wrong!) the 66% is because it was tested under different conditions than Moderns and Pfizer, but it's equally as good at preventing deaths and hospitalizations",2975389736,bellagothsgf,she/her,465,55622,,True,False,7268,,,0,0,0.7000000000000001,0.024999999999999984,positive
2021-03-11 23:23:23,1370153408519315458,LasVegasLocally: Casino and hospitality workers are eligible to get the covid-19 vaccine in Nevada. Finally.,1012948191623278593,limewirevirus69,,88,15390,,True,False,2099,,,230,0,1.0,0.0,neutral
2021-03-11 23:23:22,1370153404123725825,MaryKelliPalka: We are hosting this conversation right now. These students from imastarjax are great interviewers. And emdrums is co-…,2821373243,imastarjax,"Jacksonville, FL",143,341,,True,False,573,,,5,0,0.6428571428571428,0.5428571428571429,positive
2021-03-11 23:23:21,1370153401640714246,"JajaPhD: This is the Covid-19 vaccine that should be going to front line health workers and those who are the most vulnerable, ba?",549096551,_hadassah__,"Ontario, Canada",1103,6673,,True,False,66643,,,1207,0,0.5,0.0,neutral
2021-03-11 23:23:21,1370153398843142149,HeythereNosh My mom got the Pfizer! No side effects for either shot!,26787305,fire__girl,"Austin, TX",5830,82406,,False,False,38670,,,0,0,0.0,0.0,neutral
2021-03-11 23:23:20,1370153395445583873,Guess which healthcare worker got her second Pfizer shot today? VaccinesWork ,234865212,Maggie_Klaus,City of Angels ,11588,397376,,True,False,97040,,,13,365,0.0,0.0,neutral
2021-03-11 23:23:20,1370153395084951553,I got my first half of the COVID vaccine yesterday &amp; I really thought people were exaggerating the arm soreness. I can’t lift my arm straight up lol.,345710589,xoIvon,"California, USA",144,1915,,False,False,426,,,0,1,0.36,0.2566666666666667,positive
2021-03-11 23:23:19,1370153393063399429,"BreesAnna: This is the breaking story Mike Yeadon was talking about. 

Urgent Open Letter from Doctors and Scientists to the European M…",1668915986,ElenaMarilynch,Venezia,548,17879,,False,False,20583,,,1515,0,0.25,0.0,neutral
2021-03-11 23:23:19,1370153391108747264,"GovInslee: In more good news, I am pleased that we will move to the next tier of eligibility earlier than we thought. On March 17, ever…",856954702616969216,LarissaWakeF,"Lacey, WA",69,22762,,False,False,25715,,,148,0,0.52,0.33999999999999997,positive
2021-03-11 23:23:19,1370153391104614402,"EricMMatheny: Vaccination is not a political talking point. It’s a matter of choice. The truth is, the Covid vaccine was approved very…",618279638,senorabshs,,491,10931,,True,False,10841,,,306,0,0.1,0.0,neutral
2021-03-11 23:23:19,1370153390966140929,"I will do best youtube video Promotion and SEO to improve ranking.

Contact Me: 

Arteta  Milan  NordVPN  MUFC  AstraZeneca  vernon maguire   notallmen  FaceaBFM  KCORP  ComplementDenquete GNTM  DAYWALKER Heidi ",4719275545,biswas_sumon1,"Dhaka, Bangladeh",52,80,,False,False,362,,,0,1,0.3,1.0,positive
2021-03-11 23:23:19,1370153390685179906,"NPR: In Birmingham, Alabama, a health clinic that primarily serves a lower-income, Black neighborhood has not administered a single dos…",768274519689531392,brunneau,Connecticut,1058,23260,,False,False,19623,,,190,0,0.3825396825396825,0.05396825396825398,positive
2021-03-11 23:23:19,1370153390500548610,Government's COVID-19 vaccine rollout and latest tourism stimulus package attacked on Q+A ,1209964458958675968,GlendaM47545442,SW Vic Aus,662,78165,,False,False,34689,,,0,0,0.9,0.5,positive
2021-03-11 23:23:19,1370153390286778368,B52Malmet: This is a real world study from Israel that has a lot of weight.  ,924057140016402433,Witchypoo43,"Ohio, USA",1620,77127,,False,False,78462,,,34,0,0.30000000000000004,0.2,positive
2021-03-11 23:23:18,1370153389632462858,"HiljaGebest NYLonGirl Malveezy breeadail That's not even that this opinion piece says. 

""In conclusion, the recent advancement in the SARS-CoV-2 spike protein-based COVID-19 vaccine development is exciting and has shed light on how to end the current pandemic. These vaccines should benefit elderly people with",1348054641251119104,there_she_growz,,5,1036,,False,False,50,,,0,1,0.5375,0.175,positive
2021-03-11 23:23:18,1370153389414305792,"DethVeggie: 

Reminder. 

Don't cheat or lie to get you vaccine, but if you can get one legitimately, then you a…",372111030,XioNYC,,852,334,,True,False,211799,,,3,0,0.0,0.0,neutral
2021-03-11 23:23:18,1370153388298530819,"gracehwang1970: 1 AstraZeneca COVID19Vaccine to 11-12 receivers by ""Made in South Korea syringes"" 

",882486308622315520,fZleYRna7MvoUMB,꽈베기  끊는날  까지,1293,20405,,False,False,37144,,,4,0,0.0,0.0,neutral
2021-03-11 23:23:18,1370153388189478912,epkaufm: Pfizer data from Israel finds vaccine prevents 94% of asymptomatic infections ,1679568758,JimRosenz,Wellington New Zealand,1237,74576,,True,False,177017,,,35,0,0.0,0.0,neutral
2021-03-11 23:23:17,1370153384834174981,"TomiLahren: If you need an ID to get a Covid vaccine, why the hell shouldn’t you need an ID to vote?!! LiberalismIsAMentalDisorder",378865990,millertime4real,"O'Fallon, MO",195,98121,,True,False,55975,,,2320,0,0.0,0.0,neutral
2021-03-11 23:23:16,1370153380513943554,TheInsiderPaper: BREAKING 🚨 Denmark suspends use of AstraZeneca vaccine due to serious cases of blood clots,3306258775,IrmgardLindworm,,468,72665,,False,False,103495,,,211,0,0.5208333333333333,-0.22916666666666666,negative
2021-03-11 23:23:16,1370153378957950976,"NPR: In Birmingham, Alabama, a health clinic that primarily serves a lower-income, Black neighborhood has not administered a single dos…",2424243829,wattscentral,New York ,437,23676,,True,False,26482,,,190,0,0.3825396825396825,0.05396825396825398,positive
2021-03-11 23:23:16,1370153378702110720,PJCNDP: Got my 2nd dose of the moderna vaccine today. I am grateful for being vaccinated but wanted to remind ppl why indigenous folks…,332063391,BlueRaveFinn,"Ontario, Canada",1586,11865,,False,False,362635,,,37,0,0.0,0.0,neutral
2021-03-11 23:23:16,1370153378098073610,donkamion78: 12 Prominent scientists and doctors: Medical regulators should release bold figures of the numbers of people who have died…,60408096,myrontmoore,United States,4311,1650,,False,False,55058,,,191,0,0.5555555555555555,0.27777777777777773,positive
2021-03-11 23:23:15,1370153376734928896,"radionoel To clarify they aren't saying to skip it entirely, from the article:

""If the AstraZeneca product is the only available option, said the document, then ""nothing morally prevents anyone from receiving in good conscience the vaccines""",4490028554,trent_brownlee,"Stonewall, Manitoba",224,7938,,True,False,7764,,,0,0,0.575,0.22000000000000003,positive
2021-03-11 23:23:15,1370153375237509121,Reuters: Denmark suspends AstraZeneca COVID vaccine after blood clot reports  ,1298871832880140288,ParkFrere,,68,5684,,False,False,19594,,,1007,0,0.0,0.0,neutral
2021-03-11 23:23:15,1370153373903826950,"guardian The reasons why second dose of COVID-19 vaccine has worse side effects
",1293591139883397136,AdamAda13410588,,14,6052,,False,False,5057,,,0,3,0.3,-0.2,negative
2021-03-11 23:23:15,1370153373681348609,"Dr. Swamy39 jee :

7 European countries – Denmark, Norway, Austria, Estonia, Latvia, Lithuania and Luxembourg – have suspended all or part of their AstraZeneca​ vaccine​ rollout as a precaution​ while they investigate concerns pertaining blood clots.

",1090510399324090369,Dharma2X,,7880,100,,False,False,53167,,,2,3,0.0,0.0,neutral
2021-03-11 23:23:14,1370153372473380864,"IndianEmbassyTR: Pakistan🇵🇰, the only SAARC country to not seek COVID-19 Vaccine from India, is getting 45 million 🇮🇳 made vaccine Covi…",1312116078500225024,samarth_kaul17,,6,2801,,False,False,402,,,3055,0,1.0,0.0,neutral
2021-03-11 23:23:13,1370153364688928771,"ChrisRongey We had about 30 hours of flu-like symptoms after our second doses of Pfizer last Saturday afternoon - by Monday morning, all was good and normal.  Well, as good as it gets for 75 year olds....",21491520,davidisilb,,11,105,,False,False,359,,,0,2,0.38333333333333336,0.30999999999999994,positive
2021-03-11 23:23:12,1370153364231704581,"LincolnsBible: My god... I cannot imagine how wretched the vaccine and Covid infection situation in America would be right now, if Jare…",1346931516434239489,Kathryn10713069,,82,15675,,False,False,2436,,,613,0,0.5357142857142857,0.2857142857142857,positive
2021-03-11 23:23:12,1370153363405484032,AFarr01: PalmerReport I remember when Pfizer first came up with the vaccine and gave trump the priority in ordering the vaccine first…,732226535432826880,snoopy6702,"Buffalo, NY",292,68181,,False,False,22357,,,31,0,0.3333333333333333,0.25,positive
2021-03-11 23:23:12,1370153360494592008,"EricMMatheny: Vaccination is not a political talking point. It’s a matter of choice. The truth is, the Covid vaccine was approved very…",53840964,k1100ltbmer,Cincinnati Ohio,324,21574,,False,False,19033,,,306,0,0.1,0.0,neutral
2021-03-11 23:23:11,1370153359043395584,"theSNP: 💉 Over 1,825,800 people in Scotland have now received a first dose of the COVID vaccine.

🏴󠁧󠁢󠁳󠁣󠁴󠁿  That's over a third of Scotl…",1366002947616874496,Jon86398752,,32,2188,,False,False,1180,,,76,0,0.16666666666666666,0.125,positive
2021-03-11 23:23:11,1370153356627476484,"NPR: In Birmingham, Alabama, a health clinic that primarily serves a lower-income, Black neighborhood has not administered a single dos…",274054121,ImdeKat,"New York, USA",434,87251,,False,False,72265,,,190,0,0.3825396825396825,0.05396825396825398,positive
2021-03-11 23:23:10,1370153354391871493,"TomiLahren: If you need an ID to get a Covid vaccine, why the hell shouldn’t you need an ID to vote?!! LiberalismIsAMentalDisorder",1308564251351617539,LarryLoree,,1,1100,,False,False,337,,,2320,0,0.0,0.0,neutral
2021-03-11 23:23:10,1370153353204920327,mariamainmo: Girls don't want boys. They want the covid vaccine and a nice apartment,533143442,alecspack,"221B, Baker Street ",2233,15225,,False,False,42729,,,25183,0,1.0,0.6,positive
2021-03-11 23:23:10,1370153352282132484,robinmonottibot: Vaccine phase 2 efficacy trials completed around 20th June 2020 (see Pfizer). Phase 3 safety trials need one year post…,790649539308945409,DangerousGlobe,European,11443,31340,,True,False,79333,,,147,0,0.0,0.0,neutral
2021-03-11 23:23:09,1370153349895442436,"B R E A K I N G NEWS: 🚨 Switzerland, Italy, Austria, Latvia, Lithuania, Estonia, Luxembourg, Iceland, South Africa, Norway, Denmark have all suspended the AstraZeneca vaccine
via Guardian

Call for investigations into MSM accepting Gates funding for conflicted reporting COVID ",197233854,Practicalintuit,,1512,2659,,True,False,2534,,,4,5,0.0,0.0,neutral
2021-03-11 23:23:09,1370153348456804356,"""39-Year-Old Mother Dies After 2nd Dose of Moderna Vaccine.... She was seemingly healthy as a horse... She had no known underlying conditions.”

“They did a blood test... and her liver wasn’t functioning""

It's perfectly safe, right?🙄
",1069697383829651456,PaulMitchell_AB,"Didsbury, Alberta",6780,11999,,False,False,11068,,,75,98,0.3333333333333333,0.3333333333333333,positive
2021-03-11 23:23:07,1370153342790471683,"thehill: Virginia Kroger mistakenly gave people ""empty syringes instead of the COVID-19 vaccine""  ",721313906925400064,theeonlyyj,"Hinesville, GA",127,13422,,True,False,3377,,,28,0,0.5,-0.1,negative
2021-03-11 23:23:07,1370153342702391296,"DaxGigandet Pfizer vaccine. Shot 1: nothing. Shot 2: body aches. Like if you did a super-intense full-body workout and didn't stretch first. Rest, a hot shower, ibuprofen, and lots of water helped. Back to normal after a couple days.",1245051888560635906,CELPbytheSea,,618,36381,,False,False,3734,,,0,4,0.4583333333333333,0.1625,positive
2021-03-11 23:23:07,1370153341758570497,"trawnity: If there’s any health care workers, AG workers or education workers that want to get their covid vaccine, we are at COS parki…",64608179,krishamaxwell,,1708,7038,,True,False,32099,,,16,0,0.0,0.0,neutral
2021-03-11 23:23:07,1370153341196640265,Reuters: Denmark suspends AstraZeneca COVID vaccine after blood clot reports  ,757290960921432064,Tai_japh,🔄,9754,82874,,True,False,74373,,,1007,0,0.0,0.0,neutral
2021-03-11 23:23:05,1370153334146011136,"JoePajak: Prof adamhfinn, BristolUni,

re: AstraZeneca vaccine:

'At the moment there is no sign anywhere, including the UK where v…",3124211920,rgculley,"Doncaster, UK",4202,228385,,False,False,109273,,,3,0,0.0,0.0,neutral
2021-03-11 23:23:05,1370153331902009345,"POTUS: One in four adults in the U.S. has received their first COVID-19 vaccine — and we’re now leading the world in vaccinations.

Tha…",21107062,BGoodwmn,Philadelphia area,604,2970,,True,False,7621,,,16388,0,0.3333333333333333,0.25,positive
2021-03-11 23:23:05,1370153331562283011,"NPR: In Birmingham, Alabama, a health clinic that primarily serves a lower-income, Black neighborhood has not administered a single dos…",2763123681,53Hippie,"Celina, OH",104,16439,,True,False,4120,,,190,0,0.3825396825396825,0.05396825396825398,positive
2021-03-11 23:23:05,1370153331423809536,"POTUS: One in four adults in the U.S. has received their first COVID-19 vaccine — and we’re now leading the world in vaccinations.

Tha…",1573859252,REALGTHEKING,United States,3052,38353,,True,False,56722,,,16388,0,0.3333333333333333,0.25,positive
2021-03-11 23:23:04,1370153329758773254,Pregnant women in Texas now eligible for COVID-19 vaccine ,390277164,KAGSnews,Bryan/College Station. TX,6247,3909,,True,True,57801,,,0,0,0.5,0.3333333333333333,positive
2021-03-11 23:23:03,1370153326717894664,"alanredmond: FatEmperor Great presentation by doctor in Idaho about COVID, vitamin D, effective treatments and vaccine data.  ",41434709,_morningstar,,41,4131,,False,False,1989,,,50,0,0.775,0.7,positive
2021-03-11 23:23:02,1370153320132661250,"POTUS: One in four adults in the U.S. has received their first COVID-19 vaccine — and we’re now leading the world in vaccinations.

Tha…",1308867508313579521,DanaSan68018976,,442,72470,,False,False,29512,,,16388,0,0.3333333333333333,0.25,positive
2021-03-11 23:23:02,1370153318832508930,mariamainmo: Girls don't want boys. They want the covid vaccine and a nice apartment,953108179633623040,tblossom11,The Wild West ,28,13995,,False,False,9045,,,25183,0,1.0,0.6,positive
2021-03-11 23:23:01,1370153318257950720,"Culinary226: Culinary Union plans to help inform its 60,000-plus members in NV how to get vaccinated when the time comes. “Communities…",1386934242,GalloMarcia,,331,65253,,True,False,44532,,,1,0,0.0,0.0,neutral
2021-03-11 23:23:01,1370153318006321155,"The vaccine appointment portal will be open for anyone in phases 1A, 1B and all teachers. ",621294933,snddev,,25,10,,False,False,37309,,,0,0,0.5,0.0,neutral
2021-03-11 23:23:01,1370153317008031746,"NPR: In Birmingham, Alabama, a health clinic that primarily serves a lower-income, Black neighborhood has not administered a single dos…",1055639487626338304,BasilBing,,550,132004,,False,False,36893,,,190,0,0.3825396825396825,0.05396825396825398,positive
2021-03-11 23:23:01,1370153315930112002,JonathanSanf0rd pfizer You can only imagine how many liquor stores there are here. About 10 within 3 miles of my house.,1658707891,crazymcmama,Baltimore,461,69490,,False,False,15316,,,0,1,0.75,0.25,positive
2021-03-11 23:23:01,1370153314579533835,kublun kesterjleek mark_toshner How many people got the vaccine and how many people had blood clots? Is the number much much smaller than how many people had Covid and died or have had months of long lasting breathing issues and fatigue and cognitive decline?,1224539674615721985,DogfromTheThing,A town where noone is innocent,1360,19730,,False,False,17071,,,0,2,0.39999999999999997,0.24166666666666667,positive
2021-03-11 23:23:00,1370153312339828736,"skepticalIDdoc HealthyDebate Always these things show AstraZeneca when the only version going into arms in Canada at present, COVISHIELD, did not undergo clinic trials, as it was deemed ‘sufficiently similar’ with an ‘inferred efficacy’. CovishieldVaccine Is it wrong to wish there was more healthy debate?",1240950856905883648,waveSpire1,,2,60,,True,False,50,,,0,0,0.5499999999999999,0.08333333333333333,positive
2021-03-11 23:23:00,1370153310985064451,"Jessica Shaw shared a redacted image on Twitter showing the prescription which includes a handwritten note, ""You are allowed to hug your granddaughter."" ",17588130,newswest9,West Texas,17444,2936,,True,True,99079,,,0,0,0.0,0.0,neutral
2021-03-11 23:22:59,1370153309894479875,DaxGigandet Really sleepy for about 3 days. (Pfizer),25287236,Soonergirl12,Oklahoma City,464,34198,,False,False,15062,,,0,3,0.2,0.2,positive
2021-03-11 23:22:59,1370153309810532358,"jsolomonReports: Former presidents urge Americans to get COVID-19 vaccine, Trump not among group | Just The News ",3233164824,truth_in_wisdom,"Los Angeles, CA",620,89961,,False,False,19292,,,141,0,0.0,0.0,neutral
2021-03-11 23:22:59,1370153309609332736,"votolatino: BREAKING: POTUS signed the COVID relief bill which includes:

-$1,400 checks for most Americans
-$300/wk jobless benefits…",275386973,HTAshford,NJ,14,11866,,True,False,2512,,,31,0,0.5,0.5,positive
2021-03-11 23:22:59,1370153308288090117,KXAN_News: People scheduled to receive their second doses of the COVID-19 vaccine Wednesday through Family Hospital Systems said they w…,250231637,zephtx,,1732,110899,,False,False,128012,,,2,0,0.0,0.0,neutral
2021-03-11 23:22:59,1370153306413166593,robinmonottibot Not true. Pfizer and AZ vaccines are approved in Australia not authorized.,25644344,PeteLynch,North Gordon,314,6343,,True,False,5726,,,0,0,0.65,-0.175,negative
2021-03-11 23:22:58,1370153304064458752,"TexasDSHS: More Texans get the COVID-19 vaccine each day! Get the vax when it’s your turn. It can save your life! Vaccinated or not, we…",823566296369561601,Camp2Charlie,United States,227,32427,,False,False,51393,,,539,0,0.5,0.78125,positive
2021-03-11 23:22:58,1370153301896007691,"If you know anyone 65 or older in Maryland that needs their COVID shot. Call 301.868.8000, Southern Maryland Hospital. Might have to call several times. Ask for vaccine dept.",1101714430583287808,ent_ize,,4,17,,True,False,71,,,0,0,0.1111111111111111,0.05555555555555555,positive
2021-03-11 23:22:57,1370153300901961738,"LesFemmesPAC: No need to look to the past to find women making history.  It's happening right here right now. Meet InclusivCare CEO, D…",2578851859,AyameDinkler,"New Orleans, LA",796,4132,,False,False,3388,,,4,0,0.44047619047619047,0.10714285714285714,positive
2021-03-11 23:22:57,1370153300423741447,Women of Miami? Networking Presented by the Coffee Network Club? &amp; DCC womennetworking womeninbusiness womenempowerment womensupportingwomen networking womeninbiz women bosslady womensupportwomen femaleentrepreneurs doralchamber cityofdoral  ,30504496,Carmenlrealtor,Miami,690,50,,False,False,8342,,,0,0,0.0,0.0,neutral
2021-03-11 23:22:57,1370153299425562630,39-Year-Old Mother Dies After 2nd Dose of Moderna Vaccine: Family  via epochtimes,22442937,TheTybeeTimes,"Tybee Island, GA",1803,363724,,False,False,225745,,,0,1,0.0,0.0,neutral
2021-03-11 23:22:57,1370153298418884616,Women of Miami? Networking Presented by the Coffee Network Club? &amp; DCC womennetworking womeninbusiness womenempowerment womensupportingwomen networking womeninbiz women bosslady womensupportwomen femaleentrepreneurs doralchamber cityofdoral  ,90032503,doralshopping,"Doral, (Miami) Florida",435,0,,False,False,1203,,,0,0,0.0,0.0,neutral
2021-03-11 23:22:57,1370153298167279616,"HamillHimself: Statement by the Twice Impeached Former Guy

I hope everyone remembers when they're getting the COVID-19 (often referred…",2555624924,Amillerbiller95,,192,12047,,True,False,16688,,,1010,0,0.0,0.0,neutral
2021-03-11 23:22:56,1370153297068236800,"GovInslee: In more good news, I am pleased that we will move to the next tier of eligibility earlier than we thought. On March 17, ever…",770973150377115649,JTreezyy_,"Washington, USA",425,29411,,True,False,9222,,,148,0,0.52,0.33999999999999997,positive
2021-03-11 23:22:56,1370153297022218244,Women of Miami? Networking Presented by the Coffee Network Club? &amp; DCC womennetworking womeninbusiness womenempowerment womensupportingwomen networking womeninbiz women bosslady womensupportwomen femaleentrepreneurs doralchamber cityofdoral  ,19356730,doralchamber,"Doral, Florida (Golf Capital)",4702,683,,True,False,25159,,,0,0,0.0,0.0,neutral
2021-03-11 23:22:56,1370153295294181378,Women of Miami? Networking Presented by the Coffee Network Club? &amp; DCC womennetworking womeninbusiness womenempowerment womensupportingwomen networking womeninbiz women bosslady womensupportwomen femaleentrepreneurs doralchamber cityofdoral  ,25796762,doralgolf,Doral (Golf Capital) Florida,3657,1,,False,False,3859,,,0,1,0.0,0.0,neutral
2021-03-11 23:22:56,1370153294279147520,Women of Miami? Networking Presented by the Coffee Network Club? &amp; DCC womennetworking womeninbusiness womenempowerment womensupportingwomen networking womeninbiz women bosslady womensupportwomen femaleentrepreneurs doralchamber cityofdoral  ,2262450709,DoralDecor,"Doral, Florida",73,5,,False,False,175,,,0,0,0.0,0.0,neutral
2021-03-11 23:22:56,1370153294090412039,Women of Miami? Networking Presented by the Coffee Network Club? &amp; DCC womennetworking womeninbusiness womenempowerment womensupportingwomen networking womeninbiz women bosslady womensupportwomen femaleentrepreneurs doralchamber cityofdoral  ,3248264446,SignatureTea,,47,0,,False,False,4238,,,0,0,0.0,0.0,neutral
2021-03-11 23:22:56,1370153293805150210,Women of Miami? Networking Presented by the Coffee Network Club? &amp; DCC womennetworking womeninbusiness womenempowerment womensupportingwomen networking womeninbiz women bosslady womensupportwomen femaleentrepreneurs doralchamber cityofdoral  ,850396781540257793,inDoralMagazine,,11,27,,False,False,20,,,0,2,0.0,0.0,neutral
2021-03-11 23:22:55,1370153292089671681,Women of Miami? Networking Presented by the Coffee Network Club? &amp; DCC womennetworking womeninbusiness womenempowerment womensupportingwomen networking womeninbiz women bosslady womensupportwomen femaleentrepreneurs doralchamber cityofdoral  ,35294596,millionlatinos,Miami (Doral) USA EEUU,997,3,,False,False,3273,,,0,0,0.0,0.0,neutral
2021-03-11 23:22:55,1370153291825434633,Women of Miami? Networking Presented by the Coffee Network Club? &amp; DCC womennetworking womeninbusiness womenempowerment womensupportingwomen networking womeninbiz women bosslady womensupportwomen femaleentrepreneurs doralchamber cityofdoral  ,2875480191,AttorneyMarket,"Doral, FL",50,1,,False,False,3786,,,0,0,0.0,0.0,neutral
2021-03-11 23:22:55,1370153291322167299,Women of Miami? Networking Presented by the Coffee Network Club? &amp; DCC womennetworking womeninbusiness womenempowerment womensupportingwomen networking womeninbiz women bosslady womensupportwomen femaleentrepreneurs doralchamber cityofdoral  ,588990204,TasteofDoral,Doral (Miami) Florida,4027,53,,True,False,5605,,,0,0,0.0,0.0,neutral
2021-03-11 23:22:55,1370153290630098952,Women of Miami? Networking Presented by the Coffee Network Club? &amp; DCC womennetworking womeninbusiness womenempowerment womensupportingwomen networking womeninbiz women bosslady womensupportwomen femaleentrepreneurs doralchamber cityofdoral  ,1945394646,doral,"Doral, FL",1215,15,,False,False,6721,,,0,0,0.0,0.0,neutral
