created,id_str,text,user_id,screen_name,location,followers_count,user_favourites_count,time_zone,geo_enabled,verified,status_count,geo,coords,retweet_count,tweet_favourite_count,Subjectivity,Polarity,Sentiment
2021-03-11 23:19:38,1370152464469565440,azfamily: Arizona kids can get COVID vaccine through Moderna study starting next week:  ,107501328,211arizona,Arizona,1748,24425,,True,False,20141,,,13,0,0.05,0.0,neutral
2021-03-11 23:19:38,1370152463408463872,"deeallan_: So India “donated” us the AstraZeneca, a vaccine that they aren’t distributing to their people and which can cause thrombosi…",1308040067173187584,heyitslakeithra,,625,5989,,False,False,15936,,,6,0,0.0,0.0,neutral
2021-03-11 23:19:37,1370152459604217857,"NPR: In Birmingham, Alabama, a health clinic that primarily serves a lower-income, Black neighborhood has not administered a single dos…",25694859,yaadigal,,28,1232,,False,False,4153,,,190,0,0.3825396825396825,0.05396825396825398,positive
2021-03-11 23:19:36,1370152455875358724,"BarackObama: Michelle and I got vaccinated against COVID-19 because we know it’s the best way to beat this pandemic, protect one anothe…",21261416,dancastellano,Tokyo,380,4343,,True,False,8285,,,10006,0,0.3,1.0,positive
2021-03-11 23:19:35,1370152454160056323,jsolomonReports: Utah woman dies after taking second dose of COVID vaccine | Just The News ,1244311151116197893,CKrulcik,"Martins Ferry, OH",169,12375,,False,False,8684,,,322,0,0.0,0.0,neutral
2021-03-11 23:19:35,1370152452981407745,DaxGigandet First shot of Pfizer so far. Sore arm for a day.,3153303080,Mark1Norton,"Texas, USA",1640,5865,,False,False,3000,,,0,0,0.6666666666666666,0.175,positive
2021-03-11 23:19:35,1370152452671045632,"EricTopol: And Pfizer's press release today with this statement:
""vaccine effectiveness of 94% against asymptomatic SARS-CoV-2 infectio…",314062179,BipolarRunner,Glasgow,621,41884,,True,False,76441,,,96,0,0.0,0.0,neutral
2021-03-11 23:19:35,1370152452528373760,"POTUS: One in four adults in the U.S. has received their first COVID-19 vaccine — and we’re now leading the world in vaccinations.

Tha…",356615196,OfficialJPC,"Dallas, TX",190,868,,True,False,20641,,,16388,0,0.3333333333333333,0.25,positive
2021-03-11 23:19:35,1370152452138311682,JuddLegum: JohnKavanagh_AZ ATT Allstate BCBSAssociation CoxComm WeAreFarmers pfizer UnitedHealthGrp USAA Prudential WellsFar…,1298743290364170240,johnnyx7166,,6,4423,,False,False,168,,,333,0,0.0,0.0,neutral
2021-03-11 23:19:35,1370152451542642689,"ellymelly: This is why you do proper, extensive, long-term trials before unleashing vaccinations on the general public who are not prop…",3238459861,ThisisRaysBlog,,250,132333,,False,False,106490,,,87,0,0.25,0.012500000000000004,positive
2021-03-11 23:19:35,1370152451043627013,"RobertKennedyJr: J&amp;J has announced plans to test the vaccine on newborns, despite vaccine’s risks + strong evidence that COVID poses vi…",3804004282,TitiaDanette45,France,613,29814,,False,False,29390,,,3107,0,0.7333333333333333,0.4333333333333333,positive
2021-03-11 23:19:34,1370152446501122049,"You know, I'm not an anti-vaxer, far from it. But I've been so sick the last 12 months, have done everything poss to get healthy, and still looking at potential surgery. I'm gonna need a lot more than Dutton saying AstraZeneca doesn't cause blood clots for me to believe it.",1206429085448036354,forlornfollower,Montmorency.,257,3398,,False,False,4570,,,0,3,0.653968253968254,0.06428571428571428,positive
2021-03-11 23:19:33,1370152445926461440,FactTank: Half of Black Americans who do not intend to get a coronavirus vaccine say a major reason is that they have seen too many mis…,14837621,timethief,"Salish Sea, B.C.",3607,95019,,False,False,95311,,,9,0,0.4,0.05729166666666667,positive
2021-03-11 23:19:33,1370152445519622148,"CanuckTraveler: LukaszukAB Not just Astra Zeneca but also Janssen J &amp; J.
According to the anti choice/anti vax/anti science crowd, PER…",1253776930525966336,TheMorrigan47,Alberta,617,22690,,False,False,21047,,,2,0,0.0,0.0,neutral
2021-03-11 23:19:33,1370152445251366913,aslavitt46: COVID Vaccination Update: 1 in 4 adults in the U.S. have now received their first vaccine.,18220480,mimamound,"Iowa, USA",168,56533,,True,False,59897,,,6479,0,0.3333333333333333,0.25,positive
2021-03-11 23:19:33,1370152442202107904,"Reuters: Health authorities in Denmark, Norway and Iceland have suspended usage of the COVID-19 vaccine produced by AstraZeneca after r…",62236036,model_daughters,Your Head,19922,108941,,True,False,195421,,,418,0,0.0,0.0,neutral
2021-03-11 23:19:33,1370152441879142403,I just signed up for my Covid vaccine. Hopefully getting pricked within the next 10 days. Hopefully by month's end I'll be even more autistic.,93131679,Wigs4Chibs,A small hamlet ln the midwest,213,3408,,False,False,1460,,,0,7,0.2333333333333333,0.09999999999999999,positive
2021-03-11 23:19:32,1370152441497325568,"BarackObama: Michelle and I got vaccinated against COVID-19 because we know it’s the best way to beat this pandemic, protect one anothe…",16798222,gabzszs,"San Francisco, CA",154,27723,,True,False,10469,,,10006,0,0.3,1.0,positive
2021-03-11 23:19:32,1370152439622463494,"Postcards2WIN: Relief for families ✅
Faster vaccine rollout ✅
Opportunity for all Americans, rather than just the wealthy ✅

",605667542,VELO_2000M,,144,73959,,False,False,51739,,,3,0,1.0,0.5,positive
2021-03-11 23:19:32,1370152439370948615,"POTUS: One in four adults in the U.S. has received their first COVID-19 vaccine — and we’re now leading the world in vaccinations.

Tha…",1517473658,MAJDIYAZJI,"Virginia, USA",3533,11468,,True,False,14747,,,16388,0,0.3333333333333333,0.25,positive
2021-03-11 23:19:32,1370152439190597633,McCkl89: Me after getting my first Covid vaccine and seeing AstraZeneca trending ,2902700033,morgaannj,"London, UK",628,72922,,True,False,7202,,,41,0,0.3333333333333333,0.25,positive
2021-03-11 23:19:31,1370152434266427403,"tonythetiger21 Pfizer ! 
First dose had me flirting with Jesus . We will see how round two goes lol",315584505,drichJunior,,1091,16919,,True,False,34288,,,0,0,0.4777777777777778,0.2833333333333334,positive
2021-03-11 23:19:30,1370152433297588224,"POTUS: One in four adults in the U.S. has received their first COVID-19 vaccine — and we’re now leading the world in vaccinations.

Tha…",1045118377621147649,Gangstafloofbns,"Nashville, TN",30,1955,,False,False,341,,,16388,0,0.3333333333333333,0.25,positive
2021-03-11 23:19:30,1370152431246577666,"Almost started crying when my mom told me as of tomorrow her and my dad are getting their 2nd Moderna shot 😭
(yes, it had been a while since I had called not much is going on in my life 😢)",27573823,dc_heights,DMV (DC/MD/VA),56,38813,,True,False,1684,,,0,0,0.26666666666666666,-0.10000000000000002,negative
2021-03-11 23:19:30,1370152429694676992," DÊ LIKE
2021 Top 8 Vacinas
Brazil SFE Company

NOVAVAX INC
Moderna
BioNTech SE
 Regeneron Pharmaceuticals
Johnson &amp; Johnson
AstraZeneca
Pfizer
Sanofi

Novavax Moderna BioNTech Regeneron Johnson AstraZeneca Pfizer Sanofi ",2956693744,BrazilSFE,"São Paulo, Brasil",95,7767,,False,False,52294,,,0,0,0.5,0.5,positive
2021-03-11 23:19:30,1370152429530968071,"JuddLegum: JohnKavanagh_AZ 3. Kavanaugh, who apparently believes its his job to ensure that ""uninformed"" people do not vote is support…",1298743290364170240,johnnyx7166,,6,4423,,False,False,168,,,564,0,0.35,0.05,positive
2021-03-11 23:19:29,1370152429187137538,epkaufm: Pfizer data from Israel finds vaccine prevents 94% of asymptomatic infections ,3198349443,ferrino100,Belgium,1177,370713,,False,False,167747,,,35,0,0.0,0.0,neutral
2021-03-11 23:19:29,1370152428620939265,"POTUS: One in four adults in the U.S. has received their first COVID-19 vaccine — and we’re now leading the world in vaccinations.

Tha…",15962021,revgle,"Weymouth, MA",649,54418,,True,False,24414,,,16388,0,0.3333333333333333,0.25,positive
2021-03-11 23:19:29,1370152427450667013,epkaufm: Pfizer data from Israel finds vaccine prevents 94% of asymptomatic infections ,192042762,Loran_Fla,,649,10474,,True,False,85509,,,35,0,0.0,0.0,neutral
2021-03-11 23:19:29,1370152426469163008,LLUHealth: We have limited COVID-19 vaccine appointments available for community members who meet current tier eligibility requirements…,1309540390643535872,LLUHPhysicians,"Loma Linda, CA",202,286,,True,False,439,,,3,0,0.31428571428571433,0.10952380952380954,positive
2021-03-11 23:19:28,1370152424820854790,"President Biden signed into law a $1.9 trillion coronavirus relief bill that will provide direct payments to many Americans, extend enhanced jobless aid and disburse funds for vaccine distribution efforts  via WSJ",222365302,EJ_Blair,NJ,1618,9644,,True,False,4142,,,0,1,0.45,0.3,positive
2021-03-11 23:19:28,1370152423600222209,cantpretendtoo: Wife’s Uncle got the Covid vaccine on Friday. Died this morning.  Sad.,855972810824359936,murderof4Crows,https://www.donaldjtrump.com/n,867,12200,,False,False,78069,,,630,0,1.0,-0.5,negative
2021-03-11 23:19:28,1370152422459404292,"POTUS: One in four adults in the U.S. has received their first COVID-19 vaccine — and we’re now leading the world in vaccinations.

Tha…",290345538,xenogears1234,Mesa AZ,317,72703,,True,False,75817,,,16388,0,0.3333333333333333,0.25,positive
2021-03-11 23:19:28,1370152421431914499,christufton: Oxford-AstraZeneca: EU regulator says 'no indication' vaccine linked to blood clots ,1026667650330583040,_abi3J,Jamaica,919,58089,,False,False,9762,,,169,0,0.0,0.0,neutral
2021-03-11 23:19:27,1370152420555292673,"LincolnsBible: My god... I cannot imagine how wretched the vaccine and Covid infection situation in America would be right now, if Jare…",116833829,pmweisser,"Doylestown,Pa USA",2177,15887,,True,False,166800,,,613,0,0.5357142857142857,0.2857142857142857,positive
2021-03-11 23:19:27,1370152420538523656,"inklessPW: In addition to Austria and now Denmark, as of 9 March 2021: Estonia, Lithuania, Luxembourg, Latvia have suspended the AstraZ…",2269522754,John7Istheman,Centre of the universe Toronto,1295,104292,,True,False,131794,,,4,0,0.0,0.0,neutral
2021-03-11 23:19:27,1370152419603124230,"OFCSDistrict: Reminder! There is no school tomorrow, Friday, March 12, to allow Olmsted City Schools staff members the opportunity to r…",172481352,ofmsbulldogs,"Olmsted Falls, OH",1289,8213,,True,False,5749,,,8,0,0.0,0.0,neutral
2021-03-11 23:19:27,1370152419527626752,ColinDMello: NEW: Chief Gordon Beardy of Muskrat Dam confirms to CTVNews that they asked MPP Sol Mamakwa to fly-in and get the Moderna…,83862795,brookscappadoci,"Hamilton, ON, Canada",537,17615,,True,False,12126,,,566,0,0.45454545454545453,0.13636363636363635,positive
2021-03-11 23:19:26,1370152415614353408,"Well I am thankful to the good Lord ,science, Pfizer , and Joe Biden in the fantastic United States of America I will receive my vaccine at 2:20 PM. Hip hip hooray hip hip hooray hip hip i’m getting this shit done and when you can please do it",3432167050,JamesHu92605066,"Winamac, IN",24,149,,True,False,2171,,,0,0,0.7666666666666666,0.30000000000000004,positive
2021-03-11 23:19:26,1370152414314180609,"ABCPolitics: Despite calls for national unity and bipartisanship, President Joe Biden and his top aides have declined to give the Trump…",2950292991,1_InsanePenguin,,71,39391,,False,False,822,,,1083,0,0.5,0.5,positive
2021-03-11 23:19:25,1370152411126448128,MrsKrass NOS AstraZeneca Testfase 3 loopt tot 31-12-2023!,976827638,Zakkenrollen,,523,15279,,True,False,35110,,,0,0,0.0,0.0,neutral
2021-03-11 23:19:25,1370152410866446338,"$MRNA:

New Insider Filing on Moderna, Inc.'s

Director

ELIZABETH G NABEL:

",2344420430,InsiderAlerts4U,United States,5389,0,,False,False,173539,,,0,0,0.45454545454545453,0.13636363636363635,positive
2021-03-11 23:19:25,1370152409096327169,manilabulletin: PH plans to develop its own COVID-19 vaccine  ,1312597446,Emeloujane,Republic of the Philippines,378,25376,,False,False,9289,,,21,0,1.0,0.6,positive
2021-03-11 23:19:25,1370152408404389891,"kayleighmcenany: FINALLY the Biden admin recognizes the Trump admin’s unprecedented vaccine work:

➡️ “We’re grateful for the work that…",1187461131645968391,callowaydragon,United States,221,24634,,False,False,6012,,,4592,0,0.95,0.3,positive
2021-03-11 23:19:24,1370152408303730688,"Received my 1st Moderna vaccine today, so happy!",262728092,billiegarner,,1012,69541,,False,False,8323,,,0,0,1.0,1.0,positive
2021-03-11 23:19:24,1370152408089833476,"FOX13News: 103-year-old Emil Hopner survived the 1918 Spanish Flu pandemic and then the Holocaust, where he lost almost all of his fami…",989135976705425408,PitchAFett,"Oldsmar, FL",1035,60537,,False,False,35285,,,10,0,0.0,0.0,neutral
2021-03-11 23:19:24,1370152406567247875,"The EU’s medicines regulator says there’s no indication the Oxford-AstraZeneca COVID-19 vaccine is linked to an increased risk of blood clots.

It says the number of cases in vaccinated people was no higher than in the general population.

",112514799,Nationwideradio,"6 Bradley Avenue, Kingston",65807,496,,True,False,33747,,,12,13,0.5,-0.03749999999999999,negative
2021-03-11 23:19:24,1370152405799739392,"POTUS: One in four adults in the U.S. has received their first COVID-19 vaccine — and we’re now leading the world in vaccinations.

Tha…",1033123438800658432,DeplorableDonn2,,2105,88941,,True,False,90277,,,16388,0,0.3333333333333333,0.25,positive
2021-03-11 23:19:23,1370152402964332548,donkamion78: 12 Prominent scientists and doctors: Medical regulators should release bold figures of the numbers of people who have died…,105776703,noyade,,327,39044,,False,False,7727,,,191,0,0.5555555555555555,0.27777777777777773,positive
2021-03-11 23:19:23,1370152402549096450,"POTUS: One in four adults in the U.S. has received their first COVID-19 vaccine — and we’re now leading the world in vaccinations.

Tha…",18033503,debkingkent,"Stuart, FL",3307,276794,,False,False,111338,,,16388,0,0.3333333333333333,0.25,positive
2021-03-11 23:19:22,1370152399680139265,"CNBCnow: BREAKING: Biden signs $1.9 trillion Covid relief bill, clearing way for stimulus checks, vaccine aid 
",505116245,Justmemarie2," Manitoba, Canada 🇨🇦",7408,65110,,False,False,245486,,,457,0,0.0,0.0,neutral
2021-03-11 23:19:22,1370152397683720196,"OD_ant: If you die from Covid, but had a comorbidity...you MOST definitely died from Covid.

BUT- if you die from a VACCINE and have a…",1006859665,KLMacRae,United States,4129,260501,,False,False,113166,,,219,0,0.5,0.25,positive
2021-03-11 23:19:22,1370152397226524672,"DoctorEmto: Fake Covid-19 vaccine are on its way to Nigeria.

How you know it's fake? It will be for sale! That's just one of it.

Than…",1174163600384151553,carlijoker,lost my compass ,1559,15910,,False,False,50912,,,21,0,1.0,-0.5625,negative
2021-03-11 23:19:21,1370152395301384204,"kayleighmcenany: FINALLY the Biden admin recognizes the Trump admin’s unprecedented vaccine work:

➡️ “We’re grateful for the work that…",133917545,OoglerE5,,5,548,,False,False,716,,,4592,0,0.95,0.3,positive
2021-03-11 23:19:21,1370152394382831621,"POTUS: One in four adults in the U.S. has received their first COVID-19 vaccine — and we’re now leading the world in vaccinations.

Tha…",1364882322022137858,Boop_Oop_ADoop,East Coast,136,616,,False,False,319,,,16388,0,0.3333333333333333,0.25,positive
2021-03-11 23:19:21,1370152392688275457,"MichelleObama: When you can get the COVID-19 vaccine, I hope you do—Barack and I are certainly glad we did. It’s our best shot at beati…",912748681731993600,djones232232,"Chicago, IL",42,36853,,False,False,10914,,,8132,0,0.65,0.75,positive
2021-03-11 23:19:21,1370152392168243200,TikotheShihTzu I get my second Pfizer on Sunday!!!👍👍👍🤩🤩🤩 I felt fine first shot just a little sore!!!,1268316200490151936,hushpuppy62,,344,72031,,False,False,4508,,,0,1,0.3333333333333333,0.07511393229166669,positive
2021-03-11 23:19:21,1370152391580938247,"DamoPelham3: The story of the Utah mother, 39, that died after 2nd dose of COVID-19 vaccine has been flagged by twitter as misleading.…",1236973841907245056,kiavalyia,"Queensland, Australia",115,18057,,False,False,2410,,,24,0,0.0,0.0,neutral
2021-03-11 23:19:21,1370152391572619265,"Thank you to my new home state of Maine: I received part one of the vaccine today; and being a songwriter, was mandated the Moderna version. Going to stay up late to see what else Dolly can do for me going forward —and not like she hasn’t already done enough. ",630415325,JoeHenryMusic,,8216,5502,,False,True,2190,,,8,212,0.5181818181818182,-0.05454545454545454,negative
2021-03-11 23:19:20,1370152390977060864,PhaboDidIt Well I don’t have a choice lol the location my appointment is at gives the Pfizer one,70944725,tjh26,Chicago,447,10402,,True,False,7777,,,0,0,0.7,0.8,positive
2021-03-11 23:19:20,1370152390498861057,"votolatino: BREAKING: POTUS signed the COVID relief bill which includes:

-$1,400 checks for most Americans
-$300/wk jobless benefits…",1099507634460377091,lesliempalomino,"Georgia, USA",170,664,,True,False,1718,,,31,0,0.5,0.5,positive
2021-03-11 23:19:20,1370152387529310209,"NPR: In Birmingham, Alabama, a health clinic that primarily serves a lower-income, Black neighborhood has not administered a single dos…",953082495221682177,LenoreO87181935,,13,15589,,False,False,1234,,,190,0,0.3825396825396825,0.05396825396825398,positive
2021-03-11 23:19:19,1370152386665144326,jsolomonReports: Utah woman dies after taking second dose of COVID vaccine | Just The News ,4436941214,StephaneAtkins7,Central California ,502,70442,,False,False,38101,,,322,0,0.0,0.0,neutral
2021-03-11 23:19:19,1370152386585620483,mariamainmo: Girls don't want boys. They want the covid vaccine and a nice apartment,601437323,_sophiamarie34,,644,28849,,True,False,29423,,,25183,0,1.0,0.6,positive
2021-03-11 23:19:19,1370152385843187713,"DaxGigandet i had brief chills the first night of the moderna vaccine, and mild body aches for 2 days. Ibuprofen relieved the body aches.",2339922402,regieford1,,837,72870,,False,False,121641,,,0,0,0.38888888888888884,0.19444444444444442,positive
2021-03-11 23:19:19,1370152384563908616,Using BMI as a high-risk trait for severe covid is a clever way to convince the entire population they'll get the vaccine sooner than the rest of the population.,928779343148584960,Alex_Grimaudo,"Blacksburg, VA",228,2326,,False,False,436,,,0,1,0.7291666666666667,0.08333333333333333,positive
2021-03-11 23:19:19,1370152383968391170,"GEsfandiari: Iran has received 125,000 doses of COVAXIN from India

Health ministry spox Jahanpour says in total 695,000 doses of vacci…",49702592,barbaraslavin1,"Washington, DC",31963,6530,,False,False,73056,,,20,0,0.75,0.0,neutral
2021-03-11 23:19:18,1370152383075004416,"Reuters: Health authorities in Denmark, Norway and Iceland have suspended usage of the COVID-19 vaccine produced by AstraZeneca after r…",1302955945933312001,M_bluwi26,"Riyadh, Kingdom of Saudi Arabia",25,304,,False,False,442,,,418,0,0.0,0.0,neutral
2021-03-11 23:19:18,1370152381472776194,"MichelleObama: When you can get the COVID-19 vaccine, I hope you do—Barack and I are certainly glad we did. It’s our best shot at beati…",468009870,ErykahAnderson,"Houston, TX",1211,31082,,True,False,15473,,,8132,0,0.65,0.75,positive
2021-03-11 23:19:18,1370152380323495936,"POTUS: One in four adults in the U.S. has received their first COVID-19 vaccine — and we’re now leading the world in vaccinations.

Tha…",899141562344624129,jayaye278,,74,15318,,False,False,3088,,,16388,0,0.3333333333333333,0.25,positive
2021-03-11 23:19:18,1370152380029886467,danieteebee: It’s completely predictably American that the brand of COVID vaccine you have access to has now become a class signifier,536427487,TurboTayrob,"Detroit, MI",71,4241,,True,False,3967,,,10890,0,0.0,0.0,neutral
2021-03-11 23:19:17,1370152378041835522,"MichelleObama: When you can get the COVID-19 vaccine, I hope you do—Barack and I are certainly glad we did. It’s our best shot at beati…",841217296588767232,FlyBelles,,46,9980,,False,False,8811,,,8132,0,0.65,0.75,positive
2021-03-11 23:19:16,1370152374329806856,"EUAmbUS: The facts on EU vaccine exports: 34M doses; 31 countries:

UK: 9.1M
Canada: 3.9M
Mexico: 3.1M 
Japan: 2.7M
Saudi Arabia: 1.4M…",418526024,CianHogan2,"Dublin City, Ireland",1749,33798,,True,False,20739,,,31,0,0.0,0.0,neutral
2021-03-11 23:19:16,1370152373117718531,"naomirwolf: Ok: Switzerland, Italy, Austria, Latvia, Lithuania, Estonia, Luxembourg, Iceland, South Africa, Norway, Denmark have all su…",1255971722886631431,KathyK4th,,181,29326,,False,False,8052,,,936,0,0.5,0.5,positive
2021-03-11 23:19:16,1370152371356057600,"thedailybeast: Trump puts out a sad statement on presidential letterhead pleading for credit for COVID vaccine
",250397837,ivery5000,Everywhere     ,6681,421487,,True,False,105442,,,385,0,1.0,-0.5,negative
2021-03-11 23:19:16,1370152371062378496,"HighWireTalk: ""Denmark has suspended the use of the Oxford-AstraZeneca COVID vaccine in a precautionary move, citing concerns that it c…",3180231871,StormqueenPaula,,25,1868,,False,False,1442,,,344,0,0.0,0.0,neutral
2021-03-11 23:19:15,1370152370064199681,747_s: arendtiana DrP_MD petelincoln48 PhilHollowayEsq naomirwolf and now this  ,752132234681917440,keith_caughran,"Charlotte, NC",120,557,,False,False,6973,,,39,0,0.0,0.0,neutral
2021-03-11 23:19:15,1370152367375679488,"lewis_goodall 

""Covid vaccines"" are going to wipe out your immune system for ever.

This ""vaccine"" roll out must be stopped right now.

",1369319255083257861,flumffle,,39,948,,False,False,1440,,,0,0,0.5357142857142857,0.2857142857142857,positive
2021-03-11 23:19:14,1370152366197112832,coop22089074: Trump Reminds Americans COVID Vaccine Created Under His Leadership ,986715151595458560,coop22089074,"Griffin, Georgia",85,15,,False,False,176230,,,1,0,0.0,0.0,neutral
2021-03-11 23:19:14,1370152364922040321,jsolomonReports: Utah woman dies after taking second dose of COVID vaccine | Just The News ,623780427,maryloupatey,,304,84216,,True,False,39871,,,322,0,0.0,0.0,neutral
2021-03-11 23:19:13,1370152358936780810,"NPR: In Birmingham, Alabama, a health clinic that primarily serves a lower-income, Black neighborhood has not administered a single dos…",154941779,MikeReeseM,"Katy,Texas,USA",4439,111001,,True,False,514771,,,190,0,0.3825396825396825,0.05396825396825398,positive
2021-03-11 23:19:13,1370152358894780418,ArlFreeClinic: Need help pre-registering for a COVID-19 Vaccine? You can find help at these pop-up events! ,72598545,stephbhopkins,"Springfield, VA",431,909,,True,False,3123,,,4,0,0.0,0.0,neutral
2021-03-11 23:19:13,1370152358483738627,"POTUS: One in four adults in the U.S. has received their first COVID-19 vaccine — and we’re now leading the world in vaccinations.

Tha…",841217296588767232,FlyBelles,,46,9980,,False,False,8811,,,16388,0,0.3333333333333333,0.25,positive
2021-03-11 23:19:12,1370152357040951296,"Reuters: Health authorities in Denmark, Norway and Iceland have suspended usage of the COVID-19 vaccine produced by AstraZeneca after r…",877951780470104064,JOSHUAJREYNOLD1,,628,454328,,False,False,431018,,,418,0,0.0,0.0,neutral
2021-03-11 23:19:12,1370152356386590720,Moderna And Pfizer On Track To Hit Vaccine Production Goals ,1159189340561530881,Jessmarkowitz2,Grosse Pointe,37,0,,False,False,8115,,,0,0,0.0,0.0,neutral
2021-03-11 23:19:12,1370152356168531969,aslavitt46: COVID Vaccination Update: 1 in 4 adults in the U.S. have now received their first vaccine.,1038504328770842626,Whenindublin1,"Dublin City, Ireland",1,50,,False,False,29,,,6479,0,0.3333333333333333,0.25,positive
2021-03-11 23:19:12,1370152355702865923,"BBC News - Oxford-AstraZeneca: EU regulator says 'no indication' vaccine linked to blood clots
",1715434532,cestleiden,,20,0,,False,False,32492,,,0,0,0.0,0.0,neutral
2021-03-11 23:19:12,1370152354834751495,"AniMat505: In Canada, we dedicated today as a day of remembrance of the lives we have lost due to the COVID-19 pandemic. Until we all g…",1263482541392134151,DavidMe21879178,,27,5260,,False,False,5452,,,41,0,0.375,-0.125,negative
2021-03-11 23:19:12,1370152354406862853,"celliottability quick question. I am a transplant recipient and I am supposed to have priority in stage 2. I am 51 years old and could get the AstraZeneca vaccine, but shoppers drug Mart says I am too young. Why can I not get the AstraZeneca vaccine now?",807377239,br_stephen,,2,1,,False,False,4,,,0,0,0.3666666666666667,0.17777777777777778,positive
2021-03-11 23:19:12,1370152353949741062,mgscarsbrook: Astrazeneca 💉 has just been halted in Denmark: “Danish health authorities announced they had temporarily stopped administ…,400463559,2Apatriot74,"Monroe, NJ",125,2101,,True,False,1153,,,375,0,0.0,0.0,neutral
2021-03-11 23:19:12,1370152353920339968,"BarackObama: Michelle and I got vaccinated against COVID-19 because we know it’s the best way to beat this pandemic, protect one anothe…",1284144582,gigicalesso,,225,919,,False,False,10069,,,10006,0,0.3,1.0,positive
2021-03-11 23:19:11,1370152353094115338,"BarackObama: Michelle and I got vaccinated against COVID-19 because we know it’s the best way to beat this pandemic, protect one anothe…",4566153854,PaulaRaikkonen,,50,21314,,False,False,9874,,,10006,0,0.3,1.0,positive
2021-03-11 23:19:11,1370152352351723522,"bjornhamland: Norway gives away 677,000 doses of COVID19 vaccine for distribution in lower-income countries. Most of these are AstraZe…",1222917945581547522,AxelleEbode,,124,3503,,False,False,1875,,,8,0,0.5,0.5,positive
