created,id_str,text,user_id,screen_name,location,followers_count,user_favourites_count,time_zone,geo_enabled,verified,status_count,geo,coords,retweet_count,tweet_favourite_count,Subjectivity,Polarity,Sentiment
2021-03-11 23:21:31,1370152940569128961,"Dr. Swamy39 jee :

Denmark and Norway temporarily suspend AstraZeneca vaccine over blood clot concerns (Sky News Australia) 🌟💥

",1090510399324090369,Dharma2X,,7880,100,,False,False,53167,,,1,1,0.0,0.0,neutral
2021-03-11 23:21:31,1370152938908307458,I have a simple solution for Mitch and his minions for the horrific cost of the Covid Relief plan. Don’t give the money to any Republican voter.  Don’t give the Covid vaccine to any militia member or sympathizers. That should improve the US gene pool.,4443141209,PollackGretchen,Berea Ohio,9,2803,,False,False,56,,,0,0,0.6785714285714286,-0.5,negative
2021-03-11 23:21:31,1370152936869920770,"More now: Nine countries have suspended the AstraZeneca vaccine due to blood clots. Iceland, Norway, Denmark, South Africa, Italy, Austria, Lithiania, and Estonia ",58330119,Chillrelaxed,Atlanta,930,1738,,False,False,14711,,,0,0,0.4375,0.1875,positive
2021-03-11 23:21:30,1370152936194592769,"Meidas_RedPanda Hope you have no issues.  My husband got the moderna vaccine and no issues at all- his arm was a little sore, but that’s it.",700800671453487104,EllaTho23423177,"Florida, USA",66,7438,,False,False,6253,,,0,0,0.5,-0.1875,negative
2021-03-11 23:21:30,1370152935276023809,"simondolan: Nothing to see here. Move along. Perfectly safe....

Italy and Norway join Denmark in suspending use of AstraZeneca vaccine…",21696802,flackster,Middle-earth,1768,14258,,True,False,31767,,,894,0,0.5,0.5,positive
2021-03-11 23:21:30,1370152934634369024,timesuppeeps: AstraZeneca Vax rollout halted due to Safety concerns. Previously healthy people developed life threatening blood clots s…,1333165868780580867,TobiasCooper16,,17,6553,,False,False,1952,,,191,0,0.39166666666666666,0.15833333333333333,positive
2021-03-11 23:21:30,1370152933883514893,"As Denmark stop the Oxford vaccine roll out as they fear it may cause blood clots, our government put out a tv and radio campaign on strokes and how to spot the early signs. FFS it hard being alive today. oxfordastrazeneca BOLLOCKS AstraZeneca CovidVaccine COVID19Vaccine",1030535731054358528,ISAYWHATIWANT19,Fingeringaho Essex,64,5463,,False,False,4766,,,0,0,0.4138888888888889,-0.030555555555555558,negative
2021-03-11 23:21:30,1370152933359226882,"Public_Citizen: 9 out of 10 people in poor countries won't have access to a COVID vaccine next year. 

Meanwhile, rich countries have h…",740293626190651394,klevin_baoteng,,164,65752,,False,False,3700,,,270,0,0.45,-0.00833333333333334,negative
2021-03-11 23:21:29,1370152932419719170,Can’t tell if I’m tired because I’m old and cranky or if I’m tired as a side effect from my covid vaccine from earlier today ,1276700622679617536,Deythetaco,,34,91,,False,False,99,,,0,1,0.5249999999999999,-0.17500000000000002,negative
2021-03-11 23:21:29,1370152928971948032,B52Malmet: This is a real world study from Israel that has a lot of weight.  ,760492920,JOSE92768183,,187,117162,,True,False,99906,,,34,0,0.30000000000000004,0.2,positive
2021-03-11 23:21:28,1370152927441080323,washingtonpost I give Trump’s  Team   less than 1/3  credit for Covid response/ no plan .. the rest and crossing the finish line is all  team Biden .Trump team had a weak distribution plan and no plan whatsoever to get vaccine into the arms of people.,174799435,memehoward,,1193,17424,,True,False,44111,,,0,3,0.3458333333333333,-0.2708333333333333,negative
2021-03-11 23:21:28,1370152927097200641,Wilnerness Or maybe we should follow up on cases of possible side effects before making statements like this? ,336196788,MaheshNYCTO,Brooklyn via Toronto,112,25247,,True,False,30211,,,0,4,1.0,0.0,neutral
2021-03-11 23:21:28,1370152926035972096,Thousands of seniors in Chicago public housing get their first dose of COVID-19 vaccine: ‘I can’t wait to see my family’ ,18915579,ChicagoBreaking,Chicago,188969,168,,False,False,116795,,,1,12,0.19999999999999998,0.125,positive
2021-03-11 23:21:28,1370152925599825925,My COVID vaccine antenna grew in! Not as uncomfortable as you'd think. ,3314484947,Qualekk,,23,12732,,False,False,196,,,0,0,1.0,-0.5,negative
2021-03-11 23:21:28,1370152925486534661,"89_91Ali goldenlily2017 Yes, 3 friends of mine had the same batch of Astra Zeneca on Saturday and were fine, depends on the patient i think 👍",875265315793502208,AlanLam84206487,"Dalton-in-Furness, England",3221,44521,,True,False,8198,,,0,1,0.3125,0.20833333333333334,positive
2021-03-11 23:21:27,1370152921460051968,"davidkurten: Seven European countries suspend use of Astra Zeneca Covid vaccine after blood clot deaths.
I will not be taking a 'Covid…",1300494900136472577,ittibittikitti,Hit and Run Tweeter,131,11746,,False,False,3647,,,819,0,0.0,0.0,neutral
2021-03-11 23:21:26,1370152919476150272,"POTUS: One in four adults in the U.S. has received their first COVID-19 vaccine — and we’re now leading the world in vaccinations.

Tha…",257281892,CASSIDYHARRIS_,"Avon, OH",2126,44103,,True,False,40641,,,16388,0,0.3333333333333333,0.25,positive
2021-03-11 23:21:26,1370152919438389249,"senpizzo: COVID death rate in our prisons is about 80% higher, than outside. 

Not one single vaccine has been offered to Florida inmat…",1014724810935623682,GlendaH26016842,"Oklahoma, USA",390,88476,,True,False,128415,,,2340,0,0.2547619047619048,0.05952380952380953,positive
2021-03-11 23:21:26,1370152917840359425,"CDCgov: If you get a COVID19 vaccine, wait at least 14 days before getting any other vaccine, including those for flu or shingles. If…",31858362,antoniodivine,"Miami, FL, USA",1591,89995,,True,False,144372,,,379,0,0.3875,-0.2125,negative
2021-03-11 23:21:26,1370152917513080832,"BCschoolCovid: “Dr. Jorg Fritz, an immunologist at McGill University, says he shares the concerns raised in the letter, likening the de…",1157395568135557120,DavidWa59907969,,619,11436,,False,False,44402,,,10,0,0.0,0.0,neutral
2021-03-11 23:21:26,1370152915957125122,As with the earlier pause in Austria&gt;it cannot be concluded whether there is a link between the vaccine and the blood clots ,879377928253050880,badc0fee,,158,64268,,False,False,62218,,,0,0,0.5,0.0,neutral
2021-03-11 23:21:26,1370152915902590977,"NBCNews: BREAKING: President Biden signs $1.9T Covid relief bill into law; ​includes $1,400 checks, $300/wk jobless benefits, child all…",612057704,ManMet80,,33122,957316,,False,False,1009820,,,2366,0,0.0,0.0,neutral
2021-03-11 23:21:25,1370152915164409856,"I will setup groove funnels moosend infusionsoft  aweber zendesk and sendinblue  

TrudeauWorstPMEver OLYARS WorldKidneyDay AstraZeneca ASTRO SupaKomando dragonsden BBNaijaHighlights KenyaInanitosha BigBrotherNaija LoveIslandSA TwitchStreamers",1329749874485682177,d_mayokun,,174,6691,,False,False,483,,,1,0,0.0,0.0,neutral
2021-03-11 23:21:25,1370152913583009792,HighWireTalk: The Italian Medicines Agency (AIFA) Thursday banned nationwide the use of a batch of the AstraZeneca COVID-19 vaccine due…,14597149,tltconsulting,Canada,3906,5395,,False,False,20337,,,441,0,0.0,0.0,neutral
2021-03-11 23:21:25,1370152911733288961,"POTUS: One in four adults in the U.S. has received their first COVID-19 vaccine — and we’re now leading the world in vaccinations.

Tha…",1292341826095968258,ReikoSaito5,"Niigata, Japan",11,250,,False,False,72,,,16388,0,0.3333333333333333,0.25,positive
2021-03-11 23:21:24,1370152911464960005,"Fauci wouldn't lie, would he?
A must watch.😜
Eugenio Derbez interviews Dr Fauci about concerns with the covid vaccine...  via YouTube",1202187902794551296,drholzmichl,🔮,10,88,,False,False,228,,,0,0,0.0,0.0,neutral
2021-03-11 23:21:24,1370152911385341956,"LisatheSimpson BFujer Thromboembolic events in vaccinated people was no higher than that seen in the general population. As of 10 March, 30 cases of thromboembolic events had been reported among the five million people given the AstraZeneca vaccine in the EEA.
",2814530771,Pierssy,Forest of Dean UK,1080,100452,,True,False,114394,,,0,6,0.5,-0.03749999999999999,negative
2021-03-11 23:21:24,1370152910638710785,"OD_ant: If you die from Covid, but had a comorbidity...you MOST definitely died from Covid.

BUT- if you die from a VACCINE and have a…",1485346628,JoanPicker,,54,1833,,False,False,557,,,219,0,0.5,0.25,positive
2021-03-11 23:21:24,1370152908201861124,danieteebee: It’s completely predictably American that the brand of COVID vaccine you have access to has now become a class signifier,3195300932,asailingspecter,,8,12321,,False,False,6951,,,10889,0,0.0,0.0,neutral
2021-03-11 23:21:24,1370152908054880257,"IndianEmbassyTR: Pakistan🇵🇰, the only SAARC country to not seek COVID-19 Vaccine from India, is getting 45 million 🇮🇳 made vaccine Covi…",1120409854051373056,BhakkkBhosdike,Shimla 🌨️,241,71244,,False,False,46180,,,3055,0,1.0,0.0,neutral
2021-03-11 23:21:23,1370152906771599360,sheeraf: Went into reporting this story wondering how much Covid vaccine misinformation we would actually find in communities of color.…,980841944,DianeEugenio,"Florida, USA",407,301691,,True,False,286770,,,46,0,0.15000000000000002,0.1,positive
2021-03-11 23:21:23,1370152906301792261,"Got the Pfizer shot today, was easier than a flu shot. I was looking at something and didn't even realize was already in. No side effects so far.",1059584005551673344,WTeach2,"Raleigh, NC",328,1312,,False,False,23131,,,0,2,1.0,0.1,positive
2021-03-11 23:21:23,1370152905966297097,"awgaffney: While plunging cases &amp; the vaccine rollout are heartening, let’s not forget that tens of thousands of people are in the hosp…",2775180295,eaton_sandy,"Quincy, Massachusetts, USA",2721,6068,,True,False,11091,,,11,0,0.0,0.0,neutral
2021-03-11 23:21:23,1370152905383157762,"POTUS: One in four adults in the U.S. has received their first COVID-19 vaccine — and we’re now leading the world in vaccinations.

Tha…",71934826,Bonnie_219,,1356,297949,,True,False,95697,,,16388,0,0.3333333333333333,0.25,positive
2021-03-11 23:21:23,1370152905152532481,"kayleighmcenany: FINALLY the Biden admin recognizes the Trump admin’s unprecedented vaccine work:

➡️ “We’re grateful for the work that…",29377231,Stan_Stinson,"Enterprise, AL",3039,39487,,False,False,103718,,,4592,0,0.95,0.3,positive
2021-03-11 23:21:23,1370152903785263104,"POTUS: One in four adults in the U.S. has received their first COVID-19 vaccine — and we’re now leading the world in vaccinations.

Tha…",1093640489834897410,brady486,,12,2756,,False,False,1202,,,16388,0,0.3333333333333333,0.25,positive
2021-03-11 23:21:22,1370152902971510785,"tweettruth2me 
Utah mom Kassidi Kurill dies four days after second dose of Moderna vaccine  via nypost",1036439435733295105,Bama951,Bama,75,8620,,False,False,3343,,,0,0,0.0,0.0,neutral
2021-03-11 23:21:22,1370152901641838595,39-Year-Old Healthy Mother from Utah Dies After Second Dose of Moderna Vaccine - The True Defender ! ,1258389339341336582,LoveDJT2021,,19,208,,False,False,348,,,1,2,0.3833333333333333,0.3125,positive
2021-03-11 23:21:21,1370152898869530625,Nanjala1: And yet it's worth noting that about 2000 South Africans and an unconfirmed number of Kenyans participated in the clinical tr…,198407890,TeresaLubano,"Nairobi, Kenya",353,2423,,True,False,2486,,,18,0,0.1,0.3,positive
2021-03-11 23:21:21,1370152898764574723,"ColinDMello A friend of mine, who is Metis, got her COVID-19 vaccine from Metis Nation as a priority group. She is keeping that info on quiet for fear of backlash...thinking any indigenous person is ""jumping the line"" is a racially charged accusation.",2559481274,KdCoates2017,Here or There,156,4883,,True,False,3568,,,0,5,0.3333333333333333,0.0,neutral
2021-03-11 23:21:21,1370152898169081858,"berthahidalgo The first Moderna shot I went to bed early, the second hit me a smidge harder.  Still easier than giving blood last week.",895152176967827456,TheTimidToucan,"Alabama, USA",17,1888,,False,False,847,,,0,1,0.13999999999999999,0.049999999999999996,positive
2021-03-11 23:21:21,1370152894947803138,timesuppeeps: AstraZeneca Vax rollout halted due to Safety concerns. Previously healthy people developed life threatening blood clots s…,1194645969582854144,HPVSideEffects,,2634,5686,,False,False,3318,,,191,0,0.39166666666666666,0.15833333333333333,positive
2021-03-11 23:21:20,1370152894641500163,Moderna And Pfizer On Track To Hit Vaccine Production Goals ,779706654363414528,HarleyVicQuinn,,1069,140955,,False,False,90442,,,0,0,0.0,0.0,neutral
2021-03-11 23:21:20,1370152894444544003,Anyone else get a sore throat after their first Covid vaccine dose? Specifically Pfizer?,14551524,itsmolly,Home-UGA-ATL-BOS-PHL-CLT-Home,585,10789,,True,False,22694,,,0,1,0.3333333333333333,0.25,positive
2021-03-11 23:21:20,1370152892494090241,Have to ask my dr if he thinks I qualify as ~high risk~ bc apparently two immunoglobulin deficiencies and taking immunosuppressants does not make one explicitly eligible for the covid vaccine 🙃,3303641618,_alikazam,"Los Angeles, CA",394,39436,,True,False,12174,,,0,4,0.44499999999999995,0.10500000000000001,positive
2021-03-11 23:21:20,1370152892414496770,moolie61 Moderna is working with IBM vaccine passports &amp; tracking Give is in talks with IBM 🤮,3087448180,janet_cutts, Dorset UK ,4770,223641,,False,False,206296,,,0,0,0.0,0.0,neutral
2021-03-11 23:21:20,1370152892280147968,"KatyTurNBC: One year of COVID. 
Seven months pregnant. 
First shot of Pfizer. ",121907763,sharontokki,🇲🇾 말레이지아,2449,87960,,False,False,127327,,,453,0,0.41666666666666663,0.29166666666666663,positive
2021-03-11 23:21:19,1370152887188385803,Atul_Gawande: Large-scale vaccination sites have turned out to be a vital element of COVID-19 vaccine distribution. We explain why in t…,1110230570,stack_janton99,"Atlanta, GA/Guildford, UK",2179,317808,,True,False,48446,,,45,0,0.4,0.1,positive
2021-03-11 23:21:18,1370152885237989397,"SandraWeeden: Oxford/AstraZeneca suspended.

Denmark joins five other countries - Austria, Estonia, Lithuania, Luxembourg and Latvia -…",1236982476997824513,CovidRights,Dexamethasone is TX ,170,5996,,False,False,6105,,,770,0,0.375,-0.125,negative
2021-03-11 23:21:18,1370152882327101441,"GovInslee: In more good news, I am pleased that we will move to the next tier of eligibility earlier than we thought. On March 17, ever…",740770350565314560,EricasDesk,‘Murica,133,5464,,False,False,749,,,148,0,0.52,0.33999999999999997,positive
2021-03-11 23:21:17,1370152882058756096,CanDisParPro: 71% of Canadians w/disabilities surveyed intend to get a COVID vaccine. We want to hear from the other 29%. What are your…,3411328251,stumcreynolds,"Toronto, Ontario",365,3219,,False,False,373,,,9,0,0.375,-0.125,negative
2021-03-11 23:21:17,1370152879974084608,"Moderated by FortuneMagazine reporter davidzmorris, this panel discussion will cover:

📌 How to prepare for COVIDvaccine distribution?
📌 How technology plays an essential role?
📌 What challenges lie ahead in America’s vaccination efforts?

Register:  ",122151657,Formstack,"Fishers, Indiana",6695,3875,,False,True,20677,,,0,1,0.3,0.0,neutral
2021-03-11 23:21:17,1370152879491706885,"etrnalsnshine My mother-in-law and grandmother-in-law just got the AstraZeneca shot in India last week. More than 20 million people have received it there. I don’t think there’s any reason at this point to be afraid of it, but that’s a personal decision.",100150340,girlwithlatte,Four Seasons Total Landscaping,678,78228,,False,False,6168,,,0,0,0.4416666666666667,-0.024999999999999994,negative
2021-03-11 23:21:15,1370152872558665734,"BreesAnna Listen to the 2nd hour of Richie Allen’s show today, Thursday. 2 fleet st journalists telling of stories of adverse events and deaths following vaccination, but that newspapers won’t go near the stories. One said the Pfizer vax contained an ingredient used in lethal injection",1334423874423955458,Electri51782394,,1,57,,False,False,135,,,0,0,0.16666666666666666,0.03333333333333333,positive
2021-03-11 23:21:15,1370152872420184064,jctangmd CdnWIM ResidentDoctors OntariosDoctors FMWCanada Those shirts win for best Covid vaccine shirts!,1115301033796829185,CanadianKayMD,"Ontario, Canada",3653,24525,,True,False,15140,,,0,2,0.35,0.9,positive
2021-03-11 23:21:15,1370152869786226689,Fear of Covid: a disease with 99.997% survival rate in Ghana might lead people to their potential deaths !! Sigh!! Stop AstraZeneca and let’s get StopVaccinationsNow trending now ,1138810156052111363,GhanaSocialU,Ghana,19641,26901,,True,False,28071,,,6,11,1.0,0.0,neutral
2021-03-11 23:21:14,1370152868372570116,chngin_the_wrld AstraZeneca Have there been more then two waves historically? Or is it because this virus mutates so much? Forgive my ignorance.,2932844904,LSAneta,,150,24085,,False,False,5588,,,0,0,0.2333333333333333,0.2333333333333333,positive
2021-03-11 23:21:14,1370152867194150918,aslavitt46: COVID Vaccination Update: 1 in 4 adults in the U.S. have now received their first vaccine.,928734181667913728,maryama_aba,"Michigan, USA",25,180,,False,False,344,,,6479,0,0.3333333333333333,0.25,positive
2021-03-11 23:21:14,1370152866833428488,GinaWatss: Why do antivaxxers always forward the 1 or 2 horror stories related to covid vaccine but ignore the MILLIONS of people who a…,47431546,NavyCeelz,JA.,1212,27355,,True,False,190567,,,68,0,0.4,0.0,neutral
2021-03-11 23:21:13,1370152865101193216,netpoette: Iceland is also suspending use of the AstraZeneca-Oxford vaccine until more information becomes available from the European…,3032352520,ellecalendula,UK,265,3607,,False,False,3735,,,7,0,0.45,0.45,positive
2021-03-11 23:21:13,1370152863469432833,"NBCNews: Pfizer's Covid-19 vaccine cuts transmission of the coronavirus, new real-world study shows. ",856954702616969216,LarissaWakeF,"Lacey, WA",69,22762,,False,False,25715,,,64,0,0.45454545454545453,0.13636363636363635,positive
2021-03-11 23:21:13,1370152863091978244,orchidtreks: my immune system recognizing covid after i get the vaccine ,3100836001,BarkBarkGrr,,421,80574,,False,False,14405,,,5,0,0.0,0.0,neutral
2021-03-11 23:21:12,1370152861175328775,"kevint905: Denmark becomes 6th European state to suspend use of AstraZeneca vaccine over blood clot fears 
",800335452079173636,nataliacafolla1,Earth ,77,29589,,True,False,8383,,,22,0,0.0,0.0,neutral
2021-03-11 23:21:12,1370152860386754561,goldenlily2017: If you had the chance of getting a covid vaccine tomorrow would you take it and which one would you have? Mam is feelin…,1113996986754191360,Barbara72191459,,500,37129,,False,False,30679,,,26,0,0.0,0.0,neutral
2021-03-11 23:21:12,1370152858843115520,"Heathfritillary: Denmark is now the seventh European country to halt the Covid-19 vaccine, AstraZeneca. It is believed the vaccine poss…",563283632,ResetStandby,"Downtown, Canada",677,12928,,False,False,10381,,,6,0,0.0,0.0,neutral
2021-03-11 23:21:11,1370152856490156032,HighWireTalk: The Italian Medicines Agency (AIFA) Thursday banned nationwide the use of a batch of the AstraZeneca COVID-19 vaccine due…,1057088310726651904,IFilonczuk,,73,31197,,False,False,56029,,,441,0,0.0,0.0,neutral
2021-03-11 23:21:11,1370152854539882497,"kayleighmcenany: FINALLY the Biden admin recognizes the Trump admin’s unprecedented vaccine work:

➡️ “We’re grateful for the work that…",708836944029941760,ClareIN_CALI,,1396,158080,,True,False,234028,,,4592,0,0.95,0.3,positive
2021-03-11 23:21:11,1370152854313402370,jsolomonReports: Utah woman dies after taking second dose of COVID vaccine | Just The News ,1353055124025827328,Liberta31841399,,410,7603,,False,False,5513,,,322,0,0.0,0.0,neutral
2021-03-11 23:21:11,1370152853151621120,"ObamaFoundation: “This vaccine means hope.” —BarackObama coming together with TheBushCenter, BillClinton, and CarterCenter.

The be…",3953962152,KatherineAbra,,302,15691,,False,False,2068,,,184,0,0.0,0.0,neutral
2021-03-11 23:21:10,1370152852518285315,"BarackObama: Michelle and I got vaccinated against COVID-19 because we know it’s the best way to beat this pandemic, protect one anothe…",1593726798,mrmurray1029,,49,42416,,True,False,43620,,,10006,0,0.3,1.0,positive
2021-03-11 23:21:10,1370152851775885317,Third of people in England have Covid antibodies as case rates continue to fall ,16973333,Independent,"London, England",3530898,53,,False,True,1096283,,,12,33,0.0,0.0,neutral
2021-03-11 23:21:10,1370152849439612933,jsolomonReports: Utah woman dies after taking second dose of COVID vaccine | Just The News ,2305563439,haleywofford1,,284,195662,,False,False,100457,,,322,0,0.0,0.0,neutral
2021-03-11 23:21:10,1370152848726626306,MSNBC: Opinion | TheRevAl: Black Americans are being called out for Covid-19 vaccine skepticism. But the greater problem is access to…,130932192,santafefran,"Santa Fe, NM",622,121315,,True,False,267304,,,27,0,0.4666666666666667,0.16666666666666669,positive
2021-03-11 23:21:09,1370152847707414530,"POTUS: One in four adults in the U.S. has received their first COVID-19 vaccine — and we’re now leading the world in vaccinations.

Tha…",487686275,JayTheresaO,,686,15811,,False,False,142108,,,16388,0,0.3333333333333333,0.25,positive
2021-03-11 23:21:09,1370152845736034305,davematt88: I talked to somebody in law enforcement today. They told me that they didn't believe that covid-19 was deadly. That it was…,1020834536777822210,radioguy181,"Owings Mills, MD",3644,105162,,False,False,51081,,,129,0,0.4,-0.2,negative
2021-03-11 23:21:08,1370152844406439938,"POTUS: One in four adults in the U.S. has received their first COVID-19 vaccine — and we’re now leading the world in vaccinations.

Tha…",1828914624,JDE716,"Buffalo, NY",51,10494,,False,False,3337,,,16388,0,0.3333333333333333,0.25,positive
2021-03-11 23:21:08,1370152843961860096,"EricMMatheny: Vaccination is not a political talking point. It’s a matter of choice. The truth is, the Covid vaccine was approved very…",1063277316200108033,HawksNe54023420,,1629,3622,,False,False,7986,,,306,0,0.1,0.0,neutral
2021-03-11 23:21:08,1370152843068461058,hushpuppy62 Pretty much the same here. I received the Pfizer as well. Get the second dose in 3 weeks. Flu like aches and pains currently.,1172977409429311493,TikotheShihTzu,"Wherever your at,there you are",2082,60268,,True,False,15023,,,0,1,0.34500000000000003,0.09,positive
2021-03-11 23:21:08,1370152842699362307,Had Pfizer Round 1 today.  Definitely feeling light-headed.  Luckily there's a Leafs game tonight to fall asleep to ,16653998,NickyG618,"Davenport, IA",155,13971,,True,False,18627,,,0,2,0.5333333333333333,-0.06666666666666668,negative
2021-03-11 23:21:07,1370152838857379841,"HaighKatharina CBCManitoba To clarify that's not accurate, from the article:

""If the AstraZeneca product is the only available option, said the document, then ""nothing morally prevents anyone from receiving in good conscience the vaccines""",4490028554,trent_brownlee,"Stonewall, Manitoba",224,7938,,True,False,7764,,,0,1,0.5766666666666667,0.18,positive
2021-03-11 23:21:07,1370152837796163586,"MichelleObama: When you can get the COVID-19 vaccine, I hope you do—Barack and I are certainly glad we did. It’s our best shot at beati…",259457176,SouldxOut,"Los Angeles, CA. 1974",496,6138,,True,False,76420,,,8132,0,0.65,0.75,positive
2021-03-11 23:21:07,1370152837129367557,"NPR: In Birmingham, Alabama, a health clinic that primarily serves a lower-income, Black neighborhood has not administered a single dos…",1074513757,jerry41413871,"Raleigh, NC",294,52338,,True,False,77565,,,190,0,0.3825396825396825,0.05396825396825398,positive
2021-03-11 23:21:07,1370152836156293122,katherineOma: Jonas Salk ended polio with his vaccine &amp; praised by all including the president. We all know his name. Do you know Kizzi…,3079925047,debbievlahopou1,,22,3299,,False,False,415,,,164,0,0.0,0.0,neutral
2021-03-11 23:21:06,1370152835682344967,"POTUS: One in four adults in the U.S. has received their first COVID-19 vaccine — and we’re now leading the world in vaccinations.

Tha…",114507020,Americancrawl,"Aubrey, TX",4114,164345,,True,False,156549,,,16388,0,0.3333333333333333,0.25,positive
2021-03-11 23:21:06,1370152835589971972,"joe_warmington: Denmark, Norway and Iceland suspend AstraZeneca COVID shots after blood clot reports | Article [AMP] | Reuters ",1363462676,KLMRea,"Dawson Creek, British Columbia",27,3665,,False,False,1513,,,286,0,0.0,0.0,neutral
2021-03-11 23:21:06,1370152835506053121,jsolomonReports: Utah woman dies after taking second dose of COVID vaccine | Just The News ,3233164824,truth_in_wisdom,"Los Angeles, CA",620,89961,,False,False,19292,,,322,0,0.0,0.0,neutral
2021-03-11 23:21:06,1370152835078295555,"Reuters: Pfizer and BioNTech will exceed their original global target for COVID-19 vaccines by as much as 20% this year, Pfizer Chief E…",72757531,lgsm1971,"Chicago, Illinois",166,21106,,False,False,36917,,,65,0,0.31666666666666665,0.19166666666666665,positive
2021-03-11 23:21:06,1370152833706823682,"MuellerSheWrote: Happy to announce the VA has just scheduled me for the two-dose Moderna vaccine 3/15 and 4/5, two weeks after which I’…",2287276410,RobertW78870801,,184,115109,,False,False,67771,,,122,0,1.0,0.8,positive
2021-03-11 23:21:06,1370152833467744262,"OFCSDistrict: Reminder! There is no school tomorrow, Friday, March 12, to allow Olmsted City Schools staff members the opportunity to r…",1151896103756992514,MrSearight,"Ohio, USA",256,1588,,False,False,637,,,8,0,0.0,0.0,neutral
2021-03-11 23:21:05,1370152831286706189,"JudgeClayJ: You may register to receive the COVID19vaccines with DCHHS
📲 Online: 
📞 By Phone: 1-855-IMMUNE9
✍️…",870995264,DoraKnudsen,,130,15767,,True,False,5884,,,80,0,0.0,0.0,neutral
