created,id_str,text,user_id,screen_name,location,followers_count,user_favourites_count,time_zone,geo_enabled,verified,status_count,geo,coords,retweet_count,tweet_favourite_count,Subjectivity,Polarity,Sentiment
2021-03-11 22:46:35,1370144147361894403,"All population categories and industries listed in Phase 2 are now able to schedule an appointment for the COVID19Vaccine: Phase 2 includes Residents Aged 65+, Health Care Associated Workers, K-12 School Personnel, Veterinarians, Public Safety Agencies, ",745441932,SedgwickCounty,"Sedgwick County, Kansas",9846,3162,,True,True,26706,,,39,26,0.3638888888888889,0.13333333333333333,positive
2021-03-11 22:46:35,1370144146397261826,"kayleighmcenany: FINALLY the Biden admin recognizes the Trump admin’s unprecedented vaccine work:

➡️ “We’re grateful for the work that…",575822102,AngelaPickel,South Carolina,412,83726,,True,False,63060,,,4608,0,0.95,0.3,positive
2021-03-11 22:46:34,1370144143889080320,"mansanchezgz: Denmark, Norway and Iceland suspend use of AstraZeneca Covid vaccine over reports of blood clots ",443797891,ich_hci,,2,58,,False,False,8994,,,12,0,0.0,0.0,neutral
2021-03-11 22:46:34,1370144142097936385,"AltNews: India Today shared a chart claiming India has the lowest vaccine price in the world. This was also amplified by BJP. However,…",743823215986802688,savitasingh36,"Delhi, India",549,37653,,False,False,25887,,,318,0,0.0,0.0,neutral
2021-03-11 22:46:34,1370144141905039365,KVOA: Pima County expands COVID-19 vaccine eligibility to frontline workers and those age 55 and older  ,17215974,ladygeorge56,"Tucson, AZ",58,17692,,False,False,2472,,,8,0,0.3333333333333333,0.16666666666666666,positive
2021-03-11 22:46:34,1370144141456277504,"🤩🤩🎶&lt;LINK IN BIO&gt;🎶🤩🤩
👉 TheTopIsLonelyToo 👈
SEVENTEEN theyungbludshow ASTRO GENERATION esitolsak RollUpToWin TooManyMen YouthMentorLisa Ufelani IshaYogaCenter AstraZeneca ajayb LISA Crypto MBBHOTSEAT XboxSeriesX Bethesda XboxSeriesS BethesdaJoinsXbox ",1357901824737517568,BaseWorldMafia,"Bay Area , CA",107,184,,False,False,164,,,0,0,0.0,0.0,neutral
2021-03-11 22:46:33,1370144140806266887,"There's an opportunity here for the World Trade Organization to waive patents for COVID-19 vaccine production so that they can be more generically produced and widely distributed globally.

This Liberal government and other developed countries are  currently OPPOSED to this. ",1058391394681868289,ashwinnnair,Montreal-Ottawa,431,5450,,False,False,3075,,,3,3,0.32916666666666666,0.0625,positive
2021-03-11 22:46:33,1370144140579594247,Nigeria insists Oxford/AstraZeneca vaccine is safe  ,877530309981548544,Metricsafrica,Africa,74286,157,,False,False,45578,,,0,2,0.5,0.5,positive
2021-03-11 22:46:33,1370144139552100357,EricTopol I am 49 and in rural Ohio and I got my first dose of moderna today!,28031996,niki_morris,Ohio,452,14453,,False,False,4649,,,0,4,0.16666666666666666,0.15625,positive
2021-03-11 22:46:33,1370144138717372419,"MichelleObama: When you can get the COVID-19 vaccine, I hope you do—Barack and I are certainly glad we did. It’s our best shot at beati…",48842127,Danikobra,Beautiful Pacific Northwest,216,54853,,False,False,3432,,,8192,0,0.65,0.75,positive
2021-03-11 22:46:32,1370144136838279168,European countries suspend use of AstraZeneca’s COVID-19 vaccine  ,877530309981548544,Metricsafrica,Africa,74286,157,,False,False,45578,,,0,1,0.0,0.0,neutral
2021-03-11 22:46:32,1370144136091758597,"ABSCBNNews: Over 114,000 have received COVID-19 vaccines in the Philippines, as of March 10.

PH eyes inoculating 70 million Filipinos…",1291611690702839814,VTXjoanna,ctrna/luv,133,3149,,False,False,5020,,,20,0,0.0,0.0,neutral
2021-03-11 22:46:32,1370144134938427396,"dlh2409: gtconway3d The truth is that Pfizer didn’t receive any funding from Operation Warp Speed. Rather, its partner, BioNTech recei…",2915828272,ss_cnelson,,42,23994,,False,False,17502,,,37,0,0.0,0.0,neutral
2021-03-11 22:46:32,1370144133847818241,JDiamond1: While about 7 in 10 American adults say they will try to get a Covid shot or already have... the political divide remains.…,7161032,vasudevram,https://vasudevram.github.io,817,9901,,False,False,36293,,,30,0,0.05,0.0,neutral
2021-03-11 22:46:31,1370144130005938182,"kayleighmcenany: FINALLY the Biden admin recognizes the Trump admin’s unprecedented vaccine work:

➡️ “We’re grateful for the work that…",2446312658,isaiha_angeles,"New Jersey, USA",232,66032,,False,False,13694,,,4608,0,0.95,0.3,positive
2021-03-11 22:46:31,1370144129183707136,"weaponizedword1: “Denmark and Norway Suspend AstraZeneca Covid-19 Vaccine Over Blood Clot Worries”

",3232145240,TheManofYahweh,,1159,41006,,False,False,100525,,,23,0,0.0,0.0,neutral
2021-03-11 22:46:30,1370144128256851972,"JajaPhD: This is the Covid-19 vaccine that should be going to front line health workers and those who are the most vulnerable, ba?",4321589554,oge__asiko,,1250,3782,,True,False,33715,,,1210,0,0.5,0.0,neutral
2021-03-11 22:46:30,1370144127283822597,"POTUS: One in four adults in the U.S. has received their first COVID-19 vaccine — and we’re now leading the world in vaccinations.

Tha…",2182840106,jezzieo7,,3,419,,True,False,439,,,16416,0,0.3333333333333333,0.25,positive
2021-03-11 22:46:30,1370144126725984260,donkamion78: Several European countries suspend AstraZeneca vaccinations over blood clot fears ,24206406,Melamelons,,319,7415,,True,False,5206,,,175,0,0.0,0.0,neutral
2021-03-11 22:46:29,1370144122913312768,"gyn 
A Covid Vaccine Side Effect, Enlarged Lymph Nodes, Can Be Mistaken for Cancer ",850402846218629120,Rozierow128,Rocky Ronkonkoma NY,147,33011,,False,False,2400,,,0,0,0.0,0.0,neutral
2021-03-11 22:46:29,1370144122384830470,"goldenlily2017 I had my first Moderna, just a sore arm for less than a day.  Hopefully second one goes as smoothly.",26142553,nanmag48,"Walled Lake, MI",171,16080,,True,False,2739,,,0,1,0.22499999999999998,0.12083333333333335,positive
2021-03-11 22:46:29,1370144120870727683,dadimonso1: The federal government and their state agents should please hoard this Covid 19 vaccine the way they hoarded the palliative…,1056372348922875904,Tony64702391,,143,1188,,False,False,1016,,,36,0,0.0,0.0,neutral
2021-03-11 22:46:28,1370144119113326594,"EUAmbUS: The facts on EU vaccine exports: 34M doses; 31 countries:

UK: 9.1M
Canada: 3.9M
Mexico: 3.1M 
Japan: 2.7M
Saudi Arabia: 1.4M…",61567461,martaottaviani,,11957,4384,,True,True,17336,,,30,0,0.0,0.0,neutral
2021-03-11 22:46:28,1370144118555385861,"knarfnamduh: Denmark suspends AstraZeneca COVID-19 shots for two weeks after blood clot reports | The Japan Times

Hmm!? Watching brief…",22121068,Climateworrier,Geelong Australia/Trieste FTT,834,24403,,True,False,15290,,,6,0,0.0,0.0,neutral
2021-03-11 22:46:28,1370144118458830850,"10NewsFirst: Denmark, Norway and Iceland have temporarily suspended the rollout of the AstraZeneca COVID19 vaccine following reports s…",1321759564061028352,Ant42492864,"Melbourne, Victoria",586,59538,,False,False,17794,,,8,0,0.1,0.0,neutral
2021-03-11 22:46:28,1370144118316351488,EricMMatheny: Are we going to talk about the healthy 39 year old woman from Utah who got her second dose of the Moderna vaccine and the…,3919150883,akmi921,,589,90088,,False,False,33718,,,2907,0,0.2333333333333333,0.19999999999999998,positive
2021-03-11 22:46:28,1370144116697399304,thefive FoxNews THINK DONNIE &amp; MELANIE GOT THEIR COVID VACCINATIONS IN SECRET IS WHY 49% OF REPUBLICAN MALES WON'T GET COVID VACCINE? WHAT DO YOU THINK ABT WSJ NEWLY RELEASE PHONECALL OF DONNIE TRYING TO CONVIENCE GA OFFICIAL OF VOTER TAMPERING? THINK DONNIE SHOULD BE CHARGED?,987256874,kensgal3,US,1496,59714,,False,False,133570,,,0,0,0.5772727272727273,-0.13181818181818183,negative
2021-03-11 22:46:27,1370144114386288641,"Gaat verder prima toch hugodejonge?
Denmark, Norway and Iceland suspend AstraZeneca COVID shots after blood clot reports ",198093342,WMPost,Nederland,1105,42070,,True,False,97755,,,1,2,0.0,0.0,neutral
2021-03-11 22:46:27,1370144113908191233,"ntvuganda: Denmark, Norway and Iceland have temporarily suspended the use of AstraZeneca's COVID-19 vaccine over concerns about patient…",94584489,brad_image,"Triangle, VA",1530,8577,,True,False,61109,,,50,0,0.0,0.0,neutral
2021-03-11 22:46:27,1370144113614581764,"kayleighmcenany: FINALLY the Biden admin recognizes the Trump admin’s unprecedented vaccine work:

➡️ “We’re grateful for the work that…",1213948856188076032,onuduoha,,73,5660,,False,False,10490,,,4608,0,0.95,0.3,positive
2021-03-11 22:46:27,1370144113035730947,santamonicamoe: BeschlossDC Good! How many lives could have been saved if Trump had told the American People that Covid was airborne a…,2353518063,riporter_porter,,1,1768,,False,False,790,,,103,0,0.3666666666666667,0.4583333333333333,positive
2021-03-11 22:46:27,1370144112083619841,"NBCNews: BREAKING: President Biden signs $1.9T Covid relief bill into law; ​includes $1,400 checks, $300/wk jobless benefits, child all…",481468020,AlexNewman16,"Oklahoma City, OK",371,40631,,False,False,12808,,,2369,0,0.0,0.0,neutral
2021-03-11 22:46:26,1370144111068594180,el_uthmaan: We need Kidnapping and Boko Haram Vaccine more than we need COVID-19 Vaccine.,1880734129,Babanasidi01,"Abuja, Nigeria. ",4286,156570,,True,False,53396,,,144,0,0.5,0.5,positive
2021-03-11 22:46:26,1370144109671895040,"POTUS: One in four adults in the U.S. has received their first COVID-19 vaccine — and we’re now leading the world in vaccinations.

Tha…",2814100735,ryanjhiggins,"Fort Worth, TX",2912,11599,,True,False,21672,,,16416,0,0.3333333333333333,0.25,positive
2021-03-11 22:46:26,1370144109441077250,donkamion78: 12 Prominent scientists and doctors: Medical regulators should release bold figures of the numbers of people who have died…,30503994,babysmurfett75,Wadena sk,48,1288,,False,False,690,,,191,0,0.5555555555555555,0.27777777777777773,positive
2021-03-11 22:46:26,1370144108472336387,"MQSullivan: You’ll recall that EVERY death of someone COVID-positive, regardless of the actually cause, was treated as a COVID death...…",718505474,hisangels315,United States,38,10576,,True,False,5973,,,24,0,0.1,0.0,neutral
2021-03-11 22:46:26,1370144108191301635,Palm1Elizabeth Yes.  About the time my 2nd Covid vaccine kicks in (mid-April)  it will be time for me to hibernate in the a/c again.,56226710,halehawk,"Orlando, Florida",2519,52068,,True,False,189358,,,0,1,0.0,0.0,neutral
2021-03-11 22:46:25,1370144106664591361,pureangel40: AHSFX is gonna have a field day with this covid and vaccine shit show when they replicate it. It'll be a cross between fr…,1264828579134791680,Eddie9024,"Barnsley, England",138,10483,,False,False,10909,,,1,0,0.4,-0.1,negative
2021-03-11 22:46:25,1370144105792040960,"GovInslee: In more good news, I am pleased that we will move to the next tier of eligibility earlier than we thought. On March 17, ever…",57443302,dsheed,"Seattle, WA",351,31985,,True,False,60527,,,148,0,0.52,0.33999999999999997,positive
2021-03-11 22:46:25,1370144104634585090,NYCDSA_Health: We’re outside pfizer headquarters demanding they freethevaccine!!! 💉 ,39764062,KarlynnHolland,"Brooklyn, NY",1134,26368,,False,False,8114,,,5,0,0.05,0.0,neutral
2021-03-11 22:46:24,1370144102801674241,"BreesAnna: This is the breaking story Mike Yeadon was talking about. 

Urgent Open Letter from Doctors and Scientists to the European M…",488467524,LindaMCameron,UK and The Netherlands ,422,17602,,False,False,20226,,,1516,0,0.25,0.0,neutral
2021-03-11 22:46:24,1370144100603805702,Getting the Pfizer vaccine on Sunday. 😭,35777106,mrrubenh,The Land of Enchantment,58,11755,,True,False,5753,,,0,1,0.0,0.0,neutral
2021-03-11 22:46:23,1370144099349766151,GovRonDeSantis: Great announcement with Walgreens in Jacksonville today to highlight the increase of stores offering the vaccine from…,1369759133503782921,THammer1968,,7,177,,False,False,88,,,124,0,0.75,0.8,positive
2021-03-11 22:46:23,1370144097445556226,bmj_latest: Leaked documents show that some early commercial batches of Pfizer-BioNTech’s covid-19 vaccine had lower than expected leve…,955020946183786496,OrryDontw,,301,53972,,False,False,18232,,,50,0,0.2333333333333333,0.0,neutral
2021-03-11 22:46:23,1370144096371752970,danieteebee: It’s completely predictably American that the brand of COVID vaccine you have access to has now become a class signifier,2901227368,cockycomic,Yonder,415,33600,,True,False,23397,,,10901,0,0.0,0.0,neutral
2021-03-11 22:46:22,1370144091514662912,"EricMMatheny: Vaccination is not a political talking point. It’s a matter of choice. The truth is, the Covid vaccine was approved very…",1369426850611666944,Micaiyah5,,126,333,,False,False,167,,,306,0,0.1,0.0,neutral
2021-03-11 22:46:21,1370144090579472391,SAMetroHealth Do we wait until just before our 21 days are up to schedule via the app for our second shot if we already got our first Pfizer at the Alamodome?,1271267991171338241,cicadastillness,In TX Behind a mask ,136,10696,,False,False,5552,,,0,0,0.16666666666666666,0.125,positive
2021-03-11 22:46:21,1370144089073709064,"Effiedeans lyndsay_hopkins ""Covid vaccines"" are going to wipe out your immune system for ever.

This ""vaccine"" roll out must be stopped right now.

",1369319255083257861,flumffle,,39,948,,False,False,1440,,,0,0,0.5357142857142857,0.2857142857142857,positive
2021-03-11 22:46:21,1370144087966281730,"cyclingkev COVID-19 is inevitable. 

Many (though not all) disabled people do have underlying medical conditions which places them at greater risk. 

The lack of adequate social, &amp; political intervention to mitigate those risks was a choice.

e.g. vaccine inequity for high risks groups.",542126581,EllenaDeeley,,989,7475,,False,False,2127,,,0,0,0.37111111111111117,0.1474074074074074,positive
2021-03-11 22:46:20,1370144085248339970,"How to do explain to your Trump-supporting, anti-vaccine, COVID denying, conservative, Christian, (uneducated) family members that you’re not one of them??  But like nicely.  Lol plz save me",200770987,brittanyyxdns,Bay Area,111,1680,,True,False,2034,,,0,6,0.35,0.4,positive
2021-03-11 22:46:20,1370144084988461066,"Anyone else out there had their first dose of the AstraZeneca  COVID19 CovidVaccine at all?
I'm getting chills, aches, temp up to 38.2 (ear device)...",160218098,The_DarrenS,UK,460,4913,,False,False,17438,,,1,1,0.3333333333333333,0.25,positive
2021-03-11 22:46:20,1370144083398828034,"Reuters: Health authorities in Denmark, Norway and Iceland have suspended usage of the COVID-19 vaccine produced by AstraZeneca after r…",1193174540215562242,yinzerchemist,"Texas, USA",1775,29715,,True,False,45818,,,417,0,0.0,0.0,neutral
2021-03-11 22:46:19,1370144082144550913,Reuters: Italy bans AstraZeneca batch following two deaths in Sicily: source  ,78276703,dmwsdq,RBG 🔄 CPT,928,527,,True,False,196842,,,376,0,0.1,0.0,neutral
2021-03-11 22:46:19,1370144080638832641,disclosetv: JUST IN - Norway and Denmark suspend Oxford-AstraZeneca COVID19 vaccine rollout.,1131094980833865729,marianne_born,,374,75966,,False,False,14990,,,2585,0,0.0,0.0,neutral
2021-03-11 22:46:18,1370144076234907649,"kayleighmcenany: FINALLY the Biden admin recognizes the Trump admin’s unprecedented vaccine work:

➡️ “We’re grateful for the work that…",1681044234,BobFrogman139,"Virginia Beach, VA",5545,58282,,False,False,83178,,,4608,0,0.95,0.3,positive
2021-03-11 22:46:18,1370144075396038659,"kayleighmcenany: FINALLY the Biden admin recognizes the Trump admin’s unprecedented vaccine work:

➡️ “We’re grateful for the work that…",891216841,DougNathaniel,,3,31,,False,False,31,,,4608,0,0.95,0.3,positive
2021-03-11 22:46:18,1370144074532061195,"GOVERNOR FINTIRI’S NEW MEDIA HON.TUKUR RECEIVES COVID-19 VACCINE.
Yola_Twitta,Mubi_Twittee,MGcfr,northern_blog,abdul_bapullo,BangiesAbdu,ms_aleeyou. ",1238610725255417860,YerimaSahabo,"Adamawa, Nigeria",153,2783,,True,False,638,,,6,15,0.45454545454545453,0.13636363636363635,positive
2021-03-11 22:46:17,1370144072577474562,"kayleighmcenany: FINALLY the Biden admin recognizes the Trump admin’s unprecedented vaccine work:

➡️ “We’re grateful for the work that…",869335265365635072,JCorby18,"Jacksonville Beach, FL ",45,3831,,True,False,2475,,,4608,0,0.95,0.3,positive
2021-03-11 22:46:17,1370144071872827392,"Regarding riteaid only vaccinating educators: this will be the case in some states for the next two days (through Friday, March 12). Otherwise eligible users will be able to book again starting Saturday, March 13...according to the press release.
",1355196503522996226,getmyvaccine,,1187,77,,False,False,185,,,1,1,0.43125,0.125,positive
2021-03-11 22:46:17,1370144071558250510,danieteebee: It’s completely predictably American that the brand of COVID vaccine you have access to has now become a class signifier,928228833253347328,massivebxtch,"Paris, France",59,35165,,False,False,6753,,,10901,0,0.0,0.0,neutral
2021-03-11 22:46:16,1370144067972046848,"POTUS: One in four adults in the U.S. has received their first COVID-19 vaccine — and we’re now leading the world in vaccinations.

Tha…",143291011,SuzyQRoot,"Plainville, CT",129,43513,,False,False,9625,,,16416,0,0.3333333333333333,0.25,positive
2021-03-11 22:46:15,1370144065002561542,"KHOU: On Monday, these are all of the people who will be eligible to receive the COVID-19 vaccine in Texas. khou

MORE: ",186677561,JoyPuder,,639,355329,,True,False,152102,,,19,0,0.5,0.5,positive
2021-03-11 22:46:15,1370144064696414208,"Just yesterday, Ron was asserting that you don't need the vaccine if you've had COVID. So... ",61843359,jennaep7,,1595,11038,,False,False,6540,,,0,2,0.0,0.0,neutral
2021-03-11 22:46:15,1370144064121704448,"Are you overwhelmed by the vaccine rollout in South Florida? Let’s text!

The MiamiHerald has launched a (free) SMS tipline for eligibility updates, the latest on where to get vaccinated and more.

📲 Text COVID UPDATES to 786-386-2012 to sign up.

",423881080,forrestmilburn,he/him 🏳️‍🌈,5672,48201,,True,False,28231,,,6,8,0.7333333333333334,0.4666666666666666,positive
2021-03-11 22:46:15,1370144063819673604,"LongBeachPost: The state is officially opening the vaccine to people with underlying health conditions and disabilities on Monday, but…",2967132341,tomasrabago1,"Long Beach, CA",2937,373961,,True,False,190882,,,16,0,0.0,0.0,neutral
2021-03-11 22:46:14,1370144061571612673,danieteebee: It’s completely predictably American that the brand of COVID vaccine you have access to has now become a class signifier,3571198817,Thatmustbeari,,447,126271,,False,False,117274,,,10901,0,0.0,0.0,neutral
2021-03-11 22:46:14,1370144060183355395,cantpretendtoo: Wife’s Uncle got the Covid vaccine on Friday. Died this morning.  Sad.,21416153,lindarutter,"Toledo, Ohio",9501,95559,,True,False,125806,,,631,0,1.0,-0.5,negative
2021-03-11 22:46:14,1370144059235385344,"RobertKennedyJr You are far too intelligent for me to assume that the anti-vaxers are just using you, so I am forced to ask: What in the ever-living hell are you talking about comparing the Covid vaccine to the Tuskegee experiments and discouraging vaccines? Literally wtf?",47703692,dave8733,"Crittenden, KY, USA",35,2649,,False,False,1433,,,0,0,0.775,0.024999999999999994,positive
2021-03-11 22:46:14,1370144059017326601,IshatReza: Doug Ford just accused an Indigenous MPP of “queue jumping” even though he was eligible for a COVID vaccine. Does the Premie…,1029403392,rhodes_sheila,Ontario Tech University ,1029,32047,,True,False,20742,,,286,0,0.0,0.0,neutral
2021-03-11 22:46:13,1370144057024987141,robinmonottibot: Vaccine phase 2 efficacy trials completed around 20th June 2020 (see Pfizer). Phase 3 safety trials need one year post…,3405912879,McStauncherson,Scotland,146,1091,,False,False,2020,,,148,0,0.0,0.0,neutral
2021-03-11 22:46:13,1370144056974716929,ChrysK3: The morning after the Astra Zeneca vaccine. A thread,301056325,ZexiAllyy,Nearby Bushes,562,1620,,False,False,77903,,,78,0,0.0,0.0,neutral
2021-03-11 22:46:12,1370144052943843334,"POTUS: One in four adults in the U.S. has received their first COVID-19 vaccine — and we’re now leading the world in vaccinations.

Tha…",1297246727305490432,Camns1,"Chico, California ",62,63427,,False,False,33484,,,16416,0,0.3333333333333333,0.25,positive
2021-03-11 22:46:12,1370144052180615171,"peterdonaghy: There were 5,594 first COVID-19 vaccine doses registered in Northern Ireland yesterday, and 2,021 second doses. The wait…",239543700,peterlynas,Northern Ireland,5575,2861,,True,False,8909,,,8,0,0.16666666666666666,0.125,positive
2021-03-11 22:46:12,1370144051589226504,"wordwhisperer: 

Particularly interesting as there has been a sudden stroke awareness campaign on every TV stati…",521296721,ClaireNewton79,"poole, dorset",2289,43558,,False,False,119689,,,151,0,0.5,0.25,positive
2021-03-11 22:46:12,1370144051547271170,How many of y’all have gotten the Covid vaccine??,64011109,PeachDulce,Middle America ,7462,2959,,True,False,379427,,,1,0,0.5,0.5,positive
2021-03-11 22:46:12,1370144050523869184,"Dr Deena Hinshaw talks about concerns out of Europe re AstraZeneca vaccine. 
Says she wants to assure that COVISHIELD (currently being used in Alberta) not linked to concerns about blood clots

",718922508,JenLeeCBC,"Calgary, Alberta",3340,333,,False,True,3028,,,2,3,0.25,0.1,positive
2021-03-11 22:46:12,1370144050389585920,timesuppeeps: AstraZeneca Vax rollout halted due to Safety concerns. Previously healthy people developed life threatening blood clots s…,1241690116176871424,RogerFinn9,,6,52,,False,False,210,,,191,0,0.39166666666666666,0.15833333333333333,positive
2021-03-11 22:46:11,1370144048577572865,"In more good news, I am pleased that we will move to the next tier of eligibility earlier than we thought. On March 17, everyone in Tier 2 will be eligible for a COVID vaccine.",1077214808,GovInslee,"Olympia, WA",370233,3426,,True,True,8531,,,148,741,0.52,0.33999999999999997,positive
2021-03-11 22:46:11,1370144048183382019,mariamainmo: Girls don't want boys. They want the covid vaccine and a nice apartment,627561601,HOEkage28,,395,52895,,True,False,49838,,,25209,0,1.0,0.6,positive
2021-03-11 22:46:11,1370144047600332800,"NYGovCuomo: Vaccination Update:
 
20.4% of New Yorkers have received at least one vaccine dose and 10.4% have completed their vaccine s…",67169191,FluffySays,USA,4108,213859,,False,False,291500,,,172,0,0.42727272727272725,-0.08181818181818182,negative
2021-03-11 22:46:11,1370144047474606091,"ianhughscott: Hmm... letter is interesting. So, do you think all the doctors and researchers that have signed thus far are ""quacks?"" I…",40520758,ianhughscott,"Orangeville, ON CA, Athens, GR",1072,17275,,True,False,23087,,,1,0,0.75,0.3,positive
2021-03-11 22:46:11,1370144045524262915,"GreatGameIndia: THIS IS BIG

8 European nations including Italy, Latvia, Luxembourg, Lithuania, Estonia, Denmark, Norway and Iceland ha…",718470996899049472,JohnMarcmail,UK,2980,134916,,False,False,117743,,,795,0,0.05,0.0,neutral
2021-03-11 22:46:10,1370144043800363015,"kayleighmcenany: FINALLY the Biden admin recognizes the Trump admin’s unprecedented vaccine work:

➡️ “We’re grateful for the work that…",1251245694096113665,etica_morale,,6,878,,False,False,1179,,,4608,0,0.95,0.3,positive
2021-03-11 22:46:09,1370144039337656320,"DaniParadis: Denmark, Norway, Iceland suspend use of AstraZeneca's COVID jab over concerns about post-vaccine blood clots ",15970649,AlanGillies,Canada,1244,61488,,True,False,69748,,,2,0,0.0,0.0,neutral
2021-03-11 22:46:09,1370144037173403650,"RabeeTourky FYI EMA says “As of 9 March 2021, 22 cases of thromboembolic events had been reported among the 3 million people vaccinated” and “no higher than that seen in the general population”

",66627807,GabrielZiegler,Edinburgh,416,211,,True,False,1379,,,0,1,0.5,-0.03749999999999999,negative
2021-03-11 22:46:09,1370144036724436995,"10NewsFirst: Denmark, Norway and Iceland have temporarily suspended the rollout of the AstraZeneca COVID19 vaccine following reports s…",936092187602726914,CCrazyReddHeadd,"Sydney, New South Wales",31,1037,,True,False,1316,,,8,0,0.1,0.0,neutral
2021-03-11 22:46:09,1370144036690952192,alicianzapanta: mhdksafa kumaichi523 I legitimately had a huge fight with my mom about this the other night. She won’t get the covid…,939267616622784517,windycityJoJo,,81,6086,,False,False,8426,,,3,0,0.6375,0.13750000000000004,positive
2021-03-11 22:46:09,1370144036552511488,"mirrrroring: i got my first dose of the pfizer vaccine today and i just want to say

SIGN UP FOR MICROSOFT OFFICE 365 TODAY USING DISCO…",1850621281,birthdaycorp,Los Angeles,216,41284,,False,False,1874,,,6,0,0.3333333333333333,0.25,positive
2021-03-11 22:46:08,1370144036187598851,DennisKendel: Canada’s health authorities find no evidence of Oxford-AstraZeneca vaccine causing blood clots /via globeandmail https:/…,1154292071601266693,CarlaMeckelborg,,2482,78833,,False,False,27298,,,6,0,0.0,0.0,neutral
2021-03-11 22:46:08,1370144036107943938,OakBayNews: Denmark pauses AstraZeneca COVID-19 vaccine to probe reports of blood clots ,704798725747531776,allan_crawshaw,"Victoria, B.C.",4754,374050,,False,False,515756,,,1,0,0.0,0.0,neutral
2021-03-11 22:46:08,1370144035218853896,"BarackObama: Michelle and I got vaccinated against COVID-19 because we know it’s the best way to beat this pandemic, protect one anothe…",563213827,MichaelLeonT,New York City,119,2200,,True,False,962,,,10065,0,0.3,1.0,positive
2021-03-11 22:46:08,1370144034832805888,Greygal__Eve We asked it's the Moderna version.,37104571,Angrygumball,,63,250,,False,False,1849,,,0,1,0.0,0.0,neutral
2021-03-11 22:46:08,1370144034757378050,COVID vaccine could be delivered as a pill ,168605311,Sue_Dunlevy,Canberra,4193,3,,False,False,1102,,,0,2,0.0,0.0,neutral
