created,id_str,text,user_id,screen_name,location,followers_count,user_favourites_count,time_zone,geo_enabled,verified,status_count,geo,coords,retweet_count,tweet_favourite_count,Subjectivity,Polarity,Sentiment
2021-03-11 22:47:28,1370144369655783427,"KatyTurNBC: One year of COVID. 
Seven months pregnant. 
First shot of Pfizer.",1223350031123509248,BrimStudios,"Gig Harbor,WA/Studio City, CA ",34,4964,,False,False,5071,,,453,0,0.41666666666666663,0.29166666666666663,positive
2021-03-11 22:47:28,1370144368456167427,mellowmariooo2: If you live in the imperial valley they are giving Covid vaccine shots from 2-6 at the Westmorland youth center ;),1434838333,Michelle0choa,J,294,4803,,True,False,21039,,,7,0,0.5333333333333333,0.09545454545454546,positive
2021-03-11 22:47:27,1370144366837239809,danieteebee: It’s completely predictably American that the brand of COVID vaccine you have access to has now become a class signifier,72184442,tpatty13,QUARANTINED,389,62119,,True,False,64324,,,10901,0,0.0,0.0,neutral
2021-03-11 22:47:27,1370144366812086272,karidoll14 pfizer Yahoo!!!,17492377,blackhillslvr,Black Hills of South Dakota!!,690,44847,,True,False,56199,,,0,1,0.0,0.0,neutral
2021-03-11 22:47:27,1370144366749224965,Senior Canadian scientists question government plans to delay 2nd dose of COVID-19 vaccine - Global News  ,3432906658,ucarenet,"Toronto, ON Canada",274,320,,False,False,1232,,,0,0,0.0,0.0,neutral
2021-03-11 22:47:27,1370144364429774859,"POTUS: One in four adults in the U.S. has received their first COVID-19 vaccine — and we’re now leading the world in vaccinations.

Tha…",24150102,AmazonTracy,"San Francisco, California",456,23090,,True,False,18528,,,16416,0,0.3333333333333333,0.25,positive
2021-03-11 22:47:26,1370144363414745088,"Biden signs $1.9 trillion Covid relief bill, clearing way for stimulus checks, vaccine aid - CNBC  via GoogleNews OH GOODY!  Joebot will be giving a prime time presidential address to the nation. (according to this article).",2157657381,thomps_p,Providence,289,4208,,True,False,2128,,,0,0,0.0,0.0,neutral
2021-03-11 22:47:26,1370144360906567684,"DonaldJTrumpJr kmacbean123 ""Covid vaccines"" are going to wipe out your immune system for ever.

This ""vaccine"" roll out must be stopped right now.

",1369319255083257861,flumffle,,39,948,,False,False,1440,,,0,0,0.5357142857142857,0.2857142857142857,positive
2021-03-11 22:47:25,1370144359149047809,"SChad71593015: Six European countries suspend use of AstraZeneca vaccine after reports of serious blood clots

",406534729,Largecarfarmer,,1798,26739,,True,False,7008,,,50,0,0.3333333333333333,-0.16666666666666666,negative
2021-03-11 22:47:25,1370144358826147845,HCP1_Fuentes: Hidalgo County and Donna Independent School District to host COVID-19 Community 2nd Dose Vaccine Clinic. DONNA &amp; Hidalgo…,1201545411208601609,3d_donna,2110 Hester Ave Donna Texas,21,191,,False,False,172,,,4,0,0.0625,0.0,neutral
2021-03-11 22:47:25,1370144358603833352,"funshographix: Denmark suspends use of AstraZeneca vaccine after patient dies with blood clot

Recently Buhari &amp; Osinbajo took the vacc…",1323179770885058561,Chigozi22333530,No-man's-land Kano,1127,14449,,False,False,10472,,,91,0,0.25,0.0,neutral
2021-03-11 22:47:25,1370144358192840705,"Do you have questions about the Covid-19 vaccine and the new CDC guidelines? Share them with us by tweeting MSNBCAnswers or email talkmsnbc.com.

Tune in tomorrow at 11am ET as MSNBC's craigmelvin and team answer them live. ",107120201,MSNBCPR,,20850,172,,True,True,9443,,,0,3,0.4772727272727273,0.13636363636363635,positive
2021-03-11 22:47:24,1370144354870906881,DennisKendel: Canada’s health authorities find no evidence of Oxford-AstraZeneca vaccine causing blood clots /via globeandmail https:/…,214492262,nisobel,,1334,38790,,True,False,134195,,,6,0,0.0,0.0,neutral
2021-03-11 22:47:24,1370144352983482368,"EricMMatheny: Vaccination is not a political talking point. It’s a matter of choice. The truth is, the Covid vaccine was approved very…",1010522757543669761,because93,United States,17429,85283,,False,False,127693,,,306,0,0.1,0.0,neutral
2021-03-11 22:47:24,1370144352513748996,davematt88: I talked to somebody in law enforcement today. They told me that they didn't believe that covid-19 was deadly. That it was…,255584407,NCfarmer321,,6952,411201,,False,False,433812,,,129,0,0.4,-0.2,negative
2021-03-11 22:47:24,1370144352459223041,AliceRothchild: Israel’s Health Ministry barred a Palestinian woman from the occupied West Bank who studies at Tel Aviv University from…,2557716919,mh197069,Syria,4791,215324,,False,False,47833,,,42,0,0.0,0.0,neutral
2021-03-11 22:47:23,1370144349497921538,"N7Mith: The first vaccine, AstraZeneca's has been pulled because of dangerous side effects. Tested and safe huh? ",37743150,hueysr,"Strathcona County, Alberta",588,25102,,True,False,16488,,,20,0,0.5777777777777778,0.05000000000000001,positive
2021-03-11 22:47:23,1370144348638117894,"POTUS: One in four adults in the U.S. has received their first COVID-19 vaccine — and we’re now leading the world in vaccinations.

Tha…",301213127,RunninRebe1,"Seattle, WA",1998,249555,,True,False,53526,,,16416,0,0.3333333333333333,0.25,positive
2021-03-11 22:47:23,1370144348562616320,"Visit  to see the most current clinics available in your county, and text the message ""swuhealth"" to 888777 to get text alerts on clinic openings. 

New Johnson &amp; Johnson clinics have been added for Beaver, Garfield, Iron, and Kane Counties next week.

5/5",18960581,SWUHEALTH,"St George, UT",1013,52,,False,False,2203,,,0,0,0.35090909090909095,0.20727272727272728,positive
2021-03-11 22:47:23,1370144347774013443,"Beaver: 695 total cases, 6 deaths, 619 recovered, 70 active cases
Garfield: 454 total cases, 9 deaths, 396 recovered, 49 active cases

COVID-19 VACCINE UPDATE: 
New appointments &amp; clinics for vaccines in all 5 counties are being added more frequently....

/4",18960581,SWUHEALTH,"St George, UT",1013,52,,False,False,2203,,,0,0,0.564935064935065,0.0670995670995671,positive
2021-03-11 22:47:22,1370144344787845122,UrugwiroVillage: VIDEO: President Kagame and First Lady Jeannette Kagame receive their Covid-19 Vaccine. VaccinesSaveLives  InkingoNi…,3945259815,FulKwizera,Rwanda,7034,9449,,True,False,13441,,,338,0,0.3333333333333333,0.25,positive
2021-03-11 22:47:21,1370144342594162700,"MichelleObama: When you can get the COVID-19 vaccine, I hope you do—Barack and I are certainly glad we did. It’s our best shot at beati…",709466640,pillinz,,938,4903,,True,False,1533,,,8192,0,0.65,0.75,positive
2021-03-11 22:47:21,1370144342262874113,donkamion78: Several European countries suspend AstraZeneca vaccinations over blood clot fears ,1214100764794077184,HayleyColins,,197,3478,,False,False,12639,,,175,0,0.0,0.0,neutral
2021-03-11 22:47:21,1370144341105201159,danieteebee: It’s completely predictably American that the brand of COVID vaccine you have access to has now become a class signifier,624444018,stormcloudsoul,satx,1099,73907,,True,False,108053,,,10901,0,0.0,0.0,neutral
2021-03-11 22:47:21,1370144340702593026,"CTV_AvisFavaro: Astra Zeneca statement ""An analysis of our safety data of more than10 million records has shown no evidence of an incre…",1022477813637632001,jenkalant,Toronto,307,10265,,False,False,6203,,,69,0,0.5,0.5,positive
2021-03-11 22:47:21,1370144339846909957,"ucc231: thetruebluechef The press should be talking about this yellow card reporting but of course they are not ..,,",123509698,allessandrea,,533,10324,,False,False,10593,,,6,0,0.0,0.0,neutral
2021-03-11 22:47:20,1370144336256532481,"GovInslee: In more good news, I am pleased that we will move to the next tier of eligibility earlier than we thought. On March 17, ever…",1355353527527194625,C4C2021,Duwamish / Coast Salish Land,98,1549,,False,False,223,,,148,0,0.52,0.33999999999999997,positive
2021-03-11 22:47:20,1370144335660937217,car__ma__vie: Health workers in Melbourne last night refused to be given the AstraZeneca - which was being offered - and demanded they…,573697839,fdsfifi,Australia,2589,116788,,False,False,104403,,,16,0,0.06666666666666667,0.0,neutral
2021-03-11 22:47:20,1370144335358881793,"ruyalma Kevinliptakcnn Saying you don't trust Pfizer, Moderna, or Johnson &amp; Johnson because Trump is bat shit crazy.",19467085,weimdog,"Orange County, California",231,14316,,False,False,35462,,,0,0,0.8500000000000001,-0.4,negative
2021-03-11 22:47:20,1370144334662762500,2JohnDurant: Natasha Loder gives a really good overview of Covid-19 vaccine situation in UK &amp; US. Listen: A U.K. take on Covid vaccines…,1288142173800734721,SynBioBot,,316,111,,False,False,8386,,,1,0,0.6000000000000001,0.7,positive
2021-03-11 22:47:19,1370144332590759943,AliceRothchild: Israel’s Health Ministry barred a Palestinian woman from the occupied West Bank who studies at Tel Aviv University from…,98673063,garethparri6,Gweriniaeth Cymru,594,13633,,True,False,4710,,,42,0,0.0,0.0,neutral
2021-03-11 22:47:18,1370144329226977283,"UCF: 🤔 What makes each vaccine different from one another? Does it matter which one you receive?

Each of the  3️⃣ vaccines currently a…",1232045613589487617,UCFAcademics,,333,1065,,False,False,850,,,4,0,0.5,0.0,neutral
2021-03-11 22:47:18,1370144328572665860,mariamainmo: Girls don't want boys. They want the covid vaccine and a nice apartment,1298847531129098241,taddymason420,she/her,46,12516,,False,False,1870,,,25209,0,1.0,0.6,positive
2021-03-11 22:47:18,1370144328207728645,SarahRemelius: “are you okay?” no I still haven’t gotten the covid vaccine,859081440461545472,daisyfanaccount,,83,59634,,True,False,25300,,,74,0,0.5,0.5,positive
2021-03-11 22:47:18,1370144326773268481,Method Man - What The Blood Clot (HD)  AstraZeneca,1657137258,WinterBourneTO,Toronto,423,26242,,True,False,69247,,,0,0,0.0,0.0,neutral
2021-03-11 22:47:17,1370144325372276736,"TheZenCorner axios Which other vaccines are available? US is keeping all its own for itself, same with EU/AstraZeneca.",4512488780,rexnchan,"Melbourne, Australia",51,14750,,False,False,1042,,,0,0,0.475,0.21875,positive
2021-03-11 22:47:17,1370144325322076161,pmnewsnigeria: Why I haven’t taken AstraZeneca COVID-19 vaccine – Sanwo-Olu ,1170234679,AjayiAdefemi1,,202,2443,,False,False,5107,,,3,0,0.0,0.0,neutral
2021-03-11 22:47:17,1370144325309452296,danieteebee: It’s completely predictably American that the brand of COVID vaccine you have access to has now become a class signifier,902252188831027200,theamontadillo,,111,35695,,False,False,7297,,,10901,0,0.0,0.0,neutral
2021-03-11 22:47:17,1370144325112369163,"EricTopol: I wish it were that simple

But agree that new CDC guidance is too restrictive and not aligned with t…",21460496,NJdoc,New York City,20450,160,,False,False,565271,,,43,0,0.40584415584415584,0.06818181818181818,positive
2021-03-11 22:47:17,1370144324923580418,disclosetv: JUST IN - Norway and Denmark suspend Oxford-AstraZeneca COVID19 vaccine rollout.,586324616,boblee33408589,york,250,47782,,False,False,32181,,,2585,0,0.0,0.0,neutral
2021-03-11 22:47:17,1370144322524307458,"ShannonJoyRadio: So Facebook just put me in JAIL for THREE DAYS for posting this 100% TRUE story out of Utah.
Facebook SponsoredByPfi…",3147430363,constanzag77,México,910,34330,,False,False,44383,,,54,0,0.325,0.12499999999999999,positive
2021-03-11 22:47:17,1370144322260062209,"GovInslee: In more good news, I am pleased that we will move to the next tier of eligibility earlier than we thought. On March 17, ever…",67099778,j_stewart97,Big Sky Country,295,13568,,True,False,37697,,,148,0,0.52,0.33999999999999997,positive
2021-03-11 22:47:16,1370144321387819008,"BarackObama: Michelle and I got vaccinated against COVID-19 because we know it’s the best way to beat this pandemic, protect one anothe…",971894479,AdamJournalism1,KY,429,105393,,False,False,31009,,,10065,0,0.3,1.0,positive
2021-03-11 22:47:16,1370144320712499203,"Quicktake: ✈️ U.S. airlines, joined by travel groups and labor, urged the Biden administration to take the lead in developing standards…",321691813,skatuu,,7919,3062,,False,False,29965,,,5,0,0.0,0.0,neutral
2021-03-11 22:47:15,1370144316140707840,She got Pfizer as a med student wayyyy back in January (she's in grad school),1014365916610596865,Milkn_Sugar,Read carrd before interacting,289,41028,,False,False,14552,,,0,0,0.0,0.0,neutral
2021-03-11 22:47:15,1370144315939426310,christufton: Oxford-AstraZeneca: EU regulator says 'no indication' vaccine linked to blood clots ,1242169318667927553,EULIT2,🌅❄🏝,632,12049,,False,False,5207,,,169,0,0.0,0.0,neutral
2021-03-11 22:47:14,1370144312265170946,ProfTomCotter: Pfizer vaccine almost 100% effective.  I wonder when my time comes to be vaccinated will I get offered this one?   https…,271899098,Mirium1,"Cork, Ireland",36,886,,False,False,9152,,,2,0,0.8,0.6,positive
2021-03-11 22:47:14,1370144312206446596,"CDCgov: If you get a COVID19 vaccine, wait at least 14 days before getting any other vaccine, including those for flu or shingles. If…",1257271419827871745,HeartVessTransp,Gulmira Kudaiberdieva EiC,105,22056,,False,False,2133,,,380,0,0.3875,-0.2125,negative
2021-03-11 22:47:14,1370144311233421315,The Latest: Another COVID-19 vaccine nears finish line ,25655612,mruttu,"Nairobi, Kenya",2110,57438,,True,False,11169,,,0,0,0.9,0.5,positive
2021-03-11 22:47:14,1370144310524477446,"Vaccine politics...

Government's COVID-19 vaccine rollout and latest tourism stimulus package attacked on Q+A ",881375316362448897,totalwealth,,4,206,,False,False,789,,,0,0,0.9,0.5,positive
2021-03-11 22:47:14,1370144309685592066,narendramodi: Happy to share that my mother has taken the first dose of the COVID-19 vaccine today. I urge everyone to help and motivat…,194997770,ankur9329,संस्कारधानी जबलपुर मध्य प्रदेश,3041,275462,,True,False,100212,,,16832,0,0.6666666666666666,0.525,positive
2021-03-11 22:47:13,1370144308536381440,"roccogalatilaw: Denmark. another country, like Austria, to suspend  Astra-Zeneca vaccine due to ""blood-clotting"" which  led to deaths a…",561798277,BubblesDerek,,157,6408,,True,False,4295,,,1451,0,0.375,-0.125,negative
2021-03-11 22:47:13,1370144306330210304,Tomorrow is Friday and I get my first Covid vaccine so this girl is happy! ,1180690164,WW2HistoryGal,"Nebraska, USA",5660,137736,,False,False,89738,,,1,64,0.6666666666666666,0.625,positive
2021-03-11 22:47:13,1370144306166702080,"BarackObama: Michelle and I got vaccinated against COVID-19 because we know it’s the best way to beat this pandemic, protect one anothe…",1244395304314720256,elaine_normoyle,,39,1774,,False,False,1589,,,10065,0,0.3,1.0,positive
2021-03-11 22:47:13,1370144306087010304,christufton: Oxford-AstraZeneca: EU regulator says 'no indication' vaccine linked to blood clots ,1292711187470323712,honbrogadjm,Jamaica House,452,2822,,False,False,3154,,,169,0,0.0,0.0,neutral
2021-03-11 22:47:13,1370144305675968512,"Could’ve been red..

 skypapers coronavirus AstraZeneca COVID19 ",2323669226,PauIRob,In Lincoln Green..,253,5106,,False,False,44036,,,0,0,0.0,0.0,neutral
2021-03-11 22:47:12,1370144304635604995,"BioNTech_Group: A year ago, the WHO declared the pandemic. Today, new real world data from Israel that give us further hope, indicate…",1333957765711024129,SugayaVpd,,66,977,,False,False,565,,,40,0,0.4181818181818182,0.11212121212121212,positive
2021-03-11 22:47:12,1370144304430264320,"UnlimitedMarty: Breaking911 but thats good for the Moderna and Pfizer stock they all have, congrats!",607258583,ross_kross,"Edmond, OK",1868,152735,,True,False,155567,,,8,0,0.6000000000000001,0.875,positive
2021-03-11 22:47:12,1370144303595413506,LDTG117: Are Universitys anti-conservative? Join us at the BP business school on the Suncor plaza next to the Moderna Medical Theatre t…,888468894024818689,PeterCraigBate1,"Alberta, Canada",1063,27278,,False,False,25559,,,90,0,0.0,0.0,neutral
2021-03-11 22:47:12,1370144303301996544,AliceRothchild: Israel’s Health Ministry barred a Palestinian woman from the occupied West Bank who studies at Tel Aviv University from…,55066811,NHTeaParties,#QTard = Political Teenybopper,3160,22785,,False,False,167249,,,42,0,0.0,0.0,neutral
2021-03-11 22:47:12,1370144302437908480,"Good News - We've added Friday evening AND Saturday appointments for this weekend! Spots fill up fast, schedule your COVID vaccine online today:  ",17782721,BRGeneral,"Baton Rouge, Louisiana",2723,871,,True,False,3097,,,2,1,0.6000000000000001,0.5375,positive
2021-03-11 22:47:12,1370144301821353985,SarahRemelius: “are you okay?” no I still haven’t gotten the covid vaccine,349112340,MegsBrownell,"River Falls, WI",329,34707,,True,False,4836,,,74,0,0.5,0.5,positive
2021-03-11 22:47:11,1370144298822463492,Quicktake: Chile announced a series of new restrictions aimed at slowing a surge in Covid cases that’s tarnished one of the world’s fa…,371086859,pilar_fuerte,Nicaragua,534,42770,,False,False,50401,,,5,0,0.45454545454545453,0.13636363636363635,positive
2021-03-11 22:47:11,1370144298486935553,"BarackObama: Michelle and I got vaccinated against COVID-19 because we know it’s the best way to beat this pandemic, protect one anothe…",791122690400591872,navayess0,,542,66794,,False,False,35351,,,10065,0,0.3,1.0,positive
2021-03-11 22:47:11,1370144298151211009,danieteebee: It’s completely predictably American that the brand of COVID vaccine you have access to has now become a class signifier,1245107813023494144,sonofthesun01,,8,339,,False,False,1142,,,10901,0,0.0,0.0,neutral
2021-03-11 22:47:11,1370144297958264834,"robinmonottibot: Phase 2 trials of Pfizer completed 19th June 2020, which means Phase 3 needs to last at the very least until 19th June…",131976056,hollydais,,879,15451,,False,False,4961,,,119,0,0.29333333333333333,-0.195,negative
2021-03-11 22:47:11,1370144297148817409,m_scribe source fyi:  — long way between trials and signoff if the other ones are any indication though,15417853,doriantaylor,"Vancouver, Canada",3475,53196,,False,False,90392,,,0,1,0.3875,-0.0875,negative
2021-03-11 22:47:10,1370144295345213442,I have an appointment to get the first half of my Pfizer vaccine tomorrow. I was scheduled to get my vaccine yesterday but they were using Johnson &amp; Johnson which I cannot take because of the way it is manufactured. Soon I will be fully inoculated. I will still stay masked up.,781118593,Texas_Gal49,"Texas, USA",6338,8778,,True,False,52707,,,0,0,0.25,0.04166666666666667,positive
2021-03-11 22:47:10,1370144293331947521,"RothesayTownCat Mine got Pfizer, which sounds like a horse’s name 😹",952648933360062464,LolaKittySLC,"Salt Lake City, UT",6971,299841,,False,False,31936,,,0,1,0.0,0.0,neutral
2021-03-11 22:47:10,1370144293013262338,donkamion78: 12 Prominent scientists and doctors: Medical regulators should release bold figures of the numbers of people who have died…,1035530827734499329,OmegaAmerican,,714,5676,,False,False,28070,,,191,0,0.5555555555555555,0.27777777777777773,positive
2021-03-11 22:47:09,1370144292149329920,"ninaturner: Part two of our Hello Somebody COVID series with TheEricaEngland and DrDooleyMD is now up 🙌🏾

We get the facts straight a…",1217831589390028805,RevLiberty4,,150,6722,,False,False,7801,,,32,0,0.4,0.2,positive
2021-03-11 22:47:09,1370144289343242242,TheTerribleTout: Media loves sensation so a temporary suspension of AZ Vaccine rollout in some European nations getting pl hype. Bloodc…,875979942852513792,AzaleaDunn,,1459,66668,,False,False,122660,,,102,0,0.0,0.0,neutral
2021-03-11 22:47:08,1370144287740944385,"GovInslee: In more good news, I am pleased that we will move to the next tier of eligibility earlier than we thought. On March 17, ever…",1214738012673736705,Stlhd100,,354,298251,,False,False,323593,,,148,0,0.52,0.33999999999999997,positive
2021-03-11 22:47:08,1370144286403129351,"POTUS: One in four adults in the U.S. has received their first COVID-19 vaccine — and we’re now leading the world in vaccinations.

Tha…",18391504,alottawa,,1576,344632,,False,False,11361,,,16416,0,0.3333333333333333,0.25,positive
2021-03-11 22:47:08,1370144286235357184,"kayleighmcenany: FINALLY the Biden admin recognizes the Trump admin’s unprecedented vaccine work:

➡️ “We’re grateful for the work that…",3508034232,wheatfieldmike,"Indiana, USA",1055,99719,,False,False,29335,,,4608,0,0.95,0.3,positive
2021-03-11 22:47:08,1370144286197563393,Notify NYC: REMINDER: NYers 60+ are now eligible to get the COVID-19 vaccine: ,1258593637,tgya22,NYC ,2176,295042,,True,False,131849,,,0,0,0.0,0.0,neutral
2021-03-11 22:47:07,1370144283186098180,"MichelleObama: When you can get the COVID-19 vaccine, I hope you do—Barack and I are certainly glad we did. It’s our best shot at beati…",193964609,kingerx22,St.Paul,155,11890,,False,False,4233,,,8192,0,0.65,0.75,positive
2021-03-11 22:47:07,1370144281453805568,"MichelleObama: When you can get the COVID-19 vaccine, I hope you do—Barack and I are certainly glad we did. It’s our best shot at beati…",23620073,aliaena,Paris & CO,3625,217593,,False,False,139192,,,8192,0,0.65,0.75,positive
2021-03-11 22:47:07,1370144281361518594,"9 covid deaths of care home residents after only receiving single dose of vaccine.  one dose is not vaccinated.

Covid-19: Nine deaths at Exmouth care home ",1051957521127264256,BrexitClock,"Royston Vasey, Little Britain",14220,432082,,False,False,239055,,,22,31,0.6071428571428571,-0.03571428571428571,negative
2021-03-11 22:47:07,1370144280749223937,"Dagens rosor:

Freeport-McMoran  +8,6%
Star Bulk Carriers +7,4%
Kindred + 6,9%
Cemex +5,6%
American Tower +4,6%

Dagens ris:

Bayer -3,7%
SJR -3,5%
Astra Zeneca -2,7%
Carrefour -1,9%
Mowi -1,2%",820606284944830464,Suediarra75,"Täby, Sverige",1218,26568,,False,False,11697,,,0,2,0.0,0.0,neutral
2021-03-11 22:47:07,1370144280090644496,NRMorrow: just heard “yes gurl I got miss moderna!!” yelled from the Number Nine patio; nature is truly healing,458504290,himayw88,"Brooklyn, NY",309,62935,,True,False,19003,,,124,0,0.0,0.0,neutral
2021-03-11 22:47:06,1370144277813153795,"MRKR: An angsty public is turning the Pfizer, Moderna, and Johnson &amp; Johnson vaccines into a dangerous brand battleground, writes notr…",124245139,daniellesacks,new york,8326,3339,,True,True,3997,,,1,0,0.48333333333333334,-0.3,negative
2021-03-11 22:47:05,1370144275409768450,"dumptrump33: Just got my Covid vaccine. If you don't follow me on Twitter, you'll be able to follow me via the GPS chip in my arm. Than…",24329569,djradar,"Fayetteville, AR",532,697,,True,False,351907,,,21,0,0.625,0.5,positive
2021-03-11 22:47:05,1370144275162353664,RealJoelSmalley: It has started... ,1040598489040920577,tronderman,,117,21714,,False,False,54155,,,529,0,0.0,0.0,neutral
2021-03-11 22:47:05,1370144274885398528,"amnestyusa: One year after WHO declared the COVID-19 pandemic, rich countries have bought half of the world’s vaccine supply even thou…",49047058,handson149,Sacramento,19,116,,True,False,62971,,,42,0,0.4583333333333333,0.10416666666666667,positive
2021-03-11 22:47:05,1370144274835202048,"DrOlufunmilayo: Denmark, Norway, Iceland have now suspended giving anyone AstraZeneca Covid19 vaccine.

There are fears it causes blood…",1306589430321299456,xophiabasil,"Abuja, Nigeria",47,3798,,True,False,3764,,,626,0,0.0,0.0,neutral
2021-03-11 22:47:05,1370144272117293056,jdylan901: Appreciate the work KendraHotz and CharlesWMcKinn2  are doing to offer some vital context to highlight the racial disparit…,433693512,KendraHotz,"Memphis, TN",74,8850,,False,False,1542,,,3,0,0.4,0.1,positive
2021-03-11 22:47:05,1370144271920152577,"Heated debate at work today so I'm curious, do you think private businesses should require the COVID vaccine for all of their employees (once enough supply)?",29067178,savedemocracy18,,2836,276869,,False,False,105989,,,0,0,0.625,-0.03333333333333333,negative
2021-03-11 22:47:05,1370144271580471305,DrEricDing: Cancer patients need 2nd dose—much less protected against COVID19 after only one dose of Pfizer vaccine. An early 2nd dose…,902596925123330054,madlove_love,,975,131841,,False,False,46350,,,265,0,0.2733333333333333,-0.01333333333333333,negative
2021-03-11 22:47:04,1370144271211331586,CNN: Workers at a Kroger clinic in Central Virginia accidentally injected some customers with empty syringes instead of the Covid-19 va…,1250901315837931520,irnawil884,,189,911,,False,False,801,,,110,0,0.375,-0.05,negative
2021-03-11 22:47:04,1370144271068725256,"kayleighmcenany: FINALLY the Biden admin recognizes the Trump admin’s unprecedented vaccine work:

➡️ “We’re grateful for the work that…",1081217929729978369,HallAgServices,"Crawford,Carroll,Shelby Iowa",205,7571,,True,False,7488,,,4608,0,0.95,0.3,positive
2021-03-11 22:47:04,1370144269084762113,donkamion78: 12 Prominent scientists and doctors: Medical regulators should release bold figures of the numbers of people who have died…,874753056944082947,Azarius_777543,Babylon NY,238,53964,,False,False,50693,,,191,0,0.5555555555555555,0.27777777777777773,positive
2021-03-11 22:47:04,1370144268313006080,"Heading to 1st Pfizer dose!!
 NewProfilePic
HamiltonMusical ",297039744,ShellPatreaux,"North Phoenix, AZ",493,28152,,True,False,19063,,,0,1,0.0,0.0,neutral
2021-03-11 22:47:03,1370144266576662535,"EricMMatheny: Vaccination is not a political talking point. It’s a matter of choice. The truth is, the Covid vaccine was approved very…",27741414,callent,Nunya Bidnesssss,288,13207,,False,False,8595,,,306,0,0.1,0.0,neutral
2021-03-11 22:47:03,1370144265884594176,ruthmkb: I get it AstraZeneca has an expiry date &amp; they shld b used up. BUT indiscriminately jabbing ppl? What has RickHillier been d…,2525412733,cmdott,,573,215312,,False,False,125867,,,46,0,0.0,0.0,neutral
