created,id_str,text,user_id,screen_name,location,followers_count,user_favourites_count,time_zone,geo_enabled,verified,status_count,geo,coords,retweet_count,tweet_favourite_count,Subjectivity,Polarity,Sentiment
2021-03-11 22:43:59,1370143491456647172,"kayleighmcenany: FINALLY the Biden admin recognizes the Trump admin’s unprecedented vaccine work:

➡️ “We’re grateful for the work that…",1226992590890946565,Garycas81837140,"Hendersonville, NC",72,10068,,False,False,13756,,,4608,0,0.95,0.3,positive
2021-03-11 22:43:58,1370143490416459777,BFujer I wouldn't worry about it. Both vaccines are very effective and safe. I had the AstraZeneca - no problems at all.,235597993,Rosey_St,,500,5797,,False,False,6880,,,0,1,0.75,0.64,positive
2021-03-11 22:43:58,1370143489799905284,"BarackObama: Michelle and I got vaccinated against COVID-19 because we know it’s the best way to beat this pandemic, protect one anothe…",779351679334543360,Maritere3377,,95,36453,,False,False,26857,,,10066,0,0.3,1.0,positive
2021-03-11 22:43:58,1370143487786680326,"rockhealth: Phase 1b essential workers, persons with health conditions &amp; over 60 who live in NYS can register for COVID-19 vaccine star…",88939637,rocklandgov,"New City, New York ",3661,633,,False,False,2923,,,3,0,0.4,0.06818181818181818,positive
2021-03-11 22:43:57,1370143484749959168,"EdwardTHardy: Barack Obama, George W. Bush, Bill Clinton and Jimmy Carter took part in an ad campaign to convince the public to get the…",1147708541790281729,glotook,,426,21730,,False,False,24590,,,91,0,0.06666666666666667,0.0,neutral
2021-03-11 22:43:57,1370143484158545925,"GreatGameIndia: THIS IS BIG

8 European nations including Italy, Latvia, Luxembourg, Lithuania, Estonia, Denmark, Norway and Iceland ha…",717468384015859712,MarthaLynneOwe1,Southern Maine,4591,652458,,False,False,812091,,,795,0,0.05,0.0,neutral
2021-03-11 22:43:56,1370143482669588482,swhnyc CSurvivor9 That is exactly what happened to me with the 2nd Pfizer shot. It was definitely worse that what I normally have after a flu shot but I bounced back the next day 100%.,65926828,hackgolf,"Benbrook, TX",740,5472,,False,False,2710,,,0,2,0.25,-4.625929269271485e-18,negative
2021-03-11 22:43:56,1370143481709129729,"NEWS: We spoke with Affinity Health Center about bringing a mobile COVID vaccine clinic to the Town of Clover and teachers and staff in the Chester County School District took the vaccine. 
",36482475,cn2news,"Rock Hill, SC",9050,1108,,True,False,24369,,,0,1,0.1,-0.1,negative
2021-03-11 22:43:56,1370143479112818692,Question: Who set Trump up? Flynn? Russia is up to its old tricks': Biden battling COVID-19 vaccine disinformation campaign  via usatoday,1302616954105212929,DebunkerMimi,"Atlanta, GA",2444,19465,,False,False,8790,,,0,1,0.2,0.1,positive
2021-03-11 22:43:56,1370143479033171975,PragmaticEbooks: MAGA USA FoxNews HillaryClinton DonaldTrump Coronavirus Corona COVID CovidVaccine COVID19 Vaccine vaccinat…,542123429,DiazKmrn,,381,34815,,False,False,33637,,,1,0,0.0,0.0,neutral
2021-03-11 22:43:56,1370143478831714309,"Therese_Rein: Given that it is going to take into next year before all Australians can be fully vaccinated, why not do the job properly…",295857923,AnnieatEureka,"Sydney, Australia",526,30145,,False,False,76236,,,316,0,0.0,0.0,neutral
2021-03-11 22:43:55,1370143478072610819,"channelstv: Taraba Receives 56,250 Doses Of AstraZeneca Vaccines
 ",388563389,salisMangah,"Leicester, United Kingdom ",670,56272,,True,False,64858,,,19,0,0.0,0.0,neutral
2021-03-11 22:43:55,1370143476675796993,narendramodi: Happy to share that my mother has taken the first dose of the COVID-19 vaccine today. I urge everyone to help and motivat…,1580846659,b_devashish,"Bagh Muzaffar Khan, Agra",679,76694,,True,False,45025,,,16832,0,0.6666666666666666,0.525,positive
2021-03-11 22:43:55,1370143476239712265,"Urgent Open Letter from Doctors and Scientists to the European Medicines Agency regarding COVID-19 Vaccine Safety Concerns | by Doctors for Covid Ethics | Mar, 2021 | Medium ",1257786143007014913,LMira66,,65,695,,False,False,4585,,,0,0,0.25,0.0,neutral
2021-03-11 22:43:55,1370143474926768135,"NC_Governor: Gov. Cooper announced that thanks to the hard work of providers, NC will be moving forward in its phased vaccination proce…",19928276,rmunde,"Carrboro, NC",590,61742,,True,False,3904,,,184,0,0.37083333333333335,-0.04583333333333334,negative
2021-03-11 22:43:54,1370143473773338624,Now it’s up to 8 countries AstraZeneca ,258871381,HollyBlomberg,Cascadia Subduction Zone,7668,208910,,False,False,133493,,,1,6,0.0,0.0,neutral
2021-03-11 22:43:54,1370143473391779845,"BarackObama: Michelle and I got vaccinated against COVID-19 because we know it’s the best way to beat this pandemic, protect one anothe…",58391098,Dani_94XOXO,ρεяғεсτℓγ-ιмρεяғεсτ ℓαn∂,729,18143,,True,False,93392,,,10066,0,0.3,1.0,positive
2021-03-11 22:43:54,1370143473328910336,My blood cells when ms. pfizer came on the scene ,215488660,emily_killy,where the money reside,829,71671,,True,False,50406,,,0,1,0.0,0.0,neutral
2021-03-11 22:43:54,1370143472351580162,"DrTeckKhong: Be alert to strokes, transient ischaemic attacks, coronary events and other vascular incidents in the short and intermedia…",1060468464371023874,ex_excalibur,"Canterbury, England",2631,81239,,False,False,27150,,,531,0,0.3375,-0.0625,negative
2021-03-11 22:43:54,1370143471139500033,I got me a Pfizer fix  ,1286833703520546816,climatevegan,Georgia,1729,615,,False,False,411,,,0,2,0.0,0.0,neutral
2021-03-11 22:43:54,1370143470900420609,BREAKING 🇫🇷 France says halting use of AstraZeneca coronavirus vaccine is not needed. $AZN,118794845,MarcoDaCostaFX,StocksLand 💶💵💷,5912,34660,,True,False,1646675,,,3,0,0.0,0.0,neutral
2021-03-11 22:43:53,1370143469600186368,davematt88: I talked to somebody in law enforcement today. They told me that they didn't believe that covid-19 was deadly. That it was…,1136001576517152768,TERRYONEMORETI1,FLORIDUH,6398,163633,,False,False,80418,,,129,0,0.4,-0.2,negative
2021-03-11 22:43:53,1370143468652220418,"JKNjenga: Kenya is a comedy show, but it is not funny.

Weeks after splashing 4.2 billion for MCAs to vote BBI, we are begging 5 billio…",2660007958,ItugiboyJohn,,20,1143,,False,False,188,,,893,0,1.0,-0.125,negative
2021-03-11 22:43:53,1370143467029008385,"WakeUpLibtard: MLossiter imlovinjustinbe themood2020 3_resurection FoxxysTweets How many people who take the ""vaccine"" know what t…",870238846595862528,o_dibble,,810,83200,,False,False,61899,,,3,0,0.5,0.5,positive
2021-03-11 22:43:52,1370143463375843335,"__itsniaj ...from my experience you don’t have a choice LOL. The only difference to my knowledge is that I think Moderna is able to be administered to 16-17 year olds. 

You aren’t special hahaha.",160382956,ariellezsane,DFW,1461,36230,,True,False,92577,,,0,0,0.6592857142857143,0.37142857142857144,positive
2021-03-11 22:43:51,1370143461308039168,"kayleighmcenany: FINALLY the Biden admin recognizes the Trump admin’s unprecedented vaccine work:

➡️ “We’re grateful for the work that…",85645002,AllEliteDoug21,"Houston, TX",1294,12681,,True,False,201222,,,4608,0,0.95,0.3,positive
2021-03-11 22:43:51,1370143460406218752,"NphcdaNG: Press Statement on concerns about the safety of the Oxford/AstraZeneca Vaccine.

We are aware of precautionary concerns that…",388563389,salisMangah,"Leicester, United Kingdom ",670,56272,,True,False,64858,,,233,0,0.25,0.25,positive
2021-03-11 22:43:51,1370143460012011521,COVID-19: France faces challenge to persuade millions of vaccine sceptics to take jab. The most recent polls suggest around half of the adult population may refuse a vaccination. ,1351188126170013698,tycho60944643,"Porto Alegre, Brasil",834,142,,False,False,6653,,,0,0,0.30416666666666664,0.10833333333333334,positive
2021-03-11 22:43:51,1370143459764473860,"CJBowden1: ""No link between COVID-19 vaccine and...

👉4 Utahns who died after shots👈, medical examiner says.""

SaltLakeTribBRK (3/9)…",1096228620,Rawmarla,Im falschen Film ...,119,9717,,False,False,5708,,,98,0,0.0,0.0,neutral
2021-03-11 22:43:51,1370143458690760705,danieteebee: It’s completely predictably American that the brand of COVID vaccine you have access to has now become a class signifier,799762104441933824,jackie_yacky,,262,99944,,False,False,46359,,,10901,0,0.0,0.0,neutral
2021-03-11 22:43:51,1370143458166513668,"boblister_poole: How 46 of the 50 constituencies of England with the worst Covid vaccine uptake are LABOUR
via ",3291055667,PoirotAD,South coast of England,1231,81839,,False,False,54497,,,27,0,1.0,-1.0,negative
2021-03-11 22:43:50,1370143454483845121,"DHSCgovuk: ""There is no shred of evidence to suggest that the vaccine affects your fertility, either male or female.""

Watch Dr Charles…",573942814,Helc2,England,158,24392,,True,False,3436,,,125,0,0.13333333333333333,0.0,neutral
2021-03-11 22:43:49,1370143453359828994,"CP24: No evidence Oxford-AstraZeneca vaccine is behind blood clots, Canadian experts say  ",402947123,MyBeautyBug,Canada,1400,55105,,False,False,134623,,,43,0,0.7,-0.4,negative
2021-03-11 22:43:49,1370143452286091267,"LisasEyeRoll: AstraZeneca on hold due to blood clots from one patient 

Birth control pill: hold my beer",2763962121,DreamsofDeyes,London,5100,272574,,True,False,198198,,,665,0,0.375,-0.125,negative
2021-03-11 22:43:49,1370143451916959750,danieteebee: It’s completely predictably American that the brand of COVID vaccine you have access to has now become a class signifier,3266650100,therealaiysha,,223,23879,,False,False,11287,,,10901,0,0.0,0.0,neutral
2021-03-11 22:43:49,1370143450486562822,"allieb10017: In one week, eight family members were diagnosed with COVID-19. Ages 3 to 71. The eldest is in the hospital on oxygen. Ton…",1295139386086944768,ThinkFirst2020,,51,10808,,False,False,10203,,,277,0,0.0,0.0,neutral
2021-03-11 22:43:49,1370143449828061186,pewcubed Wooohooo! I get my second moderna dose tomorrow!,268133693,megstar73,,945,237335,,True,False,91680,,,0,4,0.0,0.0,neutral
2021-03-11 22:43:49,1370143449765326852,BradBeauregardJ: President Jimmy Carter looks so happy to get his covid vaccine...I love this ❤️💉 ,386445219,grayakg,Section 343,81,8080,,False,False,17310,,,67,0,0.8,0.65,positive
2021-03-11 22:43:49,1370143449475731458,timesuppeeps: AstraZeneca Vax rollout halted due to Safety concerns. Previously healthy people developed life threatening blood clots s…,1266248346760404993,Dyncymraeg2,Australia,343,21356,,False,False,24734,,,191,0,0.39166666666666666,0.15833333333333333,positive
2021-03-11 22:43:48,1370143448502661120,danieteebee: It’s completely predictably American that the brand of COVID vaccine you have access to has now become a class signifier,45937219,MuffinTVB42,,305,61834,,False,False,36022,,,10901,0,0.0,0.0,neutral
2021-03-11 22:43:48,1370143447898861569,"Reuters: Health authorities in Denmark, Norway and Iceland have suspended usage of the COVID-19 vaccine produced by AstraZeneca after r…",1049706021835472897,WhHartmann,Earth,210,47566,,False,False,41832,,,417,0,0.0,0.0,neutral
2021-03-11 22:43:48,1370143447475052546,"POTUS: One in four adults in the U.S. has received their first COVID-19 vaccine — and we’re now leading the world in vaccinations.

Tha…",63646618,DrLoveless73,"Anaheim, CA",27,14021,,False,False,9460,,,16416,0,0.3333333333333333,0.25,positive
2021-03-11 22:43:48,1370143447357751299,RogersM24010506: GeorgeKiumlaw JaneRuth_Aceng Disja7 globalcitizenln Suenabu2 DiasporaNup BukiirwaNina JonesNamukasa mulungi_p…,884095927828590592,Reelani18,Somewhere on God's Green Earth,890,29510,,False,False,20300,,,2,0,0.0,0.0,neutral
2021-03-11 22:43:48,1370143446380376066,"samjawed65: Sit down! 
Canada has following supplier agreements for COVID-19 vaccine - 
Pfizer: upto 76 million doses
Moderna: 44m
Astr…",1342102221580713986,AdhilArsh,"Pinang, Malaysia ",426,44603,,True,False,16036,,,769,0,0.19444444444444448,-0.09722222222222224,negative
2021-03-11 22:43:47,1370143443071209479,"Had a lovely photo shoot with AstraZeneca this morning 😍 

Can’t wait for my turn to get the shot! 💉 ",2871199398,macdonald_erika,,529,28130,,True,False,2037,,,0,10,0.75,0.625,positive
2021-03-11 22:43:47,1370143442475614219,"KatyTurNBC: One year of COVID. 
Seven months pregnant. 
First shot of Pfizer. ",24197100,liliknits,Louisiana,4435,149296,,False,False,96133,,,453,0,0.41666666666666663,0.29166666666666663,positive
2021-03-11 22:43:46,1370143440206462979,pmnewsnigeria: Why I haven’t taken AstraZeneca COVID-19 vaccine – Sanwo-Olu ,3293378943,Stormysommy,Ogbe,172,1059,,False,False,20558,,,3,0,0.0,0.0,neutral
2021-03-11 22:43:45,1370143434757918720,In this Verywell story by jenchesak I talk about the success story of IHSgov in vaccinating the most vulnerable people.  pandemic COVID19 CovidVaccine coronavirus Corona vaccine,1081114798463569920,TheJagdish,New Mexico State University,210,11373,,False,False,632,,,0,3,0.3333333333333333,0.10000000000000002,positive
2021-03-11 22:43:45,1370143433877250053,channelstv: France Sees 'No Need' To Suspend AstraZeneca Vaccine  ,388563389,salisMangah,"Leicester, United Kingdom ",670,56272,,True,False,64858,,,17,0,0.0,0.0,neutral
2021-03-11 22:43:45,1370143432719667208,spectatorindex: JUST IN: France says halting use of AstraZeneca coronavirus vaccine is not needed,1253973345219088384,lefophanasteve2,Inside a Cocoon,3842,20741,,True,False,22864,,,492,0,0.0,0.0,neutral
2021-03-11 22:43:44,1370143431788478466,"BBCNews: Friday’s FT: “EU vaccine woes deepen as clouds gather over AstraZeneca supplies” 
 
BBCPapers TomorrowsPapersToday ",22036035,mylesie,Moville Co.Donegal,1845,40878,,True,False,199914,,,19,0,0.0,0.0,neutral
2021-03-11 22:43:44,1370143431679434759,mariamainmo: Girls don't want boys. They want the covid vaccine and a nice apartment,888099002297856001,niightliights,ur dreams ,262,38792,,True,False,13753,,,25209,0,1.0,0.6,positive
2021-03-11 22:43:44,1370143430609932292,"CTV_AvisFavaro: Astra Zeneca statement ""An analysis of our safety data of more than10 million records has shown no evidence of an incre…",2525412733,cmdott,,573,215312,,False,False,125867,,,69,0,0.5,0.5,positive
2021-03-11 22:43:44,1370143430135848963,"AndrewMakeTweet: Pfizer FreeTheVaccine PeoplesVaccine protest in NYC

With actions globally, we demand an end to false scarcity and v…",802917496445497345,CurveWhiplash,"Eureka, CA",91,256689,,False,False,143474,,,80,0,0.3,-0.20000000000000004,negative
2021-03-11 22:43:43,1370143427208298497,"alanredmond: FatEmperor Great presentation by doctor in Idaho about COVID, vitamin D, effective treatments and vaccine data.  ",1335614108264173570,Michael95593735,,14,5078,,False,False,329,,,50,0,0.775,0.7,positive
2021-03-11 22:43:43,1370143425631227906,"Malinowski: Rite Aid will be taking COVID vaccine appointments only for educators and child care workers through tomorrow, to help us s…",1073852533,laurenrajczak,,975,31585,,True,False,140456,,,12,0,1.0,0.0,neutral
2021-03-11 22:43:43,1370143425337597953,First dose of Covid vaccine. Waiting for the second one. ,116867606,Yennyrah,"Jakarta, Indonesia",289,969,,True,False,2654,,,0,2,0.16666666666666666,0.125,positive
2021-03-11 22:43:43,1370143424469426194,SteiniBrown: Teachers pls consider sharing: UofT_dlsph researchers are studying COVID in Ontario teachers &amp; other education workers. P…,515011742,LauraineWoods,"Burlington, Ontario",67,3005,,False,False,1296,,,302,0,0.375,-0.125,negative
2021-03-11 22:43:43,1370143424318472196,The_BMC: “What we really are hoping for &amp; what we want out of these vaccines is that we keep people out of the hospital and we keep peo…,948703023710294016,alarammaa_,"Katsina, Nigeria",942,19397,,True,False,5807,,,57,0,0.2,0.2,positive
2021-03-11 22:43:42,1370143421768290304,danieteebee: It’s completely predictably American that the brand of COVID vaccine you have access to has now become a class signifier,363833458,bellaknowsitall,Your imagination ,1974,34276,,True,False,231996,,,10901,0,0.0,0.0,neutral
2021-03-11 22:43:42,1370143420115791878,"MichelleObama: When you can get the COVID-19 vaccine, I hope you do—Barack and I are certainly glad we did. It’s our best shot at beati…",2253544608,hlthiskrieger,,4317,578015,,True,False,325247,,,8192,0,0.65,0.75,positive
2021-03-11 22:43:41,1370143419906064384,NRMorrow: just heard “yes gurl I got miss moderna!!” yelled from the Number Nine patio; nature is truly healing,81154333,jane_heir,"Dallas, Texas",569,123541,,False,False,22023,,,124,0,0.0,0.0,neutral
2021-03-11 22:43:41,1370143418761027591,MCFCTone Funny every death to people who already had a medical condition is weird enough related to covid. But those who died to the covid vaccine aren't related,1292490159947165701,ATLhasnoring,,2252,20055,,False,False,10500,,,0,1,0.5499999999999999,-0.041666666666666664,negative
2021-03-11 22:43:41,1370143417909542917,TIME: Breaking down what COVID-19 vaccine effectiveness means ,4240559781,okreddogdjn,,181,35331,,False,False,55941,,,47,0,0.2888888888888889,-0.15555555555555559,negative
2021-03-11 22:43:41,1370143417251082248,donkamion78: Several European countries suspend AstraZeneca vaccinations over blood clot fears ,1329216263072133132,T1deplorable,OH,109,1923,,False,False,1201,,,175,0,0.0,0.0,neutral
2021-03-11 22:43:40,1370143414503813120,"sikh_coalition: ""Our role is to ensure we provide all the necessary information so they can make an informed decision."" Sikh Coalition…",8437402,ifyc,"Chicago, IL, USA",12859,5724,,True,False,15051,,,2,0,1.0,0.0,neutral
2021-03-11 22:43:40,1370143414000451590,MarchieUK So is the Pfizer one safer,1190713348368809985,goldenlily2017,Land of Lily & Teddy,21250,75064,,False,False,16415,,,0,0,0.0,0.0,neutral
2021-03-11 22:43:40,1370143413002207235,ColinDMello: NEW: Chief Gordon Beardy of Muskrat Dam confirms to CTVNews that they asked MPP Sol Mamakwa to fly-in and get the Moderna…,559696884,leighpowley,worldwide,564,52950,,False,False,2531,,,567,0,0.45454545454545453,0.13636363636363635,positive
2021-03-11 22:43:40,1370143411764793345,"OrianaBeLike: The Pfizer-BioNTech coronavirus vaccine was at least 94% effective against asymptomatic infection, suggesting that the Pf…",123076361,techboone,"Marana, AZ",133,5937,,True,False,4851,,,56,0,0.6000000000000001,0.15,positive
2021-03-11 22:43:40,1370143411597156359,"channelstv: FG Asks Nigerians To Remain Calm, Insists AstraZeneca Vaccine Delivered Is Safe
 ",388563389,salisMangah,"Leicester, United Kingdom ",670,56272,,True,False,64858,,,35,0,0.625,0.4,positive
2021-03-11 22:43:39,1370143407658573824,"hildabast teva_tweets londonboyjohn May this says...kind of late
",2824286557,julietast2,"Los Angeles, CA",163,4137,,False,False,10539,,,0,1,0.6,-0.3,negative
2021-03-11 22:43:38,1370143405460893704,"CNBCnow: BREAKING: Biden signs $1.9 trillion Covid relief bill, clearing way for stimulus checks, vaccine aid 
",469722871,D_Nice215,"Washington, DC",236,6715,,True,False,6744,,,457,0,0.0,0.0,neutral
2021-03-11 22:43:38,1370143405150507012,AnnieSage Get a heating pad handy in case your arm starts to throb. I had the Moderna 1st shot 2 weeks ago and the day after my arm was sore as hell.,32131194,Tuckertown,Colorado,949,2678,,True,False,88236,,,0,1,0.9,0.6,positive
2021-03-11 22:43:38,1370143404936531973,"JajaPhD: This is the Covid-19 vaccine that should be going to front line health workers and those who are the most vulnerable, ba?",127854464,tobbieefash,,4291,13811,,True,False,84370,,,1210,0,0.5,0.0,neutral
2021-03-11 22:43:37,1370143402826866693,"karma44921039: Utah woman, 39, dies 4 days after 2nd dose of COVID-19 vaccine; autopsy ordered ",924338124251189248,Tomreader5,,81,1643,,False,False,6448,,,15,0,0.0,0.0,neutral
2021-03-11 22:43:37,1370143402105405441,Someone in Rob’s one in person class was exposed to covid and is experiencing symptoms LOL you bet I’m glad I we both got part 1 of that Pfizer. I’m HEATED.,20325951,offbeatorbit,Brooklyn via Los Angeles,21870,330040,,True,False,180420,,,0,52,0.85,0.65,positive
2021-03-11 22:43:37,1370143400972926985,GovRonDeSantis: Great announcement with Walgreens in Jacksonville today to highlight the increase of stores offering the vaccine from…,1334904969535893505,ChicOne12,,116,22255,,False,False,25996,,,124,0,0.75,0.8,positive
2021-03-11 22:43:36,1370143397667803139,"PulseNigeria247: This is why Sanwo-Olu has not received COVID-19 vaccine
 ",388563389,salisMangah,"Leicester, United Kingdom ",670,56272,,True,False,64858,,,9,0,0.0,0.0,neutral
2021-03-11 22:43:36,1370143397307113473,"Joyce_Karam: BREAKING: EU approves Johnson and Johnson vaccine but deliveries won’t start till April (AFP).

Comes as Norway and Denmar…",2290293589,SRoyChowdhury01,Am mostly in the United States,819,37613,,False,False,22708,,,87,0,0.0,0.0,neutral
2021-03-11 22:43:36,1370143395969110020,"SandraWeeden: VACCINE HESITANT!

Are we not a necessary ‘Control’ group, those of us who have declined vaccines, without which it would…",1070828174903296005,Dearieme2,🌍,326,12469,,False,False,18908,,,215,0,1.0,0.0,neutral
2021-03-11 22:43:36,1370143395499241472,jsolomonReports: Trump: U.S. ‘probably’ would’ve never had COVID-19 vaccine without him | Just The News ,303850691,01splcheck,,3981,80633,,False,False,331047,,,313,0,0.0,0.0,neutral
2021-03-11 22:43:35,1370143394404696064,"POTUS: One in four adults in the U.S. has received their first COVID-19 vaccine — and we’re now leading the world in vaccinations.

Tha…",443435992,KathrynValido,,21,6813,,False,False,790,,,16416,0,0.3333333333333333,0.25,positive
2021-03-11 22:43:35,1370143394056470528,"G_Soule: Advising people to not take a vaccine is not a ""pro-life"" position. 

",37552089,suestroud,Brentwood Bay Vancouver Island,6233,518297,,True,False,429077,,,10,0,0.0,0.0,neutral
2021-03-11 22:43:35,1370143393184108549,"Reuters: Pfizer and BioNTech will exceed their original global target for COVID-19 vaccines by as much as 20% this year, Pfizer Chief E…",2895588229,SunStatement,,169,14346,,False,False,66989,,,65,0,0.31666666666666665,0.19166666666666665,positive
2021-03-11 22:43:35,1370143391137341443,"SalehGh28: Me watching oxford astrazeneca  vaccine banned after already receiving my first dose..
⁦AstraZeneca⁩ ",1218596758252552195,JK7141,,37,7092,,False,False,2196,,,182,0,0.3333333333333333,0.25,positive
2021-03-11 22:43:35,1370143390654816256,goldenlily2017 I got both Pfizer vaccines and had no problems with either one. Just follow your health department or doctor's advice and get immunized.,38250011,CarolBuchananMT,"NW Montana, USA",1893,6311,,True,False,44797,,,0,5,0.0,0.0,neutral
2021-03-11 22:43:34,1370143390071930888,"integrimart: No one learn how to build an Empire by watching tutorial - ajulu_

Start exercising if you have concerns about your shape…",212647862,ene_precious,"Lagos, Nigeria.",469,14407,,False,False,7672,,,3,0,0.0,0.0,neutral
2021-03-11 22:43:34,1370143388532625409,nickmyer: You must have a blood clot to enter a music concert this summer in the UK. AstraZeneca,180810321,AdamJoshDotCom,🚀Niagara,24587,47489,,True,False,153814,,,5,0,0.0,0.0,neutral
2021-03-11 22:43:34,1370143388356513795,"CDCgov: If you get a COVID19 vaccine, wait at least 14 days before getting any other vaccine, including those for flu or shingles. If…",2756268590,TrinitasRMedCtr,"Elizabeth, New Jersey",691,1163,,True,False,2869,,,380,0,0.3875,-0.2125,negative
2021-03-11 22:43:34,1370143388201271298,"kayleighmcenany: FINALLY the Biden admin recognizes the Trump admin’s unprecedented vaccine work:

➡️ “We’re grateful for the work that…",241172528,DublinMimi,Ohio,1317,71537,,False,False,49034,,,4608,0,0.95,0.3,positive
2021-03-11 22:43:34,1370143388012486656,"Reuters: Health authorities in Denmark, Norway and Iceland have suspended usage of the COVID-19 vaccine produced by AstraZeneca after r…",1355312058460332037,Suzanne14085245,"Lambton, Newcastle",282,4718,,False,False,2148,,,417,0,0.0,0.0,neutral
2021-03-11 22:43:34,1370143387320455171,"GreatGameIndia: THIS IS BIG

8 European nations including Italy, Latvia, Luxembourg, Lithuania, Estonia, Denmark, Norway and Iceland ha…",773002169553457152,Aiace_Twisted,,169,3288,,False,False,7105,,,795,0,0.05,0.0,neutral
2021-03-11 22:43:33,1370143386036957185,Donald Trump Sends Letter Out On Presidential Letterhead Stating He Wants Credit For The COVID-19 Vaccine  ,14204133,balleralert,Ballerville,235098,1723,,False,True,24514,,,8,24,0.1,0.2,positive
2021-03-11 22:43:33,1370143385105829888,AndrewMakeTweet: “Science will win” only if you share it Pfizer. We need potus to FreeTheVaccine from your greedy clutches. ,802917496445497345,CurveWhiplash,"Eureka, CA",91,256689,,False,False,143474,,,15,0,0.7,0.4,positive
2021-03-11 22:43:33,1370143384791289868,First dose of Pfizer vaccine down.,635634718,OneBadNinjaGirl,,139,2548,,True,False,10356,,,0,0,0.3111111111111111,0.04722222222222221,positive
2021-03-11 22:43:33,1370143382245240834,Several European countries have suspended the use of AstraZeneca doses. ,2817144043,NarcityCanada,Canada,16519,69722,,True,True,50861,,,1,2,0.0,0.0,neutral
2021-03-11 22:43:32,1370143382148841473,akbarth3great: Moderna And Pfizer On Track To Hit Vaccine Production Goals ,1347177640243900417,agent_guzman,RTs and Likes ≠ Endorsement,3,13,,False,False,35723,,,3,0,0.0,0.0,neutral
2021-03-11 22:43:32,1370143381423292419,"AlexanderSmith: EMA statement on AZ-Oxford vaccine &amp; blood clots: ""No indication that vaccination has caused these conditions, which ar…",1348720717748187139,BJamma3,,81,9778,,False,False,10173,,,16,0,0.0,0.0,neutral
