created,id_str,text,user_id,screen_name,location,followers_count,user_favourites_count,time_zone,geo_enabled,verified,status_count,geo,coords,retweet_count,tweet_favourite_count,Subjectivity,Polarity,Sentiment
2021-03-11 22:45:16,1370143817865822210,"bryceeet Subtronics pfizer has the highest efficacy though?? not sure why people are worried ab which vaccine is being used when, what matters is that the more vaccines are available, regardless of brand, the safer we all are as a population.",891399684824150016,ftrskr_wav,away,36,25453,,False,False,1008,,,0,20,0.5962962962962962,0.21666666666666667,positive
2021-03-11 22:45:16,1370143817295347718,"BBCNews: Friday’s FT: “EU vaccine woes deepen as clouds gather over AstraZeneca supplies” 
 
BBCPapers TomorrowsPapersToday ",1369563135753994240,jonatha36469630,,3,207,,False,False,157,,,19,0,0.0,0.0,neutral
2021-03-11 22:45:16,1370143817177862146,TheView: WHOOPI RECEIVES COVID-19 VACCINE: Our WhoopiGoldberg tells us she received her first shot of the coronavirus vaccine and enco…,56799190,HollywoodBlvd1,In Hollywood/On Hollywood,1950,153737,,False,False,83497,,,30,0,0.3333333333333333,0.25,positive
2021-03-11 22:45:16,1370143816213274632,anothervim cylonnn ThierryBreton AstraZeneca You really don’t have the first idea.,2411357797,alunprice667,Land of my fathers in law.,263,10193,,False,False,32018,,,0,0,0.26666666666666666,0.225,positive
2021-03-11 22:45:16,1370143816032862210,spectatorindex: JUST IN: France says halting use of AstraZeneca coronavirus vaccine is not needed,1313735208437506050,saidukabubakar1,,191,25135,,False,False,22399,,,492,0,0.0,0.0,neutral
2021-03-11 22:45:16,1370143814619389958,"10TampaBay: Individuals over the age of 18 can register. However, they will not receive an appointment notification until the age requi…",987363005515124744,JustTheFacts37,DeSantis’s COVID Wonderland,1067,151408,,False,False,73700,,,2,0,0.0,0.0,neutral
2021-03-11 22:45:15,1370143812866215942,"alanredmond: FatEmperor Great presentation by doctor in Idaho about COVID, vitamin D, effective treatments and vaccine data.  ",1112442954369650689,Bevbb9,"Yorkshire and The Humber, Engl",482,63898,,False,False,46658,,,50,0,0.775,0.7,positive
2021-03-11 22:45:15,1370143812450979845,Got my COVID vaccine! 🥳,331481387,Stargazing_Val,"Houston, TX",982,33152,,True,False,14147,,,0,33,0.0,0.0,neutral
2021-03-11 22:45:15,1370143810206978050,"POTUS: One in four adults in the U.S. has received their first COVID-19 vaccine — and we’re now leading the world in vaccinations.

Tha…",1241774309288415233,JoGeo15,,98,25938,,False,False,23941,,,16416,0,0.3333333333333333,0.25,positive
2021-03-11 22:45:14,1370143808722112514,donkamion78: 12 Prominent scientists and doctors: Medical regulators should release bold figures of the numbers of people who have died…,1312293145367863299,RatesZero,Also on GAB @RatesZero,1801,6854,,False,False,3090,,,191,0,0.5555555555555555,0.27777777777777773,positive
2021-03-11 22:45:14,1370143808684314625,"JuddLegum: JohnKavanagh_AZ 3. Kavanaugh, who apparently believes its his job to ensure that ""uninformed"" people do not vote is support…",174820573,Helflower,San Francisco,901,265168,,False,False,258096,,,565,0,0.35,0.05,positive
2021-03-11 22:45:14,1370143806738288644,JubalHarshaw13: I miss the days when the COVID vaccine wouldn't kill you. It would just contain a nanochip for ID and tracking...,2271019303,My_Truth_Today,"45.5774658,-62.3012402",7675,125771,,False,False,150655,,,3,0,0.0,0.0,neutral
2021-03-11 22:45:14,1370143806725758982,Jordanfiend361 iNeedKicks Nothing big me or my wife didn’t have issues with moderna either. All my employees  did though and a lot of my patients,2245963598,Tsparks615,615,605,17235,,False,False,8123,,,0,0,0.1,0.0,neutral
2021-03-11 22:45:14,1370143805844914186,"Italian health authorities have ordered the withdrawal of a batch of AstraZeneca coronavirus vaccine following the deaths of two men in Sicily who had recently been inoculated, a source close to the matter said on Thursday.​ ",25562183,Reuters_Health,,253002,66,,False,True,56536,,,5,2,0.11666666666666665,0.0,neutral
2021-03-11 22:45:13,1370143804435619841,"IndiaCongo: Pakistan🇵🇰, the only SAARC country to not seek COVID-19 Vaccine from India, is getting 45 million 🇮🇳 made vaccine Covishiel…",1195527752214028289,GalatBaatX,,31,1516,,False,False,878,,,1403,0,1.0,0.0,neutral
2021-03-11 22:45:13,1370143804100083715,Ethiopian Airlines delivers COVID-19 vaccine from Asia to Africa  Companies  news explore follow 237,236770150,poandpo,World,3445,10207,,False,False,1134467,,,0,0,0.0,0.0,neutral
2021-03-11 22:45:13,1370143803974225925,"bruceanderson: It feels like for almost all my life since I was an altar boy in Valleyfied, the Catholic Church has been a worsening me…",2525412733,cmdott,,573,215312,,False,False,125867,,,28,0,0.1,0.0,neutral
2021-03-11 22:45:13,1370143803395481600,davematt88: I talked to somebody in law enforcement today. They told me that they didn't believe that covid-19 was deadly. That it was…,565933318,krablegg,"Fort Lauderdale, FL",2053,111759,,False,False,96781,,,129,0,0.4,-0.2,negative
2021-03-11 22:45:13,1370143802908934146,"POTUS: One in four adults in the U.S. has received their first COVID-19 vaccine — and we’re now leading the world in vaccinations.

Tha…",363175790,Shnellbag,Hannover,448,76914,,True,False,22194,,,16416,0,0.3333333333333333,0.25,positive
2021-03-11 22:45:13,1370143802447564812,EricMMatheny: Are we going to talk about the healthy 39 year old woman from Utah who got her second dose of the Moderna vaccine and the…,755583815620276224,BaRebelmom,,78,7252,,False,False,26986,,,2907,0,0.2333333333333333,0.19999999999999998,positive
2021-03-11 22:45:13,1370143802351042572,"PatriotGaGa1: This mom was so young! 
The virus is 99% curable on its own, this injection is not needed. 
This is horrific! 😡
",1677256254,Ophydophies,,168,4401,,False,False,4622,,,262,0,0.7999999999999999,-0.09166666666666667,negative
2021-03-11 22:45:13,1370143801918980096,"MuellerSheWrote yoyo_yelena I'm still seeing 28 days on the CDC site for the Moderna. Any possibility you may be receiving the Pfizer-BioNTech COVID-19 vaccine? That one is 21 days. Whichever one it is, wishing you all the best!

",765038442413641728,PalpableConcern,,126,12917,,False,False,2701,,,0,6,0.3,1.0,positive
2021-03-11 22:45:13,1370143801793122304,"Reuters: Pfizer and BioNTech will exceed their original global target for COVID-19 vaccines by as much as 20% this year, Pfizer Chief E…",117822932,_VibhorGupta_,"Kanpur, India",1847,30979,,True,False,32086,,,65,0,0.31666666666666665,0.19166666666666665,positive
2021-03-11 22:45:12,1370143800744624136,duntalk: news outlets are really irresponsible with click bait headlines - there has been zero proof that the Astra Zeneca vaccine dire…,606466030,BonLadino,🇯🇲,1252,242885,,True,False,214610,,,68,0,0.2,0.2,positive
2021-03-11 22:45:12,1370143799117234178,"MediaJerNYC MuellerSheWrote I had my second Moderna. Terrific body aches , fever and a blinding headache. Compared to the alternative I will gladly take the side effects.",1190413705495879680,TerryUlrich8,"Kansas, USA",236,29854,,True,False,1566,,,0,1,0.6666666666666666,0.16666666666666666,positive
2021-03-11 22:45:12,1370143798215520256,"alanredmond: FatEmperor Great presentation by doctor in Idaho about COVID, vitamin D, effective treatments and vaccine data.  ",2890608219,JDelaney92,Ireland,33,399,,False,False,126,,,50,0,0.775,0.7,positive
2021-03-11 22:45:11,1370143797225648131,Biden plans to order 100 mln more Johnson &amp;amp; Johnson COVID-19 vaccine doses  Politics  news explore follow 923,236770150,poandpo,World,3445,10207,,False,False,1134467,,,0,0,0.5,0.5,positive
2021-03-11 22:45:11,1370143793991852035,"AstraZeneca Has anyone died? No, so what’s the problem??? ",2521380914,Magictree_No1,Tomorrow,24,479,,False,False,148,,,0,1,0.0,0.0,neutral
2021-03-11 22:45:11,1370143793224298499,djmillerJA Have you had any discussions so far regarding the vaccine for persons currently sick in the hospital with Covid. Does it make sense for them now,2178325210,Rey1Lor,jamaica,17,1413,,False,False,299,,,0,0,0.9285714285714286,-0.30714285714285716,negative
2021-03-11 22:45:10,1370143792242683904,NRMorrow: just heard “yes gurl I got miss moderna!!” yelled from the Number Nine patio; nature is truly healing,259572764,MGresko2431,,208,24357,,False,False,25323,,,124,0,0.0,0.0,neutral
2021-03-11 22:45:10,1370143791831732225,SaoMc2: GSK makers of Swine Flu vaccine were given indemnity by the HSE/State. The taxpayer is now paying out compensation to victims o…,142349337,DonaghGordon,,633,1997,,True,False,96753,,,11,0,0.0,0.0,neutral
2021-03-11 22:45:10,1370143791047393283,"BarackObama: Michelle and I got vaccinated against COVID-19 because we know it’s the best way to beat this pandemic, protect one anothe…",741321401387364353,McquayCarl,"Lafayette, IN",50,8745,,False,False,8145,,,10065,0,0.3,1.0,positive
2021-03-11 22:45:09,1370143787830415364,NRMorrow: just heard “yes gurl I got miss moderna!!” yelled from the Number Nine patio; nature is truly healing,44709716,umanoid,Trumpsylvania,1908,120954,,False,False,159169,,,124,0,0.0,0.0,neutral
2021-03-11 22:45:09,1370143786727137282,danieteebee: It’s completely predictably American that the brand of COVID vaccine you have access to has now become a class signifier,15328395,GregLescoe,Kyoto,337,31358,,True,False,20347,,,10901,0,0.0,0.0,neutral
2021-03-11 22:45:09,1370143785980719105,"JajaPhD: This is the Covid-19 vaccine that should be going to front line health workers and those who are the most vulnerable, ba?",3360942598,chimdike_david,,3153,2296,,False,False,31397,,,1210,0,0.5,0.0,neutral
2021-03-11 22:45:09,1370143785250869251,"StephnyWilliams: Moderna Vaccine Clinic for Kalamazoo Black &amp; Hispanic, 50 +  vr4smallbiz",155466579,nick_ponton,"Kalamazoo, MI",2292,20806,,True,True,62882,,,2,0,0.43333333333333335,-0.16666666666666666,negative
2021-03-11 22:45:08,1370143782017118210,Iran: Together with Cuba we will manufacture COVID-19 vaccine despite sanctions  Business  news explore follow 227,236770150,poandpo,World,3445,10207,,False,False,1134467,,,0,0,0.0,0.0,neutral
2021-03-11 22:45:08,1370143781765459968,AliceRothchild: Israel’s Health Ministry barred a Palestinian woman from the occupied West Bank who studies at Tel Aviv University from…,2569129194,MagsLand1,UK,905,81788,,True,False,101264,,,42,0,0.0,0.0,neutral
2021-03-11 22:45:07,1370143779567599618,"unojen_wood It’s  noise off stage. Some eg Denmark, responding to questions and being risk averse, understandably. It’s part of the whole journey we’re on internationally. I’ve had Astra Zeneca and looking forward to the 2nd one. Not contracting Covid 19 is the issue in this house- we’re 71",3104329221,lindjw,,2637,276432,,False,False,257755,,,0,2,0.13333333333333333,0.06666666666666667,positive
2021-03-11 22:45:07,1370143777772429314,"POTUS: One in four adults in the U.S. has received their first COVID-19 vaccine — and we’re now leading the world in vaccinations.

Tha…",1180180134894157824,PYCYuga,United States,43,13170,,False,False,5276,,,16416,0,0.3333333333333333,0.25,positive
2021-03-11 22:45:07,1370143777222975502,"The residents at The Heritage Retirement Residence in West Kelowna received their second Covid-19 vaccine and couldn't be happier!! 😀 Vervecares community goodtimes inspiredseniorliving assistedliving vaccine 
 ",825894596966305793,vervesrliving,"Toronto, Ontario",726,489,,True,False,8194,,,0,0,0.0,0.0,neutral
2021-03-11 22:45:07,1370143777201983488,"As we remember the one-year anniversary of the first COVID-19 case in Arkansas today, we look back at the challenges we've overcome. The past year has been difficult for each of us, but the vaccine gives us hope in our fight against this virus.  ",269992801,AsaHutchinson,Arkansas,88917,1047,,True,True,6853,,,4,38,0.3958333333333333,-0.125,negative
2021-03-11 22:45:06,1370143776296079360,SalehGh28 AstraZeneca Same.....,34341482,b_defelici,"43.788288,11.244339",82,5591,,False,False,1090,,,0,1,0.125,0.0,neutral
2021-03-11 22:45:06,1370143775100710912,"kayleighmcenany: FINALLY the Biden admin recognizes the Trump admin’s unprecedented vaccine work:

➡️ “We’re grateful for the work that…",50272660,Sunpoches,London,4618,181281,,False,False,177906,,,4608,0,0.95,0.3,positive
2021-03-11 22:45:06,1370143774362501120,"POTUS GovMurphy Fix the Vaccine Problems: Over 65 ill health can't get find the Vaccine 🤬
""Twenty-three percent said they would consider quitting if they are required to return to an office before all employees have been vaccinated.""  via HuffPostLife",827182422303334400,SueH731,"Manchester, NJ",230,129058,,True,False,142158,,,0,0,1.0,-0.5,negative
2021-03-11 22:45:06,1370143774106587143,"The Obamas, Clintons, Bushes and Carters are promoting the COVID-19 vaccine in two new  Ad Council PSAs debuting on the one-year anniversary of the World Health Organization declaring the virus a global pandemic. ",12480582,adage,"New York, NY",990786,2703,,True,True,154470,,,0,8,0.22727272727272727,0.06818181818181818,positive
2021-03-11 22:45:06,1370143773968064515,SkyNewsAust: Italy has joined several European countries – including Norway and Denmark – temporarily suspending the AstraZeneca vaccin…,983508625,geoffrey_payne,"Central Victoria, Australia ",9099,1237646,,False,False,1191872,,,43,0,0.0,0.0,neutral
2021-03-11 22:45:06,1370143773209071621,Denmark suspends AstraZeneca COVID-19 vaccine  Health  news explore follow 552,236770150,poandpo,World,3445,10207,,False,False,1134467,,,0,0,0.0,0.0,neutral
2021-03-11 22:45:06,1370143772579860481,Got my Covid-19 vaccine today and got my pic posted on the company website with my 2M2LN t-shirt on👍,17599940,spazmcnasty,around,146,479,,True,False,13114,,,2,28,0.0,0.0,neutral
2021-03-11 22:45:05,1370143769375375363,"OldUncleDave: lawless_grant OMGno2trump kayleighmcenany ""Given the totality of his remarks on the subject during the town hall, it i…",3121709018,holmanland,,768,122593,,False,False,132702,,,4,0,0.3333333333333333,-0.16666666666666666,negative
2021-03-11 22:45:05,1370143768427520010,danieteebee: It’s completely predictably American that the brand of COVID vaccine you have access to has now become a class signifier,3609952036,l0w_kii,,1118,97709,,True,False,35767,,,10901,0,0.0,0.0,neutral
2021-03-11 22:45:04,1370143766162509824,"Still not feeling better since I got that AstraZeneca vaccine yesterday. 
No blood clots but fatigue and some joint pains and a massive headache.
Dr said I have to wait 48 hours then call him back.",19231950,STGGamings,,26,3169,,False,False,10677,,,2,0,0.5,0.16666666666666666,positive
2021-03-11 22:45:04,1370143765940350976,"simondolan: Nothing to see here. Move along. Perfectly safe....

Italy and Norway join Denmark in suspending use of AstraZeneca vaccine…",718470996899049472,JohnMarcmail,UK,2980,134916,,False,False,117743,,,893,0,0.5,0.5,positive
2021-03-11 22:45:04,1370143765290180609,BRAINCURES: gentlewomanboss do_kinder BullyingAlberta BulliesCampaign ThePeoplesHubUK DelusionalAcad1 rossthomson26 TruthsayerO…,1254403386507698176,do_kinder,"London, England",1249,8427,,False,False,18013,,,10,0,0.0,0.0,neutral
2021-03-11 22:45:04,1370143765248290821,"Health officials said on Thursday that more than half of all seniors age 65 and older in Lake County have received at least one dose of the COVID-19 vaccine.
",514800409,LMCScanner,"Lake County, IL",10403,276,,False,False,25816,,,2,13,0.35,0.05,positive
2021-03-11 22:45:03,1370143762073067522,Denmark pauses AstraZeneca COVID-19 vaccine to probe reports of blood clots ,1305404772,PonokaNews,"Ponoka, AB",1128,68,,False,False,21629,,,0,0,0.0,0.0,neutral
2021-03-11 22:45:03,1370143761825730560,"ImMissAdorable Well, actually, I did feel a little 'flushed/buzzed' for a short time after the shot, but really nothing much.  I'm happy to take the 2nd, whatever the outcome. And I'm glad to have gotten the Pfizer...",2411542056,SB_Feldman,No. Balto. Co.,199,9976,,False,False,10454,,,0,1,0.4428571428571428,0.1875,positive
2021-03-11 22:45:03,1370143760504528897,CNN: Denmark is suspending use of the Oxford-AstraZeneca vaccine as it investigates reports of some patients developing blood clots. It…,23812651,pianotinkler,Northeast USA,21930,45234,,True,False,70134,,,351,0,0.0,0.0,neutral
2021-03-11 22:45:03,1370143760001200131,donkamion78: 12 Prominent scientists and doctors: Medical regulators should release bold figures of the numbers of people who have died…,44599716,omctc,Canada ,138,8353,,True,False,15267,,,191,0,0.5555555555555555,0.27777777777777773,positive
2021-03-11 22:45:03,1370143759992774661,Pfizer: Our COVID-19 vaccine prevents 94 percent of asymptomatic infection  Health  news explore follow 125,236770150,poandpo,World,3445,10207,,False,False,1134467,,,0,0,0.0,0.0,neutral
2021-03-11 22:45:02,1370143759577452544,"MichelleObama: When you can get the COVID-19 vaccine, I hope you do—Barack and I are certainly glad we did. It’s our best shot at beati…",1360077600,sacjai,"Los Angeles, CA",19455,25017,,True,True,12270,,,8192,0,0.65,0.75,positive
2021-03-11 22:45:02,1370143758445076485,A suburban school district was forced to shut down on Thursday because 125 staff and teachers had side effects to the COVID-19 vaccine.​  ,7663702,fox32news,"Chicago, IL",150965,3015,,True,True,180638,,,2,6,0.16296296296296298,-0.15185185185185188,negative
2021-03-11 22:45:02,1370143758428307456,"Woohoo.  Just booked my appointment for round 1 covid vaccine at Emory. 

I’m not excited actually.  Just want to get it out of the way and move on.  (Like most folks)

I can’t wait until this part of our history comes to an end. 💔",706875409179275265,lt4agreements,Eternity,17472,168513,,False,False,70862,,,7,114,0.4375,0.028124999999999997,positive
2021-03-11 22:45:02,1370143757891424262,spectatorindex: CORONAVIRUS: Denmark has temporarily suspended the AstraZeneca coronavirus vaccine as a precautionary measure due to ca…,2848458261,manuelthurmanjr,,130,1084,,True,False,4579,,,2999,0,0.375,-0.125,negative
2021-03-11 22:45:02,1370143756972867585,"Moderna Vaccine Clinic for Kalamazoo Black &amp; Hispanic, 50 +  vr4smallbiz",160575782,StephnyWilliams,"Kalamazoo, MI",1279,5268,,True,False,5077,,,2,0,0.43333333333333335,-0.16666666666666666,negative
2021-03-11 22:45:01,1370143755211317249,"DoctorEmto: Fake Covid-19 vaccine are on its way to Nigeria.

How you know it's fake? It will be for sale! That's just one of it.

Than…",3346394008,ChyderiaM,"Benue, Nigeria",534,16057,,False,False,21877,,,21,0,1.0,-0.5625,negative
2021-03-11 22:45:01,1370143755169193984,Reuters: Denmark suspends AstraZeneca COVID vaccine after blood clot reports  ,272118514,ds13_manon,,9716,284363,,False,False,273630,,,1009,0,0.0,0.0,neutral
2021-03-11 22:45:01,1370143754879967233,The Reason Black Americans Are Getting Vaccinated At A Much Slower Rate Is Not Because They’re Reluctant ,731592726924263425,sandra4killeen,"Killeen, TX",288,9317,,True,False,10412,,,0,0,0.31666666666666665,0.016666666666666677,positive
2021-03-11 22:45:01,1370143753953026052,A 103-year-old San Francisco Bay Area man recently received his second dose of the COVID-19 vaccine — but that’s not all that’s extraordinary about him.​  ,3888351,fox6now,Milwaukee,86867,284,,False,True,324549,,,0,2,0.4166666666666667,0.1111111111111111,positive
2021-03-11 22:45:01,1370143753189486592,"richardzussman: On AstraZeneca concerns being raised in Europe, Dr. Henry says everything is being looked at by lot number. Says it was…",34128870,Coover_Girl,"Munich, Bavaria",299,22205,,False,False,55665,,,6,0,0.0,0.0,neutral
2021-03-11 22:45:01,1370143751797096449,"rmariboe mikebarnkob Your comparison doesn't hold, the matter at hand is vaccine safety, hence the pause button was pressed for 2 weeks research. 
Same goes for 8 other European countries.

The AZ vaccine trial was rather flawed anyway :
",575214489,solongsweeties,,736,17172,,False,False,16778,,,0,0,0.25,-0.15625,negative
2021-03-11 22:45:00,1370143751100850177,"BarackObama: Michelle and I got vaccinated against COVID-19 because we know it’s the best way to beat this pandemic, protect one anothe…",326535927,Capt_Ingenuity,Space Wakanda,904,12232,,True,False,67456,,,10065,0,0.3,1.0,positive
2021-03-11 22:45:00,1370143748533981187,"VERIFY: Plasma treatment for COVID-19 patients will delay vaccine 

",15770208,LocalMemphis,"Memphis, TN",34473,6002,,True,True,190351,,,0,0,0.0,0.0,neutral
2021-03-11 22:45:00,1370143748424929283,"How to spot a vaccine scam. AARP and the federal government are warning about a spike in scams offering information and signups for the COVID vaccine.  See how to spot the scams. Watch Alabama News Network at 5 &amp; 5:30.
whatthetech covidscam 
vaccinescam alabamanewsnetwork ",64115649,ALNewsNetwork,"Montgomery, Alabama",28794,4278,,True,False,83679,,,0,0,0.0,0.0,neutral
2021-03-11 22:45:00,1370143748336783360,"An emotional moment ensued for one grandmother who received her second dose of the COVID-19 vaccine, allowing her to reunite with her grandson ",22990962,kmoxnews,"St. Louis, MO",81405,4228,,True,True,147936,,,1,2,0.325,0.0,neutral
2021-03-11 22:45:00,1370143748059959300,TheTerribleTout: Media loves sensation so a temporary suspension of AZ Vaccine rollout in some European nations getting pl hype. Bloodc…,392416052,D_Shaqstar,Portmore,552,6235,,False,False,7858,,,102,0,0.0,0.0,neutral
2021-03-11 22:44:59,1370143745988030465,"Suddenly became eligible for the CovidVaccine yesterday...and got my first dose today (the one-year anniversary of the declaration of a worldwide pandemic). So grateful to so many people right now. Please get a COVID vaccine when it’s your turn, and stay safe out there. ❤️😷 ",766314956,LEBWC98,"Potsdam, NY",253,24415,,True,False,21939,,,0,6,0.4738095238095238,0.3071428571428571,positive
2021-03-11 22:44:59,1370143745895657472,JubalHarshaw13: I miss the days when the COVID vaccine wouldn't kill you. It would just contain a nanochip for ID and tracking...,972572778598580224,TokyoxLACult,"Los Angeles, CA",888,14252,,False,False,6490,,,3,0,0.0,0.0,neutral
2021-03-11 22:44:59,1370143745681846276,I FINALLY get to find out about my Covid vaccine tomorrow,971550292482211840,_BrokeAndHungry,"Toronto, Ontario",257,56568,,True,False,24238,,,0,2,1.0,0.0,neutral
2021-03-11 22:44:59,1370143744503255040,"POTUS: One in four adults in the U.S. has received their first COVID-19 vaccine — and we’re now leading the world in vaccinations.

Tha…",1076875835162931206,JamesWilson0904,"Covington, GA",172,41354,,True,False,5212,,,16416,0,0.3333333333333333,0.25,positive
2021-03-11 22:44:59,1370143744201269259,CNN: Workers at a Kroger clinic in Central Virginia accidentally injected some customers with empty syringes instead of the Covid-19 va…,695107003534934016,kylahkylah_,,464,59164,,False,False,24473,,,110,0,0.375,-0.05,negative
2021-03-11 22:44:58,1370143740912926722,disclosetv: JUST IN - Norway and Denmark suspend Oxford-AstraZeneca COVID19 vaccine rollout.,23812651,pianotinkler,Northeast USA,21930,45234,,True,False,70134,,,2585,0,0.0,0.0,neutral
2021-03-11 22:44:58,1370143740254388227,LasVegasLocally: Casino and hospitality workers are eligible to get the covid-19 vaccine in Nevada. Finally.,203290198,dirrty862,"Illinois, USA",1708,255,,True,False,117784,,,231,0,1.0,0.0,neutral
2021-03-11 22:44:58,1370143739130351618,"Doesnotplaywel: righttospeak3 LockdownLazarus UK PFIZER VAX - 49,472 ADVERSE DRUG REACTIONS INCLUDING 107 DEATHS IN 7 WEEKS",1163033708905021441,MindfulnessZen2,“Karma is meeting yourself.”  ,244,4442,,False,False,10695,,,29,0,0.0,0.0,neutral
2021-03-11 22:44:57,1370143735397412864,"BarackObama: Michelle and I got vaccinated against COVID-19 because we know it’s the best way to beat this pandemic, protect one anothe…",615435035,MamaTasha106,"Columbus, OH",3,2,,False,False,4,,,10065,0,0.3,1.0,positive
2021-03-11 22:44:56,1370143733350563841,KatherineJWu: There are a lot of reasons to shout the news of a vaccination from the rooftops. But not everyone feels that way after th…,3231061699,BGHeaven,"Texas, USA",8056,423217,,True,False,331263,,,25,0,0.0,0.0,neutral
2021-03-11 22:44:56,1370143733077905409,IgorLetina: I am so very angry right now. Swiss government had an offer from Lonza (which makes Moderna vaccines): for an investment of…,3378188891,harridanechoes,"San Francisco, CA Richmond, VA",38,10117,,False,False,10608,,,37,0,0.7678571428571428,-0.18214285714285716,negative
2021-03-11 22:44:55,1370143730053869570,"bobbyhristova: A HamOnt woman says she was ""appalled"" to find a newsletter rife with COVID-19 myths and anti-vaccine sentiments in her…",381621895,Anton_P_Nym,"London, Ontario, Canada",571,132104,,False,False,128247,,,8,0,1.0,-0.8,negative
2021-03-11 22:44:55,1370143728971739136,spectatorindex: JUST IN: France says halting use of AstraZeneca coronavirus vaccine is not needed,280040064,Okulo_Jnr,Ogygia,12483,3026,,True,False,357662,,,492,0,0.0,0.0,neutral
2021-03-11 22:44:55,1370143727939911683,HollyBlomberg: Now it’s up to 8 countries AstraZeneca ,26868816,rmgg5553,"Wilkinsburg, PA",2069,107131,,False,False,135085,,,1,0,0.0,0.0,neutral
2021-03-11 22:44:54,1370143724450295809,davematt88: I talked to somebody in law enforcement today. They told me that they didn't believe that covid-19 was deadly. That it was…,400841351,MarshellScott,"Garland, TX",587,42604,,True,False,41742,,,129,0,0.4,-0.2,negative
2021-03-11 22:44:54,1370143722755690497,"MichelleObama: When you can get the COVID-19 vaccine, I hope you do—Barack and I are certainly glad we did. It’s our best shot at beati…",752296762195357696,nanners813,,8,2878,,False,False,3864,,,8192,0,0.65,0.75,positive
