created,id_str,text,user_id,screen_name,location,followers_count,user_favourites_count,time_zone,geo_enabled,verified,status_count,geo,coords,retweet_count,tweet_favourite_count,Subjectivity,Polarity,Sentiment
2021-03-11 22:37:27,1370141847063040000,"The country where vaccine passes are getting life back to normal
",971401388860243970,feedpushr,Tou,65,0,,False,False,245718,,,0,0,0.32499999999999996,0.075,positive
2021-03-11 22:37:26,1370141845137682433,"britdawgs Got my 1st one this morning(Moderna) &amp; bith me &amp; my son got bad headaches. No sore arms at all, just a bad headache &amp; a wave of tiredness hit both of us! 2nd shot will be on April 8.",729104018476273665,Staceymoon52,"Wyoming, USA",999,194551,,True,False,77017,,,0,3,0.4444444444444444,-0.5249999999999999,negative
2021-03-11 22:37:25,1370141842734379009,carlyxschn Yes what are you doing for work right now?? The weather is getting better here in the Seattle area too! It's warm today! I have a recurrent training for work and then getting my second dose of the Pfizer vaccine at the end of March so I can go back to work in April. Just chillin!,161081017,MisterSteven14,Ravenclaw common room,128,31732,,True,False,19337,,,0,0,0.3271428571428571,0.33214285714285713,positive
2021-03-11 22:37:25,1370141840704466944,"HoyteKrystal: Barbados has vaccinated 50,621 persons so far with the Oxford AstraZeneca vaccine. (First Dose)",828000196470546432,TheSocaWarrior,Barbados,1565,60502,,True,False,142066,,,3,0,0.6666666666666666,0.175,positive
2021-03-11 22:37:25,1370141840389771264,"ScottTrindall: Don't be wild at Murris for being a priority population for the covid-19 vaccine, be shitty with the country that places…",3106481173,Lilliana_ff,Australia,16,3794,,True,False,80,,,66,0,0.4,0.1,positive
2021-03-11 22:37:25,1370141840209498114,"Moderna And Pfizer On Track To Hit Vaccine Production Goals  fcBIZ fcNEWS fcNPR Pfizer and Moderna each agreed to supply 100 million doses of COVID-19 vaccine to the U.S. by the end of March. With just under three weeks left, both companies have their …",888399761128267776,fonecable,London,1169,214,,False,False,97870,,,0,0,0.0,0.0,neutral
2021-03-11 22:37:25,1370141838829572100,"MuellerSheWrote Yay!
 Also, i went yesterday to get the moderna at the VA. Turns out they received JnJ the day before, so i got that one instead. But i asked them, they didn't ask me. 
FYI",898254938601553925,Zekezat,,339,27476,,False,False,8072,,,0,1,0.0,0.0,neutral
2021-03-11 22:37:24,1370141837143445506,"JosephEllis408: Summer 2021:

“YO SO DID YOU GET PFIZER OR MODERNA?” ",104965154,CoskunCokbulan,,455,6318,,True,False,14862,,,46576,0,0.0,0.0,neutral
2021-03-11 22:37:24,1370141835553804289,"AmyBeePhoenix: The media decides what is and isn't a crisis. Example:

2019 there were 13 unarmed black men shot and killed by police…",1122161715049848833,Freeman_JesseW,Clown World ,59,2434,,False,False,745,,,6,0,0.21666666666666667,-0.18333333333333335,negative
2021-03-11 22:37:24,1370141835155230724,"NBCNews: BREAKING: President Biden signs $1.9T Covid relief bill into law; ​includes $1,400 checks, $300/wk jobless benefits, child all…",31946653,BrendaEliaLara1,"ÜT: 34.143211,-118.397545",152,5274,,True,False,71836,,,2370,0,0.0,0.0,neutral
2021-03-11 22:37:23,1370141831057584131,spectatorindex: CORONAVIRUS: Denmark has temporarily suspended the AstraZeneca coronavirus vaccine as a precautionary measure due to ca…,848247467716091904,allanahabwe633,"Kampala, Uganda",1091,10241,,False,False,3917,,,3000,0,0.375,-0.125,negative
2021-03-11 22:37:21,1370141823591718921,"solmamakwa: On March 1, 2021, I was invited by Sandy Lake First Nation to receive my 2nd dose of Moderna vaccine.  I was there to promo…",28638976,daniellemuma,"London, Ontario",402,1356,,True,False,6382,,,234,0,0.16666666666666666,0.125,positive
2021-03-11 22:37:21,1370141822450810881,danieteebee: It’s completely predictably American that the brand of COVID vaccine you have access to has now become a class signifier,786395223245123584,naturalflikchik,"Atlanta, GA",1387,35932,,True,False,79059,,,10902,0,0.0,0.0,neutral
2021-03-11 22:37:20,1370141820152393732,Praise be to God! My mom was able to schedule her COVID-19 vaccine 🙌🙌🙌,105844396,johni_sweeney,"Cincinnati, OH",1781,192270,,True,False,68207,,,0,6,0.625,0.5,positive
2021-03-11 22:37:20,1370141819544219650,thbear2 fordnation AstraZeneca reported.,1043489008666464256,StdenisKatie,,45,7542,,False,False,4574,,,0,0,0.0,0.0,neutral
2021-03-11 22:37:19,1370141815819530243,Israeli data reveals Pfizer vaccine prevents almost all asymptomatic COVID cases ,2468949685,nixon1788,,1696,7260,,False,False,36497,,,0,0,0.0,0.0,neutral
2021-03-11 22:37:19,1370141815563771905,"PulseNigeria247: This is why Sanwo-Olu has not received COVID-19 vaccine
 ",349002391,flowwriter360,Here,3020,2134,,False,False,291424,,,9,0,0.0,0.0,neutral
2021-03-11 22:37:19,1370141814968233984,"varadmehta: Pennsylvania's COVID vaccine rollout is a total debacle. Far from being set up to get shots into the arms of seniors, the m…",704380191360077824,matthew8786,Midwest and Mid-Atlantic,448,160276,,True,False,31503,,,34,0,0.875,0.05,positive
2021-03-11 22:37:19,1370141814032900096,borntomub: Just got my first Moderna vaccination dose at the Detroit Association of Black Organizations. DABO is providing vaccinations…,1347959001540132866,CarolineComrade,,67,7065,,False,False,1029,,,32,0,0.3833333333333333,0.04166666666666667,positive
2021-03-11 22:37:18,1370141813126877187,I love our forever President and First Lady Obama buuuuuut I’m still not getting the covid vaccine. K. Thanks.,158890716,marynokay,𝕋𝕙𝕖 𝔻 𝟛𝟙𝟛 📍,1165,5846,,True,False,45255,,,0,0,0.37777777777777777,0.31666666666666665,positive
2021-03-11 22:37:18,1370141811939844096,"UofAResearch: jkenney: Amazing news: Proceeding to clinical trials, made-in-Alberta COVID-19 vaccine from Edmonton’s entospharma i…",14364522,camlinke,Edmonton,2475,2727,,True,False,3372,,,4,0,0.9,0.6000000000000001,positive
2021-03-11 22:37:18,1370141811403059207,ArlingtonVA: We're getting lots of questions about the COVID-19 vaccine and preregistration--and we know it can get confusing. So we're…,2887209233,bcroftlibrary,Arlington,86,610,,False,False,301,,,11,0,0.4,-0.3,negative
2021-03-11 22:37:18,1370141811310727170,ColinDMello: NEW: Chief Gordon Beardy of Muskrat Dam confirms to CTVNews that they asked MPP Sol Mamakwa to fly-in and get the Moderna…,977661207132999680,AllanWebster14, Ontario,388,99851,,False,False,50558,,,568,0,0.45454545454545453,0.13636363636363635,positive
2021-03-11 22:37:18,1370141810153164806,iNeedKicks Second dose of moderna is where the issue is ....... that thing is LOADED,2245963598,Tsparks615,615,605,17235,,False,False,8123,,,0,0,0.0,0.0,neutral
2021-03-11 22:37:17,1370141807737241608,"VanessaGray158: Before COVID, Gates Planned Social Media Censorship of Vaccine Safety Advocates With Pharma, CDC, Media, China and CIA…",17836555,mummygirl,NW England and Scotland.,1232,91108,,False,False,623681,,,7,0,0.06666666666666667,0.03333333333333333,positive
2021-03-11 22:37:17,1370141807590436865,"JosephEllis408: Summer 2021:

“YO SO DID YOU GET PFIZER OR MODERNA?” ",9116332,harriekd,Chicago / London,2733,167370,,True,False,290542,,,46576,0,0.0,0.0,neutral
2021-03-11 22:37:16,1370141804906086406,joedaddyhala: New ad by former US Presidents urges all who are candidates to please get the Covid vaccination.  Guess who’s not in the…,1350303464732168193,GrammiePammie14,"Wichita, KS",537,27701,,False,False,39539,,,36,0,0.22727272727272727,0.06818181818181818,positive
2021-03-11 22:37:15,1370141799692525578,"owermohle: These Novavax data are pretty stellar. 

- 96% effective against original coronavirus.
- 55% effective against strain found…",498415826,MyahWard,,1378,2442,,True,False,2665,,,4,0,0.72,0.41500000000000004,positive
2021-03-11 22:37:15,1370141798094475266,"CarpathViking: Well, if the two AstraZeneca-factories inside the EU would honoring their commitments, then a lot of vaccine could be…",1048334353888157696,hedleyfarquhar,"Trefin, Wales",207,659,,True,False,18423,,,1,0,0.0,0.0,neutral
2021-03-11 22:37:14,1370141795825430532,"m_scribe: Breaking: Novavax announces efficacy results in its vaccine trials.

* 100% protection against severe disease
* 96% effective…",1411023614,ThatElJefe,Hollywood For Ugly People,2085,5667,,False,False,13850,,,689,0,0.0,0.0,neutral
2021-03-11 22:37:14,1370141795498090496,"m_scribe: Breaking: Novavax announces efficacy results in its vaccine trials.

* 100% protection against severe disease
* 96% effective…",15639858,baym,A talking head on a screen,13321,37644,,False,False,20441,,,689,0,0.0,0.0,neutral
2021-03-11 22:37:14,1370141795439554563,"Level1Paladin gogabemartinez RoosterTeeth Not to mention the whole thing about how ""the vaccine will make it so things can go back to normal"" is BS. The vaccine doesn't prevent you from getting or spreading covid, so why is it going to change things? That's literally just making people suspicious.",969466307216330752,InyanaMoon,,27,643,,False,False,5405,,,0,2,0.3499999999999999,0.11666666666666665,positive
2021-03-11 22:37:14,1370141795116548099,michaelcoren I think seniors over 65 prefers Pfizer.,167558182,Pimlico888,"Ontario, Canada",79,5716,,False,False,7166,,,0,0,0.0,0.0,neutral
2021-03-11 22:37:14,1370141794059624448,"bopanc: Serbia to start manufacturing Sinopharm Covid-19 vaccines this October in cooperation with the UAE and China. Separately, it wi…",42072562,BogdanGecic,Belgrade City,682,12969,,False,False,5570,,,13,0,0.0,0.0,neutral
2021-03-11 22:37:13,1370141792469839874,"theJagmeetSingh: .SolMamakwa is someone I consider a friend

He got a COVID-19 vaccine publicly for the safety of his constituents and…",246667561,pqpolitics,"Vancouver, BC",6414,5866,,False,False,561088,,,135,0,0.06666666666666667,0.0,neutral
2021-03-11 22:37:13,1370141792180391938,"DHSCgovuk: ""There is no shred of evidence to suggest that the vaccine affects your fertility, either male or female.""

Watch Dr Charles…",1238467680773894146,CoronaUpdateBot,,1173,65,,False,False,589003,,,125,0,0.13333333333333333,0.0,neutral
2021-03-11 22:37:13,1370141791098437642,"Ps5 in the bag, covid vaccine booked &amp; a final kill warzone victory IfCarlsbergDidDays",1407697261,JonRoberts91,,192,5730,,False,False,3698,,,0,3,1.0,0.0,neutral
2021-03-11 22:37:13,1370141790645407752,"The COVID-19 vaccination roll-out is underway in BC, and with it, lots of questions. How does it work? Should people with SCI be cautious about getting it? When will it be my turn? Jocelyn Maffin and Dr. Kim Anderson-Erisman address these and more: ",18777652,SCI_BC,"British Columbia, Canada",4827,1702,,False,False,8223,,,2,4,0.5,0.5,positive
2021-03-11 22:37:13,1370141789760413699,"proflevin: ""Louis Farrakhan warns the Black community against taking Covid-19 Vaccine w/US Government’s treacherous history of experime…",268479758,david04mu,London,264,20124,,False,False,14818,,,1,0,0.43333333333333335,-0.16666666666666666,negative
2021-03-11 22:37:13,1370141789089275904,danieteebee: It’s completely predictably American that the brand of COVID vaccine you have access to has now become a class signifier,1015742357470261250,aloebits_,not in class,17,1828,,False,False,3817,,,10902,0,0.0,0.0,neutral
2021-03-11 22:37:12,1370141788246306818,"kayleighmcenany: FINALLY the Biden admin recognizes the Trump admin’s unprecedented vaccine work:

➡️ “We’re grateful for the work that…",1514078150,cajlawless,,65,23603,,True,False,2776,,,4609,0,0.95,0.3,positive
2021-03-11 22:37:12,1370141787260645388,"DoctorEmto: Fake Covid-19 vaccine are on its way to Nigeria.

How you know it's fake? It will be for sale! That's just one of it.

Than…",956091732399153152,hadephunke,"Lagos, Nigeria",436,4679,,True,False,3957,,,21,0,1.0,-0.5625,negative
2021-03-11 22:37:12,1370141786350436355,GortonKitties She wanted tha Pfizer but she ain't old enough,1130931193720037377,RothesayTownCat,Isle of Bute,2457,50268,,False,False,15208,,,0,2,0.35,0.05,positive
2021-03-11 22:37:12,1370141786077687809,"m_scribe: Breaking: Novavax announces efficacy results in its vaccine trials.

* 100% protection against severe disease
* 96% effective…",281341580,ushamcfarling,"Los Angeles, CA",2532,1952,,False,True,6053,,,689,0,0.0,0.0,neutral
2021-03-11 22:37:12,1370141784752414723,Had two moderna! ,329708303,debrob1947,"North Carolina, USA",2573,432810,,False,False,535572,,,0,3,0.0,0.0,neutral
2021-03-11 22:37:11,1370141783326347284,"DoctorEmto: Fake Covid-19 vaccine are on its way to Nigeria.

How you know it's fake? It will be for sale! That's just one of it.

Than…",1225207510883323904,ojaytie,,119,3012,,False,False,1389,,,21,0,1.0,-0.5625,negative
2021-03-11 22:37:11,1370141781585768461,"gforbes: Ford, of course, has had two doses of the Pfizer already, as has his family - or so I hear from a little birdy",3196498726,KateLaterally,,803,38803,,False,False,82131,,,126,0,0.5,-0.1875,negative
2021-03-11 22:37:11,1370141780381863937,"welosthim: CovidVaccine CovidVaccineSideEffects

Covid-19 Vaccine Side Effects World Map

An overview of Covid-19 Vaccine Side Effect…",1371873848,HighTreason1,,262,6343,,False,False,5349,,,1,0,0.0,0.0,neutral
2021-03-11 22:37:10,1370141779257917440,TheTrayci: The suspension of AstraZeneca by most of the powerful nations feels like a whole other pandemic of uncertainties. ,1204197599588372480,aimee60221197,,2040,67065,,False,False,46076,,,8,0,0.56875,0.21875,positive
2021-03-11 22:37:10,1370141778310004740,ColinDMello: NEW: Chief Gordon Beardy of Muskrat Dam confirms to CTVNews that they asked MPP Sol Mamakwa to fly-in and get the Moderna…,1157307809622646785,clapifthisisBS,"Bull Mountain, OR",69,34106,,False,False,3408,,,568,0,0.45454545454545453,0.13636363636363635,positive
2021-03-11 22:37:10,1370141775977844738,"ReporterClaudia KNX1070 Rob Davidson, a US ER MD, told CNN's Brooke Baldwin that approx. 1/3 of the US people eligible for COVID-19 vaccination refused the vacc (""vaccine hesitancy"").  A 1/3 drop in US vacc. people shows how far the US must travel into the future for ""herd immunity"" against this virus.",218538023,IndySpiritus,"LA County, USA",219,0,,False,False,9628,,,0,0,0.5625,0.05,positive
2021-03-11 22:37:09,1370141774786666496,"CharisChang2: Australia rollout of the AstraZeneca vaccine will continue despite several countries in Europe including Denmark, Norway…",15250661,newscomauHQ,Australia,556521,1895,,True,True,261086,,,8,0,0.0,0.0,neutral
2021-03-11 22:37:09,1370141773578739712,"142,000 doses of the Pfizer vaccine arrived in Australia on Feb 15. They were presumably put in their storage containers on Feb 13 or 14.

So on Monday, the unused doses (currently about 35,000) will expire. But, sure, let's blame supply issues. auspol ",61192969,twasink,"Brisbane, Australia",231,13357,,True,False,17416,,,0,1,0.6444444444444444,0.25,positive
2021-03-11 22:37:08,1370141769761972224,"rebelawyer: Do the British thank their queen for the Oxford vaccine?
Do the Americans or Germans thank their President or Chancellor fo…",2911014223,arifms1971,"Dubai, United Arab Emirates",588,73520,,False,False,18663,,,518,0,0.0,0.0,neutral
2021-03-11 22:37:08,1370141769430667272,"DHSCgovuk: ""There is no shred of evidence to suggest that the vaccine affects your fertility, either male or female.""

Watch Dr Charles…",37963496,DHSCgovuk,England,710888,2942,,True,True,19045,,,125,0,0.13333333333333333,0.0,neutral
2021-03-11 22:37:07,1370141764812701698,"Reuters: Health authorities in Denmark, Norway and Iceland have suspended usage of the COVID-19 vaccine produced by AstraZeneca after r…",936308355420905472,DathosBD,"Madrid, Comunidad de Madrid",51234,29164,,False,False,22395,,,418,0,0.0,0.0,neutral
2021-03-11 22:37:07,1370141763747385345,"LisasEyeRoll: AstraZeneca on hold due to blood clots from one patient 

Birth control pill: hold my beer",994231358699470848,SerenaBalkwill,"South West, England",41,7674,,False,False,1449,,,667,0,0.375,-0.125,negative
2021-03-11 22:37:06,1370141762786787330,GoodSirHamlet I got Pfizer as well today. How you feeling so far?,2165609168,Utah_AM,"Salt Lake City, UT",1137,17273,,True,False,31856,,,0,1,1.0,0.1,positive
2021-03-11 22:37:06,1370141761939648515,"POTUS: One in four adults in the U.S. has received their first COVID-19 vaccine — and we’re now leading the world in vaccinations.

Tha…",3304605316,DebbieZ07,,1467,41057,,False,False,17294,,,16392,0,0.3333333333333333,0.25,positive
2021-03-11 22:37:06,1370141761113354240,"mightymacaroon DrKatrin_Rabiei ReedCurtis I can't say I know enough about vaccines, but that sounds rightish. My mom in Boston got Pfizer incidentally (seems like Boston had a lot of that and Moderna).",27265230,galinash,"Stockholm, Sweden",1187,29236,,False,False,18228,,,0,2,0.5,0.0,neutral
2021-03-11 22:37:06,1370141760169463812,"I will be getting a Covid-19 Vaccine next week, I suggest everyone else to do the same.",532657890,BlueSpade70226,"California, USA",406,72118,,True,False,70731,,,0,0,0.0625,0.0,neutral
2021-03-11 22:37:05,1370141756893892609,"GovLarryHogan: According to CDCgov data, 20% of Maryland’s population has now received at least one dose of a COVID-19 vaccine. Maryla…",84662970,BaltimoreGOP,"Baltimore, MD",1408,14607,,True,False,8025,,,41,0,0.4,-0.3,negative
2021-03-11 22:37:04,1370141753630687235,Blood clots after AstraZeneca shots? You mean the vax South Africa dropped already? ,860614623703121920,Rusty_Grapes,,169,20633,,False,False,2144,,,0,0,0.6875,-0.3125,negative
2021-03-11 22:37:04,1370141753601372160,JDiamond1: While about 7 in 10 American adults say they will try to get a Covid shot or already have... the political divide remains.…,1272706401220132864,NthnGd4,"Salt Lake City, UT",3783,114289,,False,False,88425,,,30,0,0.05,0.0,neutral
2021-03-11 22:37:04,1370141753177608192,jacquelinmagnay: AstraZeneca vaccine paused over blood clot fears ,4112208144,editorialjoe,Sydney,429,2857,,True,True,836,,,3,0,0.0,0.0,neutral
2021-03-11 22:37:04,1370141752611471362,"bolton_darjon COVID-19 Vaccination Appointment is on Thu, Mar 11 at 08:00am. Location: 4201 N Himes Avenue, Tampa, FL, 33607. 

 Got my 1st shot. Pfizer
Impressed with the organization.  
2nd shot March 31.",49303240,lymanduggan,"Tampa, Florida",603,3827,,True,False,15502,,,0,0,0.5,0.5,positive
2021-03-11 22:37:04,1370141752431144965,christufton: Oxford-AstraZeneca: EU regulator says 'no indication' vaccine linked to blood clots ,33827542,KimNainOfficial,"Kingston, Jamaica",5309,20440,,True,False,43617,,,169,0,0.0,0.0,neutral
2021-03-11 22:37:04,1370141751453880328,"DrTeckKhong: Be alert to strokes, transient ischaemic attacks, coronary events and other vascular incidents in the short and intermedia…",1347977492771065857,WildcatsClara,,107,6754,,False,False,5183,,,531,0,0.3375,-0.0625,negative
2021-03-11 22:37:03,1370141749008592910,"scottycknight POTUS Pfizer, so far nothing at all except I’ve been very happy.",4458421461,richones1,"Nashville, TN",34660,159509,,False,False,48256,,,0,3,1.0,0.55,positive
2021-03-11 22:37:03,1370141748371001344,DamionMitch: NOW: djmillerJA seeks to set the record straight. Says she never opposed PM and the Health Minister being among the first…,2182813403,Nora_divineone,,71,1171,,True,False,1176,,,2,0,0.4,0.2,positive
2021-03-11 22:37:03,1370141747620184064,"Oxford-AstraZeneca: EU regulator says 'no indication' vaccine linked to blood clots - BBC News  
   
Denmark, Norway and Iceland have temporarily suspended the rollout of the AstraZeneca vaccine. Italy and Austria, meanwhile, have stopped using certain ...",15193667,matiere,新潟県佐渡市,2446,23605,,False,False,1288989,,,0,0,0.5714285714285714,0.21428571428571427,positive
2021-03-11 22:37:03,1370141747456671751,danieteebee: It’s completely predictably American that the brand of COVID vaccine you have access to has now become a class signifier,1222771999,elskey_,,132,9473,,True,False,3116,,,10902,0,0.0,0.0,neutral
2021-03-11 22:37:02,1370141745581850624,"CNBCnow: BREAKING: Biden signs $1.9 trillion Covid relief bill, clearing way for stimulus checks, vaccine aid 
",998997930508861440,CryptographyAC_,Internet,465,1308,,False,False,27353,,,457,0,0.0,0.0,neutral
2021-03-11 22:37:02,1370141745334398976,Does anyone know how the AstraZeneca CEO is able to keep his job? ,1048334353888157696,hedleyfarquhar,"Trefin, Wales",207,659,,True,False,18423,,,0,3,0.625,0.5,positive
2021-03-11 22:37:02,1370141743744745473,"AndrewKerrNC: This dude was saying in March 2020 that there ""might never be"" a COVID vaccine.

Now he says that people who brag about p…",6284422,lordnazh,"Harriman, TN",295,63141,,True,False,22654,,,37,0,0.0,0.0,neutral
2021-03-11 22:37:01,1370141740590579712,mariamainmo: Girls don't want boys. They want the covid vaccine and a nice apartment,301448832,mar_rdguezzz,Calpe - Valencia,297,8232,,False,False,12853,,,25197,0,1.0,0.6,positive
2021-03-11 22:37:01,1370141740489932808,I also forgot to mention which Vaccine I got smh. I got the Moderna.,24311875,KanYeezy,718  ➡️ 757,1164,2887,,True,False,100350,,,0,0,0.0,0.0,neutral
2021-03-11 22:37:01,1370141739244208129,SteiniBrown: Teachers pls consider sharing: UofT_dlsph researchers are studying COVID in Ontario teachers &amp; other education workers. P…,804919418916655104,eileenmcmahonNP,Turtle Island,1470,17500,,True,False,9794,,,301,0,0.375,-0.125,negative
2021-03-11 22:37:01,1370141738765979649,kinsellawarren: One year after all of this began - one year! - Canada is in 61st place in the world for COVID-19  vaccine doses adminis…,996081618,VanCentreCPC,"Vancouver, BC",1559,7444,,True,False,19588,,,255,0,0.0,0.0,neutral
2021-03-11 22:37:00,1370141736933154822,AlbertsStuff: just got the covid vaccine! hope nothing bad happens! ,1328352269436416005,lolbitgXwolfer,hell but with pizzas,8,423,,False,False,15,,,573,0,0.6666666666666666,-0.8749999999999998,negative
2021-03-11 22:37:00,1370141736882831360,"This week Dr. David Williams, Ontario’s Chief Medical Officer of Health, issued a memo stating that the province is extending the interval between doses of the COVID-19 vaccine to up to 16 weeks. This change follows a recommendation from Canada’s National Advisory Committee",317724682,madmj1m,,66,7639,,False,False,4245,,,0,0,0.0,0.0,neutral
2021-03-11 22:37:00,1370141736454909952,"rishibagree: No opposition leader took Covid vaccination until PM Modi  took. After him... Everyone is taking it.

Looks like they have…",252209020,gbd1971,mumbai,1146,182221,,True,False,134675,,,1581,0,0.0,0.0,neutral
2021-03-11 22:37:00,1370141734873751553,Investigation: Pfizer ‘bullied’ Latin American nations in negotiations for vaccine supplies.  via AJEnglish,939317322,richard_of_yore,The Land of Yore,366,16554,,False,False,88885,,,0,0,0.0,0.0,neutral
2021-03-11 22:37:00,1370141733946806272,"bestbiafra: HIV/AIDS came No Vaccine was given.
Ebola came No Vaccine was given.
Lassa Fever came No Vaccine was given.
Hepatitis came…",1354554889825886214,kcforeign4,,82,3628,,False,False,3230,,,128,0,0.0,0.0,neutral
2021-03-11 22:36:59,1370141732185247755,"ncdhhs: Bookmark this tweet! NC's COVID-19 Vaccine Resources:

👥 Find My Vaccine Group: 

📲 COVID-19 Vaccine Hel…",617416942,SoonToBeEmD,,70,723,,False,False,47,,,48,0,0.0,0.0,neutral
2021-03-11 22:36:59,1370141731442679808,AsemHamdy55: Here we go again ,2793626914,MyRhinowelch,"Desert Edge, California",1238,9734,,True,False,14399,,,8,0,0.0,0.0,neutral
2021-03-11 22:36:59,1370141730754945027,danieteebee: It’s completely predictably American that the brand of COVID vaccine you have access to has now become a class signifier,881867889640427521,BrownKramned,Blacklivesmatter,164,64961,,False,False,7362,,,10902,0,0.0,0.0,neutral
2021-03-11 22:36:58,1370141729442119682,danieteebee: It’s completely predictably American that the brand of COVID vaccine you have access to has now become a class signifier,1009884170443788288,RaulTrujillo117,,197,16677,,False,False,4688,,,10902,0,0.0,0.0,neutral
2021-03-11 22:36:58,1370141728464855041,lahoare: Austria will continue to vaccinate against the coronavirus using the Oxford/AstraZeneca jab in spite of the Danish and Norwegi…,24261700,christiane5,A. V. ,1583,301213,,False,False,12655,,,1,0,0.0,0.0,neutral
2021-03-11 22:36:58,1370141726392868868,"Pfizer vaccine 97% effective against symptomatic COVID-19, study shows  via CBSHealth",2364718016,GailHepburn,"Boston, Ma",2989,1143,,False,False,15072,,,0,0,0.8,0.6,positive
2021-03-11 22:36:57,1370141724023132160,christufton: Oxford-AstraZeneca: EU regulator says 'no indication' vaccine linked to blood clots ,206795087,socajunkie_mel,Jamaica,305,3499,,False,False,40705,,,169,0,0.0,0.0,neutral
2021-03-11 22:36:57,1370141721867223050,"roccogalatilaw: Denmark. another country, like Austria, to suspend  Astra-Zeneca vaccine due to ""blood-clotting"" which  led to deaths a…",1256396154620837889,josh37180194,,47,21934,,False,False,5041,,,1452,0,0.375,-0.125,negative
2021-03-11 22:36:56,1370141719178584066,"MuskokaPost: Just five days after the second dose of the Pfizer COVID-19 vaccine, perfectly healthy 28-year-old health care worker and…",1311634277994356736,trip_trip00,輪廻転生,1848,56357,,False,False,32175,,,345,0,0.25,0.25,positive
2021-03-11 22:36:56,1370141717291220993,"DoctorEmto: Fake Covid-19 vaccine are on its way to Nigeria.

How you know it's fake? It will be for sale! That's just one of it.

Than…",287805940,JustKelechi,"Abuja, Nigeria",27091,22078,,True,False,359961,,,21,0,1.0,-0.5625,negative
