created,id_str,text,user_id,screen_name,location,followers_count,user_favourites_count,time_zone,geo_enabled,verified,status_count,geo,coords,retweet_count,tweet_favourite_count,Subjectivity,Polarity,Sentiment
2021-03-11 22:36:04,1370141499858554885,danieteebee: It’s completely predictably American that the brand of COVID vaccine you have access to has now become a class signifier,1108479333725700096,NastyGirl_K,Meet me on uranus cuz wtf,472,63537,,True,False,26365,,,10902,0,0.0,0.0,neutral
2021-03-11 22:36:03,1370141498507849729,39-Year-Old Mother Dies After 2nd Dose of Moderna Vaccine: Family  via epochtimes,47881924,DSkoumbourdis,Australia,11843,14897,,False,False,7097,,,0,1,0.0,0.0,neutral
2021-03-11 22:36:03,1370141497820069894,Jackiedoran10: New deadly variant discovered from fusion of face nappies and yellow jackets which blocks brain function. Moderna trials…,2800466323,porridgeisgood,,5470,682881,,False,False,837854,,,2,0,0.28484848484848485,-0.02121212121212122,negative
2021-03-11 22:36:03,1370141497744617477,Study Finds Pfizer Vaccine Blocked 94% Of Asymptomatic Infections - CBS Boston ,1263882379757867009,MA_News_Videos,,27,0,,False,False,18888,,,0,0,0.0,0.0,neutral
2021-03-11 22:36:03,1370141497601966082,"thetruebluechef This: 
""The MHRA has received 227 UK reports of suspected ADRs to the Pfizer/BioNTech vaccine in which the patient died shortly after vaccination, 275 reports for the Oxford University/AstraZeneca vaccine and 4 where the brand of vaccine was unspecified""

",2317780563,ciarawhite46,Bristol,201,1673,,True,False,2472,,,0,0,0.3,0.0,neutral
2021-03-11 22:36:03,1370141495999729672,EricMMatheny: Are we going to talk about the healthy 39 year old woman from Utah who got her second dose of the Moderna vaccine and the…,4841340415,JoyceNana10,,1037,33372,,True,False,71590,,,2911,0,0.2333333333333333,0.19999999999999998,positive
2021-03-11 22:36:02,1370141494401761291,"Scots aged 60-64 have taken to social media to urge others in their age group to call the national Covid-19 vaccine helpline
",17680050,TheScotsman,Scotland,183169,1625,,True,True,302800,,,5,6,0.23333333333333334,-0.03333333333333334,negative
2021-03-11 22:36:02,1370141491440549895,France sees no reason to suspend AstraZeneca COVID shots: minister ,129615849,carloseats,TPA,12521,304192,,True,False,234260,,,0,0,0.0,0.0,neutral
2021-03-11 22:36:02,1370141491398541312,"ThisAlexTin: Earlier this week, FinancialTimes reported that the EU planned to seek exporting the AstraZeneca doses made in the U.S.…",1356271563599962117,FreeTheVaccines,Outside the FDA,22,45,,False,False,37,,,1,0,0.5,0.0,neutral
2021-03-11 22:36:02,1370141491230863367,"kayleighmcenany: FINALLY the Biden admin recognizes the Trump admin’s unprecedented vaccine work:

➡️ “We’re grateful for the work that…",826708564668510208,pstlouisify,From Above!,89,17212,,False,False,7534,,,4609,0,0.95,0.3,positive
2021-03-11 22:36:01,1370141487581761536,"KizzyPhD: Honored to be the winner the “NextGen Award”, bestowed by The Franklin Institute, an organization that has “predicted” &amp; awar…",59478030,mott1007,,90,20250,,False,False,13331,,,495,0,0.0,0.0,neutral
2021-03-11 22:36:01,1370141486524870664,"brosinco: Gasp! I’m shocked!

Denmark suspends use of AstraZeneca vaccine as 'precautionary measure' ",489660387,Mr_Lotala,Toronto / Brampton ,603,13,,False,False,63675,,,3,0,0.8,-0.875,negative
2021-03-11 22:36:00,1370141485249699841,"BarackObama: Michelle and I got vaccinated against COVID-19 because we know it’s the best way to beat this pandemic, protect one anothe…",1328203899799445504,JohnPat13931894,"Vancouver, British Columbia",14,4612,,False,False,4540,,,10077,0,0.3,1.0,positive
2021-03-11 22:36:00,1370141484473843719,"pcrclaims ""Covid vaccines"" are going to wipe out your immune system for ever.

This ""vaccine"" roll out must be stopped right now.

",1369319255083257861,flumffle,,39,948,,False,False,1440,,,1,2,0.5357142857142857,0.2857142857142857,positive
2021-03-11 22:36:00,1370141484125675522,leeshoffdaleash I got the Moderna,706158050130817025,itsmewhiteman,1913,1977,57698,,False,False,41778,,,0,0,0.0,0.0,neutral
2021-03-11 22:36:00,1370141483211235329,"ShoodTheDude Yessir. Way less side effects than moderna/Pfizer though, I think people will like it once it’s approved in the next month or so.",157900574,AGeminiStallion,"Bay Area, CA",2721,5794,,True,False,74899,,,0,0,0.03333333333333333,-0.08333333333333333,negative
2021-03-11 22:35:59,1370141482083102723,"SkyNews if covid is so deadly why was there no mass outbreak of deaths among homeless people? Generally more difficult for the homeless to isolate, get hold of masks etc.
Don't be surprised if the deaths start happening soon ",4843608801,edfriendly_,,392,25790,,False,False,5273,,,0,0,0.7,-0.025,negative
2021-03-11 22:35:59,1370141481785307138,DennisKendel: Canada’s health authorities find no evidence of Oxford-AstraZeneca vaccine causing blood clots /via globeandmail https:/…,1434698610,WaskoDr,"Swift Current, Saskatchewan",1371,4880,,True,False,1120,,,6,0,0.0,0.0,neutral
2021-03-11 22:35:59,1370141481655275523,"oh ffs... guess they prefers ones derived from choirboy tears.
",950039201835372544,miggitymarty,"Ottawa, Ontario",55,2699,,False,False,1598,,,0,0,0.0,0.0,neutral
2021-03-11 22:35:59,1370141480145272832,"business: Novavax’s Covid-19 vaccine was 96.4% effective against mild, moderate and severe symptoms of the disease in the final analysi…",67175157,JuanRReyesG,"Santo Domingo, Rep. Dominicana",2338,14075,,True,False,22345,,,222,0,0.75,0.23333333333333334,positive
2021-03-11 22:35:59,1370141479331622913,JDiamond1: While about 7 in 10 American adults say they will try to get a Covid shot or already have... the political divide remains.…,1336002583048097832,Nebio13,,98,58726,,False,False,46014,,,30,0,0.05,0.0,neutral
2021-03-11 22:35:58,1370141477825773571,Walked in for a moderna vaccine and I got Pfizer... what I originally wanted. Dope 🤟🏼,402823552,Salazar_muzik,"Long Beach, CA",547,43826,,True,False,14171,,,0,6,0.75,0.375,positive
2021-03-11 22:35:58,1370141476060028930,"Get the vaccine to protect against Covid ... and while you're at it, shove a ticking time bomb up your ass to protect from the Boogeyman!",1281959218384437249,ellisdee4u,,1973,3669,,False,False,2316,,,0,8,0.0,0.0,neutral
2021-03-11 22:35:58,1370141475799887875,CNN: Workers at a Kroger clinic in Central Virginia accidentally injected some customers with empty syringes instead of the Covid-19 va…,1308897930812600321,Airmaye1,,7,3497,,False,False,3185,,,110,0,0.375,-0.05,negative
2021-03-11 22:35:58,1370141474935934981,"The *only* group the CDC labels as at high-risk for Covid-19 infection that KY is *not* allowing to get a vaccine in 1C are smokers. 

""Smoking is not going to be included in this, but all the other medical conditions are,"" Dr. Stack said. 

Full list: ",2925341291,AcquistoA,"Lexington, KY",2177,1904,,True,False,3095,,,1,3,0.48125,0.056249999999999994,positive
2021-03-11 22:35:58,1370141474189283330,JohnLutge: bruce_haigh The AZ vaccine has limited efficacy against the SA strain of Covid-19. If the new strains get a foothold they s…,3288075858,bruce_haigh,"Orange, New South Wales",9239,130666,,True,False,149124,,,8,0,0.2987012987012987,0.032467532467532464,positive
2021-03-11 22:35:57,1370141473698643968,John99601526: Breaking911 The guys at pfizer ,973003374,wall_e_bizz,,154,4819,,True,False,24467,,,16,0,0.0,0.0,neutral
2021-03-11 22:35:57,1370141472318689280,"BrandonDoughan I felt like absolute ass the day after Moderna shot 2. Body aches, fever/chills, with painful &amp; swollen lymph nodes. The day after that I felt fine.

It was WAY better than I assume a ventilator feels, so I’d do it again in a heartbeat!

I hope your reaction is mild, if anything",71741210,According2Bob,"Iowa, USA",650,53508,,False,False,18104,,,0,0,0.6599999999999999,0.175,positive
2021-03-11 22:35:57,1370141472050315268,el_uthmaan: We need Kidnapping and Boko Haram Vaccine more than we need COVID-19 Vaccine.,1148041402250682369,umardeyong,Maiduguri,143,13474,,False,False,5546,,,145,0,0.5,0.5,positive
2021-03-11 22:35:57,1370141471081328643,"POTUS: One in four adults in the U.S. has received their first COVID-19 vaccine — and we’re now leading the world in vaccinations.

Tha…",21643418,badbonz,south of clueless,2058,100363,,False,False,72883,,,16392,0,0.3333333333333333,0.25,positive
2021-03-11 22:35:57,1370141470490042376,"Reuters: Health authorities in Denmark, Norway and Iceland have suspended usage of the COVID-19 vaccine produced by AstraZeneca after r…",1556165870,prof_ve,,22,4495,,False,False,1476,,,418,0,0.0,0.0,neutral
2021-03-11 22:35:57,1370141469722431490,"m_scribe: Breaking: Novavax announces efficacy results in its vaccine trials.

* 100% protection against severe disease
* 96% effective…",789209223142014976,Jcanguy,,436,44871,,False,False,50817,,,689,0,0.0,0.0,neutral
2021-03-11 22:35:56,1370141469164462080,meganmesserly: Gov. Steve Sisolak was vaccinated against COVID-19 today alongside grocery store workers. He received the Janssen (forme…,1117578102,MeghinDelaney,"Las Vegas, NV",5461,32670,,True,True,41800,,,6,0,0.0,0.0,neutral
2021-03-11 22:35:56,1370141468271214597,ChrisThirkill: Denmark bans astrazeneca CoronavirusVaccine Due to Serious Cases of Blood Clots.,399641499,shimmerwood1,,136,39766,,False,False,5670,,,24,0,0.5208333333333333,-0.22916666666666666,negative
2021-03-11 22:35:56,1370141467180683270,"Reuters: Data suggests the Pfizer-BioNTech vaccine is 94% effective in preventing asymptomatic infection, meaning it could significantl…",3194913091,mcmisher,"Troutdale, OR",278,77152,,False,False,43689,,,115,0,0.8,0.6,positive
2021-03-11 22:35:56,1370141466287300612,verozaragovia: ¡Hola! BiancaJoanie and I are helping the public to answer questions on COVID-19 vaccines en ESPAÑOL TODAY at 6 p.m. on…,961262890123743232,Ovalle_LJ,"Miami, FL",250,1928,,True,False,510,,,16,0,0.06666666666666667,0.0,neutral
2021-03-11 22:35:55,1370141462579572736,clemoult: Protesters marched to Moderna’s headquarters in Cambridge today to call for steps to increase global access to the COVID vacc…,109303284,maya_sen,Harvard University,21728,2954,,True,False,6365,,,10,0,0.0,0.0,neutral
2021-03-11 22:35:54,1370141458225786880,"EricMMatheny: Vaccination is not a political talking point. It’s a matter of choice. The truth is, the Covid vaccine was approved very…",1341403442917601280,dayandnightRN,The great U.S. of A,90,9190,,False,False,2929,,,306,0,0.1,0.0,neutral
2021-03-11 22:35:54,1370141458171363329,An Irish immunologist says focusing on 16-35 year olds after the most vulnerable groups are vaccinated could reduce COVID-19 transmission in the community. ,22646514,NewstalkFM,Ireland,263175,8569,,True,True,239560,,,5,34,0.3333333333333333,0.0,neutral
2021-03-11 22:35:54,1370141458171359237,CP24: Here's who is eligible for a COVID-19 vaccine shot at Ontario pharmacies   ,188954161,cecilegatmaitan,Hundred Acre Wood,388,225678,,True,False,47963,,,20,0,0.0,0.0,neutral
2021-03-11 22:35:54,1370141457915514881,MtMama1776: They will depopulate the world with this covid vaccine ,1903297104,nonamerule1,TEXAS,1568,70,,True,False,45809,,,2,0,0.0,0.0,neutral
2021-03-11 22:35:54,1370141457655414790,"BarackObama: Michelle and I got vaccinated against COVID-19 because we know it’s the best way to beat this pandemic, protect one anothe…",632396896,AdgavinGavin,,442,125862,,True,False,20198,,,10077,0,0.3,1.0,positive
2021-03-11 22:35:53,1370141456279609346,timethief: Most B.C. First Nations communities offered at least one dose of COVID-19 vaccine. First Nations Health Authority says over…,785546413274914816,rohaniroop,"British Columbia, Canada",1860,248034,,True,False,242241,,,4,0,0.39166666666666666,0.175,positive
2021-03-11 22:35:53,1370141454975315977,"cgtnamerica: In an effort to get Americans to get the vaccine, the Ad Council released this campaign showing former U.S. Presidents Oba…",78897520,JCuTv777,France,291,15414,,False,False,12889,,,10,0,0.0,0.0,neutral
2021-03-11 22:35:52,1370141452693614592,"POTUS: One in four adults in the U.S. has received their first COVID-19 vaccine — and we’re now leading the world in vaccinations.

Tha…",227109614,pro_zach36,LFK,191,2257,,False,False,11903,,,16392,0,0.3333333333333333,0.25,positive
2021-03-11 22:35:52,1370141451355492356,MuellerSheWrote Got my second Pfizer on Tuesday. No problems.,1242249302518280192,MrAloha14,"Hilo, Hawaii",109,16067,,False,False,4477,,,0,2,0.0,0.0,neutral
2021-03-11 22:35:52,1370141451330457609,"GreatGameIndia: THIS IS BIG

8 European nations including Italy, Latvia, Luxembourg, Lithuania, Estonia, Denmark, Norway and Iceland ha…",320252434,flyer4life,,7899,201518,,False,False,245296,,,795,0,0.05,0.0,neutral
2021-03-11 22:35:51,1370141445710086146,"NiagarathisWeek: Nearly 1,800 vaccine doses were administered in Niagara on March 10
",1317554803376070656,Jess54380316,Niagara Center ,243,2958,,False,False,4549,,,2,0,0.4,0.1,positive
2021-03-11 22:35:50,1370141443281588228,"kat1567 Remember, she took the moderna_tx vaccine, not the Pfizer one

If you own Moderna, SELLLLLLLL!!!",826239654437482496,MOCOElephant,,146,32204,,False,False,8820,,,0,1,1.0,1.0,positive
2021-03-11 22:35:50,1370141441729523720,"joe_warmington: Denmark, Norway and Iceland suspend AstraZeneca COVID shots after blood clot reports | Article [AMP] | Reuters ",52438058,Leprechaun1984,"Calgary, Alberta",965,46235,,False,False,25108,,,286,0,0.0,0.0,neutral
2021-03-11 22:35:50,1370141441624829958,"chosensomto: Please how many doctors serving at the frontlines, have received the covid-19 vaccine?
The dangers of a nepotistic regime;…",365379938,nsajo,port harcourt,1311,18584,,True,False,65623,,,58,0,0.5,0.5,positive
2021-03-11 22:35:50,1370141441331105792,"ninaturner: Part two of our Hello Somebody COVID series with TheEricaEngland and DrDooleyMD is now up 🙌🏾

We get the facts straight a…",1146776116306178048,Kulinski_crat_1,"Vancouver, WA",7640,98560,,False,False,80392,,,32,0,0.4,0.2,positive
2021-03-11 22:35:49,1370141439213064195,Won’t be joining the Pfize Gang in a week. I’ll be a member of Team Moderna.,24621476,heshsson,Atlanta,596,33117,,True,False,121070,,,0,4,0.0,0.0,neutral
2021-03-11 22:35:49,1370141438520999939,"PodSaveAmerica: NEW: Republicans respond to vaccine funding and $1400 check with Dr. Seuss and Mr. Potato Head, and Democrats worry abo…",1023249631,flashtaps,New York,202,54605,,True,False,9642,,,18,0,0.45454545454545453,0.13636363636363635,positive
2021-03-11 22:35:49,1370141437271154690,"POTUS: One in four adults in the U.S. has received their first COVID-19 vaccine — and we’re now leading the world in vaccinations.

Tha…",868666007262552064,LauraDoza44,"Ohio, USA",1926,188663,,False,False,152469,,,16392,0,0.3333333333333333,0.25,positive
2021-03-11 22:35:49,1370141436495200261,"jkenney: Amazing news: Proceeding to clinical trials, made-in-Alberta COVID-19 vaccine from Edmonton’s entospharma is one step closer to Health Canada approval.

",211887326,UofAResearch,"Edmonton, Alberta, Canada",7926,5730,,True,False,7251,,,4,10,0.9,0.6000000000000001,positive
2021-03-11 22:35:48,1370141434603569161,"weaponizedword1: ""Utah woman, 39, dies 4 days after 2nd dose of COVID-19 vaccine; autopsy ordered""

",2251315536,SueTabatha,,257,2855,,False,False,2173,,,230,0,0.0,0.0,neutral
2021-03-11 22:35:48,1370141432942624771,Zachari me lmaooo but with houston covid vaccine notifications that dont even apply to me bc im not 65 or medical staff,2352355136,sadttyl,houston,345,42668,,True,False,29994,,,0,1,0.0,0.0,neutral
2021-03-11 22:35:47,1370141431755460613,jeanie31199: RonniLaurie CSurvivor9 Congrats!  My husband and I got our first dose of Moderna vaccine this morning!  Who knew getting…,1195710859,gsal5000,"Renton, WA",488,37167,,True,False,39289,,,3,0,0.3333333333333333,0.3125,positive
2021-03-11 22:35:47,1370141431709454339,"BarackObama: Michelle and I got vaccinated against COVID-19 because we know it’s the best way to beat this pandemic, protect one anothe…",23516374,micaltaz,The Corner Of No Fuggs To Give,546,1357,,True,False,356672,,,10077,0,0.3,1.0,positive
2021-03-11 22:35:47,1370141430702866432,NONBlNARY: My Child Got Vaccinated And Now She’s Super Cringe pfizer_news explain yourself,970147054575063040,SapphicScythe,she/her,314,124190,,False,False,76429,,,2,0,0.6666666666666666,0.3333333333333333,positive
2021-03-11 22:35:47,1370141430535032832,"Very soon, your local dentist may be able to administer the COVID-19 vaccine to you, if you’re in McLean County. ",334270259,HOIABC_News,"Peoria, Illinois",7037,959,,True,False,30234,,,0,0,0.30833333333333335,0.2333333333333333,positive
2021-03-11 22:35:46,1370141427406098432,"I never knew the amount of work our Covid-19 team does in CK. 
TODAY we delivered LUNCH. The Clinic Services ( WISH Centre) The Health and Family Services Building team on Grand Ave., as well as the Bradley Centre Vaccine team. 115 people working every day to keep us safe in  CK! ",4820134491,GregCKXS,Wallaceburg ,7338,91271,,True,False,9816,,,5,62,0.75,0.5625,positive
2021-03-11 22:35:45,1370141422909861892,"kayleighmcenany: FINALLY the Biden admin recognizes the Trump admin’s unprecedented vaccine work:

➡️ “We’re grateful for the work that…",988045965641777154,DonnaBetz10,,55,63377,,False,False,31119,,,4609,0,0.95,0.3,positive
2021-03-11 22:35:45,1370141422603632648,IshatReza: Doug Ford just accused an Indigenous MPP of “queue jumping” even though he was eligible for a COVID vaccine. Does the Premie…,562504522,BookishJenn96,Canada,1524,7802,,False,False,27682,,,286,0,0.0,0.0,neutral
2021-03-11 22:35:45,1370141421932580866,BashirAhmaad: Press Statement on concerns about the safety of the Oxford/AstraZeneca Vaccine. ,1148041402250682369,umardeyong,Maiduguri,143,13474,,False,False,5546,,,127,0,0.0,0.0,neutral
2021-03-11 22:35:45,1370141421559283718,"MichelleObama: When you can get the COVID-19 vaccine, I hope you do—Barack and I are certainly glad we did. It’s our best shot at beati…",1575922332,Songbird_Felena,"Detroit, MI",288,772,,True,False,1666,,,8200,0,0.65,0.75,positive
2021-03-11 22:35:44,1370141415263592454,KateMary2012: Do not rollout Covid-19 vaccine passports - Petitions ,1319651596846977024,stigwasdumped,My Blue Heaven,302,4768,,False,False,6251,,,1,0,0.0,0.0,neutral
2021-03-11 22:35:43,1370141413770473474,"POTUS: The more people that get vaccinated, the faster we will beat this pandemic. That’s why one of my first goals is to administer 10…",1370139491839672321,Mrjohnw75793829,,1,0,,False,False,166,,,13301,0,0.41666666666666663,0.375,positive
2021-03-11 22:35:43,1370141413279731715,AndrewMaitland9 IndigoFast 2 doses (3 to 12 weeks apart). I think Moderna might be single dose but we’re not using it here at the moment - it’s Pfizer of Astrazenica.,1121843323,redcelt2,"Fife, Scotland, EUROPE",2596,46319,,False,False,8575,,,0,2,0.21428571428571427,-0.07142857142857142,negative
2021-03-11 22:35:43,1370141413191655424,"NBCNews: BREAKING: President Biden signs $1.9T Covid relief bill into law; ​includes $1,400 checks, $300/wk jobless benefits, child all…",607825733,cliffordmoss4,,122,10730,,False,False,1513,,,2370,0,0.0,0.0,neutral
2021-03-11 22:35:43,1370141412243701761,"Want another life-threating medical condition?

AstraZeneca may be able to help.

",210290270,irishbearaz,Texas,354,3566,,True,False,43869,,,0,0,0.3125,0.25,positive
2021-03-11 22:35:43,1370141411014631424,"KatyTurNBC: One year of COVID. 
Seven months pregnant. 
First shot of Pfizer.",806220574158557184,carldhparmley,"Joshua Tree, CA",30,12798,,False,False,8025,,,453,0,0.41666666666666663,0.29166666666666663,positive
2021-03-11 22:35:42,1370141410779873281,"TweetrDon45th Pdog95179387 you do realize making this big of a stink out of a handful of extremely sad deaths due to vaccine complications, is exactly what you think the media is doing about COVID deaths",1056935262457081856,LucaMoDev,Toronto,214,7940,,False,False,1111,,,0,0,0.43125,-0.09375,negative
2021-03-11 22:35:42,1370141410771492865,"Reuters: Health authorities in Denmark, Norway and Iceland have suspended usage of the COVID-19 vaccine produced by AstraZeneca after r…",940407866997035010,Masterguy14,México,150,17508,,False,False,48336,,,418,0,0.0,0.0,neutral
2021-03-11 22:35:42,1370141409274122244,"kayleighmcenany: FINALLY the Biden admin recognizes the Trump admin’s unprecedented vaccine work:

➡️ “We’re grateful for the work that…",822061602077835264,rsoto2516,,22,5158,,False,False,4535,,,4609,0,0.95,0.3,positive
2021-03-11 22:35:42,1370141409181892612,"NBCNews: BREAKING: President Biden signs $1.9T Covid relief bill into law; ​includes $1,400 checks, $300/wk jobless benefits, child all…",180384560,ShaNariaaa,,598,6426,,True,False,87151,,,2370,0,0.0,0.0,neutral
2021-03-11 22:35:42,1370141409051836421,"ellymelly: This is why you do proper, extensive, long-term trials before unleashing vaccinations on the general public who are not prop…",351204415,jiggli,England,1092,35312,,False,False,21361,,,87,0,0.25,0.012500000000000004,positive
2021-03-11 22:35:42,1370141408850542593,ksd_18 Any issues? My 2nd is the 29th (Pfizer),864233112,tomkorocz,"New York, USA",2402,78722,,True,False,107059,,,0,1,0.0,0.0,neutral
2021-03-11 22:35:41,1370141404131901441,"alexsalvinews: NEW: Denmark temporarily suspends the AstraZeneca COVID vaccine due to cases of blood clots in recipients.

Health offic…",1119673480168058880,AlysonStonebra1,,96,18083,,False,False,5737,,,628,0,0.4147727272727273,0.005681818181818177,positive
2021-03-11 22:35:40,1370141401527291910,GovRonDeSantis: Great announcement with Walgreens in Jacksonville today to highlight the increase of stores offering the vaccine from…,1366175568543297536,HeidiV92184,,0,75,,False,False,46,,,124,0,0.75,0.8,positive
2021-03-11 22:35:40,1370141401204285444,MarketRebels: $NVAX up 24.6% in after hours trading after announcing its vaccine candidate demonstrated 96.4% efficacy against Covid,604980675,RaffaellaDeFili,"Charlotte, NC",1796,9945,,True,False,39256,,,9,0,0.0,0.0,neutral
2021-03-11 22:35:40,1370141401040748551,"POTUS: After a rigorous scientific review process, the FDA issued an emergency use authorization for a third safe and effective COVID-1…",1370139491839672321,Mrjohnw75793829,,1,0,,False,False,166,,,3828,0,0.43333333333333335,0.3666666666666667,positive
2021-03-11 22:35:40,1370141400273141762,"AureliaCotta: The statement from the Canadian Bishops is actually a right wing attack on the Pope and the Vatican. 
The Vatican says ge…",29891001,khawlis,Terre,887,18608,,False,False,57883,,,2,0,0.5357142857142857,0.2857142857142857,positive
2021-03-11 22:35:40,1370141399912382468,I just got my first dose of the Covid-19 vaccine today!,775761421061623808,nascar24cool,,226,3488,,False,False,3494,,,0,4,0.3333333333333333,0.3125,positive
2021-03-11 22:35:40,1370141399300079618,"noreward_norisk: Astra Zeneca vaccine roll out halted in Denmark, Italy, Norway over blood clot concerns. NHS website ingredients list…",1322465258448052225,JSmit24431193,,26,1590,,False,False,422,,,103,0,0.0,0.0,neutral
2021-03-11 22:35:40,1370141398331195399,"ReutersScience: Health authorities in Denmark, Norway and Iceland suspended the use of AstraZeneca’s COVID-19 vaccine shots following r…",1591270142,Kynykya4211,"Pittsburgh, PA",945,164622,,False,False,28055,,,322,0,0.1,0.0,neutral
2021-03-11 22:35:40,1370141398285029382,futurepundit: The FDA could have approved more vaccines sooner so that FDA inspectors could safely work. How about approving AstraZenec…,1356271563599962117,FreeTheVaccines,Outside the FDA,22,45,,False,False,37,,,1,0,0.5,0.5,positive
2021-03-11 22:35:39,1370141398092156932,My ShowMeTheSci colleague Tom has written this informative account of his experience receiving a SARS-CoV-2 vaccine. Detailed and honest; this is an excellent read for those who wish to learn more about real-world experiences with COVID-19 vaccination. ,1275011231351480321,hughes_meganj,Ynys Môn,56,308,,False,False,36,,,1,2,0.7875,0.625,positive
2021-03-11 22:35:39,1370141397936836609,"POTUS: One in four adults in the U.S. has received their first COVID-19 vaccine — and we’re now leading the world in vaccinations.

Tha…",730910320911212544,rolnroz,"Las Vegas, NV",726,76513,,False,False,53980,,,16392,0,0.3333333333333333,0.25,positive
2021-03-11 22:35:39,1370141397756616710,Anyone else get the Moderna COVID-19 vaccine and feel like their arm was going to fall off???,2973970785,east_ae,,162,9515,,False,False,1211,,,0,0,0.0,0.0,neutral
2021-03-11 22:35:38,1370141394032021507,"alisonlaiMD: Loving ambulatory care right now and the opportunity to reassure patients about getting the COVID vaccine! 

Get the shot…",921914304,sginsburg1,Toronto,1547,2069,,True,False,2501,,,1,0,0.7428571428571429,0.47857142857142854,positive
2021-03-11 22:35:38,1370141392991879168,DCelesteSpencer: My 85 year old Mom &amp; I got our 2nd Moderna Shots today. Thank you President Biden &amp; his Administration for making this…,1357808681157595136,RAJBhagwandin16,Guyana,345,5763,,True,False,9243,,,3,0,0.1,0.05,positive
2021-03-11 22:35:38,1370141390705934336,"10 appointments at 1st and 2nd Dose - Moderna - Checotah - Checotah High School
Oklahoma COVID Vaccine
 ",1356104059460202496,VaccineAlertsOk,Oklahoma,1606,2,,False,False,461,,,2,0,0.26999999999999996,0.08,positive
2021-03-11 22:35:38,1370141390433292288,"HamillHimself: Statement by the Twice Impeached Former Guy

I hope everyone remembers when they're getting the COVID-19 (often referred…",1168918302284034048,ElaineL89281281,,13,10612,,True,False,1808,,,1013,0,0.0,0.0,neutral
