created,id_str,text,user_id,screen_name,location,followers_count,user_favourites_count,time_zone,geo_enabled,verified,status_count,geo,coords,retweet_count,tweet_favourite_count,Subjectivity,Polarity,Sentiment
2021-03-11 22:34:49,1370141185449328643,ncnaacp: COVID-19 Vaccine Fireside Chat. NCNAACP,3434872672,CHCNAACP,"Carrboro, North Carolina",1363,2950,,True,False,6597,,,2,0,0.0,0.0,neutral
2021-03-11 22:34:49,1370141184828399619,EricMMatheny: Are we going to talk about the healthy 39 year old woman from Utah who got her second dose of the Moderna vaccine and the…,81973382,Louislane777,"OR, USA",382,13432,,False,False,5193,,,2911,0,0.2333333333333333,0.19999999999999998,positive
2021-03-11 22:34:49,1370141184551743491,"bruceanderson: It feels like for almost all my life since I was an altar boy in Valleyfied, the Catholic Church has been a worsening me…",409615650,turnipmangle,🇨🇦,207,6551,,False,False,4212,,,28,0,0.1,0.0,neutral
2021-03-11 22:34:48,1370141183146561539,"DavidBenda_RS: Demand was high for Sunday's Redding Rancheria COVID-19 vaccine clinic. The announcement was made Tuesday, and soon afte…",33679221,Maria9Orozco,USA,1200,13828,,True,False,13831,,,5,0,0.5399999999999999,0.16,positive
2021-03-11 22:34:48,1370141182722936833,PinkNews: Stephen Fry gets COVID vaccine in peak Stephen Fry fashion: 'Under the eye of the poets and sleeping kings and queens' https:…,950357642848841728,VKinswa,"Town and Country, WA",150,11,,False,False,36929,,,4,0,0.0,0.0,neutral
2021-03-11 22:34:48,1370141182257364998,GovRonDeSantis: Great announcement with Walgreens in Jacksonville today to highlight the increase of stores offering the vaccine from…,1312937706033307648,tonyml232,,144,32756,,False,False,62164,,,124,0,0.75,0.8,positive
2021-03-11 22:34:48,1370141180906864653,"MichelleObama: When you can get the COVID-19 vaccine, I hope you do—Barack and I are certainly glad we did. It’s our best shot at beati…",977565912848101377,NicolasEdny,Somewhere in America ,11459,290938,,False,False,54035,,,8200,0,0.65,0.75,positive
2021-03-11 22:34:48,1370141180520980485,"POTUS: One in four adults in the U.S. has received their first COVID-19 vaccine — and we’re now leading the world in vaccinations.

Tha…",797288686673129472,sturgeonbay111,,215,97724,,False,False,81871,,,16392,0,0.3333333333333333,0.25,positive
2021-03-11 22:34:48,1370141180357316608,"Come on and a majority of Australia is suppose to get this. I'm 100% on the train for to be vaccinated, but I am hesitant when it comes to AstraZeneca auspol ",3072235147,Vanished00One,Brisbane Australia,50,18,,True,False,1816,,,0,1,0.0,0.0,neutral
2021-03-11 22:34:48,1370141180290240515,"MichelleObama: When you can get the COVID-19 vaccine, I hope you do—Barack and I are certainly glad we did. It’s our best shot at beati…",822644750452977664,GoatMaven,"Chicago, IL",44,15179,,False,False,20745,,,8200,0,0.65,0.75,positive
2021-03-11 22:34:47,1370141179942072322,"MuellerSheWrote: Happy to announce the VA has just scheduled me for the two-dose Moderna vaccine 3/15 and 4/5, two weeks after which I’…",126945319,senraba,"Las Cruces, NM",3360,264923,,True,False,144879,,,122,0,1.0,0.8,positive
2021-03-11 22:34:47,1370141179212402691,"fionamflanagan1: While Denmark, Austria, Estonia, Lithuania, Luxembourg &amp; Latvia suspend their use of the Astra Zeneca injection on saf…",1246273519840899073,FightVSNWO,México,902,20487,,False,False,27485,,,83,0,0.0,0.0,neutral
2021-03-11 22:34:47,1370141177123594242,"3.11.2021 - One Year Later. This educator got his first dose of the COVID-19 (Pfizer) Vaccine! When it’s your turn, get yours. ",1689767076,BBecoats,CLT,399,2723,,True,False,56948,,,0,2,0.16666666666666666,0.15625,positive
2021-03-11 22:34:46,1370141175500341252,danieteebee: It’s completely predictably American that the brand of COVID vaccine you have access to has now become a class signifier,2430972516,narissizzle,"los angeles, ca",210,43898,,True,False,11684,,,10902,0,0.0,0.0,neutral
2021-03-11 22:34:46,1370141174627975175,"JosephEllis408: Summer 2021:

“YO SO DID YOU GET PFIZER OR MODERNA?” ",15137359,ChicagoPhotoSho,"Chicago, IL",11478,3310,,True,False,109058,,,46576,0,0.0,0.0,neutral
2021-03-11 22:34:46,1370141173826867206,KneiserJoe: Frustrating how risible folks have become in 21st century. When I was a child 21st century was to be a time of Scientific g…,1098282507647307777,joedaddyhala,"Miami, FL",10178,38696,,True,False,32323,,,23,0,0.3,-0.13333333333333333,negative
2021-03-11 22:34:46,1370141171847155714,"NBCNews: BREAKING: President Biden signs $1.9T Covid relief bill into law; ​includes $1,400 checks, $300/wk jobless benefits, child all…",23643830,DeafAngelboy23,"Greensboro, NC",791,176468,,False,False,132864,,,2370,0,0.0,0.0,neutral
2021-03-11 22:34:45,1370141171138301963,GovRonDeSantis: Great announcement with Walgreens in Jacksonville today to highlight the increase of stores offering the vaccine from…,926418021484318720,Cartersmom04,,1139,62464,,False,False,52921,,,124,0,0.75,0.8,positive
2021-03-11 22:34:45,1370141171108900866,"kayleighmcenany: FINALLY the Biden admin recognizes the Trump admin’s unprecedented vaccine work:

➡️ “We’re grateful for the work that…",108565674,tarokaja3,大阪府,189,37683,,False,False,43562,,,4609,0,0.95,0.3,positive
2021-03-11 22:34:45,1370141169854844936,"JuddLegum: JohnKavanagh_AZ 3. Kavanaugh, who apparently believes its his job to ensure that ""uninformed"" people do not vote is support…",2592410190,MayIrmamay14,"Texas, USA",6208,54424,,True,False,842420,,,566,0,0.35,0.05,positive
2021-03-11 22:34:45,1370141168835694601,amyklobuchar Really? Can you send some to PA? Our numbers are much lower GovernorTomWolf is punishing counties that voted for DonaldJTrumpJr EricTrump Why would he do that?! My Mom died from Covid! Shouldn’t I be able to get a vaccine?,1354962910276104206,SRobert73572729,,8,1171,,False,False,250,,,0,0,0.3416666666666666,0.33749999999999997,positive
2021-03-11 22:34:45,1370141167854096387,"CNN: Latinos have been among the hardest hit by the pandemic, but have been vaccinated at far lower rates than White Americans.

While…",315495725,patricklee6669,PDX,8569,164554,,True,False,603316,,,68,0,0.5,0.05,positive
2021-03-11 22:34:44,1370141166780489733,jsolomonReports: Trump: U.S. ‘probably’ would’ve never had COVID-19 vaccine without him | Just The News ,928445233066659841,purser_terry,,181,28612,,True,False,64404,,,313,0,0.0,0.0,neutral
2021-03-11 22:34:44,1370141166608510979,"theJagmeetSingh: .SolMamakwa is someone I consider a friend

He got a COVID-19 vaccine publicly for the safety of his constituents and…",420956183,MLarmon,hogville,203,50280,,True,False,17704,,,135,0,0.06666666666666667,0.0,neutral
2021-03-11 22:34:44,1370141164955918339,"zoo_bear: India Today shared a chart claiming India has the lowest vaccine price in the world. This was also amplified by BJP. However,…",1650268616,shuchitasrivast,"Mississauga, Ontario, Canada ",3577,56332,,False,False,22477,,,914,0,0.0,0.0,neutral
2021-03-11 22:34:43,1370141161537568770,TheView: WHOOPI RECEIVES COVID-19 VACCINE: Our WhoopiGoldberg tells us she received her first shot of the coronavirus vaccine and enco…,925018780752928768,Alweston58,"Florida, USA",13,1156,,False,False,411,,,30,0,0.3333333333333333,0.25,positive
2021-03-11 22:34:42,1370141156961628160,CityCynthia He is so reckless w his distancing and travelling that I am convinced he’s had his vaccine. His comorbidities make him high risk for poor outcomes should he get covid,2854446948,2chevronsback,"Durham, Ontario",1088,260285,,True,False,41436,,,0,3,0.57,-0.12000000000000001,negative
2021-03-11 22:34:42,1370141156940652545,"flumffle: samasjapi ""Covid vaccines"" are going to wipe out your immune system for ever.

This ""vaccine"" roll out must be stopped right…",1315910355122561025,karenpat64,"Newcastle Upon Tyne, England",46,4111,,False,False,1539,,,12,0,0.0,0.0,neutral
2021-03-11 22:34:42,1370141155954933761,"Michelle and I got vaccinated against COVID-19 because we know it’s the best way to beat this pandemic, protect one another, and get the country back up and running again. So I hope you’ll get the vaccine as soon as it’s available to you. It could save your life.",1320460085630554141,AFlendersonn,,8,173,,False,False,129,,,0,1,0.2333333333333333,0.4666666666666666,positive
2021-03-11 22:34:42,1370141155158020107,"welosthim: Pfizer COVID Vaccine Trial Shows Alarming Evidence of Pathogenic Priming in Older Adults

",2800466323,porridgeisgood,,5470,682881,,False,False,837854,,,3,0,0.4666666666666667,0.033333333333333326,positive
2021-03-11 22:34:41,1370141153308332032,"IndianEmbassyTR: Pakistan🇵🇰, the only SAARC country to not seek COVID-19 Vaccine from India, is getting 45 million 🇮🇳 made vaccine Covi…",822157206292492288,peelicaavi,अर्यम्णः पन्थाः,1556,255350,,False,False,112029,,,3051,0,1.0,0.0,neutral
2021-03-11 22:34:41,1370141152947675139,mariamainmo: Girls don't want boys. They want the covid vaccine and a nice apartment,416351563,soriahno,"Toronto, Ontario",697,31514,,False,False,31192,,,25197,0,1.0,0.6,positive
2021-03-11 22:34:41,1370141152821846031,"thierrybaudet: Urgent Open Letter from Doctors and Scientists to the EMA COVID-19 Vaccine Safety Concerns: “There are serious concerns,…",2396183604,HAppel19,earth,199,34057,,False,False,10906,,,195,0,0.5833333333333333,-0.16666666666666666,negative
2021-03-11 22:34:40,1370141148698775556,"NHSuk: The NHS will never ask you to share bank details or pay for the COVID-19 vaccine. 

Report anything you receive that looks suspi…",1082574164026904576,NHSNW,,4626,1063,,False,True,4179,,,81,0,0.0,0.0,neutral
2021-03-11 22:34:40,1370141148619042818,economics: AstraZeneca will deliver less than half the planned number of Covid-19 vaccines to the EU in the second quarter because of s…,1315088550568755200,income_us,"Nevada, USA",127,2023,,False,False,7521,,,14,0,0.07777777777777778,-0.1111111111111111,negative
2021-03-11 22:34:40,1370141148052918272,"POTUS: One in four adults in the U.S. has received their first COVID-19 vaccine — and we’re now leading the world in vaccinations.

Tha…",2540607781,HockeyFanGirl12,USA,4329,713792,,False,False,593490,,,16392,0,0.3333333333333333,0.25,positive
2021-03-11 22:34:40,1370141146924650500,"Reuters: Health authorities in Denmark, Norway and Iceland have suspended usage of the COVID-19 vaccine produced by AstraZeneca after r…",325087326,TedYeary,United States,363,27241,,True,False,9303,,,418,0,0.0,0.0,neutral
2021-03-11 22:34:40,1370141146765217793,MarcoDaCostaFX: $NVAX up +25% in after hours trading after Novavax announcing its vaccine candidate demonstrated 96.4% efficacy again…,474139477,Usman_A_Khan,"Oxford, United Kingdom",284,3498,,False,False,34951,,,1,0,0.0,0.0,neutral
2021-03-11 22:34:39,1370141145628545024,"scrahallia: What’s the story with Astra Zeneca? 
Switzerland, Italy, Austria, Latvia, Lithuania, Estonia, Luxembourg, Iceland, South Af…",1336244707500961792,JansenFenna,,54,5790,,False,False,1666,,,13,0,0.0,0.0,neutral
2021-03-11 22:34:39,1370141145372655618,TheNewDailyAu: The AstraZeneca COVID vaccine has been suspended from use in several countries while authorities investigate reports of…,2418567655,Janet_Morris_,Naarm/Melbourne,708,54613,,False,False,62320,,,7,0,0.0,0.0,neutral
2021-03-11 22:34:39,1370141144290631687,spectatorindex: JUST IN: France says halting use of AstraZeneca coronavirus vaccine is not needed,1362047880,armdigennaro,,173,5696,,False,False,5728,,,492,0,0.0,0.0,neutral
2021-03-11 22:34:39,1370141143464312834,GovRonDeSantis: Great announcement with Walgreens in Jacksonville today to highlight the increase of stores offering the vaccine from…,783310099775303682,SubhasisMisraMD,FL,389,4014,,True,False,1555,,,124,0,0.75,0.8,positive
2021-03-11 22:34:39,1370141142835167234,jdeq: Today fordnation attacked indigenous MPP solmamakwa and accused him of queue jumping and getting the COVID vaccine early. Ford…,35491799,Nat_alie11,,109,10453,,False,False,5421,,,20,0,0.3,0.1,positive
2021-03-11 22:34:39,1370141142751211522,"welosthim: Second AstraZeneca volunteer reportedly suffers rare neurological condition, but UK company says it’s not related to vaccine…",107663133,seachange_au,South pole,316,10916,,True,False,18179,,,21,0,0.5,-0.075,negative
2021-03-11 22:34:38,1370141140079480837,"coop22089074: 39-year-old woman dies 4 days after second Moderna vaccine, autopsy ordered | News | LifeSite ",986715151595458560,coop22089074,"Griffin, Georgia",84,15,,False,False,176276,,,1,0,0.0,0.0,neutral
2021-03-11 22:34:38,1370141139735547904,economics: AstraZeneca will deliver less than half the planned number of Covid-19 vaccines to the EU in the second quarter because of s…,792701483510853636,amsterdam_bill,,2450,42768,,True,False,80625,,,14,0,0.07777777777777778,-0.1111111111111111,negative
2021-03-11 22:34:37,1370141138020098052,"Obligatory masked photo and yes, got my first Pfizer vaccine shot! 🥰 ",28352529,ghostnotediana,,5,9,,True,False,22,,,0,0,0.3333333333333333,0.3125,positive
2021-03-11 22:34:37,1370141137311260679,AdamPrzeworski: The US and other countries that produce covid vaccines just blocked the proposal at WTO to waive property rights. I am…,221900085,leoherreros,General Roca,432,3323,,True,False,10964,,,75,0,0.375,-0.125,negative
2021-03-11 22:34:37,1370141137089015811,"POTUS: This afternoon, we’re reaching a big milestone: 50 million COVID-19 vaccine doses administered since I took office. Tune in as w…",1370139491839672321,Mrjohnw75793829,,1,0,,False,False,166,,,2995,0,0.1,0.0,neutral
2021-03-11 22:34:37,1370141136900198405,EMA_News: 📢 EMA has just recommended granting a conditional marketing authorisation for COVID19vaccine Janssen to prevent COVID19 in…,454023684,GAnastasopulos,"Palaion Faliron, Attiki",958,5102,,True,False,608,,,1201,0,0.0,0.0,neutral
2021-03-11 22:34:37,1370141136233369603,MichelleObama I am 65 years old with health issues and I received shot 1 of the Pfizer vaccine yesterday 💉,1206286901587693574,BillySh00765052,"St Paul, MN",37,25715,,True,False,3803,,,0,0,0.2,0.1,positive
2021-03-11 22:34:37,1370141134782074881,"roccogalatilaw: Denmark. another country, like Austria, to suspend  Astra-Zeneca vaccine due to ""blood-clotting"" which  led to deaths a…",1255344144131723264,WitnessnewsI,,74,113,,False,False,1933,,,1452,0,0.375,-0.125,negative
2021-03-11 22:34:36,1370141133834219520,"NHSuk: The NHS will never ask you to share bank details or pay for the COVID-19 vaccine. 

Report anything you receive that looks suspi…",20377194,aimasters,West Sussex,542,245144,,True,False,199513,,,81,0,0.0,0.0,neutral
2021-03-11 22:34:36,1370141133586771972,"NBCNews: Pfizer's Covid-19 vaccine cuts transmission of the coronavirus, new real-world study shows. ",1722907592,38Belton,,286,13643,,False,False,94869,,,64,0,0.45454545454545453,0.13636363636363635,positive
2021-03-11 22:34:36,1370141131783204870,CBSNews: President Biden is expected to announce Wednesday afternoon that the federal government is purchasing 100 million more doses o…,388296434,pamelaisanchez,"Atlanta, GA",443,3048,,True,False,11839,,,788,0,0.45,0.2,positive
2021-03-11 22:34:36,1370141131544039425,"There have been few reports of increased blood clot formation in some patients given AstraZeneca vaccine. If, true, it can easily be overcome using a short course of anti
thrombotic like aspirin, FactorXa inhibitors or low molecular weight heparin. This would clear all doubts.",1252835854512340995,Subrama00420182,,17,47,,True,False,1203,,,0,0,0.4277777777777778,0.11388888888888887,positive
2021-03-11 22:34:36,1370141131384762370,"KatyTurNBC: One year of COVID. 
Seven months pregnant. 
First shot of Pfizer.",896429122204971010,vere_percy,United States,206,38267,,False,False,34290,,,453,0,0.41666666666666663,0.29166666666666663,positive
2021-03-11 22:34:35,1370141128020914182,"MassDPH: Starting today (March 11), K-12 educators, K-12 school staff and child care workers are now eligible for COVID-19 vaccine. Lea…",725424156548935681,AnneJohansen16,,132,26747,,True,False,29758,,,14,0,0.1,0.0,neutral
2021-03-11 22:34:35,1370141127123165184,"simondolan: Nothing to see here. Move along. Perfectly safe....

Italy and Norway join Denmark in suspending use of AstraZeneca vaccine…",1371873848,HighTreason1,,262,6343,,False,False,5349,,,893,0,0.5,0.5,positive
2021-03-11 22:34:35,1370141126468980737,"MichelleObama: When you can get the COVID-19 vaccine, I hope you do—Barack and I are certainly glad we did. It’s our best shot at beati…",209403375,joelpatt,"Cambridge, Massachusetts, USA",464,56073,,False,False,43767,,,8200,0,0.65,0.75,positive
2021-03-11 22:34:34,1370141124229222404,freepeeper: AstraZeneca is the only vaccine I wouldn’t take. Seems it’s as effective as the UK track and trace program.,1233467099953143808,sirnutsandbull1,,540,57847,,False,False,36005,,,6,0,0.9,0.3,positive
2021-03-11 22:34:34,1370141121993658372,"LtGovHusted: “I’m ready to do my part.”
-Lt. Governor JonHusted on receiving his COVID vaccine today from HealthWCHD nurse Tammy Rieg…",989875626902458370,MarnieDonnelly7,,414,76635,,False,False,16780,,,12,0,0.5,0.2,positive
2021-03-11 22:34:33,1370141120353742848,borntomub: Just got my first Moderna vaccination dose at the Detroit Association of Black Organizations. DABO is providing vaccinations…,1290067219498635266,ftp_Detroit,"Detroit, MI",795,409,,True,False,907,,,32,0,0.3833333333333333,0.04166666666666667,positive
2021-03-11 22:34:33,1370141118936051716,DrEricDing: Cancer patients need 2nd dose—much less protected against COVID19 after only one dose of Pfizer vaccine. An early 2nd dose…,1949614292,LauraWares,,449,79041,,False,False,36636,,,268,0,0.2733333333333333,-0.01333333333333333,negative
2021-03-11 22:34:33,1370141118806036487,"kayleighmcenany: FINALLY the Biden admin recognizes the Trump admin’s unprecedented vaccine work:

➡️ “We’re grateful for the work that…",1144218224004861952,rachelbeernerd,"St Louis, MO",2,26,,False,False,501,,,4609,0,0.95,0.3,positive
2021-03-11 22:34:33,1370141118722043904,My Shot: A COVID Vaccine Adaptation  via YouTube It's time to elevate health care heroes voices - a plus if it's enjoyable to watch. ThisIsOurShot VaccinesSaveLives,17499373,ImmunizeCa,California,2096,5913,,False,True,12570,,,0,2,0.6,0.5,positive
2021-03-11 22:34:33,1370141118558396419,benshapiro: Don't believe me? Here's Dr. Marty Makary of Johns Hopkins saying the same thing: ,85834470,bobnicks,,61,4347,,False,False,3816,,,403,0,0.125,0.0,neutral
2021-03-11 22:34:33,1370141117669330945,chamorro_judith: The number of thromboembolic events in vaccinated people is no higher than the number seen in the general population.…,152374354,famalamar,,402,26954,,True,False,35191,,,24,0,0.5,-0.03749999999999999,negative
2021-03-11 22:34:32,1370141116805316608,"More than 8,100 Vermonters age 16 to 54 with high-risk health conditions signed up for COVID-19 vaccine appointments through the state’s registration system Thursday, the first day this latest group became eligible. vtcovid19 vthealth ",43352167,mcquiston,,1397,6,,False,False,27572,,,0,0,0.5777777777777778,0.4166666666666667,positive
2021-03-11 22:34:32,1370141116725481475,"conradjwilson: Oregon’s prisons have offered a vaccine to every inmate in custody, some 13,000 people in all. Attorneys representing Or…",436974639,TheGreaterWatt,,114,55779,,False,False,10842,,,212,0,0.0,0.0,neutral
2021-03-11 22:34:32,1370141114741719046,"CNN: Latinos have been among the hardest hit by the pandemic, but have been vaccinated at far lower rates than White Americans.

While…",52230962,PoliticalAnt,"Missouri, USA",15452,138543,,True,False,462362,,,68,0,0.5,0.05,positive
2021-03-11 22:34:32,1370141113617678345,Reuters_Health: Novavax Inc's COVID-19 vaccine was 96% effective in preventing cases caused by the original version of the coronavirus…,1360202667591614464,vacciworld,,176,126,,False,False,409,,,9,0,0.775,0.4875,positive
2021-03-11 22:34:31,1370141112778829824,"TheSun: One dose of Covid vaccine ‘LESS effective in cancer patients sparking fears for millions’, worrying study finds ",433376178,stanleyblagg,middlesbrough,387,937,,True,False,108898,,,5,0,0.43333333333333335,0.21666666666666667,positive
2021-03-11 22:34:31,1370141111944155137,TheTrayci: The suspension of AstraZeneca by most of the powerful nations feels like a whole other pandemic of uncertainties. ,1298983819391844360,mtt1984,Buckinghamshire,138,4810,,False,False,3829,,,8,0,0.56875,0.21875,positive
2021-03-11 22:34:31,1370141108928311296,"amnesty: One year after the WHO declared the COVID19 pandemic, rich countries have bought half of the world’s vaccine supply even tho…",241152898,NewmanEJ,Scotland ,7844,36882,,True,False,25683,,,78,0,0.4583333333333333,0.10416666666666667,positive
2021-03-11 22:34:30,1370141108634849290,"POTUS: One in four adults in the U.S. has received their first COVID-19 vaccine — and we’re now leading the world in vaccinations.

Tha…",1363689691149717506,melarey_,"St Louis, MO",1,0,,False,False,4,,,16392,0,0.3333333333333333,0.25,positive
2021-03-11 22:34:30,1370141107116466181,"CP24: No evidence Oxford-AstraZeneca vaccine is behind blood clots, Canadian experts say  ",1463308806,Otunba_Be,Twitter😉,1228,24023,,True,False,11880,,,43,0,0.7,-0.4,negative
2021-03-11 22:34:30,1370141106265063428,"39-year-old woman dies 4 days after second Moderna vaccine, autopsy ordered | News | LifeSite ",986715151595458560,coop22089074,"Griffin, Georgia",84,15,,False,False,176276,,,1,0,0.0,0.0,neutral
2021-03-11 22:34:30,1370141105833054212,"Reuters: Health authorities in Denmark, Norway and Iceland have suspended usage of the COVID-19 vaccine produced by AstraZeneca after r…",161082845,jmdelalamo,Madrid,61773,311079,,False,True,184409,,,418,0,0.0,0.0,neutral
2021-03-11 22:34:30,1370141105476501505,"If you've got questions about the COVID-19 vaccine and it's affect on pregnancy, watch Dr. Sherley Samuels go into detail on the matter.  



KeepCaringOn ",28190881,PiedmontHealth,"Atlanta, Ga",14538,2251,,False,True,14639,,,2,4,0.0,0.0,neutral
2021-03-11 22:34:30,1370141104935473156,"CNN: Latinos have been among the hardest hit by the pandemic, but have been vaccinated at far lower rates than White Americans.

While…",1140392144,JazzLuvnAnt,,796,4321,,True,False,46020,,,68,0,0.5,0.05,positive
2021-03-11 22:34:29,1370141103761014792,"POTUS: One in four adults in the U.S. has received their first COVID-19 vaccine — and we’re now leading the world in vaccinations.

Tha…",1078663723,J_A_P_S_C_,,4117,11769,,False,False,113525,,,16392,0,0.3333333333333333,0.25,positive
2021-03-11 22:34:29,1370141103651835906,"MuellerSheWrote: Happy to announce the VA has just scheduled me for the two-dose Moderna vaccine 3/15 and 4/5, two weeks after which I’…",1361397567519481856,OurEarth2021,,13,23,,False,False,1890,,,122,0,1.0,0.8,positive
2021-03-11 22:34:29,1370141103307911168,"CTVNews: No evidence Oxford-AstraZeneca vaccine is behind blood clots, Canadian experts say  ",1330257919225585666,CherylYAN17,Victoria,93,2329,,False,False,2157,,,44,0,0.7,-0.4,negative
2021-03-11 22:34:28,1370141100103598081,disclosetv: JUST IN - Norway and Denmark suspend Oxford-AstraZeneca COVID19 vaccine rollout.,443400645,ssebastiannq,,214,8411,,True,False,21753,,,2587,0,0.0,0.0,neutral
2021-03-11 22:34:28,1370141099365445636,LibertyBlitz: Here’s what’s gonna happen. Pretty soon they’re gonna announce everyone can get a covid vaccine and the demand isn’t goin…,227310310,dugongs2,London,79,1130,,False,False,200,,,69,0,1.0,0.25,positive
2021-03-11 22:34:28,1370141096404127745,normanswan: Reinforces why our borders should be ringed using Pfizer and include workers’ households. ,26437061,strawberrymojo,"Melbourne, Victoria",273,88152,,False,False,7583,,,230,0,0.0,0.0,neutral
2021-03-11 22:34:27,1370141094122459136,No sign Oxford-AstraZeneca vaccine causes blood clots: Canadian health authorities ,35881568,mlauriat,Canada,5527,57216,,True,False,65950,,,0,0,0.0,0.0,neutral
2021-03-11 22:34:27,1370141093652750340,mark_toshner Any adverse events will be investigated by Astra Zeneca and if there’s a safety signal the product information will be updated and submitted to the MHRA for approval.,247490030,djrsquared,"London, UK",1705,163799,,True,False,64314,,,0,4,0.0,0.0,neutral
2021-03-11 22:34:27,1370141093258530818,"Nearly 1,800 vaccine doses were administered in Niagara on March 10
",47827460,NiagarathisWeek,,14049,136,,False,False,23060,,,2,5,0.4,0.1,positive
2021-03-11 22:34:27,1370141092872474627,"NYGovCuomo: New Yorkers can trust the vaccines are safe, effective and free. 

Whether it's Moderna, Pfizer, or Janssen/J&amp;J — when it's…",23897833,GraceC4David,"Queens, NY",866,2394,,True,False,117123,,,227,0,0.6386363636363637,0.40909090909090906,positive
2021-03-11 22:34:26,1370141091823939584,"jean15849180: TND...    AstraZeneca 
Professor Murphy said one dose of the vaccine provided  
    full protection but needed to be topp…",1214489977762959362,MicheleScheffl1,,1254,67499,,True,False,72517,,,9,0,0.55,0.35,positive
2021-03-11 22:34:26,1370141089773056001,"Before COVID Outbreak, Gates Planned Social Media Censorship of Vaccine Safety Advocates With Pharma, CDC, Media… ",401004521,WinfredKNzui,,56,1735,,False,False,1603,,,0,0,0.06666666666666667,0.03333333333333333,positive
2021-03-11 22:34:26,1370141088946733056,"dwnews: Denmark, Norway and Iceland suspended the use of AstraZeneca's COVID-19 vaccine after there were reports of blood clots among s…",1328503319111745536,macabro_don,Dreamland,31,4331,,False,False,1811,,,56,0,0.0,0.0,neutral
