created,id_str,text,user_id,screen_name,location,followers_count,user_favourites_count,time_zone,geo_enabled,verified,status_count,geo,coords,retweet_count,tweet_favourite_count,Subjectivity,Polarity,Sentiment
2021-03-11 22:38:24,1370142087140802560,NicolaiLongo KyleKulinski The same people who said that we didn’t need to worry about preventing COVID because it only had a 3% death rate are now saying to avoid the COVID vaccine because it has a death rate of 0.0035%. Can’t fix stupid,3330450508,ItsMeDaveBanno,,685,1236,,False,False,3146,,,0,3,0.7083333333333334,-0.26666666666666666,negative
2021-03-11 22:38:24,1370142086339518464,NFB_voice: .Aira just announced that they will be providing free service to those needing to complete COVID19 vaccination-related tas…,798997276580409344,veron4ica,"Virginia, USA",2503,1674,,True,False,4730,,,22,0,0.6000000000000001,0.25,positive
2021-03-11 22:38:23,1370142083865018373,"LV_doeshair: Today is a big day... I’m getting my first dose of the vaccine... I’m gonna be a Pfizer baby!! 

And as promised... I plan…",1357808681157595136,RAJBhagwandin16,Guyana,345,5763,,True,False,9243,,,14,0,0.21666666666666667,0.1953125,positive
2021-03-11 22:38:23,1370142083470794753,"DHSCgovuk: ""There is no shred of evidence to suggest that the vaccine affects your fertility, either male or female.""

Watch Dr Charles…",562322322,AlishaxHaworth,"Darwen, England ",443,17896,,True,False,5809,,,125,0,0.13333333333333333,0.0,neutral
2021-03-11 22:38:23,1370142082027958275,mark_toshner: I have tweeted about likely over-reporting of side effects of vaccines extensively in the past but will have another go a…,1097501475239092224,indymeansindy,,1883,12378,,False,False,26567,,,260,0,0.5277777777777778,-0.08333333333333333,negative
2021-03-11 22:38:22,1370142081721589760,KVOA: Pima County expands COVID-19 vaccine eligibility to frontline workers and those age 55 and older  ,287861586,Andy_Tobin,"Paulden,AZ-Parlor=@AndyTobin69",6675,8154,,True,True,44039,,,8,0,0.3333333333333333,0.16666666666666666,positive
2021-03-11 22:38:22,1370142081063206920,"JenGilroy1 Yes, at last our PM is doing something right but we have the highest death rate from Covid 19 in Europe!  I hope your vaccine process speeds up, hopefully it will help stop this pandemic, although needed the world over for that really.",410823221,roberts_jenifer,Suffolk UK,435,21620,,False,False,17866,,,0,0,0.26746031746031745,0.18571428571428572,positive
2021-03-11 22:38:22,1370142080454991875,"m_scribe: Breaking: Novavax announces efficacy results in its vaccine trials.

* 100% protection against severe disease
* 96% effective…",27818124,yayayarndiva,"Sonoma County, California",13058,602577,,True,False,556764,,,689,0,0.0,0.0,neutral
2021-03-11 22:38:22,1370142080153092100,"Reuters: Data suggests the Pfizer-BioNTech vaccine is 94% effective in preventing asymptomatic infection, meaning it could significantl…",885726352799703040,myrenekala,Sin City's cold and empty,632,132785,,False,False,260791,,,115,0,0.8,0.6,positive
2021-03-11 22:38:21,1370142076596281350,mariamainmo: Girls don't want boys. They want the covid vaccine and a nice apartment,1004412848334950400,hannah_gazette,"Findlay, OH",80,15056,,False,False,1125,,,25197,0,1.0,0.6,positive
2021-03-11 22:38:21,1370142076319498240,"POTUS: One in four adults in the U.S. has received their first COVID-19 vaccine — and we’re now leading the world in vaccinations.

Tha…",896336083,hidinginhorror,New York,362,35065,,False,False,16195,,,16392,0,0.3333333333333333,0.25,positive
2021-03-11 22:38:21,1370142075992248320,"JoJoFromJerz: The former guy wants us to thank him for the Covid vaccine.
He wants to take credit for something?
He can claim the lives…",507026819,JoeKassel,"San Diego, CA",430,148611,,True,False,33953,,,132,0,0.06666666666666667,0.13333333333333333,positive
2021-03-11 22:38:21,1370142075266740225,"jmdcdenver TexasTribune TexasDSHS The hub is the Kelly Reeves Athletic Complex in north Austin. Here's a impactnews story about the WilCo hubs: 
",2214361452,kbrooksharper,Austin,383,1035,,False,False,489,,,1,2,0.4,-0.3,negative
2021-03-11 22:38:20,1370142072347394049,healthvermont: VT is vaccinating people 16+ with certain high-risk health conditions. A doctor’s note or proof of a health condition i…,1250835894304681984,TraumaEncore,nyc,3,41,,False,False,67,,,36,0,0.5714285714285714,0.21428571428571427,positive
2021-03-11 22:38:20,1370142072108367873,"bealelab: Here's our perspective on immunity to variants of concern, written to accompany the original Pfizer data showing modestly red…",823682948,EGalueMozo,"Exeter, England",355,29253,,False,False,18599,,,81,0,0.825,0.2375,positive
2021-03-11 22:38:20,1370142071554736129,"scottlincicome I had Covid at Christmas, I get my second Pfizer dose in two weeks I think that means I have like 130% immunity and when I breathe out it will kill Coronavirus particles floating in the air",138859582,Blooshier,St. Louis,276,15049,,True,False,32366,,,0,1,0.0,0.0,neutral
2021-03-11 22:38:20,1370142069935767556,voiceofnigeria: Army helicopter lands tiny Irish island with Covid-19 vaccine ,156675342,Ngbaby,Nigeria,530,6498,,True,False,6535,,,1,0,0.25,0.0,neutral
2021-03-11 22:38:19,1370142065191968774,"FDA: COVID-19 Vaccine is an unapproved vaccine.. There is no FDA-approved vaccine to prevent COVID-19.

The White House: “..you should just take that vaccine. They’ve all been approved by the FDA— these three vaccines.”
RobertKennedyJr naomirwolf ",20013633,natedan_,,879,802,,True,False,1882,,,0,0,0.0,0.0,neutral
2021-03-11 22:38:18,1370142063002533898,"kcvaccinewatch: KS: Vaccine appointments available at Hy-Vee Prairie Village from Mar 12 to Mar 15. Sign up here, zip code 66208:
https…",16115948,kcwineguy,"Online, always!",6372,38972,,False,False,52310,,,8,0,0.4,0.4,positive
2021-03-11 22:38:18,1370142062914457604,newscientist: Should you get a test to measure antibodies after a covid-19 vaccine?  ,2955205253,ovationglas115,,35,3480,,False,False,2984,,,16,0,0.0,0.0,neutral
2021-03-11 22:38:17,1370142059580039176,drhpaz: .OSUCCC_James' Electra Paskett joined WOSU's WellnessWednesday to discuss what we know about the Johnson &amp; Johnson COVID19…,34295436,OSUCCC_James,"Columbus, Ohio",13447,7511,,True,False,12803,,,1,0,0.0,0.0,neutral
2021-03-11 22:38:17,1370142057583448064,mellowmariooo2: If you live in the imperial valley they are giving Covid vaccine shots from 2-6 at the Westmorland youth center ;),1215344265858936832,Gera_Sacc,Plus Ultra ,303,29649,,True,False,2743,,,7,0,0.5333333333333333,0.09545454545454546,positive
2021-03-11 22:38:17,1370142057013112834,jsolomonReports: Trump: U.S. ‘probably’ would’ve never had COVID-19 vaccine without him | Just The News ,80858170,beamstx,"Austin, Texas",466,102027,,False,False,74505,,,313,0,0.0,0.0,neutral
2021-03-11 22:38:17,1370142056815816704,rjmyers This must be a bloody nightmare for them first the covid now the American mind you at least we have the vaccine for the covid !!,146798997,janie2home,Here,56,436,,False,False,3180,,,0,0,0.4083333333333333,-0.2546875,negative
2021-03-11 22:38:16,1370142056711094279,"Vast majority of Howard school staff, educators have received a COVID vaccine shot, county says 

HoCoMD",913194096,Steven_Sager,"Columbia, MD.",5400,1581,,True,False,12917,,,0,0,1.0,0.0,neutral
2021-03-11 22:38:16,1370142055947640838,TheNewDailyAu: The AstraZeneca COVID vaccine has been suspended from use in several countries while authorities investigate reports of…,3165903396,nic_fri,,88,48279,,False,False,32655,,,7,0,0.0,0.0,neutral
2021-03-11 22:38:16,1370142053926109184,"BarackObama: Michelle and I got vaccinated against COVID-19 because we know it’s the best way to beat this pandemic, protect one anothe…",925633617870704641,MashikeJoy,,220,184,,False,False,292,,,10077,0,0.3,1.0,positive
2021-03-11 22:38:16,1370142053267599360,South Africa suspends use of AstraZeneca’s COVID-19 vaccine after it fails to clearly stop virus variant | Science | AAAS ,1351188126170013698,tycho60944643,"Porto Alegre, Brasil",833,142,,False,False,6653,,,0,0,0.3416666666666667,-0.19999999999999998,negative
2021-03-11 22:38:15,1370142052151873537,"Air Israel and Pfizer to the rescue 🤭
Pfizer israel vaccine COVID19 CovidVaccine SouthPark SouthPark SouthParQ  ",1162827388696367105,EmrKfir,Israel,48,21991,,True,False,1432,,,2,1,0.0,0.0,neutral
2021-03-11 22:38:15,1370142049756803073,"TomiLahren: If you need an ID to get a Covid vaccine, why the hell shouldn’t you need an ID to vote?!! LiberalismIsAMentalDisorder",1039004244240621568,WatusiCrypto,,734,126705,,False,False,126739,,,2328,0,0.0,0.0,neutral
2021-03-11 22:38:15,1370142049211543553,Reuters: Italy bans AstraZeneca batch following two deaths in Sicily: source  ,901447426111819779,KRaju29878,INDIA,24,1760,,False,False,317,,,376,0,0.1,0.0,neutral
2021-03-11 22:38:14,1370142047001280514,MuellerSheWrote I just received my first Pfizer shot today.  Funny the second will be on April's fools.,1079475555790213122,RobertC_52,"New Jersey, USA",2,129,,False,False,726,,,0,0,0.4444444444444444,0.16666666666666666,positive
2021-03-11 22:38:14,1370142045826863111,"doc_turek: Denmark, Estonia, Lithuania, Luxembourg, Latvia suspend AstraZeneca Covid vaccine after reports of potentially fatal blood c…",1353766169971404800,RicFreeSpeech,,81,8372,,False,False,9692,,,49,0,1.0,0.0,neutral
2021-03-11 22:38:14,1370142045076094978,"DHSCgovuk: ""There is no shred of evidence to suggest that the vaccine affects your fertility, either male or female.""

Watch Dr Charles…",823682948,EGalueMozo,"Exeter, England",355,29253,,False,False,18599,,,125,0,0.13333333333333333,0.0,neutral
2021-03-11 22:38:13,1370142043851390979,DMinghella: Seems to be increasing evidence that Pfizer vaccine protection falls off fast for the immunocompromised - that's me and mil…,325503567,simonclarke10,,2202,59842,,True,False,46216,,,39,0,0.6,0.2,positive
2021-03-11 22:38:13,1370142042362363907,"DHSCgovuk: COVID19 VACCINE UPDATE: Daily figures on the number of people who have received a COVID-19 vaccine in the UK.

As of 11 Mar…",464559471,MrsEvs3,,108,14444,,False,False,5678,,,61,0,0.0,0.0,neutral
2021-03-11 22:38:13,1370142041959755784,"Mayor_Jeff: COVID-19 Update for March 11th, 2021.  Remembering the victims of COVID, caseloads plateauing, vaccine information and roll…",80391340,NeilAnthonyLive,"Ontario, Canada",2102,40885,,True,False,24745,,,5,0,0.0,0.0,neutral
2021-03-11 22:38:12,1370142038382026757,disclosetv: JUST IN - Norway and Denmark suspend Oxford-AstraZeneca COVID19 vaccine rollout.,952247125185720320,viralvideovlogs,കേരളം,5967,2307,,False,False,601932,,,2587,0,0.0,0.0,neutral
2021-03-11 22:38:12,1370142037274550275,"Regular flu shot already scheduled. Every year I receive the flu shot. However, the list keeps growing when it comes the AstraZeneca vaccine. auspol",3072235147,Vanished00One,Brisbane Australia,50,18,,True,False,1816,,,0,1,0.07692307692307693,0.0,neutral
2021-03-11 22:38:12,1370142036519747588,jsolomonReports: Trump: U.S. ‘probably’ would’ve never had COVID-19 vaccine without him | Just The News ,2553408986,jleetxgirl,"Texas, USA",3954,131346,,False,False,165317,,,313,0,0.0,0.0,neutral
2021-03-11 22:38:12,1370142036368711686,conarck: Florida is now ranked fourth among the Top 5 most populous states in distributing COVID vaccine. The bottom slot goes to Texas…,34216888,WFLAJustin,"Tampa, FL",3264,5704,,True,True,15680,,,70,0,0.3333333333333333,0.3333333333333333,positive
2021-03-11 22:38:12,1370142036121120769,ACHI_Net: In our newsletter: The COVID19 pandemic reaches the one-year mark in Arkansas; CDCgov's new guidelines for vaccinated peopl…,81211010,johnlyon09,"Little Rock, AR",2692,2394,,False,False,7218,,,3,0,0.45454545454545453,0.13636363636363635,positive
2021-03-11 22:38:12,1370142035978694663,"New story on NPR: Moderna And Pfizer On Track To Hit Vaccine Production Goals Pfizer and Moderna each agreed to supply 100 million doses of COVID-19 vaccine to the U.S. by the end of March. With just under three weeks left, both companies have their work cut out for them.htt…",809435591502950400,teaching_change,United States,966,175,,True,False,6199,,,0,0,0.22727272727272727,0.06818181818181818,positive
2021-03-11 22:38:11,1370142034649026563,"walgreens 1227 forrest SI, NY just denied me the covid vaccine after confirming the appt online. They will surely discard the dose. The tech blamed NYGovCuomo .",16811082,LifeblossomNY,"Staten Island , NY",10,612,,False,False,215,,,0,0,0.8888888888888888,0.5,positive
2021-03-11 22:38:11,1370142033499750401,disclosetv: JUST IN - Norway and Denmark suspend Oxford-AstraZeneca COVID19 vaccine rollout.,265842505,Pinacosan,,42,7013,,False,False,8262,,,2587,0,0.0,0.0,neutral
2021-03-11 22:38:11,1370142031775854593,Jared_Rubioo: PSA: walgreens has sooo many openings if you want the covid vaccine! I didn’t even wait a full day to get mine!!,1235870466,Monniiicca_,,1107,186820,,True,False,108149,,,11,0,0.525,0.5859375,positive
2021-03-11 22:38:09,1370142026566672384,"Sack_SAGE: RobertKennedyJr libertytarian Funny how if you die within 28 days of a positive test in the UK, you're counted as having d…",1163033708905021441,MindfulnessZen2,“Karma is meeting yourself.”  ,244,4442,,False,False,10695,,,5,0,0.7727272727272727,0.23863636363636365,positive
2021-03-11 22:38:09,1370142026348560390,"CNBCJulianna: IMPORTANT: The AstraZeneca vaccine has been found to be safe and effective by UK &amp; international authorities. 

""The inf…",363175790,Shnellbag,Hannover,448,76914,,True,False,22194,,,61,0,0.575,0.375,positive
2021-03-11 22:38:09,1370142025341882369,"Texans 50 and older will be eligible for a COVID-19 vaccine starting March 15!
Link: ",1370134207582855169,MaskUpTejas,,0,1,,False,False,2,,,0,1,0.21666666666666667,0.08333333333333333,positive
2021-03-11 22:38:09,1370142025161527300,"ninaturner: Part two of our Hello Somebody COVID series with TheEricaEngland and DrDooleyMD is now up 🙌🏾

We get the facts straight a…",1267415205677588480,nstark1959,,98,55976,,False,False,60545,,,32,0,0.4,0.2,positive
2021-03-11 22:38:09,1370142024670715907,"MichelleObama: When you can get the COVID-19 vaccine, I hope you do—Barack and I are certainly glad we did. It’s our best shot at beati…",324049999,MashaChernyak,"San Francisco, CA",912,11230,,False,False,2428,,,8200,0,0.65,0.75,positive
2021-03-11 22:38:08,1370142019092242435,"DeItaone: NOVAVAX - ACROSS UK AND SOUTH AFRICA TRIALS, CO'S COVID-19 VACCINE CANDIDATE DEMONSTRATED 100% PROTECTION AGAINST SEVERE DISE…",1361118195277385728,BioBucksUT,,74,439,,False,False,456,,,73,0,0.0,0.0,neutral
2021-03-11 22:38:07,1370142016538042371,"Scots aged 60-64 have taken to social media to urge others in their age group to call the national Covid-19 vaccine helpline
",34580330,edinburghpaper,Edinburgh,166963,5489,,False,True,175519,,,31,26,0.23333333333333334,-0.03333333333333334,negative
2021-03-11 22:38:07,1370142015925653506,"alanredmond: FatEmperor Great presentation by doctor in Idaho about COVID, vitamin D, effective treatments and vaccine data.  ",2383882980,FatEmperor,Ireland,120248,130381,,True,False,93807,,,50,0,0.775,0.7,positive
2021-03-11 22:38:07,1370142015673954305,narendramodi: Happy to share that my mother has taken the first dose of the COVID-19 vaccine today. I urge everyone to help and motivat…,72773822,govindagopala,"Sydney, Australia",2188,139420,,True,False,43695,,,16840,0,0.6666666666666666,0.525,positive
2021-03-11 22:38:06,1370142013094510595,"AniMat505: In Canada, we dedicated today as a day of remembrance of the lives we have lost due to the COVID-19 pandemic. Until we all g…",753989484593745920,RedheadXilamGuy,"Houston, TX",492,14635,,False,False,17187,,,41,0,0.375,-0.125,negative
2021-03-11 22:38:06,1370142012947771392,"MountvSimon FrankieGem57 MatthewRBroad I don't blame you, I will also. There is zero chance of me getting the vaccine and they can stuff the passport up their arse. 

It's amusing how these clowns think this simply ends at a Covid passport. They've no ability to think about the ramifications of accepting this crap.",1363878248116064265,PaulThommo89,,27,75,,False,False,426,,,0,1,0.7190476190476192,-0.0666666666666667,negative
2021-03-11 22:38:06,1370142012905816066,"MichelleObama: When you can get the COVID-19 vaccine, I hope you do—Barack and I are certainly glad we did. It’s our best shot at beati…",158088012,Jim_Saunders_84,,236,40106,,True,False,12512,,,8200,0,0.65,0.75,positive
2021-03-11 22:38:06,1370142012041666561,"gummibear737: I mean Ahab Fauci wants to defeat AIDS before he retires

Also NIAID partnered with Moderna on the development of their m…",733795282677174273,novakglobal,On The Gab also,1471,20437,,False,False,32052,,,118,0,0.39375,-0.056249999999999994,negative
2021-03-11 22:38:05,1370142009613254657,NewstalkFM: An Irish immunologist says focusing on 16-35 year olds after the most vulnerable groups are vaccinated could reduce COVID-1…,771104194635898880,Jack_Nelligan,Louth | Dublin | Dundalk,179,29749,,False,False,20699,,,5,0,0.3333333333333333,0.0,neutral
2021-03-11 22:38:04,1370142006287208453,"JNJNews: Kathy Wengel, CSCO, Johnson &amp; Johnson, shares how JNJ is leveraging its extensive experience and investing to expand its glob…",1151794208488996865,ITChardonnay,"Nottingham, England",62,10626,,False,False,4023,,,11,0,0.3333333333333333,0.0,neutral
2021-03-11 22:38:04,1370142005452365825,"Public_Citizen: 9 out of 10 people in poor countries won't have access to a COVID vaccine next year. 

Meanwhile, rich countries have h…",3305420634,TGreyland,,193,27542,,False,False,20712,,,271,0,0.45,-0.00833333333333334,negative
2021-03-11 22:38:04,1370142004563255296,narendramodi: Happy to share that my mother has taken the first dose of the COVID-19 vaccine today. I urge everyone to help and motivat…,3197814582,Passyshruti,Ludhiana Punjab,31,7610,,False,False,729,,,16840,0,0.6666666666666666,0.525,positive
2021-03-11 22:38:04,1370142004081008643,danieteebee: It’s completely predictably American that the brand of COVID vaccine you have access to has now become a class signifier,1145801041700671488,smileysingsong,Idol Hell (like always),21,29539,,False,False,14511,,,10902,0,0.0,0.0,neutral
2021-03-11 22:38:04,1370142003254718465,Covid-19: Several European countries suspend AstraZeneca vaccinations over blood clot fears  via FRANCE24,1119362017851322371,WhiteHousebirds,"Paignton, Devon, UK",173,10888,,False,False,3034,,,0,0,0.0,0.0,neutral
2021-03-11 22:38:04,1370142002776449026,"welosthim: Second AstraZeneca volunteer reportedly suffers rare neurological condition, but UK company says it’s not related to vaccine…",1284246485933031425,FrancisLWhite2,,133,32173,,False,False,9877,,,21,0,0.5,-0.075,negative
2021-03-11 22:38:03,1370142002042572802,"BromleyMencap: You should still stay home and stick to the rules, even if you have had the Covid-19 vaccine. You need both doses of the…",1198766088,Barnes47Jane,Orpington,364,481,,True,False,2234,,,1,0,0.0,0.0,neutral
2021-03-11 22:38:03,1370142001203609602,"TomiLahren: If you need an ID to get a Covid vaccine, why the hell shouldn’t you need an ID to vote?!! LiberalismIsAMentalDisorder",1243408229834452999,DeanJMueller1,,1,641,,False,False,125,,,2328,0,0.0,0.0,neutral
2021-03-11 22:38:03,1370141999953760258,"alexsalvinews: NEW: Denmark temporarily suspends the AstraZeneca COVID vaccine due to cases of blood clots in recipients.

Health offic…",1017170315192004609,creese59403939,,96,112025,,False,False,36488,,,628,0,0.4147727272727273,0.005681818181818177,positive
2021-03-11 22:38:02,1370141996178841600,"NBCNews: BREAKING: President Biden signs $1.9T Covid relief bill into law; ​includes $1,400 checks, $300/wk jobless benefits, child all…",2546690178,PatBakalian,"Santa Rosa, CA",7662,20028,,True,False,8550,,,2370,0,0.0,0.0,neutral
2021-03-11 22:38:02,1370141996040523776,"Reuters: Health authorities in Denmark, Norway and Iceland have suspended usage of the COVID-19 vaccine produced by AstraZeneca after r…",320252434,flyer4life,,7899,201518,,False,False,245296,,,418,0,0.0,0.0,neutral
2021-03-11 22:38:02,1370141995251990529,danieteebee: It’s completely predictably American that the brand of COVID vaccine you have access to has now become a class signifier,753693567357509632,wildest_summer,he/him,497,169899,,True,False,20918,,,10902,0,0.0,0.0,neutral
2021-03-11 22:38:02,1370141995210043393,"1 year ago today the first reports of covid-19 in the US took over the news, and our lives. 1 year later I received my second dose of the vaccine and in two weeks will be as immunized as possible against this horrible pandemic that flipped our lives upside down. I cried.",17448333,Meganmillsphoto,"Syracuse, NY",300,222,,True,False,7708,,,0,3,0.43703703703703695,-0.15092592592592594,negative
2021-03-11 22:38:01,1370141990722097156,voiceofnigeria: Kano Governor takes Covid-19 vaccine ,156675342,Ngbaby,Nigeria,530,6498,,True,False,6535,,,2,0,0.0,0.0,neutral
2021-03-11 22:37:59,1370141984929746946,"MGcfr: GOV FINTIRI'S SSA NEW MEDIA TUKUR RECEIVES COVID-19 VACCINE

The Senior Special Assistant (SSA) to Governor Ahmadu Umaru Fintiri…",1180130808,MuhammadKummo, ✖,838,90014,,True,False,54255,,,16,0,0.512987012987013,0.24675324675324675,positive
2021-03-11 22:37:58,1370141980555051009,NPRHealth: Moderna And Pfizer On Track To Hit Vaccine Production Goals ,27818124,yayayarndiva,"Sonoma County, California",13058,602577,,True,False,556764,,,218,0,0.0,0.0,neutral
2021-03-11 22:37:58,1370141980144009216,"BBCNews: Friday’s FT: “EU vaccine woes deepen as clouds gather over AstraZeneca supplies” 
 
BBCPapers TomorrowsPapersToday ",8619542,leftboomer,Sydney,3133,19710,,False,False,263109,,,19,0,0.0,0.0,neutral
2021-03-11 22:37:58,1370141978839617541,"POTUS: One in four adults in the U.S. has received their first COVID-19 vaccine — and we’re now leading the world in vaccinations.

Tha…",1708710216,StillMidtn,,836,4933,,False,False,34388,,,16392,0,0.3333333333333333,0.25,positive
2021-03-11 22:37:58,1370141977581387776,"However, appointments may continue to be hard to find, as the number of eligible recipients outnumbers the vaccine supply. ",1650579692,TBBusiness,"McAllen, Texas",3901,1098,,True,False,38762,,,0,0,0.5416666666666666,-0.2916666666666667,negative
2021-03-11 22:37:57,1370141976142643200,"POTUS: One in four adults in the U.S. has received their first COVID-19 vaccine — and we’re now leading the world in vaccinations.

Tha…",2281050470,JSBAMA14,,134,87178,,False,False,20593,,,16392,0,0.3333333333333333,0.25,positive
2021-03-11 22:37:57,1370141974926290945,Nigeria moves to douse anxieties over AstraZeneca's COVID-19 vaccine  via PremiumTimesng,271617242,conumah,Everywhere,8271,244,,True,False,23123,,,1,1,0.0,0.0,neutral
2021-03-11 22:37:57,1370141974682955780,Exclusive: EU told to expect no AstraZeneca vaccines from U.S. in near future - sources ,41542441,Mazri73,Malaysia,958,11037,,True,False,43689,,,0,0,0.2625,0.05,positive
2021-03-11 22:37:57,1370141973265346561,"It would appear that the withdrawal of insurance, which began yesterday is a move to force the federal government to underwrite nurses giving the Covid vaccine. The skeptics among us might say this a blatant cash grab by insurers.",737489186769358849,itsChrisoNP,"Brisbane, Queensland",586,2134,,False,False,795,,,1,3,0.5,-0.5,negative
2021-03-11 22:37:57,1370141973210861576,"RobAdam74497148: No link. Just everyone got blood clots: 
 
""At least NINE European countries hit pause on their use of AstraZeneca's d…",19144321,CountryGardener,"Ontario, Canada",4490,49649,,True,False,22305,,,45,0,0.2,-0.15,negative
2021-03-11 22:37:56,1370141972862750724,"European Medicine Agency probing 1 vaccine...
Romania pauses use of AstraZeneca COVID-19 vaccine batch  via YahooNews",37738151,owenjamesja,Jamaica,15659,1805,,False,False,33455,,,0,0,0.0,0.0,neutral
2021-03-11 22:37:56,1370141972556562439,SkyNewsAust: Italy has joined several European countries – including Norway and Denmark – temporarily suspending the AstraZeneca vaccin…,1214115059783233536,MamaW77673739,East Midlands,274,22966,,False,False,1830,,,43,0,0.0,0.0,neutral
2021-03-11 22:37:56,1370141971453464579,Utah mom Kassidi Kurill dies four days after second dose of Moderna vaccine  via nypost,2347762376,colman3colman,,2,31,,False,False,355,,,0,0,0.0,0.0,neutral
2021-03-11 22:37:56,1370141970526535687,"POTUS: One in four adults in the U.S. has received their first COVID-19 vaccine — and we’re now leading the world in vaccinations.

Tha…",2227437721,TVjunkieupnorth,New York  U.S.A.,779,39296,,False,False,69605,,,16392,0,0.3333333333333333,0.25,positive
2021-03-11 22:37:56,1370141969582747648,nikinikill I got the Pfizer one and they had us sit for 15 min after in case anything happened allergies wise. Then my arm was sore and i slept off and on for the first 24-36 hrs. No other symptoms at all for first round. I get my second on the 25th.,1364279401110663169,itsbleekerxox,las vegas,136,2335,,False,False,224,,,0,1,0.3902777777777778,0.17708333333333334,positive
2021-03-11 22:37:56,1370141969507307520,"NTarnopolsky: Pfizer CEO Albert Bourla says Netanyahu called him more than 30 times, including at 3am. ""I was impressed, frankly, with…",193286156,victoraraujodf,,12,123,,False,False,70,,,57,0,0.75,0.75,positive
2021-03-11 22:37:56,1370141969402433536,"YahooNews: Novavax Covid vaccine highly effective against severe Covid, company says  ",240890559,gregawashington,in a galaxy near you,1129,20531,,True,False,51086,,,1,0,0.8,0.6,positive
