created,id_str,text,user_id,screen_name,location,followers_count,user_favourites_count,time_zone,geo_enabled,verified,status_count,geo,coords,retweet_count,tweet_favourite_count,Subjectivity,Polarity,Sentiment
2021-03-12 01:44:47,1370188993833410562,"And the only other thing he spoke (apart from seeking sympathy by lowering his voice when referring to families of those who lost their lives to COVID) about is, how much a moron he is to collaborate two competitors and rivals in producing the same vaccine...",1133369089861324800,thebossoriginal,United States,3472,27668,,False,False,54694,,,0,4,0.625,-0.23125,negative
2021-03-12 01:44:47,1370188993824980992,"I had a thought, in 3 weeks with my second Covid-19 vaccine I can start hanging out with friends again.

I really didn't think this through.",743989339,RDammeyer,Bridge of the USS Enterprise,460,23019,,True,False,20987,,,0,2,0.1,0.1,positive
2021-03-12 01:44:46,1370188988460449793,"RubiHackett: VinGuptaMD Watching you now on thereidout. Wanted you to know, you and only you are the reason I got past my fear and st…",1257354940877594625,Daliblue2,,33,57369,,False,False,14952,,,21,0,0.625,-0.125,negative
2021-03-12 01:44:45,1370188984337436678,"MaxKennerly: Yamiche 1995-2005: Katalin Karikó invents mRNA tech
2010-15: BioNTech &amp; Moderna develop vaccine applications
2015: Obama…",330094565,sigmunddreud,"Baltimore, MD",474,16878,,True,False,34316,,,395,0,0.0,0.0,neutral
2021-03-12 01:44:45,1370188984022880260,"katchicago: At Illinois’ biggest nursing home, workers and residents still not vaccinated against COVID-19 ",889592425,GrantWehrli,"Naperville, IL",2014,2110,,False,False,5363,,,2,0,0.0,0.0,neutral
2021-03-12 01:44:45,1370188983058231297,"Forbes: Novavax, a biotech company based in Maryland, announced today that its two-dose vaccine was 96% effective against the original…",1360689838564003844,StevoB06,The Place For Reliable News,190,12868,,False,False,10814,,,32,0,0.8,0.6,positive
2021-03-12 01:44:44,1370188980445061121,"CNNPolitics: “All adult Americans will be eligible to get a vaccine no later than May 1,"" President Biden announces. ""That doesn't mean…",1168531963944132608,theresesantoss,🔜: 🇯🇵,58,12677,,False,False,5700,,,142,0,0.15,0.05,positive
2021-03-12 01:44:44,1370188980268961799,"LincolnsBible: My god... I cannot imagine how wretched the vaccine and Covid infection situation in America would be right now, if Jare…",980469337738838016,a2_mich,,34,7877,,False,False,8802,,,418,0,0.5357142857142857,0.2857142857142857,positive
2021-03-12 01:44:43,1370188977735659520,"bhrenton: In a major step for vaccinations in rural areas, the CDC is in talks with Dollar General, which has over 16,000 locations acr…",698483,iansltx,"Austin, TX",2258,17629,,True,False,38539,,,86,0,0.3333333333333333,0.037500000000000006,positive
2021-03-12 01:44:43,1370188977425293313,"Bill9MileParker: This is, of course, completely false. The development of the Pfizer vaccine was funded by Germany not Operation Warp S…",330770394,BethSunfall,Kansas,39,169,,False,False,7763,,,48,0,0.6,-0.4000000000000001,negative
2021-03-12 01:44:43,1370188976628379659,HouseGOP GOP's morally bankrupt. NO UR NOT RESPONSIBLE 4 HELPING US'S COVID RELIEF!What did U do 4 any1?Cares Act bc UR donors were worried about losing $/election-help 4 vaccines.Dolly P gave 1mil$ 4 vaccine as GOP WORKED/works DAILY AGAINST SCIENCE SO 1/2 mil OF US COULD DIE,85147941,sasellis,South Carolina,58,524,,False,False,11272,,,0,0,0.26666666666666666,-0.03333333333333333,negative
2021-03-12 01:44:43,1370188976125046785,"SciInsider: 5 people share their Pfizer and Moderna vaccine side effects, from arm pain to aches and fevers ",1338517514788216836,BramptonDear,"Brampton, Ontario",1,245,,False,False,104,,,4,0,0.0,0.0,neutral
2021-03-12 01:44:43,1370188975760097282,Nickalenpsych ThesociologistS I was thinking of reports showing that young people are more likely than older adults to report that they're not likely to get the COVID vaccine.,321563970,JessicaCalarco,"Bloomington, IN",26554,81127,,False,False,29471,,,0,1,0.6466666666666667,0.15333333333333332,positive
2021-03-12 01:44:43,1370188975651098624,"JerasIkehorn: RE: TRUMP CLAIMING CREDIT FOR THE VACCINES 
Pfizer, the first vaccine approved, was not a part of Operation Warp Speed.…",974470310,supersluggg,Florida,144,40521,,True,False,6140,,,278,0,0.3333333333333333,0.25,positive
2021-03-12 01:44:42,1370188974015328256,What about the people that can't take the vaccine for Covid what do you do? I am one who can't,1331065685460602881,Dusty60761735,,0,57,,False,False,24,,,0,0,0.0,0.0,neutral
2021-03-12 01:44:42,1370188973205774336,"SharylAttkisson: 2-Contrary to President Biden's advice, FDA advises you should not get Covid vaccine if you're allergic to any ingredi…",480741630,skis416,🍎which is sadly rotting,2583,101399,,True,False,208996,,,141,0,0.0,0.0,neutral
2021-03-12 01:44:42,1370188972580876296,"Tubaman2020 spanko615 MarkCaeruleus Kakes_48 I’m a covid survivor as well. I think my state will have people 50 years and over with a pre-existing condition candidates for the vaccine now. I think high blood pressure may qualify me as well as age. However, those older than me and front line need this first.",35063661,MisadventureImg,"Detroit, MI US & International",122,1607,,True,False,2380,,,0,2,0.4022222222222222,0.1922222222222222,positive
2021-03-12 01:44:42,1370188972341784576,"weaponizedword1: “Denmark and Norway Suspend AstraZeneca Covid-19 Vaccine Over Blood Clot Worries”

",451739442,GusReyesMusic,Mexico City,1839,9981,,False,False,8960,,,13,0,0.0,0.0,neutral
2021-03-12 01:44:42,1370188971922223104,bhrenton: President Biden has implemented the next phase of a comprehensive strategy to make all adults eligible for the vaccine by May…,785336533880442880,Jinia_PTr,"Oregon, USA",679,165372,,False,False,93649,,,10,0,0.0,0.0,neutral
2021-03-12 01:44:42,1370188971511316482,"lizziekastor: My flamelesss candle. A symbolic gesture can’t repair the hearts of those who’ve lost someone to Covid, or get vaccine in…",538697215,hollye_h,,1635,253490,,False,False,149757,,,2,0,0.0,0.0,neutral
2021-03-12 01:44:41,1370188969757995012,"kayleighmcenany: FINALLY the Biden admin recognizes the Trump admin’s unprecedented vaccine work:

➡️ “We’re grateful for the work that…",3137222356,Jmurphy_01,"Massachusetts, In the USA",934,29178,,False,False,20206,,,4119,0,0.95,0.3,positive
2021-03-12 01:44:41,1370188968810139648,SenGaryPeters: I’m pleased President Biden is continuing to mobilize the needed federal resources to combat COVID. I’m proud to partner…,1345755436822261760,PRising63,Planet Earth. ,530,5967,,False,False,9386,,,50,0,1.0,0.65,positive
2021-03-12 01:44:41,1370188968520781824,3 More EU Countries Hit Pause on AstraZeneca After Reports of Illness and Deaths • Children's Health Defense ,220931485,pspcfl,"Ottawa, Ontario",40,2768,,False,False,1134,,,0,0,0.5,0.5,positive
2021-03-12 01:44:41,1370188966436175876,PETITION: No to government and corporate penalties for refusing COVID-19 vaccine ,245750555,mutalabala,Canada,8881,82257,,True,False,372367,,,0,0,0.0,0.0,neutral
2021-03-12 01:44:41,1370188965974839303,Complex: Biden will announce his COVID-19 response plan which includes an order to make all US adults eligible to get vaccinated by May…,1334425488,Jondel99,,101,7212,,False,False,15795,,,11,0,0.4,-0.3,negative
2021-03-12 01:44:40,1370188965567819776,"globalnews: At least nine European countries have suspended use of the AstraZeneca vaccine after reports of blood clots.
",1334578597382656001,DocHoll80688740,,55,1644,,False,False,1264,,,23,0,0.2,-0.15,negative
2021-03-12 01:44:39,1370188961386266631,real_defender: Joe Biden taking credit for the Covid vaccine is the biggest lie I have ever seen.,823399089618518016,BigBear54321,,83,8426,,False,False,4162,,,90,0,0.0,0.0,neutral
2021-03-12 01:44:39,1370188959721127940,"Public_Citizen: 9 out of 10 people in poor countries won't have access to a COVID vaccine next year. 

Meanwhile, rich countries have h…",1364037016057430019,KurtisPoynter,,2,36,,False,False,13,,,234,0,0.45,-0.00833333333333334,negative
2021-03-12 01:44:39,1370188959406555138,AlKapDC: A reminder that YouTube made money off of and allowed hundreds of thousands of views for the false coronavirus vaccine microch…,17243703,maraleia,Chicago,1801,60659,,False,False,157299,,,9,0,0.6,-0.4000000000000001,negative
2021-03-12 01:44:39,1370188958286684161,kimlockhartga I bought myself a Dolly Parton t-shirt because I got the Moderna.,1204886906842034176,dorothypasquino,southern usa,699,5923,,False,False,1044,,,0,4,0.0,0.0,neutral
2021-03-12 01:44:38,1370188955602329600,i am minutes from getting the covid vaccine ama ,557326693,_cortina_,,380,22354,,True,False,6652,,,0,4,0.0,0.0,neutral
2021-03-12 01:44:37,1370188953031151617,Sam64754068: POTUS Total number of COVID patients I had to send to the ICU to get put on a ventilator today:0. We are turning a corner…,734735805902508032,RichFid2,United States,3262,191185,,False,False,159316,,,3,0,0.75,0.0,neutral
2021-03-12 01:44:37,1370188952548827138,danieteebee: It’s completely predictably American that the brand of COVID vaccine you have access to has now become a class signifier,2305945916,MementoStormy,No Time,707,35051,,True,False,19654,,,9956,0,0.0,0.0,neutral
2021-03-12 01:44:37,1370188952074907649,sallyKP: 3 More EU Countries Hit Pause on AstraZeneca After Reports of Illness and Deaths ,1066487650062934017,1_American_Gal,,2155,232,,False,False,1120,,,16,0,0.75,0.5,positive
2021-03-12 01:44:37,1370188951802187776,"NHKWORLD_News: Denmark, Norway suspend AstraZeneca vaccine shots ",55453509,bobo_bo,Hong Kong,31,6587,,False,False,6053,,,32,0,0.0,0.0,neutral
2021-03-12 01:44:37,1370188951474958336,EricMMatheny: Are we going to talk about the healthy 39 year old woman from Utah who got her second dose of the Moderna vaccine and the…,562480977,ToyaDee78,,530,52920,,True,False,50551,,,2619,0,0.2333333333333333,0.2,positive
2021-03-12 01:44:37,1370188950925504514,"9 countries suspend AstraZeneca CovidVaccine 

",1344219879428206592,arkmedic,WW,722,6139,,False,False,4570,,,4,3,0.0,0.0,neutral
2021-03-12 01:44:37,1370188949675769859,"SharylAttkisson: 2-Contrary to President Biden's advice, FDA advises you should not get Covid vaccine if you're allergic to any ingredi…",46275679,dfhall07,Pennsylvania,2006,36522,,False,False,120024,,,141,0,0.0,0.0,neutral
2021-03-12 01:44:37,1370188949159874564,LadieeAsh I see. I’ve heard the effects of that shot can intense. I assume it was your 1st shot. I got the Pfizer one last week. I was fatigued but otherwise okay,228491865,Jokesfordays, New York ™,631,5292,,False,False,60027,,,0,0,0.5222222222222223,0.2333333333333333,positive
2021-03-12 01:44:36,1370188948748767233,"RNCResearch Also, remember that Pfizer, the first vaccine, was NOT part of operation warp speed.",584086591,1bigwidesky,"DuPage County, IL",5434,47746,,False,False,31697,,,4,14,0.3333333333333333,0.25,positive
2021-03-12 01:44:36,1370188948207661056,"Impeach_Cheeto: boston7905 britdawgs Just to be clear, it is impossible to get COVID from the vaccine. Not just ""unlikely,"" it's impo…",827557099034996736,VinnieMDiaz1,"Mesa, AZ",2534,289680,,False,False,167819,,,1,0,0.6277777777777778,-0.3555555555555556,negative
2021-03-12 01:44:35,1370188944818675713,fmtoday: Liability risks emerge as an obstacle in Europe's Covid-19 vaccine negotiations. FMTNews US ,44399149,RameshRaoAKS,Malaysia,15260,3540,,True,False,416905,,,1,0,0.0,0.0,neutral
2021-03-12 01:44:34,1370188940473376769,"POTUS: One in four adults in the U.S. has received their first COVID-19 vaccine — and we’re now leading the world in vaccinations.

Tha…",2856054824,classicniko1,Covina,85,66443,,True,False,23349,,,15190,0,0.3333333333333333,0.25,positive
2021-03-12 01:44:34,1370188939198337029,"dialogician: AmyKremer If it weren’t for President Donald J Trump, 520,000 American wouldn’t be dead of COVID-19.

There are vaccines…",739564901820190720,AuntJackieB,"Willingboro, NJ",53,33092,,False,False,11396,,,9,0,0.2,-0.1,negative
2021-03-12 01:44:34,1370188937256386565,"CityCynthia: Yes, I will try and ask the Health Minister about that today.   Denmark, Norway and Italy have temporarily halted the use…",17096517,ironsideir,"Toronto, Canada",647,26604,,False,False,10570,,,62,0,0.0,0.0,neutral
2021-03-12 01:44:34,1370188937248051203,danieteebee: It’s completely predictably American that the brand of COVID vaccine you have access to has now become a class signifier,3325318093,kearitaaa_szn,,131,60740,,False,False,15766,,,9956,0,0.0,0.0,neutral
2021-03-12 01:44:34,1370188936698601474,"leadfreeH2OinDC: zdzichudyrma CNBCJulianna March 10, 2021:

""They did a blood test and immediately came back and said she was very, v…",1122955143765479433,MynameisAmy7,"Texas, USA",605,107280,,False,False,94538,,,3,0,0.15,0.1,positive
2021-03-12 01:44:33,1370188936316919809,jon_sparkes: Good news MattHancock recognises the need to prioritise people experiencing homelessness for the covid vaccination along…,2559606085,cherosebert,,1930,3661,,False,False,14648,,,4,0,0.6000000000000001,0.7,positive
2021-03-12 01:44:33,1370188936308396035,"JerasIkehorn: RE: TRUMP CLAIMING CREDIT FOR THE VACCINES 
Pfizer, the first vaccine approved, was not a part of Operation Warp Speed.…",1162422624,mwbsf,,111,4686,,False,False,1395,,,278,0,0.3333333333333333,0.25,positive
2021-03-12 01:44:33,1370188935536599042,"POTUS: One in four adults in the U.S. has received their first COVID-19 vaccine — and we’re now leading the world in vaccinations.

Tha…",1356769110307205123,ManuelBaldivia_,"Norwalk, CA",1,4,,False,False,4,,,15190,0,0.3333333333333333,0.25,positive
2021-03-12 01:44:33,1370188932764291073,"POTUS: One in four adults in the U.S. has received their first COVID-19 vaccine — and we’re now leading the world in vaccinations.

Tha…",4822541633,carleighann1220,,31,15778,,False,False,4978,,,15190,0,0.3333333333333333,0.25,positive
2021-03-12 01:44:33,1370188932621680642,SharylAttkisson: 3-The vaccine is *not* approved for current emergency use for anyone under 16 or 18 (depending on the brand). Therefor…,18206185,xformed,,10610,665664,,False,False,433133,,,176,0,0.4,0.0,neutral
2021-03-12 01:44:33,1370188932474896385,"timdragga: My wife got her first shot, but it’s the Moderna one so does she have to switch to Verizon now or can she keep her current d…",4221188074,Naushe_asim,"Sugar Land, TX",125,52774,,True,False,9380,,,16,0,0.3666666666666667,0.125,positive
2021-03-12 01:44:32,1370188929962442754,Trending on Google:  AstraZeneca vaccine ,1058809553721147399,BirdOwl,,225,109,,False,False,57487,,,0,0,0.0,0.0,neutral
2021-03-12 01:44:31,1370188927546494979,"ChildrensHD: NEW RobertKennedyJr: In Oct 2019, shortly before the COVID outbreak, Gates + other powerful individuals began planning ho…",391035886,SkyesNutHeaven,,206,26116,,True,False,17773,,,276,0,0.5323863636363636,0.07784090909090909,positive
2021-03-12 01:44:31,1370188927370338305,"CNNPolitics: “All adult Americans will be eligible to get a vaccine no later than May 1,"" President Biden announces. ""That doesn't mean…",1331522171877818369,Alice90788117,,50,8,,False,False,647,,,142,0,0.15,0.05,positive
2021-03-12 01:44:31,1370188925600415745,"“While it was different for everyone, we all lost something."" ",34355300,KIMTNews3,North Iowa/southern Minnesota,7238,382,,True,False,42548,,,0,0,0.6,0.0,neutral
2021-03-12 01:44:31,1370188925097156610,"DrGorfinkel: COVID19  UPDATE: What ISRAEL has learned about Pfizer's vaccine:

* 94% effective in reducing ASYMPTOMATIC infections, wh…",1161819426,dontbeCON_d,,132,30015,,False,False,11335,,,6,0,0.8,0.6,positive
2021-03-12 01:44:30,1370188922727374850,"Trump Administration purchases additional 100 million doses of COVID-19 investigational vaccine from Pfizer
JoeBiden POTUS PressSec didn't do a thing to get the Covid Vaccines... President Trump did. 

",2582736318,Tamaralynn212,United States,8335,112786,,True,False,229948,,,1,1,0.0,0.0,neutral
2021-03-12 01:44:30,1370188920026202118,sphinxchat DanScavino This article is confirmed by pfizer..,1332456313327116290,NickDone8,,318,43060,,True,False,20523,,,0,0,1.0,0.4,positive
2021-03-12 01:44:29,1370188917807456256,MichelleRempel: I just asked NACI if they would have recommended the off label usage of the Pfizer vaccine (four month dosing interval…,186980225,852852hk,somewhere,580,327,,True,False,56182,,,302,0,0.0,0.0,neutral
2021-03-12 01:44:29,1370188917480230917,"AndrewKerrNC: This dude was saying in March 2020 that there ""might never be"" a COVID vaccine.

Now he says that people who brag about p…",823177338275983361,kimluxhoj,"Freehold, NJ",904,69165,,False,False,48698,,,36,0,0.0,0.0,neutral
2021-03-12 01:44:29,1370188916171497474,"NaphiSoc: virginiahughes SharonLNYT cut me some slack. Things were pretty FUBARed under Trump 

and Trump passed up chance to buy 100…",3227278405,worldflood1,Somewhere in N Cali ,11723,233301,,False,False,212782,,,4,0,1.0,0.25,positive
2021-03-12 01:44:28,1370188915458461696,"Is this what is really wrong with sick Hunt? Vaccinated Sunday in hospital Tuesday.
auspol

",1120826803675783169,Nowun6,In the West of Australia,853,16648,,False,False,9709,,,0,0,0.8785714285714286,-0.6071428571428572,negative
2021-03-12 01:44:28,1370188914577846273,"Joe Biden is putting the pressure on. My clothes don’t fit after a year battling COVID-19 and staying home. I better get my pulmonary rehab self in gear, so that after this vaccine kicks in, I can be seen in public. A very good problem to have. 😊❤️

hope pandemicanniversary",51259550,TeeTweetsHere,,5574,685734,,False,False,510909,,,0,0,0.4366666666666667,0.4525,positive
2021-03-12 01:44:28,1370188913411641345,"murray_nyc POTUS Yo murray, who do you think got us the vaccine that creepy joe is taking credit for?  Did you forget that Biden did not want us to close our borders last year and is now opening southern border to people with Covid...  You're not the sharpest knife in the drawer.",703415056021585920,thebookofjohn31,,2,17,,False,False,257,,,0,3,0.3555555555555556,-0.16666666666666666,negative
2021-03-12 01:44:28,1370188912665063424,"IndiaCongo: Pakistan🇵🇰, the only SAARC country to not seek COVID-19 Vaccine from India, is getting 45 million 🇮🇳 made vaccine Covishiel…",2253119640,shajorjita,"Earth, Sol, MilkyWay, Universe",230,28884,,False,False,55116,,,1346,0,1.0,0.0,neutral
2021-03-12 01:44:28,1370188912338079754,"Thrombosis Canada issued a statement regarding the Astra Zeneca concerns.

TL:DR: ""Thrombosis Canada guidance is that current evidence does not support a direct link between the vaccine and development of blood clots""

",996816997760602112,ceepcanada,Canada,82,15,,False,False,1183,,,1,1,0.4,0.05,positive
2021-03-12 01:44:27,1370188911125831683,"tegangeorge: For those concerned about the AstraZeneca vaccine amid blood clot reports, my colleague ChloeBouras reached out to the Au…",68128023,AmyRemeikis,amy.remeikis@theguardian.com,39017,51973,,True,True,52349,,,9,0,0.0,0.0,neutral
2021-03-12 01:44:27,1370188907355148292,"TheAtulMishra: Sweden,a largely inconsequential country wished to bounce back to significance with its AstraZeneca vaccines that it pro…",1348462463302336514,69WildFire69,"Snoot Farms, Scranton, PA",38,11447,,False,False,4726,,,310,0,0.21428571428571427,0.10714285714285714,positive
2021-03-12 01:44:26,1370188905815941121,real_defender: Joe Biden taking credit for the Covid vaccine is the biggest lie I have ever seen.,110518977,Berna_BM,,5627,16552,,False,False,214367,,,90,0,0.0,0.0,neutral
2021-03-12 01:44:26,1370188905048252418,ABC7: LIVE Biden: “I promise I will do everything in my power. I will not relent until we beat this virus” ,530860273,__donp__,,293,9670,,True,False,82622,,,5,0,0.5,0.13636363636363635,positive
2021-03-12 01:44:26,1370188904599535624,"POTUS: One in four adults in the U.S. has received their first COVID-19 vaccine — and we’re now leading the world in vaccinations.

Tha…",63997977,cyberslate,NYC,3348,75792,,False,False,32258,,,15190,0,0.3333333333333333,0.25,positive
2021-03-12 01:44:26,1370188903907536908,"RiegerReport washingtonpost Quantum CRISPR tattoo that cuts your DNA put a sequence of another number in your DNA the Moderna C11H8N2O3S2 mRNA vaccine from Moderna is highly efficient. An identification mark (Corren cryptocurrency) She needs an enzyme called ""Luciferase"" Luciferin for screening.",1367236009159778315,JooPaul23,"São Paulo, Brasil",2,1,,False,False,32,,,0,1,0.5399999999999999,0.16,positive
2021-03-12 01:44:25,1370188900090540033,"Received vaccines as an infant, to start school, boosters during school, vaccines to go on a mission, and once a month on my mission... a flu shot now every year. It’s what we do to stay safe. Please just get your COVID vaccine. 👊❤️💉",107794125,ClintonPMorris,"Layton, Utah",649,24739,,True,False,18468,,,1,18,0.5,0.5,positive
2021-03-12 01:44:24,1370188898526199816,AnneJohnson12 Nothing I guess  if folks were not dying or being injured from this. Several countries now banning some vaccines due to death and injury. I’m not willing to risk the vaccine when I think my chances are greater of Covid survival.,354127754,Lomasi62,,506,9848,,False,False,3537,,,0,0,0.40625,0.0625,positive
2021-03-12 01:44:24,1370188897993560066,mariamainmo: Girls don't want boys. They want the covid vaccine and a nice apartment,201404881,katedunn__,"Lake Charles, LA",444,2396,,True,False,2815,,,24413,0,1.0,0.6,positive
2021-03-12 01:44:24,1370188897238519810,UncleTummyTX: mckaycoppins Only his cult followers that still send him cash don't know that the first Pfizer vaccine was created in Ge…,634223663,BelangerSusan,"Lakeshore, Ontario",329,164862,,True,False,113357,,,28,0,0.6666666666666666,0.125,positive
2021-03-12 01:44:24,1370188897041272836,"Covid-19 Vaccine Tracker Updates: 2021-03-12

▓▓▓▓▓▓▓▓▓▓ 100.00% +1.10 Israel
░░░░░░░░░░ 9.93% +0.32 Italy
░░░░░░░░░░ 0.12% +0.03 Japan
▓▓▓░░░░░░░ 33.16% +4.16 Jersey
░░░░░░░░░░ 1.47% +0.69 Jordan",1357684898807517184,vaccinneprogres,,94,11,,False,False,582,,,2,1,0.0,0.0,neutral
2021-03-12 01:44:24,1370188896982724618,"KizzyPhD: Off to the races with mRNA-1273.351 
""Moderna Announces First Participants Dosed in Study Evaluating COVID-19 Booster Vaccine…",1964261953,LaSwitala,"El Paso, TX",32,4902,,True,False,2104,,,86,0,0.3333333333333333,0.25,positive
2021-03-12 01:44:24,1370188896978542594,"kathrynw5 The same people who think Covid is not dangerous, think the vaccine against Covid is dangerous. I've seen this play out with some anecdotal examples. It's crazy. They went from downplaying the danger of Covid to overselling the danger of vaccines without missing a beat.",1349785606356922368,CBoTheEggman,,77,8397,,False,False,6151,,,0,1,0.575,-0.22,negative
2021-03-12 01:44:24,1370188896814956546,"Forbes: Novavax, a biotech company based in Maryland, announced today that its two-dose vaccine was 96% effective against the original…",72590123,pdr212004,,72,7543,,False,False,44604,,,32,0,0.8,0.6,positive
2021-03-12 01:44:24,1370188896575893506,OMGno2trump: So far the evidence strongly suggests that the vaccines are proving very effective against COVID and known mutations.  So…,171954269,sabulosaa,,5417,226839,,True,False,439604,,,16,0,0.9111111111111112,0.4377777777777778,positive
2021-03-12 01:44:24,1370188895338459139,"OD_ant: If you die from Covid, but had a comorbidity...you MOST definitely died from Covid.

BUT- if you die from a VACCINE and have a…",1249136548651520001,Knuckles131,"Joseph, OR",309,21425,,False,False,4589,,,131,0,0.5,0.25,positive
2021-03-12 01:44:24,1370188894931664899,"SkyNews: COVID-19: All American adults will be eligible for a vaccine by 1 May, Biden says in first primetime address ",1286743922,jerryrockman,"Houston, TX /Monterrey MX ",3314,85373,,False,False,22995,,,11,0,0.16666666666666666,0.125,positive
2021-03-12 01:44:23,1370188894520680449,"BostonGlobe: In address to the nation, President Biden sets vaccine distribution goal that would allow for Americans to gather in small…",37014391,facebookretiree,"New York, USA",2143,63870,,False,False,127714,,,9,0,0.0,0.0,neutral
2021-03-12 01:44:23,1370188892368859138,HighWireTalk: The Italian Medicines Agency (AIFA) Thursday banned nationwide the use of a batch of the AstraZeneca COVID-19 vaccine due…,877274869926305795,BeaupreDarlene,Canada,31,3369,,False,False,787,,,218,0,0.0,0.0,neutral
2021-03-12 01:44:23,1370188891769081856,"normsworld: Why not vaccinate teachers across the province with the AstraZeneca vaccine like Guelph is? Guelph teachers, adults over 60…",1357341014910898178,NolaMarion14,,3,425,,False,False,759,,,122,0,0.0,0.0,neutral
2021-03-12 01:44:23,1370188891588866049,"SkyNews: COVID-19: All American adults will be eligible for a vaccine by 1 May, Biden says in first primetime address ",1361556412015517698,ghose_charles,New York ,2,42,,False,False,519,,,11,0,0.16666666666666666,0.125,positive
2021-03-12 01:44:23,1370188890796089344,"TB_Times: Forget Gucci. This season, the runways are all about Moderna, Pfizer and Johnson &amp; Johnson.
",103076909,jimdjr1522,"Florida, USA",4000,44334,,False,False,179686,,,1,0,0.0,0.0,neutral
2021-03-12 01:44:22,1370188886815694850,"BarackObama: Michelle and I got vaccinated against COVID-19 because we know it’s the best way to beat this pandemic, protect one anothe…",1102232108259516416,Andi75131399,,54,65475,,False,False,27446,,,8779,0,0.3,1.0,positive
