created,id_str,text,user_id,screen_name,location,followers_count,user_favourites_count,time_zone,geo_enabled,verified,status_count,geo,coords,retweet_count,tweet_favourite_count,Subjectivity,Polarity,Sentiment
2021-03-12 01:46:09,1370189337900486664,ri_designs POTUS I’m in Texas. Are you a 1B? It was easy to sign up in 2 counties &amp; at doc group. Got first Pfizer vaccine as 1B yesterday. County is working w/ Curative. Very organized &amp; efficient. You should sign up now. Example in my county: ,563420171,LymeBdarned,,282,14790,,False,False,4846,,,0,1,0.4888888888888889,0.29444444444444445,positive
2021-03-12 01:46:09,1370189337674067968,JuddLegum: JohnKavanagh_AZ ATT Allstate BCBSAssociation CoxComm WeAreFarmers pfizer UnitedHealthGrp USAA Prudential WellsFar…,23242017,gsllegn,,1563,636442,,True,False,209046,,,316,0,0.0,0.0,neutral
2021-03-12 01:46:08,1370189333735436289,"CBSNews: BREAKING: President Biden announces he is directing all states, tribes and territories to make all U.S. adults 18 and older el…",846862187431788544,SallythePitBull,"Los Angeles, CA",101,58643,,True,False,61078,,,232,0,0.3333333333333333,0.16666666666666666,positive
2021-03-12 01:46:08,1370189332556972041,"naomirwolf: Ok: Switzerland, Italy, Austria, Latvia, Lithuania, Estonia, Luxembourg, Iceland, South Africa, Norway, Denmark have all su…",1052989577898680321,HalfPintGB,Essex UK,525,26451,,False,False,8962,,,720,0,0.5,0.5,positive
2021-03-12 01:46:08,1370189331898331137,ArmagidTimes ChayseFreedom AlexBerenson AstraZeneca there are no safety signals to date other than a slight increased risk of anaphylaxis. ALL reactions to vaccines known occur within 2 months of vaccination....There is no reason to think these are any different.,26307708,mcfunny,"Hope, On the Horizon",1812,71379,,False,False,93171,,,0,0,0.3805555555555555,-0.0972222222222222,negative
2021-03-12 01:46:07,1370189328434016262,"Noahpinion: America has created yet another super-effective COVID vaccine!!! 

🇺🇸🇺🇸🇺🇸 ",1263101813546311681,John47137220,Somewhere in ruskie land ,35,43004,,False,False,19633,,,58,0,0.0,0.0,neutral
2021-03-12 01:46:07,1370189328060542978,"EricBoehlert: i found the dumbest sentence of the week: 

&lt;Despite calls for national unity and bipartisanship, President Joe Biden and…",1245858003326078978,MissyDemeanor29,"Twentynine Palms, CA",567,70256,,False,False,32922,,,415,0,0.0,0.0,neutral
2021-03-12 01:46:07,1370189327427379201,"POTUS: One in four adults in the U.S. has received their first COVID-19 vaccine — and we’re now leading the world in vaccinations.

Tha…",2398405142,swooshiepush,🇺🇸🇲🇽🏳️‍🌈,685,59674,,True,False,20005,,,15189,0,0.3333333333333333,0.25,positive
2021-03-12 01:46:07,1370189327272120320,MoyoChihota: Looks like the AstraZeneca vaccine is causing many problems worldwide with many side effects.,1649132701,chifarayi,,2880,5360,,True,False,30036,,,4,0,0.5,0.5,positive
2021-03-12 01:46:07,1370189326953369603,CNBCnow: BREAKING: President Biden will direct states to make all adults eligible for the Covid-19 vaccine by May 1. The President is a…,131863936,brynbehr,"Mebane, NC",948,120940,,True,False,161686,,,327,0,0.4,0.1,positive
2021-03-12 01:46:07,1370189326915530752,real_defender: Joe Biden taking credit for the Covid vaccine is the biggest lie I have ever seen.,2561734314,jlusrey,,251,55100,,False,False,111288,,,90,0,0.0,0.0,neutral
2021-03-12 01:46:07,1370189326638845953,"3rdHourTODAY: Former presidents unite for COVID-19 vaccine PSAs: 'Roll up your sleeve and do your part'
",88180673,FoodTravelPro,"Florida,Caribbean, & Beyond",756,29887,,False,False,23560,,,5,0,0.0,0.0,neutral
2021-03-12 01:46:06,1370189326093549573,"BarackObama: Michelle and I got vaccinated against COVID-19 because we know it’s the best way to beat this pandemic, protect one anothe…",1315377881388920833,meg47185983,,6,157,,False,False,151,,,8777,0,0.3,1.0,positive
2021-03-12 01:46:06,1370189323673423872,rootsthatclutch: GegenRechts4 jaspar davidmackau Pfizer had more involvement on the vaccine development than just marketing/distribu…,2782709798,Kitty_Dunlap98,South Virginia,548,1236,,True,False,123524,,,2,0,0.5,0.5,positive
2021-03-12 01:46:05,1370189322352136194,COVID NYC Update: More contagious variants make up 51% of positive coronavirus cases in New York City - ABC7 New York originated in NYC (B1526) are both making up 51% of cases. ,117267856,Setsuoyamaguchi,日本 関東地方,102,903,,False,False,34294,,,0,0,0.4886363636363637,0.25,positive
2021-03-12 01:46:05,1370189322247356419,MichelleRempel: I just asked NACI if they would have recommended the off label usage of the Pfizer vaccine (four month dosing interval…,3222636528,CanNetDoc,,22,12084,,False,False,10925,,,302,0,0.0,0.0,neutral
2021-03-12 01:46:05,1370189321903411203,"MikeASchneider: discourse about this on here is so fucked, but medical ethicists are nearly unanimous: don’t turn down a vaccine https:…",795275,MikeASchneider,"Rochester, NY",926,95647,,True,False,65225,,,16,0,0.3472222222222223,-0.1638888888888889,negative
2021-03-12 01:46:05,1370189319881826307,21WIRE: SHARE: 'A group of scientists and doctors have issued an open letter calling on the European Medicines Agency (EMA) to answer u…,1157778825520001024,dawnpiper11,USA,382,47414,,False,False,9809,,,127,0,0.25,0.0,neutral
2021-03-12 01:46:05,1370189319722438659,"kayleighmcenany: FINALLY the Biden admin recognizes the Trump admin’s unprecedented vaccine work:

➡️ “We’re grateful for the work that…",1360057226858270727,Silverl23964445,,74,11074,,False,False,4777,,,4119,0,0.95,0.3,positive
2021-03-12 01:46:04,1370189316132069377,COVID-19 vaccine shot 1 tomorrow... I’m still not convinced... but I work in mental health and have to see clients face to face...,136790397,SoulRighter,In my skin...-,311,14276,,True,False,51427,,,0,1,0.2,-0.1,negative
2021-03-12 01:46:04,1370189314232045569,"Thank You President Trump POTUS45 
rump Administration purchases additional 100 million doses of COVID-19 investigational vaccine from Pfizer

 Operation Warp Speed did it.. not SlowDementiaJoe",2582736318,Tamaralynn212,United States,8335,112786,,True,False,229948,,,0,0,0.0,0.0,neutral
2021-03-12 01:46:04,1370189314118803456,"JuddLegum: JohnKavanagh_AZ 3. Kavanaugh, who apparently believes its his job to ensure that ""uninformed"" people do not vote is support…",23242017,gsllegn,,1563,636442,,True,False,209046,,,537,0,0.35,0.05,positive
2021-03-12 01:46:03,1370189311019130881,"PM says he's not worried about AstraZeneca vaccine despite blood clot reports

Noted: Speaks volumes Morrison &amp; his LNP mates got jabbed with the superior Pfizer vaccine, not the plagued Zeneca version!!

NEVER EVER TRUST THE CORRUPT LNP

auspol  ",333895387,AustraliaVote,Sydney Brisbane,9517,24970,,True,False,18648,,,1,1,0.95,0.25,positive
2021-03-12 01:46:03,1370189310415282182,Any vaccine im taking must be Pfizer vaccine.,72915869,iLiveDreamz,"Las Vegas, NV",877,3676,,True,False,61850,,,0,0,0.0,0.0,neutral
2021-03-12 01:46:03,1370189310134153225,jaredlholt: Kind of amazing how seamless the pivot was from “covid isn’t even a big deal” to “what if people don’t want a vaccine” was,557432619,melodyisdestiny,Nor CA,12173,551073,,False,False,321669,,,32,0,0.5,0.3250000000000001,positive
2021-03-12 01:46:02,1370189309358268418,"Hinshaw says Alberta's AstraZeneca doses have not been linked to reports of side effects in European countries, via edmontonjournal ",3306294216,DhanapalNatara1,Canada,57,108,,True,False,1021,,,0,0,0.0,0.0,neutral
2021-03-12 01:46:02,1370189308280385538,"SharylAttkisson: 2-Contrary to President Biden's advice, FDA advises you should not get Covid vaccine if you're allergic to any ingredi…",57610093,srd820,,279,55491,,False,False,83938,,,141,0,0.0,0.0,neutral
2021-03-12 01:46:01,1370189305512071168,COVID19 vaccines currently in development in the US do not use the live virus that causes COVID-19. Having symptoms like fever after you get a vaccine is normal and a sign your immune system is learning to fight the virus. More COVID-19 vaccine facts:  ,235275362,REALTalkDC,DMV Area,1229,572,,True,False,8212,,,0,0,0.5125,0.1965909090909091,positive
2021-03-12 01:46:01,1370189305306488833,"iecnweekly: “I was impressed with how well organized the pop-up vaccine clinic was,” said Delmy Spencer, MyCraftonHills  College's vic…",333516201,MyCraftonHills,"Yucaipa, CA",1291,754,,True,False,1887,,,0,0,1.0,1.0,positive
2021-03-12 01:46:01,1370189303872172033,"Wow. One year ago tonight, I was sitting in a bar in South Sudan and the WHO declared Covid-19 a global pandemic. Tomorrow, I receive my first vaccine. 365days",15533512,tmarente,South Bend / Notre Dame,1655,6399,,True,False,14139,,,0,6,0.4444444444444444,0.11666666666666665,positive
2021-03-12 01:46:01,1370189303611985923,"MeatballMom2 OhVonda 😢 that’s 😭 so very sad.
Last Monday I took my 85 year old Mom to her Doctor for her 2nd Pfizer Vaccine after months and months of being so careful with everything.",1007010466428645376,BA4Democrats,"Los Angeles, CA",3397,15308,,False,False,9449,,,1,3,0.4533333333333333,-0.13,negative
2021-03-12 01:46:01,1370189303356268546,"MichelleObama: When you can get the COVID-19 vaccine, I hope you do—Barack and I are certainly glad we did. It’s our best shot at beati…",4896399850,CheckingTheMath,,804,5681,,False,False,44057,,,7300,0,0.65,0.75,positive
2021-03-12 01:46:01,1370189303251341315,"it’s been a little more than a week since starting my sanofi trial vaccine for covid-19. 

so far I LOVE having gills but wish they hadn’t developed in my armpits 🤷‍♀️",3066065343,nicknewhouse,"New York, NY",535,10614,,True,False,3048,,,1,8,0.5,0.16874999999999998,positive
2021-03-12 01:46:01,1370189303188426753,"bhrenton: In a major step for vaccinations in rural areas, the CDC is in talks with Dollar General, which has over 16,000 locations acr…",756264,damon,Austin,6540,12618,,False,False,37676,,,86,0,0.3333333333333333,0.037500000000000006,positive
2021-03-12 01:46:00,1370189300604755972,AlmoJoNeko Does he know he had nothing to do with the Pfizer and Moderna vaccine,3045334172,TruffEvi,They/Them,464,255820,,True,False,33326,,,0,1,0.0,0.0,neutral
2021-03-12 01:46:00,1370189298117513222,"The U.S. has 4% of the world's population, 20% of all recorded COVID-19 deaths, and nearly 30% of all vaccine doses administered to date. ",800707492346925056,axios,,569860,559,,True,True,85745,,,35,94,0.4,0.1,positive
2021-03-12 01:46:00,1370189298050433025,sallyKP: 3 More EU Countries Hit Pause on AstraZeneca After Reports of Illness and Deaths ,357753264,BellHappe,United Kingdom,2787,121477,,True,False,101980,,,16,0,0.75,0.5,positive
2021-03-12 01:46:00,1370189297287098371,danieteebee: It’s completely predictably American that the brand of COVID vaccine you have access to has now become a class signifier,715239741,killyrkyoujin,"Miami, FL",152,65253,,False,False,36881,,,9955,0,0.0,0.0,neutral
2021-03-12 01:45:59,1370189293247819776,"CNBCTV18Live: From CNBC: Denmark suspends use of AstraZeneca Covid vaccine over reports of blood clots

",790381897184448512,Cheatedbuyer,India,2356,7237,,False,False,12307,,,12,0,0.0,0.0,neutral
2021-03-12 01:45:59,1370189293117972480,MPaiMD: Unfortunately... clots happen. Rate of thrombosis after AZ COVID19 vaccine seems no higher than expected in general population…,3755606662,JaneSlivchak,Thunder Bay,161,3140,,False,False,1318,,,18,0,0.6,-0.16874999999999998,negative
2021-03-12 01:45:58,1370189293004546049,"tegangeorge: For those concerned about the AstraZeneca vaccine amid blood clot reports, my colleague ChloeBouras reached out to the Au…",237612784,YaThinkN,"Sunshine Coast, Kabi Kabi land",21517,229877,,True,False,655490,,,9,0,0.0,0.0,neutral
2021-03-12 01:45:58,1370189292622860289,spinubzilla I also got Moderna today so together that counts as one (1) full vaccination js 😏😁,1303492497859960833,isolationcrone,the hubbub/the hum🔻,90,36683,,True,False,6353,,,0,0,0.55,0.35,positive
2021-03-12 01:45:58,1370189292241350663,"MichelleObama: When you can get the COVID-19 vaccine, I hope you do—Barack and I are certainly glad we did. It’s our best shot at beati…",2708910825,phoenix_estelle,"Pennsylvania, USA",317,63835,,True,False,12332,,,7300,0,0.65,0.75,positive
2021-03-12 01:45:58,1370189291356184578,"Q13FOX: Novavax vaccine has 96% efficacy against original COVID-19 strain, 55.4% against South Africa variant​ ",854410048382025728,Storm_kate_jl,,436,38399,,False,False,34506,,,4,0,0.75,0.375,positive
2021-03-12 01:45:58,1370189290492289027,DrDenaGrayson POTUS This was the number thing desire b/t American people t/defeat this invisible disease. Thanks God f/t CDC &amp; WHO plus a/t scientists who did the trails within 9 months to product a vaccine against this invisible enemy. We decree&amp;declare t/COVID-19 is destroyed NOW! I/Jesus Name!,1284589453785403393,Rose12253438,,8,575,,False,False,549,,,0,0,0.1,0.15625,positive
2021-03-12 01:45:57,1370189288046989316,ShandaTrautman pfizer Yes Shanda!!!,913895922693685248,katietowns15,"Springfield, mo",761,20978,,True,False,1178,,,0,1,0.0,0.0,neutral
2021-03-12 01:45:57,1370189286067245057,"tw // vaccines, needles 

idk. just in case 
so i got the first dose of the covid 19 vaccine and whew it knocked me down. i am so tired and i ache and im hotcold",929205610284908544,transezreal,19 . he/him . gay . 🏳️‍⚧️,239,15629,,False,False,4781,,,0,5,0.4407407407407407,-0.10185185185185186,negative
2021-03-12 01:45:57,1370189285735956483,"MDAndersonNews: “We’re hopeful that with the personalized vaccine, we’re priming the immune system to go after the residual tumor cells…",242543007,CMManly,Orlando,113,75001,,False,False,82993,,,114,0,0.0,0.0,neutral
2021-03-12 01:45:53,1370189271945068545,"CBSNews: Biden says that if all eligible adults get the COVID vaccine when it's their turn, ""there's a good chance"" Americans can have…",704342738012078080,CherylT369,"Ontario, Canada",1377,264669,,True,False,60250,,,112,0,0.6000000000000001,0.7,positive
2021-03-12 01:45:53,1370189270435135492,"KeatingCallie MollyJongFast As soon as the vaccine is fully approved, the health insurance companies will sort that stupidity out real fast. They don’t want to keep paying out for Covid care.",1013187418462318592,Shavananana,"Miami, FL",1400,208852,,False,False,20769,,,0,0,0.95,-0.14999999999999994,negative
2021-03-12 01:45:53,1370189268321251330,nubianlocz pfizer! shot was practically painless too,3179468279,finegodmother,,2403,33200,,True,False,22967,,,0,0,0.0,0.0,neutral
2021-03-12 01:45:53,1370189268019216384,thenewsoncnbc: 1 out of every 10 Americans is fully vaccinated. In total 98 million doses have been administered nationwide. CNBC's me…,47678782,megtirrell,New York,87929,7633,,False,True,19636,,,11,0,0.75,0.0,neutral
2021-03-12 01:45:52,1370189266962182150,ABC7: LIVE Biden: “All adult Americans will be eligible to get a vaccine no later than May 1. That’s much earlier than expected.” http…,1441976438,JohnBasulto,"California, USA",274,60841,,False,False,28920,,,15,0,0.34,0.027272727272727268,positive
2021-03-12 01:45:52,1370189266341486593,danieteebee: It’s completely predictably American that the brand of COVID vaccine you have access to has now become a class signifier,1343757683673997312,Blueber37959667,,4,4204,,False,False,186,,,9955,0,0.0,0.0,neutral
2021-03-12 01:45:52,1370189264969945095,"KarandikarJ Uh ... no. The odds of COVID killing me are so small, they're not worth considering. Meanwhile, the odds of a serious side effect from the vaccine is 2-3%.  This is one of those serious side effects:

",41075254,TomDNaughton,,8778,1661,,False,False,5798,,,1,1,0.4583333333333333,-0.26666666666666666,negative
2021-03-12 01:45:51,1370189262755401729,newsmax: Trump hopes everyone remembers him when they get their vaccine  ,1365009303040634881,ronivezina,"Coral Springs, FL",6,101,,False,False,6,,,370,0,0.0,0.0,neutral
2021-03-12 01:45:51,1370189262562324488,disclosetv: JUST IN - Norway and Denmark suspend Oxford-AstraZeneca COVID19 vaccine rollout.,38926453,Right2Liberty,Northern Colorado,7842,86992,,False,False,67056,,,2512,0,0.0,0.0,neutral
2021-03-12 01:45:51,1370189260259790850,a health care worker in Utah died from the covid vaccine 🤔,444194217,__Alinda,New York City,140,5387,,True,False,27137,,,0,1,0.0,0.0,neutral
2021-03-12 01:45:51,1370189260184117248,Got my second COVID vaccine shot today 💪🏻,959914184,SiouxsieSox,caffeine alley,318,27821,,False,False,147306,,,0,12,0.0,0.0,neutral
2021-03-12 01:45:51,1370189259710328835,"kayleighmcenany: FINALLY the Biden admin recognizes the Trump admin’s unprecedented vaccine work:

➡️ “We’re grateful for the work that…",996471243116335105,UsmcDallas,"Texas, USA",115,5510,,False,False,6944,,,4119,0,0.95,0.3,positive
2021-03-12 01:45:50,1370189259341246465,"Reuters: Health authorities in Denmark, Norway and Iceland have suspended usage of the COVID-19 vaccine produced by AstraZeneca after r…",1210383974,foodnpolitics,"VA, DC, NC | USA ",2090,44781,,False,False,76363,,,265,0,0.0,0.0,neutral
2021-03-12 01:45:50,1370189259110412288,"kary_cee: SParnis There is another view though.
I think many of us want the vaccine, but we've heard different things about the strate…",257028825,Pammieoz, Runnymede VIC 3559,3456,243160,,True,False,288652,,,2,0,0.55,0.25,positive
2021-03-12 01:45:50,1370189258741444612,"Forbes: Novavax, a biotech company based in Maryland, announced today that its two-dose vaccine was 96% effective against the original…",362074693,DC_ASSEMBLERS,Washington DC area - MD - VA,85793,256367,,True,False,69238,,,32,0,0.8,0.6,positive
2021-03-12 01:45:50,1370189258607108099,nytimes: Breaking News: Fully vaccinated people can have small gatherings indoors with other vaccinated people but should continue to w…,20695280,marvswife,,20149,144101,,True,False,264518,,,7111,0,0.3875,-0.1875,negative
2021-03-12 01:45:50,1370189258338803717,"ABCPolitics: Despite calls for national unity and bipartisanship, President Joe Biden and his top aides have declined to give the Trump…",2923177251,Jerry_Noloc,"Florida, USA",598,108889,,True,False,47054,,,782,0,0.5,0.5,positive
2021-03-12 01:45:50,1370189258020036614,"Heya, WritingCommunity: Have you gotten your COVID vaccination yet? I was finally able to schedule my first Pfizer jab for March 17. Yay.",1026209888664539137,Prof_Mullen,,2420,2145,,False,False,818,,,0,1,0.4791666666666666,0.375,positive
2021-03-12 01:45:50,1370189257642545153,Russia's Sputnik V Covid vaccine gaining acceptance in Europe | Coronavirus | The Guardian ,151955847,grapastor,,240,9241,,True,False,14641,,,0,0,0.0,0.0,neutral
2021-03-12 01:45:50,1370189256317091844,"JerasIkehorn: RE: TRUMP CLAIMING CREDIT FOR THE VACCINES 
Pfizer, the first vaccine approved, was not a part of Operation Warp Speed.…",2679944780,SkeptiCatz,Florida ,8166,96697,,False,False,114723,,,278,0,0.3333333333333333,0.25,positive
2021-03-12 01:45:49,1370189252164739078,Twitter trends of the day.  Tony Hawk Pfizer Rita Kentucky Kanon ,1098297127300550657,FischerJordanNY,"New York, USA",1472,297,,False,False,1263,,,0,0,0.0,0.0,neutral
2021-03-12 01:45:49,1370189251523010564,"Johnson&amp;Johnson single dose COVID-19 vaccine authorised in EU
Source: Euronews
",1213780071212707840,TheTop10News2,,151,0,,False,False,308040,,,0,0,0.21428571428571427,-0.07142857142857142,negative
2021-03-12 01:45:49,1370189251250434050,wkyc: BREAKING: President Biden to direct states to make vaccine available to all adults by May 1 ,3011364221,CeeBass009,"Cleveland, OH",446,3658,,True,False,7949,,,7,0,0.4,0.25,positive
2021-03-12 01:45:48,1370189247949414401,"BarackObama: Michelle and I got vaccinated against COVID-19 because we know it’s the best way to beat this pandemic, protect one anothe…",185406354,Abraham_K_,Wakanda: The Jabari Tribe,131,7049,,True,False,9488,,,8778,0,0.3,1.0,positive
2021-03-12 01:45:48,1370189247785934850,"ReallyDanWeiner: ashwindeshmukh ""Since all Americans became eligible for the COVID vaccine, cases have dropped dramatically but epidem…",244234172,RUOKAnny,"London, England",4626,65236,,False,False,188979,,,33,0,0.0,0.0,neutral
2021-03-12 01:45:47,1370189246363881473,narendramodi: Happy to share that my mother has taken the first dose of the COVID-19 vaccine today. I urge everyone to help and motivat…,19386376,VHetal,India,8016,236981,,True,False,272374,,,15918,0,0.6666666666666666,0.525,positive
2021-03-12 01:45:47,1370189246347177987,COVID Vaccine Eligibility to Expand Next Week  ,476092536,BigIslandNow,Hawaii Island,5408,206,,True,False,27446,,,1,1,0.0,0.0,neutral
2021-03-12 01:45:47,1370189245990772741,"TIME: Novavax reports its COVID-19 vaccine is 96% efficacious, based on Phase 3 trial results
",1351932901995196416,Alvarson2,,55,4514,,False,False,3085,,,82,0,0.0,0.0,neutral
2021-03-12 01:45:47,1370189243839045633,Reuters: AstraZeneca further cuts target for supply to EU in first quarter to 30 million vaccines: document  htt…,1361556412015517698,ghose_charles,New York ,2,42,,False,False,519,,,39,0,0.4166666666666666,0.125,positive
2021-03-12 01:45:47,1370189243058954242,The president plans to tell Americans during his first prime-time address that the nation could be “closer to normal” but July 4. ,24569636,HuffPostLife,,409344,2157,,False,True,91685,,,0,2,0.4916666666666666,0.2,positive
2021-03-12 01:45:46,1370189242052263943,"This means not just bringing in people who may be worried, hesitant or skeptical but, importantly, reaching people who want the vaccine. When I spoke with people whose loved ones eligible for the vaccine earlier this year, their biggest concern was access. ",2894253941,ChelseaCirruzzo,"Washington, DC",10160,69752,,True,False,34008,,,1,3,0.7,0.15,positive
2021-03-12 01:45:46,1370189241918050308,700 million doses from all 3 vaccine makers to be purchased in 2021 were secured by president Trump in December 2020  ,244720550,kandibar2011,"#Wisconsin , USA",5806,21531,,True,False,48394,,,1,4,0.0,0.0,neutral
2021-03-12 01:45:46,1370189241829912577,ABSCBNNews: EU approves Johnson &amp; Johnson COVID19 vaccine ,3384189984,rdahildahil_,Pasay City,2065,68556,,True,False,20057,,,13,0,0.0,0.0,neutral
2021-03-12 01:45:46,1370189239854493700,verge: Biden: ‘all American adults will be eligible to get a vaccine no later than May 1st’  ,433798995,nicosilva14,"Siguiendo el Balón, la Pecosa",180,17555,,True,False,30907,,,31,0,0.0,0.0,neutral
2021-03-12 01:45:45,1370189237291778048,"EricBoehlert: i found the dumbest sentence of the week: 

&lt;Despite calls for national unity and bipartisanship, President Joe Biden and…",3419128989,kahuna_tuna,,37,29281,,False,False,26906,,,415,0,0.0,0.0,neutral
2021-03-12 01:45:44,1370189234217320451,"EricBoehlert: i found the dumbest sentence of the week: 

&lt;Despite calls for national unity and bipartisanship, President Joe Biden and…",1077440922500124672,mommatkl,"Missouri, USA",3033,189282,,False,False,196637,,,415,0,0.0,0.0,neutral
2021-03-12 01:45:44,1370189231151194116,"vegsource: He’s immune to Covid, but since he didn’t also get an unsafe and ineffective vaccine, he’s out of luck. 🤷‍♂️ ",955221505167642624,McClure808,,130,7909,,False,False,10582,,,14,0,0.0,0.0,neutral
2021-03-12 01:45:44,1370189230337449992,MiddleEastEye: The excess doses could vaccinate all people above the age of 16 in several countries on the International Rescue Committ…,1269459686983680002,FPPunohuReport,,1036,24790,,False,False,30191,,,6,0,0.03333333333333333,0.0,neutral
2021-03-12 01:45:43,1370189228999577600,benton_whatsup: Dr. B is building a free nationwide COVID vaccine standby list that will notify you when unclaimed doses become availa…,19207933,kccatdr,Kansas City,1063,24660,,False,False,171335,,,4,0,0.8,0.4,positive
2021-03-12 01:45:43,1370189228848648192,"Forbes: Novavax, a biotech company based in Maryland, announced today that its two-dose vaccine was 96% effective against the original…",935835078890082304,Cryptotraders7,Estados Unidos,86,1520,,False,False,1310,,,32,0,0.8,0.6,positive
2021-03-12 01:45:43,1370189228802445312,"CNBCTV18Live: From CNBC: Denmark suspends use of AstraZeneca Covid vaccine over reports of blood clots

",284686980,DevangManiar54,"Gandhidham, Gujarat",33,21,,False,False,61,,,12,0,0.0,0.0,neutral
2021-03-12 01:45:43,1370189227330306048,The U.S. Is Sitting on Tens of Millions of Vaccine Doses the World Needs ,16211073,hofrench,New York City,24789,37596,,True,False,85614,,,5,3,0.0,0.0,neutral
2021-03-12 01:45:43,1370189226730516482,Dino getting the COVID vaccine at 1:30 am today.  firstdose citifield ,22021656,taiblanche,NYC,20,0,,False,False,34,,,0,0,0.0,0.0,neutral
2021-03-12 01:45:42,1370189225035853828,"POTUS: One in four adults in the U.S. has received their first COVID-19 vaccine — and we’re now leading the world in vaccinations.

Tha…",17302067,MamaBear64,"San Francisco, CA",14567,290438,,False,False,274132,,,15189,0,0.3333333333333333,0.25,positive
2021-03-12 01:45:42,1370189223672840196,"mattgallowaycbc: The U.S. Is Sitting on Tens of Millions of Vaccine Doses the World Needs
Those tens of millions of doses from AstraZen…",402000331,hicsumus,"BC, Canada",97,5683,,False,False,19713,,,6,0,0.0,0.0,neutral
2021-03-12 01:45:42,1370189223509291011,WSJ: Battling websites for a vaccine appointment? joannastern booked slots for eligible family and friends using these tricks ,877502787059417088,NaptownBookClub,,202,15733,,False,False,9014,,,59,0,0.0,0.0,neutral
2021-03-12 01:45:42,1370189223509127169,"CNN: “All adult Americans will be eligible to get a vaccine no later than May 1,"" President Biden announces. ""...That doesn't mean ever…",871116008,EmBeesWeb,"Ventura Co, California",1031,267537,,False,False,424504,,,251,0,0.32916666666666666,-0.07083333333333333,negative
