created,id_str,text,user_id,screen_name,location,followers_count,user_favourites_count,time_zone,geo_enabled,verified,status_count,geo,coords,retweet_count,tweet_favourite_count,Subjectivity,Polarity,Sentiment
2021-03-12 01:47:49,1370189754860498948,"ChadGilmartinCA KatiePavlich BS, just ask Pfizer. JoeBiden will get the credit &amp; DESERVES the credit. TrumpVirus",45643932,TexasMum1,,25,8151,,False,False,12875,,,0,0,0.0,0.0,neutral
2021-03-12 01:47:49,1370189754608783360,"kayleighmcenany: FINALLY the Biden admin recognizes the Trump admin’s unprecedented vaccine work:

➡️ “We’re grateful for the work that…",1348297415032528896,_JohnnyKilroy23,,1,861,,False,False,479,,,4119,0,0.95,0.3,positive
2021-03-12 01:47:48,1370189752784224259,narendramodi: Happy to share that my mother has taken the first dose of the COVID-19 vaccine today. I urge everyone to help and motivat…,937243642300850176,samdubey111,"New Delhi, India",417,226110,,True,False,69313,,,15917,0,0.6666666666666666,0.525,positive
2021-03-12 01:47:48,1370189751697965059,ChadGilmartinCA Are you really breezing over the fact that Trump didn’t order enough vaccine AND didn’t distribute it properly? (Also add in that Pfizer and Moderna didn’t take $$ from OWS),18765972,jacobdcon,"NY, NY",38,2113,,False,False,46,,,0,0,0.26666666666666666,0.06666666666666668,positive
2021-03-12 01:47:48,1370189750766829573,katy_milkman: It's great news that every American will be eligible for a vaccine by May 1st. But what encouragement will every American…,512195743,ScienceSites,,328,179,,False,False,1041,,,7,0,0.375,0.4,positive
2021-03-12 01:47:48,1370189750741708800,"ReallyDanWeiner: ashwindeshmukh ""Since all Americans became eligible for the COVID vaccine, cases have dropped dramatically but epidem…",242078036,SimonLandmine,London,710,141606,,False,False,85979,,,33,0,0.0,0.0,neutral
2021-03-12 01:47:47,1370189750183849986,isajjal_amir: A new real-world study in the UK suggests that “the Pfizer/BioNTech Covid-19 vaccine provides less protection in cancer p…,949190257337085952,Defense785,Pakistan,2360,50946,,True,False,13816,,,2,0,0.2606060606060606,-0.015151515151515154,negative
2021-03-12 01:47:47,1370189750020284417,MSNBC: “The most vaccine-hesitant group and the group that says they’re the least likely to take the vaccine are people from the conser…,2822758811,JR_Highnote,Nashville Tn,2763,85043,,True,False,89401,,,50,0,0.6333333333333333,0.06666666666666668,positive
2021-03-12 01:47:47,1370189749256822784,ChinaDaily: MediaFocus Preliminary data from a study in Brazil indicates that the COVID_19 vaccine developed by China's Sinovac Biote…,4831047668,CQzom,中華人民共和國🇨🇳福建福州,132,24622,,False,False,23835,,,7,0,0.3,0.1,positive
2021-03-12 01:47:47,1370189748438851591,ADBNEWS: The Philippines today became the first recipient of financing support under ADB's $9 billion Asia Pacific Vaccine Access Facility with the approval of a $400 million loan to help the government purchase safe &amp; effective COVID-19 vaccines. More ▶  ,68911475,ADB_HQ,"Manila, Philippines",225550,3890,,True,True,52666,,,9,15,0.5333333333333333,0.4625,positive
2021-03-12 01:47:46,1370189745775648773,"USATODAY: Biden will direct states to make all adults eligible for COVID-19 vaccine by May 1 during prime-time speech, administration o…",88180673,FoodTravelPro,"Florida,Caribbean, & Beyond",756,29887,,False,False,23560,,,43,0,0.4,0.1,positive
2021-03-12 01:47:46,1370189745616265217,coach_chandler Read an article saying that Pfizer and Moderna only guarantee immunity for day 15-90 after the second shot. Does that change anything?,818188516572200960,FDHSCoachHarris,"Lexington, KY",694,2122,,False,False,1455,,,0,1,0.5,0.0,neutral
2021-03-12 01:47:46,1370189744848666626,"farhip: The first covid vaccine shot was given on Dec. 14, 2020. 

It will be an Incredible feat of manufacturing, distribution and adm…",11783502,StephenGutowski,Virginia,33511,64393,,True,True,196953,,,13,0,0.6166666666666667,0.575,positive
2021-03-12 01:47:46,1370189743783223296,The Philippines became the first recipient of financing support under the ADB_HQ Asia Pacific Vaccine Access Facility or APVAX with approval of a $400 million loan to help the country purchase safe and effective vaccines against COVID19 ,744715920,MitchMillar,,44,3666,,True,False,1769,,,0,1,0.5444444444444444,0.45,positive
2021-03-12 01:47:46,1370189743485517830,39-Year-Old Mother Dies After 2nd Dose of Moderna Vaccine: Family  via epochtimes,272752712,levis3331,https://youtu.be/_QJEZbQxCLw,136,5822,,True,False,36947,,,0,0,0.0,0.0,neutral
2021-03-12 01:47:46,1370189742327930882,"PARISDENNARD Pfizer, the first vaccine, was not a part of Operation Warp Speed. 
And Trump couldnt be bothered figuring out how to produce or distribute it well
Did Trump do nothing? No.  He did something 
Did he do it well or as much as the country needed? Not even close 
thanksjoebiden",336042658,Mr_RoyBasset,,126,1117,,False,False,2065,,,0,1,0.26666666666666666,0.225,positive
2021-03-12 01:47:45,1370189741702938627,CTVNews: Denmark suspends use of AstraZeneca vaccine as 'precautionary measure' ,110276808,willy1805,Dartmouth NS,349,11921,,True,False,43250,,,172,0,0.0,0.0,neutral
2021-03-12 01:47:45,1370189741140889600,"axios: The U.S. has 4% of the world's population, 20% of all recorded COVID-19 deaths, and nearly 30% of all vaccine doses administered…",16400248,versharma,Louisiana - Rome - NYC ,14755,48274,,False,True,78486,,,35,0,0.4,0.1,positive
2021-03-12 01:47:45,1370189741035909122,"slpng_giants: Fox News downplayed COVID while their employees quarantined.

It sowed doubt about the vaccine while Rupert Murdoch got h…",18081834,Thieudaddy,floating weightless,131,30624,,False,False,10744,,,104,0,0.0,0.0,neutral
2021-03-12 01:47:45,1370189739979010050,"POTUS: One in four adults in the U.S. has received their first COVID-19 vaccine — and we’re now leading the world in vaccinations.

Tha…",839260908249440257,msacadien,"San Francisco, CA",11208,155831,,True,False,88090,,,15189,0,0.3333333333333333,0.25,positive
2021-03-12 01:47:45,1370189739077246978,"allinwithchris: Effie, an allinwithchris viewer from Tennessee, shares an emotional response to her mother getting the Covid vaccine a…",8889522,ijefff,"Spokane, WA",1154,133148,,True,False,114789,,,59,0,0.65,0.0,neutral
2021-03-12 01:47:44,1370189736405504001,"NBCNews: BREAKING: President Biden signs $1.9T Covid relief bill into law; ​includes $1,400 checks, $300/wk jobless benefits, child all…",815522124752449536,badgerbull1,,125,13316,,True,False,3276,,,2212,0,0.0,0.0,neutral
2021-03-12 01:47:44,1370189736384552961,mariamainmo: Girls don't want boys. They want the covid vaccine and a nice apartment,631397592,melanieecross,"New York, NY",1300,22645,,True,False,104220,,,24413,0,1.0,0.6,positive
2021-03-12 01:47:44,1370189734975246345,"CNN: “All adult Americans will be eligible to get a vaccine no later than May 1,"" President Biden announces. ""...That doesn't mean ever…",177643010,nedra992001,United States,116,56595,,False,False,44714,,,251,0,0.32916666666666666,-0.07083333333333333,negative
2021-03-12 01:47:44,1370189733989470209,narendramodi: Happy to share that my mother has taken the first dose of the COVID-19 vaccine today. I urge everyone to help and motivat…,1270907812596420609,ROHITGU98125428,,11,2489,,True,False,1786,,,15917,0,0.6666666666666666,0.525,positive
2021-03-12 01:47:44,1370189733800898562,christufton: Oxford-AstraZeneca: EU regulator says 'no indication' vaccine linked to blood clots ,40321644,httpsjhey,Jamaica,5320,4649,,True,False,176791,,,136,0,0.0,0.0,neutral
2021-03-12 01:47:43,1370189730588069888,"Bill9MileParker: This is, of course, completely false. The development of the Pfizer vaccine was funded by Germany not Operation Warp S…",402320568,EllisGBS,"Massachusetts, USA",3819,31296,,True,False,101009,,,48,0,0.6,-0.4000000000000001,negative
2021-03-12 01:47:43,1370189730214727682,"Yeshua1111: 🙄😒
""Biden administration is purchasing another 100 million doses of the Johnson &amp; Johnson COVID-19 vaccine""  ",985444389630726144,Adsvel,"England, United Kingdom",3683,156105,,False,False,42796,,,1,0,0.0,0.0,neutral
2021-03-12 01:47:43,1370189729929527299,"Many European countries ban AstraZeneca vaccine
Ban follows reports of severe or fatal blood clots in vaccinated people

",3091411973,mklewis11,,164,65444,,False,False,52346,,,0,0,0.25,0.25,positive
2021-03-12 01:47:43,1370189729552031744,Moderna to explore blockchain vaccine traceability with IBM ,400328352,odairarins,,236,163,,False,False,26747,,,0,0,0.0,0.0,neutral
2021-03-12 01:47:42,1370189726876110851,"If you have had Covid-19, please ask your doctor about when to get the vaccine. Please.",823367611517927425,Shades6274,,43,7268,,False,False,2349,,,0,0,0.0,0.0,neutral
2021-03-12 01:47:42,1370189726066618372,SenGaryPeters: I’m pleased President Biden is continuing to mobilize the needed federal resources to combat COVID. I’m proud to partner…,3411586277,JiSuFerr,Michigan,15,1190,,False,False,386,,,50,0,1.0,0.65,positive
2021-03-12 01:47:42,1370189725814902785,"Pun_Starr: Billboards thanking Modiji for Covid vaccine have been put up in Canada.

Billboards thanking Modiji for cooking gas have be…",1111212777828306944,Mohamma20425959,,27,5333,,False,False,4446,,,470,0,0.0,0.0,neutral
2021-03-12 01:47:41,1370189721217994757,"Reuters: Health authorities in Denmark, Norway and Iceland have suspended usage of the COVID-19 vaccine produced by AstraZeneca after r…",824253716131966978,bootsiannakfu73,"Massachusetts, USA",1198,92942,,False,False,74216,,,265,0,0.0,0.0,neutral
2021-03-12 01:47:40,1370189719292813312,jaredlholt: Kind of amazing how seamless the pivot was from “covid isn’t even a big deal” to “what if people don’t want a vaccine” was,599383815,Richardhellion,Buttbeach,80,60037,,False,False,7703,,,32,0,0.5,0.3250000000000001,positive
2021-03-12 01:47:40,1370189719200530433,My dad had his first dose of Moderna and then was in the ER Tuesday night. They gave him a lot of fluids and let him come home. ,4911466409,TheeJazzyBee,"Chicago, IL",61,7211,,False,False,4393,,,0,0,0.3333333333333333,0.25,positive
2021-03-12 01:47:40,1370189719057756160,MichelleRempel: I just asked NACI if they would have recommended the off label usage of the Pfizer vaccine (four month dosing interval…,1163672825468579841,J9Moir,"Calgary, Alberta",160,3906,,False,False,890,,,302,0,0.0,0.0,neutral
2021-03-12 01:47:39,1370189716360896512,newsmax: Trump hopes everyone remembers him when they get their vaccine  ,2557325832,lloydtwin,,229,72668,,True,False,52993,,,370,0,0.0,0.0,neutral
2021-03-12 01:47:39,1370189712955219968,davidmoore_7 You get moderna ?,519088262,LesterDerek,"Oakwood, VA",185,729,,False,False,710,,,0,1,0.0,0.0,neutral
2021-03-12 01:47:39,1370189712556650497,"ABCPolitics: Despite calls for national unity and bipartisanship, President Joe Biden and his top aides have declined to give the Trump…",1270370191503798272,MAGAB07910508,,1768,46118,,False,False,12776,,,781,0,0.5,0.5,positive
2021-03-12 01:47:38,1370189711197753346,"Utah woman, 39, dies 4 days after 2nd dose of COVID-19 vaccine; autopsy ordered ",3078800635,MtTryon,United States,296,11403,,False,False,1882,,,0,0,0.0,0.0,neutral
2021-03-12 01:47:38,1370189711138983938,"kayleighmcenany: FINALLY the Biden admin recognizes the Trump admin’s unprecedented vaccine work:

➡️ “We’re grateful for the work that…",2605445976,theironicview,"Nevada, USA",6736,1252,,False,False,111893,,,4119,0,0.95,0.3,positive
2021-03-12 01:47:38,1370189709511696386,JNJNews: JNJ is honored to collaborate with Merck and the Biden Administration to ramp up production and manufacturing of the Johnson…,128706257,fcald77,Mexico,303,122142,,True,False,47640,,,32,0,0.0,0.0,neutral
2021-03-12 01:47:37,1370189706990870533,MSNBC: “The most vaccine-hesitant group and the group that says they’re the least likely to take the vaccine are people from the conser…,149931183,jrobincs,"College Station, Texas",369,124838,,True,False,72950,,,50,0,0.6333333333333333,0.06666666666666668,positive
2021-03-12 01:47:37,1370189704688189440,"DrSamGirgis: For what it's worth...
I've admitted 2 patients in the last week with Covid viral pneumonia AFTER they received the Covid…",1254516017839181824,realDrNedll,,290,34,,False,False,34,,,102,0,0.08333333333333334,0.15,positive
2021-03-12 01:47:36,1370189702159069188,MSNBC: “The most vaccine-hesitant group and the group that says they’re the least likely to take the vaccine are people from the conser…,15677734,mig30m6,Canada,1401,71158,,False,False,334783,,,50,0,0.6333333333333333,0.06666666666666668,positive
2021-03-12 01:47:36,1370189700527439874,"weaponizedword1: ""A Rockville man said he nearly died after getting the Pfizer vaccine""

""It left the father of two with blood platelet…",451739442,GusReyesMusic,Mexico City,1839,9981,,False,False,8960,,,12,0,0.2,0.05,positive
2021-03-12 01:47:35,1370189699453747208,TheBiggggGuy AOC He has a plan to distribute it thats the most important thing trump delayed the vaccines when he had chance to buy 100 mill more shots of moderna he turned it down,815727911881805824,devilsreject10,,0,8,,False,False,305,,,0,0,0.5722222222222222,0.31111111111111106,positive
2021-03-12 01:47:35,1370189697264332803,"katieappleseed7 I was told today that b/c I choose not to vaccinate, I (and others “like” me) will be to blame when the population has to continue to get boosters b/c they can’t reach herd immunity &amp; eradicate covid. 🤔 what exactly is the point of this vaccine if not to protect against covid?",1148699804,e_galv,,613,4418,,False,False,2604,,,0,0,0.25,0.25,positive
2021-03-12 01:47:35,1370189697058799617,AmyKremer Did I miss something because it thought it was Moderna &amp; Pfizer that did it?,91469060,harleyrose300,Rochester NY,3,12553,,False,False,3575,,,0,0,0.0,0.0,neutral
2021-03-12 01:47:35,1370189696735805441,"TBG9270584: Moderna’s Top Scientist on mRNA Technology in COVID Shots: “We are Actually Hacking the Software of Life”

",4115954561,morrowfcs,Virginia,3025,25904,,False,False,100893,,,15,0,0.3,0.25,positive
2021-03-12 01:47:35,1370189696362545163,MSNBC: “The most vaccine-hesitant group and the group that says they’re the least likely to take the vaccine are people from the conser…,307956966,FaithPennick,,1014,65749,,True,False,36399,,,50,0,0.6333333333333333,0.06666666666666668,positive
2021-03-12 01:47:34,1370189694349180930,"CNN: “All adult Americans will be eligible to get a vaccine no later than May 1,"" President Biden announces. ""...That doesn't mean ever…",771123436177326080,JGarJ_,California,137,19,,True,False,9541,,,251,0,0.32916666666666666,-0.07083333333333333,negative
2021-03-12 01:47:34,1370189693426528256,"MontyBoa99: SherylNYT SharonLNYT Pfizer neither asked for nor received any help from the US gov't.
Their vaccine was developed and is…",813425527,dolphmomrc,,74,53966,,False,False,19329,,,16,0,0.3,0.1,positive
2021-03-12 01:47:34,1370189693090983942,"RNCResearch Nope. Pfizer was developed independent of OWS. But even if OWS had been solely responsible for the swift provision of vaccines, the Trump administration still treated nearly half a million dead as collateral damage of OWS. That's nothing to be proud of.",913701152,StMattsBetsy,"Halifax, NS, Canada",119,2026,,False,False,6455,,,3,16,0.4236111111111112,0.12222222222222225,positive
2021-03-12 01:47:33,1370189690498920449,"JerasIkehorn: RE: TRUMP CLAIMING CREDIT FOR THE VACCINES 
Pfizer, the first vaccine approved, was not a part of Operation Warp Speed.…",3647538858,PieceDeReSister,,1651,224442,,False,False,110822,,,278,0,0.3333333333333333,0.25,positive
2021-03-12 01:47:33,1370189689412521986,cparrent GovMikeHuckabee Pfizer was not part of operation warped speed.,1247566862,jgsgerard,,594,72972,,True,False,15827,,,0,0,0.0,0.0,neutral
2021-03-12 01:47:32,1370189686786777091,‘AstraZeneca is safe’: Australia not concerned by reports of blood clots in Europe ,18749677,brisbanetimes,"Queensland, Australia",290278,160,,False,True,68344,,,0,0,0.5,0.5,positive
2021-03-12 01:47:32,1370189684949839873,ColinDMello: NEW: Chief Gordon Beardy of Muskrat Dam confirms to CTVNews that they asked MPP Sol Mamakwa to fly-in and get the Moderna…,1026936297238224896,fastedepicure,,265,48666,,True,False,11299,,,472,0,0.4545454545454545,0.13636363636363635,positive
2021-03-12 01:47:32,1370189683423072257,"CalebJSmith Pfizer, the first vaccine, was not a part of Operation Warp Speed. 
And Trump couldnt be bothered figuring out how to produce or distribute it well
Did Trump do nothing? No.  He did something 
Did he do it well or as much as the country needed? Not even close 
thanksjoebiden",336042658,Mr_RoyBasset,,126,1117,,False,False,2065,,,0,0,0.26666666666666666,0.225,positive
2021-03-12 01:47:31,1370189681539887104,"SharylAttkisson: 2-Contrary to President Biden's advice, FDA advises you should not get Covid vaccine if you're allergic to any ingredi…",21132359,daweave,The Underbelly of the Ozarks,1641,2469,,False,False,238296,,,141,0,0.0,0.0,neutral
2021-03-12 01:47:31,1370189680063352835,"POTUS: One in four adults in the U.S. has received their first COVID-19 vaccine — and we’re now leading the world in vaccinations.

Tha…",4519107923,MarciS94518,,1060,98802,,False,False,54570,,,15189,0,0.3333333333333333,0.25,positive
2021-03-12 01:47:30,1370189678859681797,"z0mbi3ficati0n I'm technically not registered for anything yet, but you can still register here. I'm hoping that I'll just get a notification in like a week or two to start scheduling? Otherwise come the 29th I'm definitely going to be hitting up Walgreens, Meijer, etc.

",18973276,moonybeam,MKE,67,31008,,False,False,16327,,,0,1,0.3,0.0,neutral
2021-03-12 01:47:30,1370189675650969601,singpuri:   A matter of pride!!,550741444,thevijaymahajan,"Maharashtra - Gujarat, India",5706,31865,,True,False,114535,,,15,0,0.0,0.0,neutral
2021-03-12 01:47:29,1370189674686291968,"TIME: Novavax reports its COVID-19 vaccine is 96% efficacious, based on Phase 3 trial results
",271705484,FullTime_Father,Chiang Mai,968,202480,,True,False,116896,,,82,0,0.0,0.0,neutral
2021-03-12 01:47:29,1370189672572407808,"MichelleObama: When you can get the COVID-19 vaccine, I hope you do—Barack and I are certainly glad we did. It’s our best shot at beati…",1340205361740001281,intothewild293,"Nashville, TN",20,988,,False,False,103,,,7299,0,0.65,0.75,positive
2021-03-12 01:47:29,1370189670907318274,"“The President will talk about small gatherings, like a barbecue in your backyard, in your neighborhood.” ",2976653309,IndyUSA,"New York, NY",34058,3,,False,False,78288,,,0,0,0.4,-0.25,negative
2021-03-12 01:47:28,1370189670248812549,MichelleRempel: I just asked NACI if they would have recommended the off label usage of the Pfizer vaccine (four month dosing interval…,26017982,jmask,"Ontario, Canada",769,21104,,False,False,15806,,,302,0,0.0,0.0,neutral
2021-03-12 01:47:28,1370189669988716548,"allinwithchris: Effie, an allinwithchris viewer from Tennessee, shares an emotional response to her mother getting the Covid vaccine a…",542090710,DogzHerdin,,916,221629,,False,False,41373,,,59,0,0.65,0.0,neutral
2021-03-12 01:47:28,1370189668646592512,"POTUS: One in four adults in the U.S. has received their first COVID-19 vaccine — and we’re now leading the world in vaccinations.

Tha…",1293632419988492291,GlennWi22890009,"Florida, USA",431,24545,,False,False,26867,,,15189,0,0.3333333333333333,0.25,positive
2021-03-12 01:47:28,1370189666989842445,WMCActionNews5: The way you make your vaccine appointment in Shelby County is about to change -- Here's what you can expect starting Fr…,1902747967,jdylan901,"Memphis, TN",1676,133282,,True,False,33749,,,8,0,0.1,0.0,neutral
2021-03-12 01:47:27,1370189662459994112,SharylAttkisson: 3-The vaccine is *not* approved for current emergency use for anyone under 16 or 18 (depending on the brand). Therefor…,1049397449138364417,IntelligenceIs4,,75,2495,,False,False,2419,,,176,0,0.4,0.0,neutral
2021-03-12 01:47:26,1370189661306519558,SenGaryPeters: I’m pleased President Biden is continuing to mobilize the needed federal resources to combat COVID. I’m proud to partner…,1353352236559200257,NicoleBuggs3,,200,6618,,False,False,2316,,,50,0,1.0,0.65,positive
2021-03-12 01:47:26,1370189660178251778,"abcnews: Denmark, Norway and Iceland suspend AstraZeneca COVID shots after blood clot reports ",1203811234035798017,ozzy_citizen,,193,17198,,False,False,18581,,,39,0,0.0,0.0,neutral
2021-03-12 01:47:26,1370189659251245063,Still have a low grade fever and body aches. Taking Tylenol every 4 to 6 hours. It helps a little. Resting and napping. If this is my reaction to Pfizer 1 vaxx I’d better be even more prepared for 2 in three weeks.,2497363509,ChefbarraeMy,United States ,149,12680,,False,False,7160,,,0,0,0.45,0.203125,positive
2021-03-12 01:47:26,1370189659234533376,cantpretendtoo: Wife’s Uncle got the Covid vaccine on Friday. Died this morning.  Sad.,1223010197142196224,The_PeopleofUSA,,896,23067,,False,False,21740,,,321,0,1.0,-0.5,negative
2021-03-12 01:47:24,1370189651919695876,"kayleighmcenany: FINALLY the Biden admin recognizes the Trump admin’s unprecedented vaccine work:

➡️ “We’re grateful for the work that…",1345533382227349504,charlottegnzal1,,10,698,,False,False,1239,,,4119,0,0.95,0.3,positive
2021-03-12 01:47:24,1370189650959204353,"axios: The U.S. has 4% of the world's population, 20% of all recorded COVID-19 deaths, and nearly 30% of all vaccine doses administered…",18084838,tkarow,Chicago area,1477,8380,,False,False,79062,,,35,0,0.4,0.1,positive
2021-03-12 01:47:24,1370189650497654786,"carletonjtysick: Six European countries have now halted use of Astrazeneca vaccine. We just started using it.

",1260861564,stamppeder66,Calgary Alberta,406,26255,,False,False,22344,,,209,0,0.0,0.0,neutral
2021-03-12 01:47:24,1370189649814163457,bmj_latest: Denmark has temporarily suspended use of the Oxford-AstraZeneca covid-19 vaccine as a precautionary move after reports of b…,144910265,Kasir__Rather,Wanderer. ,147,7607,,False,False,295,,,70,0,0.0,0.0,neutral
2021-03-12 01:47:23,1370189649084350468,"kayleighmcenany: FINALLY the Biden admin recognizes the Trump admin’s unprecedented vaccine work:

➡️ “We’re grateful for the work that…",3486465989,Notasocialist2,Galveston Bay Texas,51,5238,,True,False,7561,,,4119,0,0.95,0.3,positive
2021-03-12 01:47:23,1370189647834443777,danieteebee: It’s completely predictably American that the brand of COVID vaccine you have access to has now become a class signifier,1559407710,MrJermT,UCF,302,36878,,False,False,17376,,,9954,0,0.0,0.0,neutral
2021-03-12 01:47:22,1370189643057094657,"JerasIkehorn: RE: TRUMP CLAIMING CREDIT FOR THE VACCINES 
Pfizer, the first vaccine approved, was not a part of Operation Warp Speed.…",606713765,nelson_luanne,"Austin, Texas",961,204901,,False,False,39547,,,278,0,0.3333333333333333,0.25,positive
2021-03-12 01:47:22,1370189642444775430,"nycjim: Novavax Reports Its COVID-19 Vaccine is 96% Efficacious, Based on Phase 3 Trial Results ",2020351,palafo,"Śūnyatā, N.Y.",37153,31518,,True,True,9784,,,19,0,0.0,0.0,neutral
2021-03-12 01:47:22,1370189641999994881,mariamainmo: Girls don't want boys. They want the covid vaccine and a nice apartment,599339870,shafiq_saha,"Pahang,Malaysia",1389,107127,,True,False,229768,,,24413,0,1.0,0.6,positive
2021-03-12 01:47:21,1370189638724358145,"CBSNews: Biden says that if all eligible adults get the COVID vaccine when it's their turn, ""there's a good chance"" Americans can have…",360863823,nelstweet,Somewhere in the good old USA,1214,160725,,True,False,113914,,,112,0,0.6000000000000001,0.7,positive
2021-03-12 01:47:21,1370189638015533058,"Joe Biden is the man for this moment. Empathy, compassion and truth. So grateful to have survived this past year without getting Covid. Stage IV lung cancer survivor for 6 yrs. Got 1st Pfizer dose 5 days ago.",1125034591935447041,DeniseMSurvivor,"Texas, USA",1006,172341,,False,False,5650,,,0,0,0.25,-0.25,negative
2021-03-12 01:47:21,1370189637738659843,"Big Pharma knows that it's time to make Big Bucks and squeeze nations dry as the race to be the first to grab the ""high vaccination rate"" trophy is underway  COVID19 SARSCoV2 Coronavirus WuhanVirus",84780305,freetrooper,,136,629,,False,False,14753,,,0,1,0.3346666666666667,0.06866666666666668,positive
2021-03-12 01:47:21,1370189637604491267,"allinwithchris: Effie, an allinwithchris viewer from Tennessee, shares an emotional response to her mother getting the Covid vaccine a…",59242017,bjgunts,NYC,1040,142388,,False,False,99964,,,59,0,0.65,0.0,neutral
2021-03-12 01:47:20,1370189636568412162,"amitmalviya: Pishi wrote to PM asking for more Covid vaccine. But has WB used the existing lot?

Of the 22,51,800 Covishield and 4,97,7…",1110483142740246528,PluginTwter,,72,45,,True,False,43756,,,587,0,0.5,0.5,positive
2021-03-12 01:47:20,1370189635150827523,"The cashier at the corner store said he’s not a big Pfizer guy, only wants Moderna or J&amp;J. Swear to god",64085878,_primmmm,"Chicago, IL",949,36934,,True,False,26920,,,0,4,0.4000000000000001,0.06666666666666668,positive
2021-03-12 01:47:20,1370189634379030530,"Venti__Poet And how happy are we that he is. I'm wiped out on the couch, my arm a little sore from my first Pfizer vaccine, and thinking ""Thank God he won""! ",32134865,lonebrat,"Seattle, WA",7889,23236,,True,False,12547,,,0,2,0.6111111111111109,0.3083333333333333,positive
