created,id_str,text,user_id,screen_name,location,followers_count,user_favourites_count,time_zone,geo_enabled,verified,status_count,geo,coords,retweet_count,tweet_favourite_count,Subjectivity,Polarity,Sentiment
2021-03-12 01:46:55,1370189531589263362,"2/ Spain bans AstraZeneca vaccine, bringing the number countries suspending it to ten. Press describes a bad ‘batch,’ but that’s misleading: a ‘batch’ is a million doses. ",289420613,naomirwolf,New York,104513,47544,,True,True,124210,,,43,126,0.3333333333333333,-0.3499999999999999,negative
2021-03-12 01:46:55,1370189531060826119,katemeraki_ covid vaccine?,1325665385358692352,imollielol,he/they,54,3920,,False,False,432,,,0,1,0.0,0.0,neutral
2021-03-12 01:46:55,1370189529647349761,"ReutersScience: Health authorities in Denmark, Norway and Iceland suspended the use of AstraZeneca’s COVID-19 vaccine shots following r…",1130292424276873216,fizzily1,manhattan,1360,118852,,False,False,77100,,,280,0,0.1,0.0,neutral
2021-03-12 01:46:55,1370189528590295042,business: JUST IN: Denmark suspends use of AstraZeneca's Covid vaccine after concerns were raised over potentially dangerous side effec…,2184317059,SyedReez,Melaka,714,33650,,True,False,46503,,,334,0,0.9,-0.6,negative
2021-03-12 01:46:54,1370189523997560833,"Reuters: Data suggests the Pfizer-BioNTech vaccine is 94% effective in preventing asymptomatic infection, meaning it could significantl…",897145163142766594,mccann_smit,,8,1505,,False,False,817,,,71,0,0.8,0.6,positive
2021-03-12 01:46:53,1370189523502690313,"BarackObama: Michelle and I got vaccinated against COVID-19 because we know it’s the best way to beat this pandemic, protect one anothe…",32212073,TeeASS,Canada,65,82766,,True,False,38089,,,8777,0,0.3,1.0,positive
2021-03-12 01:46:53,1370189522927902721,"LincolnsBible: My god... I cannot imagine how wretched the vaccine and Covid infection situation in America would be right now, if Jare…",280110910,oonasez,My subconscious,1810,67540,,False,False,131304,,,418,0,0.5357142857142857,0.2857142857142857,positive
2021-03-12 01:46:53,1370189522449920002,"pink_lady56 Nope. Pfizer &amp; Moderna were not part of project warp speed. 

so as always the case trump did nothing.",1240342945821229061,RayRaysFanAcct,"NY, USA",2527,19597,,False,False,28291,,,0,1,0.0,0.0,neutral
2021-03-12 01:46:53,1370189522227458049,There have been more than a handful of references in response to concerns over people with disabilities being left out of or deprioritized from the COVID vaccine roll out as “performative” politics or simple “selfishness”. Disability justice isn’t performative or selfish. Stop.,48283056,fatherqueerest,occupied duwamish territory,4549,213650,,False,False,39072,,,1,8,0.4642857142857143,0.0,neutral
2021-03-12 01:46:53,1370189522143641609,"Ang daming lumalabas na adverse effect ng AstraZeneca vaccine. Denmark, Norway and Iceland suspended use of Astra Zeneca Covid vaccine over reports of blood clots. 🤷‍♂️ 

May mga reports ng ba ng adverse effect on the use of Sinovac? 🧐",1237268171226144768,JamieAlonzo,Reipublicae Philippinis,2759,2208,,False,False,2303,,,2,34,0.0,0.0,neutral
2021-03-12 01:46:53,1370189521527189506,"EricBoehlert: i found the dumbest sentence of the week: 

&lt;Despite calls for national unity and bipartisanship, President Joe Biden and…",3082370998,BeckyRae12345,,1949,164244,,True,False,497363,,,415,0,0.0,0.0,neutral
2021-03-12 01:46:53,1370189520520540162,I’m getting my first COVID vaccine shot tomorrow.  I’m both happy and scared. LOL ,75192294,NYgrooveX,It wasn’t me.,3172,12679,,False,False,29577,,,0,3,0.6777777777777777,0.6166666666666667,positive
2021-03-12 01:46:53,1370189519933280259,thenewsoncnbc: 1 out of every 10 Americans is fully vaccinated. In total 98 million doses have been administered nationwide. CNBC's me…,71287915,Ajiman1,"Harrisburg, Pennsylvania",350,19,,True,False,26543,,,11,0,0.75,0.0,neutral
2021-03-12 01:46:52,1370189518557614086,"Astra Zeneca vaccine
Having some issues
Use is being discontinued due to issues with blood clots
AstraZeneka 
vaccine ",34106576,Sherrysherry1,"Washington,DC",609,99061,,False,False,44671,,,0,1,0.375,-0.125,negative
2021-03-12 01:46:52,1370189517521522692,InspiredAquaCA: Up to 9 countries and counting suspending their use of AstraZeneca. How many will be the tipping point before Canada ha…,963671284986138624,marywin55729514,,300,40802,,False,False,10703,,,2,0,0.5,0.5,positive
2021-03-12 01:46:52,1370189517458706433,"senraba: zephtx MollyJongFast Sharing....
COVID vaccine near me: Dr. B standby list texts about unused vaccines
",250231637,zephtx,,1734,110863,,False,False,127984,,,4,0,0.4,0.1,positive
2021-03-12 01:46:52,1370189516619669504,"The current Covid-19 vaccination is going to be in clinical trial until January of 2023. Everyone getting the Vaccine now is in a clinical trial and not taking an approved medication. Before you take the vaccine, know that you’re an experiment :)",983890154,brainer_13,,571,3286,,True,False,14646,,,0,3,0.7,0.25,positive
2021-03-12 01:46:51,1370189514937876484,kellydeannews: WHITE HOUSE: President Biden will order all states to make the COVID vaccine eligible for all adults by May 1st,910177102338646017,Harrison_Valk,"Bowling Green, KY",120,2249,,True,False,470,,,4,0,0.0,0.0,neutral
2021-03-12 01:46:51,1370189513092431877,"intotheairwaves: Joe Biden: “everyone will be eligible for the vaccine on May 1”
Me: *immediately looking at flights for June so I can…",1171150011599663106,clown_col,Massachusetts,786,19195,,False,False,13696,,,1,0,0.0,0.0,neutral
2021-03-12 01:46:51,1370189511595077636,grabbing an appt for covid vaccine is a lot of a gacha game. it's all luck. you try desperately for the 5 star UR card but end up with disappointment,274213664,haikyuutie,Hell,54,143224,,False,False,109530,,,0,1,0.6,-0.5333333333333333,negative
2021-03-12 01:46:51,1370189511355998208,wsteaks You mean warp speed that didn't include Pfizer?,1323282935961837568,BBwaveBreaking,Floating prison,51,125,,False,False,117,,,0,0,0.6875,-0.3125,negative
2021-03-12 01:46:51,1370189511330697218,"LincolnsBible: My god... I cannot imagine how wretched the vaccine and Covid infection situation in America would be right now, if Jare…",800088066283085824,robearto777,"Colorado, USA",231,163,,False,False,33803,,,418,0,0.5357142857142857,0.2857142857142857,positive
2021-03-12 01:46:50,1370189510898810880,"NaomiOhReally: ""The European Commission has probably been our largest funder over the past five years until now,"" the director of Unive…",835975173660631042,BrexitLalaland,The European Union.,2884,2541,,False,False,170143,,,155,0,0.125,-0.125,negative
2021-03-12 01:46:50,1370189510730989576,"kayleighmcenany: FINALLY the Biden admin recognizes the Trump admin’s unprecedented vaccine work:

➡️ “We’re grateful for the work that…",381277649,TreyLeePDR,"Siloam Springs, AR",631,4180,,True,False,6788,,,4119,0,0.95,0.3,positive
2021-03-12 01:46:50,1370189510546448386,"Pfizer Covid vaccine cuts transmission of coronavirus, new real-world study shows  a través de nbcnews",768559569891012608,luca_loggia,"Montréal, Québec",359,9713,,False,False,8581,,,0,0,0.4545454545454545,0.13636363636363635,positive
2021-03-12 01:46:50,1370189510445654017,"TIME: Novavax reports its COVID-19 vaccine is 96% efficacious, based on Phase 3 trial results
",32244078,hannephoto,Maui Hawaii,399,15967,,False,False,52899,,,82,0,0.0,0.0,neutral
2021-03-12 01:46:50,1370189510378541060,ABC7: LIVE Biden: “All adult Americans will be eligible to get a vaccine no later than May 1. That’s much earlier than expected.” http…,1311444448593600512,JoeCool00352598,"California, USA",95,16475,,False,False,18812,,,15,0,0.34,0.027272727272727268,positive
2021-03-12 01:46:50,1370189508336099332,"ChadGilmartinCA Pfizer, the first vaccine, was not a part of Operation Warp Speed. 
And Trump couldnt be bothered figuring out how to produce or distribute it well
Did Trump do nothing? No.  He did something 
Did he do it well or as much as the country needed? Not even close 
thanksjoebiden",336042658,Mr_RoyBasset,,126,1117,,False,False,2065,,,0,0,0.26666666666666666,0.225,positive
2021-03-12 01:46:50,1370189508147212290,Guys Im really freaked out... I took the Covid 19 vaccine band aid off my arm and WTF!??? ,1209354465867792384,am3li3s,,52,3485,,False,False,888,,,1,7,0.6,-0.2125,negative
2021-03-12 01:46:50,1370189507962810370,newsmax: Trump hopes everyone remembers him when they get their vaccine  ,1423918586,edaigle30,,38,3660,,False,False,11880,,,370,0,0.0,0.0,neutral
2021-03-12 01:46:49,1370189506842869765,"JeanRoeMartin: Awaiting the elixir of 2021

Which one?

Don't care be it pfizer, moderna or astrazeneca. They all sound magical 

You…",16877457,OMANXL1,Atlanta,2576,82477,,True,False,121361,,,3,0,0.7,0.45,positive
2021-03-12 01:46:49,1370189506226180098,goldenlily2017 Getting my first Covid vaccine on Saturday.  I’m excited to be protected.,824308666832601088,HeinoKay,"Oregon, USA",65,10689,,False,False,44,,,0,0,0.5416666666666666,0.3125,positive
2021-03-12 01:46:49,1370189505907544072,"naomirwolf: Ok: Switzerland, Italy, Austria, Latvia, Lithuania, Estonia, Luxembourg, Iceland, South Africa, Norway, Denmark have all su…",46430723,thefloridarose,USA,2111,97397,,False,False,106097,,,720,0,0.5,0.5,positive
2021-03-12 01:46:49,1370189505303605249,Biden will direct states to make all adults eligible for vaccine by May 1 ,3307713694,PTekach,"Poland, OH",11577,357346,,True,False,64367,,,0,1,0.4,0.1,positive
2021-03-12 01:46:49,1370189505257369601,MichelleRempel: I just asked NACI if they would have recommended the off label usage of the Pfizer vaccine (four month dosing interval…,1269643480537509888,dkelly99142666,,19,8715,,False,False,2129,,,302,0,0.0,0.0,neutral
2021-03-12 01:46:49,1370189503655206914,"kayleighmcenany: FINALLY the Biden admin recognizes the Trump admin’s unprecedented vaccine work:

➡️ “We’re grateful for the work that…",1183774252601921536,BryanMe26253625,,21,3303,,False,False,2156,,,4119,0,0.95,0.3,positive
2021-03-12 01:46:49,1370189503558717443,"RupaPatelMD: richard680news As a vaccinator on the First Nations reserves, I was so thankful for MPP SolMamakwa’s leadership to help w…",2821430847,AnneInAction,"Stratford, Ontario, Canada",306,2756,,False,False,2816,,,30,0,0.3333333333333333,0.25,positive
2021-03-12 01:46:48,1370189502719885313,Mexico says will continue using AstraZeneca's COVID-19 vaccine ,937962626222497793,dev_discourse,National Capital Region,86098,13115,,False,False,568586,,,0,0,0.0,0.0,neutral
2021-03-12 01:46:48,1370189499733585921,SenatorTimScott GOP's morally bankrupt. NO UR NOT RESPONSIBLE 4 HELPING US'S COVID RELIEF!What did U do 4 any1?Cares Act bc UR donors were worried about losing $/election-help 4 vaccines.Dolly P gave 1mil$ 4 vaccine as GOP WORKED DAILY AGAINST SCIENCE SO 1/2 MIL OF US COULD DIE,85147941,sasellis,South Carolina,58,524,,False,False,11272,,,0,0,0.26666666666666666,-0.03333333333333333,negative
2021-03-12 01:46:48,1370189499691597826,"So.

My BMI makes me eligible to get the COVID vaccine starting March 29th.

I'm having a really hard time with this bc despite working REALLY hard to get fit and lose weight, I'm still considered obese by this standard. And I just. Why am I doing this if it changed nothing?",4576999933,castielstruth,"Madison, WI",1497,116403,,True,False,39437,,,0,1,0.3166666666666666,-0.03666666666666667,negative
2021-03-12 01:46:47,1370189498181545985,“Can you be here in 30 min?” Got 1/2 moderna in a dark driveway off of MLK with a joint and KBBQ after. Perfect way to do it.,19360870,alanview,SEA thu-oh-sic!,684,2118,,False,False,27673,,,0,0,0.7,0.425,positive
2021-03-12 01:46:47,1370189497602818049,"mwk4 Michcioperz Demons? Oh, I guess it's only the Moderna vaccine that uses Death Stars ",1032038833066573825,ColeJ71909899,,485,27751,,False,False,3756,,,0,0,1.0,0.0,neutral
2021-03-12 01:46:47,1370189497065820161,"htTweets: Health ministry says over 26 million Covid19 vaccine doses administered in India so far

Track real-time updates
",64002539,soniabhaskar,India,1089,13308,,True,False,11443,,,3,0,1.0,0.1,positive
2021-03-12 01:46:47,1370189496231280647,"sergeivote: BREAKING NEWS:

Americans are owed nothing but the truth about when life will get back to normal. All adults will get the v…",2511425748,BiblicalH,,323,1091,,False,False,8237,,,28,0,0.325,0.075,positive
2021-03-12 01:46:47,1370189494947840006,beas_folklore biden said 18+ but since 16+ is eligible for pfizer i'm *assuming* it would include 16+ but idk,1118253369305567237,ethansflavor,he/him,67,16832,,False,False,9067,,,0,1,0.0,0.0,neutral
2021-03-12 01:46:47,1370189494364741634,"ceepcanada: Thrombosis Canada issued a statement regarding the Astra Zeneca concerns.

TL:DR: ""Thrombosis Canada guidance is that curre…",2883843686,SMCADMAN,On your screen.,6551,108410,,False,False,74353,,,1,0,0.0,0.0,neutral
2021-03-12 01:46:46,1370189493517611008,summerluvin2376 Vortmax29 realstevetrev BillSpadea Sdimaso That’s not fair sheepdog. I’ve answered these questions repeatedly...sorry if not yours directly. Only so many hours.The debate over vaccine mandates was won. Won’t likely come up again unless measles outbreak..&amp; if we don’t crush Covid with voluntary uptake. I hope that happens.,25728028,declanoscanlon,"Little Silver, CENTRAL NJ",9229,12205,,True,False,9289,,,0,0,0.85,0.037500000000000006,positive
2021-03-12 01:46:46,1370189493324627968,"lizziekastor: My flamelesss candle. A symbolic gesture can’t repair the hearts of those who’ve lost someone to Covid, or get vaccine in…",864566778260852736,nhmeems,"New Hampshire, USA",2783,159678,,False,False,109868,,,2,0,0.0,0.0,neutral
2021-03-12 01:46:46,1370189493228163072,"kayleighmcenany Please
Pfizer, MODERNA and J&amp;J were already on Vaccine Trials when Trump created his Op Warp Speed . . . 4 months late

Feb 24, 2020
""Moderna shipped the first clinical batch of mRNA-1273 to the NIH for use in their Phase 1 clinical study""

",2405501605,anradila17,,197,8920,,False,False,49667,,,0,0,0.4666666666666667,-0.024999999999999998,negative
2021-03-12 01:46:45,1370189489872760832,"SharylAttkisson: 5-Likewise, since the FDA says there was no evidence in studies as to what happens with pregnant women, they should di…",848315071054979076,beddawynne2_0,,117,45258,,False,False,23491,,,49,0,0.5,0.3333333333333333,positive
2021-03-12 01:46:45,1370189489784680450,HighWireTalk: The Italian Medicines Agency (AIFA) Thursday banned nationwide the use of a batch of the AstraZeneca COVID-19 vaccine due…,1077603856048185344,Z12Ren,United Kingdom,102,604,,False,False,641,,,218,0,0.0,0.0,neutral
2021-03-12 01:46:45,1370189489201614854,Reuters_Health: AstraZeneca cut its supply forecast of COVID-19 vaccines to the European Union in the first quarter to about 30 million…,126816712,Rover829,Undisclosed Location,28065,4865,,False,True,43255,,,7,0,0.16666666666666666,0.125,positive
2021-03-12 01:46:45,1370189487754469378,"KPBSnews: Biden is directing all states, territories and tribes to make every adult (18 and over) eligible for the COVID-19 vaccine by…",106430958,Aaron_Glantz,"San Francisco, CA",8582,2532,,False,True,12957,,,3,0,0.3,0.1,positive
2021-03-12 01:46:44,1370189485321768960,"HamillHimself: Statement by the Twice Impeached Former Guy

I hope everyone remembers when they're getting the COVID-19 (often referred…",60563975,singhnavjeet,"Bangkok, Thailand",467,39594,,True,False,96092,,,839,0,0.0,0.0,neutral
2021-03-12 01:46:44,1370189484290154496,"curledupkate It's all happening. Moderna Dose 2 on April 2. 

We can't wait for 🇨🇦 to catch-up. We miss our family. We miss our friends. We miss our home. ",111464878,gregoryramshaw,"Clemson, SC via Edmonton",471,10788,,True,False,14781,,,0,0,0.0,0.0,neutral
2021-03-12 01:46:44,1370189481832243205,"Hey Medtwitter, share this wonderful story far and wide! If there’s a better vaccine news story out there, I haven’t seen it ",582962011,ArtKellermannMD,"Richmond, Virginia",5676,3148,,False,False,18421,,,0,0,0.725,0.36875,positive
2021-03-12 01:46:43,1370189478879444993,"MichaelDeLauzon Pfizer, the first vaccine, was not a part of Operation Warp Speed. Science.",927863558267813890,JWilliams_74,,189,27289,,False,False,7367,,,1,5,0.3333333333333333,0.25,positive
2021-03-12 01:46:42,1370189476975276035,"uaem: Today, we showed up in front of Pfizer and advocated for a PeoplesVaccine on the one year anniversary of the WHO’s declaration o…",17198236,jonshaffer,"Boston, MA",2278,10991,,True,False,10872,,,1,0,0.0,0.0,neutral
2021-03-12 01:46:42,1370189476950052873,makaumutua AstraZeneca Source of information? And how come this had been broadcasted by CNN and BBC?,295658797,comagafrica,,79,541,,True,False,1244,,,0,0,0.0,0.0,neutral
2021-03-12 01:46:42,1370189476056739840,"I'm sorry but JoeBiden POTUS is a piece of 💩!

This old ass is literally standing up there taking credit for a vaccine to COVID-19. Yes, the vaccine is b.s, but to take credit for the work of another administration and to lie about a perceived lack of action.. He's simply, 💩!",1082301836630155265,esabine1980,"Texas, USA",199,41619,,False,False,22872,,,0,0,0.4142857142857143,-0.10625,negative
2021-03-12 01:46:41,1370189473053564929,EricMMatheny: Are we going to talk about the healthy 39 year old woman from Utah who got her second dose of the Moderna vaccine and the…,4237019654,MagnoliaAHG,"Wisconsin, USA",610,206854,,True,False,140427,,,2619,0,0.2333333333333333,0.2,positive
2021-03-12 01:46:41,1370189472948715526,"RhealJedi swhnyc My Mom did that. She felt horrible. It was the worst. But yes, better than the real thing. And her Pfizer vacc was NOTHING compared to that.",1293296925979049985,CSurvivor9,My room,1302,26148,,False,False,13793,,,0,1,0.7,-0.325,negative
2021-03-12 01:46:41,1370189470755065857,"kcvaccinewatch: KS: Vaccine appointments available at Hy-Vee Shawnee from Mar 12 to Mar 15. Sign up here, zip code 66216:
",1220521500836581382,Jayhawk4L,LFK,101,130085,,False,False,1809,,,3,0,0.4,0.4,positive
2021-03-12 01:46:41,1370189469857546240,EricMMatheny: Are we going to talk about the healthy 39 year old woman from Utah who got her second dose of the Moderna vaccine and the…,332005627,RockPB33,On the Job,383,40961,,False,False,30706,,,2619,0,0.2333333333333333,0.2,positive
2021-03-12 01:46:40,1370189468947333120,Bibliogato: If you are in PA and you are currently qualified to get a vaccine depending on your area's stage and are struggling to get…,2377859661,Mickcollins32,,953,133381,,False,False,27589,,,23,0,0.4,0.0,neutral
2021-03-12 01:46:40,1370189468485873664,"noahweiland: Scoop: The U.S. is sitting on tens of millions of doses of the AstraZeneca vaccine in Maryland and Ohio facilities, and of…",106771119,virdikuldeep,"Ludhiana, Punjab, INDIA",754,62209,,True,False,123402,,,300,0,0.0,0.0,neutral
2021-03-12 01:46:40,1370189468255219713,jgombita: Adults 60-64 signing up for AstraZeneca vaccines in Ontario (via pharmacies) please note 👇🏼,123920535,fubardaddy,Treaty 6 territory,794,67141,,True,False,65514,,,6,0,0.0,0.0,neutral
2021-03-12 01:46:40,1370189464996306944,"tiibw44 GlenAKW jbefc1 MountvSimon Ingredients the manufacturers and suppliers are liable in law to guarantee are suitably tested &amp; safe.
Unlike the pharmaceutical industry’s for covid.
Hurrah...they’ve all been absolved of any liability for any consequent damage to the vaccine recipient.

Or didn’t you know that?",803693678443249666,TonyPandy51,"England, United Kingdom",1462,67152,,False,False,20248,,,0,1,0.5833333333333334,0.3166666666666667,positive
2021-03-12 01:46:39,1370189464295895044,nationaljournal: Advocates are concerned that COVID-19 vaccine dissemination systems don’t sufficiently address the communication and a…,35875568,hq89,Michigan,41,1558,,False,False,3741,,,9,0,0.0,0.0,neutral
2021-03-12 01:46:39,1370189463511523329,"In address, Biden directs that all adults be eligible for COVID-19 vaccine by May 1  via Yahoo",2926418704,DE3x2ydy_dx,,33,1556,,False,False,12106,,,0,0,0.0,0.0,neutral
2021-03-12 01:46:39,1370189462597029889,"LeaderMcConnell Thanks to the Federal pharmacy vaccination program, I’m 62 and due to receive my second Moderna vaccine April 1.  Registering for the Arizona program was impossible. Thanks Moderna, Dolly Parton (for her generous contribution to research), Walgreens and the Biden administration.",1016344557816909824,jdyanksfan,,1,228,,False,False,168,,,0,1,0.355,-0.07833333333333331,negative
2021-03-12 01:46:39,1370189462475476993,OregonGovBrown My 78 yo father had his COVID vaccination appt cancelled today at Costco because they ran out of vaccine. He's a diabetic cancer survivor who struggled w/ how to even get his shot &amp; now this.  He has to wait for another week. He's understandably scared.,381791722,ObservingAngel,,103,8075,,False,False,5888,,,0,0,0.0,0.0,neutral
2021-03-12 01:46:39,1370189462425239558,"CDCgov: If you get a COVID19 vaccine, wait at least 14 days before getting any other vaccine, including those for flu or shingles. If…",191522212,USAPHC,"Aberdeen Proving Ground, MD",3114,621,,True,False,5473,,,237,0,0.3875,-0.2125,negative
2021-03-12 01:46:39,1370189462119010306,"ReallyDanWeiner: ashwindeshmukh ""Since all Americans became eligible for the COVID vaccine, cases have dropped dramatically but epidem…",1087156970472292353,deepstateQT,,242,24692,,False,False,10624,,,33,0,0.0,0.0,neutral
2021-03-12 01:46:39,1370189461074546688,"axios: The U.S. has 4% of the world's population, 20% of all recorded COVID-19 deaths, and nearly 30% of all vaccine doses administered…",29222187,writerknowles,northern california,3014,3718,,True,True,69938,,,35,0,0.4,0.1,positive
2021-03-12 01:46:38,1370189460214796293,"Gray_Mackenzie: Health Canada says the AstraZeneca vaccine continues to be safe to use and so far, there has been no indication that th…",291626846,AnnieClaireBO,Ottawa,12521,5337,,True,True,29236,,,10,0,0.75,0.3,positive
2021-03-12 01:46:38,1370189457731809282,"NaomiOhReally: ""The European Commission has probably been our largest funder over the past five years until now,"" the director of Unive…",1978338607,TheAverageMike,"Limerick, Ireland",517,291198,,False,False,41390,,,155,0,0.125,-0.125,negative
2021-03-12 01:46:38,1370189457673097218,RockyMountViews svizzerams Pfizer. Otherwise feeling ok. Just a little fuzzy headed.,964234439558664192,willoughby_12,Illinois,1254,69069,,False,False,51968,,,0,2,0.5,0.15625,positive
2021-03-12 01:46:38,1370189457375256579,TheyCallMeDee_x She working for Astrazeneca,38018836,dib_bee,Wherever †,522,2112,,True,False,184755,,,0,0,0.0,0.0,neutral
2021-03-12 01:46:37,1370189456452382721,normanswan: Reinforces why our borders should be ringed using Pfizer and include workers’ households. ,4722374623,amc_yanchepnews,"Yanchep, Western Australia",446,8207,,False,False,10474,,,177,0,0.0,0.0,neutral
2021-03-12 01:46:37,1370189454959390722,"nytgraphics: The CDC said on Thursday that about 64.1 million people have received at least one dose of a Covid-19 vaccine, including a…",1239227702823002116,DebiSeda,,27,16031,,False,False,10413,,,21,0,0.4,-0.3,negative
2021-03-12 01:46:37,1370189454678233091,"MichelleObama: When you can get the COVID-19 vaccine, I hope you do—Barack and I are certainly glad we did. It’s our best shot at beati…",707973725673488384,CameleonLizard,,17,4898,,False,False,4131,,,7300,0,0.65,0.75,positive
2021-03-12 01:46:37,1370189454514679810,Phil_Lewis_: NEW: Joe Biden will reportedly direct all states to make every adult in the U.S. eligible for a COVID-19 vaccine no later…,716175014,_Giichi_,Ꮯalifŏrnia ᒪovĕ,2000,75319,,True,False,87325,,,20,0,0.3848484848484848,0.11212121212121212,positive
2021-03-12 01:46:37,1370189454271520769,"ChildrensHD: NEW RobertKennedyJr: In Oct 2019, shortly before the COVID outbreak, Gates + other powerful individuals began planning ho…",867456962916646913,ZenaValdiviels1,,116,9323,,False,False,814,,,276,0,0.5323863636363636,0.07784090909090909,positive
2021-03-12 01:46:37,1370189452774096897,"CNN: “All adult Americans will be eligible to get a vaccine no later than May 1,"" President Biden announces. ""...That doesn't mean ever…",589412477,DlauraGHerrera8,"El Paso, Texas.",274,6074,,True,False,19712,,,251,0,0.32916666666666666,-0.07083333333333333,negative
2021-03-12 01:46:36,1370189452396654593,"POTUS: One in four adults in the U.S. has received their first COVID-19 vaccine — and we’re now leading the world in vaccinations.

Tha…",88759671,RN_JW733,"New York, USA",1548,50834,,False,False,118812,,,15189,0,0.3333333333333333,0.25,positive
2021-03-12 01:46:36,1370189451385659396,"MichelleObama: When you can get the COVID-19 vaccine, I hope you do—Barack and I are certainly glad we did. It’s our best shot at beati…",1330662169210327041,Phoenixcruiser1,,33,12554,,False,False,3512,,,7300,0,0.65,0.75,positive
2021-03-12 01:46:36,1370189451171926018,This New COVID-19 Strand &amp; Vaccine Giving Me Residence Evil Vibes💯😩,1361151352022384640,FifaDip,"Connecticut, USA",112,233,,False,False,74,,,0,0,0.7272727272727273,-0.4318181818181818,negative
2021-03-12 01:46:36,1370189449896820736,MichelleRempel: I just asked NACI if they would have recommended the off label usage of the Pfizer vaccine (four month dosing interval…,1219272783466766338,FrankRo21432189,,1,38,,False,False,48,,,302,0,0.0,0.0,neutral
