created,id_str,text,user_id,screen_name,location,followers_count,user_favourites_count,time_zone,geo_enabled,verified,status_count,geo,coords,retweet_count,tweet_favourite_count,Subjectivity,Polarity,Sentiment
2021-03-11 21:42:19,1370127973811060736,danieteebee: It’s completely predictably American that the brand of COVID vaccine you have access to has now become a class signifier,1151237829176877056,theonlyitu,"Inglewood, CA",297,13359,,False,False,27679,,,10902,0,0.0,0.0,neutral
2021-03-11 21:42:18,1370127972187930628,"Utah woman, 39, dies 4 days after 2nd dose of COVID-19 vaccine; autopsy ordered ",15145138,ABC13News,"Lynchburg, VA",47618,8789,,True,True,162145,,,0,1,0.0,0.0,neutral
2021-03-11 21:42:18,1370127970497658881,Covid's Vaccine First Dose ✅ 💉 ,1574115775,FBK_078,"الرياض, المملكة العربية السعودية",375,102,,True,False,9994,,,0,2,0.3333333333333333,0.25,positive
2021-03-11 21:42:18,1370127968962408449,"Update: You can now add your COVID-19 Vaccine status to your profile, so you can be empowered to make dating choices that make you feel safe. 

Don't want to share? That's OK, too – just select ""Prefer not to share,"" and your profile will stay the same. ",344157735,coffeembagel,San Francisco,119025,3390,,True,False,8067,,,0,2,0.375,0.3333333333333333,positive
2021-03-11 21:42:17,1370127966080929792,narendramodi: Happy to share that my mother has taken the first dose of the COVID-19 vaccine today. I urge everyone to help and motivat…,1334843747947909120,IndicFilms,Aapke Dil Me,19,15437,,False,False,964,,,16924,0,0.6666666666666666,0.525,positive
2021-03-11 21:42:17,1370127965804228616,BudGothmog44: QAnon groups on Telegram seethe with covid denialism and vaccine misinformation - The Washington Post ,392303969,nomaddaddy,"New York, USA",2834,132386,,False,False,102046,,,3,0,0.0,0.0,neutral
2021-03-11 21:42:16,1370127962876510208,"So; I really don’t understand why everyone is up in arms about a covid vaccine passport - is this not standard practice when travelling as it is? This is not a new thing, if you want to travel to a specific place; you have to prove that you have specific vaccines.",32477533,mghnn_jn,"Edmonton, Alberta",266,6066,,True,False,7595,,,0,2,0.1809090909090909,0.026363636363636367,positive
2021-03-11 21:42:16,1370127962083786753,"I think I'll wait, thanks AstraZenecabloodclots",1368595668823015432,Lorijjensen1,"Calgary, Alberta",2,11,,False,False,2,,,0,1,0.2,0.2,positive
2021-03-11 21:42:16,1370127961949618177,"6abc: ""The way out is vaccines"": As many people struggle to get vaccinated, Moderna has already moved ahead to booster shots.​  https:/…",3347713985,YagirlApril,Where Black Lives Don't Matter,179,6015,,False,False,14894,,,4,0,0.5,0.5,positive
2021-03-11 21:42:16,1370127960330670093,"It's a crappy photo (hold still, phone!), but Pfizer-BioNTech 1 is in my arm! ",122534598,gungfujoe,"Fairfax Station, VA",33,814,,False,False,337,,,0,2,0.0,0.0,neutral
2021-03-11 21:42:15,1370127958699036676,"LasVegasSun: Casino workers now eligible for COVID vaccine
 ",1267587077408845825,rcghospitality,"Las Vegas, NV",4,5,,False,False,16,,,16,0,0.0,0.0,neutral
2021-03-11 21:42:15,1370127958569013250,Tanzania says it's free from Covid-19 and rejects vaccine  via YouTube,1276272684414926851,EricDexter11,,9,406,,False,False,982,,,0,0,0.8,0.4,positive
2021-03-11 21:42:15,1370127957281357825,Healthcare_ABC: The logistics of the COVID19vaccine manufacturing process will play a role in how quickly populations can be protected…,1149019824720363520,Advocacy_ABC,,232,357,,False,False,333,,,3,0,0.5,0.3333333333333333,positive
2021-03-11 21:42:15,1370127956899737601,"CharlieAngusNDP further removed from the act of the original aboriton, however, the bishops' have noted that “If the AstraZeneca product is the only available option, said the document, then ""nothing morally prevents anyone from receiving in good conscience the vaccines or others that may 2/",145037877,soitgoes910,"Toronto, Ontario",133,535,,True,False,688,,,0,1,0.5833333333333334,0.24583333333333335,positive
2021-03-11 21:42:14,1370127955465285634,"MaxKennerly: Yamiche 1995-2005: Katalin Karikó invents mRNA tech
2010-15: BioNTech &amp; Moderna develop vaccine applications
2015: Obama…",25852603,mford4,"New Hope, PA",88,3672,,True,False,1165,,,412,0,0.0,0.0,neutral
2021-03-11 21:42:14,1370127952831246342,"JajaPhD: This is the Covid-19 vaccine that should be going to front line health workers and those who are the most vulnerable, ba?",532254366,dotexbaba,Behind you,438,1603,,True,False,66778,,,1210,0,0.5,0.0,neutral
2021-03-11 21:42:14,1370127951732297728,boblister_poole Wrong!  AstraZeneca ‘s calculator has decimated the EUs vaccine rollout,1048334353888157696,hedleyfarquhar,"Trefin, Wales",208,660,,True,False,18435,,,0,0,0.9,-0.625,negative
2021-03-11 21:42:13,1370127950574665736,kaitlynmidgett: The devil works hard but alysoncoletta and I work harder (at booking Covid Vaccine appointments),23241252,alysoncoletta,New Jersey,1951,17308,,False,False,186,,,1,0,0.2708333333333333,-0.19583333333333336,negative
2021-03-11 21:42:13,1370127950444695552,AvaaElaine: Millions of people won't get the vaccine until 2024 because of pfizer --- we need to freethevaccine ,1291817093588037639,FTV_Boston,,156,134,,True,False,124,,,8,0,0.0,0.0,neutral
2021-03-11 21:42:13,1370127950130077698,New COVID-19 vaccine initiative for eligible residents in Mecklenburg County ,1060300261,FloLake,Mid Atlantic ,10854,189961,,False,False,186832,,,0,0,0.45454545454545453,0.13636363636363635,positive
2021-03-11 21:42:13,1370127949261762561,"NBCPolitics: BREAKING: House passes $1.9T Covid relief bill that includes $1,400 checks, $300/wk jobless benefits, child allowance of u…",3247501704,John_01001,,134,63423,,False,False,4674,,,4955,0,0.0,0.0,neutral
2021-03-11 21:42:13,1370127947689041927,"POTUS: One in four adults in the U.S. has received their first COVID-19 vaccine — and we’re now leading the world in vaccinations.

Tha…",360760106,VACatLady,VA,1017,569346,,True,False,164394,,,16389,0,0.3333333333333333,0.25,positive
2021-03-11 21:42:12,1370127946262982662,"NARALNC: We like our healthcare without a side of religiosity. 

great op-ed from jamielmanson at Catholic4Choice!

COVID19 YourSp…",424495488,normaarios,"Austin, TX",123,3485,,True,False,2246,,,5,0,0.75,1.0,positive
2021-03-11 21:42:12,1370127945369481217,"TheAtulMishra: Sweden,a largely inconsequential country wished to bounce back to significance with its AstraZeneca vaccines that it pro…",47058785,cv_janu,,121,47278,,False,False,38855,,,450,0,0.21428571428571427,0.10714285714285714,positive
2021-03-11 21:42:11,1370127942450286594,"chicagotribune: Pregnant women deserve more COVID-19 vaccine data, says Sen. Tammy Duckworth in letter to CDC director ",875833052697686018,2334Beardown,,60,16372,,True,False,7085,,,9,0,0.5,0.41666666666666663,positive
2021-03-11 21:42:11,1370127939161972737,"POTUS: One in four adults in the U.S. has received their first COVID-19 vaccine — and we’re now leading the world in vaccinations.

Tha…",822847432899891200,helisbor,Midwest USA,1098,246881,,False,False,45580,,,16389,0,0.3333333333333333,0.25,positive
2021-03-11 21:42:11,1370127939090718721,"bhiola59: Akwa Ibom Government Takes Delivery of Vaccines
The State Government delivery of 69,030 doses of AstraZeneca Covid-19 vaccine…",1361272616636538880,abullabulla,My mind,29,34,,False,False,442,,,5,0,0.0,0.0,neutral
2021-03-11 21:42:10,1370127936997752836,"JKNjenga: Kenya is a comedy show, but it is not funny.

Weeks after splashing 4.2 billion for MCAs to vote BBI, we are begging 5 billio…",242703201,musaletweets,/usr/local/sin,2052,508,,False,False,120621,,,894,0,1.0,-0.125,negative
2021-03-11 21:42:10,1370127936326574080,Fears of 'catastrophe' as rising COVID-19 cases hit Papua New Guinea's stretched health system ,840452311692451840,ForKiriwina,"Sydney, New South Wales",5,147,,False,False,231,,,0,0,0.22727272727272727,0.043181818181818175,positive
2021-03-11 21:42:10,1370127935441543170,"actualfredsmith: After telling us we're first in the queue for vaccine, ScottyFromMarketing on the pathetically slow rollout of COVID…",1175609188736626690,chippiebrooks,,322,182668,,False,False,11055,,,9,0,0.36666666666666664,-0.025000000000000022,negative
2021-03-11 21:42:09,1370127933415817223,"Rite Aid Pharmacies are holding two days of COVID-19 vaccination appointments exclusively for teachers, educators and childcare providers. ",62872266,MyDesert,Coachella Valley,53846,4235,,True,True,88878,,,3,12,0.0,0.0,neutral
2021-03-11 21:42:09,1370127932061065224,"conradjwilson: Oregon’s prisons have offered a vaccine to every inmate in custody, some 13,000 people in all. Attorneys representing Or…",38125120,dhill1856,,54,13458,,False,False,32378,,,211,0,0.0,0.0,neutral
2021-03-11 21:42:09,1370127931847159812,"Well, it looks like Australia will be able to get its Astrazeneca doses from Italy after-all!

DeNovo_Fatima 
 ",1247531830577754120,chdigg1,,104,3744,,False,False,3167,,,0,0,0.625,0.625,positive
2021-03-11 21:42:09,1370127931062710273,"TomiLahren: If you need an ID to get a Covid vaccine, why the hell shouldn’t you need an ID to vote?!! LiberalismIsAMentalDisorder",259994532,AngelMay87,,22,460,,True,False,3280,,,2339,0,0.0,0.0,neutral
2021-03-11 21:42:09,1370127930513362947,Reuters: Novavax shares were up more than 15% after announcing its COVID vaccine's efficacy data  $NVAX,3267499909,IowaViewer,,108,60168,,False,False,5927,,,32,0,0.5,0.5,positive
2021-03-11 21:42:09,1370127930383163392,"guardian: Delaying second Pfizer dose leaves cancer patients at risk, say researchers ",830962106619088896,RigvedShubham,"California, USA",1,18,,True,False,15,,,37,0,0.0,0.0,neutral
2021-03-11 21:42:08,1370127926331637767,"kayleighmcenany: FINALLY the Biden admin recognizes the Trump admin’s unprecedented vaccine work:

➡️ “We’re grateful for the work that…",806589207594618880,TheDonald67,,1433,31304,,True,False,25951,,,4626,0,0.95,0.3,positive
2021-03-11 21:42:07,1370127925656322049,"NBCNews: BREAKING: President Biden signs $1.9T Covid relief bill into law; ​includes $1,400 checks, $300/wk jobless benefits, child all…",175111392,DallasDem4ever,"Dallas, TX",1109,9256,,False,False,15431,,,2363,0,0.0,0.0,neutral
2021-03-11 21:42:07,1370127925098450946,peterliese: 🇬🇧 claims that it is perfectly fine that they are preferentially supplied by AstraZeneca and that nothing is exported from…,1112700613337452544,StefanVerena,"Graz, Österreich",742,62651,,False,False,66006,,,11,0,0.5,0.4166666666666667,positive
2021-03-11 21:42:07,1370127925043924999,"RSBNetwork: Statement by Donald J. Trump, 45th President of the United States of America:

I hope everyone remembers when they’re getti…",1248015604054974465,Flauber91680263,,91,33344,,False,False,25027,,,836,0,0.0,0.0,neutral
2021-03-11 21:42:07,1370127924997849096,"roccogalatilaw: Denmark. another country, like Austria, to suspend  Astra-Zeneca vaccine due to ""blood-clotting"" which  led to deaths a…",1322585510183882754,GloriaEvieFrye,,33,8528,,False,False,452,,,1470,0,0.375,-0.125,negative
2021-03-11 21:42:07,1370127924733607942,WhyBlitz: NEW: The Fairfax County Health Department hasn't received any doses of the J&amp;J vaccine as of yet and likely won't until the e…,4421603307,Micheleboyd1224,,1050,398126,,True,False,331570,,,2,0,0.7272727272727273,0.06818181818181818,positive
2021-03-11 21:42:06,1370127921420062728,Moderna and Pfizer vaccines shown to reduce risk of asymptomatic COVID19 infection and spread to others  MayoClinic ,1671585252,DrMisialek,"Newton, MA",4774,260,,False,False,8473,,,0,2,0.0,0.0,neutral
2021-03-11 21:42:06,1370127919406665731,"The Health District SNHDinfo is now offering vaccines to:

•Frontline hospitality workers
•Casino &amp; resort employees 
•Restaurant &amp; quick serve food operations workers
•Cafeteria employees

Schedule an appointment here: 

🥳 ",1587143948,LasVegasLocally,"Las Vegas, NV",119391,364222,,True,False,106037,,,51,144,0.5,0.3333333333333333,positive
2021-03-11 21:42:06,1370127918895136768,Mild Side Effects Occur On Users of AstraZeneca COVID-19 Vaccines – FG ,227313985,dayoadesulu,"IKORODU, LAGOS, NIGERIA",292,346,,True,False,12392,,,0,0,0.5,0.3333333333333333,positive
2021-03-11 21:42:05,1370127917515038722,"kayleighmcenany: FINALLY the Biden admin recognizes the Trump admin’s unprecedented vaccine work:

➡️ “We’re grateful for the work that…",1238495760217333761,SteveWr85680418,,66,5390,,False,False,26502,,,4626,0,0.95,0.3,positive
2021-03-11 21:42:05,1370127916235943945,"petemorristwit: As it stands today, at this point in time. I won't be taking the vaccine.  I really don't want to be part of an ongoing…",1013115222889025537,MULUC9,"England, United Kingdom",4284,77241,,False,False,68087,,,155,0,0.2,0.2,positive
2021-03-11 21:42:05,1370127915770380293,"NaomiOhReally: ""The European Commission has probably been our largest funder over the past five years until now,"" the director of Unive…",813292557685948417,OthelloFloof,,946,117686,,False,False,37920,,,179,0,0.125,-0.125,negative
2021-03-11 21:42:04,1370127913299845125,Knight2Archer elrealista56 Phillyraines jessicajbalzer kayleighmcenany But moderna was funded by government money? Was it not?,2321778523,allyssabettenco,Leavenworth ,82,5258,,False,False,1368,,,0,0,0.0,0.0,neutral
2021-03-11 21:42:04,1370127913048141825,roussin_brent What about those idiots Bishops from Catholic Church in Canada? ,78583554,FelipeMestieri,"Winnipeg, Manitoba",430,1118,,False,False,1747,,,0,0,0.45,-0.4,negative
2021-03-11 21:42:03,1370127909118091265,European countries suspend use of AstraZeneca’s COVID-19 vaccine ,212172770,StrawberryNG,Nigeria,1921,3,,False,False,674992,,,0,0,0.0,0.0,neutral
2021-03-11 21:42:03,1370127908795203587,Reuters: Novavax shares were up more than 15% after announcing its COVID vaccine's efficacy data  $NVAX,869472945340653568,n_hatami,,7,593,,False,False,286,,,32,0,0.5,0.5,positive
2021-03-11 21:42:02,1370127904449957891,"kayleighmcenany: FINALLY the Biden admin recognizes the Trump admin’s unprecedented vaccine work:

➡️ “We’re grateful for the work that…",4659221183,eddiemyboy,,542,92300,,False,False,23481,,,4626,0,0.95,0.3,positive
2021-03-11 21:42:02,1370127904290521088,"With good weather returning, new Covid cases going down steadily, and the vaccine numbers going up, I am feeling hopeful and optimistic! More than I have in a long long time",1198161871280295937,stripeddance,,88,8307,,False,False,1152,,,0,5,0.44906204906204905,0.18416305916305914,positive
2021-03-11 21:42:02,1370127904047124483,Just got my second RFID impl... I mean covid vaccination. pfizer covid vaccine imbeingtracked,1271047282897518592,Livin_TheDream_,,6,92,,False,False,90,,,0,0,0.34375,-0.15625,negative
2021-03-11 21:42:02,1370127903858556937,ChrysK3: The morning after the Astra Zeneca vaccine. A thread,837404175185113089,RasBenjiMassop1,,1618,69331,,True,False,83586,,,78,0,0.0,0.0,neutral
2021-03-11 21:42:02,1370127902910648320,"Noahpinion: Huge win for vaccines here. 

Remember, Israel has a lot of COVID variants going around, including the scary South Africa v…",711539763321380864,SnidgerMaridger,,40,2643,,False,False,3570,,,185,0,0.7666666666666666,0.2333333333333334,positive
2021-03-11 21:42:02,1370127902512181258,More countries are suspending the use of Astrazeneca vaccines over alleged links blood clot issues. This will definitely lead to serious trust issues in Nigeria. Which way now naija.,533585089,Lekanakindoju,,4547,9731,,True,False,4801,,,1,1,0.44166666666666665,0.016666666666666677,positive
2021-03-11 21:42:01,1370127900696051716,"ThierryBreton: AstraZeneca vaccines delivery : I see efforts, but not “best efforts”. 

That’s not good enough yet for AstraZeneca to…",22915582,SaidElKhadraoui,Europa,4784,904,,False,False,3329,,,242,0,0.46666666666666673,-0.2833333333333333,negative
2021-03-11 21:42:01,1370127900146597897,ColinDMello: NEW: Chief Gordon Beardy of Muskrat Dam confirms to CTVNews that they asked MPP Sol Mamakwa to fly-in and get the Moderna…,249755844,kcchronicles,Toronto,3232,17095,,False,False,11767,,,571,0,0.45454545454545453,0.13636363636363635,positive
2021-03-11 21:42:01,1370127899970342913,"POTUS: One in four adults in the U.S. has received their first COVID-19 vaccine — and we’re now leading the world in vaccinations.

Tha…",36946477,shiplady1877,Houston,169,24225,,False,False,23428,,,16389,0,0.3333333333333333,0.25,positive
2021-03-11 21:42:01,1370127898162642946,"Eligible Charlotte, Mecklenburg residents can get the COVID vaccine at home. Here’s how. ",1060300261,FloLake,Mid Atlantic ,10854,189961,,False,False,186832,,,0,0,0.0,0.0,neutral
2021-03-11 21:42:00,1370127895876706304,"sourpatchlyds ConceptualJames Why is it ok to quote doom-and-gloom ""misleading"" Covid stats like scripture, but not ok to critically discuss the Covid vaccine?  Twitter sux.",1250996627399045120,SLadydi,,38,4618,,False,False,886,,,1,21,0.6,0.08333333333333333,positive
2021-03-11 21:42:00,1370127895847403521,Novavax’s COVID-19 vaccine prevents 96% of infections against original strain of the virus ,3198311040,techgateorg,,7520,18,,False,False,49330,,,0,0,0.75,0.375,positive
2021-03-11 21:42:00,1370127895394463746,business: Chile announced new restrictions aimed at slowing a surge in coronavirus cases that’s tarnished one of the world’s fastest va…,1223310441302102018,AsmaraCool27,,29,32489,,False,False,46508,,,13,0,0.45454545454545453,0.13636363636363635,positive
2021-03-11 21:42:00,1370127894127783938,simondolan: Urgent Open Letter from Doctors and Scientists to the European Medicines Agency regarding COVID-19 Vaccine Safety Concerns…,1108138077246160898,DonaldShimoda4,,66,12298,,False,False,12836,,,577,0,0.25,0.0,neutral
2021-03-11 21:42:00,1370127893985120260,"donkamion78: Robert Kennedy Jr.: Merck, Sanofi, Glaxo and Pfizer over the last 10 years paid 35 billion dollars in criminal penalties a…",1248951241675345920,jerezana0902,HMP England. ❤ in Jerez.,590,25939,,False,False,19108,,,498,0,0.30833333333333335,-0.2,negative
2021-03-11 21:42:00,1370127893649629193,"NBCNews: BREAKING: President Biden signs $1.9T Covid relief bill into law; ​includes $1,400 checks, $300/wk jobless benefits, child all…",700699701746737157,_momocatt,United States,254,12998,,False,False,14983,,,2363,0,0.0,0.0,neutral
2021-03-11 21:41:59,1370127889245609986,"capeannsky: ABC inching close to FOX territory.
Biden owes Trump NOTHING.
Trump didn't have a rollout plan. Hillary would have had covi…",1175100279802486784,litapi1,"Newton, MA",2527,239951,,False,False,175216,,,1,0,0.0,0.0,neutral
2021-03-11 21:41:59,1370127889140645890,"jsolomonReports: Former presidents urge Americans to get COVID-19 vaccine, Trump not among group | Just The News ",1357601342,tschief11,"San Diego, CA",787,29778,,False,False,17827,,,140,0,0.0,0.0,neutral
2021-03-11 21:41:58,1370127887840514050,"TheDailyEdge: There is a difference:

TRUMP: US leads the world in COVID19 infections

BIDEN: US leads the world in CovidVaccine inje…",260864109,LeaKThompson,,186330,34150,,False,True,31047,,,56,0,0.0,0.0,neutral
2021-03-11 21:41:58,1370127886733221894,mgscarsbrook: Astrazeneca 💉 has just been halted in Denmark: “Danish health authorities announced they had temporarily stopped administ…,1323572235123200001,louisej57551380,,38,3570,,False,False,1011,,,378,0,0.0,0.0,neutral
2021-03-11 21:41:57,1370127883335729153,"matthewherper: $NVAX says its Covid-19 vaccine prevented severe disease caused by new variants of the SARS-CoV-2 virus. 

5 severe case…",314447608,zpyeung,"Houston, TX",426,1252,,True,False,1914,,,38,0,0.45454545454545453,0.13636363636363635,positive
2021-03-11 21:41:57,1370127882253701133,39-Year-Old Healthy Utah Mother Dies After Taking Second Dose of Moderna Vaccine: Family  via epochtimes,220142000,BenDreesen,Overpelt Belgie,2096,40930,,True,False,81993,,,0,1,0.25,0.25,positive
2021-03-11 21:41:57,1370127882056572930,"AshleyMunoz2020: The Democrats think Hispanics are too stupid to get a photo ID in order to vote. 

Biden thinks Hispanics are too stup…",753404322348539906,strahanmsr,"Wichita Falls, TX",2610,31867,,True,False,56903,,,8,0,1.0,-0.7999999999999999,negative
2021-03-11 21:41:56,1370127878118014979,publiclandlvr moderna_tx Yes ma'am!,2435736139,GabrielLeete,"California, USA",2427,13045,,True,False,10356,,,0,1,0.0,0.0,neutral
2021-03-11 21:41:56,1370127877056782341,"conradjwilson: Oregon’s prisons have offered a vaccine to every inmate in custody, some 13,000 people in all. Attorneys representing Or…",1230964774571298821,ZDuffly,"Oregon, USA",19,634,,False,False,88,,,211,0,0.0,0.0,neutral
2021-03-11 21:41:55,1370127875668598786,"Why does Prince George's County have the lowest vaccination rate in MD despite having the most COVID cases &amp; deaths? It's not just hesitancy, as some have claimed — it's about access. Now some leaders want major changes to the vaccine distribution system.

",237099808,GabeCohenNews,"Seattle, WA",3236,2819,,True,True,5908,,,2,3,0.5,0.28125,positive
2021-03-11 21:41:55,1370127875282636805,meganmesserly: BIG NEWS: Food service and hospitality workers are eligible for the COVID-19 vaccine effective IMMEDIATELY in Clark Coun…,3406345023,AK_Organizer,"Las Vegas, NV",1234,11855,,True,False,13406,,,151,0,0.45,0.3,positive
2021-03-11 21:41:55,1370127872220798982,peggymel2001: MinhKular This was mentioned in last nights Q&amp;A.  Friday 12 March 2020.  The Morrison Regime has based the rollout of th…,139531687,marxdeane,Bli Bli Qld Australia,11595,9345,,True,False,244787,,,9,0,0.06666666666666667,0.0,neutral
2021-03-11 21:41:54,1370127871503654914,ComoPescado RepKatiePorter yes and the vaccine was researched and developed in Germany. The patent is held in Germany by the company Biontech. Pfizer is a strategic partner for production and sales.,1024313821538799618,RalfStein3,Germany,226,22485,,True,False,26792,,,0,0,0.3,0.1,positive
2021-03-11 21:41:54,1370127870597664770,"POTUS: One in four adults in the U.S. has received their first COVID-19 vaccine — and we’re now leading the world in vaccinations.

Tha…",2616124279,sci_writer,,333,43464,,False,False,72994,,,16389,0,0.3333333333333333,0.25,positive
2021-03-11 21:41:54,1370127869054095360,"lhfang: The current global vaccination plan, approved by the drug industry, relies on voluntary deals negotiated by drug firms that own…",250996894,mjones206,Seattle born/raised/priced out,100,11937,,False,False,9829,,,14,0,0.2,0.0,neutral
2021-03-11 21:41:54,1370127868135677955,How to Find a Covid-19 Vaccine Appointment in Your Area via ⁦WIRED⁩  ,47618647,LuxuryRelations,"New York, NY",885,1186,,True,False,4386,,,0,0,0.0,0.0,neutral
2021-03-11 21:41:54,1370127868118896643,danielle_ivory: The nytimes has been tracking eligibility for the COVID vaccine on a daily basis in all 50 states. We've expanded that…,3599637021,eldeluigi,"Toronto, Ontario",587,13484,,True,False,5900,,,75,0,0.0,0.0,neutral
2021-03-11 21:41:53,1370127866935963648,"IndianEmbassyTR: Pakistan🇵🇰, the only SAARC country to not seek COVID-19 Vaccine from India, is getting 45 million 🇮🇳 made vaccine Covi…",2554523982,pradeep_248,India ,6,566,,False,False,751,,,3055,0,1.0,0.0,neutral
2021-03-11 21:41:53,1370127866457915399,danieteebee: It’s completely predictably American that the brand of COVID vaccine you have access to has now become a class signifier,1248826213411495938,WeeabooMami,J♥,63,12332,,False,False,9546,,,10902,0,0.0,0.0,neutral
2021-03-11 21:41:53,1370127866327891975,"ABCPolitics: Despite calls for national unity and bipartisanship, President Joe Biden and his top aides have declined to give the Trump…",1297606701546377219,JLB5293,"Minnesota, USA",107,5885,,False,False,3305,,,1097,0,0.5,0.5,positive
2021-03-11 21:41:53,1370127865539350531,fightbacklibby: AT 12:40 EST: Ontario vaccines pilot project AND some family docs to administer doses this weekend! libbyznaimer is…,521566458,Papasterg,"Toronto, Ontario",391,608,,False,False,422,,,3,0,0.0,0.0,neutral
2021-03-11 21:41:53,1370127865505800197,"illonaduffy: Received dissapointing news that due to the shortage of Moderna vaccines, we won't  be able to start vaccinating patients…",1347618933537464322,NeilTwomey,"Cork, Ireland.",64,2373,,False,False,1219,,,37,0,0.5,0.1875,positive
2021-03-11 21:41:53,1370127864381763584,DO NOT FEEL BAD IF YOU CAN GET A COVID VACCINE. There are so many reports of sites dumping unused vaccines &amp; that’s why GA is in very last place and why there’s so many variants. call your local pharmacies and try to get on the waiting list of unused shots at the end of the day.,276224065,lorrainezba,,222,33546,,False,False,12970,,,2,3,0.3506666666666666,0.06000000000000003,positive
2021-03-11 21:41:53,1370127864004108288,"PaulMitchell_AB: “Significant number of Ontario PSWs refuse their COVID vaccine”

They don’t want experimental gene therapy? How selfis…",601390234,humanscartissue,in the East,331,3719,,False,False,35042,,,45,0,0.6375,0.2375,positive
2021-03-11 21:41:52,1370127862389432321,CNNPolitics: BREAKING: President Biden signs his historic Covid-19 relief package into law  ,278887320,victorakinpelum,"7.2583,5.178065",1080,2094,,False,False,2595,,,441,0,0.0,0.0,neutral
2021-03-11 21:41:52,1370127860816609291,"when my province announced they'd be reopening a bunch of shit in the summer including schools in person even though we were nowhere near a vaccine yet, and encouraged folks to travel during the summer even as Indigenous communities said ""stay home, we don't want Covid"" ",1925251062,setarelven,In your mind,553,12198,,False,False,49339,,,0,0,0.6000000000000001,-0.05,negative
