created,id_str,text,user_id,screen_name,location,followers_count,user_favourites_count,time_zone,geo_enabled,verified,status_count,geo,coords,retweet_count,tweet_favourite_count,Subjectivity,Polarity,Sentiment
2021-03-11 21:40:54,1370127619698606086,"daily_trust: Denmark, Norway, Iceland suspend AstraZeneca COVID shots over bloodclot worries 
",3407508819,afifamodibbo,Nigeria,1045,240,,True,False,5540,,,11,0,0.0,0.0,neutral
2021-03-11 21:40:54,1370127619543465994,"6abc: ""The way out is vaccines"": As many people struggle to get vaccinated, Moderna has already moved ahead to booster shots.​  https:/…",191384128,ODedOnRealityTV,on your mind & in your ❤,4318,26516,,False,False,351390,,,4,0,0.5,0.5,positive
2021-03-11 21:40:54,1370127618620678150,"POTUS: One in four adults in the U.S. has received their first COVID-19 vaccine — and we’re now leading the world in vaccinations.

Tha…",749631319110549504,bluenewjersey,NJ,793,45214,,True,False,21564,,,16389,0,0.3333333333333333,0.25,positive
2021-03-11 21:40:54,1370127618180255746,The Oxford AstraZeneca vaccine has been in the spotlight today due to several cases of thrombosis after people received said vaccine; let's have a little look at the vaccine side effects 👀 ,823682948,EGalueMozo,"Exeter, England",360,29392,,False,False,18644,,,0,1,0.2916666666666667,-0.10416666666666667,negative
2021-03-11 21:40:54,1370127617785884672,"CityOfLasVegas: Food service &amp; hospitality workers in ClarkCountyNV are now eligible to receive the COVID19 vaccine 💉
 
View expanded…",91704932,allanvkatz,Lost Vegas • El Lay,3440,5867,,True,False,6518,,,22,0,0.0,0.0,neutral
2021-03-11 21:40:54,1370127617047732224,tomselliott: The best argument against getting a Covid vaccine is that George W. Bush and Bill Clinton are telling me to. ,20422072,Frisbeetarian,The Other Washington,685,115701,,False,False,48947,,,39,0,0.3,1.0,positive
2021-03-11 21:40:53,1370127613247774723,"Denmark, Norway and Iceland suspend AstraZeneca COVID shots after blood clot reports ",315062034,ingridmajer,Australia,304,3553,,False,False,51730,,,0,0,0.0,0.0,neutral
2021-03-11 21:40:53,1370127612211761154,"POTUS: One in four adults in the U.S. has received their first COVID-19 vaccine — and we’re now leading the world in vaccinations.

Tha…",14968867,RAMJAC,"Worthington, Ohio, USA",1674,43980,,False,False,134974,,,16389,0,0.3333333333333333,0.25,positive
2021-03-11 21:40:52,1370127609665892352,"guardian: Delaying second Pfizer dose leaves cancer patients at risk, say researchers ",242874600,BDBgoldens3,,4405,724193,,False,False,325029,,,37,0,0.0,0.0,neutral
2021-03-11 21:40:52,1370127609099657222,"solmamakwa: On March 1, 2021, I was invited by Sandy Lake First Nation to receive my 2nd dose of Moderna vaccine.  I was there to promo…",15206059,janfromthebruce,"Kincardine, ON",6349,181385,,True,False,115950,,,238,0,0.16666666666666666,0.125,positive
2021-03-11 21:40:51,1370127607010795521,"POTUS: One in four adults in the U.S. has received their first COVID-19 vaccine — and we’re now leading the world in vaccinations.

Tha…",893338364631367680,MaxAlexander201,"Melbourne, Victoria",132,98906,,False,False,128733,,,16389,0,0.3333333333333333,0.25,positive
2021-03-11 21:40:51,1370127606780153861,"ProKlausSchwab: From the company who knew asbestos was in their baby powder for decades and tried to cover it up for years

",852023845,VoodooCocktail,,20,1187,,False,False,1608,,,50,0,0.0,0.0,neutral
2021-03-11 21:40:50,1370127602606878729,"DrTeckKhong: Be alert to strokes, transient ischaemic attacks, coronary events and other vascular incidents in the short and intermedia…",75304637,BelindasHandbag,England,23431,42433,,False,False,288021,,,535,0,0.3375,-0.0625,negative
2021-03-11 21:40:50,1370127601285660672,"ThierryBreton: AstraZeneca vaccines delivery : I see efforts, but not “best efforts”. 

That’s not good enough yet for AstraZeneca to…",6749452,aidanodr,"Carrigaline, Co. Cork, ireland",944,465,,False,False,31568,,,242,0,0.46666666666666673,-0.2833333333333333,negative
2021-03-11 21:40:49,1370127598685200384,"GlosCCG: If you have an underlying health condition and you're eligible for the Covid-19 vaccine, you'll be contacted to arrange an app…",1289816411536330758,UbhiMala,"Cheltenham, England",111,551,,False,False,242,,,1,0,0.0,0.0,neutral
2021-03-11 21:40:48,1370127594583117831,"freetofindtruth Moderna = 70

News breaks out on the 70th day of the year",1218295990890958848,STEEZCAPS,Your Mom's House,950,7856,,False,False,12866,,,0,0,0.0,0.0,neutral
2021-03-11 21:40:48,1370127593119354886,danieteebee: It’s completely predictably American that the brand of COVID vaccine you have access to has now become a class signifier,793570477922852865,rebeccaReyes0,texas,169,48179,,False,False,44548,,,10902,0,0.0,0.0,neutral
2021-03-11 21:40:48,1370127592603406339,My momma got her COVID vaccine I’m so happy I’m gonna cry 🥺🥺🥰 ,2246660513,Kelpie_c,The Ohio State University,563,21398,,False,False,11863,,,0,9,1.0,0.8,positive
2021-03-11 21:40:48,1370127592372768771,"NBCNews: BREAKING: President Biden signs $1.9T Covid relief bill into law; ​includes $1,400 checks, $300/wk jobless benefits, child all…",253768096,joshmhicksmedia,"Chicago, IL",801,79172,,True,False,43290,,,2364,0,0.0,0.0,neutral
2021-03-11 21:40:48,1370127592351731712,One down....one more to go Moderna COVID19Vaccine GetVaccinated ,2341312482,marissamsaucedo,"Hebbronville, TX",81,17489,,True,False,1696,,,0,0,0.5,0.5,positive
2021-03-11 21:40:48,1370127592263671824,"ReutersScience: Health authorities in Denmark, Norway and Iceland suspended the use of AstraZeneca’s COVID-19 vaccine shots following r…",1553711358,angrypixiehead,Ireland,540,5833,,False,False,6843,,,319,0,0.1,0.0,neutral
2021-03-11 21:40:47,1370127589801553923,"GreatGameIndia: THIS IS BIG

8 European nations including Italy, Latvia, Luxembourg, Lithuania, Estonia, Denmark, Norway and Iceland ha…",712684799513665536,Boofyre,"Arizona, USA",1439,145700,,False,False,105435,,,793,0,0.05,0.0,neutral
2021-03-11 21:40:47,1370127589109547009,"TheRealSANARA: Denmark, Estonia, Lithuania, Luxembourg, Latvia suspend AstraZeneca Covid vaccine after reports of potentially fatal blo…",262222003,astrolab0123,,761,79669,,True,False,67563,,,2,0,1.0,0.0,neutral
2021-03-11 21:40:47,1370127588925042688,"POTUS: One in four adults in the U.S. has received their first COVID-19 vaccine — and we’re now leading the world in vaccinations.

Tha…",2315920974,taoteg,ATX,136,10823,,True,False,9600,,,16389,0,0.3333333333333333,0.25,positive
2021-03-11 21:40:47,1370127588857937923,Utah mom dies days after receiving second dose of Moderna vaccine  via MailOnline,1261707629547655177,a_cohick,Florida,3105,9805,,False,False,21772,,,0,1,0.0,0.0,neutral
2021-03-11 21:40:46,1370127585913495553,"If I've had Covid, why do I need the vaccine??",1272751817848389632,confidentlyrght,"Texas, USA",1718,27759,,False,False,1175,,,0,0,0.0,0.0,neutral
2021-03-11 21:40:46,1370127585217220615,"EdwardTHardy: Barack Obama, George W. Bush, Bill Clinton and Jimmy Carter took part in an ad campaign to convince the public to get the…",2250802990,JoeTaylor388,,24,5304,,False,False,786,,,91,0,0.06666666666666667,0.0,neutral
2021-03-11 21:40:46,1370127584873308167,"AndrewMakeTweet: Pfizer FreeTheVaccine PeoplesVaccine protest in NYC

With actions globally, we demand an end to false scarcity and v…",824472713066643457,ceaspoon,,146,65038,,False,False,14106,,,79,0,0.3,-0.20000000000000004,negative
2021-03-11 21:40:46,1370127584223129601,"jgbrown247_john: All living Presidents (except 45) advising to get Covid-19 vaccine.
Any surprise that 45 didn't even though he and M…",2596467289,tx_resister,"Colorado, USA",3600,32969,,True,False,7200,,,5,0,0.0,0.0,neutral
2021-03-11 21:40:46,1370127583166095361,LasVegasLocally: Casino and hospitality workers are eligible to get the covid-19 vaccine in Nevada. Finally.,1132811523795984384,JeanNix7,Nevada,2951,85971,,False,False,70986,,,229,0,1.0,0.0,neutral
2021-03-11 21:40:46,1370127583048830983,abdool_moh: Talking about COVID vaccine when about 70% of your population don’t even believe the virus exist.,884034137585319936,UmmasalmaBarka,Look closely,447,5598,,False,False,10544,,,25,0,0.0,0.0,neutral
2021-03-11 21:40:46,1370127582650318850,KmSmmns: Hey Maine Media - -hope you'll ask nirav_mainecdc  and GovJanetMills about this rejection of age-based tracks without other…,70868735,gimbaled,Occupied Abenaki Territory,132,41646,,True,False,4559,,,2,0,0.0,0.0,neutral
2021-03-11 21:40:45,1370127582012841984,"""No aborted fetal tissue please!"" 
Kill patriarchy, please. 
",898176616270114817,AuntieAlias1,"Winnipeg, Manitoba",513,80211,,False,False,16885,,,0,1,0.0,0.0,neutral
2021-03-11 21:40:45,1370127578552483846,JustTheNews: Utah woman dies after taking second dose of COVID vaccine  JustTheNews landon_mion,764860336667320320,steyrshoney1,,8498,78451,,False,False,140390,,,34,0,0.0,0.0,neutral
2021-03-11 21:40:45,1370127578086961154,"FinancialTimes: The EU has warned that it may not get enough supplies from AstraZeneca in the first quarter, another blow to the bloc's…",955235007299293191,TaylorKirsch1,United States,48,3488,,True,False,12947,,,22,0,0.41666666666666663,0.125,positive
2021-03-11 21:40:44,1370127574526001152,__udontknow MikeCurkov CBS58 He sets an example for others and should follow the recommendation of the CDC and they are recommending a vaccine even if you have had Covid.,41943663,caryg44,,94,3699,,False,False,1162,,,0,0,0.0,0.0,neutral
2021-03-11 21:40:43,1370127572646780929,BishopCEBlake: FREE COVID-19 VACCINE CLINIC ON SUNDAY MARCH 14 – Sign Up Today at  ,1003144091771650048,VeazieRon,"Los Angeles, CA",104,576,,False,False,4258,,,4,0,0.8,0.4,positive
2021-03-11 21:40:43,1370127571296399367,"dinero995 Naija_PR dino_melaye The good thing about Astrazeneca which makes it better suited for Africa is because it can be moved &amp; stored at normal refrigerated conditions for up to 6 months unlike the Pfizer's which needs specialized freezers. Even moderna needs -4C to last 6 months.
No vex me tonight ooo",152316312,daemperor007,On the Almighty's radar.,1204,3599,,False,False,20838,,,0,0,0.45416666666666666,0.33749999999999997,positive
2021-03-11 21:40:43,1370127569736105990,LinaHidalgoTX: NEW: Starting MONDAY we'll be able to vaccinate people over 50 years old. If you haven't signed up for our COVID vaccin…,2685960793,ConnieAssiff,"Houston, TX",952,30381,,True,False,9860,,,293,0,0.34488636363636366,0.18409090909090908,positive
2021-03-11 21:40:42,1370127569371160576,"MichelleObama: When you can get the COVID-19 vaccine, I hope you do—Barack and I are certainly glad we did. It’s our best shot at beati…",1303709783808122880,ThruThinking,,154,10373,,False,False,7524,,,8338,0,0.65,0.75,positive
2021-03-11 21:40:42,1370127568360329219,"switchtvkenya: COVID-19 VACCINE UPDATE
Kenya receives 100,000 doses of AstraZeneca Covid-19 Vaccine as a donation by the Indian Governm…",3693771075,nyanchamamakori,Nakuru ,875,3062,,True,False,988,,,4,0,0.0,0.0,neutral
2021-03-11 21:40:41,1370127565134893063,"ReutersScience: Health authorities in Denmark, Norway and Iceland suspended the use of AstraZeneca’s COVID-19 vaccine shots following r…",1348720717748187139,BJamma3,,84,9863,,False,False,10259,,,319,0,0.1,0.0,neutral
2021-03-11 21:40:41,1370127562064588805,"POTUS: One in four adults in the U.S. has received their first COVID-19 vaccine — and we’re now leading the world in vaccinations.

Tha…",45954587,Jardinpotager,"Oakland, CA",799,30165,,True,False,25230,,,16389,0,0.3333333333333333,0.25,positive
2021-03-11 21:40:40,1370127560743391236,"Finland Had a Patent-Free COVID-19 Vaccine Nine Months Ago — But Still Went With BigPharma 
COVID19 VaccinesForAll ",1184875318001258496,FordPrefect747,Southeastern U.S.,456,30847,,False,False,33404,,,0,0,0.0,0.0,neutral
2021-03-11 21:40:40,1370127560693141506,noahpattillo RonnieLauth I felt like shit after my first pfizer dose,15383279,KayleighJacobs,New York,160,11656,,True,False,14057,,,0,1,0.5666666666666667,0.024999999999999994,positive
2021-03-11 21:40:40,1370127560584040448,"kayleighmcenany: FINALLY the Biden admin recognizes the Trump admin’s unprecedented vaccine work:

➡️ “We’re grateful for the work that…",1286998155603501059,to_sapporo,札幌,64,2970,,False,False,1990,,,4626,0,0.95,0.3,positive
2021-03-11 21:40:40,1370127559585792001,"HamillHimself: Statement by the Twice Impeached Former Guy

I hope everyone remembers when they're getting the COVID-19 (often referred…",788230062625525760,mudlarkmoment,Australia,145,23008,,False,False,7260,,,1016,0,0.0,0.0,neutral
2021-03-11 21:40:40,1370127558361165832,Here's who is eligible for a COVID-19 vaccine shot at Ontario pharmacies  via cp24,275264485,newfieghost,,4,89,,False,False,607,,,0,0,0.0,0.0,neutral
2021-03-11 21:40:39,1370127556532441088,"POTUS: One in four adults in the U.S. has received their first COVID-19 vaccine — and we’re now leading the world in vaccinations.

Tha…",595093158,manumarquez1986,"Puerto Rico, Houston, TX",383,114819,,False,False,40651,,,16389,0,0.3333333333333333,0.25,positive
2021-03-11 21:40:39,1370127554728894466,"BFujer Despite popular belief, yes you do have a choice.
My Mum has underlying health conditions so Pfizer was a worry to her. She was told that she would go back on the waiting list and get the Astra Zeneca vaccine when it becomes available. Less than a week later she got the AZ 💉",50800853,mah0n3y,"District 13, Panem ",5914,101229,,False,False,64408,,,1,4,0.2733333333333333,0.16666666666666669,positive
2021-03-11 21:40:39,1370127553667637249,"I just got my first dose of Pfizer. Overwhelming to think of how many people contributed to this amazing accomplishment, and how many should still be here to receive it too.",16674657,corybee,"Long Beach, CA",96,10146,,False,False,1340,,,0,1,0.6466666666666667,0.47000000000000003,positive
2021-03-11 21:40:38,1370127549221703686,waiting to find out if I’m getting Moderna or Pfizer tomorrow has me feeling like an Alabama freshman waiting to see if she gets a bid from Zeta or KD (which she will inevitably get kicked out from either by junior year),78036895,TheRealKatPat,"Morristown, NJ",4612,61844,,True,False,35112,,,0,39,1.0,0.0,neutral
2021-03-11 21:40:37,1370127546528976901,The European Medicines Agency recommended granting a conditional marketing authorisation for the single dose Johnson&amp;Johnson COVID-19 vaccine. ,1265640302,SasTatomir,Europe 🇪🇺,147,4163,,False,False,5100,,,0,0,0.10714285714285714,-0.03571428571428571,negative
2021-03-11 21:40:37,1370127544926810124,"CzypionkaThomas: AstraZeneca 
Please keep cool! The normal annual incidence of venous thrombembolism is  over 100/100,000 people, and…",275498007,cheng_christine,London & Toronto,7656,25022,,False,True,24800,,,74,0,0.6499999999999999,0.29375,positive
2021-03-11 21:40:37,1370127544591220749,rochelleriley: DETROIT _ People don't always give Detroit its due. But after having so many people tell me directly how proud they are…,760035463,samisosaslay,A2 | Ttown | DET | DC,178,48053,,True,False,11241,,,74,0,0.56875,0.31875,positive
2021-03-11 21:40:36,1370127541818785793,"DinaPomeranz: Daily Covid vaccinations:

Chile has now overtaken Israel, US has overtaken UK &amp; Germany is now faster than Switzerland.…",43332430,strghtforward,Switzerland,289,42294,,False,False,30341,,,19,0,0.0,0.0,neutral
2021-03-11 21:40:35,1370127540149440515,"NC_Governor: Gov. Cooper announced that thanks to the hard work of providers, NC will be moving forward in its phased vaccination proce…",632400780,PS1NC,North Carolina,5903,1113,,True,False,12903,,,187,0,0.37083333333333335,-0.04583333333333334,negative
2021-03-11 21:40:35,1370127539436421125,Denmark suspends Astra Zeneca. We in Canada are using it.,278608229,shankersetharam,Toronto,84,124,,True,False,426,,,0,0,0.0,0.0,neutral
2021-03-11 21:40:35,1370127537326718978,"🚨 COVID-19 vaccination: Does the Covid-19 vaccine affect fertility? 🚨⁠

SolentNHSTrust has put together a list of some of the most frequently asked questions about vaccination.

Is your question on their list?  ",797980224759754752,OurVersionMedia,"Southampton, England",202,231,,False,False,405,,,1,2,0.4,0.3,positive
2021-03-11 21:40:34,1370127533006487555,I got my COVID-19 vaccine ,4894608968,fire_fungus,"Vista, CA",2,5,,False,False,48,,,0,0,0.0,0.0,neutral
2021-03-11 21:40:33,1370127530682773505,"NBCNews: BREAKING: President Biden signs $1.9T Covid relief bill into law; ​includes $1,400 checks, $300/wk jobless benefits, child all…",1346955542397214722,Jimmy30222908,,89,4014,,False,False,15019,,,2364,0,0.0,0.0,neutral
2021-03-11 21:40:33,1370127529646772226,"TomiLahren: If you need an ID to get a Covid vaccine, why the hell shouldn’t you need an ID to vote?!! LiberalismIsAMentalDisorder",4862333017,Hillbillydeau,North Vancouver,31,1863,,False,False,409,,,2339,0,0.0,0.0,neutral
2021-03-11 21:40:32,1370127526975176708,"MichelleObama: When you can get the COVID-19 vaccine, I hope you do—Barack and I are certainly glad we did. It’s our best shot at beati…",2749209315,pat_scharmberg,"Oakhurst, NJ",2206,75327,,True,False,163797,,,8338,0,0.65,0.75,positive
2021-03-11 21:40:32,1370127526706692096,"POTUS: One in four adults in the U.S. has received their first COVID-19 vaccine — and we’re now leading the world in vaccinations.

Tha…",23072931,RebeccaOnFOX7,"Austin, TX",10792,8358,,False,True,51604,,,16389,0,0.3333333333333333,0.25,positive
2021-03-11 21:40:32,1370127526455033864,ejthies15: Today marks one year since I’ve been sheltering at home. The 15th is my Covid anniversary. I rarely if ever go anywhere beca…,2220351079,chimmiechoo,,202,31179,,False,False,67569,,,2,0,0.9,0.3,positive
2021-03-11 21:40:32,1370127525419044865,danielle_ivory: The nytimes has been tracking eligibility for the COVID vaccine on a daily basis in all 50 states. We've expanded that…,858201,kitson,"New York, NY",6621,42233,,True,False,128132,,,75,0,0.0,0.0,neutral
2021-03-11 21:40:32,1370127525305753602,mariamainmo: Girls don't want boys. They want the covid vaccine and a nice apartment,901277481969307648,Rachistrashh,"San Antonio, TX",810,174153,,True,False,37801,,,25247,0,1.0,0.6,positive
2021-03-11 21:40:32,1370127525054181378,"HamillHimself: Statement by the Twice Impeached Former Guy

I hope everyone remembers when they're getting the COVID-19 (often referred…",978709902,ZacharyWysk,,20,14215,,False,False,2010,,,1016,0,0.0,0.0,neutral
2021-03-11 21:40:32,1370127524987031555,"MichelleObama: When you can get the COVID-19 vaccine, I hope you do—Barack and I are certainly glad we did. It’s our best shot at beati…",634259236,billieultimajo,On the way BTS paved,416,308542,,False,False,246008,,,8338,0,0.65,0.75,positive
2021-03-11 21:40:32,1370127524772995072,disclosetv: JUST IN - Norway and Denmark suspend Oxford-AstraZeneca COVID19 vaccine rollout.,712684799513665536,Boofyre,"Arizona, USA",1439,145700,,False,False,105435,,,2589,0,0.0,0.0,neutral
2021-03-11 21:40:32,1370127524580106243,"NewsBFM: 1. Kelantan police have identified several of their personnel who refused to take a Covid-19 vaccine, via the letter of consen…",1092989101928673280,Sariahdanial,Malaysia,145,2692,,False,False,14630,,,16,0,0.0,0.0,neutral
2021-03-11 21:40:32,1370127524542435328,"POTUS: One in four adults in the U.S. has received their first COVID-19 vaccine — and we’re now leading the world in vaccinations.

Tha…",246119411,TopDonn,Chicago. Nairobi. ,1344,4752,,True,False,24496,,,16389,0,0.3333333333333333,0.25,positive
2021-03-11 21:40:32,1370127523867062272,"davidkurten: Seven European countries suspend use of Astra Zeneca Covid vaccine after blood clot deaths.
I will not be taking a 'Covid…",1034669863883694080,PimmJulie,"Sunshine Coast, Queensland",60,15797,,False,False,12883,,,835,0,0.0,0.0,neutral
2021-03-11 21:40:31,1370127521488850946,"ABCPolitics: Despite calls for national unity and bipartisanship, President Joe Biden and his top aides have declined to give the Trump…",513396024,Rebel_Mike,,1777,100658,,True,False,68330,,,1097,0,0.5,0.5,positive
2021-03-11 21:40:31,1370127519702253568,WomanistWifeist: Reminder that if your BMI is greater than or equal to 30 you can get ahead of the line on the covid vaccine priority l…,909144648937074688,femoninetails,Milf Creek,608,34323,,False,False,16136,,,3,0,0.375,0.25,positive
2021-03-11 21:40:31,1370127519530299395,"uofg: The UofG COVID-19 vaccination clinic opens on March 15 and will run through August. 

The clinic will be able to vaccinate up to…",729677023849775104,RachelAdelson,,111,237,,False,False,4777,,,46,0,0.625,0.5,positive
2021-03-11 21:40:30,1370127519031169027,JamaicaGleaner: The Jamaican Government will accept responsibility in the unlikely event that a citizen requires additional support as…,23836044,ScottRobinsonJA,Jamaica,330,2876,,True,False,18016,,,16,0,0.5,-0.5,negative
2021-03-11 21:40:30,1370127518624190464,Feds to fund over 100 new COVID-19 vaccine sites in New York: Schumer - New York Post ,1097591937165516800,O19928734,,288,38901,,True,False,83835,,,0,0,0.45454545454545453,0.13636363636363635,positive
2021-03-11 21:40:30,1370127516418121730,"danieteebee: Anyway this is a good explainer of the vaccine apartheid, South Africa is among many other nations being hit hard by the W…",78135684,Tenji95,Amerikkka (Talwa-Posa),2253,898890,,False,False,769295,,,20,0,0.5041666666666667,0.1958333333333333,positive
2021-03-11 21:40:30,1370127515973419009,mymixtapez: President Joe Biden signed the $1.9 trillion COVID-19 relief bill into law. The bill clears the way for $1400 stimulus chec…,104378150,3RDCaptain_24,"Seattle, WA",319,18633,,True,False,21120,,,71,0,0.0,0.0,neutral
2021-03-11 21:40:29,1370127514438406144,Reuters: Novavax shares were up more than 15% after announcing its COVID vaccine's efficacy data  $NVAX,3731531482,8erpentineskies,"Connecticut, USA",591,277030,,True,False,110348,,,32,0,0.5,0.5,positive
2021-03-11 21:40:29,1370127514010578951,"TIME: 1/ As the U.S. began to roll out COVID-19 vaccines, disparities emerged that aggravated the inequities that have made the pandemi…",827626969072287744,Anna_Speaks_Out,United States,232,24481,,False,False,3546,,,20,0,0.0,0.0,neutral
2021-03-11 21:40:29,1370127513871998978,dockaurG: Now 18 states in US alone &amp; growing. How do govts explain existence of 🌎jurisdictions that ended lockdowns/restrictions even…,1159399227757383681,Citizen23259866,,185,4633,,False,False,19488,,,796,0,0.0,0.0,neutral
2021-03-11 21:40:29,1370127513469456386,"""Mississauga Mayor Bonnie Crombie says she feels let down that Peel Region will not be part of a provincial pilot project in which select pharmacies in three Ontario cities will distribute the AstraZeneca COVID-19 vaccine to those in their early 60s.""

",1137008161,RPIConsultingGr,"Toronto, Canada",215,170,,False,False,2725,,,0,0,0.29444444444444445,-0.02777777777777779,negative
2021-03-11 21:40:29,1370127511820980224,"Fraserhealth: Spread the word to the seniors in your life! Seniors 85 and older, Indigenous individuals 65 and older and Indigenous Eld…",1271987860577517568,Linettehoneybee,🇨🇦,170,20938,,False,False,9800,,,21,0,0.3333333333333333,0.16666666666666666,positive
2021-03-11 21:40:28,1370127509992407041,BillCon25933243 Part 2 my 93 year old folks had Pfizer as well with zero side effects or weirdness with either shot.  It was emotional for me when I got mine. Go forth and rejoice.,248466438,kc_birder,,371,46515,,True,False,17128,,,0,0,0.42500000000000004,0.05,positive
2021-03-11 21:40:28,1370127508591415298,"POTUS: One in four adults in the U.S. has received their first COVID-19 vaccine — and we’re now leading the world in vaccinations.

Tha…",2802943930,xxladylolitaxx,"San Jose, CA",320,39493,,False,False,16126,,,16389,0,0.3333333333333333,0.25,positive
2021-03-11 21:40:28,1370127507794534402,"r2rnow: mRNA vaccines were the first to be approved for COVID19, but they require ultra-cold storage to stay intact. This made-in-Can…",2253883890,AlbertaScience,"Alberta, Canada",1753,1762,,False,False,28176,,,5,0,0.3333333333333333,0.25,positive
2021-03-11 21:40:28,1370127507450593281,"Previously, Dr Henry talked about ‘“miraculous"" protection of at least 90 per cent from the first dose of the Pfizer-BioNTech and Moderna vaccines”. So it’s dropped 10%?
 ",2339733614,LaceyLaceyp,"Vancouver, Canada",460,40339,,False,False,70448,,,3,9,0.3,-0.07222222222222223,negative
2021-03-11 21:40:28,1370127506775236609,"kayleighmcenany: FINALLY the Biden admin recognizes the Trump admin’s unprecedented vaccine work:

➡️ “We’re grateful for the work that…",1341008021795696640,malajisi10,,28,5862,,False,False,5463,,,4626,0,0.95,0.3,positive
2021-03-11 21:40:28,1370127506737627143,"MayoClinicGIHep: For IBD patients on biologics, our experts recommend they get the COVID (SARS-CoV-2) vaccine, in any current formulat…",1152434922,PashaShabanaMD,,1072,1767,,False,False,895,,,16,0,0.4,0.0,neutral
2021-03-11 21:40:27,1370127504833449990,"MichelleObama: When you can get the COVID-19 vaccine, I hope you do—Barack and I are certainly glad we did. It’s our best shot at beati…",957400340361461760,DLJordan90,United States,388,7899,,False,False,3108,,,8338,0,0.65,0.75,positive
2021-03-11 21:40:26,1370127502400757760,"McDanielJustine: PA has started vaccinating teachers, with excitement in the Philly suburbs today. ""Getting us back in the classroom wi…",1254839822411276298,DelawareCOVID,Delaware,251,1,,False,False,17596,,,1,0,0.0,0.0,neutral
