created,id_str,text,user_id,screen_name,location,followers_count,user_favourites_count,time_zone,geo_enabled,verified,status_count,geo,coords,retweet_count,tweet_favourite_count,Subjectivity,Polarity,Sentiment
2021-03-11 21:39:37,1370127296414289921,"BarackObama: Michelle and I got vaccinated against COVID-19 because we know it’s the best way to beat this pandemic, protect one anothe…",1109585535184470016,_lifechangesnow,"Houston, TX",5,157,,False,False,237,,,10285,0,0.3,1.0,positive
2021-03-11 21:39:37,1370127296279896069,"Noahpinion: Huge win for vaccines here. 

Remember, Israel has a lot of COVID variants going around, including the scary South Africa v…",381592902,RogueWPA,,9052,32282,,True,False,2525,,,185,0,0.7666666666666666,0.2333333333333334,positive
2021-03-11 21:39:37,1370127294862258180,"MichelleObama: When you can get the COVID-19 vaccine, I hope you do—Barack and I are certainly glad we did. It’s our best shot at beati…",324202331,caritademelon,DFW,21,967,,True,False,559,,,8338,0,0.65,0.75,positive
2021-03-11 21:39:37,1370127293499076608,creativecatjk: Scotty doesn't feel like covid killed off enough of the poor and elderly so he's holding back with the vaccine program u…,1354663592239329282,ThomsWizard,Antarctica,18,383,,False,False,923,,,4,0,0.275,-0.15000000000000002,negative
2021-03-11 21:39:36,1370127291037143042,"LisasEyeRoll: AstraZeneca on hold due to blood clots from one patient 

Birth control pill: hold my beer",236367548,maryhopppins,Austria,1122,183533,,False,False,30084,,,731,0,0.375,-0.125,negative
2021-03-11 21:39:36,1370127290890326023,ThierryBreton AstraZeneca AstraZenaca in tribunal fast if not meet Q1 obligations!,1310953087562133506,Tesla__89,,31,9150,,False,False,1708,,,0,0,0.6,0.25,positive
2021-03-11 21:39:36,1370127289766191105,"Pfizer/BioNTech Data Suggests Vaccine 94% Effective Preventing Asymptomatic Infection

If they would prove their COVID19 vaccine is safe &amp; effective in children &amp; teenagers then we could be be on our way to end this pandemic🤗

$PFE $BNTX $MRNA $JNJ

",1233901069366771712,CoronaStocks,,532,2685,,False,False,3184,,,0,1,0.7000000000000001,0.5666666666666668,positive
2021-03-11 21:39:36,1370127289225216007,"BarackObama: Michelle and I got vaccinated against COVID-19 because we know it’s the best way to beat this pandemic, protect one anothe…",976779709420920833,mendels_chris,"Grand Haven, MI",53,16,,False,False,5945,,,10285,0,0.3,1.0,positive
2021-03-11 21:39:36,1370127289212661760,"propeertys: ‼️ 8 European nations including Italy, Latvia, Luxembourg, Lithuania, Estonia, Denmark, Norway and Iceland have decided to…",809833498760638465,maciej_joker,,359,8163,,False,False,1963,,,4,0,0.0,0.0,neutral
2021-03-11 21:39:36,1370127289011343362,"CocoRosesalvia: ""Austria, Estonia, Latvia, Lithuania and Luxembourg have halted use of the batch""
""Denmark, Norway and Iceland went fur…",896823706831466498,joshuamills044,,172,26447,,True,False,39356,,,6,0,0.0,0.0,neutral
2021-03-11 21:39:36,1370127288860254210,AHS_media: Lori Jones was one of the first Calgarians to receive the Covishield/AstraZeneca vaccine this morning. She says she knows sh…,1186522951,LScotvold,"Calgary, Alberta",55,2187,,True,False,372,,,4,0,0.3333333333333333,0.25,positive
2021-03-11 21:39:36,1370127288713408515,mariamainmo: Girls don't want boys. They want the covid vaccine and a nice apartment,1224162640383107072,tr0mb0nafide,the cac,72,5223,,False,False,207,,,25247,0,1.0,0.6,positive
2021-03-11 21:39:36,1370127288650637314,bmj_latest: Denmark has temporarily suspended use of the Oxford-AstraZeneca covid-19 vaccine as a precautionary move after reports of b…,1248955422364569600,medjourno1,,24,306,,False,False,88,,,82,0,0.0,0.0,neutral
2021-03-11 21:39:35,1370127286939312131,castlvillageman: The Irish Taoiseach has a meeting with the CEO of Astra Zeneca to advise of legal proceeding due to 10% of contractual…,84580374,peterandann,A place in the rain. Europe,1430,382193,,False,False,260861,,,14,0,0.19166666666666665,0.025000000000000005,positive
2021-03-11 21:39:34,1370127284347211783,"KatyTurNBC: One year of COVID. 
Seven months pregnant. 
First shot of Pfizer.",2933793124,kenkircher1,Just out of Sorts,1979,14877,,True,False,914905,,,455,0,0.41666666666666663,0.29166666666666663,positive
2021-03-11 21:39:34,1370127283961229315,"m_scribe: Breaking: Novavax announces efficacy results in its vaccine trials.

* 100% protection against severe disease
* 96% effective…",220706863,lydiakiesling,PDX,10594,57069,,False,False,14898,,,692,0,0.0,0.0,neutral
2021-03-11 21:39:34,1370127283890061312,consent_factory: “I’m here today to tell you that we are actually hacking the software of life ... we think of it as information therap…,1363861042355441665,JunkieVaccine,,67,2878,,False,False,1296,,,120,0,0.1,0.0,neutral
2021-03-11 21:39:34,1370127281914515458,"MichelleObama: When you can get the COVID-19 vaccine, I hope you do—Barack and I are certainly glad we did. It’s our best shot at beati…",27918995,shaybow,Detroit,118,3937,,True,False,3736,,,8338,0,0.65,0.75,positive
2021-03-11 21:39:34,1370127280878551042,"MSNBC: BREAKING: President Biden signs $1.9T Covid relief bill into law; ​includes $1,400 checks, $300/wk jobless benefits, child allow…",2461814936,MaggieSheehan55,,53,45385,,False,False,48889,,,353,0,0.0,0.0,neutral
2021-03-11 21:39:33,1370127279880167424,"DREDF: ONLINE EVENT: Please join DREDF Fri, March 12 from 12-12:45 pm PST for our new series of weekly Q&amp;A sessions on Disability &amp; …",928529840126402562,SarahBelleLin,,4172,13310,,False,False,6136,,,3,0,0.45454545454545453,0.13636363636363635,positive
2021-03-11 21:39:33,1370127279263780868,"Eligible Ontarians are standing in lines, making calls and going online to snap up COVID-19 vaccine appointments as a pilot project offering shots in pharmacies picks up steam. 

",1277803562387615744,TheBenchNews,,134,51,,False,False,878,,,0,0,0.0,0.0,neutral
2021-03-11 21:39:33,1370127278701735936,"kayleighmcenany: FINALLY the Biden admin recognizes the Trump admin’s unprecedented vaccine work:

➡️ “We’re grateful for the work that…",865707303244369923,SteveAddison60,"Winfield, al",36,14777,,False,False,13572,,,4626,0,0.95,0.3,positive
2021-03-11 21:39:33,1370127278433300491,CiCiAdams_: Anti-vaxxer Robert Kennedy Jr. &amp; friends have released a doc using the country's history of medical racism to target Black…,4813940424,DesPSmith,"Dallas, TX",379,7752,,True,False,32624,,,49,0,0.0,0.0,neutral
2021-03-11 21:39:33,1370127278198288384,"POTUS: One in four adults in the U.S. has received their first COVID-19 vaccine — and we’re now leading the world in vaccinations.

Tha…",823373421644021760,TheBadNewsB,"Florida, USA",3494,61754,,False,False,53531,,,16389,0,0.3333333333333333,0.25,positive
2021-03-11 21:39:33,1370127277644685315,OceanCityDental: EU Approves J&amp;J Single-Shot Covid-19 Vaccine As The Bloc’s Vaccination Crisis Rumbles On ,2598235651,AST_LTD,Better Sleep. Better Health.,1431,18,,False,False,7053,,,4,0,0.0,0.0,neutral
2021-03-11 21:39:33,1370127277611216897,Pfizer vaccine found highly effective at preventing infection in real-world study ,23948496,8NEWS,"Richmond, Virginia",102120,7274,,True,True,180724,,,2,3,0.8,0.6,positive
2021-03-11 21:39:33,1370127277376172034,"VietnamNewsVNS: Vietnam announces COVID-19 vaccine delivery dates, warns of scams 

 ",2610835120,CornejoErnest,"North Las Vegas, NV",34,1370,,True,False,1376,,,6,0,0.0,0.0,neutral
2021-03-11 21:39:33,1370127277040791556,"roccogalatilaw I have the creeping suspicion the AZ concoction is a designated ""straw man"" - it is so bad it makes the likes of Moderna or Pfizer look good. They want to make you feel grateful you're not getting the poison in a vial A, but rather the one in vial B. Feeling lucky yet?",1284439885189910528,VachonMarc4,,2,25,,False,False,36,,,5,15,0.7000000000000001,0.11111111111111115,positive
2021-03-11 21:39:33,1370127276487045122,OceanCityDental: New Study Using Live Virus Explores Whether Pfizer-BioNTech Vaccine Protects Against Variants ,2598235651,AST_LTD,Better Sleep. Better Health.,1431,18,,False,False,7053,,,4,0,0.4772727272727273,0.13636363636363635,positive
2021-03-11 21:39:32,1370127273140051968,TheICIR: COVID-19: European countries suspend AstraZeneca vaccine over blood clot death fears | The ICIR ,2861582218,OdinakaAnudu,Nigeria,452,4724,,False,False,4163,,,7,0,0.0,0.0,neutral
2021-03-11 21:39:32,1370127272670326785,"BradAdamston maddow Pfizer did not join your group they came up with theirs first  on their own. Your crime was politicizing it and costing hundreds of thousands unnecessary deaths, may God have mercy on you even as you had none for others.",1294356447074160645,GailNason1,,0,139,,False,False,47,,,0,1,0.7444444444444445,0.15,positive
2021-03-11 21:39:31,1370127271772762112,"conradjwilson: Oregon’s prisons have offered a vaccine to every inmate in custody, some 13,000 people in all. Attorneys representing Or…",2289763826,tigerpoland95,"Salt Lake City, UT",160,14099,,False,False,3925,,,211,0,0.0,0.0,neutral
2021-03-11 21:39:31,1370127271764369414,"MichelleObama: When you can get the COVID-19 vaccine, I hope you do—Barack and I are certainly glad we did. It’s our best shot at beati…",1167089229240971264,Brittan84613360,"Sicklerville, NJ ",539,48185,,True,False,34025,,,8338,0,0.65,0.75,positive
2021-03-11 21:39:31,1370127271441408006,"NBCNews: BREAKING: President Biden signs $1.9T Covid relief bill into law; ​includes $1,400 checks, $300/wk jobless benefits, child all…",69768996,ZenMobius,Not Mixer,71,4040,,False,False,72739,,,2364,0,0.0,0.0,neutral
2021-03-11 21:39:31,1370127269990178824,"POTUS: One in four adults in the U.S. has received their first COVID-19 vaccine — and we’re now leading the world in vaccinations.

Tha…",333391147,LittleBlkDres,,1459,75150,,False,False,22109,,,16389,0,0.3333333333333333,0.25,positive
2021-03-11 21:39:31,1370127269235195904,"MacCerullo: Not going to lie, this pandemic anniversary has been something else. This morning the doctors finally let me sit in on my w…",1528686678,LeslieMurrayles,United States,347,1458,,False,False,7544,,,3,0,1.0,0.0,neutral
2021-03-11 21:39:31,1370127269063229440,"donkamion78: Utah woman, 39, dies 4 days after 2nd dose of COVID Moderna vaccine ",2586122233,Gene137,"Millau, France (12)",226,18826,,False,False,8910,,,187,0,0.0,0.0,neutral
2021-03-11 21:39:31,1370127268249444359,"kayleighmcenany: FINALLY the Biden admin recognizes the Trump admin’s unprecedented vaccine work:

➡️ “We’re grateful for the work that…",1246605566220234753,maggie31317905,,18,14683,,False,False,14256,,,4626,0,0.95,0.3,positive
2021-03-11 21:39:31,1370127267892924418,"ellymelly: This is why you do proper, extensive, long-term trials before unleashing vaccinations on the general public who are not prop…",735789527348846592,FeeRedfern,Big Country,314,10215,,False,False,19336,,,87,0,0.25,0.012500000000000004,positive
2021-03-11 21:39:30,1370127264944418816,danieteebee: It’s completely predictably American that the brand of COVID vaccine you have access to has now become a class signifier,928398903980036097,tanakajelly,eng/kor/esp • mixed latino ,1681,203192,,False,False,59243,,,10902,0,0.0,0.0,neutral
2021-03-11 21:39:29,1370127261383426049,"Young mother dies after receiving second dose of Moderna vaccine. Utah, USA.

""They did a blood test and said her liver was not functioning"" 

Vaccine Adverse Event Reporting System VAERS USA.

COVIDVaccination covidvaccine Modernavaccine

",1346145679845044229,antivaxdazza,Shropshire UK,23,148,,False,False,269,,,2,1,0.2,0.05,positive
2021-03-11 21:39:29,1370127261245046784,"WISN_Caroline: If you are a Wisconsin resident with any of the medical conditions on this list, you are eligible for the COVID-19 vacci…",29873795,TimKidwell,Wisconsin,320,2560,,False,False,12004,,,35,0,0.0,0.0,neutral
2021-03-11 21:39:29,1370127259978366979,EricMMatheny: Are we going to talk about the healthy 39 year old woman from Utah who got her second dose of the Moderna vaccine and the…,3735016395,GiudyttaCortona,"Spoleto, Umbria",89,14875,,False,False,9380,,,2919,0,0.2333333333333333,0.19999999999999998,positive
2021-03-11 21:39:28,1370127259160428551,HighWireTalk: VACCINE DISASTER AHEAD  CDC Spin on New Mask Data; Celebrity Catches Fauci Lying!; Expert Warns of Coming Covid Vaccine D…,552725069,ChamberDisciple,,234,89797,,False,False,19186,,,628,0,0.45454545454545453,0.17045454545454544,positive
2021-03-11 21:39:28,1370127258325819394,"DinaPomeranz: Daily Covid vaccinations:

Chile has now overtaken Israel, US has overtaken UK &amp; Germany is now faster than Switzerland.…",39935216,tyentzen,"Ann Arbor, MI",448,5490,,False,False,2558,,,19,0,0.0,0.0,neutral
2021-03-11 21:39:28,1370127257071714306,ronozer: Pfizer/BioNTech say data suggests vaccine 94% effective in preventing asymptomatic infection  via Yaho…,3253931080,skomoruchar,"Delaware, USA",304,67679,,False,False,51612,,,1,0,0.8,0.6,positive
2021-03-11 21:39:28,1370127256345997313,COVID-19: Blood clot reports in Europe prompt investigation into Oxford-AstraZeneca vaccine ,2942652422,megglim,Wellington,143,5121,,True,False,2162,,,1,1,0.0,0.0,neutral
2021-03-11 21:39:28,1370127256023003137,normanswan: Reinforces why our borders should be ringed using Pfizer and include workers’ households. ,789356979898621953,kimonthenet,"Perth, Western Australia",91,28767,,False,False,10750,,,229,0,0.0,0.0,neutral
2021-03-11 21:39:27,1370127254664187904,"MikeDeeeeeee arekmakarenko sivanpaetsch drseltsam Sebastian_Hols bplommer x30YkXZ7M7h6yEB NateSilver538 Looking at how many doses Pfizer can deliver,i still cant understand why AZ have such problems.Even freaking SII India doesnt complain about problems.",1239288900516003840,Semyaza666,,28,47,,False,False,6609,,,0,1,0.5,0.25,positive
2021-03-11 21:39:27,1370127253955354624,"InfoPEI: The AstraZeneca vaccine🙂
Reminder - even after you receive the vaccine, until we get enough Islanders immunized, it's very imp…",727655633202352129,SheriBSOLE,,12,182,,False,False,40,,,9,0,0.4,0.1,positive
2021-03-11 21:39:27,1370127252889866240,"COVID event! High fives for saving lives!
covid covidvaccine covidevent covid19 covid_19 vaccine vaccination ",1449588026,JarrodHarbour,"Visalia, CA",124,994,,False,False,823,,,0,0,0.5399999999999999,0.2,positive
2021-03-11 21:39:27,1370127252797677573,"Denmark, Norway, and Iceland have suspended AstraZeneca's COVID-19 vaccine over concerns about blood clots  via YahooNews 
AstraZeneca",150754332,Agent99XXX,USA,811,78,,False,False,107207,,,0,0,0.0,0.0,neutral
2021-03-11 21:39:27,1370127250906046471,"maybritillner so AstraZeneca is not safe and Noorway, ostenreich and others stop using it cause people are dying because of it !!! You need SputnikV so ask KremlinRussia_E Putin he will help you West Germans!!!",1317030495016919042,RamonGlenn7,,118,16077,,False,False,4624,,,0,1,0.5,-0.5,negative
2021-03-11 21:39:26,1370127250847379463,"conradjwilson: Oregon’s prisons have offered a vaccine to every inmate in custody, some 13,000 people in all. Attorneys representing Or…",511525368,erinchapstick,"Cambridge, MA",98,46317,,False,False,6007,,,211,0,0.0,0.0,neutral
2021-03-11 21:39:26,1370127250381631489,"IndianEmbassyTR: Pakistan🇵🇰, the only SAARC country to not seek COVID-19 Vaccine from India, is getting 45 million 🇮🇳 made vaccine Covi…",1072570274388893697,VisionSkeptic,Raigad,207,8769,,False,False,18459,,,3055,0,1.0,0.0,neutral
2021-03-11 21:39:26,1370127250134233088,"Europe clears J&amp;J's single-shot COVID-19 vaccine as roll-out falters

【Reuters】 ",1856081029,manekicat_koban,,655,1,,False,False,94635,,,0,0,0.0,0.0,neutral
2021-03-11 21:39:26,1370127249366728707,"snopes: Michael Yeadon last worked at Pfizer a decade ago, and was never the company's ""chief scientist."" His anti-vaccine argument rel…",144658847,cjsnowdon,Tufton Street,36865,11997,,True,True,34479,,,57,0,0.06666666666666667,0.0,neutral
2021-03-11 21:39:26,1370127248649416705,Girls in STEM today become the scientists👩🏽‍🔬👩🏻‍🔬👩🏿‍🔬👩🏼‍🔬👩🏾‍🔬 of tomorrow. PfizerProud of all our scientists &amp; engineers who work tirelessly for our purpose: breakthrough that change patients' lives. Tag below a woman in STEM you're... PFEColleague ,31293013,RaLou518,"Hoboken, NJ",77,328,,True,False,1336,,,0,0,0.0,0.0,neutral
2021-03-11 21:39:26,1370127248628576257,can I encourage you all to go and actually look at the list: bipolar disorder is right there and I had never even thought to check ,18900358,singlecrow,London,1248,19346,,False,False,26168,,,6,18,0.31785714285714284,0.14285714285714285,positive
2021-03-11 21:39:26,1370127246875312132,CSurvivor9: I've had my first dose of Pfizer!,817112504878952455,priralyn,"Annapolis, MD",1487,144406,,False,False,123535,,,70,0,0.3333333333333333,0.3125,positive
2021-03-11 21:39:25,1370127246313263109,"ElaineF2022: Scots aged 60-64 and have yet to receive a Covid vaccine appointment letter, I would encourage you to call the vaccination…",2772709815,jimxmoore,A dugout that my dad built,91,12920,,False,False,9750,,,17,0,0.4,-0.1,negative
2021-03-11 21:39:25,1370127244753039364,youngsinick: I got my first shot of the Pfizer vaccine on Monday. I practically gave them my arm. Haven't felt so much relief in a long…,60824763,cagbi2000,Anywhere they accept Visa.,454,18949,,False,False,60342,,,17,0,0.26666666666666666,0.225,positive
2021-03-11 21:39:25,1370127244664967172,"POTUS: One in four adults in the U.S. has received their first COVID-19 vaccine — and we’re now leading the world in vaccinations.

Tha…",1245694438137004033,BobbieHasAPres,"Georgia, USA",5165,37434,,False,False,29840,,,16389,0,0.3333333333333333,0.25,positive
2021-03-11 21:39:25,1370127243029188609,ColinDMello: NEW: Chief Gordon Beardy of Muskrat Dam confirms to CTVNews that they asked MPP Sol Mamakwa to fly-in and get the Moderna…,15206059,janfromthebruce,"Kincardine, ON",6349,181385,,True,False,115950,,,571,0,0.45454545454545453,0.13636363636363635,positive
2021-03-11 21:39:25,1370127242722996231,LasVegasLocally: Casino and hospitality workers are eligible to get the covid-19 vaccine in Nevada. Finally.,1232806331246997504,FrancisBaconJr,"Waikiki Beach, HI ",90,5850,,True,False,1277,,,229,0,1.0,0.0,neutral
2021-03-11 21:39:24,1370127238796955648,meganmesserly: BIG NEWS: Food service and hospitality workers are eligible for the COVID-19 vaccine effective IMMEDIATELY in Clark Coun…,3278103162,GisellRios_,"North Las Vegas, NV",255,38167,,False,False,7939,,,151,0,0.45,0.3,positive
2021-03-11 21:39:23,1370127238105030665,EricMMatheny: Are we going to talk about the healthy 39 year old woman from Utah who got her second dose of the Moderna vaccine and the…,4142479683,SaralouPedigo,,44,49299,,False,False,11518,,,2919,0,0.2333333333333333,0.19999999999999998,positive
2021-03-11 21:39:23,1370127237903699969,The_BMC: “What we really are hoping for &amp; what we want out of these vaccines is that we keep people out of the hospital and we keep peo…,195919409,Quintero_Funes,"Maracay, Venezuela",1269,127,,True,False,996025,,,57,0,0.2,0.2,positive
2021-03-11 21:39:23,1370127237559771138,Complex: Traveling internationally post-pandemic will look a lot different. But will “vaccine passports” be a regular thing in the near…,135282950,jasxiverson,"New Orleans, LA",1591,86216,,True,False,262015,,,5,0,0.2692307692307692,-0.075,negative
2021-03-11 21:39:23,1370127234770538499,"POTUS: One in four adults in the U.S. has received their first COVID-19 vaccine — and we’re now leading the world in vaccinations.

Tha…",108435440,CvilleDems,"Charlottesville, VA",1013,41,,False,False,25614,,,16389,0,0.3333333333333333,0.25,positive
2021-03-11 21:39:23,1370127234468564992,WashTimes: Denmark to halt AstraZeneca vaccinations amid reports of blood clots ,550718971,cjo_olguin,"Las Vegas, NV",926,54205,,True,False,45861,,,18,0,0.0,0.0,neutral
2021-03-11 21:39:22,1370127234011328516,"AltNews: India Today shared a chart claiming India has the lowest vaccine price in the world. This was also amplified by BJP. However,…",925286077627228160,MChakravarty9,,418,21263,,False,False,7983,,,320,0,0.0,0.0,neutral
2021-03-11 21:39:22,1370127233843658764,"ArmstrongDrew: 💉VACCINE DATA UPDATE (March 11)💉

📊2.5M doses today; 7-day avg=2.23M/day
🇺🇸US: 98.2M doses total

⚠️Notes and news in th…",17479741,OriginalBad,"New York, NY",681,69592,,True,False,54460,,,145,0,0.75,0.0,neutral
2021-03-11 21:39:22,1370127233327587331,"Happening today at 5 pm PST! Join the SoCalCTSI COVID-19 Vaccine Town Hall.

Top experts from USC &amp; members of the faith community answer questions &amp; concerns from you!

Join the Zoom meeting:  ",613850336,SoCalCTSI,Los Angeles,554,127,,False,False,913,,,0,1,0.5,0.625,positive
2021-03-11 21:39:22,1370127232635531264,jeremyjojola: Just heard from my dad who’s been living with stage-four brain cancer. He got his first Pfizer vaccine dose. Hope to see…,430245957,SteveHensonME,,1724,38772,,False,False,81422,,,8,0,0.3333333333333333,0.25,positive
2021-03-11 21:39:22,1370127232207876101,"rishibagree: No opposition leader took Covid vaccination until PM Modi  took. After him... Everyone is taking it.

Looks like they have…",770733290496008193,DrRakeshSaxena5,"Ahmadabad City, India",318,111618,,True,False,19182,,,1585,0,0.0,0.0,neutral
2021-03-11 21:39:21,1370127227585765380,"AlexaGagosz: BIG Vaccine news: 
COVID-19 vaccination eligibility will open on Friday for Rhode Islanders who are 60 to 64 years of age…",1667729982,katelyncsilva,"Providence, RI",777,17564,,False,False,156,,,14,0,0.3,0.0,neutral
2021-03-11 21:39:21,1370127226646192133,"MichelleObama: When you can get the COVID-19 vaccine, I hope you do—Barack and I are certainly glad we did. It’s our best shot at beati…",285811870,stacyo28,,1499,362212,,False,False,72605,,,8338,0,0.65,0.75,positive
2021-03-11 21:39:20,1370127224452620291,KneiserJoe: Frustrating how risible folks have become in 21st century. When I was a child 21st century was to be a time of Scientific g…,1363627829422927875,lauralobiancos1,,391,76,,False,False,483,,,23,0,0.3,-0.13333333333333333,negative
2021-03-11 21:39:20,1370127222468665346,ruthmkb: I get it AstraZeneca has an expiry date &amp; they shld b used up. BUT indiscriminately jabbing ppl? What has RickHillier been d…,122422343,DavidPatersonca,"Ottawa, Canada",1081,16108,,False,False,46882,,,47,0,0.0,0.0,neutral
2021-03-11 21:39:19,1370127220262506496,"byjlee: Yes, to develop the J&amp;J vaccine, scientists used the offspring of a cell from a fetus to make ""factories"" of genetically-modifi…",432320364,mjohnflaherty,Electric avenue ,545,49525,,True,False,26556,,,14,0,0.0,0.0,neutral
2021-03-11 21:39:19,1370127217494269957,"REBogart: Wow, it takes 4 former Presidents to come forward to clean up the mess of just one. Sure makes the fascist right look bad, I…",1249739746441601024,purplediscomove,,178,79570,,False,False,30959,,,113,0,0.5666099773242631,0.05391156462585039,positive
2021-03-11 21:39:19,1370127217418661889,Reuters: Novavax shares were up more than 15% after announcing its COVID vaccine's efficacy data  $NVAX,77870937,greentea_pt,Thailand,16543,419,,False,False,524031,,,32,0,0.5,0.5,positive
2021-03-11 21:39:18,1370127217116684291,superkaelyn: Tonight we’re gonna be live a lil’ earlier than usual at 6pm PT / 8pm CT / 9pm ET playing Phasmo with muh frens EverNever…,3184408436,britnaybrittles,"California, USA",46,5435,,False,False,3963,,,2,0,0.4166666666666667,-0.03787878787878788,negative
2021-03-11 21:39:18,1370127216672051201,"CDCgov: If you get a COVID19 vaccine, wait at least 14 days before getting any other vaccine, including those for flu or shingles. If…",1162013675755995137,NRD_SanDiego,"ASW Naval Base Point Loma, CA",166,8122,,False,False,7587,,,388,0,0.3875,-0.2125,negative
2021-03-11 21:39:18,1370127216437301248,SkyNewsAust: Two European countries have temporarily suspended the use of AstraZeneca's COVID vaccine because of concerns over blood cl…,603045622,HistorianLexano,Tesano ,127,6165,,True,False,5609,,,44,0,0.0,0.0,neutral
2021-03-11 21:39:18,1370127216072388610,RalfStein3 RepKatiePorter Oh that's right. I remember now Pfizer was the one that wouldn't accept the government $$ from the former guy. Thanks for the article.,1242549469125783552,ComoPescado,Ecuador,113,32244,,True,False,7068,,,0,1,0.24523809523809526,0.1619047619047619,positive
2021-03-11 21:39:18,1370127214805663746,"zerohedge: So WSJ reports that ""Russian Disinformation Campaign Aims to Undermine Confidence in Pfizer, Other Covid-19 Vaccines, U.S. O…",1356950083988783104,TinkyWi21518032,,6,740,,False,False,1558,,,245,0,0.1875,-0.0625,negative
2021-03-11 21:39:18,1370127213345918976,"NBCNews: As vaccine distribution in the U.S. has ramped up, so has the misinformation blitz targeting Black communities.

Reporting by…",824278381445390336,ohlordy_cmonman,,14,5954,,False,False,183,,,22,0,0.43333333333333335,-0.16666666666666666,negative
2021-03-11 21:39:17,1370127212222033925,"I’ve had and gotten over Covid, but I’m still thinking about getting the vaccine.",1109669136,loveeAndria_,,374,680,,True,False,28887,,,0,0,0.0,0.0,neutral
2021-03-11 21:39:17,1370127212188426247,"ABCPolitics: Despite calls for national unity and bipartisanship, President Joe Biden and his top aides have declined to give the Trump…",701521618569445376,ripjohnnyboy,,666,23208,,False,False,21996,,,1097,0,0.5,0.5,positive
2021-03-11 21:39:17,1370127211559272453,never got covid but got every side effect from the vaccine 🥴,858473948,panicsophia,"norman, ok",426,17359,,False,False,19295,,,0,2,0.0,0.0,neutral
