created,id_str,text,user_id,screen_name,location,followers_count,user_favourites_count,time_zone,geo_enabled,verified,status_count,geo,coords,retweet_count,tweet_favourite_count,Subjectivity,Polarity,Sentiment
2021-03-11 21:38:25,1370126994361487366,"NBCNews: As vaccine distribution in the U.S. has ramped up, so has the misinformation blitz targeting Black communities.

Reporting by…",3379658705,CiCiAdams_,"New York, NY",19278,70190,,True,True,25923,,,22,0,0.43333333333333335,-0.16666666666666666,negative
2021-03-11 21:38:25,1370126993497415681,"DrOlufunmilayo: Denmark, Norway, Iceland have now suspended giving anyone AstraZeneca Covid19 vaccine.

There are fears it causes blood…",1367809288102674433,Joy62823912,,5,174,,False,False,32,,,628,0,0.0,0.0,neutral
2021-03-11 21:38:25,1370126992838959106,"POTUS: One in four adults in the U.S. has received their first COVID-19 vaccine — and we’re now leading the world in vaccinations.

Tha…",343682317,tagreenia,"Kissimmee, FL",2217,73169,,True,False,128153,,,16390,0,0.3333333333333333,0.25,positive
2021-03-11 21:38:25,1370126992176156677,i just got my second dose of the covid vaccine 🥳🥳🥳,998358728192606208,rkivedkoo,20 she/her,594,46217,,False,False,19523,,,0,2,0.0,0.0,neutral
2021-03-11 21:38:24,1370126990590803968,Theaulred: Hearing rumours that Astra zeneca are being awarded the rural broadband rollout gig,36332476,playingwithdust,Waterford,751,22088,,True,False,31944,,,17,0,0.0,0.0,neutral
2021-03-11 21:38:24,1370126990204932096,"POTUS: One in four adults in the U.S. has received their first COVID-19 vaccine — and we’re now leading the world in vaccinations.

Tha…",976779709420920833,mendels_chris,"Grand Haven, MI",53,16,,False,False,5945,,,16390,0,0.3333333333333333,0.25,positive
2021-03-11 21:38:24,1370126989512871940,THGPCareGroup: . TowerHamlets residents eligible for the COVIDVaccine can now easily book their appointment through TowerHamletsNow'…,748846627,RNBlake,"East London, UK",2515,14862,,True,False,5203,,,10,0,0.8333333333333334,0.43333333333333335,positive
2021-03-11 21:38:24,1370126988946595846,"ridgeisback: To all those that have had the vaccine, just  ask yourselves 'what if the conspiracy theorists are right?'.
We've been rig…",1346560510494388225,DaveWRound21,Dark side of the moon.,681,14955,,False,False,3184,,,212,0,0.5357142857142857,0.2857142857142857,positive
2021-03-11 21:38:24,1370126988699176970,"Paul_Hand: jamesjpdrake pfizer A synthetic way to program the immune system with gene therapy.
As a ‘programmer’ I am also aware that…",795880843,19531066B,,1324,36923,,True,False,25470,,,2,0,0.25,0.25,positive
2021-03-11 21:38:24,1370126987151482882,goldsby_will paintsndaubs DeniseChiumient CeeOfGee thetruebluechef They weren't given placebo either. The 'control group' were given Pfizer's meningitis jag.,1369345002799849476,MerylFeral,,5,146,,False,False,38,,,0,3,0.0,0.0,neutral
2021-03-11 21:38:23,1370126986585255942,"unfortunately the government has already replaced all vials of estrogen with the covid vaccine so really youre just doing exactly what they want, and playing directly into their hands ",820963460871753732,mkultradwife,"Columbus, OH",59,12745,,False,False,5306,,,0,3,0.4625,0.012500000000000004,positive
2021-03-11 21:38:23,1370126986262179841,"TheAtulMishra: Sweden,a largely inconsequential country wished to bounce back to significance with its AstraZeneca vaccines that it pro…",819523882503860224,heisenberg2106,Pune,21,995,,False,False,498,,,450,0,0.21428571428571427,0.10714285714285714,positive
2021-03-11 21:38:23,1370126984559394816,LasVegasLocally: Casino and hospitality workers are eligible to get the covid-19 vaccine in Nevada. Finally.,1309160208111931394,callmeLC_,,66,4037,,False,False,644,,,229,0,1.0,0.0,neutral
2021-03-11 21:38:23,1370126982684491780,Ben Stein Issues WARNING: Suffers Severe Side Effects from COVID Vaccine DAYS AFTER Getting Shot (VIDEO) ,1051209872,Confedereid,Confederate States History,52,20,,False,False,2711,,,0,0,0.7,-0.6,negative
2021-03-11 21:38:22,1370126981791109123,ColinDMello: NEW: Chief Gordon Beardy of Muskrat Dam confirms to CTVNews that they asked MPP Sol Mamakwa to fly-in and get the Moderna…,221142887,paulwayling,"Oshawa, Ontario",163,10451,,False,False,4308,,,571,0,0.45454545454545453,0.13636363636363635,positive
2021-03-11 21:38:22,1370126979769438210,COVID-19 Vaccine: Why Are Women Experiencing Worse Side Effects Than Men? ,1246093110884610049,cbd364,world,312,2402,,False,False,9423,,,0,0,0.6,-0.4,negative
2021-03-11 21:38:22,1370126979681431557,"IrwinRedlenerMD quick vaccine question. If someone has received the moderna vaccine, but they’re concerned about variants or something would it be safe to also get J&amp;J or would the different vaccines cancel each other or to react badly?",35227589,AquaJAWS,"Atlanta, GA",180,1237,,False,False,5484,,,0,0,0.5283333333333333,0.001666666666666683,positive
2021-03-11 21:38:22,1370126979601682432,"_birny: THANK YOU Office of Donald J. Trump for giving us the vaccine that was designed by Turkish scientists in Germany, just a few da…",1242223598816964608,tnim__,Singapore,78,5068,,False,False,3052,,,1,0,0.1,-0.2,negative
2021-03-11 21:38:22,1370126979513647111,"conradjwilson: Oregon’s prisons have offered a vaccine to every inmate in custody, some 13,000 people in all. Attorneys representing Or…",2661682980,Ganbare__Ginkun,,781,598452,,False,False,571012,,,211,0,0.0,0.0,neutral
2021-03-11 21:38:22,1370126979098419206,"BarackObama: Michelle and I got vaccinated against COVID-19 because we know it’s the best way to beat this pandemic, protect one anothe…",1008778964763111426,blackzizea,,44,211,,False,False,54,,,10285,0,0.3,1.0,positive
2021-03-11 21:38:22,1370126978964189186,tomselliott: The best argument against getting a Covid vaccine is that George W. Bush and Bill Clinton are telling me to.,540506535,h__krause,"Annapolis, MD",624,162222,,True,False,55640,,,39,0,0.3,1.0,positive
2021-03-11 21:38:22,1370126978536333316,"MichelleObama: When you can get the COVID-19 vaccine, I hope you do—Barack and I are certainly glad we did. It’s our best shot at beati…",897251619351527425,JenLove3602,"Maryland, USA",19,791,,False,False,270,,,8338,0,0.65,0.75,positive
2021-03-11 21:38:21,1370126977647181824,"IPSSchools: 🚨ATTENTION🚨 All IPS school and support staff can register for the COVID-19 vaccine. 

Click here to learn more. ➡️",3495979637,Allen4IPS,"Indianapolis, IN",95,183,,False,False,146,,,7,0,0.5,0.5,positive
2021-03-11 21:38:21,1370126977110220801,"KRON4RFladeboe: SantaClaraCo officials, CommunityHealthPartnership join forces to oppose state plan to hand over COVID-19 vaccination…",73237448,morgandawn6,Silicon Valley,538,26502,,False,False,121565,,,3,0,0.0,0.0,neutral
2021-03-11 21:38:21,1370126975843635200,BashirAhmaad: Press Statement on concerns about the safety of the Oxford/AstraZeneca Vaccine. ,400222308,UsmanKabir1,"Kano,Nigeria",1145,52957,,True,False,5362,,,126,0,0.0,0.0,neutral
2021-03-11 21:38:21,1370126975675826182,danieteebee: It’s completely predictably American that the brand of COVID vaccine you have access to has now become a class signifier,985560531816894465,itsdynahmite,"Austin, TX",38,2131,,False,False,19868,,,10902,0,0.0,0.0,neutral
2021-03-11 21:38:21,1370126974912393218,"noplaceforsheep I'm so glad NZ only has the Pfizer, phew.",42560408,binarusconi,NZ,135,9122,,True,False,10338,,,0,0,1.0,0.25,positive
2021-03-11 21:38:21,1370126974622953473,GTMBB AlvaradoJose15 mant12_ I think the heart murmur this game gave me just made me eligible for the COVID vaccine so thank you for two things,62880759,gvedak,"Atlanta, GA",3875,47256,,True,False,105182,,,0,18,0.4,-0.4,negative
2021-03-11 21:38:21,1370126974262382599,"politico: Andy Slavitt, a senior adviser to the White House's Covid team, credited Trump's Operation Warp Speed for spurring the develo…",1315494541,fuzzypenguinluv,Des Moines Iowa ,37,3003,,True,False,4085,,,34,0,0.0,0.0,neutral
2021-03-11 21:38:20,1370126973398249472,"Click the link in our bio to see currently open Pharmacy Technician - Retail Store jobs like ""COVID 19 Vaccine Support - Pharmacy Technician"" at CVS Health in Montgomery, AL.",25724940,tmj_mgm_pharm,"Montgomery, AL",289,0,,True,False,167,"{'type': 'Point', 'coordinates': [32.3085765, -86.3506694]}","{'type': 'Point', 'coordinates': [-86.3506694, 32.3085765]}",0,0,0.5,0.0,neutral
2021-03-11 21:38:20,1370126973176008719,Nigeria moves to douse anxieties over AstraZeneca’s COVID-19 vaccine ,373978904,PremiumTimesng,"Abuja, Nigeria",1620954,914,,True,True,291938,,,4,13,0.0,0.0,neutral
2021-03-11 21:38:20,1370126971867308034,timesuppeeps: AstraZeneca Vax rollout halted due to Safety concerns. Previously healthy people developed life threatening blood clots s…,1247702443070087168,hlamb61,"Melbourne, Victoria",9,399,,False,False,1246,,,198,0,0.39166666666666666,0.15833333333333333,positive
2021-03-11 21:38:20,1370126970546176007,"kayleighmcenany: FINALLY the Biden admin recognizes the Trump admin’s unprecedented vaccine work:

➡️ “We’re grateful for the work that…",49179462,Alamoannie,,238,76443,,False,False,15693,,,4626,0,0.95,0.3,positive
2021-03-11 21:38:20,1370126970072145920,danieteebee: It’s completely predictably American that the brand of COVID vaccine you have access to has now become a class signifier,455736692,chimddung,magic shop ✨,890,224839,,True,False,156403,,,10902,0,0.0,0.0,neutral
2021-03-11 21:38:19,1370126968197423108,"ASNKidney: ASN, ERAEDTA, and ISNkidneycare urge immediate prioritization of COVID19 vaccine distribution to people undergoing dialy…",79905793,equilibrioacido,Venezuela,3748,23382,,True,False,59656,,,8,0,0.0,0.0,neutral
2021-03-11 21:38:19,1370126967543058438,"CDCgov: If you get a COVID19 vaccine, wait at least 14 days before getting any other vaccine, including those for flu or shingles. If…",115077040,BarrenRiverHD,"Bowling Green, Kentucky",1131,879,,True,False,2097,,,388,0,0.3875,-0.2125,negative
2021-03-11 21:38:19,1370126967396315142,"NBCNews: BREAKING: President Biden signs $1.9T Covid relief bill into law; ​includes $1,400 checks, $300/wk jobless benefits, child all…",730757239775088641,BSstack11,,118,26694,,True,False,27118,,,2364,0,0.0,0.0,neutral
2021-03-11 21:38:19,1370126967199047680,spectatorindex: JUST IN: France says halting use of AstraZeneca coronavirus vaccine is not needed,2991653138,wjsejguq_,사찰그만하구팔로우하쟈,1808,27565,,True,False,503447,,,487,0,0.0,0.0,neutral
2021-03-11 21:38:19,1370126967014494208,"Just took my first shot of the moderna_tx CovidVaccine. 

DayWalker",2435736139,GabrielLeete,"California, USA",2427,13045,,True,False,10356,,,0,4,0.3333333333333333,0.25,positive
2021-03-11 21:38:18,1370126965458530310,"HamillHimself: Statement by the Twice Impeached Former Guy

I hope everyone remembers when they're getting the COVID-19 (often referred…",883672513506627585,1Wineo2,"Richmond, VA",119,158137,,False,False,24535,,,1016,0,0.0,0.0,neutral
2021-03-11 21:38:18,1370126963428495362,MSNBC: Opinion | TheRevAl: Black Americans are being called out for Covid-19 vaccine skepticism. But the greater problem is access to…,756320672784211968,RickyRojasNJ,"North Hudson, NJ",455,8393,,False,False,3619,,,35,0,0.4666666666666667,0.16666666666666669,positive
2021-03-11 21:38:18,1370126961922740225,"MichelleObama: When you can get the COVID-19 vaccine, I hope you do—Barack and I are certainly glad we did. It’s our best shot at beati…",213383985,VMSAdvocates,"Montpelier, Vermont",1352,2311,,False,False,600,,,8338,0,0.65,0.75,positive
2021-03-11 21:38:17,1370126960458883073,stuartjdneil: Study from HaydayLab showing that the level of protection in cancer patients by one shot of Pfizer is much poorer than i…,3543001941,DrTMaehr,🇪🇺 | 🇬🇧 | 🇦🇹,262,6580,,False,False,11027,,,13,0,0.2,0.2,positive
2021-03-11 21:38:17,1370126960450486282,"TomiLahren: If you need an ID to get a Covid vaccine, why the hell shouldn’t you need an ID to vote?!! LiberalismIsAMentalDisorder",18920778,h54jeffa,Terre Haute Indiana,128,4142,,False,False,5005,,,2339,0,0.0,0.0,neutral
2021-03-11 21:38:17,1370126960324644867,JamesMelville: Zero Covid is for the birds. The vaccine will massively reduce the serious cases and mortality rates of Covid. But there…,704403745589829634,shelley733,selby,167,27328,,True,False,11269,,,262,0,0.8333333333333333,-0.16666666666666666,negative
2021-03-11 21:38:17,1370126957657124870,"NYCMayorCounsel: New CityHallPass next week with nycHealthy Commissioner Dr. Dave Chokshi!

Dr. Chokshi shared about his decorated ca…",1066726290407985155,Arcange52536129,,136,182235,,False,False,233700,,,4,0,0.22727272727272727,0.06818181818181818,positive
2021-03-11 21:38:16,1370126955572498432,TheSource: Autopsy Ordered for Woman Who Died Four Days After Second Dose of COVID19 Vaccine. What are your thoughts on taking the vac…,75141619,DjBanga414,"Atlanta, GA",6015,707,,True,False,131278,,,3,0,0.0,0.0,neutral
2021-03-11 21:38:16,1370126954804834307,"kayleighmcenany: FINALLY the Biden admin recognizes the Trump admin’s unprecedented vaccine work:

➡️ “We’re grateful for the work that…",1369824338157862915,Trev57Jacob,,1,123,,False,False,75,,,4626,0,0.95,0.3,positive
2021-03-11 21:38:16,1370126953907298307,"Parkour_Lewis: Breh. They injected people, not with saline, but with AIR....which can kill you 🤦🏽‍♂️

Kroger mistakenly used empty syri…",28287360,brandirahill,"Northern California, Bay Area",6004,8983,,False,False,103556,,,135,0,0.5,-0.1,negative
2021-03-11 21:38:15,1370126952988876802,ColinDMello: NEW: Chief Gordon Beardy of Muskrat Dam confirms to CTVNews that they asked MPP Sol Mamakwa to fly-in and get the Moderna…,2376541478,agriffin64,"Toronto, Ontario",1151,8452,,False,False,4040,,,571,0,0.45454545454545453,0.13636363636363635,positive
2021-03-11 21:38:15,1370126952959508481,michael_galant: 130 countries have yet to receive a single dose of Covid vaccine — that’s global health apartheid. And it’s a political…,2824571907,muellermedico,,43,13,,False,False,267,,,153,0,0.10714285714285714,-0.03571428571428571,negative
2021-03-11 21:38:15,1370126951327834114,"POTUS: One in four adults in the U.S. has received their first COVID-19 vaccine — and we’re now leading the world in vaccinations.

Tha…",970128254974672896,bananasouleee,,52,18797,,True,False,19675,,,16390,0,0.3333333333333333,0.25,positive
2021-03-11 21:38:15,1370126951101399041,WDGPublicHealth: Eligible groups in Wellington-Dufferin-Guelph under Phase 2 of Ontario's Vaccination Plan can now also pre-register on…,390796230,TaylorEvansPS,"Guelph, Ontario, Canada",382,737,,False,False,4437,,,81,0,0.0,0.0,neutral
2021-03-11 21:38:13,1370126941282578432,"MarkAlanMarks1: *******************
BREAKING NEWS
*******************
France Threatens To Make Covid Vaccine Compulsory For Health Work…",982901528049717248,natasha_couzens,,222,59417,,False,False,5273,,,74,0,0.0,0.0,neutral
2021-03-11 21:38:12,1370126939097301001,guyverhofstadt U.K. placed their orders on time instead of dilly dallying like the EU did. Stopping Australian shipments was also not nice. EU seems to have a special knit picking with AstraZeneca.,51254201,sinhak,"South West, England",71,2501,,False,False,2923,,,0,1,0.5238095238095238,0.019047619047619053,positive
2021-03-11 21:38:12,1370126938896007168,"MartyMakary: Dr. Fauci supported double masking arguing it was ""common sense""-- OK.

Here's my ""common sense"" conclusion after reviewin…",108615872,RTribeck,,205,384,,True,False,988,,,448,0,0.375,-0.024999999999999994,negative
2021-03-11 21:38:12,1370126936970719236,HighWireTalk: VACCINE DISASTER AHEAD  CDC Spin on New Mask Data; Celebrity Catches Fauci Lying!; Expert Warns of Coming Covid Vaccine D…,1241799972590215168,roselob1,,40,12860,,False,False,13165,,,628,0,0.45454545454545453,0.17045454545454544,positive
2021-03-11 21:38:11,1370126936282910720,thierrybaudet: Austria suspends AstraZeneca COVID-19 vaccine batch after death | Article [AMP] | Reuters ,187132088,kevbrijer,??????,644,115908,,True,False,79178,,,386,0,0.0,0.0,neutral
2021-03-11 21:38:11,1370126932713598982,"ABCPolitics: Despite calls for national unity and bipartisanship, President Joe Biden and his top aides have declined to give the Trump…",457694206,AGENT_GATTACA,CSPAN the other C network,1394,69406,,False,False,86410,,,1097,0,0.5,0.5,positive
2021-03-11 21:38:11,1370126932625534981,"TomiLahren: If you need an ID to get a Covid vaccine, why the hell shouldn’t you need an ID to vote?!! LiberalismIsAMentalDisorder",1248015604054974465,Flauber91680263,,91,33344,,False,False,25027,,,2339,0,0.0,0.0,neutral
2021-03-11 21:38:11,1370126932562513920,WhereWomenBloom lex_about_sex GraemeSeabrook RaquelOnlyfans I forgot too. I'm having brain fog from my second covid vaccine today lol,2352004788,Bitchy_Mcfly,Bi-Coastal,53,2094,,False,False,1502,,,0,1,0.35,0.4,positive
2021-03-11 21:38:10,1370126931212038146,mymixtapez: President Joe Biden signed the $1.9 trillion COVID-19 relief bill into law. The bill clears the way for $1400 stimulus chec…,631597295,Rozaymax,"Dakar , Sénégal",1629,7247,,True,False,21636,,,71,0,0.0,0.0,neutral
2021-03-11 21:38:10,1370126929622351882,ddiamond: Trump officials last year conceived a plan for 2 pharma rivals to work together on covid vaccine. Biden closed the deal on it…,21369637,ThePantau, Ζω την καλύτερη μου ζωή.,3450,5903,,False,False,126178,,,65,0,0.08333333333333334,-0.05,negative
2021-03-11 21:38:10,1370126928821256192,"PoliticsPollss: Norway has joined Denmark in pausing its AstraZeneca Covid vaccine programme, describing its decision to do so as “caut…",1240669780597714944,Tracey69327123,,139,73569,,False,False,38195,,,21,0,0.0,0.0,neutral
2021-03-11 21:38:10,1370126928372449281,"electrixtree: Ok, who will be responsible for the people who died in Europe in the last days after being vaccinated with the AstraZen…",225909959,57Mo,,163,14818,,False,False,4944,,,5,0,0.37222222222222223,0.2333333333333333,positive
2021-03-11 21:38:09,1370126925688008704,Rachel__Bush: Daily remember to not label those that do not back the covid vaccine as “insensitive conservatives”. Since the experts SA…,34337079,VerucaSalty76,"California, USA",2847,71857,,True,False,53600,,,11,0,0.0,0.0,neutral
2021-03-11 21:38:09,1370126924400365571,"HamillHimself: Statement by the Twice Impeached Former Guy

I hope everyone remembers when they're getting the COVID-19 (often referred…",1352795181968285698,luisisihas,,28,995,,False,False,256,,,1016,0,0.0,0.0,neutral
2021-03-11 21:38:08,1370126920415916033,NYPatriot50 covidbrossuck seanhannity No but we need to get to a safer point that can greatly reduce the infection rate. Hence the vaccine. We will probably end up living along with covid like we do the flu.,1076911698936770561,AlexMcphail2539,"Bradford, England",4,373,,False,False,224,,,0,1,0.75,0.8,positive
2021-03-11 21:38:08,1370126920227155972,"MimiJ9 BirchallVerity itstrisha_innit Nope, AZ is jab and go. Easier to store (standard fridge) and more robust for handling and transport. Pfizer disclaim liability if theirs is moved off-premises after dilution (not hazardous, just might affect efficacy; it's a bit fragile).",273457915,peter_lord,East Angrier!,5450,14949,,False,False,25464,,,0,1,0.475,0.05,positive
2021-03-11 21:38:08,1370126920210333706,orlatinsley HSELive DonnellyStephen I would suggest you give Astrazeneca grief as they are a major problem in this. I did today,4854406754,woodners,"Wicklow, Ireland",269,665,,False,False,4784,,,0,0,0.35,-0.36875,negative
2021-03-11 21:38:07,1370126916720689157,BDliveSA: Denmark and Norway suspend AstraZeneca vaccine after reports of blood clots ,3414653055,gatshenimbuso73,"Johannesburg, South Africa",1345,25005,,False,False,2498,,,6,0,0.0,0.0,neutral
2021-03-11 21:38:06,1370126915168694273,"365 days ago, the World Health Organization defined COVID19 as a pandemic. Today, I am PfizerProud to be looking back at how far we have come in just one year. ScienceWillWin PFEColleague ",31293013,RaLou518,"Hoboken, NJ",77,328,,True,False,1336,,,0,0,0.5,0.05,positive
2021-03-11 21:38:06,1370126911830171656,pshegs Its not the same Astrazeneca vaccine linked to blood clots Nigeria got ooO ah. You people should say the true nah 😂🙂😂😂😂🤣😂,1290984657798995970,RevenantMe2,"Ikeja, Nigeria",342,1387,,False,False,1429,,,1,2,0.3875,0.175,positive
2021-03-11 21:38:06,1370126911284801537,"elle91 Yeah, but is it real fesh Covid 19 Vaccine or artificial Covid 19 Vacine flavoring?",369607296,bluetorpedo123,"Glendale, CA",114,19356,,True,False,5686,,,0,0,0.65,-0.19999999999999998,negative
2021-03-11 21:38:05,1370126911024795648,disclosetv: JUST IN - Norway and Denmark suspend Oxford-AstraZeneca COVID19 vaccine rollout.,711379646319861760,UghToHillary,United States,9599,344069,,True,False,285029,,,2589,0,0.0,0.0,neutral
2021-03-11 21:38:05,1370126910307590151,"DrTeckKhong: Be alert to strokes, transient ischaemic attacks, coronary events and other vascular incidents in the short and intermedia…",303154079,janekin24,"North West, England",17889,52409,,True,False,86290,,,535,0,0.3375,-0.0625,negative
2021-03-11 21:38:05,1370126908831244288,Italy bans AstraZeneca batch following two deaths in Sicily: source ,3869246068,Gefira_org,"Nijmegen, The Netherlands",5124,16086,,False,False,42093,,,7,6,0.1,0.0,neutral
2021-03-11 21:38:05,1370126908587798529,LasVegasLocally: Casino and hospitality workers are eligible to get the covid-19 vaccine in Nevada. Finally.,19047562,whatpaigeesaid,Area 51,1482,131209,,True,False,56174,,,229,0,1.0,0.0,neutral
2021-03-11 21:38:04,1370126904225828864,"POTUS: One in four adults in the U.S. has received their first COVID-19 vaccine — and we’re now leading the world in vaccinations.

Tha…",758352258845114368,_DamianAnderson,"Tennessee, USA",281,56814,,False,False,4466,,,16390,0,0.3333333333333333,0.25,positive
2021-03-11 21:38:04,1370126903563055107,"breeadail: EUROPE—Denmark, Austria, Estonia, Latvia, Lithuania and Luxembourg have banned Oxford’s AstraZeneca COVID vaccine.

Sources…",874696526,andgrateful,,1020,106291,,False,False,78186,,,345,0,0.0,0.0,neutral
2021-03-11 21:38:04,1370126903525392397,"BarackObama: Michelle and I got vaccinated against COVID-19 because we know it’s the best way to beat this pandemic, protect one anothe…",34955499,ashleyalaniz25,Indy,53,0,,True,False,11596,,,10285,0,0.3,1.0,positive
2021-03-11 21:38:03,1370126901537173506,"POTUS: One in four adults in the U.S. has received their first COVID-19 vaccine — and we’re now leading the world in vaccinations.

Tha…",2919848414,debaajimod,"Bemidji, MN.",397,5492,,True,False,9434,,,16390,0,0.3333333333333333,0.25,positive
2021-03-11 21:38:03,1370126900891385861,"funshographix: Denmark suspends use of AstraZeneca vaccine after patient dies with blood clot

Recently Buhari &amp; Osinbajo took the vacc…",2191968339,mohathunder,the COme UP,485,30463,,False,False,17190,,,91,0,0.25,0.0,neutral
2021-03-11 21:38:03,1370126900056756228,paul__ghanem Authorities literally said 5 days ago take astrazeneca... you’re blinded w inventing stuff. I never said vaccines are bad. I dont have any problem with it as long as it isnt mandatory. Only morons are led to think otherwise. Good night yal,301264219,elismaan,,830,4892,,True,False,64178,,,0,0,0.7333333333333333,-0.16999999999999998,negative
2021-03-11 21:38:02,1370126898118922241,"This article is correct.

",1352733359127076868,Takeastepback16,,119,1034,,False,False,527,,,1,5,0.0,0.0,neutral
2021-03-11 21:38:02,1370126894700564481,"Would you like to help your neighbors receive the CovidVaccine? Mercy is looking for non-medical volunteers to serve with us at our upcoming vaccine clinics. If you would be able to help us out, visit  and sign up for a ""Volunteer/Support Staff"" slot. ",48441411,MercyinFranklin,"Franklin & Lewisburg, TN",1349,998,,True,False,2496,,,0,1,0.625,0.5,positive
2021-03-11 21:38:01,1370126893891080194,"Tokyo 2020: China offers Covid vaccine doses for Olympic, Paralympic athletes ",2544469879,Blueprint_ng,Nigeria,3659,82,,True,False,112573,,,0,0,0.0,0.1,positive
2021-03-11 21:38:01,1370126893467500551,"As vaccine distribution in the U.S. has ramped up, so has the misinformation blitz targeting Black communities.

Reporting by BrandyZadrozny and CiCiAdams_ 

",14173315,NBCNews,"New York, NY",8392906,789,,True,True,295373,,,22,35,0.43333333333333335,-0.16666666666666666,negative
2021-03-11 21:38:00,1370126888618840070,"POTUS: One in four adults in the U.S. has received their first COVID-19 vaccine — and we’re now leading the world in vaccinations.

Tha…",465055676,sbn1780,,122,129787,,False,False,74748,,,16390,0,0.3333333333333333,0.25,positive
2021-03-11 21:38:00,1370126887968768000,"MichelleObama: When you can get the COVID-19 vaccine, I hope you do—Barack and I are certainly glad we did. It’s our best shot at beati…",1348229768186114048,Carissa11201447,,26,6152,,False,False,1046,,,8338,0,0.65,0.75,positive
2021-03-11 21:37:59,1370126884042838021,wusa9: Vaccinated seniors literally 'beat COVID' | Get Uplifted ,1935048084,JoyceMinipoodle,"Virginia, USA",312,11130,,False,False,37290,,,1,0,0.0,0.0,neutral
2021-03-11 21:37:59,1370126883371687938,NatImmForum: This is what good vaccine outreach looks like. ,255841733,ccambises,California,990,5271,,True,False,8550,,,2,0,0.6000000000000001,0.7,positive
2021-03-11 21:37:59,1370126883354857472,KTNV: JUST IN: Food service and hospitality workers can now get a COVID vaccine in Nevada. ,618428335,KalynaAstrinos,LA • San Diego • Las Vegas ,5286,14103,,True,True,10447,,,14,0,0.0,0.0,neutral
