created,id_str,text,user_id,screen_name,location,followers_count,user_favourites_count,time_zone,geo_enabled,verified,status_count,geo,coords,retweet_count,tweet_favourite_count,Subjectivity,Polarity,Sentiment
2021-03-12 01:34:12,1370186328239865856,"RonniSalt: Actually, it is news.

This is how Scott Morrison manipulates people's minds. 

It's up to Australians to decide what they c…",1220049364116111360,NicStearman,,162,20857,,False,False,1478,,,161,0,0.1,0.0,neutral
2021-03-12 01:34:12,1370186327782662147,"profholden: Australia on the other hand, not so much. So it seems that Jacinda Ardern is a better commercial negotiator than Greg Hunt.…",93816184,flipcritic,The Unceeded Nyoongar Country,2138,142648,,False,False,265241,,,310,0,0.26875,0.14375,positive
2021-03-12 01:34:11,1370186326809604096,PortelaforWard6: Ward 6 needs a leader who is going to bring joy and healing after a year long fight with Covid. Encourage safety and s…,1148291196839587840,AdkinsFriend,,38,6080,,False,False,1641,,,8,0,0.30000000000000004,0.375,positive
2021-03-12 01:34:11,1370186326281129984,"Hinshaw says Alberta's AstraZeneca doses have not been linked to reports of side effects in European countries 

",1058808528,TracyBaxter11,Canada,2283,15373,,False,False,107097,,,0,0,0.0,0.0,neutral
2021-03-12 01:34:11,1370186326255964167,"conradjwilson: Oregon’s prisons have offered a vaccine to every inmate in custody, some 13,000 people in all. Attorneys representing Or…",827259557772554240,alizasongbird,,224,53168,,False,False,18937,,,188,0,0.0,0.0,neutral
2021-03-12 01:34:11,1370186325660471296,newsmax: Trump hopes everyone remembers him when they get their vaccine  ,1369759133503782921,THammer1968,,5,159,,False,False,79,,,398,0,0.0,0.0,neutral
2021-03-12 01:34:10,1370186322489532419,"BarackObama: Michelle and I got vaccinated against COVID-19 because we know it’s the best way to beat this pandemic, protect one anothe…",496123238,LindaNiro,,207,88365,,True,False,70806,,,8941,0,0.3,1.0,positive
2021-03-12 01:34:10,1370186321982058500,"CPDAction: We’re here outside Pfizer HQ to demand POTUS to protect people not profits, support TRIPSWaiver, and hold pharmaceuticals…",16243428,direwolfepc,occupied Haudenosaunee land,318,43870,,False,False,39796,,,8,0,0.05,0.0,neutral
2021-03-12 01:34:10,1370186319478001666,"BarackObama: Michelle and I got vaccinated against COVID-19 because we know it’s the best way to beat this pandemic, protect one anothe…",885873976488206336,gilliland_ac,personal account,786,232066,,False,False,27887,,,8941,0,0.3,1.0,positive
2021-03-12 01:34:09,1370186316500004866,"michaelmalice: FREE OF CHARGE

""I dont feel comfortable taking the COVID vaccine until all the people in need get theirs first.""",874879270644060161,LexiKEKographer,,281,2411,,False,False,2390,,,110,0,0.6444444444444445,0.35000000000000003,positive
2021-03-12 01:34:09,1370186316256837639,"thenewsoncnbc: “I need every American to do their part,” President Biden says, calling on Americans to get vaccinated when they’re elig…",2596733485,Nesting4Awhile,USA,1012,58963,,True,False,49037,,,42,0,0.0,0.0,neutral
2021-03-12 01:34:09,1370186316047134724,"BarackObama: Michelle and I got vaccinated against COVID-19 because we know it’s the best way to beat this pandemic, protect one anothe…",808330491678035968,Candor2016,,54,48391,,False,False,39476,,,8941,0,0.3,1.0,positive
2021-03-12 01:34:09,1370186315241771008,"allinwithchris: Effie, an allinwithchris viewer from Tennessee, shares an emotional response to her mother getting the Covid vaccine a…",24150102,AmazonTracy,"San Francisco, California",454,22686,,True,False,18228,,,61,0,0.65,0.0,neutral
2021-03-12 01:34:08,1370186313513771011,sahilkapur: Big news: White House says it will direct states and localities to make every American eligible for a Covid-19 vaccine **no…,54466755,rebels2008,Somewhere in the Good old USA!,420,70594,,True,False,363410,,,330,0,0.125,0.025,positive
2021-03-12 01:34:08,1370186312536494082,"“injecting synthetic mRNA typically led to that vexing immune response; (...) The solution (…) was the biological equivalent of swapping out a tire”

The story of mRNA: How a once-dismissed idea became a leading technology in the Covid vaccine race ",37973014,edisonlsm,Curitiba,1471,64897,,True,False,148509,,,0,0,0.5,-0.16666666666666666,negative
2021-03-12 01:34:08,1370186311592738817,JustTheNews: .POTUS will instruct states to make all adults to be eligible for COVID vaccine no later than May 1 ,822355214422441984,PbolTex,"Texas, USA",318,207748,,False,False,89307,,,4,0,0.0,0.0,neutral
2021-03-12 01:34:08,1370186310988804102,"joe_warmington: Denmark, Norway and Iceland suspend AstraZeneca COVID shots after blood clot reports | Article [AMP] | Reuters ",230331160,ViolaNewYork,New York / Torun,1835,19741,,False,False,283541,,,220,0,0.0,0.0,neutral
2021-03-12 01:34:07,1370186310770688007,"More men died in this Covid-19 Pandemic by estimations upward of 40% more than women. Yet the stories have been ""but women are suffering."" There is absolutely no prioritisation on Men getting the vaccine in the UK before women even though this is the glaring factor. Why?  

8/",1319032724263493635,AdamLlorent,"London, England",6,46,,False,False,234,,,0,0,0.6333333333333333,0.3,positive
2021-03-12 01:34:07,1370186308174241792,danieteebee: It’s completely predictably American that the brand of COVID vaccine you have access to has now become a class signifier,455285243,srslyshi,an abyss of self-hatred,476,80503,,True,False,110388,,,10123,0,0.0,0.0,neutral
2021-03-12 01:34:06,1370186306639257603,"CNN: “All adult Americans will be eligible to get a vaccine no later than May 1,"" President Biden announces. ""...That doesn't mean ever…",129897298,RogueHunter65,United States,295,28882,,True,False,56426,,,255,0,0.32916666666666666,-0.07083333333333333,negative
2021-03-12 01:34:06,1370186305884323842,theflowernurse: Moderna's top scientist: 'We are actually hacking the software of life' ,1196151609400733696,Cherri74887119,Planet Earth,223,62077,,False,False,74382,,,153,0,0.3,0.25,positive
2021-03-12 01:34:06,1370186302713442311,AURELIUS — John Thomas compared his experience at the Cayuga County Health Department's COVID-19 vaccination clinic to an assembly line. ,14676527,The_Citizen,"Auburn, NY",5618,89,,True,True,107604,,,0,2,0.0,0.0,neutral
2021-03-12 01:34:06,1370186302604283907,"MichelleObama: When you can get the COVID-19 vaccine, I hope you do—Barack and I are certainly glad we did. It’s our best shot at beati…",495322431,HerlindaCorn,,14,459,,True,False,1093,,,7459,0,0.65,0.75,positive
2021-03-12 01:34:05,1370186302369464321,"SharylAttkisson: 5-Likewise, since the FDA says there was no evidence in studies as to what happens with pregnant women, they should di…",788945381480464386,Samtaylorrose,,226,212091,,False,False,169738,,,49,0,0.5,0.3333333333333333,positive
2021-03-12 01:34:05,1370186299869704192,"AFP: BREAKING Biden to end Covid-19 vaccine priority group restrictions by May 1, says US official ",746778695130558464,Amb0306,,432,31064,,False,False,476063,,,82,0,0.0,0.0,neutral
2021-03-12 01:34:04,1370186297587855363,"CBSNews: BREAKING: President Biden announces he is directing all states, tribes and territories to make all U.S. adults 18 and older el…",76017253,NSchd,"USA. Home: Chandigarh, India",207,5880,,False,False,4647,,,241,0,0.3333333333333333,0.16666666666666666,positive
2021-03-12 01:34:04,1370186297382469644,danieteebee: It’s completely predictably American that the brand of COVID vaccine you have access to has now become a class signifier,3166133947,kat_the_tea,tKpK,498,138496,,True,False,45136,,,10123,0,0.0,0.0,neutral
2021-03-12 01:34:04,1370186297034346499,"BarackObama: Michelle and I got vaccinated against COVID-19 because we know it’s the best way to beat this pandemic, protect one anothe…",1286484144285982721,PhilipD50193522,"Damascus,Syria",86,961,,False,False,121,,,8941,0,0.3,1.0,positive
2021-03-12 01:34:04,1370186296879108097,"(2) Coronavirus update: Latest Covid-19 vaccine and world news

",3141687749,WalsheKimber,Markdale Ontario,210,2155,,True,False,6157,,,0,0,0.9,0.5,positive
2021-03-12 01:34:04,1370186295855697922,"KizzyPhD: Honored to be the winner the “NextGen Award”, bestowed by The Franklin Institute, an organization that has “predicted” &amp; awar…",1468104758,YvankadeSoysa,"Boston, MA",321,2142,,True,False,401,,,470,0,0.0,0.0,neutral
2021-03-12 01:34:04,1370186294635155458,"SenSchumer SenatorWarnock SenOssoff Thank you, President Trump Mike_Pence &amp; GOP
for OperationWarpSpeed to combat the Chinese Virus. 

Resulted in 2 COVID-19 Vaccines from Pfizer &amp; Moderna. 

Phase 3 trials for AstraZeneca, Novavax &amp; Johnson &amp; Johnson’s Janssen. 

JoeBiden &amp; VP said they'll not take vaccine!",1275568954749202436,DannyM33612501,Home is where the heart is,40,619,,False,False,13209,,,0,0,0.0,0.0,neutral
2021-03-12 01:34:03,1370186293565554690,"qadRick: healthgovau Contact USA and India if you need more vaccine 💉 
They have an export ban for it! 
Before complaining that EU als…",1357191646677323777,Surinde82220659,,1,1,,False,False,3,,,1,0,0.5,0.625,positive
2021-03-12 01:34:03,1370186293179744258,uncletoopie KatiePavlich The vaccine was created in Germany by Pfizer’s partner BioNTech and sequencing shared with other Pharma ...they accepted zero US dollars and was approved in Europe first. Trump did the absolute minimum in my view.,54219241,GlennInvestor,White Plains,1019,16032,,True,False,37182,,,0,3,0.5361111111111111,0.10833333333333334,positive
2021-03-12 01:34:03,1370186292466741251,"SharylAttkisson: 5-Likewise, since the FDA says there was no evidence in studies as to what happens with pregnant women, they should di…",3040593650,PeterDrake125,Pandemonium Fortress,68,6024,,False,False,4276,,,49,0,0.5,0.3333333333333333,positive
2021-03-12 01:34:03,1370186292315627522,"radioaustralia: Fears of 'catastrophe' as rising COVID-19 cases hit Papua New Guinea's stretched health system.

",104758530,jjjove,Melbourne,2796,79751,,True,False,42975,,,11,0,0.2272727272727273,0.043181818181818175,positive
2021-03-12 01:34:03,1370186291682320387,who WOULDN’T want their covid vaccine😭 I’d fight for that darn vaccine,1169705747711553536,micheladuhhhh,She/ her,256,44295,,False,False,10525,,,0,4,0.0,0.0,neutral
2021-03-12 01:34:03,1370186291518771202,"MichelleObama: When you can get the COVID-19 vaccine, I hope you do—Barack and I are certainly glad we did. It’s our best shot at beati…",914145039110033408,jasperstoller,,72,13396,,False,False,1356,,,7459,0,0.65,0.75,positive
2021-03-12 01:34:03,1370186290633846794,orlandosentinel: Fried says DeSantis uses COVID-19 vaccine as ‘political weapon’ against opponents  ,342467945,Speak4Democracy,,144,66242,,False,False,56234,,,21,0,0.1,0.0,neutral
2021-03-12 01:34:03,1370186290415685635,TheMorayCouncil got to laugh at you muppets. Blocking people from Facebook for get this TELLING THE TRUTH. About ur nonsense covid figures and vaccine propaganda! Says it all really. Would you like me to start sharing the FOI requests from all over Scotland to probe my point?,61139702,littlemiss_l,scotland ,38,3,,False,False,67,,,0,0,0.13333333333333333,0.125,positive
2021-03-12 01:34:02,1370186289388085248,"MarkCavitt: JUST IN: Next week, State of Michigan will receive 11,400 Johnson and Johnson COVID-19 vaccine doses

98,200 first dose Pfi…",1113953351643824128,MidMich4Pete,,939,12976,,False,False,2097,,,14,0,0.16666666666666666,0.125,positive
2021-03-12 01:34:02,1370186286917640194,"Bizarre! Truth Joe, is the real facts about the virus. 500,000+ deaths is collective deaths from everything because CDC labels everything covid deaths. 98.6 survival rate. HCQ is the cure. Curve is flatten to 77%, Vaccine would be insane. Why would anyone alter DNA w/these stats ",33249884,pattymalek,World Traveler,989,84897,,False,False,56682,,,0,0,0.6333333333333333,-0.10000000000000002,negative
2021-03-12 01:34:02,1370186286565367810,"theJagmeetSingh: .SolMamakwa is someone I consider a friend

He got a COVID-19 vaccine publicly for the safety of his constituents and…",250170548,Teresa_Kelly,Toronto,2064,78880,,True,False,61154,,,113,0,0.06666666666666668,0.0,neutral
2021-03-12 01:34:02,1370186285940408333,"BuzzFeedNews: President Biden announced he will direct states to make all adults eligible for the COVID vaccine by May 1. 

He adds it…",1568124685,don_harris1,"Fairfax, VA",1331,231565,,True,False,129929,,,32,0,0.4,0.1,positive
2021-03-12 01:34:02,1370186285734760449,"TIME: Novavax reports its COVID-19 vaccine is 96% efficacious, based on Phase 3 trial results
",1122408426296864769,VJ_Dinu,,225,86,,False,False,1072,,,84,0,0.0,0.0,neutral
2021-03-12 01:34:01,1370186285298556930,"ScottTrindall: Don't be wild at Murris for being a priority population for the covid-19 vaccine, be shitty with the country that places…",1175935471404240896,BroHilderchump,Central West NSW ,2165,54288,,False,False,37935,,,50,0,0.4,0.1,positive
2021-03-12 01:34:01,1370186283235041286,"AJEnglish: Drugmaker Pfizer 'bullied' and held Argentina and Brazil 'to ransom' during negotiations to acquire vaccines, according to a…",226521605,GChamberlainAZ,Toronto Canada,764,4609,,True,False,28528,,,42,0,0.0,0.0,neutral
2021-03-12 01:34:01,1370186283117641728,"POTUS: One in four adults in the U.S. has received their first COVID-19 vaccine — and we’re now leading the world in vaccinations.

Tha…",1182100297809874944,LarkNightengale,Florida,2174,62111,,False,False,39678,,,15346,0,0.3333333333333333,0.25,positive
2021-03-12 01:34:01,1370186283067211778,B.C. doctor urges people against COVID-19 ‘vaccine shopping’  COVIDBC COVID19BC COVIDVaccine COVID19Vaccine COVIDVaccination COVID19Vavccination COVIDCanada COVID19Canada,475308891,iChinadian,"Vancouver 溫哥華, Canada 加拿大 🇨🇦",1363,729,,False,False,125486,,,0,0,0.0,0.0,neutral
2021-03-12 01:34:01,1370186282995957762,"Lin_Manuel - With POTUS indicating that he wants all US adults to be eligible for the CoVID vaccine no later than May 1st, is this an opportunity to start hearing “I am not throwing away my shot” as a theme song? Hamilton",960585564780220416,infinitenullity,,0,39,,False,False,65,,,0,0,0.05,0.1,positive
2021-03-12 01:34:01,1370186282782052353,"SharylAttkisson: 2-Contrary to President Biden's advice, FDA advises you should not get Covid vaccine if you're allergic to any ingredi…",1262872968,LatAmFr,,2712,7177,,False,False,374272,,,144,0,0.0,0.0,neutral
2021-03-12 01:34:01,1370186282119274496,"It takes 10Yrs 2 develop A Vaccine,2-3 Yrs 4 Trial,these Vaccines were made in Months,I'll let U B the Guinea Pig B4 I think of taking one! Denmark, Norway and Iceland suspend use of AstraZeneca Covid vaccine over reports of blood clots  Get Educated! ",259121785,mobygrapefan,Earth,3514,122683,,False,False,380781,,,0,0,0.0,0.0,neutral
2021-03-12 01:34:00,1370186281427349504,"davis1862 I am a Pfizer, sir. Currently evaluating every weird sensation for signs of negative reaction. So far so good.",15273337,danimichelle,"Wichita, Kansas",1744,20575,,False,False,21605,,,0,0,0.6799999999999999,-2.2204460492503126e-17,negative
2021-03-12 01:34:00,1370186280928219141,"AFP: BREAKING Biden to end Covid-19 vaccine priority group restrictions by May 1, says US official ",235910137,PSchydlowski,Au bord de la Sarre,22188,209285,,True,True,327786,,,82,0,0.0,0.0,neutral
2021-03-12 01:34:00,1370186280919658496,"TIME: Novavax reports its COVID-19 vaccine is 96% efficacious, based on Phase 3 trial results
",284938804,SmittenChicken,anywhere that offers free wifi,223,24324,,False,False,38278,,,84,0,0.0,0.0,neutral
2021-03-12 01:34:00,1370186280202555399,pfizer Thank You! Just got shot one of your vaccine.,541596993,NdWorm,Philadelphia,33,2633,,False,False,894,,,0,0,0.0,0.0,neutral
2021-03-12 01:34:00,1370186280051515392,JuddLegum: JohnKavanagh_AZ ATT Allstate BCBSAssociation CoxComm WeAreFarmers pfizer UnitedHealthGrp USAA Prudential WellsFar…,711720939822551040,BellaDonaModels,UNKNOWN ,1409,30556,,False,False,303856,,,317,0,0.0,0.0,neutral
2021-03-12 01:34:00,1370186279153975296,"WHCOVIDResponse: By May 1st, every adult in this country will be eligible for a COVID-19 vaccine but we all have to do our part: Get yo…",1725653964,toymom303,,181,99774,,False,False,114496,,,878,0,0.3,0.1,positive
2021-03-12 01:33:59,1370186276482080769,"cnni: “All adult Americans will be eligible to get a vaccine no later than May 1,"" US President Biden announces. ""...That doesn't mean…",854496084512485376,cjwalsh52,"West Hollywood, CA",101,36958,,False,False,39810,,,77,0,0.15,0.05,positive
2021-03-12 01:33:59,1370186276381540357,"PISDI94_96: Like and if you agree they can shove their COVID vaccine up their stinking ass!

NOT GETTING IT AND JOE BIDEN IS A PIECE…",815734894039068673,alice_v1109,,237,129830,,False,False,81295,,,86,0,0.0,0.0,neutral
2021-03-12 01:33:59,1370186276255756289,"thenewsoncnbc: President Biden says he will direct all states, tribes and territories to make all adults eligible for vaccination no la…",51939805,HelloLynne4Ever,Home of the WorldSeries Champs,1084,49143,,False,False,112909,,,24,0,0.4,0.1,positive
2021-03-12 01:33:59,1370186276184461312,SharylAttkisson: 3-The vaccine is *not* approved for current emergency use for anyone under 16 or 18 (depending on the brand). Therefor…,2732987812,donnarene1210,"Pennsylvania, USA",586,9489,,True,False,63750,,,180,0,0.4,0.0,neutral
2021-03-12 01:33:59,1370186274699673600,"NVICLoeDown: Death Rates Skyrocket in Israel Following Pfizer Experimental COVID ""Vaccines""  ",1134141671791308800,StopTCensorship,,762,3953,,False,False,8585,,,97,0,0.25,0.05,positive
2021-03-12 01:33:59,1370186273986641920,"CNNPolitics: “All adult Americans will be eligible to get a vaccine no later than May 1,"" President Biden announces. ""That doesn't mean…",33925249,afpolk,Oklahoma,154,157,,True,False,2163,,,145,0,0.15,0.05,positive
2021-03-12 01:33:58,1370186272661250049,Did you know you can add your COVID-19 vaccine status to your profile? nypost  ,344157735,coffeembagel,San Francisco,118967,3391,,True,False,8067,,,0,0,0.0,0.0,neutral
2021-03-12 01:33:58,1370186272564740099,"So, after much contemplation and hesitation, I scheduled my appt for the covid vaccine. 😳🥺😳 Question, is it true that one should stop taking blood thinners, ibuprofen days prior to injection? drsanjaygupta",49518536,gloriaonthemove,"Hoosier Girl, USA",4120,8533,,True,False,7714,,,0,0,0.2833333333333334,0.18333333333333332,positive
2021-03-12 01:33:58,1370186271671353345,CSurvivor9: I've had my first dose of Pfizer!,601890937,JoeKoffee,,5725,179006,,False,False,647084,,,55,0,0.3333333333333333,0.3125,positive
2021-03-12 01:33:58,1370186271432249349,"DelthiaRicks: Some European countries are suspending AstraZeneca vaccinations over worries about blood clots. Denmark, Iceland &amp; Norway…",1284778632,DrLarryBKeating,"Miami, FL",533,7375,,False,False,52470,,,11,0,0.0,0.0,neutral
2021-03-12 01:33:58,1370186269230211072,"kayleighmcenany seanhannity The Scientists develop the Vaccine not Trump. Trump downplayed the virus for months, he was too busy golfing and still having his rallies ignoring the Covid.suggests Sunlight &amp; injecting Hydroychoroquine. Didn’t u say Trump would never let the virus come to the US!",35321438,Babswirv,,171,9202,,False,False,12028,,,0,0,0.3,0.125,positive
2021-03-12 01:33:57,1370186268643094529,fox5dc: Biden directs states to make all adults eligible for COVID-19 vaccine by May 1 ,1155456108896694272,Fuxk_ur_feelinz,,107,425,,True,False,5559,,,8,0,0.0,0.0,neutral
2021-03-12 01:33:57,1370186268219297792,"TheLeoTerrell
Democrats always have someone to blame!
It is amazing how perfect Democrats think they are!
What's more amazing, 80M LOW IQ AMERICANS VOTED FOR JoeBiden AN INCOMPETENT, CORRUPT LIAR!

Democrats can't accept: CHINA gave us COVID &amp;
President Trump gave us a vaccine!",552145307,enufread,"Lindon, UT",117,2952,,True,False,16635,,,0,0,0.7095238095238096,0.22410714285714287,positive
2021-03-12 01:33:57,1370186267980394501,"My parents both got Pfizer shot 1 today in Wisconsin! Woohoo! I'm so relieved they'll be protected from this virus, and soon be able to do things and see people with minimal risk. :-)",387967256,JaredALee,"Broomfield, CO",608,57689,,True,False,31112,,,0,17,0.7416666666666667,0.3,positive
2021-03-12 01:33:56,1370186264608137222,"NPR: Pfizer and Moderna agreed to supply 100 million doses a piece to the U.S. by the end of March. With just under three weeks left, b…",2328061699,NirodhaTW,"Michigan, USA",675,49205,,False,False,23912,,,158,0,0.0,0.0,neutral
2021-03-12 01:33:56,1370186264117411841,"JerasIkehorn: RE: TRUMP CLAIMING CREDIT FOR THE VACCINES 
Pfizer, the first vaccine approved, was not a part of Operation Warp Speed.…",1348064870474903552,StacyHo26740338,New York ,531,11662,,False,False,10935,,,386,0,0.3333333333333333,0.25,positive
2021-03-12 01:33:56,1370186263932891137,newsmax: Trump hopes everyone remembers him when they get their vaccine  ,1360746669512474625,mac_brookie,"Plant City, FL",44,1026,,False,False,218,,,398,0,0.0,0.0,neutral
2021-03-12 01:33:56,1370186263475617798,DavidSacks: President Biden is correctly calling on states to drop vaccine eligibility requirements and provide a date certain for Covi…,41393390,henrybahk,Los Angeles,27,2992,,False,False,839,,,53,0,0.5714285714285714,0.21428571428571427,positive
2021-03-12 01:33:56,1370186263131607041,"SharylAttkisson: 5-Likewise, since the FDA says there was no evidence in studies as to what happens with pregnant women, they should di…",1347906422206582788,Geri73591690,,21,2424,,False,False,13718,,,49,0,0.5,0.3333333333333333,positive
2021-03-12 01:33:56,1370186262972358656,"Today, at 98 years old, my mother Ana Gallagher, received the second doses of a Covid-19 vaccine. Contratulations mother &amp; Chile. ",1435733094,josequiroga777,"OTTAWA, ONTARIO, CANADA",16,54,,False,False,138,,,0,0,0.1,0.05,positive
2021-03-12 01:33:56,1370186262670376960,barkey_don: AP Awesome speech tonight by President Biden who is appealing to all people to adhere to all Covid restrictions and an ear…,23823808,Snicklefrits,Canada,2,109000,,False,False,166432,,,2,0,0.75,0.75,positive
2021-03-12 01:33:55,1370186258002087936,"TheDailyShow Thank you, President Trump Mike_Pence &amp; GOP
for OperationWarpSpeed to combat the Chinese Virus. 

Resulted in 2 COVID-19 Vaccines from Pfizer &amp; Moderna. 

Phase 3 trials for AstraZeneca, Novavax &amp; Johnson &amp; Johnson’s Janssen. 

JoeBiden &amp; VP said they'll not take vaccine!",1275568954749202436,DannyM33612501,Home is where the heart is,40,619,,False,False,13209,,,0,1,0.0,0.0,neutral
2021-03-12 01:33:55,1370186257880387591,39-Year-Old Mother Dies After 2nd Dose of Moderna Vaccine: Family  via epochtimes,1177040709267775488,sharapist,,906,21624,,False,False,16232,,,0,0,0.0,0.0,neutral
2021-03-12 01:33:55,1370186257452703744,"EricBoehlert: i found the dumbest sentence of the week: 

&lt;Despite calls for national unity and bipartisanship, President Joe Biden and…",886627915902799874,kulu_sadira,"Fairfield, IA",1668,46449,,False,False,12409,,,495,0,0.0,0.0,neutral
2021-03-12 01:33:54,1370186256143982594,abeladdin: Pfizer gays vs. Moderna gays once the clubs reopen  ,1039596796975054848,Daniel_sito90,"Ontario, CA",146,16572,,False,False,1396,,,10,0,0.0,0.0,neutral
2021-03-12 01:33:54,1370186255967813636,MarshaBlackburn You’re lying but that’s what you do.    Pfizer was not part of Warpspeed and Moderna and J&amp;J started on their own.,1175382141447876608,BostonDukeman,"Boston, MA",1253,150430,,False,False,26862,,,0,6,1.0,0.6,positive
2021-03-12 01:33:54,1370186255254781959,"Omnitrans: .SBCounty is offering COVID-19 vaccinations to eligible residents at several sites throughout the Omnitrans service area,…",3179359837,SBCountyPH,"San Bernardino, CA",2552,1551,,True,False,2946,,,5,0,0.0,0.0,neutral
2021-03-12 01:33:54,1370186254197911554,"SharylAttkisson: 2-Contrary to President Biden's advice, FDA advises you should not get Covid vaccine if you're allergic to any ingredi…",3040593650,PeterDrake125,Pandemonium Fortress,68,6024,,False,False,4276,,,144,0,0.0,0.0,neutral
2021-03-12 01:33:54,1370186253182832643,"TomiLahren: If you need an ID to get a Covid vaccine, why the hell shouldn’t you need an ID to vote?!! LiberalismIsAMentalDisorder",103036937,billkoehl,"Chardon, OH",43,9257,,True,False,4671,,,2119,0,0.0,0.0,neutral
2021-03-12 01:33:54,1370186252629213185,"BarackObama: Michelle and I got vaccinated against COVID-19 because we know it’s the best way to beat this pandemic, protect one anothe…",1592180876,Dafisch4,,141,151926,,True,False,25371,,,8941,0,0.3,1.0,positive
2021-03-12 01:33:53,1370186251706437641,"SharylAttkisson: 2-Contrary to President Biden's advice, FDA advises you should not get Covid vaccine if you're allergic to any ingredi…",292550164,tom_martino1,"Tampa, Fla",1422,160800,,True,False,50865,,,144,0,0.0,0.0,neutral
2021-03-12 01:33:53,1370186250737438722,narendramodi: Happy to share that my mother has taken the first dose of the COVID-19 vaccine today. I urge everyone to help and motivat…,1101105810380283904,komalT200,"Delhi, India",220,821,,False,False,817,,,16051,0,0.6666666666666666,0.525,positive
2021-03-12 01:33:53,1370186248799858694,Got my second dose of Moderna yesterday and was completely laid low about 12 hours after the jab. Felt like the worse case of flu ever. But I had a great nurse helping me...my Havanese Noelle. She never left my side today. ,51756862,GloDittmann,,83,9791,,False,False,8833,,,0,1,0.3416666666666666,0.08333333333333333,positive
