created,id_str,text,user_id,screen_name,location,followers_count,user_favourites_count,time_zone,geo_enabled,verified,status_count,geo,coords,retweet_count,tweet_favourite_count,Subjectivity,Polarity,Sentiment
2021-03-12 01:35:33,1370186671447236611,"LincolnsBible: My god... I cannot imagine how wretched the vaccine and Covid infection situation in America would be right now, if Jare…",262714309,willwitwonttwit,DenCo til Mothership arrives,6260,100127,,True,False,106894,,,440,0,0.5357142857142857,0.2857142857142857,positive
2021-03-12 01:35:33,1370186670830542849,I got it today. First penetration in years. I thought I'd be rusty but I took it just fine. vaccinated Moderna PartOne ,1316444442606223360,JoeBIn818,"North San Fernando Valley, CA",56,5709,,False,False,13103,,,0,0,0.4166666666666666,0.33333333333333337,positive
2021-03-12 01:35:33,1370186669568233472,"President Biden spoke to the Nation on Covid and the Vaccine, Biden outlook “maybe we may gather in small groups by July”. Well, it looks like  the outlook from the White House is more Months of Lock downs. ",1266147111881580544,truthforall13,"Fort Lauderdale, FL",1,22,,True,False,1410,,,0,0,0.3,0.08333333333333333,positive
2021-03-12 01:35:33,1370186667588517890,"CBSNews: 12-year-old helps more than 1,600 people get vaccines after building a website to help seniors ",41829624,Mari_Twins,NJ/NY,928,16957,,False,False,52229,,,171,0,0.5,0.5,positive
2021-03-12 01:35:32,1370186664560168962,"CNNPolitics: “All adult Americans will be eligible to get a vaccine no later than May 1,"" President Biden announces. ""That doesn't mean…",922244477699477505,corridorof_time,Suburban new york head ass,266,33774,,True,False,27989,,,145,0,0.15,0.05,positive
2021-03-12 01:35:31,1370186662337073152,NBCNews Only if I can get Pfizer,36811320,MyFrogIsAPrince,"Humboldt County, California",35,7513,,False,False,2263,,,0,0,1.0,0.0,neutral
2021-03-12 01:35:31,1370186661150216203,AmyKremer: I don’t want to hear Joe Biden talk about Covid and the vaccine as long as he is letting illegal aliens into this country th…,826949620597129219,PerigouxA,United States,243,91866,,False,False,23744,,,151,0,0.45,-0.275,negative
2021-03-12 01:35:31,1370186660890087425,"BuzzFeedNews: President Biden announced he will direct states to make all adults eligible for the COVID vaccine by May 1. 

He adds it…",50503854,epoy_chinoy,"Quezon City, Philippines",126,8946,,True,False,64537,,,32,0,0.4,0.1,positive
2021-03-12 01:35:30,1370186658365108227,LaSalleStTrader dey5401 NC5 IntelCrab There’s no pleasing some of you people lmfao. Tell me the “nasty side effects” of the Pfizer/Moderna vaccine.,860335943575896064,berniegangg,,118,40116,,False,False,612,,,0,0,1.0,-1.0,negative
2021-03-12 01:35:30,1370186658142855171,Can we verify this story?!? Yikes!!! Don’t ban me Twitter! ,24226614,itsmeTONYV,"Denver, CO",7310,7341,,True,True,41998,,,0,1,0.0,0.0,neutral
2021-03-12 01:35:30,1370186657899630593,"CNN: “All adult Americans will be eligible to get a vaccine no later than May 1,"" President Biden announces. ""...That doesn't mean ever…",34481145,couminator,,467,22136,,True,False,18718,,,255,0,0.32916666666666666,-0.07083333333333333,negative
2021-03-12 01:35:30,1370186657631248386,"RN00711: Still wondering why he won? POTUS GoJoe GoPOTUS
👏🏾👏🏾👏🏾👏🏾👏🏾👏🏾👏🏾👏🏾👏🏾👏🏾👏🏾👏🏾
""Biden to direct states to make all adults eligibl…",1346894638867738625,DouglasCooley16,,27,1338,,False,False,1575,,,21,0,0.4,0.1,positive
2021-03-12 01:35:30,1370186656100143104,"CNNPolitics: “All adult Americans will be eligible to get a vaccine no later than May 1,"" President Biden announces. ""That doesn't mean…",384689692,thedpressman,,217,4506,,False,False,1796,,,145,0,0.15,0.05,positive
2021-03-12 01:35:30,1370186655605358596,TimesofIsrael: Pfizer CEO: ‘Obsessive’ Netanyahu called 30 times in effort to seal vaccine deal ,977006733360025600,ableburton1,"South Carolina, USA",167,10267,,True,False,3601,,,21,0,0.0,0.0,neutral
2021-03-12 01:35:30,1370186655034904576,"CNN: “All adult Americans will be eligible to get a vaccine no later than May 1,"" President Biden announces. ""...That doesn't mean ever…",1723817280,coldplayer1964,"Illinois, USA",57,4063,,True,False,2584,,,255,0,0.32916666666666666,-0.07083333333333333,negative
2021-03-12 01:35:30,1370186654934315017,NBCNews: BREAKING: President Biden is expected to call for all U.S. adults to be eligible to receive the vaccine no later than May 1; w…,22662094,PeriwinkleinOK,Oklahoma,1634,85866,,False,False,53506,,,256,0,0.2,-0.05,negative
2021-03-12 01:35:29,1370186652925054982,"davidalim: Inbox statement from CVS Health CEO Karen Lynch:

""Pre-K through 12 educators and staff and child care workers have accounte…",59028892,daulan,"Pacific Grove, CA",281,30633,,True,False,79327,,,7,0,0.0,0.0,neutral
2021-03-12 01:35:29,1370186651926810627,"SharylAttkisson: 5-Likewise, since the FDA says there was no evidence in studies as to what happens with pregnant women, they should di…",2954169932,6ftmommy,"Stuck in California, but Texan by birth",804,140474,,True,False,217340,,,49,0,0.5,0.3333333333333333,positive
2021-03-12 01:35:29,1370186651603976200,"ItsKingsBruh: Summer definitely open this year. Between Moderna, Pfizer and Novavax you got all the efficacy you need for a good year",987043285708484613,vanessao_,"Virginia, USA",297,13733,,False,False,15377,,,16,0,0.55,0.35,positive
2021-03-12 01:35:29,1370186651310419968,"SharylAttkisson: 5-Likewise, since the FDA says there was no evidence in studies as to what happens with pregnant women, they should di…",920084009966764032,VniReps,,8,978,,False,False,788,,,49,0,0.5,0.3333333333333333,positive
2021-03-12 01:35:28,1370186650219782151,"Denmark, Norway and Iceland suspend use of AstraZeneca Covid vaccine over reports of blood clots ",4395012935,chitorsantos,Quezon City,7,173,,False,False,2425,,,0,0,0.0,0.0,neutral
2021-03-12 01:35:28,1370186648386994179,"Pamacious: ""Alabama Regional Medical Services — a health clinic that primarily serves a lower-income, Black neighborhood — has not admi…",3387727233,EmiliaOnPoint,"A Democracy, Functioning",1388,182143,,False,False,83484,,,13,0,0.3111111111111111,0.07777777777777779,positive
2021-03-12 01:35:28,1370186647082573831,itsJeffTiedrich AmyKremer Yeah nobody else would’ve figured out vaccines. Trump should go take that Pfizer CEO’s job since he obviously know better.,71352034,stevieballgame,"Chicago, IL",22,485,,False,False,278,,,0,8,0.5,0.25,positive
2021-03-12 01:35:27,1370186646264549382,narendramodi: Happy to share that my mother has taken the first dose of the COVID-19 vaccine today. I urge everyone to help and motivat…,969485754618478593,InderSinghBis16,"Pune, India",172,7398,,False,False,5972,,,16050,0,0.6666666666666666,0.525,positive
2021-03-12 01:35:27,1370186644817543171,RowdyMaya kylegriffin1 samswey Actually they deployed a number of people in DC in the USDA many veterinarians already.    I think it’s not just the shot. But for the Pfizer vaccine they have to be monitored for 15 minutes for adverse affects.   That needs to be trained medical personnel.  J J changes game,820690956,cabbageridge,,577,19896,,True,False,44675,,,0,0,0.25,0.024999999999999998,positive
2021-03-12 01:35:27,1370186644129775617,"HealthyEarth8: Kurill got the 2nd shot Mon Feb 1. While she was in bed all day Tues &amp; Wed, it wasn’t until Thurs morning she went to th…",3400737969,1blessedbee,"Pennsylvania, USA",2026,178207,,True,False,105995,,,3,0,0.0,0.0,neutral
2021-03-12 01:35:27,1370186643618037761,imnotbri_: and that’s why I said I want the Pfizer vaccine period,1888272758,RaynaRenee_,"Charlotte, NC",428,43960,,False,False,28628,,,11,0,0.0,0.0,neutral
2021-03-12 01:35:27,1370186643500507139,"EricBoehlert: i found the dumbest sentence of the week: 

&lt;Despite calls for national unity and bipartisanship, President Joe Biden and…",297265083,JSilvey70,Near the In-N-Out Burger,441,81397,,True,False,122951,,,494,0,0.0,0.0,neutral
2021-03-12 01:35:27,1370186643106361352,"calebthom1 POTUS45 ROTFLMAO..
pfizer received ZERO from OWS for R&amp;D
pfizer got approved first in UK, so the whole bs about 'cutting the red tape' is also bs..",1332456313327116290,NickDone8,,319,43089,,True,False,20542,,,0,4,0.4083333333333333,-0.037499999999999985,negative
2021-03-12 01:35:26,1370186641516724229,"WHCOVIDResponse: By May 1st, every adult in this country will be eligible for a COVID-19 vaccine but we all have to do our part: Get yo…",50576527,Wahrhaftig,🌎,10582,236863,,False,False,173895,,,877,0,0.3,0.1,positive
2021-03-12 01:35:26,1370186640501714944,"kayleighmcenany: FINALLY the Biden admin recognizes the Trump admin’s unprecedented vaccine work:

➡️ “We’re grateful for the work that…",49203495,ZeelandCap,the Occident,3556,214005,,False,False,61102,,,4197,0,0.95,0.3,positive
2021-03-12 01:35:26,1370186640271028224,"ABC: Pfizer's vaccine is successful in preventing not only symptomatic COVID-19, but also asymptomatic disease according to new real-wo…",95787053,AsToldByDezz,"Detroit, MI",475,7056,,True,False,43985,,,326,0,0.8015151515151514,0.2954545454545455,positive
2021-03-12 01:35:26,1370186639075647493,"BrendanNyhan Puh-leeze. 1) GOP congresspeople are already touting the COVID rescue bill, despite not voting for it. 2) Most people will eventually get the shot despite politics bc they know they should (witness Trump &amp; Melania “quietly” getting vaccine).",243434304,oheystephj,Raleigh NC,346,19296,,False,False,8839,,,0,1,0.4166666666666666,0.25,positive
2021-03-12 01:35:26,1370186638861680641,MariannMeedWard: Toured the Jo_Brant Hospital Vaccine Clinic opening tomorrow. They’re ready to welcome those aged 80+ &amp; you’ll be in…,28882929,messy2,,9,6,,False,False,11,,,7,0,0.6,0.3,positive
2021-03-12 01:35:25,1370186636953333763,"SharylAttkisson: 2-Contrary to President Biden's advice, FDA advises you should not get Covid vaccine if you're allergic to any ingredi…",1107085840847699968,MikeDuBose7,Alabama,2837,173144,,False,False,32841,,,144,0,0.0,0.0,neutral
2021-03-12 01:35:25,1370186636336660482,davidmweissman 24 hrs after 2 Pfizer shot &amp; feeling same as always. No side effects.,276910517,BravoJuneau,PNW,821,12976,,False,False,43392,,,0,0,0.125,0.0,neutral
2021-03-12 01:35:25,1370186634554134531,"AmyKremer Wait. You mean the guy who said it would just go away last summer? The guy who caught COVID with a superspreader event he threw? The guy who wanted us to inject bleach? The guy who then got the vaccine ahead of millions, altho he didn't ""believe in it?""",2409659088,Cking613,"Massachusetts, USA",804,24655,,False,False,7070,,,0,3,0.3770833333333333,-0.15625,negative
2021-03-12 01:35:24,1370186633832755200,TheLeoTerrell Pfizer wasn’t part of Warp Speed. And all he did was dump millions into pharma’s lap! You want credit for that fine.,34722412,jjaparo,Resistance Headquarters ,284,233,,True,False,21664,,,0,9,0.5,0.4166666666666667,positive
2021-03-12 01:35:24,1370186633312616448,"PINKSODALOVE Sarahluvshkey77 Hey Lauren, There is a lot of lies out there about the COVID on both sides. I am not here to cause fear or anxiety. I know a 30yr that is in the vulnerability group. Her husband &amp; her do not plan on getting the vaccine because all the uncertainties &amp; complications...continued",1177393290402062337,Shine4Ever,Earth transferring to Heaven,105,2636,,False,False,4932,,,0,0,0.0,0.0,neutral
2021-03-12 01:35:24,1370186632893186054,katherineOma: Jonas Salk ended polio with his vaccine &amp; praised by all including the president. We all know his name. Do you know Kizzi…,39170600,oldguygamer420,Florida,1426,28026,,True,False,17626,,,162,0,0.0,0.0,neutral
2021-03-12 01:35:24,1370186632008237062,Reuters: South Korea extends use of AstraZeneca COVID-19 vaccine to people aged 65 and over  ,123882169,epphm,Caracas,1118,16,,False,False,89921,,,48,0,0.4,-0.1,negative
2021-03-12 01:35:24,1370186631282446339,DavidBe53174057: The Federal Government should hand the Covid Vaccine roll-out to the states. The Feds are simply not competent enough.,1213446779535937542,CharlesSzulc,Gunaikurnai land. Vic.,2282,80609,,False,False,82010,,,41,0,0.5833333333333333,-0.125,negative
2021-03-12 01:35:23,1370186629453860870,"TomiLahren: If you need an ID to get a Covid vaccine, why the hell shouldn’t you need an ID to vote?!! LiberalismIsAMentalDisorder",1180636744494047232,quincysd1,,75,20523,,True,False,4832,,,2119,0,0.0,0.0,neutral
2021-03-12 01:35:23,1370186626199076866,"POTUS: One in four adults in the U.S. has received their first COVID-19 vaccine — and we’re now leading the world in vaccinations.

Tha…",715523862,FowadAbdo,New York,18,1674,,False,False,288,,,15345,0,0.3333333333333333,0.25,positive
2021-03-12 01:35:22,1370186625251164162,RobbySkyKiller: pfizer sounds like a corporation I’ll trust with my life ! google not even hiding this truth yet . WakeUp NOWAYMAN…,1212531195524739073,GroyperJe,"Chicago, IL",578,15465,,False,False,9061,,,1,0,0.0,0.0,neutral
2021-03-12 01:35:22,1370186624689135624,"Y'all on May 2nd: ""he didn't say WHICH vaccine, you just ASSUMED he meant the COVID vaccine"" ",61844078,BecksWelker,NY via OH,2419,71711,,False,False,43327,,,17,122,0.0,0.0,neutral
2021-03-12 01:35:22,1370186621862117378,"votolatino: BREAKING: POTUS signed the COVID relief bill which includes:

-$1,400 checks for most Americans
-$300/wk jobless benefits…",2884834600,luchaporpaz,,320,57266,,True,False,83733,,,29,0,0.5,0.5,positive
2021-03-12 01:35:21,1370186620201267201,"Farbeka Then again, other countries got the vaccine sooner than the USA.  Pfizer was not part of DJT's warp speed program and was first to market here.

So, then - there's that.",4704333120,KE4Bears,,78,4148,,False,False,4230,,,0,2,0.35416666666666663,0.0625,positive
2021-03-12 01:35:21,1370186618330611718,"brianstelter CNN drsanjaygupta JoeBiden vaccine is *not* approved for current emergency use for anyone under 16 or 18 (depending on the brand). Biden said, no child should get Covid vaccine.",1275568954749202436,DannyM33612501,Home is where the heart is,40,619,,False,False,13209,,,0,0,0.4,0.0,neutral
2021-03-12 01:35:21,1370186617420386308,This is so sad.  ,982013498464129024,Politigolf1,"Bucks County, PA",65,3403,,False,False,15567,,,0,0,1.0,-0.5,negative
2021-03-12 01:35:21,1370186617118457856,"thenewsoncnbc: President Biden says he will direct all states, tribes and territories to make all adults eligible for vaccination no la…",1017301814864220161,PotamusHippo1,,610,17517,,False,False,11360,,,24,0,0.4,0.1,positive
2021-03-12 01:35:20,1370186616699035648,"Please do not mix vaccination brands. There are no clinical trials for this yet.
Get Moderna two shot vaccine stay with Moderna for booster shot and future updates.
Get J&amp;J one shot vaccine stay with J&amp;J for future updated shots. Consider this before you choose a vaccine.",916902297820717057,tastycaketaster,"Mobile, AL",257,11025,,False,False,6000,,,0,1,0.125,0.0,neutral
2021-03-12 01:35:20,1370186616657084416,MichelleRempel: I just asked NACI if they would have recommended the off label usage of the Pfizer vaccine (four month dosing interval…,282876636,binarycrystal,,192,28966,,False,False,11975,,,355,0,0.0,0.0,neutral
2021-03-12 01:35:20,1370186616405381121,"Baker admin ‘created’ COVID vaccine supply issue by making teachers return to class by April, House Speaker Ron Mariano says  ",90497137,forzadepor13,MA,49,20284,,True,False,12441,,,0,0,0.0,0.0,neutral
2021-03-12 01:35:20,1370186615738359813,Brindlepooch: Four former presidents combine efforts to educate U.S. citizens on COVID vaccination and increase the number of people va…,129024739,DrDignity,"Palm Springs, CA",2707,12680,,True,False,31634,,,94,0,0.0,0.0,neutral
2021-03-12 01:35:20,1370186614782132224,"leselec27: PM Morrison now has another job Minister for Health this should go well as he has failed at every other job he had.
Now Stat…",1165169070037094400,JordanSprings8,,511,51924,,False,False,18848,,,1,0,0.3375,-0.3125,negative
2021-03-12 01:35:20,1370186613045788675,"Anyone pro-coved vaccine need to read this.  It's government advice for 'healthcare professionals'.  Some of it I don't understand, but if you read it. It's fucking scary.  Even the bits you 'can' understand. and propaganda is persuading you to take it.

",21479903,petemorristwit,"Barnsley, England",11276,23854,,True,False,69326,,,2,6,0.55,-0.3,negative
2021-03-12 01:35:19,1370186612689145857,9NewsAUS: President Joe Biden has confirmed the US has secured enough vaccines to inoculate every adult in the country by the end of Ma…,1238467680773894146,CoronaUpdateBot,,1171,65,,False,False,587903,,,5,0,0.6,0.16666666666666666,positive
2021-03-12 01:35:19,1370186612378898434,"eb454: If you’re a Biden supporter and you got the COVID vaccine, just remember it’s because of Trump and Operation Warp Speed.",1120387425707147264,PatriotsRmaga,S.Jersey Shore,2633,158803,,False,False,56646,,,42,0,0.0,0.0,neutral
2021-03-12 01:35:19,1370186611841896451,"SharylAttkisson: 2-Contrary to President Biden's advice, FDA advises you should not get Covid vaccine if you're allergic to any ingredi…",3301042497,MariMagforever,,335,82829,,False,False,71773,,,144,0,0.0,0.0,neutral
2021-03-12 01:35:19,1370186608721461248,"Evelyn55996644: ""Pfizer CEO Albert Bourla, 59, cancels his trip to Israel because he's not fully vaccinated and 'didn't want to jump th…",1356227332504236040,Iobey10,,216,10405,,False,False,9255,,,1,0,0.0,0.0,neutral
2021-03-12 01:35:18,1370186608633376771,"EricBoehlert: i found the dumbest sentence of the week: 

&lt;Despite calls for national unity and bipartisanship, President Joe Biden and…",3627313815,Ann67241,,420,352993,,False,False,141851,,,494,0,0.0,0.0,neutral
2021-03-12 01:35:18,1370186607148462089,AlexSamuelsx5: New: Some may interpret Black Americans’ low COVID-19 inoculation rates as vaccine hesitancy. But issues like accessibil…,14934284,devans00,"Silicon Valley, CA",2292,242946,,True,False,291907,,,398,0,0.395959595959596,-0.010101010101010102,negative
2021-03-12 01:35:18,1370186606712344577,Have you gotten or planning on getting the Covid vaccine?,1592307180,Death2Tyrants84,,1215,39000,,True,False,39234,,,2,1,0.0,0.0,neutral
2021-03-12 01:35:18,1370186606196400128,"TCPHB Weaverville POD - Moderna 2nd Dose Clinic
101 Memorial Drive, Weaverville, CA 96093
Fri - 9:00AM-3:00PM
Sign up at: ",1359242890241667072,CAVaccine,CA,213,3,,False,False,1292,,,0,0,0.0,0.0,neutral
2021-03-12 01:35:18,1370186605638553602,DavidLeopold I got my second Pfizer shot a little over 2 weeks ago. No side effects at all other than a slightly sore arm. Having dinner with my grandkids tonight.,21942196,KayEllen48,,278,2596,,False,False,24924,,,0,1,0.2604166666666667,-0.11979166666666664,negative
2021-03-12 01:35:17,1370186601310126083,mariamainmo: Girls don't want boys. They want the covid vaccine and a nice apartment,602938917,RCADEFlRE,ellllll ayyyyy *on hiatus*,722,62583,,True,False,36402,,,24492,0,1.0,0.6,positive
2021-03-12 01:35:16,1370186599913422853,"CNNPolitics: “All adult Americans will be eligible to get a vaccine no later than May 1,"" President Biden announces. ""That doesn't mean…",18199034,angelwolf71885,Florida USA,275,112254,,False,False,46845,,,145,0,0.15,0.05,positive
2021-03-12 01:35:16,1370186596910206979,"CBSNews: BREAKING: President Biden announces he is directing all states, tribes and territories to make all U.S. adults 18 and older el…",53518171,peoplescrtic,Seattle WA,1562,1036,,True,False,184825,,,242,0,0.3333333333333333,0.16666666666666666,positive
2021-03-12 01:35:15,1370186594393546754,"CTVAtlantic: Due to the COVID-19 pandemic, Matthew MacDonald hasn't left his Cape Breton home much in the past year. MacDonald, 28, liv…",388532629,WesleyCoughlan,"Miramichi, New Brunswick, CAN",1502,375700,,True,False,398053,,,4,0,0.20625,-0.04375,negative
2021-03-12 01:35:15,1370186593701670913,"CTV_PowerPlay CPHO_Canada I am looking for a complete ingredient list on all versions of AstraZeneca.  Can anyone advise?  Anyone?

Oh, and it's probably too late to put the skeptics at ease.
No matter what the headlines state.
",1204932083887595520,NightflyThe,,39,353,,False,False,1753,,,0,0,0.5,-0.1,negative
2021-03-12 01:35:15,1370186593634545665,CVS adding 74 more COVID-19 vaccine sites in Texas ,2363765797,KTABTV,"Abilene, Texas",6115,735,,False,True,56277,,,0,0,0.5,0.5,positive
2021-03-12 01:35:15,1370186593424801792,"thenewsoncnbc: “I need every American to do their part,” President Biden says, calling on Americans to get vaccinated when they’re elig…",1210345957558276098,EvaColin9,,1044,226184,,False,False,76229,,,42,0,0.0,0.0,neutral
2021-03-12 01:35:15,1370186592673927168,"i_amdinesh: Dharma2X Swamy39 8 European Nations Stop AstraZeneca COVID-19 Vaccine On Reports Of “Serious” Blood Clots

",1394171118,gh14sharma,,55,7988,,False,False,20159,,,28,0,0.3333333333333333,-0.16666666666666666,negative
2021-03-12 01:35:15,1370186592669818886,mariamainmo: Girls don't want boys. They want the covid vaccine and a nice apartment,53962392,SophiaPoole,Chi town,105,9007,,False,False,1043,,,24492,0,1.0,0.6,positive
2021-03-12 01:35:15,1370186592267206660,"CNNPolitics: “All adult Americans will be eligible to get a vaccine no later than May 1,"" President Biden announces. ""That doesn't mean…",16872022,Alejo_Manrique,"Bogota, CDMX, New York City",2054,8250,,True,True,26272,,,145,0,0.15,0.05,positive
2021-03-12 01:35:14,1370186590006349824,sherylp461: Bill_Maxwell_ Pfizer developed their vaccine first unaided by trump or his money and was no part of his scheme,808089528,TerryDycus,US,237,67295,,False,False,45724,,,5,0,0.31666666666666665,0.175,positive
2021-03-12 01:35:14,1370186588974579712,President Joe Biden has confirmed the US has secured enough vaccines to inoculate every adult in the country by the end of May. 9News  ,22993014,9NewsAUS,Australia,627285,468,,False,True,311123,,,5,16,0.6,0.16666666666666666,positive
2021-03-12 01:35:14,1370186588622364675,SharylAttkisson: 3-The vaccine is *not* approved for current emergency use for anyone under 16 or 18 (depending on the brand). Therefor…,1295047242399862785,FashYourself,,800,3776,,False,False,4018,,,180,0,0.4,0.0,neutral
2021-03-12 01:35:13,1370186585136893954,"MichelleObama: When you can get the COVID-19 vaccine, I hope you do—Barack and I are certainly glad we did. It’s our best shot at beati…",1725653964,toymom303,,181,99774,,False,False,114496,,,7458,0,0.65,0.75,positive
2021-03-12 01:35:13,1370186584570560512,"Covid-19 Vaccine Tracker Updates: 2021-03-12

░░░░░░░░░░ 1.38% +0.84 Nepal
░░░░░░░░░░ 9.45% +1.65 Netherlands
░░░░░░░░░░ 0.37% +0.17 New Zealand
░░░░░░░░░░ 2.88% +1.58 Northern Cyprus",1357684898807517184,vaccinneprogres,,94,11,,False,False,582,,,0,0,0.4545454545454545,0.13636363636363635,positive
2021-03-12 01:35:13,1370186584155295745,"ElvisSinosic The Astra-Zeneca vaccine is different in its approach and I haven't yet been able to trace what part of the clotting cascade is potentiated to cause this issue, but its drastically less than GETTING the Virus and dealing with COVID. ",1236393183610671105,scubatropin,,25,121,,False,False,866,,,0,1,0.4305555555555556,0.11111111111111112,positive
2021-03-12 01:35:13,1370186583781953537,"eb454: If you’re a Biden supporter and you got the COVID vaccine, just remember it’s because of Trump and Operation Warp Speed.",945295509501067265,momonyc19,,163,7219,,False,False,22241,,,42,0,0.0,0.0,neutral
2021-03-12 01:35:12,1370186583417180164,SharylAttkisson: 3-The vaccine is *not* approved for current emergency use for anyone under 16 or 18 (depending on the brand). Therefor…,36163273,LadyDi1843,,127,1022,,False,False,1154,,,180,0,0.4,0.0,neutral
2021-03-12 01:35:12,1370186582641176578,"ABC: Pfizer's vaccine is successful in preventing not only symptomatic COVID-19, but also asymptomatic disease according to new real-wo…",1027870706724265985,cornishpixxies,,104,60712,,False,False,125052,,,326,0,0.8015151515151514,0.2954545454545455,positive
2021-03-12 01:35:12,1370186581328363522,"Richardkimble45 Does anyone know what the hell he’s talking about ? People live in fear from being shot in Portland, Seattle and Minnesota more than from Covid. And Joe you didn’t get the vaccine going. It would be five years minimum for your administration to get it done.",1149188659276648448,OU812BITCH,Everywhere my feet take me,29,944,,True,False,1451,,,0,1,0.5,0.3181818181818182,positive
2021-03-12 01:35:12,1370186579864608772,politico: Biden gives first primetime address one year after Covid-19 shutdown  ,230832125,ebscbwi,"eileenlovercheck,webster, tx",717,2814,,True,False,330562,,,33,0,0.3333333333333333,0.25,positive
2021-03-12 01:35:12,1370186579474534401,SharylAttkisson: 3-The vaccine is *not* approved for current emergency use for anyone under 16 or 18 (depending on the brand). Therefor…,2470064492,TikiTiQue,,1018,390959,,False,False,189968,,,180,0,0.4,0.0,neutral
2021-03-12 01:35:11,1370186579126403082,"SharylAttkisson: 5-Likewise, since the FDA says there was no evidence in studies as to what happens with pregnant women, they should di…",743311013747920897,murphtoday,USA,7141,209928,,False,False,142669,,,49,0,0.5,0.3333333333333333,positive
2021-03-12 01:35:11,1370186578027544577,"WhiteHouse Jan 11 2020 China uploaded virus gene sequence.
Oct 22 2020 VRBAC met to discuss vaccines.
Dec 10 2020 met on the Pfizer BioNTech EUA.
Dec 17 2020 met on Moderna EUA.
Data cutoff for 2-month phase III for Janssen was Jan 22 2021.
Feb 26, 2021 met on Janssen Biotech vaccine EUA.",1231590638,LarryBoorstein,"Virginia, USA",2981,70369,,True,False,142399,,,0,0,0.0,0.0,neutral
