created,id_str,text,user_id,screen_name,location,followers_count,user_favourites_count,time_zone,geo_enabled,verified,status_count,geo,coords,retweet_count,tweet_favourite_count,Subjectivity,Polarity,Sentiment
2021-03-12 01:33:07,1370186057325686789,What you need to know about COVID-19 vaccines in Washington Thursday ,19430999,KING5Seattle,"Seattle, Washington, USA",675291,30242,,True,True,358263,,,5,5,0.0,0.0,neutral
2021-03-12 01:33:07,1370186055836647428,SharylAttkisson: 3-The vaccine is *not* approved for current emergency use for anyone under 16 or 18 (depending on the brand). Therefor…,24641813,tryasyoumust,,38,860,,False,False,1994,,,180,0,0.4,0.0,neutral
2021-03-12 01:33:07,1370186055232671744,"gforbes: Ford, of course, has had two doses of the Pfizer already, as has his family - or so I hear from a little birdy",162536320,nomine_Artemis,Where it matters,1091,32255,,True,False,56347,,,107,0,0.5,-0.1875,negative
2021-03-12 01:33:06,1370186054834208770,"SharylAttkisson: 5-Likewise, since the FDA says there was no evidence in studies as to what happens with pregnant women, they should di…",103465324,madasa2,USA,46,72620,,False,False,29700,,,49,0,0.5,0.3333333333333333,positive
2021-03-12 01:33:06,1370186054796517379,"allieb10017: In one week, eight family members were diagnosed with COVID-19. Ages 3 to 71. The eldest is in the hospital on oxygen. Ton…",462455162,finniesfriend,,8364,42476,,False,False,61770,,,244,0,0.0,0.0,neutral
2021-03-12 01:33:06,1370186054272188418,MedicVet68 Good! I wanted this one because of the one dose. But I am getting the Pfizer vaccine tomorrow. I just want to get it done! My other one is scheduled for 3 weeks from tomorrow's date. I'm ready! 💉💪🏽,1533041618,geegeejp,,1326,267334,,False,False,29144,,,0,0,0.4916666666666667,0.375,positive
2021-03-12 01:33:06,1370186054171422735,"craftsandtools I'm doing well! Just got a job giving the covid vaccine here, I'm a wee bit excited.",2460920030,SkerryKerri,"Geelong, Victoria",370,12043,,False,False,11984,,,0,0,0.75,0.375,positive
2021-03-12 01:33:06,1370186053689085954,"Australia mulls $1bn proposal to build biopharma campus to boost its medicines' supply chain resilience as ""vaccine nationalism"" in the EU threatens Covid-19 vaccine imports  FT ",251206909,JamieSmythF,"Sydney, Australia",6805,562,,True,False,5836,,,2,1,0.0,0.0,neutral
2021-03-12 01:33:06,1370186053613666307,sallyKP: 3 More EU Countries Hit Pause on AstraZeneca After Reports of Illness and Deaths ,1070420203450830849,AnonLoomom,,1267,30735,,False,False,55163,,,18,0,0.75,0.5,positive
2021-03-12 01:33:06,1370186053311664129,AllenLEllison: . marcorubio didn’t give a damn about you during this entire pandemic. He even skipped your grandparents in line to get…,103076909,jimdjr1522,"Florida, USA",4003,44334,,False,False,179686,,,564,0,0.625,0.0,neutral
2021-03-12 01:33:06,1370186052338642945,"NewsHour: NEW: President Biden will direct states and territories to make all U.S. adults eligible for a COVID-19 vaccine by May 1. 

…",1352704401232822275,TeeGeorge7,,10,3564,,False,False,3517,,,178,0,0.4272727272727273,0.11818181818181818,positive
2021-03-12 01:33:05,1370186049394253826,"CDCgov: If you get a COVID19 vaccine, wait at least 14 days before getting any other vaccine, including those for flu or shingles. If…",1314891875380232194,BestHealthPC,Bridgeport CT,3,10,,False,False,80,,,244,0,0.3875,-0.2125,negative
2021-03-12 01:33:05,1370186048907718657,bstokesmitchell: The bad/good news is that today I’m old enough to qualify for a NY State Covid vaccine.  The great news is that I got…,39421059,ActorAaronBooth,Minneapolis,6046,25137,,True,False,165021,,,11,0,0.4833333333333333,0.3,positive
2021-03-12 01:33:05,1370186048018526211,MSNBC Got my 1st Moderna today.  Registered on Tuesday in Houston TX.  Feel like I won the lottery.   Thank God for Joe Biden!   Go Joe!,3483582680,WalkinPaul,Earth Most Days,61,17537,,False,False,1351,,,0,1,0.0,0.0,neutral
2021-03-12 01:33:05,1370186047829643264,SharylAttkisson: 3-The vaccine is *not* approved for current emergency use for anyone under 16 or 18 (depending on the brand). Therefor…,3915420798,rebeccaOden1,"California, USA",4072,260873,,True,False,58574,,,180,0,0.4,0.0,neutral
2021-03-12 01:33:04,1370186046395285505,disclosetv: JUST IN - Norway and Denmark suspend Oxford-AstraZeneca COVID19 vaccine rollout.,1262670168,noTyranny4ever,Eternity ,1277,85610,,True,False,22955,,,2522,0,0.0,0.0,neutral
2021-03-12 01:33:04,1370186046156210178,"KristinaRex What is the minimum age for pre-registration? Pfizer is approved for 16+ &amp; the other two are for 18+. Can  children be pre-registered while waiting for vaccine approval for younger ages, or do they need to wait till they are 16 (or 18) before they can be preregistered?",432954486,essayingmoves,Marlborough Public Schools,901,12524,,True,False,3443,,,0,0,0.1875,-0.0625,negative
2021-03-12 01:33:04,1370186045665464332,"ACPM_HQ: Vaccines save millions of lives every year. That’s why we are launching our VaccineConfident campaign,
because we want our co…",1338333294,MariaCMoraP,"Wisconsin, USA",4508,61502,,True,False,22553,,,2,0,0.0,0.0,neutral
2021-03-12 01:33:04,1370186042947604482,politico: Biden gives first primetime address one year after Covid-19 shutdown  ,30595199,samy45,,1015,58035,,True,False,394568,,,33,0,0.3333333333333333,0.25,positive
2021-03-12 01:33:03,1370186040615563266,"529 K Dead Americans are hopefully haunting you and every other republican denier 
GQPTraitors 

Donald Trump Demands Americans Picture His Face While COVID Vaccine Enters Their Bodies - Vanity Fair ",2768913394,pullenpoynt1,#ConvictTrump  - Resist ,5036,72940,,False,False,37635,,,0,0,0.5583333333333333,0.125,positive
2021-03-12 01:33:03,1370186039793307651,Steve_Dangle You think the Leafs need the Covid vaccine or anti-venom?   snakebitten Apologies for being topical.,1366929420947050496,KidCatholic1,,0,62,,False,False,172,,,0,0,0.05,0.0,neutral
2021-03-12 01:33:03,1370186039424385026,"TIME: Novavax reports its COVID-19 vaccine is 96% efficacious, based on Phase 3 trial results
",2259067080,JoanTravis12,,107,5975,,False,False,4405,,,84,0,0.0,0.0,neutral
2021-03-12 01:33:02,1370186036979073035,AJPreziosi I got notified tonight I’m scheduled for dose 1 of Pfizer in Fla. Especially happy it’s Pfizer cause they wouldn’t play games with tRump admin,816680274503364608,bjPtrade,"Tampa, FL & Waynesville, NC",367,34890,,False,False,13707,,,0,1,1.0,1.0,positive
2021-03-12 01:33:02,1370186035079053313,"SharylAttkisson: 2-Contrary to President Biden's advice, FDA advises you should not get Covid vaccine if you're allergic to any ingredi…",886369257566724099,MJ72804966,"Florida, USA",308,163875,,False,False,29076,,,144,0,0.0,0.0,neutral
2021-03-12 01:33:02,1370186034915520516,newsmax: Trump hopes everyone remembers him when they get their vaccine  ,1364772209110220802,colleenmr62,Pennsylvania,13,26,,True,False,18,,,398,0,0.0,0.0,neutral
2021-03-12 01:33:02,1370186034722566151,What to Expect: COVID-19 Vaccine Side Effects ,2378851076,AmegidAbd,egypt,837,37,,False,False,46375,,,0,0,0.0,0.0,neutral
2021-03-12 01:33:02,1370186034517004289,"bpmena: CONFIRMED: POTUS is directing all states to make all American adults eligible for the COVID-19 vaccine no later than May 1.

H…",921127739280650240,AllysaTellez,"Lubbock, TX",475,1559,,False,True,1496,,,3,0,0.3333333333333333,0.13333333333333333,positive
2021-03-12 01:33:02,1370186034198183939,"TIME: Novavax reports its COVID-19 vaccine is 96% efficacious, based on Phase 3 trial results
",63012764,blooferdame,Milky Way Galaxy,200,1407,,True,False,2288,,,84,0,0.0,0.0,neutral
2021-03-12 01:33:01,1370186033027948549,"And, uh, abbott...why in hell have you excluded grocery workers from vaccine access? 
It’s time you were replaced.

As Abbott hits Biden for releasing migrants with COVID, White House asks why Texas rejects funds to test them ",4248802152,DlRotroff,somewhere between two beats,14110,39229,,True,False,69329,,,1,1,0.0,0.0,neutral
2021-03-12 01:33:01,1370186031065137154,"CBSNews: BREAKING: President Biden announces he is directing all states, tribes and territories to make all U.S. adults 18 and older el…",61837787,jenannrodrigues,MA,2301,1091,,True,False,209433,,,241,0,0.3333333333333333,0.16666666666666666,positive
2021-03-12 01:33:00,1370186029508915203,SpokaneCity: It’s important that you do not receive any other vaccinations right before you receive your COVID-19 vaccine. You need to…,948634455442419715,Mopor777,"Spokane, WA 🇺🇸",1500,246273,,False,False,81005,,,4,0,0.6369047619047619,0.1869047619047619,positive
2021-03-12 01:33:00,1370186029395800069,bhrenton: President Biden has implemented the next phase of a comprehensive strategy to make all adults eligible for the vaccine by May…,3349241,TimFullerton,"New York, NY",13564,19797,,True,True,52442,,,10,0,0.0,0.0,neutral
2021-03-12 01:33:00,1370186028057649153,sambowne: Virginia Kroger gave people 'empty syringes instead of the COVID-19 vaccine' | TheHill ,35077224,sudoneuron,Pacific Northwest,744,19685,,False,False,3938,,,3,0,0.5,-0.1,negative
2021-03-12 01:33:00,1370186026807885829,"Reuters: Health authorities in Denmark, Norway and Iceland have suspended usage of the COVID-19 vaccine produced by AstraZeneca after r…",1463258990,ahmed_abbah,Nigeria,402,1774,,False,False,26667,,,291,0,0.0,0.0,neutral
2021-03-12 01:33:00,1370186026614919171,"The supply of AstraZeneca vaccines against the coronavirus disease is expected to arrive in Negros Occidental province in the next two days.

",823349574739734528,pnagovph,Quezon City,23822,12143,,True,True,76949,,,0,1,0.2,-0.05,negative
2021-03-12 01:33:00,1370186025679663105,"CanadianPM 
When will Ontario be receiving the Pfizer and Moderna vaccines?",599420651,OliverMayaAndMe,Canada,742,22107,,False,False,12091,,,0,0,0.0,0.0,neutral
2021-03-12 01:33:00,1370186025675407360,"kayleighmcenany Shut up
",861016368455483392,GatsMomm,,1586,69482,,False,False,26996,,,0,0,0.0,0.0,neutral
2021-03-12 01:32:59,1370186022886121473,"cantcensorusall POTUS That's not an argument. Warp Speed helped, yes, but it was far from delivering on the promises that were claimed. And Pfizer managed to put out a more reliable vaccine without using the funds from the Project.",2202513882,keefe_todd,Susanville,4,77,,False,False,1628,,,0,3,0.75,0.3,positive
2021-03-12 01:32:58,1370186020696723457,The U.S. Is Sitting on Tens of Millions of Vaccine Doses the World Needs ,437753224,joechoreo,"Los Angeles, CA",428,4749,,True,False,5393,,,0,1,0.0,0.0,neutral
2021-03-12 01:32:58,1370186020570820612,KatiePavlich when you definitely know how the covid vaccine works,4564434092,gazing_at_porno,"California, USA",71,31291,,False,False,7590,,,0,0,0.5,0.0,neutral
2021-03-12 01:32:58,1370186020474478592,newsmax: Trump hopes everyone remembers him when they get their vaccine  ,823399089618518016,BigBear54321,,83,8426,,False,False,4162,,,398,0,0.0,0.0,neutral
2021-03-12 01:32:58,1370186019492880386,"At LEAST 9 countries have paused the vaccine use, or certain batches of it. 
If there's no problem, why did they pause using AstraZeneca? In a time of uncertainty, Health Canada's statement is not exactly reassuring.
HealthCanada
",1253776930525966336,TheMorrigan47,Alberta,616,22629,,False,False,21001,,,0,0,0.4071428571428572,-0.07023809523809524,negative
2021-03-12 01:32:58,1370186017911738369,YoureAllDunces: The Vaccine Passport 'Global Deal' &amp; Experts The World Over Speak Out About COVID Vaccine Concerns ,1208677095951523840,MasseyN9,"Meath, Ireland",343,19217,,False,False,6106,,,26,0,0.0,0.0,neutral
2021-03-12 01:32:57,1370186015734964224,Rite Aid expands eligibility for COVID-19 vaccine ,30264308,KGETnews,"Bakersfield, CA",65810,2758,,True,True,62902,,,2,2,0.0,0.0,neutral
2021-03-12 01:32:57,1370186015328067598,"BarackObama: Michelle and I got vaccinated against COVID-19 because we know it’s the best way to beat this pandemic, protect one anothe…",72697263,kimfeldpausch,Southwest Michigan,5120,401,,True,False,9376,,,8941,0,0.3,1.0,positive
2021-03-12 01:32:57,1370186013574901762,"renegadecut: if you qualify for the vaccine due to your medical history, immune system, or dangerous career, get the vaccine. listen to…",760854597145690112,ntentionlnachos,,377,158167,,False,False,95526,,,16,0,0.425,-0.2416666666666667,negative
2021-03-12 01:32:56,1370186011075088389,"NBCPolitics: BREAKING: House passes $1.9T Covid relief bill that includes $1,400 checks, $300/wk jobless benefits, child allowance of u…",25259962,ZulaQi,,4023,63858,,False,False,323149,,,4953,0,0.0,0.0,neutral
2021-03-12 01:32:55,1370186007748956163,danieteebee: It’s completely predictably American that the brand of COVID vaccine you have access to has now become a class signifier,1247571141654384640,JoseyLifts,"Florida, USA",672,13938,,True,False,2824,,,10124,0,0.0,0.0,neutral
2021-03-12 01:32:55,1370186007195348992,nottt my dad driving like dale earnhardt jr to take me to get my covid vaccine bc i’m scared to go alone n the pharmacy closes in 30 min 😂😂😂😂,531788843,alyssamichalsky,tx,1152,32419,,True,False,45861,,,0,3,0.0,0.0,neutral
2021-03-12 01:32:55,1370186005786071042,"Scoop ! breaking  
EU Exported 25 Million Vaccine Doses in February Despite Supply Crunch At Home
lafautealeurope  quatremer YANoghes
klandaburu
jugasparutto 
 ",1243621370589831169,Provost__J,,5,4,,False,False,2,,,0,0,0.0,0.0,neutral
2021-03-12 01:32:55,1370186005257543685,"CalebJSmith Pfizer was the first approved, and had ZERO to do with Warp Speed.. ZERO !!
Try again trumper ..",929020763339927552,dmp2you,,23,13395,,False,False,10051,,,1,1,0.3333333333333333,0.390625,positive
2021-03-12 01:32:55,1370186004745838594,"kaylatausche: 14/ In one year:
- 10 million net jobs have been lost.
- 29 million Americans have contracted COVID-19
- 530,000 have die…",993358020,sadieark,NW Oh,9542,6194,,True,False,85247,,,91,0,0.0,0.0,neutral
2021-03-12 01:32:54,1370186003244269574,"CNN: “All adult Americans will be eligible to get a vaccine no later than May 1,"" President Biden announces. ""...That doesn't mean ever…",42064840,edotom,,202,22860,,True,False,22885,,,255,0,0.32916666666666666,-0.07083333333333333,negative
2021-03-12 01:32:54,1370186002602541065,"OD_ant: If you die from Covid, but had a comorbidity...you MOST definitely died from Covid.

BUT- if you die from a VACCINE and have a…",1578642072,redwngs5fan,"Taneytown, Md",172,48413,,False,False,8779,,,144,0,0.5,0.25,positive
2021-03-12 01:32:54,1370186002401128451,"CMOH_Alberta: As of 2:30pm 23K+ ABs have signed up for AZ. Based on expected supply, starting at 8 a.m. tomorrow, ABs born in 1957-60 c…",824395019993939968,Lyss5778,"Edmonton, Alberta",31,9134,,True,False,1038,,,10,0,0.25,-0.05,negative
2021-03-12 01:32:54,1370186001587580933,tabnola yep. zay had a headache today too. i got moderna.,893233584982634497,_erikadionne,"Mississippi, USA",221,27060,,True,False,9032,,,0,1,0.0,0.0,neutral
2021-03-12 01:32:54,1370186001432383489,NBCNews: BREAKING: President Biden is expected to call for all U.S. adults to be eligible to receive the vaccine no later than May 1; w…,2854203381,okokeilish_,"Toronto, Ontario",1291,62603,,True,False,59763,,,256,0,0.2,-0.05,negative
2021-03-12 01:32:54,1370186001251852291,"ZeeNewsEnglish: Canadian billboard thanks PM narendramodi for providing COVID19 vaccine.

",1286097056021413888,vikasra34374186,,503,17350,,False,False,9788,,,32,0,0.2,0.2,positive
2021-03-12 01:32:53,1370185999742013444,"noahweiland: Scoop: The U.S. is sitting on tens of millions of doses of the AstraZeneca vaccine in Maryland and Ohio facilities, and of…",1676685152,Eyesgack,"Chicago, IL",1872,10498,,False,False,10286,,,360,0,0.0,0.0,neutral
2021-03-12 01:32:53,1370185998248902658,"Heritage Pfizer didn't take a dime and didn't participate. And Donny turned down an offer from Moderna for a pre-order for 200 million doses. So no - ""Warp Speed"" only deserves credit for how behind we are and how ahead we could have been. Assholes.",23042143,Ari_Kleit,"ÜT: 40.24749,-74.303197",408,4139,,True,False,4483,,,1,7,0.662962962962963,-0.1851851851851852,negative
2021-03-12 01:32:53,1370185996948627457,"VickyisGrateful: President Biden has declared that by May 1st, 2021, EVERYONE will be able to get a Covid-19 Vaccine in America. And he…",1012604486,sandy06906,Northeast,11196,61267,,True,False,33085,,,6,0,0.625,0.5,positive
2021-03-12 01:32:53,1370185996751532033,"rockinwprogress DailyCaller So... let me get this straight, you’re agreeing that we already had enough for 2/3rds of our people with a further 800 million optional (from Pfizer + Moderna) ... within a few weeks of these things being approved...",822954895754018818,Gorilder,,21,4811,,False,False,1548,,,0,1,0.375,0.0,neutral
2021-03-12 01:32:52,1370185995895902208,"SharylAttkisson: 5-Likewise, since the FDA says there was no evidence in studies as to what happens with pregnant women, they should di…",987349405,susiemacphee,,239,36977,,False,False,7530,,,49,0,0.5,0.3333333333333333,positive
2021-03-12 01:32:52,1370185995115696132,"dw_business: An unconfirmed number of patients have developed blood clots after receiving the shot, according to health authorities. I…",1175867185614471168,James79124918,Heaven,84,1900,,False,False,3031,,,5,0,0.3,0.1,positive
2021-03-12 01:32:52,1370185994440429570,"Tam, Hajdu confident in Oxford-AstraZeneca vaccine despite European concerns - CTV News

I don’t believe you.  ",1478303342,kahnkidz,"Ontario, Canada",1219,54933,,False,False,29967,,,2,10,0.4166666666666667,0.25,positive
2021-03-12 01:32:52,1370185994398482437,The bad/good news is that today I’m old enough to qualify for a NY State Covid vaccine.  The great news is that I got my first dose! I’m glad I happened to be wearing my IATSE T-shirt. Particularly meaningful since tomorrow marks the 1-year closure of Broadway. ,851147851,bstokesmitchell,New York City,9729,42,,True,False,772,,,11,640,0.5472222222222222,0.36875,positive
2021-03-12 01:32:51,1370185990929838084,danielle_ivory: The nytimes has been tracking eligibility for the COVID vaccine on a daily basis in all 50 states. We've expanded that…,1091446817965801472,LaneyPope,"New York, USA",192,1631,,False,False,127,,,62,0,0.0,0.0,neutral
2021-03-12 01:32:51,1370185990841671681,"Kroger clinic patients receive empty shot instead of COVID-19 vaccine, ‘shot of nothing’ found harmless | 8News ",131142354,nana1dottie,,14,654,,True,False,8029,,,0,0,0.5,-0.1,negative
2021-03-12 01:32:51,1370185990401327105,"An important story on vaccine deserts by prosaaquino.

",410205211,nia_prater,,387,5982,,False,False,14402,,,2,11,1.0,0.4,positive
2021-03-12 01:32:51,1370185988694278145,Forbes: More states are moving toward opening the Covid-19 vaccine up to the general public sooner than May 1  h…,236976199,BurberryBeanz,SE DC,1112,134156,,True,False,192366,,,12,0,0.3555555555555556,0.18333333333333332,positive
2021-03-12 01:32:50,1370185987721097217,"Here in Canada, they are using, natives as guinea pigs, by giving all natives, the Covid Vaccine first🤔",760778275,KevinLeader2,Kelowna BC,460,7484,,False,False,4899,,,0,0,0.0,0.0,neutral
2021-03-12 01:32:50,1370185986865438720,RavenZech2 And if we could wait till their is more Pfizer and perhaps buy it,730236872308330500,sewviolets,"Newcastle, Australia",468,57247,,False,False,26327,,,0,1,0.5,0.5,positive
2021-03-12 01:32:50,1370185985540059137,"SharylAttkisson: 2-Contrary to President Biden's advice, FDA advises you should not get Covid vaccine if you're allergic to any ingredi…",24992182,Bowtimeready,"Washington, USA",2346,36169,,False,False,22662,,,144,0,0.0,0.0,neutral
2021-03-12 01:32:49,1370185982604107786,"CNN: “All adult Americans will be eligible to get a vaccine no later than May 1,"" President Biden announces. ""...That doesn't mean ever…",72697263,kimfeldpausch,Southwest Michigan,5120,401,,True,False,9376,,,255,0,0.32916666666666666,-0.07083333333333333,negative
2021-03-12 01:32:49,1370185980578312192,"DrFred57 Fucci AND the NIH own about 50% of moderna+ their future vax patents, allegedly.",3008532284,Grace3rd,Valley Forge,57,3208,,False,False,32,,,3,1,0.4083333333333334,0.16666666666666666,positive
2021-03-12 01:32:49,1370185979936473090,"kayleighmcenany ""truth"" Amazed you can spell the word.

President Biden has given Trump more credit than he deserves irt vaccine development.

Just be happy that President Biden hasn't given Trump the credit he's fully due on US Covid-19 Deaths.
Can't forget your role in adding to death numbers.",1346718077392543745,CliffUehara,,6,21,,False,False,851,,,0,0,0.625,0.39166666666666666,positive
2021-03-12 01:32:48,1370185978342735876,"CBSNews: BREAKING: President Biden announces he is directing all states, tribes and territories to make all U.S. adults 18 and older el…",53566508,josephbduda,Boston Massachusetts,276,3676,,True,False,46548,,,241,0,0.3333333333333333,0.16666666666666666,positive
2021-03-12 01:32:48,1370185976195256325,"taradublinrocks POTUS Which vaccine? I got first Pfizer and couldn't be happier. Excellent protection even against variants, &amp; I've not heard of many side effects. But I'd have taken any available.",198356488,Gavin1962,United States,224,3071,,True,False,7294,,,0,2,0.5583333333333333,0.5375,positive
2021-03-12 01:32:47,1370185975087857665,kinsellawarren: One year after all of this began - one year! - Canada is in 61st place in the world for COVID-19  vaccine doses adminis…,2817762150,marcykain,"Lethbridge, Alberta",45,3036,,False,False,1292,,,233,0,0.0,0.0,neutral
2021-03-12 01:32:47,1370185973208875008,"CNN: “All adult Americans will be eligible to get a vaccine no later than May 1,"" President Biden announces. ""...That doesn't mean ever…",236976199,BurberryBeanz,SE DC,1112,134156,,True,False,192366,,,255,0,0.32916666666666666,-0.07083333333333333,negative
2021-03-12 01:32:47,1370185973200416769,danieteebee: It’s completely predictably American that the brand of COVID vaccine you have access to has now become a class signifier,1963410697,theEcoCommunist, o’odham lands /az ,1111,103448,,True,False,13979,,,10124,0,0.0,0.0,neutral
2021-03-12 01:32:47,1370185972999188482,"renegadecut: if you qualify for the vaccine due to your medical history, immune system, or dangerous career, get the vaccine. listen to…",131642736,John_Divney_,,127,25351,,False,False,1491,,,16,0,0.425,-0.2416666666666667,negative
2021-03-12 01:32:47,1370185972336459776,"CNN: “All adult Americans will be eligible to get a vaccine no later than May 1,"" President Biden announces. ""...That doesn't mean ever…",574229603,4uto26,#worldwide #FRANCE #USA ,206,12790,,True,False,34453,,,255,0,0.32916666666666666,-0.07083333333333333,negative
2021-03-12 01:32:47,1370185972101476358,I got my 1st vaccine March 4 at a Smith's pharmacy. In and out within a half hour. vaccinated Moderna,287275623,Liberalibrarian,"Las Vegas, Nevada",4382,133932,,True,False,204096,,,0,5,0.16666666666666666,-0.16666666666666666,negative
2021-03-12 01:32:47,1370185971598307333,"POTUS: One in four adults in the U.S. has received their first COVID-19 vaccine — and we’re now leading the world in vaccinations.

Tha…",2440781685,thechefcloset,Jersey and DC,52,37138,,False,False,2855,,,15347,0,0.3333333333333333,0.25,positive
2021-03-12 01:32:46,1370185969404624901,European Countries Suspend Use of AstraZeneca Shots over Worries About Blood Clots ,1330828616523939840,rahman33665,,220,45,,False,False,81,,,0,0,0.0,0.0,neutral
2021-03-12 01:32:45,1370185966145658885,"CNBCnow: BREAKING: Biden signs $1.9 trillion Covid relief bill, clearing way for stimulus checks, vaccine aid 
",134253540,windjamer2be,,349,31677,,False,False,19233,,,437,0,0.0,0.0,neutral
2021-03-12 01:32:45,1370185964891557888,"AlexBerenson: Just wait until they hear what the mRNA vaccines can do...

Really, though, the side effect profile of the astrazeneca v…",54171175,lilyflower36,nederland ede,636,23543,,False,False,27669,,,317,0,0.2,0.2,positive
2021-03-12 01:32:45,1370185964874825728,xiaoaishiteru I think pfizer and moderna may have been developed in the us too?,1288172800084246531,jimincel_,"jan, she/her - read carrd byf",226,7237,,False,False,8419,,,0,1,0.3,0.1,positive
2021-03-12 01:32:45,1370185964635746306,"WHCOVIDResponse: By May 1st, every adult in this country will be eligible for a COVID-19 vaccine but we all have to do our part: Get yo…",178676071,MrsRPh817,,139,4548,,True,False,1870,,,878,0,0.3,0.1,positive
2021-03-12 01:32:45,1370185964375662599,"Everyone please continue to check to see when you are eligible to receive a Covid-19 vaccine. THEY ARE SAFE AND EFFECTIVE. They have gone through they SAME rigorous testing as every other vaccine, but without the red tape and lack of funding so they rolled out quicker.",1318359979016003585,saviin_jen,Occupied Menominee Land,149,7292,,False,False,5764,,,1,5,0.36,0.195,positive
2021-03-12 01:32:45,1370185963859771397,"TIME: Novavax reports its COVID-19 vaccine is 96% efficacious, based on Phase 3 trial results
",711676519274315776,xotier,Suiza,56,2873,,True,False,4203,,,84,0,0.0,0.0,neutral
2021-03-12 01:32:44,1370185960672100367,"MichelleObama: When you can get the COVID-19 vaccine, I hope you do—Barack and I are certainly glad we did. It’s our best shot at beati…",732228017028759556,sahanasinna,International,366,2218,,True,False,6307,,,7460,0,0.65,0.75,positive
2021-03-12 01:32:44,1370185960055529473,"NatGeoTV: Paid Content for Pfizer. Go inside the massive, historic effort to develop the first COVID-19 vaccine. Mission Possible: The…",28344563,skyew92,"New York, NY",122,3587,,True,False,4693,,,10,0,0.5833333333333333,0.0625,positive
