created,id_str,text,user_id,screen_name,location,followers_count,user_favourites_count,time_zone,geo_enabled,verified,status_count,geo,coords,retweet_count,tweet_favourite_count,Subjectivity,Polarity,Sentiment
2021-03-12 01:34:51,1370186494535688192,i want one moderna shot n one pfizer shot from a j&amp;j employee and then it’s like a cocktail from a bartender who’s studying to be a lawyer and is an actor on the side. u know,351909591,kroshea,uranus ,344,9564,,True,False,18646,,,2,2,0.0,0.0,neutral
2021-03-12 01:34:51,1370186492631527426,"kayleighmcenany: FINALLY the Biden admin recognizes the Trump admin’s unprecedented vaccine work:

➡️ “We’re grateful for the work that…",335682471,KarlaHobart,,116,33718,,False,False,1775,,,4197,0,0.95,0.3,positive
2021-03-12 01:34:50,1370186489582260233,ChrisGloverMPP: We must do better. My office created a step-by-step guide to help Torontonians book a vaccine appointment online: http…,344377989,Hurka,"Trinity-Bellwoods, Toronto",153,26912,,True,False,1601,,,1,0,0.5,0.5,positive
2021-03-12 01:34:50,1370186488256753665,mariamainmo: Girls don't want boys. They want the covid vaccine and a nice apartment,3926318834,ilyssa_lee,"Salt Lake City, UT",229,58489,,True,False,13170,,,24492,0,1.0,0.6,positive
2021-03-12 01:34:50,1370186487195635713,SharylAttkisson: 3-The vaccine is *not* approved for current emergency use for anyone under 16 or 18 (depending on the brand). Therefor…,1155528172940779521,Mandalynn0410,Indiana,37,296,,False,False,27508,,,180,0,0.4,0.0,neutral
2021-03-12 01:34:49,1370186485278765056,Swamy39: I have answers about the current COVID vaccine situation: ,2313154512,NitinSriv09,,23,2289,,False,False,2628,,,233,0,0.4,0.0,neutral
2021-03-12 01:34:49,1370186484821725188,"CNNPolitics: “All adult Americans will be eligible to get a vaccine no later than May 1,"" President Biden announces. ""That doesn't mean…",1044807393182437376,alaattinselim,"İzmir, Türkiye",215,12999,,True,False,26887,,,145,0,0.15,0.05,positive
2021-03-12 01:34:49,1370186484809146373,"BarackObama: Michelle and I got vaccinated against COVID-19 because we know it’s the best way to beat this pandemic, protect one anothe…",328773569,jennbaum1,,95,76704,,False,False,19962,,,8940,0,0.3,1.0,positive
2021-03-12 01:34:49,1370186484779728896,"EricBoehlert: i found the dumbest sentence of the week: 

&lt;Despite calls for national unity and bipartisanship, President Joe Biden and…",705550025183641600,answeryourshoe,Ohio,1736,99510,,False,False,60764,,,494,0,0.0,0.0,neutral
2021-03-12 01:34:49,1370186484557357056,"thenewsoncnbc: “I need every American to do their part,” President Biden says, calling on Americans to get vaccinated when they’re elig…",123926189,medical91,Canada/ USA,43136,27640,,False,False,202692,,,42,0,0.0,0.0,neutral
2021-03-12 01:34:49,1370186484419035137,cantpretendtoo: Wife’s Uncle got the Covid vaccine on Friday. Died this morning.  Sad.,18786099,Nvania,,2454,38563,,False,False,373612,,,346,0,1.0,-0.5,negative
2021-03-12 01:34:49,1370186484377075721,"My 20yo brother got his first moderna vaccine today. He spent 9 days in the PICU as a kid because of lung issues. Catching COVID likely would’ve sent him back to the ICU. 

Pretending that everyone who is “young” is also “healthy” is ableist. Let’s just not judge??? ",904083511497379843,NabihahKumte,"South Carolina, USA",1638,46468,,False,False,4347,,,0,7,0.4619047619047619,0.19285714285714287,positive
2021-03-12 01:34:49,1370186484158988288,"Personally, I would prefer the Pfizer or Moderna vaccine. What I’m reading about AstraZeneca &amp; Johnson-Johnson really have me a bit skeptical.",1106642207996547072,cydonbowen,"Grange Hill, Jamaica",1712,14652,,True,False,15597,,,0,13,0.3333333333333333,-0.1,negative
2021-03-12 01:34:48,1370186482787438594,"MichelleObama: When you can get the COVID-19 vaccine, I hope you do—Barack and I are certainly glad we did. It’s our best shot at beati…",818151993554456576,marysavage1957,"Indianapolis, IN",173,49055,,False,False,27897,,,7458,0,0.65,0.75,positive
2021-03-12 01:34:48,1370186482464522245,BOOM !!! President Trump secured options with all 3 vaccine makers to purchase an additional 700 MILLION doses in 2021 ! Biden has done nothing to battle Covid and except wear his mask inside out!  ,244720550,kandibar2011,"#Wisconsin , USA",5807,21531,,True,False,48394,,,1,1,0.0,0.0,neutral
2021-03-12 01:34:48,1370186481151606787,"Dharma2X: Dr. Swamy39 jee :

7 European countries – Denmark, Norway, Austria, Estonia, Latvia, Lithuania and Luxembourg – have suspend…",326003769,VarshaThacker,,2021,265486,,False,False,452374,,,2,0,0.0,0.0,neutral
2021-03-12 01:34:48,1370186479545241601,"jack84135042 CurtisHouck JoeBiden vaccine is *not* approved for current emergency use for anyone under 16 or 18 (depending on the brand). Biden said, no child should get Covid vaccine.",1275568954749202436,DannyM33612501,Home is where the heart is,40,619,,False,False,13209,,,0,0,0.4,0.0,neutral
2021-03-12 01:34:47,1370186478500810754,"iamnotkathy Cleavon_MD Two weeks out now from my second Moderna shot, just finished listening to our President’s speech and my anxiety/stress level is nearly nonexistent.",23639736,LaundryPrncss,,1151,65803,,True,False,41762,,,0,2,0.2,0.05,positive
2021-03-12 01:34:47,1370186478039355392,SharylAttkisson: 3-The vaccine is *not* approved for current emergency use for anyone under 16 or 18 (depending on the brand). Therefor…,2296378326,pharvey2001,"Los Angeles, CA",310,47090,,True,False,23492,,,180,0,0.4,0.0,neutral
2021-03-12 01:34:47,1370186476848316422,"noahweiland: Scoop: The U.S. is sitting on tens of millions of doses of the AstraZeneca vaccine in Maryland and Ohio facilities, and of…",1122731406,DrJLHazelton,,2369,67872,,False,False,72249,,,360,0,0.0,0.0,neutral
2021-03-12 01:34:46,1370186474176475137,narendramodi: Happy to share that my mother has taken the first dose of the COVID-19 vaccine today. I urge everyone to help and motivat…,4852371073,PoyekarSourabh,"मुंबई, भारत",17,25,,False,False,470,,,16050,0,0.6666666666666666,0.525,positive
2021-03-12 01:34:46,1370186473832468482,real_defender: Joe Biden taking credit for the Covid vaccine is the biggest lie I have ever seen.,1161007441573634048,Margare96897181,,323,23419,,False,False,27083,,,99,0,0.0,0.0,neutral
2021-03-12 01:34:46,1370186473484517376,"TIME: Novavax reports its COVID-19 vaccine is 96% efficacious, based on Phase 3 trial results
",1171650611131158528,Abrhjam,"Monterrey, Nuevo León",9,62,,False,False,87,,,84,0,0.0,0.0,neutral
2021-03-12 01:34:46,1370186472188383233,JanetteSpeyer: Covid vaccine: Biden will direct states to make all adults eligible by May 1 ,24290529,jennykim,"Washington, DC Newsletter👉",4224,58851,,True,False,382523,,,1,0,0.4,0.1,positive
2021-03-12 01:34:46,1370186471718547462,sunlorrie: Denmark suspends use of AstraZeneca Covid vaccine ,42135117,polluxc,,478,7431,,True,False,52435,,,117,0,0.0,0.0,neutral
2021-03-12 01:34:46,1370186470422573060,"POTUS: One in four adults in the U.S. has received their first COVID-19 vaccine — and we’re now leading the world in vaccinations.

Tha…",2193766470,CampbeOfficial,"Sydney, Australia",727,123037,,True,False,116761,,,15345,0,0.3333333333333333,0.25,positive
2021-03-12 01:34:45,1370186468249903106,"pettyTrader: Breaking911 So you can’t say it changes your DNA without being labeled misinformation, but that’s not what the chief medi…",231097014,AWOL_in_AK,USA,895,8022,,True,False,3452,,,19,0,0.0,0.0,neutral
2021-03-12 01:34:45,1370186468245782530,"CBSNews: BREAKING: President Biden announces he is directing all states, tribes and territories to make all U.S. adults 18 and older el…",1002672059997216769,Kayke99,"San Francisco, CA / BH",367,43522,,False,False,20198,,,242,0,0.3333333333333333,0.16666666666666666,positive
2021-03-12 01:34:45,1370186466161094657,EricMMatheny: Are we going to talk about the healthy 39 year old woman from Utah who got her second dose of the Moderna vaccine and the…,706648091617828864,RickWoo89291732,"Naples, FL",201,330,,True,False,17787,,,2659,0,0.2333333333333333,0.2,positive
2021-03-12 01:34:45,1370186466098221056,"Dharma2X: Dr. Swamy39 jee :

Use of AstraZeneca COVID-19 vaccine suspended in parts of Europe (CBC News) 🌟💥

",326003769,VarshaThacker,,2021,265486,,False,False,452374,,,2,0,0.0,0.0,neutral
2021-03-12 01:34:44,1370186465737633792,"RobinMartinPC is Ontario going ahead with astrazeneca even though denmark, and others stopped due to blood clotting",1009507404344487936,subermom2,,0,151,,False,False,47,,,0,1,0.375,-0.125,negative
2021-03-12 01:34:44,1370186464894521346,Yamiche 🤣🤣🤣Says the ‘man’ that denied Covid or even real science existed. Oh and he neglected to prepare for us to get the vaccine because he never ordered it. But now his GOPHypocrisy is blaming our current POTUS for his failures. Typical whitePrivilege,1082833654617985024,Virgini93201568,"Brooklyn, NY",95,3769,,False,False,1714,,,0,0,0.4000000000000001,0.011111111111111118,positive
2021-03-12 01:34:44,1370186464357576707,"SharylAttkisson: 2-Contrary to President Biden's advice, FDA advises you should not get Covid vaccine if you're allergic to any ingredi…",2954169932,6ftmommy,"Stuck in California, but Texan by birth",804,140474,,True,False,217340,,,144,0,0.0,0.0,neutral
2021-03-12 01:34:44,1370186462730330115,"kayleighmcenany: FINALLY the Biden admin recognizes the Trump admin’s unprecedented vaccine work:

➡️ “We’re grateful for the work that…",1348603684230459392,Newagepatriot2,,4,5021,,False,False,301,,,4197,0,0.95,0.3,positive
2021-03-12 01:34:44,1370186462046654469,BreakingNews: President Biden is expected to call for all U.S. adults to be eligible to receive the vaccine no later than May 1; will a…,97661467,TheAmazingBrdmn,#757 or whatever the kids say,175,3366,,True,False,4401,,,85,0,0.2,-0.05,negative
2021-03-12 01:34:43,1370186461845327873,"BarackObama: Michelle and I got vaccinated against COVID-19 because we know it’s the best way to beat this pandemic, protect one anothe…",1063902078224003072,ROBODIQUE,ALL OVER THE WORLD,251,3597,,False,False,37617,,,8940,0,0.3,1.0,positive
2021-03-12 01:34:43,1370186461803376644,"ScottGottliebMD DWUhlfelderLaw I live in a small Texas town and thus far the locally owned Pharmacy has no COVID 19 vaccines to administer. Some States, such as Texas are sadly lacking  as far as vaccine distribution goes.",1071598948576575488,Sarah18585983,,1196,85882,,False,False,32812,,,0,0,0.6285714285714287,-0.0590909090909091,negative
2021-03-12 01:34:43,1370186461480357890,newsmax: Trump hopes everyone remembers him when they get their vaccine  ,1275598167355068418,MsKimm_Texas,"Texas, USA",21,203,,False,False,396,,,398,0,0.0,0.0,neutral
2021-03-12 01:34:43,1370186461316739072,citlalli____: Didn’t know one of the covid vaccine side effects was having a gorilla grip kitty 😒😒😒💯‼️,745044827297873920,alexkkjh,"Pasadena, CA",230,44239,,True,False,15379,,,2,0,0.0,0.0,neutral
2021-03-12 01:34:43,1370186459290996742,NPRHealth: Moderna And Pfizer On Track To Hit Vaccine Production Goals ,2965592463,GreengrassAlfyn,,93,33063,,False,False,33870,,,72,0,0.0,0.0,neutral
2021-03-12 01:34:43,1370186458322063361,shalisemyoung Jodymcp And I got Pfizer! Haha,93360865,iammattcote,"Massachusetts, USA",869,89283,,True,False,58053,,,0,0,0.3,0.2,positive
2021-03-12 01:34:43,1370186457961365504,"Could spike protein in Moderna, Pfizer vaccines cause blood clots, brain inflammation and heart attacks? | Opinion | LifeSite ",1256188118,oaklogman,,10719,3721,,False,False,6464,,,0,1,0.0,0.0,neutral
2021-03-12 01:34:42,1370186457273483266,AlArabiya_Eng: SaudiArabia will be expanding its national coronavirus vaccine campaign to include a much larger segment of its popula…,761920203898904576,FwbravoFwwaleed,,269,26363,,False,False,16885,,,4,0,0.5,0.0,neutral
2021-03-12 01:34:42,1370186455264284673,"CBSNews: Biden says that if all eligible adults get the COVID vaccine when it's their turn, ""there's a good chance"" Americans can have…",878423250983944193,DanielLMacy,"Albuquerque, NM",2937,26282,,True,False,9077,,,112,0,0.6000000000000001,0.7,positive
2021-03-12 01:34:42,1370186454425538563,"EricBoehlert: i found the dumbest sentence of the week: 

&lt;Despite calls for national unity and bipartisanship, President Joe Biden and…",1136451548245049346,AudibleOtter,,1329,34502,,False,False,17197,,,494,0,0.0,0.0,neutral
2021-03-12 01:34:41,1370186453356064774,"🙄😒
""Biden administration is purchasing another 100 million doses of the Johnson &amp; Johnson COVID-19 vaccine""   ",1230496004253900801,Yeshua1111,,301,10217,,True,False,12922,,,1,1,0.0,0.0,neutral
2021-03-12 01:34:41,1370186452626239489,"The additional doses, when added to the vaccines from other sources, is more than enough to inoculate every American.
",22523286,Blueturtle2009,"Oregon, USA",448,29298,,True,False,52799,,,0,0,0.34375,0.09375,positive
2021-03-12 01:34:41,1370186451229405186,"8612 people received a vaccine today and 91,366 Albertans are now fully vaccinated against Covid. We are going to need that daily number to increase greatly in the coming days and weeks to keep up with the vaccine numbers that are coming.",20551907,manaboutcowtown,Calgary,2385,34313,,False,False,26786,,,0,4,0.375,0.4,positive
2021-03-12 01:34:41,1370186450147287041,"rick_rampal: Astrazeneca has been stopped from being used in several Scandinavian countries along with Luxembourg, Lithuania, Estonia e…",1132791264242307073,AnimaeOK,"Adelaide, South Australia",2360,264467,,False,False,170505,,,42,0,0.0,0.0,neutral
2021-03-12 01:34:40,1370186448243073025,"PaulMitchell_AB: ""39-Year-Old Mother Dies After 2nd Dose of Moderna Vaccine.... She was seemingly healthy as a horse... She had no know…",1362497955001896961,Exposn4Humanity,,211,6558,,False,False,6068,,,57,0,0.25,0.25,positive
2021-03-12 01:34:40,1370186447936962562,goldenlily2017 Yes! Pfizer or Moderna but not sure about J&amp;J as it looks to be less effective overall. I’m patiently (not!) waiting for an appointment for mine 👍🏼 (I am immunocompromised and feel as though it’s necessary for me),477454980,darblackcats,"Whitman, MA",817,119501,,False,False,10559,,,0,1,0.5511111111111111,0.03666666666666667,positive
2021-03-12 01:34:40,1370186447869853699,"nia_prater: An important story on vaccine deserts by prosaaquino.

",946441826,MatthewStieb,"Brooklyn, NY",612,19993,,False,False,1222,,,2,0,1.0,0.4,positive
2021-03-12 01:34:40,1370186446057840641,DonaldMBraden: I am sick of Pfizer guy saying he’s giving the world this vaccine. No he’s is charging high prices to realize massive pr…,422138186,M4ACalifornia,"California, USA",1726,194750,,True,False,103489,,,13,0,0.7990476190476189,-0.1847619047619048,negative
2021-03-12 01:34:40,1370186445793681409,"Imagecaptured: Remember when Biden fast tracked the covid vaccine? 

No, because it wasn't him who did that, it was President Trump.…",1347247861612892166,slbgirl3,United States,42,3445,,False,False,4682,,,37,0,0.6,0.2,positive
2021-03-12 01:34:39,1370186444271054850,"PhilCygnus: Well, well, who would have thought it?
Australia news live: News Corp photographer condemns 'toxic' sexism at tabloids; Ast…",231755724,paulbris2010,,3196,221641,,False,False,175252,,,1,0,0.5,0.13636363636363635,positive
2021-03-12 01:34:39,1370186442069078017,"“22 cases of thromboembolic events out of 3 million people vaccinated""

Hidden lede: ""an average efficacy of 70% in protecting against the virus""

",2955309247,Frances_Larina,"Northern California, USA",2661,154143,,False,False,70711,,,1,3,0.36666666666666653,-0.15833333333333333,negative
2021-03-12 01:34:39,1370186441830117376,KGETnews: Rite Aid expands eligibility for COVID-19 vaccine ,821322546591236097,hitsonlychiko,Global ,286,3104,,True,False,28784,,,2,0,0.0,0.0,neutral
2021-03-12 01:34:39,1370186441364504582,"rockinwprogress DailyCaller Biden came in with the job all done, all he needed to do is approve the further vaccines from J&amp;J, Pfizer, and Moderna that were already being made. 

Biden is a liar trying to get us to thank him for things he had no part in.",822954895754018818,Gorilder,,21,4811,,False,False,1548,,,0,3,0.5,0.0,neutral
2021-03-12 01:34:39,1370186440923963393,"Denmark and Norway suspend AstraZeneca covid vaccine over blood clot concerns, even as European regulator maintains it is safe - The Washington Post ",465790247,RosaleeAdams,,13739,28489,,True,False,263337,,,1,1,0.25,0.25,positive
2021-03-12 01:34:38,1370186439464525827,"jack84135042 CurtisHouck MISTAKE in President JoeBiden 's speech. He said ""Everyone should get vaccinated."" That is contrary to the actual advice from public health experts.
Contrary to Biden's advice, FDA advises you should not get Covid vaccine if you're allergic to any ingredient in the vaccine.",1275568954749202436,DannyM33612501,Home is where the heart is,40,619,,False,False,13209,,,0,1,0.08333333333333334,0.0,neutral
2021-03-12 01:34:38,1370186438935932928,"All US Adults Will Be Eligible For A COVID-19 Vaccine By May 1, Joe Biden Said -  ",279483742,MEDIABOXSTORE,Egypt,19255,2028,,False,False,725641,,,0,0,0.0,0.0,neutral
2021-03-12 01:34:37,1370186434859139072,Finally got a COVID vaccine appointment and I'm so excited! In like a month I can finally see Kendall (haven't seen her in over a year)!!,1596604902,M_A_Hunny,Over here!!,219,10366,,False,False,11905,,,0,17,0.9166666666666666,0.15625,positive
2021-03-12 01:34:37,1370186434775298052,"NC_Governor: Gov. Cooper announced that thanks to the hard work of providers, NC will be moving forward in its phased vaccination proce…",966011112,JohnathanCato,"Near Asheville, North Carolina",1244,44162,,False,False,463,,,156,0,0.37083333333333335,-0.04583333333333334,negative
2021-03-12 01:34:37,1370186434628390914,Lee_Cobaj: This article doesn't include Sinovac (f that stuff) but makes a very compelling argument as to why you should snap up the Bi…,255946506,catsandsparkle,Hong Kong,1776,19094,,True,False,17930,,,2,0,0.78,0.39,positive
2021-03-12 01:34:37,1370186433319866372,"BigPharma monopolies = Countries waiting until 2023 for widespread Vaccination~Pfizer Moderna_tx BioNTech_Group AstraZeneca Novavax JNJNews must JoinCTAP +ShareVaccines worldwide.
Govs must support TRIPSWaiver .WTO
PeoplesVaccine.
Pls Read&amp;",86886629,My_Pedagogics,Resident of Earth.,554,15812,,False,False,26466,,,0,1,0.0,0.0,neutral
2021-03-12 01:34:36,1370186431679885312,Denmark Suspends the Use of AstraZeneca Shots Over Worries About Blood Clots ,1346502675056115712,leafypage1,,92,7,,False,False,2984,,,0,0,0.0,0.0,neutral
2021-03-12 01:34:36,1370186430664876033,bhrenton: President Biden has implemented the next phase of a comprehensive strategy to make all adults eligible for the vaccine by May…,15590364,CorettaScottKey,"East Orange, NJ",2849,11943,,False,False,183093,,,10,0,0.0,0.0,neutral
2021-03-12 01:34:36,1370186430484508675,"CMcKNichols: Vaccine line, flu pandemic of 1918. Back then there was a race for medial treatments for the deadly flu but those vaccines…",86199249,dropoutnation,"ÜT: 38.7973156,-77.1318254",8937,231839,,True,False,373070,,,1,0,0.2,-0.1,negative
2021-03-12 01:34:36,1370186429079244800,consent_factory: “I’m here today to tell you that we are actually hacking the software of life ... we think of it as information therap…,624480985,dirteafairy,"Fluttering Around, Tsimshian",486,46180,,False,False,18720,,,98,0,0.1,0.0,neutral
2021-03-12 01:34:35,1370186424700575748,"KieranKelly77: It's not a conspiracy to say;

Suicides up
Mental health is deteriorating 
Businesses gone
Kids development impacted
Dea…",1237302774477529088,ThingsYouNeed2K,,686,0,,False,False,33189,,,7,0,0.2,-0.1,negative
2021-03-12 01:34:35,1370186424377618436,donkamion78: 12 Prominent scientists and doctors: Medical regulators should release bold figures of the numbers of people who have died…,819211254355070976,mcaterra,,2233,13653,,False,False,46057,,,124,0,0.5555555555555555,0.2777777777777777,positive
2021-03-12 01:34:34,1370186423547011072,"Toronto, Canada has this board up thanking India &amp; PM Modi for sending Covid vaccine to the country ModiHaiToMumkinHai 
ModiBrigadeRally modi_jawab_do ModiBrigadeRally modi_jawab_do ",1312806445792948224,ZubaMohammad,Baramulla,75,51,,False,False,117,,,0,0,0.0,0.0,neutral
2021-03-12 01:34:34,1370186422725062657,SharylAttkisson: 3-The vaccine is *not* approved for current emergency use for anyone under 16 or 18 (depending on the brand). Therefor…,544819255,terriUKfan,"Kentucky, USA",2355,91693,,False,False,115132,,,180,0,0.4,0.0,neutral
2021-03-12 01:34:34,1370186420653015041,naomirwolf: Whoa! Add Italy: ,2397909876,PierreMagna,,926,11057,,True,False,23503,,,507,0,0.0,0.0,neutral
2021-03-12 01:34:34,1370186420602744836,"Canada currently has 4 vaccines approved for the public. Although the studies conducted for each vaccine yield different efficacies, they are all almost 100% effective against hospitalizations and deaths from COVID-19.



CovidVaccine COVID19 Corona ",1245147402169987072,Covid19simple,"Toronto, Ontario",1211,103,,False,False,594,,,1,5,0.4666666666666667,0.15,positive
2021-03-12 01:34:34,1370186420590022658,"noahweiland: Scoop: The U.S. is sitting on tens of millions of doses of the AstraZeneca vaccine in Maryland and Ohio facilities, and of…",378178961,ViraniAlim,,206,11175,,True,False,5224,,,360,0,0.0,0.0,neutral
2021-03-12 01:34:33,1370186419889700866,"Yesterday we administered our 40,000th vaccine dose to Navy Veteran Steven Maurice. 

SE Louisiana Veterans who are enrolled in VA health care and interested in a COVID-19 vaccine should contact VA at 1-800-935-8387 extension 72819. ",294264494,VANewOrleans,"New Orleans, Lousiana",3282,5284,,True,True,6075,,,0,1,0.25,0.125,positive
2021-03-12 01:34:33,1370186419394596865,"joe_warmington: Denmark, Norway and Iceland suspend AstraZeneca COVID shots after blood clot reports | Article [AMP] | Reuters ",1058808528,TracyBaxter11,Canada,2283,15373,,False,False,107097,,,220,0,0.0,0.0,neutral
2021-03-12 01:34:33,1370186418316849153,SharylAttkisson: 3-The vaccine is *not* approved for current emergency use for anyone under 16 or 18 (depending on the brand). Therefor…,902214369815257089,SamuelBuckner11,USA,11755,54447,,True,False,52034,,,180,0,0.4,0.0,neutral
2021-03-12 01:34:33,1370186418266501124,"CBSNews: BREAKING: President Biden announces he is directing all states, tribes and territories to make all U.S. adults 18 and older el…",2800331798,tainahobbit,Torre dos Titãs,416,13894,,True,False,24973,,,241,0,0.3333333333333333,0.16666666666666666,positive
2021-03-12 01:34:33,1370186417637371907,"naomirwolf: Nine countries have now suspended the AstraZeneca vaccine due to blood clots. Now it's Iceland, Norway, Denmark, South Afri…",1251960656523231233,CherylJ98899432,,109,8657,,False,False,2049,,,255,0,0.375,-0.125,negative
2021-03-12 01:34:33,1370186416689459204,KrisGoldsmith85: Yesterday (Wednesday) I went to DeptVetAffairs website and signed up for “more info” about when I could receive the C…,877881972256845824,JABell27,"Maryland, USA",2992,184088,,False,False,24436,,,136,0,0.5,0.5,positive
2021-03-12 01:34:32,1370186415372402691,"sallyKP: In October 2019, shortly before the COVID outbreak, Gates and other powerful individuals began planning how to censor vaccine…",3957180826,HarrlyQuinn,,172,12405,,False,False,5929,,,79,0,0.5583333333333333,0.05833333333333333,positive
2021-03-12 01:34:32,1370186412478316544,"charliekirk11 Really? What makes you think this? Why would no other president have been able to develop a vaccine. Nonsense. And don’t forget. Had Trump dealt with Covid early on, we would not have been is such a dangerous position.",18526305,pjmooney,"Berkeley, California",34530,31567,,True,False,90226,,,0,8,0.4833333333333333,0.04374999999999999,positive
2021-03-12 01:34:32,1370186411979182082,"thenewsoncnbc: President Biden says he will direct all states, tribes and territories to make all adults eligible for vaccination no la…",1291111316799868930,ComeNovember,,26,32102,,False,False,7411,,,24,0,0.4,0.1,positive
2021-03-12 01:34:31,1370186409391353865,"allinwithchris: Effie, an allinwithchris viewer from Tennessee, shares an emotional response to her mother getting the Covid vaccine a…",17178342,drmaggiesa,"Texas, USA",1358,6943,,True,False,354352,,,61,0,0.65,0.0,neutral
2021-03-12 01:34:31,1370186407524904960,LissandraVilla: Lil late to this but Mitch McConnell in PBS interview ahead of the Biden address tonight encourages everyone to get COV…,366368285,caitlynkim,,2124,13364,,False,True,16990,,,16,0,0.6,-0.3,negative
2021-03-12 01:34:30,1370186406115471360,danieteebee: It’s completely predictably American that the brand of COVID vaccine you have access to has now become a class signifier,1311355912662036480,triptych_tri,,4,204,,False,False,547,,,10123,0,0.0,0.0,neutral
2021-03-12 01:34:30,1370186406098739203,"WHCOVIDResponse: By May 1st, every adult in this country will be eligible for a COVID-19 vaccine but we all have to do our part: Get yo…",3317621227,SinCityChrisS1,,2033,162325,,True,False,133929,,,878,0,0.3,0.1,positive
2021-03-12 01:34:30,1370186404421005315,"MonicaGandhi9: How long will immunity from COVID-19 vaccine last? Let's remember from papers tweeted before, immunity from natural infe…",49677817,Patricia99801,,1121,127693,,True,False,162440,,,121,0,0.2888888888888889,0.016666666666666666,positive
2021-03-12 01:34:30,1370186404312023042,"KatyTurNBC: One year of COVID. 
Seven months pregnant. 
First shot of Pfizer. ",12256592,philgross,NYC,103,65033,,False,False,46585,,,316,0,0.4166666666666666,0.29166666666666663,positive
