created,id_str,text,user_id,screen_name,location,followers_count,user_favourites_count,time_zone,geo_enabled,verified,status_count,geo,coords,retweet_count,tweet_favourite_count,Subjectivity,Polarity,Sentiment
2021-03-11 19:13:41,1370090568714424320,"HamillHimself: Statement by the Twice Impeached Former Guy

I hope everyone remembers when they're getting the COVID-19 (often referred…",93661187,neilmcloughlin_,"Was West London, now Wiltshire",322,91641,,False,False,35106,,,1046,0,0.0,0.0,neutral
2021-03-11 19:13:41,1370090568517304320,"CNBCnow: BREAKING: Biden signs $1.9 trillion Covid relief bill, clearing way for stimulus checks, vaccine aid 
",23798633,CbazzThaGreat,Why?,3594,10992,,True,False,346043,,,452,0,0.0,0.0,neutral
2021-03-11 19:13:41,1370090568009846786,"DrZweliMkhize [Denmark, Norway Pause Rollout Of AstraZeneca Vaccine Over Blood Clotting Concerns.]

I remember how angry some people would become when this vaccine was questioned. ",968041645,tololodj,Mzansi,1321,15386,,True,False,44601,,,0,0,1.0,-0.5,negative
2021-03-11 19:13:40,1370090565518364676,TheElders: “We must act with collective responsibility and solidarity as a human family to ensure each one of us is able to receive the…,27423868,Sabrina_Mahtani,Lusaka-London-Freetown,5344,8130,,False,False,8297,,,67,0,0.3625,0.25,positive
2021-03-11 19:13:40,1370090563823886342,"""What are the long term affects of the Covid vaccine?"" 

Idk what are the long term affects of death?",1128172973184180224,SmartyPantsPayt,,77,9107,,False,False,5847,,,0,5,0.4,-0.05,negative
2021-03-11 19:13:40,1370090563643531268,"Every article about Texas removing mask and other covid restrictions just makes me less willing to go shopping, order food, etc. I guess I'm back to lockdown until the vaccine is more widely available.",14489844,swelljoe,"Dallas, TX",488,133678,,True,False,26975,,,2,6,0.34861111111111115,0.14305555555555557,positive
2021-03-11 19:13:39,1370090562834075656,"petemorristwit: As it stands today, at this point in time. I won't be taking the vaccine.  I really don't want to be part of an ongoing…",1177239203660423176,heblais,,1226,15357,,False,False,20209,,,156,0,0.2,0.2,positive
2021-03-11 19:13:39,1370090562741809156,"POTUS: One in four adults in the U.S. has received their first COVID-19 vaccine — and we’re now leading the world in vaccinations.

Tha…",163508533,SleepingSun16,somewhere in time,897,17011,,False,False,31693,,,16506,0,0.3333333333333333,0.25,positive
2021-03-11 19:13:39,1370090561584168974,LSEPublicPolicy: Richer countries are vaccinating their own citizens first. But leaving the rest without access to 💉 makes it more like…,830259092,Paulinasetama,Ecuador,429,140,,False,False,90,,,11,0,0.611111111111111,0.45,positive
2021-03-11 19:13:39,1370090561412104192,Are you getting your COVID vaccine at a federally supported vaccination clinic? Check out fema's video -- all federally supported sites have ASL interpreters or Video Relay Interpreters (VRI) available! Coronavirus ASL ,51542338,NAD1880,"Silver Spring, MD",22229,555,,False,True,5627,,,5,3,0.4,0.5,positive
2021-03-11 19:13:39,1370090560183230464,"davidkurten: Seven European countries suspend use of Astra Zeneca Covid vaccine after blood clot deaths.
I will not be taking a 'Covid…",1249007526076723200,DeLAPASSE6,Occitanie,172,18745,,False,False,20090,,,852,0,0.0,0.0,neutral
2021-03-11 19:13:39,1370090559939997702,"DinaPomeranz: Daily Covid vaccinations:

Chile has now overtaken Israel, US has overtaken UK &amp; Germany is now faster than Switzerland.…",231885161,linamariacr9,"Zurich, Switzerland",35,24,,True,False,7970,,,19,0,0.0,0.0,neutral
2021-03-11 19:13:39,1370090559184928770,"Moderna Admits: MRNA Jabs Are An ‘Operating System’ Designed To Program Humans. // Coronavirus COVID19 CovidVaccine MRNA Moderna

",25694578,johndk7,"Los Angeles, CA USA",518,353,,False,False,24060,,,1,0,0.0,0.0,neutral
2021-03-11 19:13:38,1370090558178258946,"ecomgatsby: BREAKING NEWS: Biden signs $1.9 trillion Covid relief bill, clearing way for stimulus checks, vaccine aid",1303753191083798528,mannymcmoney,,36,711,,False,False,159,,,2,0,0.0,0.0,neutral
2021-03-11 19:13:38,1370090557331103747,DrEricDing: FANTASTIC NEWS—A potential vaccine for multiple sclerosis is now within sight on the horizon! And it’s an mRNA vaccine by B…,1828562480,amzieaa,,1613,314011,,False,False,123836,,,8755,0,0.6333333333333333,0.13333333333333333,positive
2021-03-11 19:13:38,1370090556295159809,"Still a conspiracy?

506 ADR fatalities in 🇬🇧 UK

🇦🇹 Austria 
🇮🇹 Italy 
🇮🇸 Iceland 
🇩🇰 Denmark 
🇳🇴 Norway 

All suspend use of AZ 

",760564088854441984,TheRustler83,"Aberdeen, Scotland",2614,12927,,True,False,12131,,,15,21,0.0,0.0,neutral
2021-03-11 19:13:38,1370090556202708993,"To SNHDinfo, SteveSisolak, RepSusieLee, SenCortezMasto, RosenforNevada, this story  is absolutely infuriating... 2000 apts not taken every day! Feels like I am stuck behind a driver at a green traffic light waiting... except it is my life at stake!",35467336,yanpujante,"Las Vegas, NV",232,31,,False,False,1133,,,0,0,0.625,-0.21249999999999997,negative
2021-03-11 19:13:38,1370090556051894280,"cuecardfan Todaysopinionis Leighjr MountvSimon It’s not fake news, it’s all in there black and white if you care to look. Here’s a link to the government’s papers on adverse reactions including deaths from the vaccines. Happy reading! 😁 
",804502034,FrarnieGee,London,244,3226,,False,False,1104,,,0,0,0.6083333333333334,0.2708333333333333,positive
2021-03-11 19:13:38,1370090555963752451,joaquimsacouto: Utah mom Kassidi Kurill dies four days after second dose of Moderna vaccine  via nypost,1242458206988886016,Cor83634376Jp,"Alenquer, Portugal",283,28435,,False,False,6044,,,6,0,0.0,0.0,neutral
2021-03-11 19:13:37,1370090554307010563,"doctorshaib: Better to continue with the Oxford-AZ vaccines.

Over a million doses have been successfully adminstered.

Denmark has su…",284038979,ImSairyFairy,"Trowbridge, Wiltshire",225,18863,,True,False,14541,,,9,0,0.725,0.625,positive
2021-03-11 19:13:37,1370090553254232067,"CzypionkaThomas: AstraZeneca 
Please keep cool! The normal annual incidence of venous thrombembolism is  over 100/100,000 people, and…",6530322,anondiver,"Bavaria, Germany",167,37927,,False,False,15534,,,74,0,0.6499999999999999,0.29375,positive
2021-03-11 19:13:37,1370090553111683072,"POTUS: One in four adults in the U.S. has received their first COVID-19 vaccine — and we’re now leading the world in vaccinations.

Tha…",1329111216149696512,ChariweN,,142,1563,,False,False,1537,,,16506,0,0.3333333333333333,0.25,positive
2021-03-11 19:13:37,1370090551706583048,"lyndy1115 He has spoken many times since his inauguration. Announcing Cabinet selections, vaccine distribution and administration, he spoke in honor of the deceased due to COVID. Jen provides daily updates, COVID team provides 3 time weekly updates. He’s busy. I am good",1188288357203398656,Nancy06180389,NJ,2761,48675,,True,False,20186,,,1,8,0.35500000000000004,0.23499999999999996,positive
2021-03-11 19:13:36,1370090549806395393,"CNBCnow: BREAKING: Biden signs $1.9 trillion Covid relief bill, clearing way for stimulus checks, vaccine aid 
",1034787842939965440,Jude30449142,,135,9110,,False,False,9555,,,452,0,0.0,0.0,neutral
2021-03-11 19:13:36,1370090548401422336,"andy_chow: Gov. Mike DeWine briefing on COVID-19 in Ohio...Thursday, March 11, 2021 🧵

Starting today people 50 and older can get the C…",903288212180828160,fairyfoopaloopa,funkytown,233,44797,,False,False,17113,,,16,0,0.21666666666666667,0.08333333333333333,positive
2021-03-11 19:13:36,1370090547856179204,"HamillHimself: Statement by the Twice Impeached Former Guy

I hope everyone remembers when they're getting the COVID-19 (often referred…",177736055,Mangler112,The Netherlands,966,13173,,True,False,106954,,,1046,0,0.0,0.0,neutral
2021-03-11 19:13:36,1370090547558322176,My mom back in SoCal just got her first dose of Pfizer. I could literally cry 😭🙏🏼,1052782391138246657,elvaacast,"Las Vegas, NV",124,733,,False,False,255,,,0,12,0.16666666666666666,0.125,positive
2021-03-11 19:13:36,1370090546778275842,"POTUS: One in four adults in the U.S. has received their first COVID-19 vaccine — and we’re now leading the world in vaccinations.

Tha…",1189542419131457536,calichicacine,All via Socal/Philly/Mex/Aus,3480,37937,,False,False,41858,,,16506,0,0.3333333333333333,0.25,positive
2021-03-11 19:13:35,1370090545037639693,World marks one year of pandemic; Kroger accidentally uses empty syringes; AstraZeneca vaccine suspended in Denmark: Live COVID-19 updates ,757250499787751424,JohnApp63499667,"Philadelphia, PA",9490,17383,,False,False,514719,,,0,1,0.5,0.018181818181818174,positive
2021-03-11 19:13:35,1370090544634953738,danieteebee: It’s completely predictably American that the brand of COVID vaccine you have access to has now become a class signifier,2241407906,SarahhMcCaff,"Pittsburgh, PA",3904,131218,,True,False,14820,,,10930,0,0.0,0.0,neutral
2021-03-11 19:13:35,1370090544286826497,Pfizer vaccine made me pfat what the pfuck,36844438,rotandpoetry,,77,5754,,True,False,4498,,,0,4,0.0,0.0,neutral
2021-03-11 19:13:35,1370090544152653826,"IGotTheShot because I care about humanity 💕 now in the state of Georgia, people with intellectual and developmental disabilities including autism can now schedule an appointment to get the vaccine! Can’t wait for my second Pfizer vaccine shot! ",721346978,theKwomanrules,"Georgia, USA",2603,89899,,True,False,68879,,,0,11,0.2,0.1875,positive
2021-03-11 19:13:35,1370090543607259137,alywhoop: covid vaccine card,2265452442,pcraig1234567,,224,10863,,True,False,7068,,,5,0,0.0,0.0,neutral
2021-03-11 19:13:34,1370090542315368449,"realoverheardla: “Today I saw a guy get shot, got my covid vaccine, and booked a modeling gig.”

“Welcome to LA...”",994786511785807873,_Fantasma89,,473,62206,,False,False,41051,,,31,0,0.9,0.8,positive
2021-03-11 19:13:34,1370090541925474320,"POTUS: One in four adults in the U.S. has received their first COVID-19 vaccine — and we’re now leading the world in vaccinations.

Tha…",1021192197914464257,IridescentAshes,"Pennsylvania, USA",911,271837,,False,False,266253,,,16506,0,0.3333333333333333,0.25,positive
2021-03-11 19:13:34,1370090541262766088,"Swamy39 I'm not sure why its being checked for emergency use authorisation in United  States and EU countries, when its approved in India.. meanwhile FYI, it has been approved by EMA (medicine regulators in EU) and AstraZeneca have not yet filed in USA. ",714402730379493376,swesha_82,"Runcorn, UK.",5,947,,False,False,493,,,0,0,0.8888888888888888,-0.25,negative
2021-03-11 19:13:34,1370090541103349770,"JKNjenga: In the last 24 hours, seven European nations have suspended the Astra Zeneca vaccine that Kenya using because of serious adve…",385412960,nonicky,,298,14900,,False,False,19092,,,329,0,0.24444444444444444,-0.1111111111111111,negative
2021-03-11 19:13:34,1370090539031273474,"POTUS: One in four adults in the U.S. has received their first COVID-19 vaccine — and we’re now leading the world in vaccinations.

Tha…",867588350152130569,2old_notdead,,122,39255,,True,False,16185,,,16506,0,0.3333333333333333,0.25,positive
2021-03-11 19:13:34,1370090538511298564,"andy_chow: Gov. Mike DeWine briefing on COVID-19 in Ohio...Thursday, March 11, 2021 🧵

Starting today people 50 and older can get the C…",917107450045784065,PeggyYates2014,"Columbus, OH",1012,116979,,False,False,140838,,,16,0,0.21666666666666667,0.08333333333333333,positive
2021-03-11 19:13:33,1370090538079289345,"CNBCnow: BREAKING: Biden signs $1.9 trillion Covid relief bill, clearing way for stimulus checks, vaccine aid 
",1255182850221015041,badpiranha2_0,"Cerberus Plains, Mars ",85,3515,,True,False,4440,,,452,0,0.0,0.0,neutral
2021-03-11 19:13:33,1370090537538191363,"NYGovCuomo: Vaccination Update:
 
20.4% of New Yorkers have received at least one vaccine dose and 10.4% have completed their vaccine s…",787040524192604160,TheActor_movie,NYC/LA,4941,139305,,False,False,143116,,,174,0,0.42727272727272725,-0.08181818181818182,negative
2021-03-11 19:13:33,1370090537433276417,"richu_jay: Make your skin glow using DISAAR CREAM AND SERUM ENRICHED WITH SUNFLOWER OILS
♨️Removes dark spots
♨️Balances skin tones
♨️M…",1280157494552268803,CoMrAdE_015,"Nairobi, Kenya",6349,19776,,True,False,24276,,,130,0,0.4,-0.15,negative
2021-03-11 19:13:33,1370090535998779392,BlueVotr Moderna: I'm getting my second shot tomorrow.,994054543028600832,peyton_susie,"Antelope, CA",478,108052,,True,False,4357,,,0,1,0.0,0.0,neutral
2021-03-11 19:13:33,1370090534484709388,Dixie202021: AmyAThatcher The pharmaceutical companies were already racing to be first..warp speed was no big deal. Pfizer wasn't part…,1354443877,nsnurse1,Chicago,2961,56917,,False,False,6788,,,2,0,0.1,0.0,neutral
2021-03-11 19:13:32,1370090533343920135,"DailyCaller: YouTube Says It’s Taken Down 30,000 Videos For COVID-19 Vaccine Misinformation ",590438656,Camcareli,"Kristiansand, Norway",601,145,,False,False,3039,,,18,0,0.2888888888888889,-0.15555555555555559,negative
2021-03-11 19:13:32,1370090533020917764,"HamidMirPAK Reuters (Reuters) Tweeted:
Austria suspends AstraZeneca COVID-19 vaccine batch after death   ",1369366433608708099,GALAXY01966028,,6,154,,False,False,103,,,0,0,0.0,0.0,neutral
2021-03-11 19:13:32,1370090531993292806,achillesheels_ It’s sometimes not worth the hassle of posting Covid related stuff. I’ve been slated because I’m opposed to a vaccine passport for domestic use. I’m also against mask wearing as it causes more harm than good. I’m also against asymptomatic testing.,255134219,peteilc,"North West, England",1493,18492,,True,False,15095,,,0,2,0.34,0.20999999999999996,positive
2021-03-11 19:13:32,1370090531414495233,"HamillHimself: Statement by the Twice Impeached Former Guy

I hope everyone remembers when they're getting the COVID-19 (often referred…",520779141,silverlb52,"New Jersey, USA",276,85973,,False,False,32855,,,1046,0,0.0,0.0,neutral
2021-03-11 19:13:32,1370090531376791560,"POTUS: One in four adults in the U.S. has received their first COVID-19 vaccine — and we’re now leading the world in vaccinations.

Tha…",129216415,Ebeneezer22,"Moosejaw, Saskatchewan",1313,137226,,True,False,143772,,,16506,0,0.3333333333333333,0.25,positive
2021-03-11 19:13:32,1370090531020275718,COVID vaccine finders in Berks County and across Pa. know when appointments open and help those struggling to find shots ,15063278,MercuryX,"Pottstown, PA",10488,151,,True,True,53014,,,1,1,0.5,0.0,neutral
2021-03-11 19:13:32,1370090530072317958,"254Proff: 🔖Adidas StanSmith available at Ksh.3500 only.
🔖Sizes 38-45
🏢-Imenti house, Zodiac Stalls, Along Tom Mboya Strt, nrb.
📱-&gt;+2547…",1293130256505884672,wangeci_ci,Unknown,2458,6473,,False,False,4100,,,94,0,0.7,0.2,positive
2021-03-11 19:13:32,1370090529791344642,"CNBCnow: BREAKING: Biden signs $1.9 trillion Covid relief bill, clearing way for stimulus checks, vaccine aid 
",1195775541254742016,glochrizz,"Adelphi, MD",203,14620,,True,False,7348,,,452,0,0.0,0.0,neutral
2021-03-11 19:13:31,1370090529707458570,"kayleighmcenany: FINALLY the Biden admin recognizes the Trump admin’s unprecedented vaccine work:

➡️ “We’re grateful for the work that…",1341497347935776769,JJHale9,,22,3565,,False,False,7624,,,4655,0,0.95,0.3,positive
2021-03-11 19:13:31,1370090529254481929,spectatorindex: JUST IN: Norway has suspended use of the AstraZeneca coronavirus vaccine,1310832679710056449,JubaBerry08,In South Africa our laaaaaand!,1321,18943,,False,False,20466,,,2570,0,0.0,0.0,neutral
2021-03-11 19:13:31,1370090528994324483,"CNBCnow: BREAKING: Biden signs $1.9 trillion Covid relief bill, clearing way for stimulus checks, vaccine aid 
",337744935,mplsgilyard,Minneapolis,1636,361,,False,False,25446,,,452,0,0.0,0.0,neutral
2021-03-11 19:13:31,1370090528201699332,2Spaceninja15: The covid vaccine accounts for 10% of all deaths ever reported immediately following getting a vaccine. And it's only be…,339150717,WolfeGlenda,,4757,183577,,False,False,213951,,,41,0,0.55,0.0,neutral
2021-03-11 19:13:31,1370090526700146696,"SalehGh28: Me watching oxford astrazeneca  vaccine banned after already receiving my first dose..
⁦AstraZeneca⁩ ",2501153365,1_99_8,,262,134730,,True,False,25698,,,194,0,0.3333333333333333,0.25,positive
2021-03-11 19:13:31,1370090525924163589,"MichelleObama: When you can get the COVID-19 vaccine, I hope you do—Barack and I are certainly glad we did. It’s our best shot at beati…",47429961,Boricuayankee1,"Bronx, New York",484,136949,,True,False,173375,,,8488,0,0.65,0.75,positive
2021-03-11 19:13:30,1370090524506480647,FOX26Houston: The Pfizer-BioNTech COVID-19 vaccine was found to block 94% of asymptomatic infections and 97% of symptomatic cases in an…,994965630469246976,AhnRee__,"Suitland via PG County, MD ",1522,446,,False,False,139906,,,5,0,0.0,0.0,neutral
2021-03-11 19:13:30,1370090522107346953,"kayleighmcenany: FINALLY the Biden admin recognizes the Trump admin’s unprecedented vaccine work:

➡️ “We’re grateful for the work that…",21959062,crystalbehard,,25,4864,,True,False,678,,,4655,0,0.95,0.3,positive
2021-03-11 19:13:29,1370090521100713988,HighWireTalk: VACCINE DISASTER AHEAD  CDC Spin on New Mask Data; Celebrity Catches Fauci Lying!; Expert Warns of Coming Covid Vaccine D…,204339253,SashGirlVegas,,4515,106398,,True,False,147720,,,719,0,0.45454545454545453,0.17045454545454544,positive
2021-03-11 19:13:29,1370090519745863683,i get my covid vaccine tomorrow 💉,1970273858,daaannieel_,California ,1912,53160,,True,False,30105,,,0,2,0.0,0.0,neutral
2021-03-11 19:13:29,1370090519473369089,"For me, just sums up the poor vaccine rollout of the vaccine programme in Wales!!!  SwanseabayNHS WelshGovernment ",349200209,nickbb7,"Neath, South Wales",1128,448,,True,False,29418,,,0,0,0.6,-0.78125,negative
2021-03-11 19:13:29,1370090519196438530,"zoo_bear: India Today shared a chart claiming India has the lowest vaccine price in the world. This was also amplified by BJP. However,…",986248806445363200,NrndraShah, India,329,85126,,False,False,51300,,,916,0,0.0,0.0,neutral
2021-03-11 19:13:29,1370090519154495489,"CNBCnow: BREAKING: Biden signs $1.9 trillion Covid relief bill, clearing way for stimulus checks, vaccine aid 
",102957506,msjangir,"Calgary,Canada",174,1702,,True,False,2869,,,452,0,0.0,0.0,neutral
2021-03-11 19:13:29,1370090518475112451,"Biden signs $1.9 trillion Covid relief bill, clearing way for stimulus checks, vaccine aid ",494299332,Outrageous__fun,Philadelphia,1636,1994,,True,False,4644,,,0,0,0.0,0.0,neutral
2021-03-11 19:13:29,1370090517766283264,"simondolan: Nothing to see here. Move along. Perfectly safe....

Italy and Norway join Denmark in suspending use of AstraZeneca vaccine…",1284124672225927169,IrelandAwake1,Ireland,45,5278,,False,False,5058,,,898,0,0.5,0.5,positive
2021-03-11 19:13:28,1370090514792509450,"CNBCnow: BREAKING: Biden signs $1.9 trillion Covid relief bill, clearing way for stimulus checks, vaccine aid 
",89534245,CBIANews,"Hartford, Connecticut",6099,2505,,True,False,12104,,,452,0,0.0,0.0,neutral
2021-03-11 19:13:28,1370090514779828226,A new lab study shows troubling signs that Pfizer's and Moderna's COVID-19 shots could be far less effective against the variant first found in South Africa SmartNews  ,4039758442,femmesthetics,,1611,35717,,False,False,34340,,,0,0,0.530909090909091,0.18393939393939393,positive
2021-03-11 19:13:28,1370090514654060544,"BasedSicily: One policeman and one soldier have died after getting AstraZeneca vaccine in Catania, Sicily",2557500213,FelixLeptis,𝕸𝖆𝖗𝖊 𝕹𝖔𝖘𝖙𝖗𝖚𝖒,95,25002,,False,False,2381,,,1,0,0.0,0.0,neutral
2021-03-11 19:13:28,1370090514402271236,"HamillHimself: Statement by the Twice Impeached Former Guy

I hope everyone remembers when they're getting the COVID-19 (often referred…",1297382640828297221,samuelserickson,,20,300,,False,False,315,,,1046,0,0.0,0.0,neutral
2021-03-11 19:13:28,1370090514331140104,"At FMQs today I was struck by Nicola Sturgeon's baloney answer on the slow vaccine roll out in Glasgow.

My friends in Fife (57 and 54) have no health conditions and were both vaccinated last week, so the issue is the distribution of vaccine in Scotland

 ",19414559,Mark1957,"Glasgow, Scotland",1105,15906,,True,False,50393,,,0,1,0.2333333333333333,-0.15000000000000002,negative
2021-03-11 19:13:28,1370090513437691909,SenSanders: I support the United States backing a TRIPS waiver at the WTO to ensure that life-saving COVID vaccine technology is availa…,75213524,IngridCapeTown,"Cape Town, South Africa",84,1326,,False,False,1708,,,1110,0,0.0,0.0,neutral
2021-03-11 19:13:27,1370090512749719554,"AltNews: India Today shared a chart claiming India has the lowest vaccine price in the world. This was also amplified by BJP. However,…",358698072,Parthiban2900,"Bengaluru, India",339,61062,,False,False,56505,,,322,0,0.0,0.0,neutral
2021-03-11 19:13:27,1370090510887612416,"tuuliel: This is AMAZING news. Data from Israel indicates that the Pfizer-BioNTech vaccine prevents infections, not just symptoms, very…",43579011,Tomi_Tapio,"Espoo, Suomi",1253,75403,,False,False,154488,,,34,0,0.9,0.6000000000000001,positive
2021-03-11 19:13:27,1370090510732439555,disclosetv: JUST IN - Norway and Denmark suspend Oxford-AstraZeneca COVID19 vaccine rollout.,1265876695359373314,Leahbellabella,,2071,5634,,False,False,5148,,,2599,0,0.0,0.0,neutral
2021-03-11 19:13:27,1370090510694588417,"MichaelArt123: Barack Obama
Michelle and I got vaccinated against COVID-19 because we know it’s the best way to beat this pandemic, pro…",2992724509,cbond20464,,7324,95517,,False,False,70609,,,26,0,0.3,1.0,positive
2021-03-11 19:13:27,1370090509780275200,itsJeffTiedrich Until the day before yesterday I didn't think I'd get my 1st COVID vaccine until mid-summer at the earliest.  I have my appointment for my 1st shot on Monday.  I'm ecstatic.,15547892,EllenE929,,386,44493,,True,False,4306,,,0,3,0.0,0.0,neutral
2021-03-11 19:13:26,1370090508513513472,"CNBCnow: BREAKING: Biden signs $1.9 trillion Covid relief bill, clearing way for stimulus checks, vaccine aid 
",382719073,tenutenu3,,315,224,,False,False,16459,,,452,0,0.0,0.0,neutral
2021-03-11 19:13:26,1370090508077428745,"celliottability &amp; the Ontario Conservatives seems to find it okay if vulnerable Ontarians have blood clots from AstraZeneca. 😬

If you are in Ontario, please rethink getting this vaccine until further notice. We are clearly on our own in this. ",1088951924668297216,Sarah_Colero,"Toronto, Ontario",2800,71004,,False,False,30806,,,0,0,0.5766666666666667,0.13999999999999999,positive
2021-03-11 19:13:26,1370090508073234437,"GDR

Biden signs $1.9 trillion Covid relief bill, clearing way for stimulus checks, vaccine aid

",786216006997778432,Fox_in_the_hole,UK,803,6904,,False,False,10765,,,6,17,0.0,0.0,neutral
2021-03-11 19:13:26,1370090507532001280,"I just signed up for DrB, the national COVID-19 vaccine standby list. Anyone can join at  so get in line and pass it on! ",1262884604,deborahjaquith,,4903,37109,,False,False,14909,,,0,2,0.0,0.0,neutral
2021-03-11 19:13:26,1370090506806566921,"TheRevAl: Covid vaccine skepticism among Black Americans is falling — but there's a bigger issue.

Black Americans are being called out…",1074882806508068864,bigbabydrama,the undertow,975,80050,,True,False,59736,,,22,0,0.45555555555555555,-0.1111111111111111,negative
2021-03-11 19:13:26,1370090506701668355,"CNBCnow: BREAKING: Biden signs $1.9 trillion Covid relief bill, clearing way for stimulus checks, vaccine aid 
",840584197,RCCGJHNY,,55,286,,True,False,3050,,,452,0,0.0,0.0,neutral
2021-03-11 19:13:26,1370090506299015171,ThandekaLo: Astrazeneca vaccine is now causing blood clots😳,2786758031,Manyikeeee,"Nizhny Novgorod, Russia",1540,72359,,True,False,45758,,,45,0,0.0,0.0,neutral
2021-03-11 19:13:26,1370090505573392389,"JuddLegum: JohnKavanagh_AZ 3. Kavanaugh, who apparently believes its his job to ensure that ""uninformed"" people do not vote is support…",3646356376,zunderwhelmed,Earth...Detroit 🦑🏒,6143,69856,,False,False,245980,,,587,0,0.35,0.05,positive
2021-03-11 19:13:26,1370090505468440577,"JahidHussain2 How are you Liar?

Read here before promoting Fake news shamelessly!  ",358242233,MrFrancisTalks,,466,80,,False,False,3133,,,0,0,1.0,-0.625,negative
2021-03-11 19:13:26,1370090504797487107,"nickdearden75: Disgraceful - but we’re not giving up. The TRIPSWaiver proposal is far from dead, and while this delay is deeply unhelp…",34062694,OccupyNN,"#OLSX London, United Kingdom",983,1805,,True,False,53158,,,34,0,0.6,-0.03333333333333333,negative
2021-03-11 19:13:26,1370090504709365768,"HamillHimself: Statement by the Twice Impeached Former Guy

I hope everyone remembers when they're getting the COVID-19 (often referred…",1097129701267722240,efe38795173,"Federal Capital Territory, Nig",6093,65624,,False,False,21633,,,1046,0,0.0,0.0,neutral
2021-03-11 19:13:25,1370090503895662594,"

When Ebola was on the high rise globally, there was never a time where everyone was forced to be ‘vaccinated’ against it. The next thing we knew, Covid-19 had been introduced into the system. A ‘vaccine’ has been developed for it but is being forced on us",902251164024152065,j_j_z_e_r_o,,88,1302,,False,False,413,,,0,0,0.20666666666666667,-0.05666666666666668,negative
2021-03-11 19:13:25,1370090501479669761,Thailand says Moderna to apply for COVID-19 vaccine approval this month  via YahooNews nationnews moderna_tx COVID19Tracking Reuters,183374909,4KSavage,"North Vallejo, CA",176,4791,,True,False,18298,,,0,0,0.0,0.0,neutral
