created,id_str,text,user_id,screen_name,location,followers_count,user_favourites_count,time_zone,geo_enabled,verified,status_count,geo,coords,retweet_count,tweet_favourite_count,Subjectivity,Polarity,Sentiment
2021-03-11 19:11:59,1370090142761947136,BradleyCarlvin1: If Amin was president atleast 60% + ugandans would be vaccinated with pfizer vaccine by now.. not this jolly jus they'…,1314169653258866695,ArindaFaithPro2,🛀,497,3958,,False,False,1026,,,102,0,0.0,0.0,neutral
2021-03-11 19:11:59,1370090142573203465,"fordnation: Somewhere in our province today, an Ontarian will receive our one millionth dose of a COVID-19 vaccine.

This achievement i…",987288923490549761,NishaModi17,"Toronto,ON",1,4,,False,False,2,,,105,0,0.0,0.0,neutral
2021-03-11 19:11:59,1370090142229217280,"malonebarry: Been seeing lots of vaccine selfies - genuinely warms the heart. The selfies, though, are from rich countries. Those count…",14533559,shonatiger,,7716,262956,,True,False,301926,,,8,0,0.625,0.3875,positive
2021-03-11 19:11:59,1370090141868429313,"solmamakwa: On March 1, 2021, I was invited by Sandy Lake First Nation to receive my 2nd dose of Moderna vaccine.  I was there to promo…",519739889,CharRichardRSW,"Treaty 7. Calgary, Alberta",1742,20529,,False,False,13834,,,239,0,0.16666666666666666,0.125,positive
2021-03-11 19:11:59,1370090141734211584,Reuters: Italy bans AstraZeneca batch following two deaths in Sicily: source  ,58849231,anastasiathya,,1428,2131,,True,False,85491,,,378,0,0.1,0.0,neutral
2021-03-11 19:11:59,1370090141453287425,A COVID-19 vaccine clinic will be held in Elmira on Friday ,19927280,WETM18News,"Elmira, NY",8614,2230,,True,True,56002,,,0,0,0.0,0.0,neutral
2021-03-11 19:11:59,1370090141247737856,MyOpini55028743 pfizer Glad you’ll get some relief!,30368879,timotheetee,,589,11585,,False,False,8905,,,0,0,1.0,0.625,positive
2021-03-11 19:11:59,1370090140366999568,"POTUS: One in four adults in the U.S. has received their first COVID-19 vaccine — and we’re now leading the world in vaccinations.

Tha…",1155658699937058817,SandVsco,,7,2938,,False,False,1349,,,16506,0,0.3333333333333333,0.25,positive
2021-03-11 19:11:59,1370090140366934017,"MihrThakar: Facts about Covid-19 (the coronavirus pandemic):

It is hear to STAY

The protocols that vastly changed your lives are here…",347935376,Baba_Ow,,334,6448,,True,False,46993,,,25,0,1.0,0.0,neutral
2021-03-11 19:11:58,1370090138685034498,UrugwiroVillage: VIDEO: President Kagame and First Lady Jeannette Kagame receive their Covid-19 Vaccine. VaccinesSaveLives  InkingoNi…,475778735,kiiza2Y,,710,1195,,True,False,1429,,,355,0,0.3333333333333333,0.25,positive
2021-03-11 19:11:58,1370090137632137216,"POTUS: One in four adults in the U.S. has received their first COVID-19 vaccine — and we’re now leading the world in vaccinations.

Tha…",829155760286339072,LindyLoo515,,279,274168,,True,False,330643,,,16506,0,0.3333333333333333,0.25,positive
2021-03-11 19:11:58,1370090136948588550,"MichelleObama: When you can get the COVID-19 vaccine, I hope you do—Barack and I are certainly glad we did. It’s our best shot at beati…",23539798,paul1310,Hereford and proud to be here,503,1419,,True,False,8545,,,8488,0,0.65,0.75,positive
2021-03-11 19:11:58,1370090136751378433,"TomiLahren: If you need an ID to get a Covid vaccine, why the hell shouldn’t you need an ID to vote?!! LiberalismIsAMentalDisorder",42461462,mustangusn,WA,2270,65269,,False,False,93617,,,2358,0,0.0,0.0,neutral
2021-03-11 19:11:57,1370090133161119746,"HamillHimself: Statement by the Twice Impeached Former Guy

I hope everyone remembers when they're getting the COVID-19 (often referred…",1115383946676719619,AtiradorMiope,"Curitiba, Brasil",48,43380,,False,False,32906,,,1046,0,0.0,0.0,neutral
2021-03-11 19:11:57,1370090133043740674,"sailorrooscout: Ready for some good news?
Data from Pfizer’s latest analysis shows their vaccine is at least 97% effective in preventin…",237904069,JK_DarkSide,Borger,631,81187,,False,False,217262,,,349,0,0.64,0.33999999999999997,positive
2021-03-11 19:11:57,1370090132880113665,jcho710: 1/The COVID vaccine is not a normal vaccine. It's an mRNA vaccine. What this means is as follows. A normal vaccine carries a d…,2964878626,billyjack19641,Chattanooga tn,20,594,,True,False,15406,,,220,0,0.6499999999999999,0.0375,positive
2021-03-11 19:11:57,1370090132779458563,RogueO: Billius27 My wife informed me the local pest control workers received their COVID vaccine. She works in a daycare and still ha…,1227723951524151297,EducatingAshley,,133,13319,,False,False,1664,,,5,0,0.0,0.0,neutral
2021-03-11 19:11:57,1370090131500232710,4 former presidents unite for COVID vaccine ad campaign ,261808913,ElisabethEarle,Austin Texas,758,2062,,True,False,1017,,,0,0,0.0,0.0,neutral
2021-03-11 19:11:56,1370090131240202242,LtGovHusted just received his first dose of the covid-19 vaccine ,334488656,emilycohentv,"Toledo, OH",813,7066,,True,False,5289,,,1,0,0.3333333333333333,0.25,positive
2021-03-11 19:11:56,1370090131219046405,"CNBCnow: BREAKING: Biden signs $1.9 trillion Covid relief bill, clearing way for stimulus checks, vaccine aid 
",424300385,AWealthEngineer,Oak Park CA,412,28611,,True,False,17452,,,452,0,0.0,0.0,neutral
2021-03-11 19:11:56,1370090130820726794,"AnnitaStephanou: Denmark, Iceland and Norway suspend AstraZeneca COVID-19 vaccinations after blood clot reports ",1117445353,chChr11,Λευκωσία / Nicosia,2995,33595,,True,False,44817,,,1,0,0.0,0.0,neutral
2021-03-11 19:11:56,1370090130535419904,danieteebee: It’s completely predictably American that the brand of COVID vaccine you have access to has now become a class signifier,740126190573228032,memeyoingi,🇨🇦,1964,23484,,False,False,300488,,,10930,0,0.0,0.0,neutral
2021-03-11 19:11:56,1370090130225106951,"roccogalatilaw: Denmark. another country, like Austria, to suspend  Astra-Zeneca vaccine due to ""blood-clotting"" which  led to deaths a…",196134547,G_ozzy,Canada,4968,238558,,False,False,293281,,,1497,0,0.375,-0.125,negative
2021-03-11 19:11:56,1370090129239339009,DopeySneezy: Utah mom Kassidi Kurill dies four days after second dose of Moderna vaccine  via nypost,1208098653732143109,OldW0LFLY,#Boycottliberalbusiness,7524,39134,,False,False,53471,,,5,0,0.0,0.0,neutral
2021-03-11 19:11:56,1370090128446787591,Nolan_Meister Me in line for my Moderna Vaccine ,1868045600,hayden1234g,,200,5296,,False,False,2472,,,0,2,0.0,0.0,neutral
2021-03-11 19:11:56,1370090128081846273,"POTUS: One in four adults in the U.S. has received their first COVID-19 vaccine — and we’re now leading the world in vaccinations.

Tha…",1314324787691429890,BMT8291,"New York, USA",305,17995,,False,False,86323,,,16506,0,0.3333333333333333,0.25,positive
2021-03-11 19:11:56,1370090127955988483,"lunanoko Trying to schedule a covid vaccine appointment while also trying to focus on work 

Today's been a bit of a mess",1095187098917838848,WitherManDFW,"Texas, USA",337,23529,,False,False,8909,,,0,0,0.175,-0.175,negative
2021-03-11 19:11:56,1370090127729385476,"ReutersScience: Health authorities in Denmark, Norway and Iceland suspended the use of AstraZeneca’s COVID-19 vaccine shots following r…",24019364,TanyaKlassen,"Victoria, British Columbia",274,82381,,False,False,40382,,,324,0,0.1,0.0,neutral
2021-03-11 19:11:56,1370090127570182144,"Biden signs $1.9 trillion Covid relief bill, clearing way for stimulus checks, vaccine aid CNBC

Now it has become the law😌 ",1195041285238857730,imekanella,United States,48,4905,,False,False,1161,,,0,0,0.0,0.0,neutral
2021-03-11 19:11:56,1370090127112962050,"CNBCnow: BREAKING: Biden signs $1.9 trillion Covid relief bill, clearing way for stimulus checks, vaccine aid 
",331318245,csreinicke,"Manhattan, NY",1610,10432,,False,True,1645,,,452,0,0.0,0.0,neutral
2021-03-11 19:11:55,1370090126269890560,"CNBCnow: BREAKING: Biden signs $1.9 trillion Covid relief bill, clearing way for stimulus checks, vaccine aid 
",2237480961,TriggerPsychoma,Upstate SC,231,8362,,False,False,19130,,,452,0,0.0,0.0,neutral
2021-03-11 19:11:55,1370090126165041153,"CNBCnow: BREAKING: Biden signs $1.9 trillion Covid relief bill, clearing way for stimulus checks, vaccine aid 
",2863775426,JoeTheCryptoKid,Pluto,2121,9895,,True,False,11819,,,452,0,0.0,0.0,neutral
2021-03-11 19:11:55,1370090126110564365,"GovernorObaseki: Edo receives 81,080 doses of AstraZeneca COVID-19 vaccine ",287050115,Leninopino,"Nigeria, Africa",540,35620,,False,False,38249,,,29,0,0.0,0.0,neutral
2021-03-11 19:11:55,1370090125334577152,"POTUS: One in four adults in the U.S. has received their first COVID-19 vaccine — and we’re now leading the world in vaccinations.

Tha…",824298275427586048,NotYrKateBishop,"Hawaii, USA",1149,113918,,False,False,11583,,,16506,0,0.3333333333333333,0.25,positive
2021-03-11 19:11:55,1370090124969664515,"hilarypbest: pwme
I have been having a good spell for the last few months, and able to gradually increase my activities.
AstraZeneca…",456956443,1959best,Addingham,56,1603,,False,False,6545,,,1,0,0.34791666666666665,0.25,positive
2021-03-11 19:11:55,1370090123484889088,twitterbo I had the Moderna. Just arm pain for 2 days. No big deal,3181024304,2fratalumnus,"Arkansas, USA",332,7658,,True,False,3033,,,0,0,0.1,0.0,neutral
2021-03-11 19:11:55,1370090123417825282,thbear2 fordnation AstraZeneca Polysorbate 80 is a natural vegetable sourced emulsifier which creates solubility between water based ingredients and oil based ingredients.,1043489008666464256,StdenisKatie,,46,7829,,False,False,4661,,,0,0,0.4,0.1,positive
2021-03-11 19:11:55,1370090123417821188,ClareCraigPath: And 8 countries have today suspended use of AstraZeneca vaccine pending investigation that it is causing clots which ca…,1260291453973983232,ProlongingCovid,On Gab at ChloroquineGuerilla2,825,5172,,False,False,24699,,,220,0,0.0,0.0,neutral
2021-03-11 19:11:54,1370090122641768451,LDTG117: Are Universitys anti-conservative? Join us at the BP business school on the Suncor plaza next to the Moderna Medical Theatre t…,1236478186579357696,manadajo2,Treaty 6,443,32137,,False,False,5929,,,90,0,0.0,0.0,neutral
2021-03-11 19:11:54,1370090120792084481,"HamillHimself: Statement by the Twice Impeached Former Guy

I hope everyone remembers when they're getting the COVID-19 (often referred…",1191494986577002499,WhoaShitsCrazy,"Happy Valley, OR",12083,49123,,False,False,14402,,,1046,0,0.0,0.0,neutral
2021-03-11 19:11:54,1370090120653770753,"CNBCnow: BREAKING: Biden signs $1.9 trillion Covid relief bill, clearing way for stimulus checks, vaccine aid 
",958507941732036608,ErikBregar,"Toronto, Ontario",787,5471,,False,False,5538,,,452,0,0.0,0.0,neutral
2021-03-11 19:11:54,1370090119877771269,"FJ731 Ah interesting, thanks! I guess they've got all the data we have and more, just wish they'd explain what was going on..was that Pfizer for the 6 week gap then, I kind of hope they've not jumped into doing the same for AS because 12wk seems just as good there",2959351367,nasirfmusiqi,"Free music, dub, noise funk",111,45603,,False,False,3348,,,0,0,0.4708333333333334,0.425,positive
2021-03-11 19:11:54,1370090119437418496,Had my 2nd Covid vaccine at KingsCollegeNHS today as part of the staff rollout. It was quick and painless. It’s been a hard year but our Exec Team and my own managers and team have kept us/me informed and supported throughout. Thank you teamkings CliveKay,25724254,EmJ20,South East London,1188,9849,,False,False,4232,,,0,24,0.5104166666666666,0.16041666666666665,positive
2021-03-11 19:11:54,1370090118900498435,"jfkirkegaard: Per the Danish authorities AstraZeneca will now cut its deliveries to the EU in Q2 by half! Needless to say, this is a r…",3334654887,helen_springall,Copenhagen,1053,41839,,True,False,9659,,,27,0,0.5833333333333334,-0.35416666666666663,negative
2021-03-11 19:11:53,1370090118598565895,"HamillHimself: Statement by the Twice Impeached Former Guy

I hope everyone remembers when they're getting the COVID-19 (often referred…",37031078,iamcg83,"Orlando, FL",2380,68020,,True,False,57323,,,1046,0,0.0,0.0,neutral
2021-03-11 19:11:53,1370090118544035846,"oiler3535 astrazeneca is UK developed vaccine getting manufactured in many countries including India.
We took it from india , even india send it to the uk.",1217058163326844928,salla7ovitch95,Royaume du Maroc,6,9,,False,False,70,,,0,0,0.4,0.3,positive
2021-03-11 19:11:53,1370090118250381319,BMEnvoysExpats: Around 23 million doses of the AstraZeneca vaccine should arrive in the country during this year. - UK envoy to PHL …,490636475,timg33,"Ramsgate, Kent, UK",1677,48633,,True,False,237914,,,5,0,0.0,0.0,neutral
2021-03-11 19:11:53,1370090117730332684,"MichelleObama: When you can get the COVID-19 vaccine, I hope you do—Barack and I are certainly glad we did. It’s our best shot at beati…",169190319,fmartinezblanco,"Brooklyn, NY",179,305,,True,False,1029,,,8488,0,0.65,0.75,positive
2021-03-11 19:11:53,1370090117520629764,"Columbia: Director of Global Health in Emergency Medicine 
ColumbiaMed Dr. Craig Spencer joins MarkLevineNYC tonight on his Q&amp;A about…",155634643,paula_span,New York,7970,35185,,False,False,80177,,,3,0,0.0,0.0,neutral
2021-03-11 19:11:53,1370090117222793219,"myfashionunit: Planning to go on a DATE/FUNCTION this weekend? 

Compliment your outfit with a CONTACT LENS 😉

- Buy two coloured conta…",178643963,Enkayakanbi,Lagos,323,2189,,True,False,6720,,,195,0,0.0,0.0,neutral
2021-03-11 19:11:53,1370090116597813254,Lisadelivers My son has had both Pfizer. Sore arm after first shot. 24 hrs of feeling tired and achy after the second one. That was it.,946952223321415681,Hopewenttodie,,2272,362439,,False,False,248684,,,0,2,0.3444444444444444,-0.05000000000000001,negative
2021-03-11 19:11:53,1370090116199370753,"CNBCnow: BREAKING: Biden signs $1.9 trillion Covid relief bill, clearing way for stimulus checks, vaccine aid 
",1325224754865975296,jordanfarialima,,5210,23622,,False,False,13883,,,452,0,0.0,0.0,neutral
2021-03-11 19:11:53,1370090116195217417,"France not planning to halt use of AstraZeneca jab
See more on ",573866808,robertojirusta,Argentina,5719,106225,,True,False,300474,,,0,0,0.5,0.5,positive
2021-03-11 19:11:53,1370090115121434640,"Breaking: News 📰 

 ",1326770779632136193,FBGCNews,WorldWide,55,28709,,False,False,33025,,,0,0,0.0,0.0,neutral
2021-03-11 19:11:53,1370090114869817346,"HamillHimself: Statement by the Twice Impeached Former Guy

I hope everyone remembers when they're getting the COVID-19 (often referred…",1228345278610190336,CbfComic,"1265 Lombardi Ave, Green Bay",395,4175,,False,False,24809,,,1046,0,0.0,0.0,neutral
2021-03-11 19:11:52,1370090112378417154,JoeBrunoWSOC9: Starting Saturday- CVS Health will begin offering COVID-19 vaccine appointments in North Carolina. CVS says 9 stores in…,876161947959513088,TemporarilyClsd,🌜,323,20830,,False,False,24506,,,29,0,0.1,0.0,neutral
2021-03-11 19:11:52,1370090112105713670,"fordnation ""Denmark suspends AstraZeneca COVID vaccine after blood clot reports""

We need transparency on those rushed experimental vaccines. The cure shouldn't be worse than the disease.",1189359256803389440,MrMaxBoivin,,104,12105,,False,False,4217,,,0,0,0.5,-0.15000000000000002,negative
2021-03-11 19:11:52,1370090110394396675,"MichaelArt123: Barack Obama
Michelle and I got vaccinated against COVID-19 because we know it’s the best way to beat this pandemic, pro…",3246793157,CassettMfgill,,154,48782,,False,False,36876,,,26,0,0.3,1.0,positive
2021-03-11 19:11:52,1370090110356701193,"CNBCnow: BREAKING: Biden signs $1.9 trillion Covid relief bill, clearing way for stimulus checks, vaccine aid 
",2654975484,ChudiCObi,,1332,132823,,False,False,104128,,,452,0,0.0,0.0,neutral
2021-03-11 19:11:51,1370090109903720454,Somehow I got eligible for the covid vaccine ayeee baby,3304759361,HOttFrEy,,150,24382,,True,False,12086,,,0,1,0.0,0.0,neutral
2021-03-11 19:11:51,1370090108674830345,"BarackObama: Michelle and I got vaccinated against COVID-19 because we know it’s the best way to beat this pandemic, protect one anothe…",2801914235,elizbowyer1,,41,41253,,False,False,12654,,,10545,0,0.3,1.0,positive
2021-03-11 19:11:51,1370090108653875203,robertmentzer: This is a going to open eligibility up to a *lot* of people. I'm in the process of calling some of the folks I talked to…,805959242624733184,fiftyacorns,"Madison, WI",193,2087,,True,False,2886,,,2,0,0.5,0.0,neutral
2021-03-11 19:11:51,1370090108037308424,"Biden signs $1.9 trillion Covid relief bill, clearing way for stimulus checks, vaccine aid ⁦CNBC⁩  ",34456552,olavchen,Oslo,7338,642,,True,False,5847,,,0,4,0.0,0.0,neutral
2021-03-11 19:11:51,1370090108024655883,"POTUS: One in four adults in the U.S. has received their first COVID-19 vaccine — and we’re now leading the world in vaccinations.

Tha…",297608951,_HelenLindberg_,Wherever I lay my books,1417,56389,,True,False,43707,,,16506,0,0.3333333333333333,0.25,positive
2021-03-11 19:11:51,1370090106908983298,"HamillHimself: Statement by the Twice Impeached Former Guy

I hope everyone remembers when they're getting the COVID-19 (often referred…",37899481,reneestan,,90,17504,,True,False,72107,,,1046,0,0.0,0.0,neutral
2021-03-11 19:11:51,1370090106556723200,"CNBCnow: BREAKING: Biden signs $1.9 trillion Covid relief bill, clearing way for stimulus checks, vaccine aid 
",1300919595478536194,InvestMenz_,,44,3537,,False,False,624,,,452,0,0.0,0.0,neutral
2021-03-11 19:11:50,1370090105285832711,"POTUS: One in four adults in the U.S. has received their first COVID-19 vaccine — and we’re now leading the world in vaccinations.

Tha…",214936709,tom1robson,"Toronto, Canada",391,19178,,True,False,10569,,,16506,0,0.3333333333333333,0.25,positive
2021-03-11 19:11:50,1370090104803500040,"CNBCnow: BREAKING: Biden signs $1.9 trillion Covid relief bill, clearing way for stimulus checks, vaccine aid 
",32148675,caa1000,Orlando FL,1455,2852,,True,False,195670,,,452,0,0.0,0.0,neutral
2021-03-11 19:11:50,1370090103796756482,"ZoomTV: Drishyam2 actor Mohanlal took the COVID-19 vaccine earlier today

",1282335450464583680,Rajavin16321561,,197,2883,,False,False,9536,,,106,0,0.5,0.0,neutral
2021-03-11 19:11:50,1370090103037517825,"IndiaCongo: Pakistan🇵🇰, the only SAARC country to not seek COVID-19 Vaccine from India, is getting 45 million 🇮🇳 made vaccine Covishiel…",754936080,bhartiyabhakt,Greater Noida,3120,12335,,False,False,15021,,,1396,0,1.0,0.0,neutral
2021-03-11 19:11:50,1370090102228148230,"CNBCnow: BREAKING: Biden signs $1.9 trillion Covid relief bill, clearing way for stimulus checks, vaccine aid 
",35219345,thedave2006,Canada,5310,266425,,False,False,112269,,,452,0,0.0,0.0,neutral
2021-03-11 19:11:50,1370090102056161284,DonnellyStephen why don't the govt buy more of Pfizer vaccine if astra zenica can't provide. I'm in cohort 4 haven't seen any friends since 03/20. Immunocompromised &amp; a carer. This is doing hell to my mental health. Numbers starting to go up. Medical services cancelledisolated,1317543984898756608,Nzd201,,7,997,,False,False,1202,,,0,0,0.19999999999999998,0.1,positive
2021-03-11 19:11:50,1370090101997408256,The vaccine alarmism needs to stop. Millions and millions of people around the world have gotten covid vaccines and people are gonna freak out over a headline that says a lady died after her second dose? The news should not even fuckin run that story until an autopsy comes back.,384657617,IsaacsHandle,Salt Lake City,652,76835,,True,False,121587,,,0,2,0.0,0.0,neutral
2021-03-11 19:11:49,1370090101494190080,danieteebee: It’s completely predictably American that the brand of COVID vaccine you have access to has now become a class signifier,1015425480638521349,JungHoesuckk,she/her,94,82196,,False,False,6742,,,10930,0,0.0,0.0,neutral
2021-03-11 19:11:49,1370090098977554434,"suleskerry: DENMARK suspends use of OXFORD Astra-Zeneca vaccine after blood clots in some of those vaccinated, and one DEATH",1173286490,JanCowan2,,1544,33808,,True,False,62971,,,4,0,0.0,0.0,neutral
2021-03-11 19:11:49,1370090098453319682,"CNBCnow: BREAKING: Biden signs $1.9 trillion Covid relief bill, clearing way for stimulus checks, vaccine aid 
",1319230901969182720,karlpikner,Estonia,60,97,,False,False,2276,,,452,0,0.0,0.0,neutral
2021-03-11 19:11:48,1370090096800698369,"TheRevAl: Covid vaccine skepticism among Black Americans is falling — but there's a bigger issue.

Black Americans are being called out…",17057770,phillyvet,www.nawvphilly.webs.com,534,2015,,False,False,3714,,,22,0,0.45555555555555555,-0.1111111111111111,negative
2021-03-11 19:11:48,1370090096410685444,"CNBCnow: BREAKING: Biden signs $1.9 trillion Covid relief bill, clearing way for stimulus checks, vaccine aid 
",958087450274000896,Reformed_Trader,,41538,7480,,False,False,14718,,,452,0,0.0,0.0,neutral
2021-03-11 19:11:48,1370090096175775746,"Received my 1st dose of Pfizer’s vaccine today! Not going to lie, I teared up a little when I saw all the volunteers, nurses, pharmacists, &amp; others at the site working together to get people in &amp; vaccinated as quickly &amp; efficiently as possible. The end is in sight friends 💗 ",457189346,daniellextalbot,Philly/Chicago/Iowa City/?,509,97606,,True,False,18774,,,0,15,0.6666666666666666,0.048611111111111105,positive
2021-03-11 19:11:48,1370090095596900353,Having walk in appointments for Moderna vaccines walking distance from my apt. Very nice folks and efficient. Everyone in masks and social distancing. Gotta wait 15 min for side effect check then make 2nd ap before leaving. I am doing my part. Are you?,1220535047184211969,JoyRuthann,,2267,15998,,False,False,15848,,,0,2,0.5166666666666667,0.35333333333333333,positive
2021-03-11 19:11:48,1370090095366139907,Utah mother dies four days after taking second COVID vaccine dose ,2568734003,MccunnJ,,0,3,,True,False,406,,,0,0,0.0,0.0,neutral
2021-03-11 19:11:48,1370090094695186435,"HegKong: Anything that challenges the official Covid vaccine narrative these days will get you banned on Twitter, suggesting that rathe…",117529098,keithdahacker,,2068,84091,,False,False,77886,,,161,0,0.0,0.0,neutral
2021-03-11 19:11:47,1370090093222957056,"Magic2Girl: Buy airtime from your Mpesa using VochaLtd paybill no. 505082 to ALL NETWORKS . Account number is the phone no.
It is pret…",1311933312135507975,ItsMorgan____,"Ruiru, Kenya",7975,31001,,False,False,39337,,,93,0,0.0,0.0,neutral
2021-03-11 19:11:47,1370090092555956226,danieteebee: It’s completely predictably American that the brand of COVID vaccine you have access to has now become a class signifier,1200228939794391040,mariloopy,tú casa,40,2444,,True,False,481,,,10930,0,0.0,0.0,neutral
2021-03-11 19:11:47,1370090090182152201,"HamillHimself: Statement by the Twice Impeached Former Guy

I hope everyone remembers when they're getting the COVID-19 (often referred…",850423084091879424,Tomfan_photos,,976,93492,,False,False,14990,,,1046,0,0.0,0.0,neutral
2021-03-11 19:11:47,1370090089553002497,4 former presidents unite for COVID vaccine ad campaign - Axios ,20564528,araragon,Philadelphia,1023,147,,True,False,22738,,,0,0,0.0,0.0,neutral
2021-03-11 19:11:47,1370090089473310720,"POTUS: One in four adults in the U.S. has received their first COVID-19 vaccine — and we’re now leading the world in vaccinations.

Tha…",171800425,jackiemishler,,314,951,,False,False,4371,,,16506,0,0.3333333333333333,0.25,positive
2021-03-11 19:11:46,1370090088965677056,"908 COVID+ in hospitals, down 25 fr 933 Wed (3.31% of beds)
220 in ICU, down 25 fr 245 Wed; 4.64% of beds
161 on ventilators, down 6 from 167 Wed; 3.41% capacity 
Positivity rate 3%; 7-day moving avg 3%
18.46% (2,157,525) of total Ohio population have had at least 1 vaccine dose",18261728,karenkasler,"Ohio Statehouse, Columbus",13269,8726,,True,False,20199,,,4,2,0.4033333333333333,-0.15333333333333338,negative
2021-03-11 19:11:46,1370090086767939584,"TheStreet: Johnson &amp; Johnson's ( $JNJ ) single-shot vaccine for COVID-19 will soon be available in the European Union.
",54271887,1FLP7,?,4927,146032,,True,False,30107,,,3,0,0.2,0.2,positive
2021-03-11 19:11:46,1370090085635481606,USAmbPyatt: 2/2 Very proud that US companies active in Greece like pfizer JNJNews merck LillyPad GileadSciences &amp; AbbottNews are…,1221826725165879296,EW5RtiU4eeL1Zho,,491,31082,,False,False,32315,,,7,0,0.8,0.43333333333333335,positive
2021-03-11 19:11:45,1370090084494671873,"POTUS: One in four adults in the U.S. has received their first COVID-19 vaccine — and we’re now leading the world in vaccinations.

Tha…",71668229,gabrielrcross,Why do you wanna know?,445,201605,,False,False,19275,,,16506,0,0.3333333333333333,0.25,positive
2021-03-11 19:11:45,1370090084213518338,narendramodi: Happy to share that my mother has taken the first dose of the COVID-19 vaccine today. I urge everyone to help and motivat…,1063303139468681216,shashankrajak27,,2,5,,True,False,312,,,17054,0,0.6666666666666666,0.525,positive
2021-03-11 19:11:45,1370090081390895104,"CNBCnow: BREAKING: Biden signs $1.9 trillion Covid relief bill, clearing way for stimulus checks, vaccine aid 
",448067363,Baghlaf_Naif,Jeddah-Saudi Arabia,6081,2598,,True,False,23328,,,452,0,0.0,0.0,neutral
2021-03-11 19:11:44,1370090080937910284,Exclusive with chiaraalbanese AstraZeneca will deliver less than half the planned number of Covid-19 vaccines to the EU in the second quarter because of supply-chain problems  via business,94189821,journosooz,London,3157,1173,,False,True,4051,,,7,2,0.07777777777777778,-0.1111111111111111,negative
2021-03-11 19:11:44,1370090080757551119,UrugwiroVillage: VIDEO: President Kagame and First Lady Jeannette Kagame receive their Covid-19 Vaccine. VaccinesSaveLives  InkingoNi…,1283817415638425601,Emmanue26670502,South Sudan,31,361,,False,False,125,,,355,0,0.3333333333333333,0.25,positive
