created,id_str,text,user_id,screen_name,location,followers_count,user_favourites_count,time_zone,geo_enabled,verified,status_count,geo,coords,retweet_count,tweet_favourite_count,Subjectivity,Polarity,Sentiment
2021-03-11 19:12:47,1370090341936865281,"kayleighmcenany: FINALLY the Biden admin recognizes the Trump admin’s unprecedented vaccine work:

➡️ “We’re grateful for the work that…",843865851728203776,El_Jefe_Yeffy,"San Antonio, TX",43,4022,,False,False,633,,,4655,0,0.95,0.3,positive
2021-03-11 19:12:46,1370090340162625536,"drsimonegold: According to the FDA’s adverse reporting system, 3 dozen cases of spontaneous miscarriages or stillbirths occurred after…",457694206,AGENT_GATTACA,CSPAN the other C network,1393,69593,,False,False,86520,,,2719,0,0.9,0.6,positive
2021-03-11 19:12:46,1370090339319562241,danieteebee: It’s completely predictably American that the brand of COVID vaccine you have access to has now become a class signifier,4780211352,maangiia,she/her,544,189210,,True,False,24375,,,10930,0,0.0,0.0,neutral
2021-03-11 19:12:46,1370090337629245445,"Kassidi Kurill Wiki - Kassidi Kurill Biography
Kassidi Kurill is a single mother in Utah with no underlying medical conditions who reportedly died four days after receiving her second dose of the Modern COVID-19 vaccine, according to a report.

 ",1233458160528171013,WikiBious,"New York, USA",16,1,,False,False,2370,,,0,0,0.12857142857142856,0.03214285714285715,positive
2021-03-11 19:12:46,1370090336823967747,"POTUS: One in four adults in the U.S. has received their first COVID-19 vaccine — and we’re now leading the world in vaccinations.

Tha…",2591675300,CharlesPDavis,Retweets ≠ endorsement,1555,919,,False,False,162367,,,16506,0,0.3333333333333333,0.25,positive
2021-03-11 19:12:45,1370090336391954436,"CNBCnow: BREAKING: Biden signs $1.9 trillion Covid relief bill, clearing way for stimulus checks, vaccine aid 
",348541395,i_am_andrew84,"Texas, USA",1429,27759,,True,False,17516,,,452,0,0.0,0.0,neutral
2021-03-11 19:12:45,1370090336303902731,HopkinsMedNews: Underarm lymph nodes can be larger than usual after getting a COVID19 vaccine. New recommendations suggest that women…,1301298233109614593,JHGeriatrics,"Baltimore, Maryland ",1062,3225,,False,False,2636,,,3,0,0.40151515151515155,-0.03787878787878788,negative
2021-03-11 19:12:45,1370090335997726721,"MichelleObama: When you can get the COVID-19 vaccine, I hope you do—Barack and I are certainly glad we did. It’s our best shot at beati…",1121117620051292160,sarawniya1,,12,7686,,False,False,6692,,,8488,0,0.65,0.75,positive
2021-03-11 19:12:45,1370090335016263690,Reuters: Italy bans AstraZeneca batch following two deaths in Sicily: source  ,4909144967,Silvere71269532,"Ile-de-France, France",66,9959,,True,False,13520,,,378,0,0.1,0.0,neutral
2021-03-11 19:12:45,1370090334462513153,"justinhorowitz_: On Bannon's show, MyPillow CEO Mike Lindell describes the COVID-19 vaccine as ""the mark of the beast"" 

ApplePodcasts…",122448186,annetonie,Berlin,923,206694,,False,False,179531,,,169,0,0.0,0.0,neutral
2021-03-11 19:12:45,1370090334101852161,DrJDrooghaag: 🔵 COVID vaccine: EU regulators approve Johnson &amp; Johnson shot ,3429955204,DrJDrooghaag,"Germany, Europe",31396,244872,,False,False,123415,,,5,0,0.0,0.0,neutral
2021-03-11 19:12:45,1370090332977782787,AndFranchini: Serve commentare? AstraZeneca ,1299087773601861632,gettasofia,,160,19909,,False,False,34700,,,63,0,0.0,0.0,neutral
2021-03-11 19:12:44,1370090329672724485,"The companies plan to submit data for children aged 12 to 16 very soon, the CEO announced Thursday. 
",116502194,globalnews,,580624,13180,,True,True,253619,,,5,16,0.35,0.05,positive
2021-03-11 19:12:43,1370090327445536773,keithedwards: Can Pfizer make a vaccine for Trumpism while they’re at it,2726667669,Pacaldo57,,32,41278,,False,False,2508,,,91,0,0.0,0.0,neutral
2021-03-11 19:12:43,1370090327185485825,"CNBCnow: BREAKING: Biden signs $1.9 trillion Covid relief bill, clearing way for stimulus checks, vaccine aid 
",1325831870349774853,KremserMariana1,,55,3731,,False,False,22320,,,452,0,0.0,0.0,neutral
2021-03-11 19:12:43,1370090326916993027,"CNBCnow: BREAKING: Biden signs $1.9 trillion Covid relief bill, clearing way for stimulus checks, vaccine aid 
",492687638,PrettyCGLL,"East Coast, USA",1180,30808,,True,False,218812,,,452,0,0.0,0.0,neutral
2021-03-11 19:12:43,1370090326120103936,"kayleighmcenany: FINALLY the Biden admin recognizes the Trump admin’s unprecedented vaccine work:

➡️ “We’re grateful for the work that…",1355618318405799938,KettleySteve,"South East, England",55,10452,,False,False,9274,,,4655,0,0.95,0.3,positive
2021-03-11 19:12:43,1370090325511929867,"timstimeagain michaelcoren The vaccine being used here is Astra Zeneca, which is not recommended for those 65 or older.  Your outrage is unnecessary",584123234,apelipiak,"London, Ontario",386,23021,,True,False,21908,,,0,6,0.6166666666666667,-0.11666666666666668,negative
2021-03-11 19:12:43,1370090325058928644,ruthmkb: I get it AstraZeneca has an expiry date &amp; they shld b used up. BUT indiscriminately jabbing ppl? What has RickHillier been d…,3750904576,nlclarke1112,,711,233169,,True,False,67458,,,47,0,0.0,0.0,neutral
2021-03-11 19:12:43,1370090324933148672,"Nas_k27: New propaganda &amp; Agenda on our way!
“Pakistan will Import Made in India Covid vaccines 😳
Not TRUE
Its WHO who is deciding who…",477041865,RukhsanaQ,U.A.E,9674,115779,,True,False,122306,,,71,0,0.40151515151515155,-0.05454545454545454,negative
2021-03-11 19:12:42,1370090323091816453,"MichelleObama: When you can get the COVID-19 vaccine, I hope you do—Barack and I are certainly glad we did. It’s our best shot at beati…",884061157241352192,Anica_MD,"Berlin, Deutschland",10,1590,,False,False,80,,,8488,0,0.65,0.75,positive
2021-03-11 19:12:42,1370090322743717892,CBSNews: President Biden is expected to announce Wednesday afternoon that the federal government is purchasing 100 million more doses o…,739832188619882497,gisal2010,,547,7912,,True,False,27127,,,798,0,0.45,0.2,positive
2021-03-11 19:12:42,1370090321800007686,"iam_Muideen: Please I Need A Room Around Bodija, Ashi, Apete Eleyele And It's Environ Please It's Urgent I Have Been On This House Hunt…",227757472,Queenn_Olaa,Ibadan,733,12937,,False,False,11773,,,6,0,0.0,0.0,neutral
2021-03-11 19:12:42,1370090320814354434,"HamillHimself: Statement by the Twice Impeached Former Guy

I hope everyone remembers when they're getting the COVID-19 (often referred…",2881985823,Celebi734,,96,15358,,False,False,4310,,,1046,0,0.0,0.0,neutral
2021-03-11 19:12:42,1370090320743038989,spectatorindex: JUST IN: France says halting use of AstraZeneca coronavirus vaccine is not needed,574900083,BVanderwey10,London ON,294,66044,,True,False,20480,,,487,0,0.0,0.0,neutral
2021-03-11 19:12:41,1370090319732207616,"Petition: Do not rollout Covid-19 vaccine passports  No to a passport, for a trial drug which doesn’t stop transmission, infection or symptoms, but may stop your symptoms from being worse! 10DowningStreet I have a choice what goes in my body! freedom",716014297,missionhealthy,"East Midlands, England",107,384,,False,False,674,,,3,3,0.6,-0.625,negative
2021-03-11 19:12:41,1370090319509868545,"CNBCnow: BREAKING: Biden signs $1.9 trillion Covid relief bill, clearing way for stimulus checks, vaccine aid 
",933346454554411009,tombRaider_kw,,541,53862,,False,False,33490,,,452,0,0.0,0.0,neutral
2021-03-11 19:12:41,1370090319388282884,"GiulioTerzi: 3 days after Pfizer vaccine, Japanese woman dies from brain hemorrhage ",1285295149082447872,Pixty3,,115,14881,,False,False,17710,,,37,0,0.5,0.25,positive
2021-03-11 19:12:41,1370090319052730369,"snopes: Michael Yeadon last worked at Pfizer a decade ago, and was never the company's ""chief scientist."" His anti-vaccine argument rel…",21421032,iancundell,Olney,682,5358,,True,False,58620,,,57,0,0.06666666666666667,0.0,neutral
2021-03-11 19:12:41,1370090318511620103,BlueVotr Didn't have a choice. Got Moderna.,823337401061937152,SPEAKUPJULIA,Red State,7827,352232,,True,False,334608,,,0,0,0.0,0.0,neutral
2021-03-11 19:12:41,1370090318457110535,HighWireTalk: VACCINE DISASTER AHEAD  CDC Spin on New Mask Data; Celebrity Catches Fauci Lying!; Expert Warns of Coming Covid Vaccine D…,1103008100154593285,mcguinness_noel,,166,9478,,False,False,7371,,,719,0,0.45454545454545453,0.17045454545454544,positive
2021-03-11 19:12:41,1370090317584683008,"POTUS: One in four adults in the U.S. has received their first COVID-19 vaccine — and we’re now leading the world in vaccinations.

Tha…",961488077880471557,districtdems,"Washington, DC",98,3081,,True,False,2607,,,16506,0,0.3333333333333333,0.25,positive
2021-03-11 19:12:41,1370090315886002179,"HighWireTalk: ""Denmark has suspended the use of the Oxford-AstraZeneca COVID vaccine in a precautionary move, citing concerns that it c…",357753264,BellHappe,United Kingdom,2788,121487,,True,False,102007,,,367,0,0.0,0.0,neutral
2021-03-11 19:12:40,1370090315248513033,HighWireTalk: VACCINE DISASTER AHEAD  CDC Spin on New Mask Data; Celebrity Catches Fauci Lying!; Expert Warns of Coming Covid Vaccine D…,1095171002533695488,no2duopoly,,201,32668,,False,False,4285,,,719,0,0.45454545454545453,0.17045454545454544,positive
2021-03-11 19:12:40,1370090314959048710,DaveKeating: In AstraZeneca's contract with the EU it list 4 facilities that will be used to fulfil delivery - 2 in the UK and 2 in the…,1248609816576065539,Lurlooo,,243,10921,,False,False,10766,,,77,0,0.0,0.0,neutral
2021-03-11 19:12:40,1370090314694864903,"midletonimages: Stunning Ariel view of the Midleton Distillery from IrishDistillers 

pure_cork corkbeo 
PhotosCork Ireland 100da…",429822979,jjahartnett,Cork,897,18300,,True,False,6525,,,5,0,1.0,0.5,positive
2021-03-11 19:12:40,1370090314275254272,"ABCPolitics: Despite calls for national unity and bipartisanship, President Joe Biden and his top aides have declined to give the Trump…",141938077,TroubledDays,"Alaska, USA",7515,211512,,True,False,549285,,,1116,0,0.5,0.5,positive
2021-03-11 19:12:40,1370090314195636230,"JosephEllis408: Summer 2021:

“YO SO DID YOU GET PFIZER OR MODERNA?” ",2390029500,ishouldgethelp,"San Diego, CA",390,95658,,True,False,50802,,,46756,0,0.0,0.0,neutral
2021-03-11 19:12:40,1370090313067360263,"POTUS: One in four adults in the U.S. has received their first COVID-19 vaccine — and we’re now leading the world in vaccinations.

Tha…",42544445,ganeshk1102,,6431,32097,,False,False,47322,,,16506,0,0.3333333333333333,0.25,positive
2021-03-11 19:12:40,1370090312798982153,"VaccineAlertsOk: 14 appointments at 1st and 2nd Dose - Moderna - Chandler - Lincoln County Health Department
15 at Moderna - Blackwell…",43137793,klcollierokc,"Oklahoma City, OK, USA",653,28698,,False,False,9550,,,3,0,0.0,0.0,neutral
2021-03-11 19:12:40,1370090312543178754,"AkindoyinWasiu: Omo!!! It's the man's bag for me😂. Funniest thing you'll see online 💯
Maguire Oxlade MUNACM  Milan Claire Drogba…",1256707502651183104,Tosinlovewizkid,,1171,11765,,True,False,11761,,,1,0,0.0,0.0,neutral
2021-03-11 19:12:40,1370090312438284290,"Biden Signs $1.9 Trillion Covid relief bill, clearing way for stimulus checks, vaccine aid.   StimulusPackage StimulusCheck ",73721873,hcrubin2009,NYC  E: (HRubinroit@gmail.com),349,65929,,False,False,18156,,,0,0,0.0,0.0,neutral
2021-03-11 19:12:40,1370090312174014465,"POTUS: One in four adults in the U.S. has received their first COVID-19 vaccine — and we’re now leading the world in vaccinations.

Tha…",1165766846274056197,NorthStar5001,,16,4435,,False,False,2768,,,16506,0,0.3333333333333333,0.25,positive
2021-03-11 19:12:40,1370090311913988099,keep_resisting5 Itsjust_JEFF GabrielShapiro4 davidmackau Don’t be offended but I fact check everything.  He does not.  ,1638479378,LittleGuy825,,2,10,,False,False,110,,,0,1,0.0,0.0,neutral
2021-03-11 19:12:39,1370090310680862720,"MsKellyMHayes my partner got both shots of Moderna and didn't have a bad reaction at all, just soreness and fatigue",1062471709637443585,declatom,"Chicago, IL",151,6523,,False,False,2251,,,0,8,0.6666666666666666,-0.6999999999999998,negative
2021-03-11 19:12:39,1370090310060154886,"kayleighmcenany: FINALLY the Biden admin recognizes the Trump admin’s unprecedented vaccine work:

➡️ “We’re grateful for the work that…",830613473071620096,kirglassmyer,,3,4323,,False,False,1157,,,4655,0,0.95,0.3,positive
2021-03-11 19:12:39,1370090308856348678,"POTUS: One in four adults in the U.S. has received their first COVID-19 vaccine — and we’re now leading the world in vaccinations.

Tha…",2874092008,nevertrump76,,392,33949,,False,False,25176,,,16506,0,0.3333333333333333,0.25,positive
2021-03-11 19:12:39,1370090308101419012,"TheMSeries1: Pfizer Covid vaccine cuts transmission of coronavirus, new real-world study shows ",1296551881045680131,PG24___,,73,1514,,False,False,22244,,,36,0,0.45454545454545453,0.13636363636363635,positive
2021-03-11 19:12:38,1370090307262554121,"kayleighmcenany: FINALLY the Biden admin recognizes the Trump admin’s unprecedented vaccine work:

➡️ “We’re grateful for the work that…",1326670066285502466,Brownlow2Steve,"Houston, TX",19,7376,,False,False,5086,,,4655,0,0.95,0.3,positive
2021-03-11 19:12:38,1370090306541137923,AllenLEllison: . marcorubio didn’t give a damn about you during this entire pandemic. He even skipped your grandparents in line to get…,3104759578,tchevalier10,Canada,1876,181948,,False,False,189119,,,587,0,0.625,0.0,neutral
2021-03-11 19:12:38,1370090306302001155,"POTUS: One in four adults in the U.S. has received their first COVID-19 vaccine — and we’re now leading the world in vaccinations.

Tha…",1369986792162799622,mymagentamood,,0,132,,False,False,52,,,16506,0,0.3333333333333333,0.25,positive
2021-03-11 19:12:38,1370090305375019008,UrugwiroVillage: VIDEO: President Kagame and First Lady Jeannette Kagame receive their Covid-19 Vaccine. VaccinesSaveLives  InkingoNi…,164287098,GodemaE,𝐈𝐧 𝐓𝐫𝐚𝐧𝐬𝐢𝐭,1614,7359,,True,False,39880,,,355,0,0.3333333333333333,0.25,positive
2021-03-11 19:12:38,1370090305333170177,danieteebee: It’s completely predictably American that the brand of COVID vaccine you have access to has now become a class signifier,544696708,luidithecoxinha,Seu cu,124,30340,,True,False,19536,,,10930,0,0.0,0.0,neutral
2021-03-11 19:12:37,1370090303143698432,"CNBCnow: BREAKING: Biden signs $1.9 trillion Covid relief bill, clearing way for stimulus checks, vaccine aid 
",1346149879643516931,murrayt1929,,10,122,,False,False,45,,,452,0,0.0,0.0,neutral
2021-03-11 19:12:37,1370090302657200136,"petemorristwit: As it stands today, at this point in time. I won't be taking the vaccine.  I really don't want to be part of an ongoing…",1216769793715572744,WendyGore16,,307,19477,,False,False,9745,,,156,0,0.2,0.2,positive
2021-03-11 19:12:37,1370090302351024128,"Good afternoon,
COVID_19 Vaccination updates.
",141297107,HealthPeopleOrg,"Bronx, NY",939,264,,False,False,2677,,,0,0,0.6000000000000001,0.7,positive
2021-03-11 19:12:37,1370090301734453249,JeffreyCMcKay: FX will soon be opening a mass COVID-19 vacc site w InovaHealth + AlexandriaVAGov. Our goal is getting as many people…,1606711592,UCAlexandria,Alexandria VA,1021,6484,,True,False,7183,,,11,0,0.5,0.5,positive
2021-03-11 19:12:37,1370090300220268547,"nytimes: Ukraine is so plagued by misinformation about Covid-19 that vaccine hesitancy is among the worst in Europe. 

Opened vials of…",389330643,gera777r,,37,19136,,False,False,5264,,,67,0,1.0,-1.0,negative
2021-03-11 19:12:37,1370090299544965124,"HegKong: Anything that challenges the official Covid vaccine narrative these days will get you banned on Twitter, suggesting that rathe…",32696129,modernmysticmom,,127,1382,,False,False,2677,,,161,0,0.0,0.0,neutral
2021-03-11 19:12:37,1370090299536642052,stopbeingaderp: Got my first Moderna shot this morning and feeling a little ... off.  Anyone else have side effects after their first s…,340757907,CarlosTryidero,"New York, USA",2523,108146,,True,False,143283,,,10,0,0.38888888888888884,0.10416666666666667,positive
2021-03-11 19:12:36,1370090298479685633,FIAsouthafrica: We have joined movements and civil society at the Johnson &amp; Johnson and pfizer Head Office in CT and JHB demanding an…,51085338,CedoMadubedube,From Gqeberha- in Camissa,1291,8399,,True,False,14513,,,32,0,0.0,0.0,neutral
2021-03-11 19:12:36,1370090298014060548,UrugwiroVillage: VIDEO: President Kagame and First Lady Jeannette Kagame receive their Covid-19 Vaccine. VaccinesSaveLives  InkingoNi…,4514227474,RwandaInUAE,United Arab Emirates,2576,6550,,True,False,5455,,,355,0,0.3333333333333333,0.25,positive
2021-03-11 19:12:36,1370090297674326023,"karenkasler: 908 COVID+ in hospitals, down 25 fr 933 Wed (3.31% of beds)
220 in ICU, down 25 fr 245 Wed; 4.64% of beds
161 on ventilato…",18245880,ClevelandScene,Cleveland,127170,28536,,True,True,86173,,,4,0,0.2888888888888889,-0.15555555555555559,negative
2021-03-11 19:12:36,1370090296952844290,benedictrogers: The New Hong Kong ,1178561952626274305,TomWong93767868,,3139,46984,,False,False,72591,,,650,0,0.45454545454545453,0.13636363636363635,positive
2021-03-11 19:12:36,1370090296915030021,"pfizer: The Israel data demonstrate that the vaccine may be able to prevent continued transmission of SARS-CoV-2, which is vital to hel…",19713167,jasonleong,,2444,383,,True,False,84149,,,22,0,0.5125,0.3,positive
2021-03-11 19:12:36,1370090296457986056,"HegKong: Anything that challenges the official Covid vaccine narrative these days will get you banned on Twitter, suggesting that rathe…",1355032477618872320,JohannGambolpu7,,36,1662,,False,False,858,,,161,0,0.0,0.0,neutral
2021-03-11 19:12:36,1370090296332140544,"PeterKGeoghegan: Seems a pretty decent chance that Brazil could become a global Covid incubator, spreading new - probably vaccine resis…",569423494,BryanODonnell,Glasgow,257,7167,,False,False,5450,,,66,0,0.5303030303030303,0.13825757575757575,positive
2021-03-11 19:12:36,1370090296298639360,"jesusanampa: Real-World Data suggest Pfizer vaccine is :
-94% effective in preventing asymptomatic infections
-97% effective in prevent…",475473929,luchicarrillo22,,411,23568,,True,False,20487,,,30,0,0.8,0.6,positive
2021-03-11 19:12:36,1370090296105705479,"POTUS: One in four adults in the U.S. has received their first COVID-19 vaccine — and we’re now leading the world in vaccinations.

Tha…",749728665047629824,demianddebby,,905,73912,,True,False,47502,,,16506,0,0.3333333333333333,0.25,positive
2021-03-11 19:12:35,1370090294260142087,stopbeingaderp Got 1st Pfizer 💉 2 wks ago. Really didn't have a noticeably sore arm.  I've talked to ppl who got Pfizer &amp; Moderna shots. Some had a few side effects-some didn't have any. I think whether or not your arm is sore has a lot to do w/skill of person who gave the 💉.,1303709783808122880,ThruThinking,,157,10442,,False,False,7569,,,0,0,0.15000000000000002,0.0,neutral
2021-03-11 19:12:35,1370090293098385410,JUST IN: France says halting use of AstraZeneca coronavirus vaccine is not needed,601118520,shurugwian,🇺🇸,3372,62,,False,False,10419,,,0,4,0.0,0.0,neutral
2021-03-11 19:12:35,1370090293039673344,"CNBCnow: BREAKING: Biden signs $1.9 trillion Covid relief bill, clearing way for stimulus checks, vaccine aid 
",1290538789119680513,wallstreetard,"Manhattan, NY",75,1981,,False,False,1268,,,452,0,0.0,0.0,neutral
2021-03-11 19:12:35,1370090292716564483,"MichelleObama: When you can get the COVID-19 vaccine, I hope you do—Barack and I are certainly glad we did. It’s our best shot at beati…",826860708360966144,CObywayofME,United States,7057,92641,,False,False,27304,,,8488,0,0.65,0.75,positive
2021-03-11 19:12:35,1370090292330774531,"My thoughts and prayers are you with Hon RailaOdinga .

I wish you a quick recovery General.

To kenyans let brace ourselves for tough times,Covid is real and I appeal to everybody to take a vaccine.

Your body and heath is your priority. ",953206030606979072,Tonny_M_Mugiira,Republic of kenya Nairobi Meru,2897,48830,,True,False,53247,,,1,2,0.5333333333333334,0.048611111111111105,positive
2021-03-11 19:12:35,1370090292305612802,"Future Stole this beat 💕👌👉🏻60 Wrap$$ - Never Hustle Me  via YouTube
AstraZeneca Corona",1364133239124865029,realpepsicoblog,Pepsico blog,1,1,,False,False,549,,,0,0,0.125,0.0,neutral
2021-03-11 19:12:34,1370090290137202697,"Today (due to my increased risk of severe illness from the virus) I was able to get my moderna_tx CovidVaccine &amp; I absolutely wept. I wept with gratitude &amp; the release of anxiety. With a 3 year old &amp; infant at home, I do everything to protect them. COVID19Vaccination VDHgov ",21054417,worthystyle,"Virginia, USA",1687,31869,,True,False,73318,,,0,5,0.525,0.16874999999999998,positive
2021-03-11 19:12:34,1370090289256357893,"pfizer: The Israel data demonstrate that the vaccine may be able to prevent continued transmission of SARS-CoV-2, which is vital to hel…",816413432262119424,Dietis_Lab_UCY,Cyprus,5241,10166,,True,False,5250,,,22,0,0.5125,0.3,positive
2021-03-11 19:12:34,1370090288765624324,If I got Covid and lost my sense of taste and smell I’d be down to one sense and still not qualify for a vaccine.,17734512,JohnnyWalsh,"Madison, Wisconsin",1474,552,,True,False,2471,,,0,1,0.2888888888888889,-0.15555555555555559,negative
2021-03-11 19:12:34,1370090288375607297,"theamgreatness: A COVID-19 vaccine center in Pasadena, California, set to take place on Thursday was shuttered after the majority of it…",1233103807212589058,Michael95494331,,220,20152,,False,False,56646,,,8,0,0.1,-0.1,negative
2021-03-11 19:12:34,1370090287608045568,"HamillHimself: Statement by the Twice Impeached Former Guy

I hope everyone remembers when they're getting the COVID-19 (often referred…",871793571292225537,rhealyrhealy,My own little world,4712,98232,,False,False,27448,,,1046,0,0.0,0.0,neutral
2021-03-11 19:12:33,1370090285376626690,"MHRA response to Danish, Norwegian and Icelandic authorities’ action to temporarily suspend the AstraZeneca COVID-19 Vaccine -  ",505783907,MeshalAlotaibi8,K.S.A.,827,1294,,True,False,1248,,,0,0,0.05,0.05,positive
2021-03-11 19:12:33,1370090285007470596,Chile Clamps Down With New Covid Limits Despite Vaccine Success ,1643123766,akbarth3great,🌎 Everywhere,12892,111,,False,False,42920,,,3,0,0.24781144781144782,0.09360269360269358,positive
2021-03-11 19:12:33,1370090284672032771,"davidkurten: Seven European countries suspend use of Astra Zeneca Covid vaccine after blood clot deaths.
I will not be taking a 'Covid…",1172551284311937024,Silveness1,"England, United Kingdom",58,7327,,True,False,621,,,852,0,0.0,0.0,neutral
2021-03-11 19:12:33,1370090283862462465,"Evie_Magazine: If getting vaccinated means you still can't travel, and that you may still be susceptible to contracting or passing on C…",1230483919,Nachomomma1221,United States,41,9452,,False,False,3967,,,51,0,0.0,0.0,neutral
2021-03-11 19:12:33,1370090282738458630,"POTUS: One in four adults in the U.S. has received their first COVID-19 vaccine — and we’re now leading the world in vaccinations.

Tha…",2613787772,TBag_McG,,921,33233,,False,False,13184,,,16506,0,0.3333333333333333,0.25,positive
2021-03-11 19:12:32,1370090281781981185,spectatorindex: JUST IN: Norway has suspended use of the AstraZeneca coronavirus vaccine,86160089,ThatRedDeviL,dystopia,1414,51850,,False,False,230105,,,2570,0,0.0,0.0,neutral
2021-03-11 19:12:32,1370090281404612615,"jieunlee14 1/2 because pfizer and moderna are both use mRNA, the first does acts as a partial protectant and the second is the booster. however, the j&amp;j vaccine is more like the flu shot and you only need 1 dose based off of how it makes your immune system respond (to put it simply)",887700354,tequilasluut,WI,694,96246,,True,False,9244,,,0,1,0.4150793650793651,0.10833333333333334,positive
2021-03-11 19:12:32,1370090281257828358,"HamillHimself: Statement by the Twice Impeached Former Guy

I hope everyone remembers when they're getting the COVID-19 (often referred…",516138094,BWhackerReviews,Good Ol' New York ,1197,13508,,True,False,61350,,,1046,0,0.0,0.0,neutral
2021-03-11 19:12:31,1370090277269078016,"kayleighmcenany: FINALLY the Biden admin recognizes the Trump admin’s unprecedented vaccine work:

➡️ “We’re grateful for the work that…",884124089052532737,realJosephKlein,,89,42884,,False,False,12637,,,4655,0,0.95,0.3,positive
2021-03-11 19:12:31,1370090276686024712,"HamillHimself: Statement by the Twice Impeached Former Guy

I hope everyone remembers when they're getting the COVID-19 (often referred…",3417917189,Bartfratze1982,"Ruhrpott, NRW ",946,111090,,False,False,71160,,,1046,0,0.0,0.0,neutral
2021-03-11 19:12:31,1370090276618960899,"CNBCnow: BREAKING: Biden signs $1.9 trillion Covid relief bill, clearing way for stimulus checks, vaccine aid 
",1274839731306663938,GridShortAge,,3,651,,False,False,221,,,452,0,0.0,0.0,neutral
2021-03-11 19:12:31,1370090273922023427,"POTUS: One in four adults in the U.S. has received their first COVID-19 vaccine — and we’re now leading the world in vaccinations.

Tha…",1673490823,2trimstine,"Houston, TX",186,29516,,True,False,27967,,,16506,0,0.3333333333333333,0.25,positive
2021-03-11 19:12:30,1370090272034410496,"POTUS: One in four adults in the U.S. has received their first COVID-19 vaccine — and we’re now leading the world in vaccinations.

Tha…",831129801402376194,lizbehonest_5,,43,19044,,False,False,11927,,,16506,0,0.3333333333333333,0.25,positive
2021-03-11 19:12:30,1370090270654533637,"POTUS: One in four adults in the U.S. has received their first COVID-19 vaccine — and we’re now leading the world in vaccinations.

Tha…",184395747,IamDineshKR,Coimbatore,233,58105,,True,False,4752,,,16506,0,0.3333333333333333,0.25,positive
