created,id_str,text,user_id,screen_name,location,followers_count,user_favourites_count,time_zone,geo_enabled,verified,status_count,geo,coords,retweet_count,tweet_favourite_count,Subjectivity,Polarity,Sentiment
2021-03-15 00:07:53,1371251772061327368,brianweeden: Quite a different picture than the stories early on claiming minorities would e the ones refusing to take the COVID vaccin…,331069269,DeenaGarzik,,186,52778,,False,False,23597,,,5,0,0.44999999999999996,0.05,positive
2021-03-15 00:07:53,1371251771629133827,"DrEricDing: 2) First let’s cover some good news, that having 2 doses clearly MUCH MUCH better than 1 dose alone of either the Pfizer or…",18484282,rodneyhatley,"San Diego, CA",570,187002,,False,False,46647,,,139,0,0.4777777777777778,0.48333333333333334,positive
2021-03-15 00:07:53,1371251770647805954,"MattNegrin: “Covid is not real” I heard some serious-looking people say on the country’s most trusted and highly rated news programs, m…",1294646688083320834,paradiseandme,,56,19317,,False,False,4912,,,25,0,0.4466666666666666,0.18666666666666668,positive
2021-03-15 00:07:51,1371251764528222210,mairb10 kenwyatt44 pfizer StLukesHealth Tuesday for me. Nampa,1876258429,RexBackman,Idaho,792,2046,,True,False,2085,,,0,1,0.0,0.0,neutral
2021-03-15 00:07:51,1371251761453891588,"Coronavirusgoo1: The UK has given over 10 million doses of both the Oxford and Pfizer vaccine. 

Number of blood clot related events:…",722260556,tulipgraves,♡ she/they ♡,9636,0,,False,False,78871,,,4580,0,0.4,0.0,neutral
2021-03-15 00:07:50,1371251758245187584,Dan_GT2 I'm wishing you all the best. Toronto warns of potential interruption in COVID19vaccinationbooking as the Ontario provincial system comes online ,14837621,timethief,"Salish Sea, B.C.",3617,95580,,False,False,95670,,,0,2,0.65,0.5,positive
2021-03-15 00:07:50,1371251757578399747,f0lake: No i dont think u understand i need to get my hands on that pfizer syringe...,1093947274437242881,MakiahHarris,She/her,16,17732,,False,False,1067,,,142,0,0.0,0.0,neutral
2021-03-15 00:07:49,1371251755585916929,DrEricDing: 9) now let’s turn on just Moderna and how much fold decrease 2-dose vaccinated persons had against each variant in neutrali…,572024693,jmal1039,"Richmond, IN",3007,203891,,True,False,163509,,,76,0,0.2,0.2,positive
2021-03-15 00:07:49,1371251753463713793,"AlexBerenson: As the kids say, lolcatz. Though Moderna avoids calling what it does gene therapy (in part because regulators historicall…",879548970082721792,rising_serpent,United States,79877,4152,,False,False,77250,,,120,0,0.0,0.0,neutral
2021-03-15 00:07:48,1371251751412715521,"so when are we going to cancel Denmark, Republic of Ireland and all those other countries for ""spreading misinformation about Astra Zeneca vaccine""?

I can't believe people don't want to get a blood clot in order to stay safe from a case of sniffles",1363825059354263554,GoosSilly,,6,144,,False,False,137,,,0,0,0.4375,0.1875,positive
2021-03-15 00:07:48,1371251748212461568,EricBellmanWSJ: India's vaccine-making skills are providing enough shots to feed a local inoculation drive &amp; still export to 70 countri…,335535886,NarasimhaRao10,,2157,24013,,False,False,99202,,,30,0,0.25,0.0,neutral
2021-03-15 00:07:47,1371251745112870921,"BNODesk: BREAKING: Netherlands suspends the use of AstraZeneca's COVID-19 vaccine, citing ""precautionary principle""",740271582,LaniBeno,"North Lincolnshire, England.",6871,376325,,False,False,140909,,,240,0,0.0,0.0,neutral
2021-03-15 00:07:47,1371251744223727617,MtMama1776: If the covid virus has a 1% death rate why would anyone take the covid vaccine that has a 5% death rate.,1227233519199571968,blaylock_annie,Boston Massachusetts,77,2681,,False,False,2629,,,0,0,0.0,0.0,neutral
2021-03-15 00:07:46,1371251743485464581,stuartpstevens Well remember that Pfizer was making its vaccine without federal $$ - and that it was private enterprise and innovation that took Chinese genetic info and made vaccines possible - govt (Trump) role was guaranteeing sales which was the minimum effort needed,155597449,chagonz,NY,12,979,,False,False,1054,,,0,0,0.4583333333333333,0.0,neutral
2021-03-15 00:07:46,1371251743309320192,SeanTPendergast PatrickStormTU Is Moderna 2 shots also?,24575931,nzakos,"Houston, TX",841,63292,,False,False,51194,,,0,0,0.0,0.0,neutral
2021-03-15 00:07:46,1371251741971378179,"DrTomFrieden: The chance that you’ll get a long-term health problem from a vaccine against Covid may well be zero, but even if not, are…",378147040,lula_reh,"Minnesota, USA",4476,188130,,True,False,269812,,,301,0,0.0,0.0,neutral
2021-03-15 00:07:46,1371251740784394240,"AlexBerenson: As the kids say, lolcatz. Though Moderna avoids calling what it does gene therapy (in part because regulators historicall…",964314495463116801,SlappyWhite2020,"Red Earth 29, Saskatchewan",1786,3848,,False,False,9819,,,120,0,0.0,0.0,neutral
2021-03-15 00:07:45,1371251736053215238,BNODesk: AstraZeneca says there's no evidence its COVID-19 vaccine increases the risk of blood clots. Out of 17 million people vaccinat…,3669559162,MaureenPrender4,,81,15381,,True,False,7488,,,356,0,0.0,0.0,neutral
2021-03-15 00:07:44,1371251733817667588,Having the guy who hands out vaccines make the call is an unspoken threat withhold them ,5571722,Wisco,"Wisconsin, US",5591,20874,,False,False,282339,,,0,2,0.0,0.0,neutral
2021-03-15 00:07:43,1371251729858236422,"AgTerzo: This is a constant fear for many who have yet to receive a vaccine, and may still have two or more months to go, especially th…",16100069,darryn_briggs,Virginia (USA),2417,79444,,False,False,133430,,,23,0,0.5833333333333333,0.25,positive
2021-03-15 00:07:43,1371251727463243779,anxiousdeluxe: my two Moderna doses ,1594252286,emmecooley,,239,32217,,True,False,1485,,,7800,0,0.0,0.0,neutral
2021-03-15 00:07:42,1371251724531433472,Dakotadamus: If you haven’t heard yet - it appears that Marvin Hagler’s death may have been caused by the Covid 19 Vaccine. Thomas the…,3373921258,RealKingOfCheap,United States,112,716,,False,False,41425,,,10,0,0.0,0.0,neutral
2021-03-15 00:07:42,1371251723696766979,"RIHEALTH: All K-12 teachers, school staff &amp; child care workers in RI are now eligible for COVID-19 vaccine in the cities &amp; towns where…",718476067,LynnArditi,Rhode Island,2559,3040,,False,False,7970,,,8,0,0.0,0.0,neutral
2021-03-15 00:07:42,1371251723537326082,"RussosBrand: On this episode of The Beautiful Podcast, VelVelHoller &amp; ActualALove share their feelings on the AEW Barbed Wire Match…",2412935556,THEVinceRusso,The Broasters.com,66301,13358,,True,True,70354,,,2,0,1.0,0.85,positive
2021-03-15 00:07:41,1371251721163304962,Dear WHOPhilippines WHO weren't the AstraZeneca vaccines donated for health workers? Just saying it should have been specified that health care workers should be the priority specially now that the PH is back to square one. ,813576026970128384,selbsie_bb,,249,54157,,True,False,35870,,,0,0,0.2857142857142857,0.17857142857142858,positive
2021-03-15 00:07:39,1371251713638858754,YesImKylee If it might make you feel better? I actually *caught* covid and I never actually developed a fever so maybe you won’t get one from the vaccine,1019412113444560896,Artful_AliCat,Any Pronouns!,770,51558,,False,False,38464,,,0,3,0.3,0.15,positive
2021-03-15 00:07:39,1371251711776542721,"Reuters: People waiting at a vaccination clinic in Pittsfield, Massachusetts got a surprise performance from Yo-Yo Ma after the legenda…",731064771328409600,yvovaldes,Panama,1330,63679,,False,False,29940,,,96,0,0.0,0.0,neutral
2021-03-15 00:07:39,1371251711449399297,"ABC: Pfizer's vaccine is successful in preventing not only symptomatic COVID-19, but also asymptomatic disease, according to new real-w…",3573505637,ttounislime,,87,70,,False,False,191,,,117,0,0.8015151515151514,0.29545454545454547,positive
2021-03-15 00:07:39,1371251710509867011,HelenBranswell: 1. When vaccine regulators are looking into whether there is an increased rate of clotting events in people who've gott…,1197472679672070146,MonaSmitte,,342,15504,,False,False,227079,,,32,0,0.0,0.0,neutral
2021-03-15 00:07:38,1371251710107078657,DrEricDing: 8) let’s focus on just Pfizer and exactly how much relative fold decrease 2-dose vaccinated person had against each variant…,572024693,jmal1039,"Richmond, IN",3007,203891,,True,False,163509,,,79,0,0.4166666666666667,0.25,positive
2021-03-15 00:07:38,1371251709402517508,suzannelynch1: Ireland suspends rollout of AstraZeneca vaccine following blood clot reports via IrishTimes ,1067507922979180549,AnnSwif09052981,"Liverpool, England",360,25935,,False,False,6902,,,109,0,0.1,0.0,neutral
2021-03-15 00:07:37,1371251704260395011,"Jessicam6946: Everyone getting their vaccines.  Please, remember it takes 2 weeks to build full immunity after your 2nd dose of Pfizer…",891015532392173573,RWLawsonFL,"Pompano Beach, FL",693,181429,,True,False,165406,,,335,0,0.275,0.175,positive
2021-03-15 00:07:37,1371251703778050051,"akikigate Rural Alabama here, both shots, Moderna. However, we had our shots in Florida before Death Santis closed it down. All my groceries, nursery plants, home improvement money goes to Florida.",3334587148,bluedotskytoday,Alabama,3235,64731,,True,False,76849,,,0,8,0.12962962962962965,-0.0851851851851852,negative
2021-03-15 00:07:35,1371251697494847497,"Reuters: People waiting at a vaccination clinic in Pittsfield, Massachusetts got a surprise performance from Yo-Yo Ma after the legenda…",1081396056590446593,gyulgye,,2,2256,,True,False,10038,,,96,0,0.0,0.0,neutral
2021-03-15 00:07:35,1371251693795561479,"Bobby_Network: Today we peek inside the current situation in Israel: how Netanyahu sold his people to Pfizer/BioNTech &amp; Co, conducting…",3065034238,Plejona,,280,10428,,False,False,22715,,,814,0,0.4,0.0,neutral
2021-03-15 00:07:34,1371251692285624322,"AlexBerenson: As the kids say, lolcatz. Though Moderna avoids calling what it does gene therapy (in part because regulators historicall…",20055614,BombJack67,,871,6894,,False,False,23722,,,120,0,0.0,0.0,neutral
2021-03-15 00:07:34,1371251692109328384,"jbecher: Germans invented 1200 new words during the pandemic. Some of the best:
Maskenmuffel: Grumps who refuse to wear masks
Abstandsb…",72758137,jonathanwold,Sunnyvale/San Jose,898,76290,,True,False,68451,,,1,0,0.37727272727272726,0.5681818181818181,positive
2021-03-15 00:07:34,1371251690851217415,DrEricDing: 9) now let’s turn on just Moderna and how much fold decrease 2-dose vaccinated persons had against each variant in neutrali…,62880951,cynthiakiker,North Carolina,3968,222817,,False,False,155843,,,76,0,0.2,0.2,positive
2021-03-15 00:07:33,1371251688724692992,rishipuff: johnson and johnson made my baby shampoo and now my covid vaccine damn they really did say no more tears,748967142,issaagaa,Euskal Herria.,434,33934,,True,False,45514,,,8299,0,0.35,-0.024999999999999994,negative
2021-03-15 00:07:33,1371251687613161475,rishipuff: johnson and johnson made my baby shampoo and now my covid vaccine damn they really did say no more tears,1059166460407361536,janetmkamara,"she/her, UK, 16",153,80902,,False,False,15123,,,8299,0,0.35,-0.024999999999999994,negative
2021-03-15 00:07:33,1371251685490790401,ABsteward: 🔥AstraZeneca : A careful review of all available safety data of more than 17 million people vaccinated in the European Union…,3149363550,name_chari,~/,864,42952,,False,False,34679,,,108,0,0.475,0.2,positive
2021-03-15 00:07:33,1371251685398618120,"FrancescoLari: Italian news, first page of all newspapers. Teacher die after 10 days of AZ jab, began to feel down the day after. Judge…",754044255438573568,HoltDaved,Harrow  England,333,64,,True,False,46306,,,214,0,0.2074074074074074,0.03148148148148147,positive
2021-03-15 00:07:32,1371251684555378689,MsKawami: AstraZeneca Covid vaccine suspended in some countries over blood clot fears ,28260497,ellicoy,Los Angeles ca,35,812,,False,False,1250,,,3,0,0.0,0.0,neutral
2021-03-15 00:07:32,1371251683183972361,Lauren_Southern: Genuinely want someone to explain to me why Marvin Haglers death shouldn’t make people concerned about the COVID vacci…,768510941386465280,Humanspecies101, Briton,299,2543,,False,False,2988,,,102,0,0.5,0.4,positive
2021-03-15 00:07:32,1371251682831572996,DrEricDing: 7) Now let’s look at many folks with 1 or 2 doses of the NIH-Moderna vaccine... 1 dose still much lower than 2 doses. And …,572024693,jmal1039,"Richmond, IN",3007,203891,,True,False,163509,,,50,0,0.35,0.35,positive
2021-03-15 00:07:31,1371251678306054145,"felly500: Ireland suspension of AZ vaccine 

Adam Finn - ""IF clear evidence of serious or life threatening side-effects emerges that wi…",411287111,alisonkmcc,,820,21966,,True,False,48262,,,6,0,0.5249999999999999,-0.11666666666666664,negative
2021-03-15 00:07:31,1371251676871528448,"48 Hours post CoVid vaccine:

The monitor window is over! I'm pretty fine. No symptoms/issues. No fever, headaches, chills, pain, nausea, weakness (all common side effects of a vaccine) 
I'm happy it wasn't eventful. Hopefully my experience can add to what's already being shared.",253094943,itsajeffi,Jamaica,389,8141,,False,False,63780,,,0,0,0.75,0.2916666666666667,positive
2021-03-15 00:07:30,1371251672589201412,netpoette: sue91282690 benzosarebad RealDeniseWelch Use of the AstraZeneca-Oxford vaccine has now been suspended in 11 countries. Fu…,430579114,1denmadrid,"Madrid, Colombia",3148,75926,,False,False,1222282,,,3,0,0.0,0.0,neutral
2021-03-15 00:07:29,1371251671716745224,And Alzheimer’s 🙏 since they found a vaccine for covid PLEASE FIND THE CURE FOR THESE DISEASES 🙏🙏🙏 You have had BILLIONS OF $$$$ DONATED to you 🙏🙏🙏 ,1252705861,jayne_golden,From florida born in Scotland ,2028,19179,,True,False,27005,,,0,0,0.0,0.0,neutral
2021-03-15 00:07:29,1371251671066681349,zerohedge: NETHERLANDS SUSPENDS USE OF ASTRAZENECA COVID-19 VACCINE UNTIL AT LEAST MARCH 29 -GOVERNMENT,898986966024433664,CrypJohn,Nederland,1834,17874,,False,False,16219,,,348,0,0.4,-0.3,negative
2021-03-15 00:07:29,1371251670714290184,eunique: Trying to get scheduled for a Covid vaccine feels like trying to win some Js on SNKRS app.,33734176,_siriusblcc,,330,79877,,True,False,46867,,,42,0,0.4,0.8,positive
2021-03-15 00:07:28,1371251667027513350,"MattHancock EU at their dirty work again!
Determined to do down anything British like Astra Zeneca! ",1884149964,TUVFermanagh,Fermanagh,642,5824,,True,False,9753,,,0,0,0.362962962962963,-0.30185185185185187,negative
2021-03-15 00:07:28,1371251664393531394,Lauren_Southern: Genuinely want someone to explain to me why Marvin Haglers death shouldn’t make people concerned about the COVID vacci…,78481599,SuperBowlWs3547,United States of America,2382,32313,,True,False,96940,,,102,0,0.5,0.4,positive
2021-03-15 00:07:27,1371251664003297285,"toles_jenna CalPoly Hi Jenna,
The truth is that IF there is a Covid-19 virus, it's never been isolated and the CDC says they have no samples of it. How can they make a test for it, or a vaccine for it, if it's never been isolated? How does the test know what it's looking for?",1310272653224157184,JulieSm36982015,,43,2704,,False,False,8366,,,0,0,0.0,0.0,neutral
2021-03-15 00:07:27,1371251662510252036,"This is why I am still being super careful. ‘I almost made it’: Close to a vaccine, these Americans got covid-19 instead ",7002452,laffingbuddha,Somewhere over the rainbow,480,37099,,True,False,26777,,,0,1,0.8333333333333333,0.11666666666666665,positive
2021-03-15 00:07:27,1371251661017018370,"AlexBerenson: As the kids say, lolcatz. Though Moderna avoids calling what it does gene therapy (in part because regulators historicall…",48961308,locotecato,,1452,97134,,True,False,75719,,,120,0,0.0,0.0,neutral
2021-03-15 00:07:27,1371251660178132993,I have a PhD &amp; I have worked on devices and drugs. I have worked enough to understand that these side -effects cannot be linked to the AstraZeneca vaccine because the % of them occurring in the general population is the same but not everyone has enough knowledge.,1357397061444927488,Shraddha13061,,19,466,,False,False,380,,,0,0,0.40625,0.012500000000000004,positive
2021-03-15 00:07:26,1371251659465240576,"AlexBerenson: As the kids say, lolcatz. Though Moderna avoids calling what it does gene therapy (in part because regulators historicall…",22382549,JD_Gaffle, STL,1250,4636,,False,False,151883,,,120,0,0.0,0.0,neutral
2021-03-15 00:07:26,1371251659297333249,"bluestein: On Monday, the big day arrives for many Georgians wanting COVID vaccine gapol ",1255577288223019008,DemocratsUp,USA,3601,253895,,True,False,254858,,,24,0,0.3,0.25,positive
2021-03-15 00:07:25,1371251655136616452,DrEricDing: 6) Now let’s look at many folks with 1 and 2 doses of the Pfizer-BioNtech vaccine... 1 dose much lower than 2 doses. B1351…,572024693,jmal1039,"Richmond, IN",3007,203891,,True,False,163509,,,53,0,0.35,0.35,positive
2021-03-15 00:07:25,1371251655128322050,akikigate First Pfizer - 2nd is this coming Thursday,289093746,SallyBunnell1,,1576,123424,,False,False,38085,,,0,3,0.16666666666666666,0.125,positive
2021-03-15 00:07:25,1371251652825649154,"Maximil86429959: Did or did not the Irish government, the MSM, &amp; the Health Service say that the covid vaccines are safe?

Why then is…",877943916456288257,Therese29979716,,142,17013,,False,False,3987,,,7,0,0.25,0.25,positive
2021-03-15 00:07:23,1371251646903160832,JoeABCNews: The target was 4m Australians by April ,760714137722904580,Ocomeon,,46,11735,,False,False,7307,,,90,0,0.0,0.0,neutral
2021-03-15 00:07:23,1371251646672429056,I have received some very snarky replies to my comment about my concerns with the COVID vaccine. It appears I am only welcomed in the fishing community.,1370145834394812417,Pete55508170,"California, USA",4,31,,False,False,45,,,0,0,0.65,0.1,positive
2021-03-15 00:07:23,1371251646492205063,business: The weekly U.S. Covid-19 death toll fell to a four-month low and AstraZeneca says data shows no evidence of an increased risk…,378521012,mariaporfy,"Kifisia, Greece",258,55007,,False,False,52443,,,23,0,0.3,0.0,neutral
2021-03-15 00:07:23,1371251644718051334,CTVNews: AstraZeneca finds no evidence showing increased risk of blood clots with COVID-19 vaccine  ,1715422615,Samad45H,,59,2151,,False,False,19305,,,34,0,0.0,0.0,neutral
2021-03-15 00:07:23,1371251643648335872,sebbaaaass: today my mom was denied the covid-19 vaccine because she is undocumented. riteaid asked for her social security and the wo…,1565223164,foos4less,Anaheim ,286,28571,,True,False,28510,,,704,0,0.06666666666666667,0.03333333333333333,positive
2021-03-15 00:07:21,1371251638162362369,brinleyhineman: Please call local pharmacies in your area to see if they have a waitlist. ErikBacharach and I were on the list for les…,1241715684595445768,Bladescraft1,"Nashville, TN",81,9759,,False,False,7896,,,7,0,0.0,0.0,neutral
2021-03-15 00:07:21,1371251637877084161,DrEricDing: 8) let’s focus on just Pfizer and exactly how much relative fold decrease 2-dose vaccinated person had against each variant…,62880951,cynthiakiker,North Carolina,3968,222817,,False,False,155843,,,79,0,0.4166666666666667,0.25,positive
2021-03-15 00:07:21,1371251637436702720,"TheRickyDavila: My mother and I were finally able schedule our first dose of the Covid vaccine for next week. Wear a mask, get the vacc…",206693531,robdromb, a Philly suburb,2411,45538,,True,False,114161,,,297,0,0.3194444444444444,0.25,positive
2021-03-15 00:07:21,1371251637373767685,akikigate Both shots if Pfizer.,108088002,zaxdad123,"Asheville, NC",1967,114261,,False,False,6765,,,0,0,0.0,0.0,neutral
2021-03-15 00:07:21,1371251634911784962,KylieBitkin One of the symptoms of covid  is extreme  fatigue. Since you got the vaccine  you probably are having  some of symptom without actually having it. My Dad showed that symptom.  You'll will recover just takes time. Take your time Kylie.,27786034,IO_Error,"33.00394,-97.012104",57,1701,,False,False,953,,,0,4,0.55,-0.0625,negative
2021-03-15 00:07:20,1371251633682800646,Lauren_Southern: Genuinely want someone to explain to me why Marvin Haglers death shouldn’t make people concerned about the COVID vacci…,804585851984478208,_drfister,Here,95,7934,,False,False,12480,,,102,0,0.5,0.4,positive
2021-03-15 00:07:19,1371251628867792896,DrEricDing: VACCINE ESCAPE OF VARIANTS vs Pfizer-BioNTech &amp; NIH-Moderna: Troubling new peer-reviewed paper shows even 2-dose recipients…,4222650917,sreusze17,,136,86256,,True,False,5047,,,1283,0,0.45454545454545453,0.13636363636363635,positive
2021-03-15 00:07:19,1371251628108513284,"NikolovScience: If you hear experts claiming that the COVID mRNA vaccines are not a ""gene therapy"", refer them to this 2017 TEDx talk b…",849856035598643201,axterixo,"Nelson City, New Zealand",330,10285,,True,False,2868,,,138,0,0.0,0.0,neutral
2021-03-15 00:07:17,1371251621305446400,PeterHotez: It’s why we might eventually move to a 3 dose Pfizer Moderna mRNA vaccine and a 2 dose JnJ vaccine: 1) higher virus neutral…,3230858194,petechallis25,London,137,3080,,False,False,6578,,,493,0,0.5,0.25,positive
2021-03-15 00:07:17,1371251619543797764,"aubrey_huff: Take the Covid_19 vaccine it’s “safe” they said: 1,524 deaths, &amp; and 5,507 serious injuries. ",914315513815339008,BettyLe60527300,,174,218033,,False,False,96232,,,312,0,0.5833333333333333,0.08333333333333334,positive
2021-03-15 00:07:15,1371251613394989056,"doctor_oxford He doesn’t mention AstraZeneca either? He says we. We’re all in it together, let’s make the  best out of things where we can instead of picking fights where there are more important ones to be made.",255953229,DJGD,London,128,713,,True,False,5975,,,0,0,0.6,0.6333333333333333,positive
2021-03-15 00:07:15,1371251611033554947,heathercampbell: i wish the covid conspiracy theory was: covid was intentionally released on the public to thin out the herd and preven…,45980135,kiki_py,,34,2983,,False,False,707,,,11,0,0.45833333333333337,-0.2,negative
2021-03-15 00:07:15,1371251610584776709,Here Are The Facts: Trump Deserves No Credit For The COVID Vaccine  via politicususa,62818014,hilltophereford,Texas,1746,42872,,False,False,201319,,,0,0,0.0,0.0,neutral
2021-03-15 00:07:15,1371251609997434881,MonicaGandhi9: In my haste to tell you the 94% drop in asymptomatic infection among vaccinated individuals in the Pfizer updated press…,348733641,megdonohue,San Francisco,1612,6590,,True,False,5808,,,22,0,0.0,0.0,neutral
2021-03-15 00:07:14,1371251606843445249,UCFALUMNI: Each of the vaccines currently approved for distribution in the United States prevents severe disease and death from COVID-1…,353103299,FeliciasArt,"Florida, USA",2568,224085,,False,False,86683,,,2,0,0.4,0.0,neutral
2021-03-15 00:07:14,1371251606671532033,Jessicam6946: Don't forget we have 3 excellent covid vaccines!!  They will ALL save your life and keep you from meeting me or 1 of my c…,308480144,BooksYALove,"Texas, USA",3560,244210,,False,False,67346,,,109,0,1.0,1.0,positive
2021-03-15 00:07:13,1371251601952927744,"abirballan: According to Mike Yeadon and GirardotMarc, COVID Immunity is broad: variants can neither escape natural immunity nor the v…",1221547197474451456,riouserandcurio,Down the rabbit hole,57,10989,,False,False,1465,,,32,0,0.35625,0.08125,positive
2021-03-15 00:07:12,1371251600463859715,"NanaWearsAMask: Now this: 
“Covid vaccinations tracking poll found the number of Republicans refusing to get the vaccine was twice the…",3158470735,ColleenHenley,"Shell Beach, CA, USA",26199,117717,,False,False,87679,,,48,0,0.0,0.0,neutral
2021-03-15 00:07:12,1371251597653676033,"DrTomFrieden: The chance that you’ll get a long-term health problem from a vaccine against Covid may well be zero, but even if not, are…",161502563,Paleonut_,"Winchester, California",1843,120432,,True,False,95414,,,301,0,0.0,0.0,neutral
2021-03-15 00:07:11,1371251593228730368,Reuters: Ireland recommends temporary deferral of Astrazeneca COVID-19 vaccine  ,854390451255881730,AchBerl,Deutschland,114,20917,,False,False,3131,,,145,0,0.0,0.0,neutral
2021-03-15 00:07:09,1371251586878558210,roinnslainte: STATEMENT: The National Immunisation Advisory Committee (NIAC) has recommended that the administration of COVID19 Vaccin…,2243709212,Finimanso2013,,387,19107,,False,False,7612,,,432,0,0.0,0.0,neutral
2021-03-15 00:07:09,1371251586727616519,"doctorshaib: Difficult to understand decisions being made by some countries about the astrazenecavaccine.

Vaccine will save lives and…",952247125185720320,viralvideovlogs,കേരളം,5994,2304,,False,False,605980,,,15,0,1.0,-0.5,negative
2021-03-15 00:07:08,1371251583472824321,wrightyofsherw1 MacroCRG No it’s not maybe. The Moderna vaccine prevented 100% of hospitalizations and serious illness. Similar for Pfizer. Most people haven’t seen their parents and grandparents in a ywar,1284542387835019265,ChrisRi85691712,,0,54,,False,False,145,,,0,0,0.5222222222222223,0.05555555555555556,positive
2021-03-15 00:07:08,1371251581816086535,"doctorshaib: Difficult to understand decisions being made by some countries about the astrazenecavaccine.

Vaccine will save lives and…",919846273,yasminocon,"Dublin, Ireland",4498,48507,,True,False,38490,,,15,0,1.0,-0.5,negative
2021-03-15 00:07:08,1371251580998201346,"ChrisThirkill: Physiotherapist, 28 dies after COVID19Vaccine 

""'My 28 year old daughter took the vaccine on a Tuesday and she was dea…",1138370495160684545,SheronC01571447,south west,1043,144794,,False,False,54477,,,63,0,0.2,0.1,positive
2021-03-15 00:07:06,1371251575470063620,"aubrey_huff: Take the Covid_19 vaccine it’s “safe” they said: 1,524 deaths, &amp; and 5,507 serious injuries. ",1058468164177059840,Patriotgirl18,Toronto,542,8757,,False,False,11620,,,312,0,0.5833333333333333,0.08333333333333334,positive
