created,id_str,text,user_id,screen_name,location,followers_count,user_favourites_count,time_zone,geo_enabled,verified,status_count,geo,coords,retweet_count,tweet_favourite_count,Subjectivity,Polarity,Sentiment
2021-03-15 00:05:38,1371251203980488706,"aubrey_huff: Take the Covid_19 vaccine it’s “safe” they said: 1,524 deaths, &amp; and 5,507 serious injuries. ",204979724,stout5308,,69,20292,,False,False,2298,,,312,0,0.5833333333333333,0.08333333333333334,positive
2021-03-15 00:05:37,1371251200675483653,rishipuff: johnson and johnson made my baby shampoo and now my covid vaccine damn they really did say no more tears,318113786,chilakaylees,parts unknown,192,1540,,True,False,14887,,,8299,0,0.35,-0.024999999999999994,negative
2021-03-15 00:05:36,1371251197714210816,SenatorHassan: The COVID-19 relief package Congress just passed prioritizes vaccine distribution. That's because we know our nation can…,27819475,jenningsghv2,Manila,1342,207215,,False,False,229227,,,48,0,0.0,0.0,neutral
2021-03-15 00:05:36,1371251196762152962,21stCenturyWire: Fauci totally whiffed on a question about AstraZeneca vaccine on MeetThePress today. chucktodd may have miraculous…,16936686,21WIRE,USA,63509,37332,,False,True,93812,,,12,0,0.75,0.0,neutral
2021-03-15 00:05:34,1371251188453228551,clairegcoleman: I'm going to come right out and say it. Scott Morrison is not eligible for the COVID vaccine under stage 1a of the roll…,1903455816,BrittleSun,the earth,581,32420,,False,False,13462,,,63,0,0.5357142857142857,0.2857142857142857,positive
2021-03-15 00:05:34,1371251187995930627,Saddened by the growing list of EU countries suspending use of AstraZeneca vaccine over misleading information UN gavi WHO and specially AstraZeneca should up their efforts to clarify this misinformation and engage advocacy groups in this.,1357397061444927488,Shraddha13061,,19,466,,False,False,380,,,0,0,0.5714285714285714,0.35714285714285715,positive
2021-03-15 00:05:34,1371251186997821441,LonsdaleKeith: Ireland latest country to suspend AstraZeneca COVID-19 vaccine  FoxNews,2394313432,citizencaz,,1650,117826,,True,False,282184,,,1,0,0.9,0.5,positive
2021-03-15 00:05:34,1371251186976841729,"DrTomFrieden: The chance that you’ll get a long-term health problem from a vaccine against Covid may well be zero, but even if not, are…",92984487,jccordero28,"Toronto, ON Canada",1016,41098,,True,False,142976,,,301,0,0.0,0.0,neutral
2021-03-15 00:05:33,1371251185806675970,eunique: Trying to get scheduled for a Covid vaccine feels like trying to win some Js on SNKRS app.,873025664,KhaliaBraswell,"Philly via Charlotte, NC ",6760,18598,,True,False,61375,,,42,0,0.4,0.8,positive
2021-03-15 00:05:32,1371251180819603458,"Ruben_DeHerdt: The JNJNews Vaccine is not an authorized vaccine, it has only received ""Conditional Marketing Authorization"" with the f…",1336094946055630856,Zils98322619,,29,622,,False,False,748,,,4,0,1.0,0.0,neutral
2021-03-15 00:05:32,1371251180244979712,MonicaGandhi9: In my haste to tell you the 94% drop in asymptomatic infection among vaccinated individuals in the Pfizer updated press…,253809371,kjhoops23,,139,22484,,False,False,75202,,,22,0,0.0,0.0,neutral
2021-03-15 00:05:32,1371251178282045441,"Grouse_Beater: Not the *Oxford* Vaccine!

Ireland is temporarily suspending use of the AstraZeneca coronavirus vaccine as a precautiona…",1032027278094610433,kimnicoll3,,642,14345,,False,False,36746,,,18,0,0.0,0.0,neutral
2021-03-15 00:05:31,1371251175136260096,"Tom_Fowdy: The Wall Street Journal has published more articles attempting to discredit every single detail of China's vaccines, than it…",1351751524641169408,justcurious1313,,327,32920,,False,False,26720,,,42,0,0.35714285714285715,0.2142857142857143,positive
2021-03-15 00:05:31,1371251174855303171,"KonstantinKisin: ""Lockdown harder and faster""
""Close the borders""
""10 years in prison for COVID offenders""
""Beat anti-lockdown proteste…",757291325645524993,sdunne45,,1042,231042,,False,False,76381,,,150,0,0.0,-0.1,negative
2021-03-15 00:05:31,1371251174469373953,mariamainmo: Girls don't want boys. They want the covid vaccine and a nice apartment,1125323959061245953,im_matchoco,"Guadalajara, Jalisco",47,17124,,True,False,1171,,,25369,0,1.0,0.6,positive
2021-03-15 00:05:31,1371251173378949132,roinnslainte: STATEMENT: The National Immunisation Advisory Committee (NIAC) has recommended that the administration of COVID19 Vaccin…,351636607,da_da39,"Salfords, South East",54,4562,,False,False,11696,,,432,0,0.0,0.0,neutral
2021-03-15 00:05:30,1371251173014011908,DrEricDing: VACCINE ESCAPE OF VARIANTS vs Pfizer-BioNTech &amp; NIH-Moderna: Troubling new peer-reviewed paper shows even 2-dose recipients…,902682664058138624,OChristianChH,,55,31194,,False,False,18371,,,1283,0,0.45454545454545453,0.13636363636363635,positive
2021-03-15 00:05:30,1371251170505818114,"AlexBerenson: As the kids say, lolcatz. Though Moderna avoids calling what it does gene therapy (in part because regulators historicall…",205024574,bobchavis,"Kentucky, USA",214,7902,,False,False,7895,,,120,0,0.0,0.0,neutral
2021-03-15 00:05:28,1371251163195183113,"jshoreboston: donwinslow SenDuckworth 🤨FoxNews TuckerCarlson had something to say about American Hero SenDuckworth?

No problem,…",3691110204,grandmaofanange,pA,1435,39648,,True,False,154896,,,1,0,0.0,0.0,neutral
2021-03-15 00:05:27,1371251158203908103,DrEricDing: 9) now let’s turn on just Moderna and how much fold decrease 2-dose vaccinated persons had against each variant in neutrali…,966495168,gkrad9,"Richmond Hill, Ontario",1106,206894,,True,False,141618,,,76,0,0.2,0.2,positive
2021-03-15 00:05:26,1371251152642310149,DrEricDing: VACCINE ESCAPE OF VARIANTS vs Pfizer-BioNTech &amp; NIH-Moderna: Troubling new peer-reviewed paper shows even 2-dose recipients…,62880951,cynthiakiker,North Carolina,3968,222817,,False,False,155843,,,1283,0,0.45454545454545453,0.13636363636363635,positive
2021-03-15 00:05:25,1371251148993167361,"niki_jay_1: Toronto lockdown czar’s husband has ‘financial ties’ to Pfizer, AstraZeneca | News | LifeSite ",254095506,dovgvlad,,1585,51364,,True,False,42288,,,104,0,0.0,0.0,neutral
2021-03-15 00:05:24,1371251148087234564,7News: Ireland suspends Astrazeneca vaccine amid blood clot reports ,156006445,OVVenBoss,"Boston, MA",1039,5647,,True,True,17793,,,7,0,0.0,0.0,neutral
2021-03-15 00:05:24,1371251145302110209,"""real-world data from Israel, where 90 percent of the entire population have been vaccinated, show that the vaccine is equally effective against asymptomatic cases.""

90% vaccinated. Now there's a government that has its shite together

",1096900359732129792,narayansmate,,140,5538,,False,False,7303,,,0,0,0.7125,0.3,positive
2021-03-15 00:05:24,1371251144320815105,"NateSilver538: Time to send these abroad now. By the time AstraZeneca gets an EUA, which if you read between the lines of this article…",1106777071,bfry1981,"Silver Spring, MD",2663,72454,,True,False,161398,,,132,0,0.0,0.0,neutral
2021-03-15 00:05:23,1371251143922360323,"Marissa_Joy: I just got my second COVID vaccine, should I treat myself to some Dairy Queen and a new squishmallow?",611248867,afititties,"Ohio, USA",3536,21417,,True,False,56556,,,1,0,0.22727272727272727,0.06818181818181818,positive
2021-03-15 00:05:23,1371251143729422338,Lauren_Southern: Genuinely want someone to explain to me why Marvin Haglers death shouldn’t make people concerned about the COVID vacci…,988346782924050432,FraserNeill1,,166,35677,,False,False,15884,,,102,0,0.5,0.4,positive
2021-03-15 00:05:23,1371251142626263040,TommyRainmaker: girl who only dates guys with the pfizer brand vax,1097551854622392321,Llama5x,🇺🇸,6075,27612,,False,False,56148,,,5,0,1.0,0.0,neutral
2021-03-15 00:05:23,1371251140608856064,"Coronavirusgoo1: The UK has given over 10 million doses of both the Oxford and Pfizer vaccine. 

Number of blood clot related events:…",386047383,JonathanSlayton,England,815,59573,,False,False,41421,,,4580,0,0.4,0.0,neutral
2021-03-15 00:05:22,1371251139652554754,DrEricDing: 8) let’s focus on just Pfizer and exactly how much relative fold decrease 2-dose vaccinated person had against each variant…,966495168,gkrad9,"Richmond Hill, Ontario",1106,206894,,True,False,141618,,,79,0,0.4166666666666667,0.25,positive
2021-03-15 00:05:22,1371251139522535432,"21WIRE: Former champion added that Hagler was in ICU due to the ‘after-effects of the vaccine'... 
",706863698976051200,heine_cuthen,,211,8727,,False,False,18878,,,245,0,0.1875,-0.0625,negative
2021-03-15 00:05:22,1371251138297622532,PeterHotez: It’s why we might eventually move to a 3 dose Pfizer Moderna mRNA vaccine and a 2 dose JnJ vaccine: 1) higher virus neutral…,1226143172209700869,bear_risa,"Oregon, USA",1405,17680,,False,False,55812,,,493,0,0.5,0.25,positive
2021-03-15 00:05:22,1371251138209533953,"VirusesImmunity: When compared to matched unvaccinated participants (n=22), those who had receive a vaccine (n=44) had no worsening of…",233589297,beechhangergals,royal botanic gardens KEW,2190,3815,,True,False,100059,,,13,0,0.0,0.0,neutral
2021-03-15 00:05:22,1371251137630896128,"ChrisEl23170486: Covid vaccine 
Please rt for bigger poll",197087527,scottdfowler,Trowbridge  UK,278,21637,,True,False,6521,,,1184,0,0.5,0.0,neutral
2021-03-15 00:05:22,1371251136682860545,"zeynep: Folks, *look* at this chart. That red line that's fallen of a cliff starting around January 10 is 65+ folks hospitalized for CO…",395142185,Splitcoil,San Diego,2383,36586,,False,False,25295,,,526,0,0.05,0.0,neutral
2021-03-15 00:05:21,1371251134183133190,Independent: Ireland suspends AstraZeneca vaccine amid blood clot reports ,599491231,IslaValle,World 😷,2379,115493,,True,False,220500,,,32,0,0.125,0.0,neutral
2021-03-15 00:05:21,1371251133675532289,f0lake: No i dont think u understand i need to get my hands on that pfizer syringe...,1156874031909367808,jiinxx5,,25,48132,,False,False,3904,,,142,0,0.0,0.0,neutral
2021-03-15 00:05:21,1371251132912177155,boston25: Yo-Yo Ma brightened the days of some MA residents Saturday when he gave an impromptu performance after receiving his second d…,565156017,yubikonrunrun,japan kyoto,139,9784,,False,False,57253,,,4761,0,0.0,0.0,neutral
2021-03-15 00:05:21,1371251132589342722,"TheRickyDavila: My mother and I were finally able schedule our first dose of the Covid vaccine for next week. Wear a mask, get the vacc…",27359960,ComputeBlu,Some where in Ohio,4438,254376,,True,False,207930,,,298,0,0.3194444444444444,0.25,positive
2021-03-15 00:05:20,1371251130622111747,sebbaaaass: today my mom was denied the covid-19 vaccine because she is undocumented. riteaid asked for her social security and the wo…,1434799183,soraya_idalis,,834,82593,,True,False,47860,,,704,0,0.06666666666666667,0.03333333333333333,positive
2021-03-15 00:05:20,1371251130605449222,markruffaloTD: if you have the first shot of astrazeneca just shift someone who has it too and you’re fully vaccinated :),1295180709548761088,TaniaM07137916,,633,92913,,False,False,57929,,,5,0,0.6666666666666666,0.375,positive
2021-03-15 00:05:20,1371251128088752129,"JoeABCNews: NSW vaccine rollout update
35,000 have received Pfizer
2,500 have received Astra-Zeneca
Media conf up on abcnews channel n…",25804649,jakejnelson,Australia,243,2386,,True,False,24978,,,2,0,0.0,0.0,neutral
2021-03-15 00:05:20,1371251127946072066,"jbirch_12: This is the second republican that is taking credit for President Biden's Covid relief bill. 

Don’t let her fool you, FL-27…",828175197702287361,DannySabato2,Guam,1149,22475,,False,False,23691,,,34,0,0.0,0.0,neutral
2021-03-15 00:05:19,1371251127174508544,"Common Sense Anyone⁉️ Hint: the vaccine does not preclude a mask or social distancing 🆘😳 OMG ‼️As Canadians anxiously await their jabs, COVID-19 vaccine envy is running rampant ",839530002932723712,Tamara_LopezDMM,"Toronto, Ontario",32,2008,,False,False,393,,,0,0,0.5222222222222223,-0.1722222222222222,negative
2021-03-15 00:05:19,1371251126826323969,"Coronavirusgoo1: The UK has given over 10 million doses of both the Oxford and Pfizer vaccine. 

Number of blood clot related events:…",468305543,kareemelfass,"Alexandria, Egypt",507,3141,,False,False,1378,,,4580,0,0.4,0.0,neutral
2021-03-15 00:05:19,1371251126469808131,Reuters: AstraZeneca finds no evidence of increased blood clot risk from vaccine  ,378521012,mariaporfy,"Kifisia, Greece",258,55007,,False,False,52443,,,124,0,0.0,0.0,neutral
2021-03-15 00:05:19,1371251125257666560,MMXXI14: I think I am correct in saying Boris Johnson wants to extend the covid emergency powers in order for the untested gene alterin…,457635895,mmjblair,somewhere near you. ,15077,431096,,True,False,677536,,,4,0,0.1,0.2,positive
2021-03-15 00:05:18,1371251120400695298,toadmeister: Ireland and the Netherlands have joined the list of countries that have suspended the use of AstraZeneca's Covid vaccine b…,988918483860836352,KStalou,Greater Manchester,367,27462,,False,False,12840,,,77,0,0.0,0.0,neutral
2021-03-15 00:05:17,1371251118039240713,guardiannews: Coronavirus live news: AstraZeneca finds 'no evidence' of blood clot risk as Netherlands suspends vaccine ,14472234,charliemansell,London,3132,8038,,False,False,128799,,,24,0,0.5,0.13636363636363635,positive
2021-03-15 00:05:17,1371251114667032584,Jessicam6946: Don't forget we have 3 excellent covid vaccines!!  They will ALL save your life and keep you from meeting me or 1 of my c…,47011582,midsummer_dream,,8165,115225,,False,False,115538,,,109,0,1.0,1.0,positive
2021-03-15 00:05:16,1371251111412256769,And that means proportionally worse stats for Pfizer ,142743754,terry_nyorks,"North Yorkshire, UK",109,3868,,True,False,1650,,,0,0,0.6,-0.4,negative
2021-03-15 00:05:15,1371251110246182913,"TheNortyEmp Probably not. But potentially, yes. No vaccine is 100%, however, if you happen to get covid from an unvaccinated person your vaccine will help you recover faster.",18623747,lapearce,Inside my House AZ,1198,14594,,True,False,21453,,,0,1,1.0,0.0,neutral
2021-03-15 00:05:15,1371251109285789696,"axios: NEW: AstraZeneca has announced that a review of over 17 million people who've received its COVID-19 vaccine in Europe shows ""no…",779261015414415360,No1Marx,,125,2754,,True,False,697,,,124,0,0.45454545454545453,0.13636363636363635,positive
2021-03-15 00:05:15,1371251109239517186,"Coronavirusgoo1: The UK has given over 10 million doses of both the Oxford and Pfizer vaccine. 

Number of blood clot related events:…",209486497,thecatbarked,Philippines,202,2431,,False,False,4856,,,4580,0,0.4,0.0,neutral
2021-03-15 00:05:15,1371251106563686403,"Vaxart: DYK on March 11, 2020 the World Health Organization declared the Covid-19 outbreak a pandemic? To learn more about how Vaxart’…",264333941,MaryannKay,Big Bang,1007,50780,,True,False,121225,,,23,0,0.5,0.5,positive
2021-03-15 00:05:14,1371251106068758530,Jessicam6946: Don't forget we have 3 excellent covid vaccines!!  They will ALL save your life and keep you from meeting me or 1 of my c…,2355146755,JaneSepmeier,United States,1586,471848,,False,False,488451,,,109,0,1.0,1.0,positive
2021-03-15 00:05:14,1371251105196240901,"DrTomFrieden: Vaccines are extremely effective at preventing severe Covid illness and death, but no vaccine is perfect. Continue maskin…",1048234116,electrotech11,"Seattle, WA",3334,208689,,False,False,202080,,,688,0,0.9,0.8,positive
2021-03-15 00:05:13,1371251098212655104,"cmyeaton ScottGottliebMD Assuming everyone over the age of 16 has had an opportunity to be vaccinated, and variants do not evade vaccine-induced protection against severe illness, schools should be open full-time, in-person without masks. Health is not merely the absence of COVID, especially for kids.",166614581,epibuff,University of Colorado Boulder,229,1429,,True,False,775,,,0,3,0.5,0.059375,positive
2021-03-15 00:05:13,1371251097940148225,akikigate Done.  2 shots Pfizer 🙂😷💉,22665203,mpd888,Gainesville Florida,11149,59320,,True,False,38638,,,0,1,0.0,0.0,neutral
2021-03-15 00:05:12,1371251097663385610,DrEricDing: 7) Now let’s look at many folks with 1 or 2 doses of the NIH-Moderna vaccine... 1 dose still much lower than 2 doses. And …,966495168,gkrad9,"Richmond Hill, Ontario",1106,206894,,True,False,141618,,,50,0,0.35,0.35,positive
2021-03-15 00:05:12,1371251094265987072,"DrJenGunter After careful consideration, I opted for my second shot Moderna dose 4 weeks 6 days after Dose 1, even though 4 weeks was available.

I am age 67, and +6 days gives more time for my older immune system to react to Dose 1. Closer to younger person 4 weeks.",1553031854,AlanfromBigEasy,New Orleans,555,164661,,False,False,27843,,,0,0,0.37222222222222223,0.16111111111111112,positive
2021-03-15 00:05:11,1371251091766132737,SickleCellUK: We're part of a charity partnership to encourage those with long term health conditions and their carers to get the Covid…,335208537,tiannalisha,"Bedfordshire, England",1056,63785,,True,False,100858,,,2,0,0.4,-0.05,negative
2021-03-15 00:05:11,1371251091086659586,fmtoday: The data review covers more than 17 million people inoculated in the UK and EU. FMTNews Vaccines  ,551809099,MesarutMay,"chester ,UK
",48,5135,,False,False,1229,,,3,0,0.5,0.5,positive
2021-03-15 00:05:10,1371251086510686211,jdickerson Yes! It hurt going in and the arm pain was awful for 3 days. It hurt much worse than the 1st Covid vaccine which is all I've gotten. Grateful for both!,715895117043908608,toomanytrees,,74,80144,,False,False,1660,,,0,0,0.8,-0.75,negative
2021-03-15 00:05:09,1371251082756767750,photopro28: Charbrevolution manlikeslatt How many people have to die within days or a couple of weeks of getting this experimental dr…,1208113347486457862,europeanhammer,Planet GATES-1984,439,44253,,False,False,1796,,,9,0,0.45,0.3,positive
2021-03-15 00:05:09,1371251081997647874,"bluestein: On Monday, the big day arrives for many Georgians wanting COVID vaccine gapol ",3932603189,tati_vict,,3618,427919,,False,False,376973,,,24,0,0.3,0.25,positive
2021-03-15 00:05:09,1371251081829785603,"DrTomFrieden: The chance that you’ll get a long-term health problem from a vaccine against Covid may well be zero, but even if not, are…",109760016,DrSportsBra,"Portland, Oregon",243,81790,,True,False,25109,,,301,0,0.0,0.0,neutral
2021-03-15 00:05:08,1371251078700924932,"GeoffNorcott: The Astra Zeneca gets unfair treatment on the continent.
It’s like a vaccine version of Eurovision.",3935792619,Mariebe10098426,Cumbria. ,4435,162230,,False,False,262569,,,271,0,1.0,-0.5,negative
2021-03-15 00:05:08,1371251077903966209,"21WIRE: Former champion added that Hagler was in ICU due to the ‘after-effects of the vaccine'... 
",43212672,Labas81,,829,52053,,False,False,35129,,,245,0,0.1875,-0.0625,negative
2021-03-15 00:05:07,1371251076171771904,"The Scott County Health Department on Sunday reported another allocation of 1,170 doses of Pfizer vaccine for administration this week. ",10613072,qctimes,"Davenport, IA",47571,515,,True,True,121118,,,0,1,0.0,0.0,neutral
2021-03-15 00:05:07,1371251073357291524,"Reuters: People waiting at a vaccination clinic in Pittsfield, Massachusetts got a surprise performance from Yo-Yo Ma after the legenda…",1208750744,azhimufred,Atlanta,6,736,,False,False,458,,,96,0,0.0,0.0,neutral
2021-03-15 00:05:07,1371251072921141249,"The Scott County Health Department on Sunday reported another allocation of 1,170 doses of Pfizer vaccine for administration this week. ",30262332,qctnews,"Davenport, Iowa",923,61,,False,False,31769,,,0,0,0.0,0.0,neutral
2021-03-15 00:05:05,1371251066294005768,"PicoRiveraCity: From lapublichealth

COVID-19 Vaccination Information for those with high-risk medical conditions or disabilities. App…",1868602993,mayorgcamacho,"Pico Rivera, CA",74,216,,False,False,386,,,1,0,0.0,0.0,neutral
2021-03-15 00:05:05,1371251064641572865,"BerkshireEagle: After Yo-Yo Ma received his second jab of a COVID-19 vaccine at Berkshire Community College Saturday, he transformed hi…",872869386,BartBuff,"Covington, GA",2127,73278,,True,False,29985,,,6202,0,0.0,0.0,neutral
2021-03-15 00:05:04,1371251061592313859,David_Beloved71: My daily reminder that I will never take the COVID vaccine. Agree or disagree?,1019199803299958784,jd_bridges,,559,9562,,False,False,9709,,,22,0,0.0,0.0,neutral
2021-03-15 00:05:04,1371251060690407427,"Reuters: People waiting at a vaccination clinic in Pittsfield, Massachusetts got a surprise performance from Yo-Yo Ma after the legenda…",14269620,thongek,เห่า แต่ไม่กัด,2262,3730,,False,False,64398,,,96,0,0.0,0.0,neutral
2021-03-15 00:05:03,1371251060002594820,"hutcho66 NordicNomadEsq There's also the fact that pre vaccination discussion includes discussion about the need for a second dose. Pfizer and AZ have different time frames for second dose, so this discussion should be had prior to ensure recipient will be able to get the second dose when needed.",61152278,woopdedoo652,"Victoria, Australia",456,69978,,False,False,21834,,,0,0,0.2041666666666667,0.08333333333333333,positive
2021-03-15 00:05:03,1371251057163051013,Reuters: AstraZeneca finds no evidence of increased blood clot risk from vaccine  ,1133514959755784192,BahangD,"Malacca, Malaysia",177,2983,,False,False,75315,,,124,0,0.0,0.0,neutral
2021-03-15 00:05:03,1371251056605155333,"metaburbia DennisN KristenRemaro BNODesk Indeed and the IP that is tied up with the production techniques, not because it’s Covid but in general to get a vaccine designed for the quickest possible roll out, is just too sensitive to give to any old manufacturer. So it’s being kept in their own secure facilities",246124236,Steve_Flau,"Wellington, New Zealand",90,2173,,True,False,2967,,,0,0,0.7000000000000001,0.20833333333333334,positive
2021-03-15 00:05:02,1371251055816798219,"tmcs10 StPetePolls DaytimeDan wmnfnews fema GovRonDeSantis I just got vaccinated at Walmart yesterday in Florida under the waste avoidance protocol with the Moderna vaccine. 

That’s so unfortunate that they would rather levy a fine than get that shot in the arm of someone, anyone.  It’s so against what we’ve been working toward.",372570403,MadScientistAmy,,950,10033,,True,False,3482,,,0,0,0.5,-0.09444444444444443,negative
2021-03-15 00:05:02,1371251054743027712,"Aaron_Glantz: In the real world

Pfizer vaccine shows 94% effectiveness against asymptomatic transmission of COVID - ABC News via ABC…",25541341,Tamwiel,,36,15511,,True,False,1940,,,2,0,0.30000000000000004,0.2,positive
2021-03-15 00:05:02,1371251052218085378,McMasterU: Got questions about the 2nd-gen COVID-19 vaccines developed by MacGlobalNexus? Immunologist Zhou Xing explains how they wor…,985140817,fahman33,Egypt,1000,6136,,True,False,28438,,,322,0,0.3,0.1,positive
2021-03-15 00:05:02,1371251051857346567,"There were reports of serious blood clotting after inoculations in Norway.

",2861771,WNCN,North Carolina,46413,5127,,True,True,150636,,,3,0,0.6666666666666666,-0.3333333333333333,negative
2021-03-15 00:05:01,1371251047851757571,"niki_jay_1: Toronto lockdown czar’s husband has ‘financial ties’ to Pfizer, AstraZeneca | News | LifeSite ",4170889399,DeniseInCanada,Canada,6023,115369,,False,False,77374,,,104,0,0.0,0.0,neutral
2021-03-15 00:04:59,1371251042625626119,"LtGovMorales: The AmericanRescuePlan is huge for NewMexico: $1,400 direct payments to workers &amp; families, help to safely reopen schoo…",727888799640915968,joinnealc,"Las Cruces, NM",302,10496,,False,False,4414,,,2,0,0.6,0.3333333333333333,positive
2021-03-15 00:04:59,1371251042164170755,business: The weekly U.S. Covid-19 death toll fell to a four-month low and AstraZeneca says data shows no evidence of an increased risk…,180643353,kidstrevor,"San Jose, CA",130,2036,,True,False,79297,,,23,0,0.3,0.0,neutral
2021-03-15 00:04:59,1371251041061249026,"GovNedLamont: Proud to continue our vaccination efforts this morning with federal, state and local leaders at B1CommunityCT in Stamfor…",202625355,CHCConnecticut,Connecticut,3479,1089,,True,False,8188,,,13,0,0.5,0.4,positive
2021-03-15 00:04:59,1371251040838897671,"AlexBerenson: As the kids say, lolcatz. Though Moderna avoids calling what it does gene therapy (in part because regulators historicall…",726395588498051072,realcanuck7,,289,14,,False,False,246005,,,120,0,0.0,0.0,neutral
2021-03-15 00:04:59,1371251040167718914,Independent: Ireland suspends AstraZeneca vaccine amid blood clot reports ,240890205,ms_msmarshas,Los Angeles,2787,61819,,True,False,196357,,,32,0,0.125,0.0,neutral
2021-03-15 00:04:59,1371251039932985345,Brindlepooch: America's wealthiest are finding ways to access the vaccine ahead of those who qualify for it. cc .⁦WhiteHouse⁩ ⁦MSNBC⁩…,1059670327926624256,Trish5_Here,"New Jersey, USA. 🇺🇸🇺🇸",4846,59312,,False,False,260881,,,76,0,0.0,0.0,neutral
2021-03-15 00:04:59,1371251039261843459,sebbaaaass: today my mom was denied the covid-19 vaccine because she is undocumented. riteaid asked for her social security and the wo…,2476345046,manwoaspleen,there is no there there,726,144062,,True,False,108898,,,704,0,0.06666666666666667,0.03333333333333333,positive
2021-03-15 00:04:58,1371251039010164737,"NickDone8 LoveUSA521 DanScavino I'm really not sure what first to market means. Moderna is now the most distributed vaccine with J and J coming up on second ... Pfizer is soon third, Maybe next time launch a product that doesn't have to be packed in liquid nitrogen and require an entire cold supply chain",29491779,thegreatone922,Las Vegas,9,16,,False,False,4323,,,0,0,0.4184027777777778,-0.012499999999999997,negative
2021-03-15 00:04:58,1371251038703996935,joylynbest: Trump is still refusing to do his part keep Americans from dying of COVID-19 ,155986770,joylynbest,,10312,160604,,True,False,240221,,,1,0,0.0,0.0,neutral
