created,id_str,text,user_id,screen_name,location,followers_count,user_favourites_count,time_zone,geo_enabled,verified,status_count,geo,coords,retweet_count,tweet_favourite_count,Subjectivity,Polarity,Sentiment
2021-03-15 00:12:47,1371253002103877633,"GeigerNews: Ways to get Trump supporters to take the Covid vaccine:

- Tell them Biden ordered them *not* to take it

- Convince them t…",830069222008983553,29361RMSM,,2389,7336,,False,False,455438,,,11,0,0.0,0.0,neutral
2021-03-15 00:12:46,1371253001394941953,"Reuters: People waiting at a vaccination clinic in Pittsfield, Massachusetts got a surprise performance from Yo-Yo Ma after the legenda…",1313258964931366913,Kitkat64582131,,205,40893,,False,False,24875,,,96,0,0.0,0.0,neutral
2021-03-15 00:12:46,1371252999918604302,"TheRickyDavila: My mother and I were finally able schedule our first dose of the Covid vaccine for next week. Wear a mask, get the vacc…",16021340,KayS57,Thornton  Colorado,2950,42453,,False,False,134951,,,297,0,0.3194444444444444,0.25,positive
2021-03-15 00:12:45,1371252997867646980,"SimonClarkeMP: My money is, once again, on the Oxford/AstraZeneca scientists here.  The repeated attempts to cast doubt upon what is tr…",42942856,tinkernurse,Martello bay .UK.,5183,41552,,True,False,69422,,,38,0,0.0,0.0,neutral
2021-03-15 00:12:45,1371252997653602305,"ComfortablySmug: Pfizer, moderna, and johnson and johnson are private companies that competed to rapidly develop a vaccine once Trump r…",204176679,ThePoliticalHat,The state with shuttered blackjack and brothels due to Corona-chan.,4029,1039,,False,False,193561,,,293,0,0.375,0.0,neutral
2021-03-15 00:12:45,1371252997209088006,I Would Sell Pfizer And Moderna At 5x Sales  stocks stockstobuy stockmarket,984429417995874306,financialmania,"Lewes, Delaware",674,2821,,False,False,10408,,,0,0,0.0,0.0,neutral
2021-03-15 00:12:44,1371252990183579649,anxiousdeluxe: my two Moderna doses ,3277315956,_katieross__,"San Diego, CA",458,50994,,True,False,27667,,,7796,0,0.0,0.0,neutral
2021-03-15 00:12:43,1371252986601644032,"democracynow: Joseph Stiglitz says there is an ""artificial"" shortage of COVID-19 vaccines. ""There are many companies in developing coun…",712696418,PSafiyaGabriel,,10,9868,,False,False,1989,,,87,0,0.75,-0.04999999999999999,negative
2021-03-15 00:12:43,1371252986450706432,Pietro2759: WhiteHouse JoeBiden I just received my first shot of Moderna vaccine. I’m 62 years old live in Western N.Y THANK YOU DONA…,753057467496558592,jgionova,"Miami Beach, FL",6228,7886,,False,False,525484,,,1,0,0.2583333333333333,0.12159090909090908,positive
2021-03-15 00:12:43,1371252985469267970,"DrTomFrieden: The chance that you’ll get a long-term health problem from a vaccine against Covid may well be zero, but even if not, are…",100377279,Fromgirltogirl,"Washington, DC",1352,21493,,False,False,124582,,,301,0,0.0,0.0,neutral
2021-03-15 00:12:42,1371252982646460421,"KonstantinKisin: ""Lockdown harder and faster""
""Close the borders""
""10 years in prison for COVID offenders""
""Beat anti-lockdown proteste…",3018838022,chrisraposo1,,28,15401,,False,False,1115,,,150,0,0.0,-0.1,negative
2021-03-15 00:12:42,1371252982231134211,akikigate First shot here. Moderna. My son Jacob got the J+J.,886666237098561536,Rogerwa80331466,,1942,103621,,True,False,22604,,,0,3,0.3333333333333333,0.25,positive
2021-03-15 00:12:41,1371252979496493061,MarciaJAnderson: If vaccine rollout plans do not explicitly respond to widespread evidence about what racial/ ethnic/ Indigenous/ incom…,917914287158345728,AASporle,"Auckland, New Zealand",711,32684,,True,False,1447,,,13,0,0.0,0.0,neutral
2021-03-15 00:12:41,1371252977835642887,"Jessicam6946: Everyone getting their vaccines.  Please, remember it takes 2 weeks to build full immunity after your 2nd dose of Pfizer…",802980614471356416,JWSpringer62,LA USA,2735,130850,,True,False,45113,,,335,0,0.275,0.175,positive
2021-03-15 00:12:40,1371252974626893825,tedlieu: Dear nytimes &amp; washingtonpost: The former President HID that he got vaccinated &amp; had no plan for vaccine rollout. And Pfizer…,46320929,terrylaug,,45,24292,,True,False,1620,,,1767,0,0.0,0.0,neutral
2021-03-15 00:12:39,1371252970608852993,politicususa: Chris Christie demanded that America give Trump credit for the COVID vaccine that Trump’s Operation Warp Speed had nothin…,808755910566879234,doris_sher,,1289,5546,,True,False,118041,,,35,0,0.0,0.0,neutral
2021-03-15 00:12:39,1371252969954373634,"akikigate Got both doses of Moderna, will have full efficacy on Tuesday.",246457424,jrwebber16,"Colorado, USA",1245,80567,,False,False,50869,,,0,3,0.55,0.35,positive
2021-03-15 00:12:39,1371252969765736449,"FriendEden100: Ladies: Wait 4-6 weeks after getting vaccinated to have a mammogram.

COVID vaccine can cause swelling in the lymph node…",1114991438301888519,JenyF12,"Charlotte, NC",5263,100297,,False,False,12456,,,8,0,0.0,0.0,neutral
2021-03-15 00:12:39,1371252968859783178,rupert_pearse: Pretty clear statement from the UK drug regulator MHRAgovuk that the available evidence does not suggest an increased r…,452626071,briwbri,Liverpool/Belfast/Manchester,1477,13905,,True,False,10075,,,103,0,0.5944444444444444,0.25,positive
2021-03-15 00:12:38,1371252967316291585,"aubrey_huff: Take the Covid_19 vaccine it’s “safe” they said: 1,524 deaths, &amp; and 5,507 serious injuries. ",33947838,cottongirl45,"Lubbock, Texas",2156,82345,,False,False,20073,,,312,0,0.5833333333333333,0.08333333333333334,positive
2021-03-15 00:12:38,1371252966569738240,jeffisrael25: getting one dose of Pfizer and one dose of Moderna its called an Arnold Pharma,1037331957330468864,EderyMaya,"Brooklyn, NY",333,1713,,False,False,502,,,20258,0,0.0,0.0,neutral
2021-03-15 00:12:37,1371252960886464517,GlobalNational: Canada has not received any AstraZeneca COVID-19 vaccines that were part of the batch under investigation for blood clo…,188855808,TJohn_Tex,"Texas, USA",2325,53851,,False,False,49369,,,69,0,0.0,0.0,neutral
2021-03-15 00:12:36,1371252959342780419,"bluestein: On Monday, the big day arrives for many Georgians wanting COVID vaccine gapol ",1149747295,dickeyx2,"California, USA",231,131755,,True,False,15139,,,24,0,0.3,0.25,positive
2021-03-15 00:12:36,1371252958629920775,"Robyn_TRuth: Today I left quarantine after 375 days to get my first Moderna vaccine shot. 💉

I got to touch another human being and ri…",1182673079157383171,LarryBa11254224,,34,668,,False,False,3831,,,68,0,0.14444444444444446,0.08333333333333333,positive
2021-03-15 00:12:35,1371252955702124545,newsmax: Ric Grenell: Biden's only 'reordering' vaccines - the heavy lifting was done by Trump  ,612618408,franmosh,"Las Vegas, NV",308,24841,,True,False,7971,,,1707,0,0.75,-0.1,negative
2021-03-15 00:12:35,1371252955463225344,"rexzane1: ThankTrump 
Pfizer, aka the first vaccine approved, was not a part of Operation Warp Speed. 
Trump isn't responsible for the…",51726986,arw1950,atlanta,1492,91732,,True,False,83881,,,42,0,0.44166666666666665,0.225,positive
2021-03-15 00:12:35,1371252951864446976,"zeynep: Folks, *look* at this chart. That red line that's fallen of a cliff starting around January 10 is 65+ folks hospitalized for CO…",2611910322,lucykpick,Chicago. Il,2020,109715,,False,False,77554,,,526,0,0.05,0.0,neutral
2021-03-15 00:12:33,1371252946160160770,spectatorindex: JUST IN: The Netherlands suspends the administration of the AstraZeneca coronavirus vaccine as a 'precaution',1548449911,mountkidd,"Alberta, Canada",939,353377,,False,False,196627,,,612,0,0.0,0.0,neutral
2021-03-15 00:12:33,1371252946000773121,"AdrianMorrow: At a factory in Ohio, there are enough doses of AstraZeneca’s covid vaccine to more than fill Canada’s entire order. The…",22820478,chrishbenge,Vancouver BC,10699,4072,,False,False,44285,,,51,0,0.5416666666666666,0.16666666666666666,positive
2021-03-15 00:12:32,1371252942288789511,Only About 22 States Give Postal Workers Vaccine Access ,1529630646,MinecraftTimez,,29,0,,False,False,25539,,,0,0,1.0,0.0,neutral
2021-03-15 00:12:32,1371252942129356802,DrEricDing: VACCINE ESCAPE OF VARIANTS vs Pfizer-BioNTech &amp; NIH-Moderna: Troubling new peer-reviewed paper shows even 2-dose recipients…,718877167942152192,PeterUpsidedown,,510,25417,,False,False,4647,,,1282,0,0.45454545454545453,0.13636363636363635,positive
2021-03-15 00:12:32,1371252941026394113,DrEricDing: 15) Another preprint recently found similar worrisome results for B1351 neutralization by Pfizer &amp; Moderna vaccinated? Yes…,22004290,bowditch71,"Crewe, UK",251,14683,,False,False,5933,,,90,0,0.325,0.0,neutral
2021-03-15 00:12:32,1371252940959285249,"DrTomFrieden: The chance that you’ll get a long-term health problem from a vaccine against Covid may well be zero, but even if not, are…",1362601601186357251,DanFord38763054,,1,27,,False,False,18,,,301,0,0.0,0.0,neutral
2021-03-15 00:12:31,1371252938379816960,spectatorindex: JUST IN: The Netherlands suspends the administration of the AstraZeneca coronavirus vaccine as a 'precaution',588204046,alejosanz4,,644,36432,,True,False,35359,,,612,0,0.0,0.0,neutral
2021-03-15 00:12:30,1371252934617362432,America doesn’t use the AstraZeneca vaccine WOOOO USA NUMBER 1!!!! ,774102707997028354,gallardonuts,"Hawthorne, CA",156,5912,,True,False,7615,,,0,0,0.0,0.0,neutral
2021-03-15 00:12:30,1371252933854167040,RetroHonda: realreporter News - Pfizer was not consulted about Henry’s experiment with vaccines. Pfizer says this is the only experime…,1143653068556423168,livingintoronto,"Toronto, Ontario",157,96,,False,False,2212,,,13,0,1.0,0.0,neutral
2021-03-15 00:12:30,1371252931614318593,"POTUS  Read the GAO report on Trump's vaccines. Trump ordered 500 million doses of Covid vaccine, enough to vaccinate every person in the U.S and this is still in place. You are lying to the American People as you did NOTHING, NOTHING, to increase vaccine production.",1102133059,blueroadliner,,14,4,,True,False,10121,,,0,0,0.25,0.0,neutral
2021-03-15 00:12:29,1371252930058260480,"DrEricDing: Did you know—30 million doses of the Oxford-AstraZeneca are sitting idle in the US, awaiting results from its U.S. clinical…",1359890119092826117,M_Almeida_82,,12,179,,False,False,78,,,762,0,0.0,0.0,neutral
2021-03-15 00:12:29,1371252929961725954,DrEricDing: VACCINE ESCAPE OF VARIANTS vs Pfizer-BioNTech &amp; NIH-Moderna: Troubling new peer-reviewed paper shows even 2-dose recipients…,215503013,chrisw442,"Vancouver, WA",540,67365,,True,False,70232,,,1282,0,0.45454545454545453,0.13636363636363635,positive
2021-03-15 00:12:28,1371252926568660992,"aubrey_huff: Take the Covid_19 vaccine it’s “safe” they said: 1,524 deaths, &amp; and 5,507 serious injuries. ",502301284,stevemlowe,United States,188,17912,,False,False,3805,,,312,0,0.5833333333333333,0.08333333333333334,positive
2021-03-15 00:12:28,1371252923963998219,"Another country:
Ireland Suspends AstraZeneca Vaccine Amid Blood Clot Reports ",1194346351179501576,Cream_n_Coffee,WorldWide,767,1745,,False,False,11003,,,1,1,0.0,0.0,neutral
2021-03-15 00:12:28,1371252922764365828,wfaa: Minority groups are being vaccinated far below their population rate and wealthy communities are receiving far more doses than po…,2396766331,chemxtree,"Rochester, NY",192,10270,,True,False,6414,,,17,0,0.875,0.3,positive
2021-03-15 00:12:27,1371252919383777286,magnoliasun1: COVID-19 vaccines designed to elicit neutralising antibodies may sensitise vaccine recipients to more severe disease than…,23510139,Irene48,,2603,260154,,False,False,184016,,,4,0,0.5,0.5,positive
2021-03-15 00:12:26,1371252917391523847,"ComfortablySmug: Pfizer, moderna, and johnson and johnson are private companies that competed to rapidly develop a vaccine once Trump r…",17527144,smallgovlizard,,548,524,,True,False,33194,,,293,0,0.375,0.0,neutral
2021-03-15 00:12:26,1371252916468736002,"DrTomFrieden: The chance that you’ll get a long-term health problem from a vaccine against Covid may well be zero, but even if not, are…",3362989235,judyjackson2086,,874,75885,,False,False,165753,,,301,0,0.0,0.0,neutral
2021-03-15 00:12:26,1371252915629854724,"SaderCharlie Fine with my first Moderna. Second one, fever, chills, headache and very tired. Symptoms started about 12 hours after the shot. Oh yes. Arm hurt all they way to my finger tips. First day the worst then better next 2 and then fine. Guess the body is doing what it's suppose to.",36108890,minibus2,,672,16711,,True,False,20873,,,0,0,0.4529629629629629,0.034814814814814826,positive
2021-03-15 00:12:26,1371252914841337863,"If the EU_Commission and EU countries want to believe conspiracies about the Oxford/ AstraZeneca vaccine and give into anglophobia despite no evidence and over 10 million UK vaccinations, give us the doses back and fuck off. Seriously.",142728197,JamesWillby,"New York, NY",3916,16016,,True,False,114296,,,0,1,0.4222222222222222,-0.24444444444444446,negative
2021-03-15 00:12:25,1371252911435550721,empath_g_app At least there's a vaccine against COVID. Stupidity is a terminal illness.,1167440213213425664,zendormouse,"Fayetteville, AR",1825,260266,,False,False,8533,,,0,0,0.7,-0.44999999999999996,negative
2021-03-15 00:12:24,1371252909061632002,Jessicam6946 I've gotten both doses of moderna. I am wearing my mask as usual.,2756863186,trina_me8,"Oklahoma, USA",25958,192810,,False,False,12659,,,0,8,0.25,-0.25,negative
2021-03-15 00:12:24,1371252906167431174,"Oh no. 😓😷
“The data that we’ve seen from a real world evidence perspective that has been used to make arguments to extend the dose schedule has been done on much younger populations,” 
cdnpoli bcpoli  ",172399876,cindian1,,2146,109178,,True,False,79320,,,0,0,0.15000000000000002,0.1,positive
2021-03-15 00:12:23,1371252904821100550,DrEricDing: VACCINE ESCAPE OF VARIANTS vs Pfizer-BioNTech &amp; NIH-Moderna: Troubling new peer-reviewed paper shows even 2-dose recipients…,962809553321644032,jmeandthemore,"Austin, TX",362,25402,,True,False,14052,,,1282,0,0.45454545454545453,0.13636363636363635,positive
2021-03-15 00:12:23,1371252902229065734,mark_toshner: I have tweeted about likely over-reporting of side effects of vaccines extensively in the past but will have another go a…,2480069648,MaartenDevant,,1209,15900,,False,False,34040,,,548,0,0.5277777777777778,-0.08333333333333333,negative
2021-03-15 00:12:22,1371252897271398400,zerohedge: NETHERLANDS SUSPENDS USE OF ASTRAZENECA COVID-19 VACCINE UNTIL AT LEAST MARCH 29 -GOVERNMENT,2356837350,maniseku,,984,11161,,True,False,191342,,,348,0,0.4,-0.3,negative
2021-03-15 00:12:21,1371252897145483264,"One 💉 down, one  💉 to go. Had the Moderna vaccine today.  
🥳🥳🥳 ",2530553016,ElizaWallace27,"Orange County, CA",14199,281985,,False,False,169801,,,0,30,0.2888888888888889,-0.15555555555555559,negative
2021-03-15 00:12:21,1371252896529055746,MidwesternMama2: MalcolmNance peterbakernyt farhip They talked about Hillary’s emails for 2 straight year but have already moved on…,884171587481735169,miladysmama,Lodge 49,426,85850,,False,False,68124,,,52,0,0.4,0.2,positive
2021-03-15 00:12:21,1371252895442685953,"AlexanderKekule: In the light of the latest events, AstraZeneca COVID vaccinations should be halted and possible subtle or rare effect…",2262672047,Kassandra_1909,,522,140093,,False,False,102670,,,21,0,0.8,0.17333333333333334,positive
2021-03-15 00:12:19,1371252887314042884,schuetze_k: PNG has the most cases of Covid-19 per capita of the the whole Pacific region (with gross under testing) and yet they have…,2783926117,alex_m_johnston,"Auckland, NZ",398,1199,,True,False,1040,,,12,0,0.3,0.2333333333333333,positive
2021-03-15 00:12:18,1371252884420038656,Independent: Ireland suspends AstraZeneca vaccine amid blood clot reports ,3957030021,singerdrb,"Vienna, Austria / ",1518,5286,,False,False,5919,,,32,0,0.125,0.0,neutral
2021-03-15 00:12:17,1371252880414498820,TIME: Breaking down what COVID-19 vaccine effectiveness means ,1061959976334356480,akentenwiafe1,Ghana,208,9104,,False,False,986,,,35,0,0.2888888888888889,-0.15555555555555559,negative
2021-03-15 00:12:17,1371252879881830405,DrEricDing: VACCINE ESCAPE OF VARIANTS vs Pfizer-BioNTech &amp; NIH-Moderna: Troubling new peer-reviewed paper shows even 2-dose recipients…,1003066401345687553,IronSocialist,"San Fransisco, California",625,59442,,False,False,59090,,,1282,0,0.45454545454545453,0.13636363636363635,positive
2021-03-15 00:12:16,1371252876232724488,Got my second Pfizer shot last night and I feel pretty great today. No hangover or side effects yet... ,25169169,LiamODin,"Los Angeles, CA",2070,96754,,True,False,9151,,,0,32,0.45416666666666666,0.2625,positive
2021-03-15 00:12:16,1371252876119527424,"Come on, Massachusetts! This isn't even remotely okay. ",66517711,allisonrose303,Philly | Boston | Orlando,340,57693,,False,False,17228,,,0,0,0.5,0.5,positive
2021-03-15 00:12:15,1371252871241424899,Lauren_Southern: Genuinely want someone to explain to me why Marvin Haglers death shouldn’t make people concerned about the COVID vacci…,1301682429510336512,lord_maga,,1367,26463,,False,False,16567,,,102,0,0.5,0.4,positive
2021-03-15 00:12:15,1371252869710671882,"Good and Bad news folks. Bad, no stream tomorrow. Good, its because I'm getting round 1 of the covid vaccine. I'll let yall know if I end up turning into a cannibal or if nothing at all happens, we'll see.",535730048,IAmLitus,United States,122,747,,False,False,4341,,,0,4,0.5866666666666667,-0.03999999999999996,negative
2021-03-15 00:12:15,1371252868490084355,"darylsturgis He also turned down the opportunity to lock in a supply beyond the initial 100 million doses of Pfizer, which was only enough to vax 50 million ppl. ",24979144,stirfriedrice,"Dallas, Texas. ",387,72374,,False,False,8394,,,0,0,0.44722222222222224,-0.038888888888888896,negative
2021-03-15 00:12:14,1371252866631962624,"ComfortablySmug: Pfizer, moderna, and johnson and johnson are private companies that competed to rapidly develop a vaccine once Trump r…",2193702882,AkiraR39,Not here,661,59463,,False,False,48543,,,293,0,0.375,0.0,neutral
2021-03-15 00:12:14,1371252866459967490,21stCenturyWire: Fauci totally whiffed on a question about AstraZeneca vaccine on MeetThePress today. chucktodd may have miraculous…,1697268019,billWithTrumpet,,196,45061,,False,False,1359,,,12,0,0.75,0.0,neutral
2021-03-15 00:12:13,1371252863318458370,"hutcho66 NordicNomadEsq I'm talking about discussion that should be had between doctor and patient, not a form. Regardless, they can't not tell you if you specifically ask, which was my entire point. You have a right to know what is being injected into you, whether it's covid vaccine or anything else.",61152278,woopdedoo652,"Victoria, Australia",455,69978,,False,False,21834,,,0,0,0.5803571428571428,0.14285714285714285,positive
2021-03-15 00:12:13,1371252860789346305,DrEricDing: VACCINE ESCAPE OF VARIANTS vs Pfizer-BioNTech &amp; NIH-Moderna: Troubling new peer-reviewed paper shows even 2-dose recipients…,1304846484249161729,HaydeeF14,,590,55326,,False,False,27067,,,1282,0,0.45454545454545453,0.13636363636363635,positive
2021-03-15 00:12:13,1371252860202184704,newsmax: Ric Grenell: Biden's only 'reordering' vaccines - the heavy lifting was done by Trump  ,591951432,PLisaj,,3408,21816,,True,False,135859,,,1707,0,0.75,-0.1,negative
2021-03-15 00:12:12,1371252858646061056,"aubrey_huff: Take the Covid_19 vaccine it’s “safe” they said: 1,524 deaths, &amp; and 5,507 serious injuries. ",706709211,mcso444,"Central Florida, USA",5421,106993,,True,False,56025,,,312,0,0.5833333333333333,0.08333333333333334,positive
2021-03-15 00:12:12,1371252855294791680,"RedsReporter: So, 14 countries have now suspended the use of covid vaccine. 

Yet still we ploughing on jabbing thousands a day. 

What…",603817947,JuliaJay8,UK,5273,35429,,False,False,146972,,,11,0,0.0,0.0,neutral
2021-03-15 00:12:11,1371252853730336772,"Suntimes: Illinois has doled out 4,040,302 vaccine doses over the last three months, including 96,332 on Saturday, state health officia…",438620792,maudlynei,"Chicago, Illinois",5633,11908,,True,True,85316,,,5,0,0.06666666666666667,0.0,neutral
2021-03-15 00:12:10,1371252847522684932,sebbaaaass: today my mom was denied the covid-19 vaccine because she is undocumented. riteaid asked for her social security and the wo…,1882092282,ashleystefanson,"California, USA",244,55422,,True,False,5800,,,704,0,0.06666666666666667,0.03333333333333333,positive
2021-03-15 00:12:10,1371252847510056961,AlexBerenson: So we’re all just gonna pretend the Marvin Hagler thing didn’t happen? Like the Hank Aaron thing? Or the Australian Healt…,1368301975947800658,aflml2,,7,1925,,False,False,1084,,,1345,0,0.0,0.0,neutral
2021-03-15 00:12:09,1371252842992783361,JenTheRiot: Joe Biden would have Americans think he is responsible for development and distribution of the Covid vaccine. I’m here to t…,959983126817755136,JimLongo63,"Marion, OH",1960,21499,,True,False,52094,,,8,0,0.55,0.2,positive
2021-03-15 00:12:08,1371252839331287042,Tomorrow marks one year since my last shift before i got laid off due to the pandemic. In 2 1/2 weeks i go for my first dose of the Covid-19 vaccine. Im still terrified but im more hopeful now than ever before that were gonna get through this.,1090371763,christatortots,,74,3007,,False,False,1228,,,0,2,0.31875,0.15625,positive
2021-03-15 00:12:07,1371252834801311746,MeaghanBower got that with the moderna shot. i was miserable.,591296839,Yvettes14,a concert or hockey game. az.,394,26844,,True,False,49612,,,0,1,1.0,-1.0,negative
2021-03-15 00:12:06,1371252831798317062,f0lake: No i dont think u understand i need to get my hands on that pfizer syringe...,1055706685,the_victouria,"AUSTIN, TX.",208,12103,,False,False,45573,,,142,0,0.0,0.0,neutral
2021-03-15 00:12:05,1371252829986377732,newsmax: Ric Grenell: Biden's only 'reordering' vaccines - the heavy lifting was done by Trump  ,1295734445258018819,MishaOBrien18,"Collegeville, PA",4097,8256,,False,False,5073,,,1707,0,0.75,-0.1,negative
2021-03-15 00:12:05,1371252829483065345,anxiousdeluxe: my two Moderna doses ,521901999,hallvvayz,"Orlando, FL",577,75426,,True,False,80237,,,7796,0,0.0,0.0,neutral
2021-03-15 00:12:05,1371252829134946310,"SandraWeeden: Oxford/AstraZeneca suspended.

Denmark joins five other countries - Austria, Estonia, Lithuania, Luxembourg and Latvia -…",1293889481544736769,Mike03345985,"North Carolina, USA",11,70,,False,False,2663,,,790,0,0.375,-0.125,negative
2021-03-15 00:12:05,1371252828489023494,"Reuters: People waiting at a vaccination clinic in Pittsfield, Massachusetts got a surprise performance from Yo-Yo Ma after the legenda…",2480124013,AntidoteThought,Fibonacci sequence,2378,102674,,False,False,61540,,,96,0,0.0,0.0,neutral
2021-03-15 00:12:04,1371252824353411073,"Coronavirusgoo1: The UK has given over 10 million doses of both the Oxford and Pfizer vaccine. 

Number of blood clot related events:…",138074324,TheBuffaloJoe,Liver Pool,1101,9272,,False,False,11976,,,4580,0,0.4,0.0,neutral
2021-03-15 00:12:04,1371252824043089920,"BNODesk: UK's medicine regulator on AstraZeneca's COVID-19 vaccine: ""We are closely reviewing reports but given the large number of dos…",1241922964960038913,sulemanali2001,,92,126897,,False,False,5507,,,110,0,0.42857142857142855,0.21428571428571427,positive
2021-03-15 00:12:04,1371252822294024192,"Quantanamo: Irish health officials recommend suspension of AstraZeneca vaccine amid blood clot reports

While no conclusive link has be…",1341982894668083200,CentzCrypto,,48,3203,,False,False,935,,,20,0,0.0,0.0,neutral
2021-03-15 00:12:04,1371252822080163845,"thegreatone922 LoveUSA521 DanScavino Huh..but you said the vaccines couldn't have been developed without Dr Cheeto, and literally Pfizer did it..",1332456313327116290,NickDone8,,324,43805,,True,False,20993,,,0,0,0.3,0.1,positive
2021-03-15 00:12:03,1371252821241266177,PamLongCO: Bossche’s solution to avoiding the current experimental mRNA vaccine  fallout is a novel NK vaccine. That’s his “alarm.” He…,1410527701,saraart4,,1075,123720,,False,False,79341,,,42,0,0.4,0.05,positive
2021-03-15 00:12:03,1371252821228617728,"Reuters: People waiting at a vaccination clinic in Pittsfield, Massachusetts got a surprise performance from Yo-Yo Ma after the legenda…",1337954988354535426,Deeks59677870,,23,211,,False,False,3021,,,96,0,0.0,0.0,neutral
2021-03-15 00:12:03,1371252820549206021,"I really just scheduled my mom a covid vaccine I’m so happy for her ❤️

My mom never stopped working last March, or any month after, and now a year later she’s getting the vaccine and I’m so happy for her 😭💗",2228870460,hunterrr_ash,"Michigan, USA",235,39877,,True,False,18748,,,0,1,0.4533333333333333,0.36,positive
2021-03-15 00:12:03,1371252819689345024,"NYDailyNews: World-renowned cellist, Yo-Yo Ma, received his second shot of a COVID vaccine Saturday, then spent the 15 minute post-shot…",354865786,Congressgohome,"Winchester, VA",330,4181,,False,False,10179,,,253,0,0.05,-0.05,negative
2021-03-15 00:12:03,1371252818703704065,"Coronavirusgoo1: The UK has given over 10 million doses of both the Oxford and Pfizer vaccine. 

Number of blood clot related events:…",47574293,earthgirlgeena,"London, England",246,37263,,True,False,14942,,,4580,0,0.4,0.0,neutral
2021-03-15 00:12:03,1371252817759981572,"democracynow: Joseph Stiglitz says there is an ""artificial"" shortage of COVID-19 vaccines. ""There are many companies in developing coun…",426113645,majsanom,Slovenija,1602,21793,,True,False,36595,,,87,0,0.75,-0.04999999999999999,negative
