created,id_str,text,user_id,screen_name,location,followers_count,user_favourites_count,time_zone,geo_enabled,verified,status_count,geo,coords,retweet_count,tweet_favourite_count,Subjectivity,Polarity,Sentiment
2021-03-15 00:10:09,1371252339714125826,"JAnitsakis MMFlint KatyTurNBC He didn't say that. He's been fighting racism &amp; hate. He protested against Texas governor lifting mask mandate because it will reduce the effect of vaccination. In desperation, he said vaccine shall go to those who abide by the rules to fight Covid-19.",222371467,norikosasali,,51,4244,,True,False,11633,,,0,0,0.9,-0.8,negative
2021-03-15 00:10:08,1371252338430738432,"LawDavF iamthedrifter Is astrazeneca vaccine still in clinical trials?
Are they just doing post surveillance?

If yes to both questions, then the consent form is signed by the receiver?",750955328,Mianwaseem8,Dreams,452,12410,,True,False,11086,,,0,0,0.0,0.0,neutral
2021-03-15 00:10:08,1371252337814216705,wbkotv: Dr. Anthony Fauci said Sunday he wishes former President Donald Trump would use his popularity among Republicans to persuade hi…,1360395985638326272,BethMill8,"Bowling Green, KY",25,12,,True,False,738,,,1,0,0.0,0.0,neutral
2021-03-15 00:10:08,1371252335750610947,jaynooch: Before and after getting the covid vaccine ,3146469977,succserer,he/him • fae/faer • 22,2067,304424,,True,False,206758,,,232,0,0.0,0.0,neutral
2021-03-15 00:10:07,1371252332906831877,"Coronavirus vaccine news: Expert ‘80% sure’ Brits can take summer holidays as rollout sees Covid deaths hit 5 MONTH low

Stories from 5 sources | Photo via Metro



 covid vaccine covidvaccine brits ",1209133111956688896,CollectedTimes,,17,0,,False,False,13370,,,0,0,0.5944444444444444,0.25,positive
2021-03-15 00:10:07,1371252331572994050,"PhilippineStar 3/10: highest covid cases in SEA, last to received vaccine in SEA. After 1 year, we're back to square one!",4780609002,Bobet_C_A,,0,3,,False,False,4,,,0,0,0.03333333333333333,0.0,neutral
2021-03-15 00:10:06,1371252330100891648,"AlexBerenson: As the kids say, lolcatz. Though Moderna avoids calling what it does gene therapy (in part because regulators historicall…",1292418826752217088,Ms_Ishabethel,The Heavens  ,149,450,,False,False,1618,,,120,0,0.0,0.0,neutral
2021-03-15 00:10:05,1371252325730324480,"ABSCBNNews: US biotech firm Novavax's coronavirus vaccine was shown to be 100% protective against severe cases of the disease, includin…",1238467680773894146,CoronaUpdateBot,,1170,65,,False,False,590505,,,8,0,0.4,-0.2,negative
2021-03-15 00:10:05,1371252324727885826,"RitaPanahiHi Rita from The Great White North Canada!i think that is about time, that The Precautionary Principle is applied to Covid vaccines. An under utilised body of international law! When it comes to International Vaccine passports its your Fairy God Mother 'Big Out'!",1324213380941447168,elainemdenison1,,2,107,,False,False,1464,,,0,0,0.16999999999999998,0.16,positive
2021-03-15 00:10:04,1371252322060361729,rishipuff: johnson and johnson made my baby shampoo and now my covid vaccine damn they really did say no more tears,2539229884,EternaEnamoradx,"Atlanta, GA",1153,184599,,True,False,201512,,,8299,0,0.35,-0.024999999999999994,negative
2021-03-15 00:10:04,1371252319032025091,"ChrisEl23170486: Covid vaccine 
Please rt for bigger poll",1255951545591627777,DiDi17071993,United States,284,10702,,False,False,9384,,,1183,0,0.5,0.0,neutral
2021-03-15 00:10:03,1371252316335009797,"ABKinSTL: atrupar Not only that, but the Operation Warp Speed legend isn't nearly as impressive as many believe since, for example, Pf…",876194535474253824,SenoritaWallst,"California, USA",408,57965,,False,False,38242,,,4,0,0.8333333333333334,0.5,positive
2021-03-15 00:10:02,1371252313453641728,"🇦🇺 Best Shot

◽ Revealed: All Australians aged over 50 to be given Covid vaccine from June in new rollout plan ◽ 🇦🇺  tminear 

frontpagestoday Australia HeraldSun 📰 ",306209103,ukpapers,"Here, Now, With You - UK",6357,84,,True,False,116805,,,1,0,0.38484848484848483,0.34545454545454546,positive
2021-03-15 00:10:02,1371252312220573696,Joe Biden would have Americans think he is responsible for development and distribution of the Covid vaccine. I’m here to tell you he’s a dog faced pony LIAR. Donald Trump gets credit for this and his Warped Speed plan. 🤦‍♀️,326255086,JenTheRiot,http://www.jennifertheriot.com,22156,143538,,False,False,425656,,,8,14,0.55,0.2,positive
2021-03-15 00:10:01,1371252309418774535,Looks like Marvin Hagler died from the covid vaccine.,263764961,Chale333,United States,251,7666,,False,False,28919,,,0,0,0.0,0.0,neutral
2021-03-15 00:10:01,1371252308810424325,business: The weekly U.S. Covid-19 death toll fell to a four-month low and AstraZeneca says data shows no evidence of an increased risk…,795899346101252096,MissLucy_2011,,512,242553,,False,False,74623,,,23,0,0.3,0.0,neutral
2021-03-15 00:10:01,1371252306877018115,akikigate First shot.  Pfizer. 4 days ago.,4312898958,HumanBeing2019,"Texas, USA",3817,147066,,True,False,84122,,,0,0,0.3333333333333333,0.25,positive
2021-03-15 00:10:01,1371252306180718593,"mazzenilsson: Nine people have died following an outbreak of Covid-19 at a care home in Devon.

All nine people who died were residents…",855626217948676096,AmandaD_1980,"Texas, USA",74,21124,,False,False,6780,,,74,0,0.1,0.0,neutral
2021-03-15 00:10:00,1371252302854643713,"US biotech firm Novavax's coronavirus vaccine was shown to be 100% protective against severe cases of the disease, including hospitalization and death, the company said. COVID19 ",15872418,ABSCBNNews,"Manila, Philippines",7326913,1172,,True,True,869699,,,8,59,0.4,-0.2,negative
2021-03-15 00:10:00,1371252302519017473,Netherlands halts use of AstraZeneca COVID19 vaccine ,44728980,ANCALERTS,Philippines,5080387,5390,,False,True,789532,,,1,3,0.0,0.0,neutral
2021-03-15 00:10:00,1371252302099542017,"Denmark, Norway and Iceland have suspended the use of the vaccine over clotting issues, while Thailand became the first country outside of Europe to do so on Friday, delaying its AstraZeneca rollout over the safety concerns.
Italy, Austria too. ",1226393433574526977,retro26290935,,20,698,,False,False,7030,,,0,0,0.19166666666666665,0.125,positive
2021-03-15 00:09:59,1371252301176864768,cairdin AlexBerenson AstraZeneca Please share a diagram that is more accurate. We'd all love to see how it operates at the genetic level.,37778253,krmarko,My own private Idaho,3412,24603,,True,False,35097,,,0,0,0.5777777777777778,0.46666666666666673,positive
2021-03-15 00:09:59,1371252300245823492,Ireland suspends AstraZeneca vaccine  via YouTube,1302622974865010691,KimJone04052805,,114,1598,,False,False,3033,,,0,0,0.0,0.0,neutral
2021-03-15 00:09:58,1371252295946604547,"TheUSASingers: I talked to someone last night who said Covid is the biggest hoax in history, masks don’t prevent disease transmission,…",3252051872,droeske2,,851,168993,,True,False,107231,,,158,0,0.06666666666666667,0.0,neutral
2021-03-15 00:09:58,1371252293799092229,sebbaaaass: today my mom was denied the covid-19 vaccine because she is undocumented. riteaid asked for her social security and the wo…,67765212,julie__vu,"Los Angeles, CA",985,53114,,True,False,4313,,,704,0,0.06666666666666667,0.03333333333333333,positive
2021-03-15 00:09:57,1371252292796702723,"ChrisThirkill: Physiotherapist, 28 dies after COVID19Vaccine 

""'My 28 year old daughter took the vaccine on a Tuesday and she was dea…",1352553034614792193,CovidRulesKill2,,32,931,,False,False,762,,,63,0,0.2,0.1,positive
2021-03-15 00:09:57,1371252291559424002,"axios: NEW: AstraZeneca has announced that a review of over 17 million people who've received its COVID-19 vaccine in Europe shows ""no…",16297067,PamUnplugged,Connecticut,2320,864588,,True,False,351930,,,124,0,0.45454545454545453,0.13636363636363635,positive
2021-03-15 00:09:57,1371252290255003657,"aubrey_huff: Take the Covid_19 vaccine it’s “safe” they said: 1,524 deaths, &amp; and 5,507 serious injuries. ",1207693037884837888,patriot_state,Florida (Treasure Coast) USA,3640,112127,,False,False,77852,,,312,0,0.5833333333333333,0.08333333333333334,positive
2021-03-15 00:09:57,1371252289953013773,"jasonhickel: In a letter to Biden, pharma executives have claimed, inexplicably, that suspending patent restrictions on covid vaccines…",229782690,JdelCSanchez,Teams / Zoom / Signal! ,2970,21926,,True,False,16750,,,223,0,0.9,-0.6,negative
2021-03-15 00:09:56,1371252286463283208,"ChrisThirkill: Physiotherapist, 28 dies after COVID19Vaccine 

""'My 28 year old daughter took the vaccine on a Tuesday and she was dea…",22605770,Muzzer100,Wales United Kingdom,227,8984,,False,False,1559,,,63,0,0.2,0.1,positive
2021-03-15 00:09:55,1371252283795726337,"tyrconnal ""..mRNA ..not a vaccine ..it's a synthetic pathogen.."":  ""..doesn’t stop her getting it ..transmitting it ..What effect does the vaccine have?.."":   ""..provides a synthetic mRNA of the virus.."": ",15256416,phelanm,,2300,87548,,False,False,44980,,,0,0,0.0,0.0,neutral
2021-03-15 00:09:54,1371252280104677379,akikigate 2nd Moderna 2 weeks ago Tuesday.,4061092694,gene_leis,Deep Left Field,30447,4639,,True,False,17737,,,0,3,0.0,0.0,neutral
2021-03-15 00:09:54,1371252279601418246,Received my second Moderna vaccine CenterNorthern with at least a couple hundred people. In line for an hour. Could count the number of Black folks on one hand. Literally one hand. Why?kyshp KrogerPharmacyB,565955470,MsCreolaD,Live in Bourbon World 🥃,66,7437,,False,False,728,,,0,0,0.2777777777777778,-0.15555555555555556,negative
2021-03-15 00:09:53,1371252276015300618,"AmyAThatcher Not really. But it's funny went I ask pro covid vaccine lot whether they have had MenAwcy and Gardasil and truly up to date with vaccines and don't even know what either are or make excuses.

I don't support Trump but I will say I am suffering the consequences from gardasil.",1361353815329550341,GoldenPotato333,"Glasgow, Scotland",1,240,,False,False,600,,,0,0,0.6,0.075,positive
2021-03-15 00:09:53,1371252274282950659,krebiozen nidoro23 naomirwolf Why are all unrelated deaths covid deaths but no directly related vaccine deaths are vaccination deaths?  Try having an independent thought instead of believing every piece of government propaganda you read is 100% gospel. I'm not surprised you're first in line for the experiment,1367500136293761028,Highlandbound11,,41,45,,False,False,77,,,0,3,0.37166666666666665,0.019999999999999997,positive
2021-03-15 00:09:51,1371252267890798597,BBCWorld: Covid-19: Ireland's vaccine body proposes AstraZeneca suspension ,1176506916274524160,Unyil81855105,,156,8530,,False,False,9417,,,672,0,0.0,0.0,neutral
2021-03-15 00:09:51,1371252266821296133,rishipuff: johnson and johnson made my baby shampoo and now my covid vaccine damn they really did say no more tears,223441375,myra_heart,Meow city,515,8549,,True,False,96611,,,8299,0,0.35,-0.024999999999999994,negative
2021-03-15 00:09:51,1371252264552251395,FUNKNA Elle_G_Lewis carrieh2020 freestockholm Aussie3_1_13 Julija9Julija AndersJonita REALITYofJNJ FatEmperor DickDelingpole NotPartaking CarolineCoramUK SandraWeeden AndreaAlbion SusanACreed PantheraSteven BradCla55888567 Must watch Del Bigtree explain Dr Bossche's message how the vaccine destroys your immunity and produces a more virulent virus you can't fight off. ,17741558,yescolleen,greece,40,8454,,True,False,680,,,1,2,0.5,0.5,positive
2021-03-15 00:09:50,1371252262299963394,"ComfortablySmug: Pfizer, moderna, and johnson and johnson are private companies that competed to rapidly develop a vaccine once Trump r…",276819775,RLHeiny,,130,16309,,False,False,22274,,,293,0,0.375,0.0,neutral
2021-03-15 00:09:50,1371252261591080972,"Reuters: People waiting at a vaccination clinic in Pittsfield, Massachusetts got a surprise performance from Yo-Yo Ma after the legenda…",1348599532448337921,AnabelM88314705,,11,2074,,False,False,1718,,,96,0,0.0,0.0,neutral
2021-03-15 00:09:49,1371252257921101825,getting the covid vaccine in all of my orifices,1345258376,teresaiiana,,312,41212,,True,False,6055,,,0,3,0.0,0.0,neutral
2021-03-15 00:09:49,1371252257866457088,CNNSitRoom: Rep. Adam Schiff says Biden’s plan to travel across the US to sell Americans on the benefits of the Covid relief plan will…,787728243960844288,_StandUpNow,"California, USA",5752,208708,,True,False,168037,,,121,0,0.0,0.0,neutral
2021-03-15 00:09:48,1371252254754414593,8NewsNow: A PUSH TO GET THE VACCINE: Dr. Anthony Fauci says he wishes former President Trump would use his popularity among Republicans…,604980675,RaffaellaDeFili,"Charlotte, NC",1796,9949,,True,False,39266,,,2,0,0.0,0.0,neutral
2021-03-15 00:09:48,1371252254146228230,"snarkgrapefruit That’s awesome, Chloe!  I got my first Pfizer shot.  I had a sore arm and very, very mild headache on the second day.  No side effects at all by the third day: I felt great.  Hope you do well also!  💛",947998967991762944,reaganweeps,USA,4352,11355,,False,False,8765,,,0,1,0.45555555555555555,0.44722222222222224,positive
2021-03-15 00:09:48,1371252253508636680,"They're talking about reviving tourism between ASEAN members who recognize the Chinese vaccine. The USA (despite using Pfizer) &amp; China want to start a mutual recognition as well. This all means that with vaccine mutual recognition we'll all be able to return.
 takeusbacktochina ",1226476803398733825,lisa68470387,Arctic,15,42,,False,False,82,,,2,3,0.3125,0.25,positive
2021-03-15 00:09:48,1371252251617017857,Reuters: Ireland recommends temporary deferral of Astrazeneca COVID-19 vaccine  ,2181045924,dubengeldu,BabyAWACS - TRULY independent.,1429,16872,,True,False,142250,,,145,0,0.0,0.0,neutral
2021-03-15 00:09:48,1371252251503833092,"DrTomFrieden: The chance that you’ll get a long-term health problem from a vaccine against Covid may well be zero, but even if not, are…",3224252246,LovingVolTrav,,225,152806,,False,False,234832,,,301,0,0.0,0.0,neutral
2021-03-15 00:09:47,1371252249767288832,POTUS Where is the truth that Trump ordered 800 million doses of the COVID vaccine last summer?  These orders went to 7 manufacturers.  This is according to the General Accounting Office.  When will you stop lying to the American public?,15727974,HarleyDF,,15,508,,True,False,4905,,,0,0,0.15833333333333333,0.012500000000000004,positive
2021-03-15 00:09:47,1371252247611510789,"ChrisEl23170486: Covid vaccine 
Please rt for bigger poll",1318571382658170883,jotto58860511,,72,13482,,False,False,478,,,1183,0,0.5,0.0,neutral
2021-03-15 00:09:47,1371252247355621385,"Thread by PeterHotez: It’s why we might eventually move to a 3 dose Pfizer Moderna mRNA vaccine and a 2 dose JnJ vaccine: 1) higher virus neutralizing antibodies, 2) greater durability, 3) cross protections vs VOC...… ",17124028,ftapia,Caracas,6807,509,,False,False,76955,,,0,0,0.3333333333333333,0.25,positive
2021-03-15 00:09:46,1371252243639365637,Reuters: AstraZeneca finds no evidence of increased blood clot risk from vaccine  ,1034020435,fadli_tamam,Indonesia,1201,174499,,True,False,119929,,,124,0,0.0,0.0,neutral
2021-03-15 00:09:45,1371252242238570496,"B52Malmet: The Biden administration plans to deploy troops to maximize vaccination efforts and administer shots, and more health care p…",247791531,tenajd,United States,3451,86150,,True,False,364564,,,39,0,0.5,0.5,positive
2021-03-15 00:09:45,1371252241097719812,"_IllumiNatives: Tribes are having the most successful coronavirus vaccination campaigns, breaking stereotypes about tribal govts. As so…",76120670,AAmitey,"Dothan, AL",420,2675,,True,False,19677,,,44,0,0.725,0.625,positive
2021-03-15 00:09:45,1371252239453581312,"aubrey_huff: Take the Covid_19 vaccine it’s “safe” they said: 1,524 deaths, &amp; and 5,507 serious injuries. ",1072207543730982913,ApprtionMission,"South Dakota, USA",390,7470,,False,False,31387,,,312,0,0.5833333333333333,0.08333333333333334,positive
2021-03-15 00:09:43,1371252232931442692,Brindlepooch: America's wealthiest are finding ways to access the vaccine ahead of those who qualify for it. cc .⁦WhiteHouse⁩ ⁦MSNBC⁩…,1238958790885535744,HatesGerry,"Denver, CO",458,65772,,False,False,50927,,,76,0,0.0,0.0,neutral
2021-03-15 00:09:43,1371252230653841410,"BNODesk: BREAKING: Netherlands suspends the use of AstraZeneca's COVID-19 vaccine, citing ""precautionary principle""",123330890,shinkoro_bot,,226,60548,,False,False,59323,,,240,0,0.0,0.0,neutral
2021-03-15 00:09:42,1371252227260698626,"rupert_pearse: The total combined population of Norway, Denmark, Iceland and Ireland is 16 million people. Around 1.47 million of them…",20343805,pengraiggoch,Wales,2224,142947,,False,False,33419,,,6,0,0.75,0.0,neutral
2021-03-15 00:09:41,1371252225398476807,"Coronavirusgoo1: The UK has given over 10 million doses of both the Oxford and Pfizer vaccine. 

Number of blood clot related events:…",1265921600525926402,dantainian,,106,6152,,False,False,4518,,,4580,0,0.4,0.0,neutral
2021-03-15 00:09:40,1371252217886478338,"Jessicam6946: Everyone getting their vaccines.  Please, remember it takes 2 weeks to build full immunity after your 2nd dose of Pfizer…",881962756324425728,cantchgusername,,410,62417,,False,False,12079,,,335,0,0.275,0.175,positive
2021-03-15 00:09:39,1371252217215397888,"OlavJensenNOR Goatfishbat BNODesk It says 30 of the reported blood clots were after taking the Pfizer/BioNTech vaccine and 1 reported after AstraZeneca (but leading to a death)... Granted, less than a quarter of distributed vaccines are AZ while 2/3 are Pfizer. If anything, Pfizer should be investigated as well",1078668922482814976,dimaOP_cr,,44,20967,,False,False,358,,,0,0,0.06666666666666667,-0.16666666666666666,negative
2021-03-15 00:09:39,1371252216917557251,"DrTomFrieden: The chance that you’ll get a long-term health problem from a vaccine against Covid may well be zero, but even if not, are…",495142830,EricHasAThought,"Chicago, IL",105,23747,,False,False,3676,,,301,0,0.0,0.0,neutral
2021-03-15 00:09:38,1371252213180403713,ChinaDaily: Former Brazilian President Luiz Inacio Lula da Silva received on Saturday his first dose of the COVID-19 vaccine. Covid_1…,941683706036719617,capitalparanae1,,198,10452,,False,False,30346,,,8,0,0.16666666666666666,0.125,positive
2021-03-15 00:09:38,1371252212383379458,BBCWorld: Covid-19: Ireland's vaccine body proposes AstraZeneca suspension ,4666236038,bravotvwatchero,Australia,61,2012,,False,False,6197,,,672,0,0.0,0.0,neutral
2021-03-15 00:09:37,1371252205643309058,Frustrated Fauci urges Trump to tell Republicans to get vaccinated ,1338647906014916610,rumrot2,Gettysburg,15,703,,True,False,8136,,,0,0,0.2,-0.7,negative
2021-03-15 00:09:34,1371252196604440576,5gatos ianhanomansing checkupcbc 1st shot Astra Zeneca,4057326761,RobinADupuis,"Calgary, Alberta",18510,56626,,False,False,62182,,,0,0,0.0,0.0,neutral
2021-03-15 00:09:34,1371252194771542016,gcraige: Wow.  What a liar!!!! Pushing a vaccine that even he admits doesn’t stop covid.  Smh ,455412749,kjweers,"Renton, WA",170,31082,,True,False,16251,,,17,0,1.0,0.244140625,positive
2021-03-15 00:09:33,1371252192514961410,Lauren_Southern: Genuinely want someone to explain to me why Marvin Haglers death shouldn’t make people concerned about the COVID vacci…,1347400798607536128,ironwillrecon,,247,17934,,False,False,9772,,,102,0,0.5,0.4,positive
2021-03-15 00:09:33,1371252189444911113,VFreedoms: Let me get this straight they want you to have a vaccine passport to say you had a jab that doesn’t stop you getting covid o…,133760029,mallyjoeberry,"Leeds, England",1608,74124,,False,False,24654,,,30,0,0.4,0.2,positive
2021-03-15 00:09:32,1371252188232642562,IshatReza: This is concerning evidence from a study by Imperial College in the UK. Does it make sense to delay the second dose by as mu…,1322644460824530944,LiseCandlestick,,78,4688,,False,False,2105,,,37,0,0.0,0.0,neutral
2021-03-15 00:09:32,1371252186018025477,"DrTomFrieden: The chance that you’ll get a long-term health problem from a vaccine against Covid may well be zero, but even if not, are…",1041578414459695105,JainNahush,,100,7754,,False,False,7193,,,301,0,0.0,0.0,neutral
2021-03-15 00:09:31,1371252183404929027,"DrTomFrieden: The chance that you’ll get a long-term health problem from a vaccine against Covid may well be zero, but even if not, are…",560903736,DickAltavista,"Victoria, British Columbia",1392,9190,,True,False,31385,,,301,0,0.0,0.0,neutral
2021-03-15 00:09:31,1371252181152759810,newsmax: Ric Grenell: Biden's only 'reordering' vaccines - the heavy lifting was done by Trump  ,18693896,quinn54,,155,3575,,True,False,38986,,,1707,0,0.75,-0.1,negative
2021-03-15 00:09:30,1371252178644525058,"Coronavirusgoo1: The UK has given over 10 million doses of both the Oxford and Pfizer vaccine. 

Number of blood clot related events:…",305197223,ClaireHanlon1,Cork,286,1585,,True,False,1217,,,4580,0,0.4,0.0,neutral
2021-03-15 00:09:30,1371252177856036868,"SouthPark: Mellitaleen The ""South ParQ Vaccination Special"" premieres TONIGHT at 8/7c on Comedy Central.
The citizens of SouthParQ ar…",724690214199922689,Mellitaleen,,92,21077,,False,False,3250,,,1,0,0.4107142857142857,0.17857142857142858,positive
2021-03-15 00:09:30,1371252177621061632,MarkSharon_DP: AZ is heading south ,4666236038,bravotvwatchero,Australia,61,2012,,False,False,6197,,,9,0,0.0,0.0,neutral
2021-03-15 00:09:30,1371252176375353351,schuetze_k: PNG has the most cases of Covid-19 per capita of the the whole Pacific region (with gross under testing) and yet they have…,41706471,kelvinfiji,Views are my own. ,2448,8557,,True,False,10202,,,12,0,0.3,0.2333333333333333,positive
2021-03-15 00:09:28,1371252171174469633,Midnightrider98: Ireland’s chief medical officer recommended the suspension of the AstraZeneca Vaccine. Canada ... full steam ahead. Re…,411489760,istoneca,"Ontario, Can Negril, Jamaica",1638,49798,,True,False,30198,,,64,0,0.275,0.175,positive
2021-03-15 00:09:27,1371252167374426112,spectatorindex: JUST IN: The Netherlands suspends the administration of the AstraZeneca coronavirus vaccine as a 'precaution',189931443,martinhalty,"Posadas, Misiones, Argentina",1397,216008,,True,False,103135,,,612,0,0.0,0.0,neutral
2021-03-15 00:09:27,1371252167064096773,"PalBint: When is AstraZeneca going to donate Covid vaccine supplies to 5+ million Palestinians living under permanent, Israeli militar…",69856537,caroldunk, Canada,726,356,,False,False,41400,,,44,0,0.0,0.0,neutral
2021-03-15 00:09:26,1371252162185990146,"toles_jenna CalPoly In actuality, the name COVID-19 stands for Certificate of Vaccination I.D.  The virus hoax is just a way to get people to take the vaccine, which is experimental, and does not fit the definition of a vaccine. Do some searches outside of mainstream media to learn more.",1310272653224157184,JulieSm36982015,,43,2704,,False,False,8366,,,0,0,0.3375,0.1,positive
2021-03-15 00:09:26,1371252161556922374,I got a job offer and my first (pfizer) covid vaccine all in the same week 🥰 I hope things continue this way,2274155641,avocatey,,472,70214,,True,False,10732,,,0,15,0.22916666666666666,0.125,positive
2021-03-15 00:09:26,1371252161175228418,"GovAndyBeshear: As of tomorrow, the Kentucky COVID-19 vaccination eligibility phase is 1C. Learn more by visiting ",1360395985638326272,BethMill8,"Bowling Green, KY",25,12,,True,False,738,,,35,0,0.5,0.5,positive
2021-03-15 00:09:25,1371252158994190338,MtMama1776: If the covid virus has a 1% death rate why would anyone take the covid vaccine that has a 5% death rate.,827944764062445570,WilheminaFoxx,,12691,111048,,False,False,134271,,,0,0,0.0,0.0,neutral
2021-03-15 00:09:24,1371252154632126465,Growing Number Of Nations_Suspend AstraZeneca Covid Vaccine Amid Blood Clot Concerns ,257088949,mycomfor,deutscher Sprachraum,458,59,,True,False,223714,,,1,0,0.0,0.0,neutral
2021-03-15 00:09:24,1371252153227022337,"welosthim: CovidVaccine CovidVaccineSideEffects 

In the UK from the 3rd Feb till 9th March there have been 201,622 adverse reactions…",2800466323,porridgeisgood,,5475,683859,,False,False,838613,,,2,0,0.0,0.0,neutral
2021-03-15 00:09:24,1371252152937508864,diana_murphy613: Is JustinTrudeau so desperate to have vaccine numbers that he’ll risk seniors lives with astra Zeneca vaccine.  Irela…,787774368566816768,simonchase123,"Calgary, Alberta",2029,84214,,False,False,17418,,,148,0,1.0,-0.6,negative
2021-03-15 00:09:24,1371252151909937152,annezinkmd: For anyone in South Central Alaska there are over 500 Moderna vaccine appointments available at the State Fair Grounds on T…,190158227,AKGoddess,"Palmer,  AK",221,6089,,True,False,4443,,,31,0,0.5166666666666667,0.3666666666666667,positive
2021-03-15 00:09:24,1371252151188619271,akikigate I get my 2nd shot of Moderna on April 3rd.,2241060300,filo22222,,155,49026,,False,False,8075,,,0,1,0.0,0.0,neutral
2021-03-15 00:09:21,1371252140459495427,MsTerryMcMillan: Being inconvenienced and uncomfortable a day or two  after getting the second dose of the Covid-19 vaccine doesn't las…,709369282170191872,TinaGarnet2016,California,943,20699,,True,False,20440,,,17,0,0.5,-0.25,negative
2021-03-15 00:09:21,1371252139989811200,"NanaWearsAMask: Now this: 
“Covid vaccinations tracking poll found the number of Republicans refusing to get the vaccine was twice the…",1080666845282213890,Brindlepooch,,7919,139813,,True,False,98920,,,48,0,0.0,0.0,neutral
2021-03-15 00:09:21,1371252138639302658,rishipuff: johnson and johnson made my baby shampoo and now my covid vaccine damn they really did say no more tears,180067015,larry_mikowski,"Michigan, USA",357,4741,,True,False,1764,,,8299,0,0.35,-0.024999999999999994,negative
